index,url,valid,domain,title,description,image,published,archive,content,quote,language,keyword
https://burgenland.orf.at/stories/3242989/,https://burgenland.orf.at/stories/3242989/,0,burgenland.orf.at,Energieunabhängigkeit: Land setzt auf Speicher,"Im Burgenland ist Windkraft als auch zunehmend Photovoltaik vorhanden. Weil Sonnenstrom vor allem zu Mittag reichlich vorhanden ist, und der Wind eher in der Nacht bläst, ergibt sich eine günstige Kombination. Doch in der Früh und am Abend reicht auch das nic…",https://ibs.orf.at/bgl?image=https%3A%2F%2Foekastatic.orf.at%2Fmims%2F2024%2F05%2F74%2Fcrops%2Fw%3D1200%2Ch%3D627%2Cq%3D75%2F2091835_master_790174_240131_bh_speicherstrategie_00_00_28_17.jpg%3Fs%3D38dfb7cab3c02ffa195e983c3c52b4aa468a1327,2024-02-01T04:01:00Z,,200 Millionen Euro will die Burgenland Energie bis zum Jahr 2030 in Groß-Stromspeicher investieren. Schon heuer ist die Installation solcher Anlagen in Nickelsdorf (Bezirk Neusiedl am See) und Güssin… [+1687 chars],,de,'Windkraft'
https://www.welt.de/wirtschaft/plus249845678/EEG-Umlage-17-statt-7-8-Milliarden-Euro-Wird-Oekostrom-noch-teurer-fuer-den-Steuerzahler.html,https://www.welt.de/wirtschaft/plus249845678/EEG-Umlage-17-statt-7-8-Milliarden-Euro-Wird-Oekostrom-noch-teurer-fuer-den-Steuerzahler.html,0,www.welt.de,"17 statt 7,8 Milliarden Euro – Wird Ökostrom noch teurer für den Steuerzahler?","Die Strompreise sinken, doch das hat auch negative Folgen: Die EEG-Kosten für Solar- und Windstrom steigen deutlich an. Die Netzbetreiber haben bereits vor einem Milliardenloch gewarnt. Doch die FDP hält deutlich höhere Summen für möglich – die der Steuerzahl…",https://img.welt.de/img/wirtschaft/mobile249846104/0341359497-ci16x9-w1200-fnov-fpotl-fpi157750653/Solar-energy-field-and-wind-turbines-during-a-summer-sunrise.jpg,2024-02-01T04:03:10Z,https://web.archive.org/web/20240202132212/https://www.welt.de/wirtschaft/plus249845678/EEG-Umlage-17-statt-7-8-Milliarden-Euro-Wird-Oekostrom-noch-teurer-fuer-den-Steuerzahler.html,"Die WELT als ePaper: Die vollständige Ausgabe steht Ihnen bereits am Vorabend zur Verfügung so sind Sie immer hochaktuell informiert. Weitere Informationen: http://epaper.welt.de 
 Der Kurz-Link die… [+49 chars]",,de,'Solar'
https://www.zeit.de/news/2024-02/01/netanjahu-geisel-deal-nicht-um-jeden-preis,https://www.zeit.de/news/2024-02/01/netanjahu-geisel-deal-nicht-um-jeden-preis,0,www.zeit.de,Gaza-Krieg: Netanjahu: Geisel-Deal «nicht um jeden Preis»,"Hier finden Sie Informationen zu dem Thema „Gaza-Krieg“. Lesen Sie jetzt „Netanjahu: Geisel-Deal ""nicht um jeden Preis""“.",https://img.zeit.de/news/2024-02/01/netanjahu-geisel-deal-nicht-um-jeden-preis-image-group/wide__1300x731,2024-02-01T04:24:27Z,,Israels Ministerpräsident Benjamin Netanjahu will einem möglichen neuen Abkommen über eine Feuerpause im Gaza-Krieg und der Freilassung weiterer Geiseln nach eigenen Aussagen «nicht um jeden Preis» z… [+7343 chars],,de,'Kämpfe'
https://orf.at/stories/3347375/,https://orf.at/stories/3347375/,0,orf.at,Heimischer Verbrauch von Strom und Gas deutlich gesunken,,https://orf.at/mojo/1_4_1/storyserver//news/common/images/og-fallback-news.png,2024-02-01T05:24:52Z,,Der Verbrauch von Strom und Gas ist im vergangenen Jahr dem zweiten Jahr des Ukraine-Kriegs und unsicherer russischer Gaslieferungen gegenüber 2022 stark gesunken. Die Stromerzeugung ist im Gesamtjah… [+1825 chars],,de,'Windkraft'
https://www.focus.de/politik/ausland/krieg-im-nahen-osten-fregatte-hessen-soll-handelsschiffe-vor-huthis-schuetzen_id_220048976.html,https://www.focus.de/politik/ausland/krieg-im-nahen-osten-fregatte-hessen-soll-handelsschiffe-vor-huthis-schuetzen_id_220048976.html,0,www.focus.de,"Krieg im Nahen Osten - Bundeswehr-Fregatte „Hessen“ sticht bald in See, um Schiffe vor Huthis zu schützen","Südafrika wirft Israel vor, das Urteil des Internationalen Gerichtshofs im Hinblick auf Gaza zu ignorieren. Die Fregatte „Hessen“ sticht bald in See. Sie soll Handelsschiffe vor den Huthis schützen. Alle Entwicklungen hier im Newsticker.",https://p6.focus.de/img/regional/niedersachsen/id_259629170/die-fregatte-hessen-kehrt-in-den-heimathafen-zurueck..jpg?im=Crop%3D%280%2C132%2C2048%2C1024%29%3BResize%3D%281200%2C627%29&impolicy=perceptual&quality=mediumHigh&hash=ac81c4f823b5c7b3a9bea26cf190a0d6ac554f1f1f2b03674f897b29e5398a4b,2024-02-01T08:16:59Z,,"Südafrika wirft Israel vor, das Urteil des Internationalen Gerichtshofs im Hinblick auf Gaza zu ignorieren. Die Fregatte Hessen sticht bald in See. Sie soll Handelsschiffe vor den Huthis schützen. Al… [+11126 chars]",,de,'Krieg'
https://taz.de/-Nachrichten-im-Nachost-Krieg-/!5989677/,https://taz.de/-Nachrichten-im-Nachost-Krieg-/!5989677/,0,taz.de,+++ Nachrichten im Nachost-Krieg +++: Anschlag auf Botschaft vereitelt,Über den Zaun der israelischen Botschaft in Schweden wird eine Handgranate geworfen. Die USA schießen Drohnen im Jemen und aus Iran ab.,https://taz.de/picture/6800505/948/34555563-1.jpeg,2024-02-01T08:23:00Z,,"Über den Zaun der israelischen Botschaft in Schweden wird eine Handgranate geworfen. Die USA schießen Drohnen im Jemen und aus Iran ab.
Polizisten stehen Wache vor der israelischen Botschaft in Stoc… [+5901 chars]",,de,'Krieg'
https://www.focus.de/politik/ausland/ukraine-krieg-im-ticker-ukrainischer-geheimdienstchef-kuendigt-verstaerkte-angriffe-auf-ziele-in-russland-an_id_57275780.html,https://www.focus.de/politik/ausland/ukraine-krieg-im-ticker-ukrainischer-geheimdienstchef-kuendigt-verstaerkte-angriffe-auf-ziele-in-russland-an_id_57275780.html,0,www.focus.de,Ukraine-Krieg - Stimmen und Entwicklungen - UN-Gericht weist Klage von Ukraine gegen Russland weitgehend ab,Der Internationale Gerichtshof weist eine Klage der Ukraine gegen Russland aus dem Jahr 2017 weitgehend ab. Die EU räumt ein Scheitern des Munitionsplans für die Ukraine ein. Alle News zum Krieg gegen die Ukraine im Ticker.,https://p6.focus.de/img/fotos/id_259617712/ukraine-front-haubitze-munition-getty.jpg?im=Crop%3D%280%2C188%2C3463%2C1732%29%3BResize%3D%281200%2C627%29&impolicy=perceptual&quality=mediumHigh&hash=5af2618896735b398e722de2458b933ea688325127173d69bc418cfcb104b42b,2024-02-01T08:44:40Z,,Der Internationale Gerichtshof weist eine Klage der Ukraine gegen Russland aus dem Jahr 2017 weitgehend ab. Die EU räumt ein Scheitern des Munitionsplans für die Ukraine ein. Alle News zum Krieg gege… [+9872 chars],,de,'Krieg'
https://www.zeit.de/wirtschaft/2024-01/klimaschutzgesetz-fossile-brennstoffe-klimaziele-ampelkoalition,https://www.zeit.de/wirtschaft/2024-01/klimaschutzgesetz-fossile-brennstoffe-klimaziele-ampelkoalition,0,www.zeit.de,Klimaschutzgesetz: Klimakanzler Olaf Scholz – war da was?,"Die Regierung will das Klimaschutzgesetz verwässern. Dabei braucht es jetzt schnell den Ausstieg aus den Fossilen, fordert unser Gastautor. Diskutieren Sie jetzt mit ihm.",https://img.zeit.de/wirtschaft/2024-01/klimaschutzgesetz-fossile-brennstoffe/wide__1300x731,2024-02-01T09:16:47Z,,"Felix
Ekardt forscht als Leiter der Leipziger
Forschungsstelle Nachhaltigkeit und Klimapolitik sowie Professor an der Uni Rostock
nach Politikkonzepten für mehr Nachhaltigkeit. Er sucht anlässlich… [+8449 chars]",,de,'Krieg'
https://www.zeit.de/news/2024-02/01/geschaeft-mit-menschen-gaza-ausreise-fuer-10-000-dollar,https://www.zeit.de/news/2024-02/01/geschaeft-mit-menschen-gaza-ausreise-fuer-10-000-dollar,0,www.zeit.de,Krieg in Nahost: Geschäft mit Menschen: Gaza-Ausreise für 10.000 Dollar,Hier finden Sie Informationen zu dem Thema „Krieg in Nahost“. Lesen Sie jetzt „Geschäft mit Menschen: Gaza-Ausreise für 10.000 Dollar“.,https://img.zeit.de/news/2024-02/01/geschaeft-mit-menschen-gaza-ausreise-fuer-10-000-dollar-image-group/wide__1300x731,2024-02-01T09:18:21Z,,"Nachdem er und seine Familie im Krieg sechsmal innerhalb Gazas durch Kämpfe vertrieben wurde, war die Sache für Mohammed entschieden. «Ich konnte es nicht ausstehen, in einem Zelt zu leben», erzählt … [+7285 chars]",,de,'Krieg'
https://www.focus.de/politik/ausland/griechenland-als-schluessel-biden-trotzt-waffenlieferungs-blockade_id_259629125.html,https://www.focus.de/politik/ausland/griechenland-als-schluessel-biden-trotzt-waffenlieferungs-blockade_id_259629125.html,0,www.focus.de,Griechenland als Schlüssel - Biden will Ukraine-Blockade der Republikaner mit einem Trick umgehen,"US-Präsident Joe Biden scheint einen Weg gefunden zu haben, um trotz des Widerstands der Republikaner, Waffen an die Ukraine zu liefern. Der Schlüssel dazu könnte Griechenland sein.",https://p6.focus.de/img/fotos/id_259629087/selenskyj-biden.jpg?im=Crop%3D%280%2C173%2C3463%2C1732%29%3BResize%3D%281200%2C627%29&impolicy=perceptual&quality=mediumHigh&hash=3ff9eebfb3aefa13b76a1bcb300225821c9c237a819a4132bcc39adf726ee6ee,2024-02-01T10:04:03Z,,"US-Präsident Joe Biden scheint einen Weg gefunden zu haben, um trotz des Widerstands der Republikaner, Waffen an die Ukraine zu liefern. Der Schlüssel dazu könnte Griechenland sein. Obwohl die Republ… [+2387 chars]",,de,'Ukraine'
https://www.sueddeutsche.de/politik/israel-krieg-news-liveticker-gaza-sprengungen-1.6342083,https://www.sueddeutsche.de/politik/israel-krieg-news-liveticker-gaza-sprengungen-1.6342083,0,www.sueddeutsche.de,Krieg in Nahost: Israel soll Hunderte Gebäude im Gazastreifen zerstört haben,"Die ""New York Times"" verweist auf Material, das gezielte Sprengungen des israelischen Militärs belegen soll. Ministerpräsident Netanjahu will ein neues Geiselabkommen nicht ""um jeden Preis"".",https://www.sueddeutsche.de/image/sz.1.6342176/1200x675?v=1706781911,2024-02-01T10:05:10Z,,"Viele von euch hassen uns, einige von euch aber haben uns sogar lieb: Ihr seid rechts, links, doof, klug, divers, tragt Irokese, Burka oder Minirock. Eine Klarstellung für dunkle Tage in Deutschland.",,de,'Krieg'
https://www.bild.de/politik/ausland/politik/kritik-an-mariupol-beitrag-verbreitet-das-zdf-russen-propaganda-86972424.bild.html,https://www.bild.de/politik/ausland/politik/kritik-an-mariupol-beitrag-verbreitet-das-zdf-russen-propaganda-86972424.bild.html,0,www.bild.de,Kritik an Mariupol-Beitrag - Verbreitet das ZDF Russen-Propaganda?,"Das ZDF verbreitet aus dem von Russland besetzten Mariupol das russische Narrativ, dass in der Ukraine Theaterstücke auf Russisch verboten wären. Experten üben Kritik.","https://images.bild.de/65b9322faffd3e1dc5fa9e8f/7f26be30fe98303caf98f5f37be39186,5bcf7433?w=1280",2024-02-01T10:21:50Z,,"Schwere Vorwürfe gegen das ZDF!
Der öffentlich-rechtliche Sender steht wegen eines Beitrags aus der von Russland zerstörten und besetzten ukrainischen Stadt Mariupol in der Kritik.
Die Vorwürfe von… [+3506 chars]",,de,'Ukraine'
https://www.nzz.ch/international/eu-gipfel-einigt-sich-auf-50-milliarden-hilfspaket-fuer-die-ukraine-ld.1776929,https://www.nzz.ch/international/eu-gipfel-einigt-sich-auf-50-milliarden-hilfspaket-fuer-die-ukraine-ld.1776929,0,www.nzz.ch,Orban lenkt ein: Die EU einigt sich auf neue Ukraine-Hilfen,Der ungarische Ministerpräsident Viktor Orban hat seine Blockade eines 50-Milliarden-Euro-Pakets für die Ukraine aufgegeben. Vermutlich spielten dabei massive Sanktionsandrohungen innerhalb der EU eine Rolle.,"https://img.nzz.ch/2024/02/01/0deca3fd-1af6-44f6-acdf-91be6b2e25af.jpeg?width=1200&height=674&fit=bound&quality=75&auto=webp&crop=5000,2809,x0,y261&wmark=nzz",2024-02-01T10:40:56Z,,"Der slowakische Premierminister Robert Fico, rechts, spricht mit dem ungarischen Premierminister Viktor Orban am EU-Gipfel in Brüssel.
Die Mitgliedstaaten der EU haben sich am Donnerstag überraschen… [+4640 chars]",,de,'Krieg'
https://www.nzz.ch/international/ungarn-lenkt-ein-eu-gipfel-einigt-sich-auf-ukraine-hilfen-ueber-50-milliarden-euro-ld.1776929,https://www.nzz.ch/international/ungarn-lenkt-ein-eu-gipfel-einigt-sich-auf-ukraine-hilfen-ueber-50-milliarden-euro-ld.1776929,0,www.nzz.ch,Ungarn lenkt ein: EU-Gipfel einigt sich auf Ukraine-Hilfen über 50 Milliarden Euro,Der ungarische Regierungschef Viktor Orban hat seine Blockade nach Angaben von EU-Ratspräsident Charles Michel aufgegeben.,"https://img.nzz.ch/2024/02/01/0deca3fd-1af6-44f6-acdf-91be6b2e25af.jpeg?width=1200&height=674&fit=bound&quality=75&auto=webp&crop=5000,2809,x0,y261&wmark=nzz",2024-02-01T10:40:56Z,,"Der slowakische Premierminister Robert Fico, rechts, spricht mit dem ungarischen Premierminister Viktor Orban auf dem EU-Gipfel in Brüssel.
(Reuters) Die 27 EU-Mitglieder haben sich auf ein zusätzli… [+1085 chars]",,de,'Krieg'
https://www.stern.de/news/ungarn-lenkt-ein--alle-eu-laender-billigen-ukraine-hilfen-von-50-milliarden-euro-34419584.html,https://www.stern.de/news/ungarn-lenkt-ein--alle-eu-laender-billigen-ukraine-hilfen-von-50-milliarden-euro-34419584.html,0,www.stern.de,Ungarn lenkt ein: Alle EU-Länder billigen Ukraine-Hilfen von 50 Milliarden Euro,"Ungarn hat eingelenkt: Beim EU-Sondergipfel in Brüssel haben sich alle 27 Mitgliedsländer auf Wirtschaftshilfen für die Ukraine im Umfang von 50 Milliarden Euro geeinigt, wie Ratspräsident Charles Michel am Donnerstag im Onlinedienst X mitteilte. Dies bedeute…",https://image.stern.de/34419586/t/1S/v1/w1440/r1.7778/-/01--kanzler-scholz-bei-der-begruessung-von-ungarns-regierungschef-orban-in-bruessel---f379e5eaced3f76f.jpg,2024-02-01T11:20:35Z,,"Ungarn hat eingelenkt: Beim EU-Sondergipfel in Brüssel haben sich alle 27 Mitgliedsländer auf Wirtschaftshilfen für die Ukraine im Umfang von 50 Milliarden Euro geeinigt, wie Ratspräsident Charles Mi… [+1213 chars]",,de,'Krieg'
https://www.focus.de/politik/ausland/ukraine-krise/saluschnyj-der-kult-general-der-gern-rammstein-hoert-wie-saluschny-mit-selenskyj-brach_id_259628196.html,https://www.focus.de/politik/ausland/ukraine-krise/saluschnyj-der-kult-general-der-gern-rammstein-hoert-wie-saluschny-mit-selenskyj-brach_id_259628196.html,0,www.focus.de,Saluschnyj - General mit Kultstatus - und Selenskyjs Rivale?,"Berichte über die Absetzung des beliebten Oberbefehlshabers der Streitkräfte, Walerij Saluschnyj, haben die Ukraine erschüttert. Offenbar haben die Differenzen zwischen ihm und dem Präsidenten einen Höhepunkt erreicht.",https://p6.focus.de/img/politik/ausland/id_259628195/walerij-saluschnyj-kurz-vor-der-russischen-invasion-der-ukraine-im-februar-2022.jpg?im=Crop%3D%280%2C29%2C940%2C470%29%3BResize%3D%281200%2C627%29&impolicy=perceptual&quality=mediumHigh&hash=74e70b72ccc82f24269cc0e89a29f44d016c61427c03608f3f9d2345968272fa,2024-02-01T11:24:00Z,,"Berichte über die Absetzung des beliebten Oberbefehlshabers der Streitkräfte, Walerij Saluschnyj, haben die Ukraine erschüttert. Offenbar haben die Differenzen zwischen ihm und dem Präsidenten einen … [+7724 chars]",,de,'Ukraine'
https://www.focus.de/panorama/welt/rockband-in-abschiebegefaengnis-festgehalten-russlands-langer-arm-reicht-bis-nach-thailand_id_259629374.html,https://www.focus.de/panorama/welt/rockband-in-abschiebegefaengnis-festgehalten-russlands-langer-arm-reicht-bis-nach-thailand_id_259629374.html,0,www.focus.de,Nach einer Woche Angst vor Putin - Russische Band darf nach Israel,"Mitglieder der regierungskritischen russischen Rockband Bi-2 waren eine Woche in einem thailändischen Gefängnis inhaftiert, es bestand die Sorge, dass sie nach Russland abgeschoben werden könnten.",https://p6.focus.de/img/fotos/id_259629376/bi-2.jpg?im=Crop%3D%280%2C289%2C3463%2C1731%29%3BResize%3D%281200%2C627%29&impolicy=perceptual&quality=mediumHigh&hash=a68ba8fbdf301aa9aba9acec0a259312e666a4422e4092fbc9b6b0f42b315001,2024-02-01T11:28:50Z,,"Mitglieder der regierungskritischen russischen Rockband Bi-2 waren eine Woche in einem thailändischen Gefängnis inhaftiert, es bestand die Sorge, dass sie nach Russland abgeschoben werden könnten.Die… [+1870 chars]",,de,'Putin'
https://www.telepolis.de/features/Bidens-blinde-Eskalation-Warum-US-Truppen-aus-Irak-und-Syrien-abziehen-muessen-9615483.html,https://www.telepolis.de/features/Bidens-blinde-Eskalation-Warum-US-Truppen-aus-Irak-und-Syrien-abziehen-muessen-9615483.html,0,www.telepolis.de,Bidens blinde Eskalation: Warum US-Truppen aus Irak und Syrien abziehen müssen,"Wie immer die Antwort der USA auf tote GIs aussieht, sie wird die Lage verschlimmern. Warum ein endloser Krieg droht. Und was dringend getan werden muss. Kommentar.",https://heise.cloudimg.io/bound/1200x1200/q85.png-lossy-85.webp-lossy-85.foil1/_www-heise-de_/imgs/18/4/5/3/5/5/1/0/U-5c40d6756e2f2e7e.jpeg,2024-02-01T11:30:00Z,,"Soldaten der US-Armee bei einer Übung in Dschibuti am 2. Februar 2021. Bild: US Africa Command / CC BY 2.0 Deed
Wie immer die Antwort der USA auf tote GIs aussieht, sie wird die Lage verschlimmern. … [+2696 chars]",,de,'Krieg'
https://www.focus.de/politik/ausland/nordkorea/kim-jong-un-macht-denkmal-platt-die-gefaehrliche-180-grad-wende-des-diktators_id_259629726.html,https://www.focus.de/politik/ausland/nordkorea/kim-jong-un-macht-denkmal-platt-die-gefaehrliche-180-grad-wende-des-diktators_id_259629726.html,0,www.focus.de,Gastbeitrag aus Korea - Kim Jong un macht Denkmal platt - die gefährliche 180-Grad-Wende des Diktators,Der nordkoreanische Machthaber Kim Jong Un hat eine historische Wende vollzogen. Süd- und Nordkorea sind für ihn keine gemeinsame Nation mehr. Die staatliche Propaganda hat komplett umgeschwenkt. Die Spannungen auf der Halbinsel nehmen damit zu.Von FOCUS-onli…,https://p6.focus.de/img/politik/ausland/id_259579365/die-situation-auf-der-koreanischen-halbinsel-ist-so-angespannt-wie-seit-jahren-nicht-mehr.-fuer-machthaber-kim-jong-un-ist-eine-vereinigung-mit-dem-suedlichen-nachbarn-nicht-mehr-moeglich..jpg?im=Crop%3D%280%2C169%2C2048%2C1024%29%3BResize%3D%281200%2C627%29&impolicy=perceptual&quality=mediumHigh&hash=f2430be33ede0bed60a0c6c83e315813e9f1e033b3450fb696015ada37a83248,2024-02-01T11:43:59Z,,Der nordkoreanische Machthaber Kim Jong Un hat eine historische Wende vollzogen. Süd- und Nordkorea sind für ihn keine gemeinsame Nation mehr. Die staatliche Propaganda hat komplett umgeschwenkt. Die… [+4739 chars],,de,'Gas'
https://www.zeit.de/politik/ausland/2024-02/eu-gipfel-ukraine-milliardenhilfe-viktor-orban,https://www.zeit.de/politik/ausland/2024-02/eu-gipfel-ukraine-milliardenhilfe-viktor-orban,0,www.zeit.de,EU-Gipfel zu Ukraine-Hilfen: Orbán hat die Entschlossenheit der EU unterschätzt,Niedergestreckt von 26 EU-Staaten: In der Frage der Ukraine-Hilfen hat die EU den ungarischen Ministerpräsidenten auf Normalmaß geschrumpft. Doch sie muss noch mehr tun.,https://img.zeit.de/politik/ausland/2024-02/eu-gipfel-ukraine-milliardenhilfe/wide__1300x731,2024-02-01T19:30:02Z,,"Viktor Orbán gibt sich gerne als
Kämpfer, den nichts so schnell umwirft. Doch diesmal lag er schon nach
zweieinhalb Stunden am Boden, niedergestreckt von der geballten Macht der 26 Staats- und Regi… [+4494 chars]",,de,'Putin'
https://www.n-tv.de/politik/02-18-Geh-nach-Russland-Massendemos-gegen-Fico-in-der-Slowakei--article23143824.html,https://www.n-tv.de/politik/02-18-Geh-nach-Russland-Massendemos-gegen-Fico-in-der-Slowakei--article23143824.html,0,www.n-tv.de,"Ukraine-Krieg im Liveticker: +++ 02:18 ""Geh' nach Russland"": Massendemos gegen Fico in der Slowakei +++",Lesen Sie alle aktuellen Entwicklungen und Nachrichten über den russischen Angriffskrieg auf die Ukraine im Liveticker von ntv.de.,https://bilder2.n-tv.de/img/incoming/crop23332537/9041326157-cImg_16_9-w1200/Liveticker1-grau-1-Kopie.jpg,2024-02-01T23:30:00Z,,In der Slowakei haben am Abend erneut Tausende gegen die seit Ende Oktober amtierende Regierung des linksnationalen Ministerpräsidenten Robert Fico demonstriert. Wie die Organisatoren dem TV-Nachrich… [+4095 chars],,de,'Krieg'
https://www.n-tv.de/politik/05-14-Job-Turbo-fuer-Ukrainer-geht-nach-hinten-los--article23143824.html,https://www.n-tv.de/politik/05-14-Job-Turbo-fuer-Ukrainer-geht-nach-hinten-los--article23143824.html,0,www.n-tv.de,"Ukraine-Krieg im Liveticker: +++ 05:14 ""Job-Turbo"" für Ukrainer geht nach hinten los +++",Lesen Sie alle aktuellen Entwicklungen und Nachrichten über den russischen Angriffskrieg auf die Ukraine im Liveticker von ntv.de.,https://bilder2.n-tv.de/img/incoming/crop23332537/9041326157-cImg_16_9-w1200/Liveticker1-grau-1-Kopie.jpg,2024-02-01T23:30:00Z,,"Gut drei Monate nach dem Start des ""Job-Turbos"" zur schnelleren Integration von Flüchtlingen in den Arbeitsmarkt kann die Bundesagentur für Arbeit (BA) einem Medienbericht zufolge bei Ukrainern noch … [+6329 chars]",,de,'Krieg'
https://www.n-tv.de/politik/15-10-Kreml-Sprecher-reagiert-auf-Forderungen-aus-Kiew-nach-Leichen-von-Flugzeugabsturz--article23143824.html,https://www.n-tv.de/politik/15-10-Kreml-Sprecher-reagiert-auf-Forderungen-aus-Kiew-nach-Leichen-von-Flugzeugabsturz--article23143824.html,0,www.n-tv.de,Ukraine-Krieg im Liveticker: +++ 15:10 Kreml-Sprecher reagiert auf Forderungen aus Kiew nach Leichen von Flugzeugabsturz +++,Lesen Sie alle aktuellen Entwicklungen und Nachrichten über den russischen Angriffskrieg auf die Ukraine im Liveticker von ntv.de.,https://bilder2.n-tv.de/img/incoming/crop23332537/9041326157-cImg_16_9-w1200/Liveticker1-grau-1-Kopie.jpg,2024-02-01T23:30:00Z,,Gut eine Woche nach dem Absturz einer russischen Transportmaschine vom Typ Iljuschin Il-76 mit angeblich 65 ukrainischen Kriegsgefangenen an Bord gibt es weiter Rätsel um die Leichen. Auf Forderungen… [+18648 chars],,de,'Ukraine'
https://www.n-tv.de/politik/06-18-ISW-Tuerkische-Banken-machen-russische-Konten-dicht--article23143824.html,https://www.n-tv.de/politik/06-18-ISW-Tuerkische-Banken-machen-russische-Konten-dicht--article23143824.html,0,www.n-tv.de,Ukraine-Krieg im Liveticker: +++ 06:18 ISW: Türkische Banken machen russische Konten dicht +++,Lesen Sie alle aktuellen Entwicklungen und Nachrichten über den russischen Angriffskrieg auf die Ukraine im Liveticker von ntv.de.,https://bilder2.n-tv.de/img/incoming/crop23332537/9041326157-cImg_16_9-w1200/Liveticker1-grau-1-Kopie.jpg,2024-02-01T23:30:00Z,,"Einige türkische Banken schließen Konten, die mit russischen Unternehmen in Verbindung stehen, aus Angst, Sekundärsanktionen der USA auszulösen, berichtet das Institute for the Study of War (ISW) unt… [+7767 chars]",,de,'Krieg'
https://www.n-tv.de/politik/12-29-Ukraine-Russland-lehnt-Ubergabe-der-Opfer-von-Flugzeugabsturz-ab--article23143824.html,https://www.n-tv.de/politik/12-29-Ukraine-Russland-lehnt-Ubergabe-der-Opfer-von-Flugzeugabsturz-ab--article23143824.html,0,www.n-tv.de,Ukraine-Krieg im Liveticker: +++ 12:29 Ukraine: Russland lehnt Übergabe der Opfer von Flugzeugabsturz ab +++,Lesen Sie alle aktuellen Entwicklungen und Nachrichten über den russischen Angriffskrieg auf die Ukraine im Liveticker von ntv.de.,https://bilder2.n-tv.de/img/incoming/crop23332537/9041326157-cImg_16_9-w1200/Liveticker1-grau-1-Kopie.jpg,2024-02-01T23:30:00Z,,"Russland verweigert nach ukrainischen Angaben eine Herausgabe der Leichen der Kriegsgefangenen, die nach Darstellung aus Moskau beim jüngsten Abschuss eines russischen Militärtransportflugzeugs durch… [+14290 chars]",,de,'Krieg'
https://www.n-tv.de/politik/08-36-USA-machen-Druck-auf-Ungarn-NATO-Blockade-riskiert-Beziehungen--article23143824.html,https://www.n-tv.de/politik/08-36-USA-machen-Druck-auf-Ungarn-NATO-Blockade-riskiert-Beziehungen--article23143824.html,0,www.n-tv.de,Ukraine-Krieg im Liveticker: +++ 08:36 USA machen Druck auf Ungarn: NATO-Blockade riskiert Beziehungen +++,Lesen Sie alle aktuellen Entwicklungen und Nachrichten über den russischen Angriffskrieg auf die Ukraine im Liveticker von ntv.de.,https://bilder2.n-tv.de/img/incoming/crop23332537/9041326157-cImg_16_9-w1200/Liveticker1-grau-1-Kopie.jpg,2024-02-01T23:30:00Z,,"Hochrangige US-Gesetzgeber fordern Ungarn auf, dem NATO-Beitritt Schwedens unverzüglich zuzustimmen, und weisen, eine Woche nach der Zustimmung der Türkei, darauf hin, dass Budapest dauerhafte Schäde… [+10229 chars]",,de,'Krieg'
https://www.n-tv.de/politik/06-59-Putin-Besetzte-Gebiete-muessen-gesamtrussisches-Niveau-erreichen--article23143824.html,https://www.n-tv.de/politik/06-59-Putin-Besetzte-Gebiete-muessen-gesamtrussisches-Niveau-erreichen--article23143824.html,0,www.n-tv.de,"Ukraine-Krieg im Liveticker: +++ 06:59 Putin: Besetzte Gebiete müssen ""gesamtrussisches Niveau"" erreichen +++",Lesen Sie alle aktuellen Entwicklungen und Nachrichten über den russischen Angriffskrieg auf die Ukraine im Liveticker von ntv.de.,https://bilder2.n-tv.de/img/incoming/crop23332537/9041326157-cImg_16_9-w1200/Liveticker1-grau-1-Kopie.jpg,2024-02-01T23:30:00Z,,Der russische Präsident Wladimir Putin will die besetzten ukrainischen Gebiete bis zum Jahr 2030 vollständig in die Russische Föderation integrieren. Seit dem russischen Einmarsch im Februar 2022 ste… [+8469 chars],,de,'Putin'
https://www.n-tv.de/politik/08-01-Weisses-Haus-EU-Gelder-kein-Ersatz-fuer-US-Militaerhilfe--article23143824.html,https://www.n-tv.de/politik/08-01-Weisses-Haus-EU-Gelder-kein-Ersatz-fuer-US-Militaerhilfe--article23143824.html,0,www.n-tv.de,Ukraine-Krieg im Liveticker: +++ 08:01 Weißes Haus: EU-Gelder kein Ersatz für US-Militärhilfe +++,Lesen Sie alle aktuellen Entwicklungen und Nachrichten über den russischen Angriffskrieg auf die Ukraine im Liveticker von ntv.de.,https://bilder2.n-tv.de/img/incoming/crop23332537/9041326157-cImg_16_9-w1200/Liveticker1-grau-1-Kopie.jpg,2024-02-01T23:30:00Z,,"Die USA begrüßen die Entscheidung der EU, die Ukraine-Fazilität in Höhe von 50 Milliarden Euro zu genehmigen, betonen aber, dass diese Finanzierung kein Ersatz für die US-Militärhilfe sei, sagt der S… [+9211 chars]",,de,'Krieg'
