index,url,valid,domain,title,description,image,published,archive,content,quote,language,keyword
https://www.focus.de/experts/ukraine-als-vorbild-wie-die-zukunft-deutschlands-aus-kiew-gruesst_id_259636048.html,https://www.focus.de/experts/ukraine-als-vorbild-wie-die-zukunft-deutschlands-aus-kiew-gruesst_id_259636048.html,0,www.focus.de,Ukraine als Vorbild - Wie die Zukunft Deutschlands aus Kiew grüßt,Der Krieg zwischen Russland und der Ukraine wird früher oder später enden. Wirtschaftsphilosoph Anders Indset sieht im Wiederaufbau der Ukraine eine Chance auf ein Wirtschaftswunder. Zudem könnten etablierte neue Systeme und Entwicklungen aus der Ukraine Vorb…,https://p6.focus.de/img/fotos/id_259636053/buch-von-lamby-ernst-79104845.jpg?im=Crop%3D%280%2C289%2C3463%2C1731%29%3BResize%3D%281200%2C627%29&impolicy=perceptual&quality=mediumHigh&hash=81278cd142649b997350a51bfe6a14c40f8e1d4f2174375bfd6656efa6382f4e,2024-02-04T07:34:45Z,,"<ul><li>
Kommentare</li><li>
E-Mail</li><li>
Teilen</li><li>
Mehr</li><li>
Twitter</li><li>
Drucken</li><li>
Feedback</li><li>
Fehler meldenSie haben einen Fehler gefunden?
Bitte markieren S… [+11931 chars]",,de,'Russland'
https://www.n-tv.de/politik/Stoert-Russland-die-Satellitennavigation-im-Ostseeraum-article24711148.html,https://www.n-tv.de/politik/Stoert-Russland-die-Satellitennavigation-im-Ostseeraum-article24711148.html,0,www.n-tv.de,Gab schon Flugausfälle: Stört Russland die Satellitennavigation im Ostseeraum?,Militärexperten beobachten die Satellitennavigation im deutschen Luftraum genau. Doch seit einiger Zeit wird die GPS-Navigation immer wieder großflächig im Ostseeraum gestört. Vor allem im nordöstlichen Bereich des deutschen Luftraums. Da liegt ein Verdächtig…,https://bilder2.n-tv.de/img/incoming/crop24711213/3421324684-cImg_16_9-w1200/420391993.jpg,2024-02-04T09:06:43Z,,Militärexperten beobachten die Satellitennavigation im deutschen Luftraum genau. Doch seit einiger Zeit wird die GPS-Navigation immer wieder großflächig im Ostseeraum gestört. Vor allem im nordöstlic… [+4447 chars],,de,'Gefährdung'
https://www.stern.de/auto/technik--so-faehrt-der-denza-n7-konfliktpotenzial-34427664.html,https://www.stern.de/auto/technik--so-faehrt-der-denza-n7-konfliktpotenzial-34427664.html,0,www.stern.de,Technik: So fährt der Denza N7: Konfliktpotenzial,"Denza gibt weiter Gas. Nach dem coolen Van D9 hat die BYD-Tochter jetzt das E-SUV E7 auf Kiel gelegt. Der 
Stromer bietet einige Annehmlichkeiten, eine gute Reichweite, hat aber auch Schwächen.",https://image.stern.de/34427666/t/Lt/v1/w1440/r1.7778/-/04--artikel27919bild01jpg---d97cf4bc2f46f635.jpg,2024-02-04T11:36:36Z,,"Denza gibt weiter Gas. Nach dem coolen Van D9 hat die BYD-Tochter jetzt das E-SUV E7 auf Kiel gelegt. Der 
 Stromer bietet einige Annehmlichkeiten, eine gute Reichweite, hat aber auch Schwächen.
Ha… [+5544 chars]",,de,'Gas'
https://www.welt.de/politik/ausland/plus249872736/Der-Balkan-entgleitet-dem-Westen-und-Putin-wartet-schon.html,https://www.welt.de/politik/ausland/plus249872736/Der-Balkan-entgleitet-dem-Westen-und-Putin-wartet-schon.html,0,www.welt.de,Der Balkan entgleitet dem Westen – und Putin wartet schon,"Der Ukraine-Krieg hat die Schwachstellen Europas aufgedeckt. Eine davon: der Westbalkan. Dessen Länder sollen eigentlich der EU beitreten, um die Stabilität des Kontinents zu sichern – doch Nationalisten zündeln an allen Ecken. Russland und China haben das er…",https://img.welt.de/img/politik/ausland/mobile249881130/6991350147-ci16x9-w1200-fnov-fpotl-fpi157750653/DWO-AP-Teaser-Balkan-Stabilitaet-pd-jpg.jpg,2024-02-04T12:31:04Z,,"Die WELT als ePaper: Die vollständige Ausgabe steht Ihnen bereits am Vorabend zur Verfügung so sind Sie immer hochaktuell informiert. Weitere Informationen: http://epaper.welt.de 
 Der Kurz-Link die… [+49 chars]",,de,'Russland'
https://www.bild.de/sport/fussball/hsv/hsv-die-bild-noten-katterbach-im-nacken-macht-muheim-dampf-87030522.bild.html,https://www.bild.de/sport/fussball/hsv/hsv-die-bild-noten-katterbach-im-nacken-macht-muheim-dampf-87030522.bild.html,0,www.bild.de,Die BILD-HSV-Noten - Katterbach im Nacken macht Muheim Dampf,"Miro Muheim gab beim Sieg in Berlin Gas, traf. Er hatte viele Gründe dafür. Die BILD-NotenFoto: WITTERS","https://images.bild.de/65bf6d090cd78021d68901d6/89c5ea44b9346cd36b334cf2fc653190,3ae3e234?w=1280",2024-02-04T12:53:30Z,,"Und dann hat es rumms gemacht!
Miro Muheim (25) feierte beim 2:1-Sieg in Berlin eine besondere Premiere. Der Linksfuß, der bei seinem Treffer zum 1:0 des 
HSV (57.) unüblicherweise seinen rechten F… [+2172 chars]",,de,'Gas'
https://taz.de/Kultur-und-Kriege/!5987818/,https://taz.de/Kultur-und-Kriege/!5987818/,0,taz.de,Kultur und Kriege: Schräge Solidarisierungen,Die liberalen Demokratien sind unter Druck. Der hybriden Kriegsführung totalitärer Mächte sollte man gerade im Kulturbereich entschlossen begegnen.,https://taz.de/picture/6804640/948/34569034-1.jpeg,2024-02-04T12:54:00Z,,"Die liberalen Demokratien sind unter Druck. Der hybriden Kriegsführung totalitärer Mächte sollte man gerade im Kulturbereich entschlossen begegnen.
Zwischen Kunstfreiheit und politischer Debatte: de… [+9672 chars]",,de,'Gas'
https://www.sueddeutsche.de/wirtschaft/energie-gas-mehrwertsteuer-1.6343669,https://www.sueddeutsche.de/wirtschaft/energie-gas-mehrwertsteuer-1.6343669,0,www.sueddeutsche.de,Erdgas: Bleibt die gesenkte Mehrwertsteuer doch länger?,Eigentlich soll ab Anfang März wieder der normale Mehrwertsteuersatz beim Gas gelten. Doch ein entsprechendes Gesetz hängt fest - zum Vorteil der Verbraucher?,https://www.sueddeutsche.de/image/sz.1.5678480/1200x675?v=1707054872,2024-02-04T14:25:40Z,,"Verbraucher können darauf hoffen, dass die Mehrwertsteuersenkung bei Gas doch erst Ende März ausläuft - und nicht Ende Februar. Aus der SPD kamen vor dem Hintergrund von Verhandlungen zwischen Bundes… [+4171 chars]",,de,'Gas'
https://www.zeit.de/news/2024-02/04/schwerverletzte-bei-gasexplosion-in-imbisswagen,https://www.zeit.de/news/2024-02/04/schwerverletzte-bei-gasexplosion-in-imbisswagen,0,www.zeit.de,Unfälle: Schwerverletzte bei Gasexplosion in Imbisswagen,Hier finden Sie Informationen zu dem Thema „Unfälle“. Lesen Sie jetzt „Schwerverletzte bei Gasexplosion in Imbisswagen“.,https://img.zeit.de/news/2024-02/04/schwerverletzte-bei-gasexplosion-in-imbisswagen-image-group/wide__1300x731,2024-02-04T14:43:58Z,,"Bei einer Gasexplosion in einem Imbisswagen in Gerolstein in der Eifel ist die Inhaberin am Sonntag schwer verletzt worden. Die Frau sei in ein Krankenhaus gebracht worden, Lebensgefahr bestehe nicht… [+1180 chars]",,de,'Gas'
https://www.bild.de/politik/ausland/politik-ausland/ukrainer-leben-unter-besatzung-in-armut-putin-laesst-uns-erfrieren-86937466.bild.html,https://www.bild.de/politik/ausland/politik-ausland/ukrainer-leben-unter-besatzung-in-armut-putin-laesst-uns-erfrieren-86937466.bild.html,0,www.bild.de,Ukrainer in Armut - Putin lässt uns erfrieren!,"Sie leben in Armut und Elend. BILD sprach mit Ukrainerinnen, die in Mariupol und Cherson geblieben sind.","https://images.bild.de/65b60c8b3a5db50f07c44415/7f26be30fe98303caf98f5f37be39186,5bcf7433?w=1280",2024-02-04T16:55:30Z,,"Es sind die Gebiete, in denen zu Beginn des Angriffskriegs Russlands vor zwei Jahren der größte Horror wütete und die immer noch von Russland besetzt sind. 
Aus Mariupol und Teilen der Region Cherso… [+3479 chars]",,de,'Gas'
https://www.zeit.de/news/2024-02/05/krieg-gegen-die-ukraine-so-ist-die-lage,https://www.zeit.de/news/2024-02/05/krieg-gegen-die-ukraine-so-ist-die-lage,0,www.zeit.de,Russische Invasion: Krieg gegen die Ukraine: So ist die Lage,Hier finden Sie Informationen zu dem Thema „Russische Invasion“. Lesen Sie jetzt „Krieg gegen die Ukraine: So ist die Lage“.,https://img.zeit.de/news/2024-02/05/krieg-gegen-die-ukraine-so-ist-die-lage-image-group/wide__1300x731,2024-02-05T04:14:25Z,,Der ukrainische Präsident Wolodymyr Selenskyj hat bei einem Frontbesuch in der Region Dnipro und Saporischschja eine Stärkung der Luftabwehr befohlen. Hintergrund sind verstärkte Angriffe des russisc… [+5484 chars],,de,'Putin'
https://www.stern.de/gesellschaft/regional/bayern/energie--windkraft-ausbau-kommt-in-bayern-weiter-kaum-voran-34428786.html,https://www.stern.de/gesellschaft/regional/bayern/energie--windkraft-ausbau-kommt-in-bayern-weiter-kaum-voran-34428786.html,0,www.stern.de,Energie: Windkraft-Ausbau kommt in Bayern weiter kaum voran,"Vor zehn Jahren begann der damalige Ministerpräsident Seehofer, den Bau von Windrädern und Stromtrassen in Bayern zu bremsen. Die Folgen wirken bis heute nach, obwohl die Regierung den Kurswechsel vollzogen hat.",https://image.stern.de/34428788/t/7N/v1/w1440/r1.7778/-/05--urnnewsmldpacom2009010124020599873382v3w800h600l640t435r1920b1308jpeg---97cfdda2e7427a3c.jpg,2024-02-05T05:15:26Z,,"Vor zehn Jahren begann der damalige Ministerpräsident Seehofer, den Bau von Windrädern und Stromtrassen in Bayern zu bremsen. Die Folgen wirken bis heute nach, obwohl die Regierung den Kurswechsel vo… [+5388 chars]",,de,'Windkraft'
https://www.zeit.de/news/2024-02/05/windkraft-ausbau-kommt-in-bayern-weiter-kaum-voran,https://www.zeit.de/news/2024-02/05/windkraft-ausbau-kommt-in-bayern-weiter-kaum-voran,0,www.zeit.de,Energie: Windkraft-Ausbau kommt in Bayern weiter kaum voran,Hier finden Sie Informationen zu dem Thema „Energie“. Lesen Sie jetzt „Windkraft-Ausbau kommt in Bayern weiter kaum voran“.,https://img.zeit.de/news/2024-02/05/windkraft-ausbau-kommt-in-bayern-weiter-kaum-voran-image-group/wide__1300x731,2024-02-05T05:15:26Z,,Der Ausbau der Windenenergie in Bayern macht auch nach dem Kurswechsel der Staatsregierung keine wesentlichen Fortschritte. Im vergangenen Jahr gingen im Freistaat sieben neue Windkraftanlagen in Bet… [+6029 chars],,de,'Windkraft'
https://www.telepolis.de/features/Russisches-Gas-Oesterreichs-heimliche-Liebe-in-Zeiten-des-Krieges-9618247.html,https://www.telepolis.de/features/Russisches-Gas-Oesterreichs-heimliche-Liebe-in-Zeiten-des-Krieges-9618247.html,0,www.telepolis.de,Russisches Gas: Österreichs heimliche Liebe in Zeiten des Krieges,"Trotz Sanktionen und Krieg: Österreichs Bindung an russisches Gas bleibt stark. Die Energiepolitik ist umstritten. Was wird, wenn die Verträge auslaufen?",https://heise.cloudimg.io/bound/1200x1200/q85.png-lossy-85.webp-lossy-85.foil1/_www-heise-de_/imgs/18/4/5/3/6/9/5/9/Denys_Shmyhal_met_with_Austrian_Chancellor_Nehammer_in_Kyiv_20220409__8_-139db1b7177d0b2a.jpeg,2024-02-05T08:00:00Z,,"Österreichs Kanzler Karl Nehammer (2. v. l.) auf einer Pressekonferenz im April 2022 in Kiew. Archivbild: Cabinet of Ministers of Ukraine / CC BY 4.0
Trotz Sanktionen und Krieg: Österreichs Bindung … [+5319 chars]",,de,'Gas'
https://www.telepolis.de/features/Energiereich-trotz-Ukraine-Krieg-Der-Handel-mit-russischem-Gas-in-der-EU-9618247.html,https://www.telepolis.de/features/Energiereich-trotz-Ukraine-Krieg-Der-Handel-mit-russischem-Gas-in-der-EU-9618247.html,0,www.telepolis.de,Energiereich trotz Ukraine-Krieg: Der Handel mit russischem Gas in der EU,"Österreich wird dank russischer Importe zum Energieexporteur. Diplomatisch heikel, aber lukrativ. Was wird, wenn die Verträge auslaufen?",https://heise.cloudimg.io/bound/1200x1200/q85.png-lossy-85.webp-lossy-85.foil1/_www-heise-de_/imgs/18/4/5/3/6/9/5/9/Denys_Shmyhal_met_with_Austrian_Chancellor_Nehammer_in_Kyiv_20220409__8_-139db1b7177d0b2a.jpeg,2024-02-05T08:00:00Z,,"Österreichs Kanzler Karl Nehammer (2. v. l.) auf einer Pressekonferenz im April 2022 in Kiew. Archivbild: Cabinet of Ministers of Ukraine / CC BY 4.0
Österreich wird dank russischer Importe zum Ener… [+5281 chars]",,de,'Ukraine'
https://www.tagesspiegel.de/politik/einigung-lasst-viele-fragen-offen-bundesregierung-verstandigt-sich-auf-kraftwerksstrategie--kritik-von-umwelthilfe-und-union-11160595.html,https://www.tagesspiegel.de/politik/einigung-lasst-viele-fragen-offen-bundesregierung-verstandigt-sich-auf-kraftwerksstrategie--kritik-von-umwelthilfe-und-union-11160595.html,0,www.tagesspiegel.de,„Einigung lässt viele Fragen offen“: Bundesregierung verständigt sich auf Kraftwerksstrategie – Kritik von Umwelthilfe und Union,Deutschland wird den Bau neuer Gaskraftwerke subventionieren – darauf hat sich die Ampel-Regierung nun geeinigt. Allerdings sollen diese in Zukunft klimaneutral werden.,https://www.tagesspiegel.de/images/kugelgasspeicher-in-dortmund-gasheizkraftwerk-versorgt-haushalte-mit-fernwarme-gaspreise-ukrainekrieg-heizkostenspi/alternates/BASE_16_9_W1400/kugelgasspeicher-in-dortmund-gasheizkraftwerk-versorgt-haushalte-mit-fernwaerme-gaspreise--ukrainekrieg-heizkostenspi.jpeg,2024-02-05T09:57:42Z,,"Nach langen Verhandlungen hat sich die Bundesregierung auf einen Kompromiss für den Bau neuer Kraftwerke verständigt. 
Insgesamt solle zunächst die Errichtung von neuen Gaskraftwerken mit bis zu zeh… [+6609 chars]",,de,'Gas'
https://www.zeit.de/wirtschaft/2024-02/bundesregierung-gaskraftwerke-wasserstoff-strategie,https://www.zeit.de/wirtschaft/2024-02/bundesregierung-gaskraftwerke-wasserstoff-strategie,0,www.zeit.de,Erdgas und Wasserstoff: Bundesregierung einigt sich auf Strategie zum Bau neuer Kraftwerke,Mit Gas sollen sie starten und später auf Wasserstoff umgestellt werden: Die Ampelregierung hat nach langem Ringen einen Kompromiss zum Bau neuer Kraftwerke gefunden.,https://img.zeit.de/wirtschaft/2024-02/bundesregierung-gaskraftwerke-wasserstoff-strategie-bild/wide__1300x731,2024-02-05T10:09:26Z,,"Bundeskanzler Olaf Scholz (SPD), Bundeswirtschaftsminister Robert Habeck 
(Grüne) und Bundesfinanzminister Christian Lindner (FDP) haben sich auf eine Strategie zum Bau neuer wasserstofffähiger Gask… [+1664 chars]",,de,'Gas'
https://www.tagesschau.de/inland/kraftwerkstrategie-regierung-100.html,https://www.tagesschau.de/inland/kraftwerkstrategie-regierung-100.html,0,www.tagesschau.de,Bundesregierung einigt sich auf Kraftwerksstrategie,"Es war ein langes Ringen in der Ampelkoalition, nun steht ein Plan: Die Bundesregierung hat sich auf eine Strategie zum Bau neuer wasserstofffähiger Gaskraftwerke in Deutschland geeinigt .",https://images.tagesschau.de/image/b0fd9f0d-de5f-40a7-9504-2b0ba16c3034/AAABjH0uRX4/AAABibBxqrQ/16x9-1280/leipheim-100.jpg,2024-02-05T10:27:00Z,,"Stand: 05.02.2024 11:27 Uhr
Es war ein langes Ringen in der Ampelkoalition, nun steht ein Plan: Die Bundesregierung hat sich auf eine Strategie zum Bau neuer wasserstofffähiger Gaskraftwerke in Deut… [+2345 chars]",,de,'Gas'
https://www.tagesschau.de/kraftwerksstrategie-bundesregierung-100.html,https://www.tagesschau.de/kraftwerksstrategie-bundesregierung-100.html,0,www.tagesschau.de,Pläne der Bundesregierung: Wofür braucht es eine Kraftwerksstrategie?,Im Jahr 2030 sollen mindestens 80 Prozent des verbrauchten Stroms aus erneuerbaren Energien stammen - vor allem aus Windkraft- und Solaranlagen. Aber warum werden auch Gaskraftwerke gefördert? Von Martin Polansky.,https://images.tagesschau.de/image/9f41c5b1-bd03-42b0-bbf4-ad448e34a2cc/AAABh3lswKQ/AAABibBxqrQ/16x9-1280/gaskraftwerk-115.jpg,2024-02-05T10:33:12Z,,"Stand: 05.02.2024 11:33 Uhr
Im Jahr 2030 sollen mindestens 80 Prozent des verbrauchten Stroms aus erneuerbaren Energien stammen - vor allem aus Windkraft- und Solaranlagen. Aber warum werden auch Ga… [+2226 chars]",,de,'Solar'
https://www.welt.de/wirtschaft/video249916086/Energieversorgung-Bundesregierung-einigt-sich-auf-Kraftwerksstrategie.html,https://www.welt.de/wirtschaft/video249916086/Energieversorgung-Bundesregierung-einigt-sich-auf-Kraftwerksstrategie.html,0,www.welt.de,Bundesregierung einigt sich auf Kraftwerksstrategie,Die Bundesregierung hat sich auf eine Strategie zum Bau neuer wasserstofffähiger Gaskraftwerke geeinigt. Insgesamt werde zunächst die Errichtung von bis zu zehn Gigawatt an Gas-Kraftwerksleistung ausgeschrieben. Die Kraftwerke sollen die schwankende Wind- und…,https://img.welt.de/img/incoming/mobile249916058/6041353497-ci16x9-w1200/443489086-jpg.jpg,2024-02-05T10:50:21Z,,"Die WELT als ePaper: Die vollständige Ausgabe steht Ihnen bereits am Vorabend zur Verfügung so sind Sie immer hochaktuell informiert. Weitere Informationen: http://epaper.welt.de 
 Der Kurz-Link die… [+49 chars]",,de,'Gas'
https://www.focus.de/politik/ausland/eu/britische-regierung-fordert-eu-auf-stopp-der-russischen-gasimporte_id_259640334.html,https://www.focus.de/politik/ausland/eu/britische-regierung-fordert-eu-auf-stopp-der-russischen-gasimporte_id_259640334.html,0,www.focus.de,Trotz Ukraine-Krieg - Russisches Gas in EU - Britische Regierung erhebt Zeigefinger gegen Frankreich,"Russisches Gas könnte in britische Haushalte gelangen - und das, obwohl gegen Russland Sanktionen verhängt wurden. Großbritannien fordert nun die EU zum Handeln auf.",https://p6.focus.de/img/regional/niedersachsen/id_238212444/grossbritanniens-energieministerin-claire-coutinho-l-und-bundeswirtschaftsminister-robert-habeck-unterhalten-sich..jpg?im=Crop%3D%280%2C171%2C2048%2C1024%29%3BResize%3D%281200%2C627%29&impolicy=perceptual&quality=mediumHigh&hash=0247b3067ff3ee9e1945426d1f5518ecf2153850bd84ad3b18ea0657b564c09f,2024-02-05T11:32:04Z,,"Russisches Gas könnte in britische Haushalte gelangen - und das, obwohl gegen Russland Sanktionen verhängt wurden. Großbritannien fordert nun die EU zum Handeln auf.Die britische Regierung fordert vo… [+1905 chars]",,de,'Russland'
https://www.tagesschau.de/ausland/europa/nadeschdin-102.html,https://www.tagesschau.de/ausland/europa/nadeschdin-102.html,0,www.tagesschau.de,Russland: Kriegsgegner Nadeschdin droht Aus der Kandidatur,"Boris Nadeschdin ist der einzige Präsidentschaftsbewerber, der Russlands Angriffskrieg gegen die Ukraine offen kritisiert. Nun steht seine Kandidatur auf der Kippe: Die Wahlkommission hat angeblich fehlerhafte Unterstützerunterschriften aussortiert.",https://images.tagesschau.de/image/e66db8c5-ede5-468e-bd6d-494b03668687/AAABjXj2ppM/AAABibBxqrQ/16x9-1280/nadeschdin-104.jpg,2024-02-05T11:58:27Z,,"Stand: 05.02.2024 12:58 Uhr
Boris Nadeschdin ist der einzige Präsidentschaftsbewerber, der Russlands Angriffskrieg gegen die Ukraine offen kritisiert. Nun steht seine Kandidatur auf der Kippe: Die W… [+2309 chars]",,de,'Krieg'
https://www.nzz.ch/zuerich/die-zuercher-svp-scheitert-mit-ihrem-angriff-auf-die-windkraft-der-kantonsrat-lehnt-einen-mindestabstand-zu-bewohnten-liegenschaften-ab-ld.1777447,https://www.nzz.ch/zuerich/die-zuercher-svp-scheitert-mit-ihrem-angriff-auf-die-windkraft-der-kantonsrat-lehnt-einen-mindestabstand-zu-bewohnten-liegenschaften-ab-ld.1777447,0,www.nzz.ch,Die Zürcher SVP blitzt mit ihrem Angriff auf die Windkraft ab: Der Kantonsrat verweigert einen Mindestabstand zu bewohnten Liegenschaften,Für die parlamentarische Initiative fehlten genügend freisinnige Stimmen.,"https://img.nzz.ch/2024/02/05/314a20e9-8732-45c2-87b4-4ba2112eb524.jpeg?width=1200&height=675&fit=bound&quality=75&auto=webp&crop=3470,1952,x0,y229&wmark=nzz",2024-02-05T16:30:00Z,,"Lässt im Kanton Zürich noch längere Zeit auf sich warten: eine grosse Windkraftanlage, hier in Lutersarni im Entlebuch.
Es ist erst zwei Wochen her, seit das Kantonsparlament letztmals über die Wind… [+7012 chars]",,de,'Windkraft'
https://www.tagesschau.de/inland/innenpolitik/kraftwerksstrategie-106.html,https://www.tagesschau.de/inland/innenpolitik/kraftwerksstrategie-106.html,0,www.tagesschau.de,Die Kraftwerksstrategie fällt deutlich kleiner aus als geplant,Die Bundesregierung hat sich nach langem Ringen auf einen Kompromiss zum Bau neuer Kraftwerke verständigt. Die Kraftwerksstrategie sieht zunächst den Bau von bis zu zehn Gigawatt an wasserstofffähigen Gaskraftwerken vor. Von M. Polansky.,https://images.tagesschau.de/image/f9b7036a-7fa8-407b-8007-03aefbcbae11/AAABjEkgexk/AAABibBxqrQ/16x9-1280/kraftwerk-windrad-100.jpg,2024-02-05T17:55:52Z,,"Stand: 05.02.2024 18:55 Uhr
Die Bundesregierung hat sich nach langem Ringen auf einen Kompromiss zum Bau neuer Kraftwerke verständigt. Die Kraftwerksstrategie sieht zunächst den Bau von bis zu zehn … [+5991 chars]",,de,'Gas'
https://orf.at/stories/3347911/,https://orf.at/stories/3347911/,0,orf.at,UNO warnen vor Ausweitung der Gaza-Kämpfe nach Rafah,,https://orf.at/mojo/1_4_1/storyserver//news/common/images/og-fallback-news.png,2024-02-06T13:08:31Z,,"Die Vereinten Nationen haben vor einer Ausweitung der Kämpfe im Gazastreifen auf die südliche Stadt Rafah an der Grenze zu Ägypten gewarnt. Dort drängen sich mehr als eine Million Menschen, viele von… [+1478 chars]",,de,'Kämpfe'
https://www.tagesspiegel.de/internationales/funf-beamte-festgenommen-ukraine-will-russische-spione-im-geheimdienst-aufgespurt-haben-11169595.html,https://www.tagesspiegel.de/internationales/funf-beamte-festgenommen-ukraine-will-russische-spione-im-geheimdienst-aufgespurt-haben-11169595.html,0,www.tagesspiegel.de,Fünf Beamte festgenommen: Ukraine will russische Spione im Geheimdienst aufgespürt haben,"Der ukrainische Geheimdienst SBU berichtet, dass ein „mächtiges Agentennetzwerk“ des russischen Geheimdienstes FSB in der Ukraine operiert habe. Ihnen wird Hochverrat vorgeworfen.",https://www.tagesspiegel.de/images/ukraine-russia-tensions/alternates/BASE_16_9_W1400/ukraine-russia-tensions.jpeg,2024-02-06T14:03:00Z,,"Der ukrainische Geheimdienst SBU hat nach eigenen Angaben ein Agentennetz des russischen Inlandsgeheimdienstes FSB aufgespürt, zu dem ehemalige und derzeitige Beamte der ukrainischen Geheimdienste ge… [+2513 chars]",,de,'Ukraine'
https://www.sueddeutsche.de/bayern/bayern-antisemitismus-israel-hamas-krieg-straftaten-1.6344782,https://www.sueddeutsche.de/bayern/bayern-antisemitismus-israel-hamas-krieg-straftaten-1.6344782,0,www.sueddeutsche.de,"Krieg im Nahen Osten: ""Wir erleben eine Explosion von Antisemitismus in Bayern""",Die Zahl der judenfeindlichen Straftaten ist seit der Eskalation im Nahen Osten stark angestiegen. Im Landtag äußert sich Israels Generalkonsulin besorgt - bekräftigt aber die bayerisch-israelische Freundschaft.,https://www.sueddeutsche.de/image/sz.1.6344783/1200x675?v=1707230121,2024-02-06T14:18:30Z,,Die Zahl der antisemitischen Straftaten in Bayern ist seit dem Massaker der Hamas am 7. Oktober und dem darauffolgenden Krieg Israels im Gazastreifen stark angestiegen. 40 Prozent der 538 im vergange… [+1700 chars],,de,'Krieg'
https://www.freitag.de/autoren/alexandra-senfft/unrwa-im-israel-gaza-krieg-eine-extreme-herausforderung,https://www.freitag.de/autoren/alexandra-senfft/unrwa-im-israel-gaza-krieg-eine-extreme-herausforderung,0,www.freitag.de,Vereinte Nationen | UNRWA im Israel-Gaza-Krieg: Eine extreme Herausforderung,Die Organisation UNRWA steht unter enormem Druck. Mitarbeiter sollen in Terrorakte der Hamas verwickelt sein. Was wird nun aus der Hilfe für die Palästinenser? Zwölf Mitarbeiter des Hilfswerks der Vereinten Nationen für Palästina-Flüchtlinge (UNRWA) sollen am…,https://www.freitag.de/autoren/alexandra-senfft/unrwa-im-israel-gaza-krieg-eine-extreme-herausforderung/@@images/social_image,2024-02-06T14:20:00Z,,Zwölf Mitarbeiter des Hilfswerks der Vereinten Nationen für Palästina-Flüchtlinge (UNRWA) sollen am Massaker der Terrororganisation Hamas an israelischen Zivilist:innen am 7. Oktober 2023 beteiligt g… [+546 chars],,de,'Krieg'
https://www.tagesspiegel.de/internationales/us-think-tank-warnt-iran-konnte-innerhalb-einer-woche-genugend-uran-fur-atomwaffe-anreichern-11170222.html,https://www.tagesspiegel.de/internationales/us-think-tank-warnt-iran-konnte-innerhalb-einer-woche-genugend-uran-fur-atomwaffe-anreichern-11170222.html,0,www.tagesspiegel.de,US-Think-Tank warnt: Iran könnte innerhalb einer Woche genügend Uran für Atomwaffe anreichern,"Ein Think-Tank, der das Atomprogramm des Irans seit den 1990er Jahren analysiert, hat erstmals die höchste Bedrohungsstufe ausgerufen. Teheran könnte unbemerkt von westlichen Diensten Atomwaffen bauen.",https://www.tagesspiegel.de/politik/images/a-handout-picture-provided-by-irans-defence-ministry-on-february-1-2021-shows-the-launch-of-irans-newest-satellite-carrying-rocket-called-zuljanah-at-an-undisclosed-location-photo-by-iranian-defence-ministry-afp-restricted-to-editorial-use-manda/alternates/BASE_16_9_W1400/a-handout-picture-provided-by-irans-defence-ministry-on-february-1-2021-shows-the-launch-of-irans-newest-satellite-carrying-rocket-called-zuljanah-at-an-undisclosed-location-photo-by-----iranian-defence-ministry---afp-----restricted-to-editorial-use---mandatory-credit-afp-photo---ho--ir.jpeg,2024-02-06T14:30:10Z,,"Ein neuer Bericht des US-amerikanischen Think-Tanks Institute for Science and International Security warnt, dass der Iran innerhalb einer Woche genug waffenfähiges Uran für eine Atomwaffe anreichern … [+1559 chars]",,de,'Krieg'
https://www.faz.net/aktuell/politik/ausland/liveblog-zum-krieg-in-nahost-unrwa-erwartet-bericht-nach-mitarbeiter-skandal-anfang-maerz-faz-19226976.html,https://www.faz.net/aktuell/politik/ausland/liveblog-zum-krieg-in-nahost-unrwa-erwartet-bericht-nach-mitarbeiter-skandal-anfang-maerz-faz-19226976.html,0,www.faz.net,Liveblog zum Krieg in Nahost: UNRWA erwartet Bericht nach Mitarbeiter-Skandal Anfang März,China richtet Vorwürfe an USA wegen Vergeltungsschlägen +++ Blinken zu Gesprächen in Ägypten eingetroffen +++ abermals Beschuss an Grenze zu Libanon +++ alle Entwicklungen im Liveblog,https://media1.faz.net/ppmedia/aktuell/politik/2210204864/1.9500915/facebook_teaser/frankreichs-ehemalige.jpg,2024-02-06T14:52:30Z,,"Die Regierung von US-Präsident Joe Biden will ein Veto gegen einen von den Republikanern im Repräsentantenhaus unterstützten Gesetzentwurf einlegen, der Israel Hilfe leisten würde. Die Regierung lehn… [+1793 chars]",,de,'Krieg'
