index,url,valid,domain,title,description,image,published,archive,content,quote,language,keyword
https://www.welt.de/politik/ausland/article246675820/Ukraine-News-Russische-Truppen-laut-London-im-Sueden-unter-Druck.html,https://www.welt.de/politik/ausland/article246675820/Ukraine-News-Russische-Truppen-laut-London-im-Sueden-unter-Druck.html,0,www.welt.de,"Wenig Munition, Mangel an Reserven – Russische Truppen laut London im Süden unter Druck","Nach britischen Informationen haben die russischen Truppen im Süden der Ukraine immer mehr Probleme, sie leiden an Kampfmüdigkeit und Abstimmungsproblemen. Und erneut ist die russische Hauptstadt mit Drohnen angegriffen worden. Mehr im Liveticker.",https://img.welt.de/img/politik/ausland/mobile246677098/8311352257-ci16x9-w1200/UKRAINE-CRISIS-BAKHMUT-UGC.jpg,2023-08-01T03:57:01Z,http://archive.md/20230801095500/https://www.welt.de/politik/ausland/article246675820/Ukraine-News-Russische-Truppen-laut-London-im-Sueden-unter-Druck.html,Die ukrainische Gegenoffensive setzt nach Einschätzung britischer Geheimdienste die russischen Besatzungstruppen im Süden der Ukraine unter Druck. Zu den allgemeinen Problemen der russischen Kommande… [+6220 chars],,de,'Gas'
https://www.morgenpost.de/ratgeber/article238104219/gasheizung-umruesten-h2-ready-energieberaterin-hausbesitzer.html,https://www.morgenpost.de/ratgeber/article238104219/gasheizung-umruesten-h2-ready-energieberaterin-hausbesitzer.html,0,www.morgenpost.de,Was Experten empfehlen: Gasheizung auf H2-ready umrüsten: Große Hürden für Besitzer,Auf Wasserstoff umrüstbare Gasheizungen sollen weiter erlaubt sein. • Doch nicht überall sind H2-Netze vorgesehen • Was Hausbesitzer bedenken sollten.,https://img.morgenpost.de/img/frontpage/crop238709449/5602605610-w820-cv16_9-q85/Gasheizung-mit-Wasserstoff-nutzen-H2-ready-ab-2024.jpg,2023-08-01T08:30:00Z,,Berlin. <ul><li>Viele Hausbesitzer mit Gasheizung im Keller beschäftigten sich in den vergangenen Monaten mit der Zukunft ihres Heizsystems</li><li>Denn der Einbau von neuen Gas- und Ölheizungen soll… [+13933 chars],,de,'Hohe Kosten'
https://www.morgenpost.de/politik/article238686873/gasheizung-h2-ready-heizung-energieberater-kosten.html,https://www.morgenpost.de/politik/article238686873/gasheizung-h2-ready-heizung-energieberater-kosten.html,0,www.morgenpost.de,Heizungsgesetz entschärft: Für diese Heizung trifft Experte ein vernichtendes Urteil,Die Ampel-Koalition hat das Heizungsgesetz entschärft. Der Einbau einer Gasheizung ist weiter möglich – doch unter welchen Bedingungen?,https://img.morgenpost.de/img/frontpage/crop238727511/3862604295-w820-cv16_9-q85/5FAD9C00317C6524.jpg,2023-08-01T08:52:00Z,,Berlin. <ul><li>Die vergangenen Monate waren für viele Hausbesitzer sicher keine leichten: Dass lag vor allem an den Konflikten in der Debatte um das neue Heizungsgesetz </li><li>Die Novelle wird ers… [+13244 chars],,de,'Gas'
https://www.morgenpost.de/ratgeber/article238804575/gasheizung-heizungsgesetz-aenderungen-2024.html,https://www.morgenpost.de/ratgeber/article238804575/gasheizung-heizungsgesetz-aenderungen-2024.html,0,www.morgenpost.de,Förderung und Co.: Was sich ab 2024 bei der Gasheizung alles ändern wird,Laut Heizungsgesetz soll auch die Gasheizung ab 2024 weiter eingebaut werden – doch es gelten Voraussetzungen. Hier lesen Sie mehr.,https://img.morgenpost.de/img/frontpage/crop238235527/1692604027-w820-cv16_9-q85/H2-Gasheizung.jpg,2023-08-01T08:58:00Z,,"Berlin. <ul><li>Wer noch eine Gasheizung hat, musste in den vergangenen Monaten darauf hoffen, dass nicht ihr Ende besiegelt werden würde</li><li>Letztlich wurde das Heizungsgesetz entschärft, Gashei… [+9126 chars]",,de,'Hohe Kosten'
https://www.faz.net/aktuell/politik/inland/versorgung-von-fruehchen-mindestmengen-retten-leben-19071592.html,https://www.faz.net/aktuell/politik/inland/versorgung-von-fruehchen-mindestmengen-retten-leben-19071592.html,0,www.faz.net,Versorgung von Säuglingen: „Mindestmengen“ retten Leben von Frühgeborenen,"Es gibt einen Zusammenhang zwischen der Überlebenschance von sehr kleinen Frühchen und der Größe der Einrichtung, in der sie betreut werden. Daher ist es richtig , dass sie nur von bestimmten Kliniken versorgt werden dürfen. Ein Gastbeitrag.",https://media0.faz.net/ppmedia/aktuell/gesellschaft/775117219/1.9071584/facebook_teaser/ein-wenige-wochen-altes.jpg,2023-08-01T11:59:01Z,,Derzeit erregen die Regelungen um sogenannte Mindestmengen bei der Versorgung sehr kleiner Frühgeborener die öffentliche Aufmerksamkeit und werden kontrovers diskutiert. Häufig ist in der Debatte die… [+4768 chars],,de,'Gefährdung'
https://www.wiwo.de/unternehmen/industrie/covestro-chef-die-frage-ist-doch-wofuer-das-geld-ausgegeben-wird-/29290750.html,https://www.wiwo.de/unternehmen/industrie/covestro-chef-die-frage-ist-doch-wofuer-das-geld-ausgegeben-wird-/29290750.html,0,www.wiwo.de,"Covestro-Chef: „Die Frage ist doch, wofür das Geld ausgegeben wird“","Covestro-CEO Markus Steilemann drängt die Ampelkoalition zu mehr Unterstützung. Er erklärt, warum er trotz allem noch Hoffnung für die deutsche Chemieindustrie hat – und warnt vor einer neuen Abhängigkeit bei Öl und Gas.",https://www.wiwo.de/images/covestro-corrosion-protection/29290930/2-format11240.jpg,2023-08-01T13:56:37Z,,"WirtschaftsWoche: Herr Steilemann, die deutsche Wirtschaft lahmt, die Chemieindustrie in Deutschland geht den Bach runter. Sie haben die Risiken selbst beschrieben: hohe Energiekosten und Steuern, sc… [+6500 chars]",,de,'Gas'
https://www.faz.net/aktuell/politik/ukraine-liveticker-usa-wagner-stellt-keine-besondere-bedrohung-fuer-nato-dar-faz-19030454.html,https://www.faz.net/aktuell/politik/ukraine-liveticker-usa-wagner-stellt-keine-besondere-bedrohung-fuer-nato-dar-faz-19030454.html,0,www.faz.net,Ukraine-Liveblog: USA: Wagner stellt keine besondere Bedrohung für NATO dar,London: Russische Truppen im Süden der Ukraine unter Druck +++ Botschafter Makeiev sieht keine Verhandlungslösung mit Russland +++ Ukraine kann Getreide über Kroatien ausführen +++ alle Entwicklungen im Liveblog,https://media0.faz.net/ppmedia/aktuell/1296316059/1.9074546/facebook_teaser/die-wagner-gruppe-und-ihr-chef.jpg,2023-08-01T16:11:13Z,,"Von den Wagner-Söldnern geht nach Ansicht der USA keine besondere Bedrohung für Polen oder andere NATO-Verbündete aus. Die USA beobachteten die Lage an der Grenze von Polen zu Belarus sorgfältig, sag… [+943 chars]",,de,'Ukraine'
https://www.jungewelt.de/artikel/456043.kapital-in-angst.html,https://www.jungewelt.de/artikel/456043.kapital-in-angst.html,0,www.jungewelt.de,Kommentar: Kapital in Angst,"Die deutsche Wirtschaft ist nicht erst seit dem Ukraine-Krieg auf der besagten Verliererstraße, sie ist da schon lange unterwegs. Seit Jahren wird die überfällige Transformation vieler Branchen verschleppt.",https://www.jungewelt.de/img/1100/183732.jpg,2023-08-01T17:36:23Z,,"Der Präsident des Industrieverbands BDI, Siegfried Russwurm, hat ja recht, wenn er mit Blick auf die wirtschaftliche Entwicklung beklagt, Deutschland sei »auf der Verliererstraße«. Laut dem Internati… [+2615 chars]",,de,'Krieg'
https://www.focus.de/kaufberatung/deals_angebote/nachhaltig-sprudeln-geld-sparen-und-die-umwelt-schonen-mit-edelstahlflaschen-fuer-sodastream_id_200653609.html,https://www.focus.de/kaufberatung/deals_angebote/nachhaltig-sprudeln-geld-sparen-und-die-umwelt-schonen-mit-edelstahlflaschen-fuer-sodastream_id_200653609.html,0,www.focus.de,Nachhaltig sprudeln - Geld sparen und die Umwelt schonen mit Edelstahlflaschen für Ihren Sodastream,"Edelstahlflaschen für den SodaStream sind spülmaschinengeeignet, bruchfest und haben kein Ablaufdatum. Wir zeigen Ihnen, welche Flaschen es gibt und mit welchen Sprudlern sie kompatibel sind.",https://p6.focus.de/img/fotos/id_200650810/edelstahlflasche-aufmacher.jpg?im=Crop%3D%280%2C59%2C1890%2C945%29%3BResize%3D%281200%2C627%29&impolicy=perceptual&quality=mediumHigh&hash=86449c5a56e1cfa5144422c277f0a369a286a6490e34b2cee97c019bcdb2a66b,2023-08-01T18:33:49Z,,"<ul><li>
Kommentare</li><li>
E-Mail</li><li>
Teilen</li><li>
Mehr</li><li>
Twitter</li><li>
Drucken</li><li>
Feedback</li><li>
Fehler meldenSie haben einen Fehler gefunden?
Bitte markieren S… [+1272 chars]",,de,'Geld sparen'
https://salzburg.orf.at/stories/3218355/,https://salzburg.orf.at/stories/3218355/,0,salzburg.orf.at,Energiekosten: SPÖ fordert mehr Hilfe für Arme,"Salzburgs Sozialdemokraten fordern von der Landesregierung, diese möge politisch wesentlich mehr gegen die Teuerung unternehmen.Außerdem brauche es mehr Unterstützung gegen für Haushalte, die sich Heizung und Strom kaum noch leisten könnten.",https://ibs.orf.at/sbg?image=https%3A%2F%2Foekastatic.orf.at%2Fmims%2F2022%2F14%2F34%2Fcrops%2Fw%3D1200%2Ch%3D627%2Cq%3D75%2F1295321_master_462834_stromzaehler.jpg%3Fs%3Dd7f338be4d3efae83f8e81453fdf5b1f86886855,2023-08-02T04:00:00Z,,"Die neue Salzburger Landesregierung nehme die Inflation nicht ernst genug. Hohe Strom- und Heizkosten würden längst nicht nur einkommensschwachen Menschen und Familien große Probleme bereiten.
Auch … [+617 chars]",,de,'Energiekosten'
https://orf.at/stories/3325937/,https://orf.at/stories/3325937/,0,orf.at,Sparen in der Zeit und in der Not,"Der Handel verharrt in der Krise, ob daran die Nachwehen der Pandemie schuld sind, ist strittig. Jedenfalls ausschlaggebend ist die Zurückhaltung von Konsumentinnen und Konsumenten angesichts einer Inflation von immer noch sieben Prozent. Etliche Betriebe, au…",https://ibs.orf.at/news?image=https%3A%2F%2Fassets.orf.at%2Fmims%2F2023%2F31%2F10%2Fcrops%2Fw%3D1200%2Ch%3D630%2Cq%3D75%2F1886632_master_707210_sparen_teuerung_kaufzurueckhaltung_scheine_glas_gy.jpg%3Fs%3Df6b2d7d48155f575171df6016593fe36264a6558,2023-08-02T04:06:54Z,,"Delka, Salamander, Gerry Weber und Hallhuber, aber auch etliche Firmen abseits der Textilsparte wie Forstinger sowie Gastronomiebetriebe schlossen zuletzt ihre Pforten für immer. Die Gründe sind ein … [+5647 chars]",,de,'Inflation'
https://www.morgenpost.de/politik/article239088611/9000-Euro-in-bar-Wie-Ukrainer-den-Militaerdienst-umgehen.html,https://www.morgenpost.de/politik/article239088611/9000-Euro-in-bar-Wie-Ukrainer-den-Militaerdienst-umgehen.html,0,www.morgenpost.de,Bestechungsvorwürfe: 9000 Euro in bar – Wie Ukrainer den Militärdienst umgehen,Ein hochrangiger Militärbeamter wurde in der Ukraine festgenommen: Er soll Ukrainer für wehruntauglich erklärt haben. Wie der Skandal aufgedeckt wurde.,https://img.morgenpost.de/img/politik/crop239088595/0752603457-w820-cv16_9-q85/65509308-311a-11ee-834b-695648732fc6.jpg,2023-08-02T11:11:21Z,,"Kiew. Es ist eine brisante Geschichte mitten im Krieg. In der ukrainischen Hauptstadt Kiew wurde der bereits entlassene Chef des Militäreinberufungsamtes der südukrainischen Region Odessa, Jewhen Bor… [+5702 chars]",,de,'Ukraine'
https://www.telepolis.de/features/Wagner-Soeldner-ueber-Polen-Warschau-fuerchtet-Angriffe-aus-Belarus-9232910.html,https://www.telepolis.de/features/Wagner-Soeldner-ueber-Polen-Warschau-fuerchtet-Angriffe-aus-Belarus-9232910.html,0,www.telepolis.de,Wagner-Söldner über Polen: Warschau fürchtet Angriffe aus Belarus,Ukraine-Krieg: US-Botschafterin an der UN warnt vor Bedrohung für Nato. Putin warnt vor Angriffen auf Belarus. Ist das Risiko einer Eskalation auf dem Radar?,https://heise.cloudimg.io/bound/1200x1200/q85.png-lossy-85.webp-lossy-85.foil1/_www-heise-de_/imgs/18/4/2/8/0/0/4/2/Master_Hubschrauber-cb245f68366be661.jpeg,2023-08-02T12:00:00Z,,"Hubschrauber Mi-8MT. Bild: www.dodmedia.osd.mil / US-Army 
Ukraine-Krieg: US-Botschafterin an der UN warnt vor Bedrohung für Nato. Putin warnt vor Angriffen auf Belarus. Ist das Risiko einer Eskalat… [+5987 chars]",,de,'Risiko'
https://taz.de/Autor-Paul-Maar/!5947642/,https://taz.de/Autor-Paul-Maar/!5947642/,0,taz.de,Autor Paul Maar: „Das Sams gehört zur Familie“,"Mit den Geschichten vom Sams wurde Paul Maar berühmt. Ein Gespräch über seine Angst vor Demenz und die Freiheit, für Erwachsene zu schreiben.",https://taz.de/picture/6414637/948/Paul-Maar-Gespraech-1.jpeg,2023-08-02T12:45:00Z,http://archive.md/20230802170631/https://taz.de/Autor-Paul-Maar/!5947642/,"Mit den Geschichten vom Sams wurde Paul Maar berühmt. Ein Gespräch über seine Angst vor Demenz und die Freiheit, für Erwachsene zu schreiben.
Früher kamen Paul Maar die Ideen angerast, heute eher an… [+14709 chars]",,de,'Angst'
https://www.n-tv.de/politik/Experte-zeichnet-Szenario-fuer-Atomunfall-in-Saporischschja-article24301007.html,https://www.n-tv.de/politik/Experte-zeichnet-Szenario-fuer-Atomunfall-in-Saporischschja-article24301007.html,0,www.n-tv.de,Fatale Folgen für Nachbarländer: Experte zeichnet Szenario für Atomunfall in Saporischschja,Seit über einem Jahr besetzt Russland das ukrainische Kernkraftwerk Saporischschja. Immer wieder kommen angesichts von Angriffen auf die Anlage Sorgen einer Atomkatastrophe auf. Neue meteorologische Modellrechnungen zeigen die unmittelbaren Folgen eines Super…,https://bilder2.n-tv.de/img/incoming/crop24301013/3161321433-cImg_16_9-w1200/415704274.jpg,2023-08-02T14:07:35Z,,Seit über einem Jahr besetzt Russland das ukrainische Kernkraftwerk Saporischschja. Immer wieder kommen angesichts von Angriffen auf die Anlage Sorgen einer Atomkatastrophe auf. Neue meteorologische … [+2195 chars],,de,'Russland'
https://www.zeit.de/news/2023-08/03/krieg-gegen-die-ukraine-so-ist-die-lage,https://www.zeit.de/news/2023-08/03/krieg-gegen-die-ukraine-so-ist-die-lage,0,www.zeit.de,Russische Invasion: Krieg gegen die Ukraine: So ist die Lage,,,2023-08-03T03:08:05Z,,"When browsing with ads:
We collect personal data and also transmit it to third-party providers
 that help us improve and finance our digital content. Some of the information stored on your device, … [+821 chars]",,de,'Ukraine'
https://www.zeit.de/2023/33/konjunktur-deutschland-usa-kapitalmarkt-risikobereitschaft,https://www.zeit.de/2023/33/konjunktur-deutschland-usa-kapitalmarkt-risikobereitschaft,0,www.zeit.de,"Konjunktur: Amerika, du machst es besser!","Subventionen und Energiekosten sind nur ein Teil der Erklärung: Die Wirtschaft in den USA wächst, die Löhne steigen. Europa fällt zurück und versinkt in Bürokratie.",,2023-08-03T04:31:49Z,http://archive.md/20230803043935/https://www.zeit.de/2023/33/konjunktur-deutschland-usa-kapitalmarkt-risikobereitschaft,"When browsing with ads:
We collect personal data and also transmit it to third-party providers
 that help us improve and finance our digital content. Some of the information stored on your device, … [+821 chars]",,de,'Energiekosten'
https://www.handelsblatt.com/politik/konjunktur/nachrichten/konjunktur-erzeugerpreise-im-euroraum-sinken-weiter/29295162.html,https://www.handelsblatt.com/politik/konjunktur/nachrichten/konjunktur-erzeugerpreise-im-euroraum-sinken-weiter/29295162.html,0,www.handelsblatt.com,Konjunktur: Erzeugerpreise im Euroraum fallen weiter – Inflationsdruck lässt nach,Die sinkenden Energiekosten haben die Produzentenpreise stärker eingedämmt als erwartet. Diese Entwicklung stellt ein Nachlassen der Inflation in Aussicht.,https://www.handelsblatt.com/images/erzeugerpreise/29295294/2-format2003.jpg,2023-08-03T09:08:18Z,,Berlin/Brüssel Die Preise der Hersteller im Euroraum sinken und lassen damit auf ein Nachlassen des Inflationsschubs schließen. Die Produzentenpreise in der Industrie fielen im Juni den zweiten Monat… [+1461 chars],,de,'Energiekosten'
https://www.handelsblatt.com/politik/konjunktur/nachrichten/konjunktur-erzeugerpreise-im-euroraum-sinken-weiter-signal-fuer-abebben-der-inflation/29295162.html,https://www.handelsblatt.com/politik/konjunktur/nachrichten/konjunktur-erzeugerpreise-im-euroraum-sinken-weiter-signal-fuer-abebben-der-inflation/29295162.html,0,www.handelsblatt.com,Konjunktur: Erzeugerpreise im Euroraum sinken weiter – Signal für Abebben der Inflation,Die sinkenden Energiekosten haben die Produzentenpreise stärker eingedämmt als erwartet. Diese Entwicklung stellt ein Abflauen der Inflationsrate in Aussicht.,https://www.handelsblatt.com/images/erzeugerpreise/29295294/2-format2003.jpg,2023-08-03T09:08:18Z,,Berlin/Brüssel Die Preise der Hersteller im Euroraum sinken und lassen damit auf ein Nachlassen des Inflationsschubs schließen. Die Produzentenpreise in der Industrie fielen im Juni den zweiten Monat… [+1461 chars],,de,'Energiekosten'
https://www.wiwo.de/politik/konjunktur/konjunktur-erzeugerpreise-im-euroraum-sinken-weiter-signal-fuer-abebben-der-inflation/29295344.html,https://www.wiwo.de/politik/konjunktur/konjunktur-erzeugerpreise-im-euroraum-sinken-weiter-signal-fuer-abebben-der-inflation/29295344.html,0,www.wiwo.de,Konjunktur: Erzeugerpreise im Euroraum sinken weiter – Signal für Abebben der Inflation,Die sinkenden Energiekosten haben die Produzentenpreise stärker eingedämmt als erwartet. Diese Entwicklung stellt ein Abflauen der Inflationsrate in Aussicht.,https://www.wiwo.de/images/erzeugerpreise/29295294/2-format11240.jpg,2023-08-03T09:08:18Z,,Die Preise der Hersteller im Euroraum sinken und lassen damit auf ein Nachlassen des Inflationsschubs schließen. Die Produzentenpreise in der Industrie fielen im Juni den zweiten Monat in Folge und z… [+1447 chars],,de,'Energiekosten'
https://www.zeit.de/news/2023-08/03/russische-angriffe-zielen-auf-ukrainisches-getreide,https://www.zeit.de/news/2023-08/03/russische-angriffe-zielen-auf-ukrainisches-getreide,0,www.zeit.de,Krieg in der Ukraine: Russische Angriffe zielen auf ukrainisches Getreide,,,2023-08-03T09:33:13Z,,"When browsing with ads:
We collect personal data and also transmit it to third-party providers
 that help us improve and finance our digital content. Some of the information stored on your device, … [+821 chars]",,de,'Krieg'
https://taz.de/Forscher-ueber-Zustand-der-Gesellschaft/!5951963/,https://taz.de/Forscher-ueber-Zustand-der-Gesellschaft/!5951963/,0,taz.de,Forscher über Zustand der Gesellschaft: „Die Bevölkerung ist erschöpft“,"Pandemie, Krieg, Klima: Laut Forscher Hurrelmann zeigt die Gesellschaft Symptome einer posttraumatischen Belastungsstörung. Wie kann das überwunden werden?",https://taz.de/picture/6430447/948/33334208-1.jpeg,2023-08-03T16:41:00Z,http://archive.md/20230803173621/https://taz.de/Forscher-ueber-Zustand-der-Gesellschaft/!5951963/,"Pandemie, Krieg, Klima: Laut Forscher Hurrelmann zeigt die Gesellschaft Symptome einer posttraumatischen Belastungsstörung. Wie kann das überwunden werden?
Mit der Klimakrise folgt die nächste Überf… [+9188 chars]",,de,'Angst'
https://www.n-tv.de/politik/22-24-Premier-Schmyhal-Ukraine-gibt-2023-knapp-50-Milliarden-Dollar-fuer-Streitkraefte-aus--article24304607.html,https://www.n-tv.de/politik/22-24-Premier-Schmyhal-Ukraine-gibt-2023-knapp-50-Milliarden-Dollar-fuer-Streitkraefte-aus--article24304607.html,0,www.n-tv.de,Ukraine-Krieg im Liveticker: +++ 22:24 Premier Schmyhal: Ukraine gibt 2023 knapp 50 Milliarden Dollar für Streitkräfte aus +++,Lesen Sie alle aktuellen Entwicklungen und Nachrichten über den russischen Angriffskrieg auf die Ukraine im Liveticker von ntv.de.,https://bilder2.n-tv.de/img/incoming/crop23332537/9041326157-cImg_16_9-w1200/Liveticker1-grau-1-Kopie.jpg,2023-08-03T18:30:00Z,,"Die Ukraine wird im Jahr 2023 rund 48 Milliarden US-Dollar für die Streitkräfte ausgeben. Das sagte der ukrainische Premierminister Denys Schmyhal laut einem Bericht der ukrainischen Zeitung ""Kyiv In… [+66461 chars]",,de,'Krieg'
https://www.kicker.de/auf-der-tribuene-gespuert-dass-unten-angst-herrscht-das-fazit-zum-wm-aus-962116/video,https://www.kicker.de/auf-der-tribuene-gespuert-dass-unten-angst-herrscht-das-fazit-zum-wm-aus-962116/video,0,www.kicker.de,"""Auf der Tribüne gespürt, dass unten Angst herrscht"": Das Fazit zum WM-Aus",Video: Deutschland ist nach dem 1:1 gegen Südkorea im letzten WM-Gruppenspiel ausgeschieden. kicker-Reporter Jim Decker hat die DFB-Elf in Down Under begleitet und zieht ein erstes Fazit.,"https://derivates.kicker.de/image/upload/c_crop,x_0,y_93,w_4000,h_2250/w_1200,q_auto/v1/2023/08/03/8e7a2dd1-985d-4d7b-b58d-87e9be6c66af.jpeg",2023-08-03T18:39:12Z,,"Werbung und Tracking: Um dir relevante Inhalte und personalisierte Werbung anzubieten, setzen wir Cookies und andere Technologien ein. Damit messen wir, wie und womit du unsere Angebote nutzt. Diese … [+2186 chars]",,de,'Angst'
https://www.sueddeutsche.de/projekte/artikel/gesellschaft/fanny-ardant-im-herzen-jung-film-interview-e752930/,https://www.sueddeutsche.de/projekte/artikel/gesellschaft/fanny-ardant-im-herzen-jung-film-interview-e752930/,0,www.sueddeutsche.de,"Interview mit Fanny Ardant: ""Wenn man anfängt, Angst zu haben, ist es vorbei"" / ""Lieber unglücklich als eifersüchtig"" ""Man muss","Der französischen Schauspielerin Fanny Ardant missfällt die Idee, mit Gefühlen zu haushalten. Ein Interview über die große Liebe, Ängste, Autoritäten und darüber, warum eine Frau nie zulassen sollte, dass ihr Partner ihre Eltern trifft.","https://www.sueddeutsche.de/projekte/artikel/gesellschaft/fanny-ardant-im-herzen-jung-film-interview-e752930/8cede617a998b8f9ac1a7afa6ad81ed0a487e0c36f2e489c0f4bf62e8bb52f7c_w2400_h1256_r167,0,3593,1880_oszplus_q70.jpg",2023-08-03T21:32:43Z,http://archive.md/20230804104841/https://www.sueddeutsche.de/projekte/artikel/gesellschaft/fanny-ardant-im-herzen-jung-film-interview-e752930/,"Der französischen Schauspielerin Fanny Ardant missfällt die Idee, mit Gefühlen zu haushalten. Ein Interview über die große Liebe, Ängste, Autoritäten und darüber, warum eine Frau nie zulassen sollte,… [+36 chars]",,de,'Angst'
https://www.n-tv.de/politik/09-53-Video-soll-Explosion-von-Seedrohne-vor-russischem-Stuetzpunkt-zeigen--article23143824.html,https://www.n-tv.de/politik/09-53-Video-soll-Explosion-von-Seedrohne-vor-russischem-Stuetzpunkt-zeigen--article23143824.html,0,www.n-tv.de,Ukraine-Krieg im Liveticker: +++ 09:53 Video soll Explosion von Seedrohne vor russischem Stützpunkt zeigen +++,Lesen Sie alle aktuellen Entwicklungen und Nachrichten über den russischen Angriffskrieg auf die Ukraine im Liveticker von ntv.de.,https://bilder2.n-tv.de/img/incoming/crop23332537/9041326157-cImg_16_9-w1200/Liveticker1-grau-1-Kopie.jpg,2023-08-03T22:01:00Z,,"Russland vereitelt nach eigenen Angaben mehrere ukrainische Angriffe gegen Ziele auf und nahe der annektierten Krim. Zwei Seedrohnen seien vor einem russischen Marinestützpunkt zerstört worden, außer… [+13056 chars]",,de,'Krieg'
https://www.n-tv.de/politik/07-49-Ukraine-kommt-im-Sueden-und-Osten-voran-Minen-verhindern-groessere-Erfolge--article23143824.html,https://www.n-tv.de/politik/07-49-Ukraine-kommt-im-Sueden-und-Osten-voran-Minen-verhindern-groessere-Erfolge--article23143824.html,0,www.n-tv.de,Ukraine-Krieg im Liveticker: +++ 07:49 Ukraine kommt im Süden und Osten voran - Minen verhindern größere Erfolge +++,Lesen Sie alle aktuellen Entwicklungen und Nachrichten über den russischen Angriffskrieg auf die Ukraine im Liveticker von ntv.de.,https://bilder2.n-tv.de/img/incoming/crop23332537/9041326157-cImg_16_9-w1200/Liveticker1-grau-1-Kopie.jpg,2023-08-03T22:01:00Z,,"Der ukrainische Direktor der Planungsabteilung der Nationalgarde, Oberst Mykola Urshalovych, teilt mit, dass die ukrainischen Streitkräfte auf einer Front von 1,5 Kilometern bis zu 650 Meter in Richt… [+9816 chars]",,de,'Krieg'
https://www.n-tv.de/politik/09-08-Russlands-Ruestungsausgaben-explodieren--article23143824.html,https://www.n-tv.de/politik/09-08-Russlands-Ruestungsausgaben-explodieren--article23143824.html,0,www.n-tv.de,Ukraine-Krieg im Liveticker: +++ 08:39 Drohnenbeschuss nahe NATO-Gebiet - London: Russland geht mehr ins Risiko +++,Lesen Sie alle aktuellen Entwicklungen und Nachrichten über den russischen Angriffskrieg auf die Ukraine im Liveticker von ntv.de.,https://bilder2.n-tv.de/img/incoming/crop23332537/9041326157-cImg_16_9-w1200/Liveticker1-grau-1-Kopie.jpg,2023-08-03T22:01:00Z,,"Russland gibt in diesem Jahr weitaus mehr für Rüstung aus als ursprünglich geplant. Wie aus einem Regierungsdokument hervorgeht, das Reuters einsehen konnte, sind für 2023 mehr als 100 Milliarden Dol… [+12068 chars]",,de,'Krieg'
https://www.n-tv.de/politik/14-45-Leontjew-ueber-russische-Rekruten-Maenner-gehen-aus-Geldnot-in-den-Krieg--article23143824.html,https://www.n-tv.de/politik/14-45-Leontjew-ueber-russische-Rekruten-Maenner-gehen-aus-Geldnot-in-den-Krieg--article23143824.html,0,www.n-tv.de,Ukraine-Krieg im Liveticker: +++ 14:45 Leontjew über russische Rekruten: Männer gehen aus Geldnot in den Krieg +++,Lesen Sie alle aktuellen Entwicklungen und Nachrichten über den russischen Angriffskrieg auf die Ukraine im Liveticker von ntv.de.,https://bilder2.n-tv.de/img/incoming/crop23332537/9041326157-cImg_16_9-w1200/Liveticker1-grau-1-Kopie.jpg,2023-08-03T22:01:00Z,,"230.000 Russen melden sich angeblich freiwillig für den Kriegsdienst. ntv-Korrespondent Peter Leontjew erklärt, wie diese Zahl zustande kommen kann, obwohl die Zustimmung zum Krieg in Russland sinkt.… [+21420 chars]",,de,'Ukraine'
