index,url,valid,domain,title,description,image,published,archive,content,quote,language,keyword
https://www.n-tv.de/politik/09-18-Industriestadt-in-der-Ukraine-nach-Angriffen-teils-ohne-Strom--article23143824.html,https://www.n-tv.de/politik/09-18-Industriestadt-in-der-Ukraine-nach-Angriffen-teils-ohne-Strom--article23143824.html,0,www.n-tv.de,Ukraine-Krieg im Liveticker: +++ 09:18 Industriestadt in der Ukraine nach Angriffen teils ohne Strom +++,Lesen Sie alle aktuellen Entwicklungen und Nachrichten über den russischen Angriffskrieg auf die Ukraine im Liveticker von ntv.de.,https://bilder2.n-tv.de/img/incoming/crop23332537/9041326157-cImg_16_9-w1200/Liveticker1-grau-1-Kopie.jpg,2024-02-01T23:30:00Z,,Russland überzieht die Ukraine erneut mit Drohnenangriffen und verursacht damit in der Industriestadt Krywyj Rih einen größeren Stromausfall verursacht. Zehntausende Haushalte und zahlreiche Industri… [+11019 chars],,de,'Krieg'
https://www.morgenpost.de/kultur/tv/article241559464/Der-will-nicht-Strack-Zimmermann-wettert-gegen-Scholz.html,https://www.morgenpost.de/kultur/tv/article241559464/Der-will-nicht-Strack-Zimmermann-wettert-gegen-Scholz.html,0,www.morgenpost.de,„Der will nicht“: Strack-Zimmermann wettert gegen Scholz,"Die Ukraine könnte deutsche Lenkwaffen gebrauchen, doch der Kanzler sagt nein. Die FDP-Verteidigungsexpertin macht ihrem Frust Luft.",https://img.sparknews.funkemedien.de/240815902/240815902_1702554482_v4_3_800.jpeg,2024-02-02T00:11:09Z,,"Berlin. Die Ukraine könnte deutsche Lenkwaffen gebrauchen, doch der Kanzler sagt nein. Die FDP-Verteidigungsexpertin macht ihrem Frust Luft.
Nach fast zwei Jahren Krieg gegen die scheinen die Bestän… [+3042 chars]",,de,'Krieg'
https://www.sueddeutsche.de/politik/israel-krieg-news-liveticker-gaza-rafah-verteidigungsminister-yoav-galant-1.6342083,https://www.sueddeutsche.de/politik/israel-krieg-news-liveticker-gaza-rafah-verteidigungsminister-yoav-galant-1.6342083,0,www.sueddeutsche.de,Krieg in Nahost: Bericht: Israelisches Militär will nach Rafah vorstoßen,"Die Stadt an der Grenze zu Ägypten gilt als Hamas-Hochburg, doch auch viele Zivilisten suchen dort Schutz. Vier Israelis wird vorgeworfen, Gewalt gegen Zivilisten im Westjordanland ausgeübt zu haben. Das israelische Militär soll Hunderte Gebäude im Gazastreif…",https://www.sueddeutsche.de/image/sz.1.6342738/1200x675?v=1706833740,2024-02-02T00:29:00Z,,"In Rafah und Umgebung sollen sich inzwischen mehr als 1,3 Millionen Menschen aufhalten - mehr als die Hälfte der rund 2,2 Millionen Einwohner des Gazastreifens. Sie suchen dort Schutz vor den Kämpfen… [+163 chars]",,de,'Krieg'
https://www.sueddeutsche.de/politik/israel-krieg-news-liveticker-gaza-rafah-1.6342083,https://www.sueddeutsche.de/politik/israel-krieg-news-liveticker-gaza-rafah-1.6342083,0,www.sueddeutsche.de,Krieg in Nahost: Bericht: Israelisches Militär will nach Rafah vorstoßen,"Laut der Zeitung ""Times of Israel"" will Verteidigungsminister Gallant dort ähnlich vorgehen wie in Chan Yunis. In der Stadt an der Grenze zu Ägypten hält sich derzeit über die Hälfte der Bevölkerung des Gazastreifens auf.",https://www.sueddeutsche.de/image/sz.1.6342738/1200x675?v=1706853377,2024-02-02T00:29:00Z,,"Viele von euch hassen uns, einige von euch aber haben uns sogar lieb: Ihr seid rechts, links, doof, klug, divers, tragt Irokese, Burka oder Minirock. Eine Klarstellung für dunkle Tage in Deutschland.",,de,'Krieg'
https://www.bild.de/news/ausland/news-ausland/6-tote-in-der-wueste-drogen-blutbad-wie-in-us-kultserie-breaking-bad-86972290.bild.html,https://www.bild.de/news/ausland/news-ausland/6-tote-in-der-wueste-drogen-blutbad-wie-in-us-kultserie-breaking-bad-86972290.bild.html,0,www.bild.de,Sechs Tote in Mojave-Wüste - Drogen-Massaker wie in Kultserie „Breaking Bad“,"Kartell-Krieg in Kalifornien: Die Polizei entdeckt sechs Leichen, Täter wurden verhaftet.Foto: picture alliance / Mary Evans/AF Archive/Sony Pictu, RV/AP","https://images.bild.de/65b9385bd6777e61fa858e86/2bc0a599e7776fcc2a60c4e154adcf0a,69be53d3?w=1280",2024-02-02T03:37:12Z,,"Los Angeles (USA, Kalifornien) Sechs Tote. Ihre Leichen, verstreut und verrenkt im Staub. Vier der Opfer verbrannt. Acht Feuerwaffen und dutzende Patronenhülsen am Boden. Ein Dodge-Caravan und ein Ch… [+2866 chars]",,de,'Krieg'
https://burgenland.orf.at/stories/3243173/,https://burgenland.orf.at/stories/3243173/,0,burgenland.orf.at,Strom aus Windkraft: Jänner brachte Allzeit-Rekord,"Stromerzeugung durch Windkraftanlagen hat im Winter Hochsaison. Der 25. Jänner war diesbezüglich österreichweit der stärkste Tag aller Zeiten – mit einer produzierten Gesamtenergie von 79 Gigawattstunden (GWh). Geschätzt ein Drittel davon, 28,5 GWh, stammt au…",https://ibs.orf.at/bgl?image=https%3A%2F%2Foekastatic.orf.at%2Fmims%2F2024%2F05%2F07%2Fcrops%2Fw%3D1200%2Ch%3D627%2Cq%3D75%2F2093138_master_790707_240201_bh_windbilanz_00_00_08_00.jpg%3Fs%3D226cd4a1bf7ad8e16482256d5a97daa2a7559513,2024-02-02T04:03:00Z,,"An besagtem 25. Jänner lag der burgenländische Stromverbrauch bei circa 5,5 GWh. Die Stromerzeugung aus burgenländischer Windkraft war an diesem Tag also etwa fünfmal so hoch wie der eigene Verbrauch… [+3285 chars]",,de,'Windkraft'
https://www.faz.net/aktuell/politik/ausland/israel-erwaegt-offenbar-ausweitung-der-kaempfe-auf-rafah-19491320.html,https://www.faz.net/aktuell/politik/ausland/israel-erwaegt-offenbar-ausweitung-der-kaempfe-auf-rafah-19491320.html,0,www.faz.net,Israel erwägt offenbar Ausweitung der Kämpfe auf überfüllte Stadt Rafah,"Mehr als eine Millionen Menschen sind in den äußersten Süden des Gazastreifens geflohen. Nun wird Israels Verteidigungsminister damit zitiert, man werde auch dort die Hamas-Truppen bekämpfen.",https://media1.faz.net/ppmedia/aktuell/1112175751/1.9491325/facebook_teaser/vertriebene-palaestinenser.jpg,2024-02-02T04:42:42Z,,Im Nahen Osten droht sich die hochbrisante Lage zu verschärfen. Während die US-Regierung nach einem tödlichen Angriff proiranischer Milizen auf amerikanische Soldaten in Jordanien Vergeltung ankündig… [+5299 chars],,de,'Kämpfe'
https://www.nzz.ch/international/wie-soziale-netzwerke-im-aethiopien-krieg-zur-waffe-wurden-ld.1776520,https://www.nzz.ch/international/wie-soziale-netzwerke-im-aethiopien-krieg-zur-waffe-wurden-ld.1776520,0,www.nzz.ch,"NZZ FORMAT - Facebooks Afrika-Problem – Ein Dokumentation darüber, wie soziale Netzwerke im Äthiopien-Krieg zur Waffe wurden","Facebook wird immer wieder vorgeworfen, ethnische Spannungen zu schüren. Wie konnte die Plattform, die uns eine vernetzte, offene Welt versprach, zum Werkzeug von Kriegstreibern und Gewalttätern werden?","https://img.nzz.ch/2024/01/30/f9ca6210-db6d-4ef3-ac23-b25e5be199d8.jpeg?width=1200&height=675&fit=bound&quality=75&auto=webp&crop=1920,1080,x0,y0&wmark=nzz",2024-02-02T05:30:00Z,,"Streamen Sie die Dokumentation hier in voller Länge:
Darum geht es in der Doku
Der Tigray-Krieg in Äthiopien zählt zu den schlimmsten Konflikten der Gegenwart. Mehr als eine halbe Million Menschen … [+722 chars]",,de,'Krieg'
https://www.morgenpost.de/politik/article241559756/AfD-Mitarbeiter-soll-Kontakt-zu-Putins-Geheimdienst-haben.html,https://www.morgenpost.de/politik/article241559756/AfD-Mitarbeiter-soll-Kontakt-zu-Putins-Geheimdienst-haben.html,0,www.morgenpost.de,AfD-Mitarbeiter soll Kontakt zu Putins Geheimdienst haben,Steht ein Mitarbeiter der AfD-Bundestagsfraktion im Austausch mit dem FSB? Das legen Medienberichte nahe. Es geht um Waffenlieferungen.,https://img.sparknews.funkemedien.de/241502862/241502862_1706190793_v4_3_800.jpeg,2024-02-02T05:42:00Z,,"San Francisco/Berlin. Steht ein Mitarbeiter der AfD-Bundestagsfraktion im Austausch mit dem FSB? Das legen Medienberichte nahe. Es geht um Waffenlieferungen.
Ein Mitarbeiter des AfD-Bundestagsabgeor… [+4753 chars]",,de,'Krieg'
https://www.dw.com/de/ukraine-hilfe-vorreiterrolle-f%C3%BCr-deutschland-schwierig/a-68145141,https://www.dw.com/de/ukraine-hilfe-vorreiterrolle-f%C3%BCr-deutschland-schwierig/a-68145141,0,www.dw.com,Ukraine-Hilfe: Vorreiterrolle für Deutschland schwierig,Die Chancen für eine vollständige Wiederaufnahme der US-Militärhilfe an die Ukraine schwinden. Daher versprechen die europäischen Länder mehr Unterstützung. Kiew wünscht sich dabei eine deutsche Führung. Ist das möglich?,https://static.dw.com/image/67011440_6.jpg,2024-02-02T05:47:00Z,,"In Russlands Krieg gegen die Ukraine deuten sich bei den Partnern Kiews radikale Veränderungen an. Der Ukraine droht der Verlust ihres wichtigsten Waffenlieferanten USA, denn der Ende 2023 entbrannte… [+8177 chars]",,de,'Ukraine'
https://www.stern.de/politik/ausland/gaza--usa-sehen--gefaehrlichen-moment----israel-plant-einsatz-der-armee-im-sueden-34421998.html,https://www.stern.de/politik/ausland/gaza--usa-sehen--gefaehrlichen-moment----israel-plant-einsatz-der-armee-im-sueden-34421998.html,0,www.stern.de,"Krieg in Nahost: Vergeltung angekündigt: USA sehen ""gefährlichen Moment"" in Nahost – Israel plant Einsatz der Armee im Süden",Die USA haben Vergeltung für den Tod eigener Soldaten in Jordanien angekündigt. Droht eine weitere Eskalation im Nahen Osten? Ein Überblick.,https://image.stern.de/34422006/t/rc/v1/w1440/r1.7778/-/lloyd-austin.jpg,2024-02-02T05:56:00Z,,"Die USA haben Vergeltung für den Tod eigener Soldaten in Jordanien angekündigt. Droht eine weitere Eskalation im Nahen Osten? Ein Überblick.
Im Nahen Osten droht sich die hochbrisante Lage zu versch… [+6259 chars]",,de,'Krieg'
https://www.focus.de/politik/ausland/ukraine-hilfe-vorreiterrolle-fuer-deutschland-schwierig_id_259632102.html,https://www.focus.de/politik/ausland/ukraine-hilfe-vorreiterrolle-fuer-deutschland-schwierig_id_259632102.html,0,www.focus.de,- Ukraine-Hilfe: Vorreiterrolle für Deutschland schwierig,Die Chancen für eine vollständige Wiederaufnahme der US-Militärhilfe an die Ukraine schwinden. Daher versprechen die europäischen Länder mehr Unterstützung. Kiew wünscht sich dabei eine deutsche Führung. Ist das möglich?,https://p6.focus.de/img/fotos/id_259634046/scholz-selenskyj.png?im=Crop%3D%2864%2C0%2C968%2C484%29%3BResize%3D%281200%2C627%29&impolicy=perceptual&quality=mediumHigh&hash=f7912a40b11e3278e16cce9336d38362e300e6fdba20ec971b959ff82ba4196e,2024-02-02T06:15:03Z,,"In Russlands Krieg gegen die Ukraine deuten sich bei den Partnern Kiews radikale Veränderungen an. Der Ukraine droht der Verlust ihres wichtigsten Waffenlieferanten USA, denn der Ende 2023 entbrannte… [+7973 chars]",,de,'Ukraine'
https://www.brigitte.de/leben/wohnen/energiekosten--was-bedeuten-die-zahlen-auf-dem-heizungsregler--10978732.html,https://www.brigitte.de/leben/wohnen/energiekosten--was-bedeuten-die-zahlen-auf-dem-heizungsregler--10978732.html,0,www.brigitte.de,Heizkosten sparen: Das bedeuten die Zahlen auf deinem Heizungsregler wirklich,"Die Heizungsregler-Zahlen scheinen auf den ersten Blick logisch: 1 (kalt) bis 5 (heiß) - oder etwa nicht? Seht im Video, welche Bedeutung sie wirklich haben - und warum euch das viel Geld sparen kann!",https://image.brigitte.de/10978782/t/Jv/v3/w1440/r1.7778/-/heizungteaser.jpg,2024-02-02T06:56:00Z,,"Die Heizungsregler-Zahlen scheinen auf den ersten Blick logisch: 1 (kalt) bis 5 (heiß) - oder etwa nicht? Seht im Video, welche Bedeutung sie wirklich haben - und warum euch das viel Geld sparen kann… [+1929 chars]",,de,'Geld sparen'
https://www.zeit.de/politik/ausland/2024-02/wladimir-putin-ukraine-russland-gaza-5vor8,https://www.zeit.de/politik/ausland/2024-02/wladimir-putin-ukraine-russland-gaza-5vor8,0,www.zeit.de,"Wladimir Putin: Je schlimmer die Verbrechen, desto ""gerechter"" die Sache","Russlands Präsident Wladimir Putin findet, er führe einen ""gerechten Krieg"". Ob in der Ukraine oder in Gaza: Kann das überhaupt eine Kategorie sein?",https://img.zeit.de/politik/ausland/2024-02/krieg/wide__1300x731,2024-02-02T06:56:22Z,,"Jetzt auch
noch gerecht. Wladimir Putin behauptet neuerdings, dass er einen ""gerechten""
Krieg führe. Das sagte er vor Studenten in St. Petersburg, die an der Front gedient
haben: ""Wir machen alles… [+687 chars]",,de,'Ukraine'
https://www.focus.de/politik/ausland/ukraine-krise/kreml-uebernimmt-kontrolle-wagner-gruppe-wird-teil-von-putins-privater-armee_id_259632219.html,https://www.focus.de/politik/ausland/ukraine-krise/kreml-uebernimmt-kontrolle-wagner-gruppe-wird-teil-von-putins-privater-armee_id_259632219.html,0,www.focus.de,Kreml übernimmt Kontrolle - Wagner-Gruppe wird Teil von Putins „privater Armee“,Ex-Wagner Söldner könnten bald wieder in der Ukraine im Einsatz sein - diesmal unter Führung von Russlands Nationalgarde. Diese ist Putin direkt unterstellt.,https://p6.focus.de/img/fotos/id_197382833/imago0261481254h.jpg?im=Crop%3D%280%2C289%2C3462%2C1731%29%3BResize%3D%281200%2C627%29&impolicy=perceptual&quality=mediumHigh&hash=ddc9d4d3b776c8c2d8ab366a492046d138f7fe18008707db0d878fc22552ffd2,2024-02-02T07:18:31Z,,Ex-Wagner Söldner könnten bald wieder in der Ukraine im Einsatz sein - diesmal unter Führung von Russlands Nationalgarde. Diese ist Putin direkt unterstellt.Laut westlicher Geheimdienste bereitet Rus… [+1724 chars],,de,'Putin'
https://www.ifun.de/eufy-s330-neue-ueberwachungskamera-mit-solar-und-4g-lte-226904/,https://www.ifun.de/eufy-s330-neue-ueberwachungskamera-mit-solar-und-4g-lte-226904/,0,www.ifun.de,Eufy S330 4G: Überwachungskamera mit Solar und LTE,"Die Anker-Marke Eufy baut ihr Angebot an Überwachungskameras mit 4G-Konnektivität weiter aus und lässt auf die 4G-Kamera S230, die ebenfalls im Set mit einem Solarmodul erhältlich ist, jetzt die 4G-Kamera S330 folgen. Während die S230 aktuell zum Angebotsprei…",https://images.ifun.de/wp-content/uploads/2024/02/4g-kamera-s330.jpg,2024-02-02T08:09:16Z,,"Die Anker-Marke Eufy baut ihr Angebot an Überwachungskameras mit 4G-Konnektivität weiter aus und lässt auf die 4G-Kamera S230, die ebenfalls im Set mit einem Solarmodul erhältlich ist, jetzt die 4G-K… [+1651 chars]",,de,'Solar'
https://www.diepresse.com/18056655/jose-faleros-supermarkt-von-regalschlichtern-zu-drogendealern,https://www.diepresse.com/18056655/jose-faleros-supermarkt-von-regalschlichtern-zu-drogendealern,0,www.diepresse.com,José Faleros „Supermarkt“: Von Regalschlichtern zu Drogendealern,"Zwei Regalschlichtern reicht es, dass sie mit ihrem Gehalt nicht über die Runden kommen. José Faleros „Supermarkt“ ist ein Roman über Armut, Abwege und gewitzte Helden.",https://img.diepresse.com/public/incoming/4vbb4d-Falero_Supermarkt-Josemar-Afrovulto.jpg/alternates/DPR_SOCIAL_MAGAZIN/Falero_Supermarkt%20Josemar%20Afrovulto.jpg,2024-02-02T09:03:42Z,,"Zwei Regalschlichtern reicht es, dass sie mit ihrem Gehalt nicht über die Runden kommen. José Faleros Supermarkt ist ein Roman über Armut, Abwege und gewitzte Helden. 
Manche Helden sind Verbrecher,… [+3174 chars]",,de,'Armut'
https://www.welt.de/regionales/hamburg/article249871068/Offshore-Windkraft-An-den-Engpaessen-in-den-Haefen-koennten-Deutschlands-Energieplaene-auf-See-scheitern.html,https://www.welt.de/regionales/hamburg/article249871068/Offshore-Windkraft-An-den-Engpaessen-in-den-Haefen-koennten-Deutschlands-Energieplaene-auf-See-scheitern.html,0,www.welt.de,An den Engpässen in den Häfen könnten Deutschlands Energiepläne auf See scheitern,"Der jährliche Ausbaubedarf für Offshore-Windkraft steigt bis 2030 auf durchschnittlich drei Gigawatt an. Die Küstenländer machen deswegen Druck beim Bund, sie wollen verlässliche Finanzierungszusagen. Denn um die Ausbauziele umsetzen zu können, braucht Deutsc…",https://img.welt.de/img/regionales/hamburg/mobile249871066/8321359697-ci16x9-w1200/Siemens-Gamesa-Renewable-Energy-Werk-Cuxhaven.jpg,2024-02-02T10:16:42Z,,"Die Küstenländer wollen einen schnellen Ausbau von Hafenflächen erreichen, damit Deutschland seine Pläne zum Ausbau der Offshore-Windkraft verwirklichen kann. In einer gemeinsamen Erklärung fordern L… [+4307 chars]",,de,'Windkraft'
https://www.brigitte.de/aktuell/buzz/fuehrerschein--warum-autofahrer-diese-markierung-unbedingt-kennen-sollten-13765764.html,https://www.brigitte.de/aktuell/buzz/fuehrerschein--warum-autofahrer-diese-markierung-unbedingt-kennen-sollten-13765764.html,0,www.brigitte.de,Führerschein: Warum du diese Markierung unbedingt kennen solltest,"Autofahrer:innen aufgepasst: Wenn du weißt was dieses Symbol im Straßenverkehr für eine wichtige Bedeutung hat, kannst du bares Geld sparen. Im Video verraten wir dir wieso!",https://image.brigitte.de/13765762/t/Im/v1/w1440/r1.7778/-/fueherschein-autofahrer-markierung.jpg,2024-02-02T14:38:00Z,,"Autofahrer:innen aufgepasst: Wenn du weißt was dieses Symbol im Straßenverkehr für eine wichtige Bedeutung hat, kannst du bares Geld sparen. Im Video verraten wir dir wieso!
Es gibt zahlreiche Verke… [+575 chars]",,de,'Geld sparen'
https://www.focus.de/finanzen/news/anhaltend-hoehere-gaspreise-biden-dreht-ploetzlich-den-gashahn-zu-was-das-fuer-deutschland-bedeutet_id_259632935.html,https://www.focus.de/finanzen/news/anhaltend-hoehere-gaspreise-biden-dreht-ploetzlich-den-gashahn-zu-was-das-fuer-deutschland-bedeutet_id_259632935.html,0,www.focus.de,"„Anhaltend höhere Gaspreise"" - Biden dreht plötzlich den Gashahn zu – was das für Deutschland bedeutet",Die USA haben neue Exporte von Flüssiggas (LNG) vorerst auf Eis gelegt. Deutschland setzt stark auf die LNG-Lieferungen aus den Staaten. Das Wirtschaftsministerium beobachte „die Lage genau“. Auf Verbraucher und Unternehmen könnten höhere Gaspreise zukommen.V…,https://p6.focus.de/img/regional/niedersachsen/id_259510842/das-mit-verfluessigtem-erdgas-beladene-tankschiff-maria-energy-hinten-liegt-am-schwimmenden-lng-terminal..jpg?im=Crop%3D%280%2C170%2C2048%2C1024%29%3BResize%3D%281200%2C627%29&impolicy=perceptual&quality=mediumHigh&hash=bd969c4f85b2f8906de8c258f5046a880cd2fb84cf9555ac1c24d40f17f37633,2024-02-02T14:41:12Z,,Die USA haben geplante Exportegenehmigungen von Flüssiggas (LNG) vorerst auf Eis gelegt. Deutschland setzt stark auf die LNG-Lieferungen aus den Staaten. Das Wirtschaftsministerium beobachte die Lage… [+5571 chars],,de,'Gas'
https://www.zeit.de/politik/ausland/2024-02/ukraine-lage-walerij-saluschnyj-wolodymyr-selenskyj-eu-woche,https://www.zeit.de/politik/ausland/2024-02/ukraine-lage-walerij-saluschnyj-wolodymyr-selenskyj-eu-woche,0,www.zeit.de,"Lage in der Ukraine: General Saluschnyj taumelt, EU sichert ukrainische Finanzen",In der Ukraine könnte bald die folgenschwerste Personalentscheidung seit Kriegsbeginn fallen. Die EU-Länder setzen unterdessen ein wichtiges Zeichen. Der Wochenrückblick,https://img.zeit.de/politik/ausland/2024-02/ukraine-lage-walerij-saluschnyj-wolodymyr-selenskyj-eu-woche-bild-2/wide__1300x731,2024-02-02T14:43:13Z,,"Im neuen Ukraine-Wochenrückblick von ZEIT ONLINE ordnen wir die wichtigste Nachricht der vergangenen Tage ein, fassen weitere wichtige Themen zusammen, präsentieren die Woche in Bildern und blicken a… [+16447 chars]",,de,'Krieg'
https://www.zeit.de/politik/ausland/2024-02/russland-oleg-orlow-memorial-auslandsagent,https://www.zeit.de/politik/ausland/2024-02/russland-oleg-orlow-memorial-auslandsagent,0,www.zeit.de,"Menschenrechtsorganisation Memorial: Russland stuft Bürgerrechtler Orlow als ""ausländischen Agenten"" ein","Mehr als 30 Jahre lang hatte die russische NGO Memorial sowjetische Verbrechen dokumentiert. Ihr Co-Vorsitzender Oleg Orlow wurde jetzt zum ""Auslandsagenten"" erklärt.",https://img.zeit.de/politik/ausland/2024-02/oleg-orlow-memorial-bild/wide__1300x731,2024-02-02T21:16:39Z,,"Russland hat den Menschenrechtsaktivisten Oleg Orlow als ""ausländischen Agenten"" eingestuft. Das russische Justizministerium erklärte, Orlow habe sich ""gegen die spezielle Militäroperation in der Ukr… [+2889 chars]",,de,'Russland'
https://www.focus.de/finanzen/news/energie-mehrwertsteuersenkung-bei-gas-koennte-ende-maerz-auslaufen_id_259635710.html,https://www.focus.de/finanzen/news/energie-mehrwertsteuersenkung-bei-gas-koennte-ende-maerz-auslaufen_id_259635710.html,0,www.focus.de,Energie - Mehrwertsteuersenkung bei Gas könnte Ende März auslaufen,Eigentlich soll ab Anfang März wieder der normale Mehrwertsteuersatz beim Gas gelten. Doch ein entsprechendes Gesetz hängt fest - zum Vorteil der Verbraucher?,https://p6.focus.de/img/finanzen/news/id_259635709/wegen-der-gestiegenen-energiepreise-nach-dem-russischen-angriff-auf-die-ukraine-hatte-die-bundesregierung-den-mehrwertsteuersatz-fuer-gas-und-waerme-gesenkt..jpg?im=Crop%3D%280%2C170%2C2048%2C1024%29%3BResize%3D%281200%2C627%29&impolicy=perceptual&quality=mediumHigh&hash=d9b29c2b945e21fbc6e398920bdbd87d67fc72bfc4023206e1a8d8944c6f21db,2024-02-03T04:50:04Z,,"Verbraucher können darauf hoffen, dass die Mehrwertsteuersenkung bei Gas doch erst Ende März ausläuft - und nicht Ende Februar. Aus der SPD kamen vor dem Hintergrund von Verhandlungen zwischen Bundes… [+4257 chars]",,de,'Gas'
https://www.welt.de/politik/ausland/plus249879494/Taktische-Atomwaffen-Wie-Putin-seinen-Nuklear-Vorteil-ausnutzt.html,https://www.welt.de/politik/ausland/plus249879494/Taktische-Atomwaffen-Wie-Putin-seinen-Nuklear-Vorteil-ausnutzt.html,0,www.welt.de,„Rückkehr der Angst“ – Wie Putin seinen Nuklear-Vorteil ausnutzt,"Russland verfügt über bis zu 3500 taktische Atomsprengköpfe. Ein führender Nuklearexperte sieht Anzeichen dafür, dass Putins Bereitschaft, solche Waffen einzusetzen, größer wird. Auch, weil der Westen im Abschreckungsrennen in Rückstand geraten ist – mit dram…",https://img.welt.de/img/politik/ausland/mobile249879520/3081356097-ci16x9-w1200-fnov-fpotl-fpi157750653/DWO-Teaser-Putin-Atomwaffen-cg-jpg.jpg,2024-02-03T09:51:01Z,,"Die WELT als ePaper: Die vollständige Ausgabe steht Ihnen bereits am Vorabend zur Verfügung so sind Sie immer hochaktuell informiert. Weitere Informationen: http://epaper.welt.de 
 Der Kurz-Link die… [+49 chars]",,de,'Putin'
https://www.n-tv.de/mediathek/videos/panorama/Tesla-stuerzt-ins-Wasser-und-sinkt-vor-Sauna-article24710297.html,https://www.n-tv.de/mediathek/videos/panorama/Tesla-stuerzt-ins-Wasser-und-sinkt-vor-Sauna-article24710297.html,0,www.n-tv.de,Fahrer gibt versehentlich Gas: Tesla stürzt ins Wasser - und sinkt vor Sauna,An einem Pier in Norwegens Hauptstadt Oslo gibt der Fahrer eines Tesla im falschen Moment versehentlich Gas - und landet samt Mitfahrer im Wasser. Beide retten sich auf das Dach des sinkenden Wagens - in letzter Sekunde kommt eine schwimmende Sauna zu Hilfe.,https://bilder4.n-tv.de/img/incoming/crop24710311/1071323175-cImg_16_9-w1200/Tesla.jpg,2024-02-03T10:37:09Z,,,,de,'Gas'
https://www.morgenpost.de/ratgeber/article241488722/heizung-austauschpflicht-gasheizung-verbot-hausbesitzer.html,https://www.morgenpost.de/ratgeber/article241488722/heizung-austauschpflicht-gasheizung-verbot-hausbesitzer.html,0,www.morgenpost.de,Diese Öl- und Gasheizungen dürfen 2024 weiterlaufen,Für eine alte Heizung kann die Austauschpflicht gelten. Welche Öl- und Gasheizungen sind betroffen? Eine Expertin beantwortet essentielle Fragen.,,2024-02-03T12:07:00Z,,"Berlin. Für eine alte Heizung kann die Austauschpflicht gelten. Über Ausnahmen, Kontrollen und Bußgeld haben wir mit einer Expertin gesprochen.
<ul><li>Seit dem 1. Januar 2023 setzt Deutschland neue… [+6937 chars]",,de,'Gas'
https://www.morgenpost.de/ratgeber/article241534196/gasheizung-heizung-biogas-oelheizung-waermepumpe-hausbesitzer.html,https://www.morgenpost.de/ratgeber/article241534196/gasheizung-heizung-biogas-oelheizung-waermepumpe-hausbesitzer.html,0,www.morgenpost.de,Gasheizung mit Biogas? Experten warnen vor teurem Fallstrick,Viel wird aktuell an Biobrennstoffen geforscht. Wie realistisch ist in Zukunft der Einsatz von Bioöl und -gas? Zwei Experten ordnen ein.,https://img.sparknews.funkemedien.de/238152957/238152957_1702304948_v4_3_800.jpeg,2024-02-03T13:12:00Z,,"Berlin. Eine Heizung mit Biogas oder -öl statt Wärmepumpe und Co.? Wir haben zwei Experten gefragt, wie realistisch die Alternativen sind.
<ul><li>Wie sieht die Heizung der Zukunft aus? Fest steht: … [+10126 chars]",,de,'Gas'
https://oe3.orf.at/sendungen/stories/3039026/,https://oe3.orf.at/sendungen/stories/3039026/,0,oe3.orf.at,David Scheid a.k.a. Dave legt auf Ö3 auf,<ul><li>David Scheid a.k.a. Dave ist am Montagabend zu Gast im Treffpunkt Gästeliste auf Ö3.</li><li>Zwei Stunden lang legt er für die Ö3-Gemeinde seine ganz persönlichen Lieblingssongs auf.</li><li>Zugleich erzählt er knackige Anekdoten aus seinem Leben und …,https://tubestatic.orf.at/static/images/site/tube/2024015/dave_01.6008483.jpg,2024-02-03T14:52:00Z,,<ul><li>David Scheid a.k.a. Dave ist am Montagabend zu Gast im Treffpunkt Gästeliste auf Ö3.</li><li>Zwei Stunden lang legt er für die Ö3-Gemeinde seine ganz persönlichen Lieblingssongs auf.</li><li>… [+2847 chars],,de,'Gas'
https://www.tagesschau.de/ausland/europa/demonstration-moskau-ukraine-100.html,https://www.tagesschau.de/ausland/europa/demonstration-moskau-ukraine-100.html,0,www.tagesschau.de,Festnahmen bei Protest gegen Ukraine-Krieg in Moskau,"Erneut haben Angehörige von Soldaten, die im Krieg gegen die Ukraine kämpfen, in Moskau für ein Ende des Krieges demonstriert. Dabei wurden Berichten zufolge mindestens 27 Menschen vorläufig festgenommen - es soll sich um Journalisten handeln.",https://images.tagesschau.de/image/444a97be-165c-4155-81b7-64e44156300e/AAABjW-q5No/AAABibBxqrQ/16x9-1280/protest-moskau-102.jpg,2024-02-03T15:51:27Z,,"Stand: 03.02.2024 16:51 Uhr
Erneut haben Angehörige von Soldaten, die im Krieg gegen die Ukraine kämpfen, in Moskau für ein Ende des Krieges demonstriert. Dabei wurden Berichten zufolge mindestens 2… [+3138 chars]",,de,'Putin'
