index,url,valid,domain,title,description,image,published,archive,content,quote,language,keyword
https://www.tagesschau.de/wirtschaft/finanzen/marktberichte/marktbericht-dax-dow-geldanlage-aktien-108.html,https://www.tagesschau.de/wirtschaft/finanzen/marktberichte/marktbericht-dax-dow-geldanlage-aktien-108.html,0,www.tagesschau.de,Marktbericht: Bleibt der DAX in Rekordlaune?,Starke Vorgaben aus den USA könnten den DAX über sein jüngstes Rekordhoch bei 24.609 Punkten hinaustreiben. Die Hoffnung auf Zinssenkungen in den USA lässt die Risikofreude der Investoren steigen.,https://images.tagesschau.de/image/71ccf8f7-a204-47b0-93a7-b13b3394b0c8/AAABleqLn9k/AAABkZLlo-k/16x9-big/dax-226.jpg?width=1280,2025-07-10T05:34:04Z,,"Stand: 10.07.2025 07:34 Uhr
Starke Vorgaben aus den USA könnten den DAX über sein jüngstes Rekordhoch bei 24.609 Punkten hinaustreiben. Die Hoffnung auf Zinssenkungen in den USA lässt die Risikofreu… [+4178 chars]",,de,'Risiko'
https://www.stern.de/wirtschaft/news/niedrigster-stand-seit-herbst--entlastung-fuer-verbraucher--inflation-sinkt-auf-2-0-prozent-35882204.html,https://www.stern.de/wirtschaft/news/niedrigster-stand-seit-herbst--entlastung-fuer-verbraucher--inflation-sinkt-auf-2-0-prozent-35882204.html,0,www.stern.de,"Niedrigster Stand seit Herbst: Entlastung für Verbraucher: Inflation sinkt auf 2,0 Prozent",Bei der Teuerungsrate geht es weiter nach unten. Das ist eine gute Nachricht für Deutschlands Verbraucherinnen und Verbraucher. Entwarnung auf ganzer Linie wollen Volkswirte aber nicht geben.,https://image.stern.de/35882206/t/Zk/v1/w1440/r1.7778/-/10--ojoall5evev1axs2048jpeg---8312bf563b53016f.jpg,2025-07-10T06:22:03Z,,"Kopiere den aktuellen Link
Zur Merkliste hinzufügen
Bei der Teuerungsrate geht es weiter nach unten. Das ist eine gute Nachricht für Deutschlands Verbraucherinnen und Verbraucher. Entwarnung auf ga… [+1829 chars]",,de,'Inflation'
https://www.zeit.de/news/2025-07/10/eu-israel-akzeptiert-mehr-hilfe-fuer-gazastreifen,https://www.zeit.de/news/2025-07/10/eu-israel-akzeptiert-mehr-hilfe-fuer-gazastreifen,0,www.zeit.de,Krieg: EU: Israel akzeptiert mehr Hilfe für Gazastreifen,Hier finden Sie Informationen zu dem Thema „Krieg“. Lesen Sie jetzt „EU: Israel akzeptiert mehr Hilfe für Gazastreifen“.,https://img.zeit.de/administratives/sharing/fallback-image-die-zeit/wide__1300x731,2025-07-10T11:33:38Z,,"Israel hat nach Angaben der EU einer Vereinbarung für eine bessere Versorgung der notleidenden Zivilbevölkerung im Gazastreifen zugestimmt. Wie die EU-Außenbeauftragte Kaja Kallas mitteilte, geht es … [+177 chars]",,de,'Krieg'
https://www.zeit.de/politik/ausland/2025-07/ukraine-wiederaufbau-konferenz-rom-hilfspaket-merz-trump,https://www.zeit.de/politik/ausland/2025-07/ukraine-wiederaufbau-konferenz-rom-hilfspaket-merz-trump,0,www.zeit.de,Ukraine-Wiederaufbaukonferenz: Europa bekräftigt Unterstützung für die Ukraine,Auf einer Konferenz für die Ukraine hat die EU ein milliardenschweres Hilfspaket angekündigt. Kanzler Friedrich Merz wandte sich mit einem Appell direkt an Donald Trump.,https://img.zeit.de/administratives/sharing/fallback-image-die-zeit/wide__1300x731,2025-07-10T12:26:00Z,,Die europäischen Verbündeten der Ukraine haben auf einer Wiederaufbaukonferenz in Rom ihre Unterstützung für das angegriffene Land bekräftigt. So kündigte die Europäische Union ein neues Finanzpaket … [+1028 chars],,de,'Ukraine'
https://www.welt.de/politik/ausland/article256380348/Russischer-Angriffskrieg-Berlin-will-von-Washington-zwei-Patriot-Systeme-fuer-die-Ukraine-kaufen.html,https://www.welt.de/politik/ausland/article256380348/Russischer-Angriffskrieg-Berlin-will-von-Washington-zwei-Patriot-Systeme-fuer-die-Ukraine-kaufen.html,0,www.welt.de,Berlin will von Washington zwei Patriot-Systeme für die Ukraine kaufen,"In Rom findet die vierte Konferenz für den Wiederaufbau der angegriffenen Ukraine statt. Russland sorgt derweil mit seinen verstärkten Luftschlägen für „ein Ausmaß an Leid, das wir in mehr drei Jahren noch nicht gesehen haben“, beklagen die UN. Deutschland wi…",https://images.welt.de/686f977bac61ad562eaf5bc0/79b817f7d70d80a0ca4686c6398f1d2e-master/ci16x9-w1200/selenskyj-vor-einem-flugabwehrsystem,2025-07-10T12:51:05Z,,Der Wiederaufbau der Ukraine wird nach Schätzungen aus Kiew umgerechnet mehr als 850 Milliarden Euro über einen Zeitraum von 14 Jahren kosten. Unsere Konzeption sieht die Schaffung von zwei Fonds in … [+5377 chars],,de,'Ukraine'
https://www.welt.de/politik/ausland/article256380348/Krieg-in-der-Ukraine-Juni-war-toedlichster-Monat-fuer-Zivilisten-seit-Kriegsbeginn.html,https://www.welt.de/politik/ausland/article256380348/Krieg-in-der-Ukraine-Juni-war-toedlichster-Monat-fuer-Zivilisten-seit-Kriegsbeginn.html,0,www.welt.de,Juni war tödlichster Monat für ukrainische Zivilisten seit Kriegsbeginn,"Russland sorgt mit seinen verstärkten Luftschlägen gegen die Ukraine für „ein Ausmaß an Leid, das wir in mehr drei Jahren noch nicht gesehen haben“, beklagen die UN. In Rom beginnt derweil die vierte Konferenz für den Wiederaufbau des angegriffenen Landes.",https://images.welt.de/686f977bac61ad562eaf5bc0/401f150434ce2015572ad24713e4d587-master/ci16x9-w1200/russia-hits-ukraine-with-wave-of-drone-and-missile-attack,2025-07-10T12:51:05Z,,"Russland sorgt mit seinen verstärkten Luftschlägen gegen die Ukraine für ein Ausmaß an Leid, das wir in mehr drei Jahren noch nicht gesehen haben, beklagen die UN. In Rom beginnt derweil die vierte K… [+4729 chars]",,de,'Russland'
https://www.welt.de/politik/ausland/article256380348/Russischer-Angriffskrieg-Ukraine-schaetzt-Kosten-fuer-Wiederaufbau-auf-mehr-als-850-Milliarden-Euro.html,https://www.welt.de/politik/ausland/article256380348/Russischer-Angriffskrieg-Ukraine-schaetzt-Kosten-fuer-Wiederaufbau-auf-mehr-als-850-Milliarden-Euro.html,0,www.welt.de,Ukraine schätzt Kosten für Wiederaufbau auf mehr als 850 Milliarden Euro,"In Rom findet die vierte Konferenz für den Wiederaufbau der angegriffenen Ukraine statt. Russland sorgt derweil mit seinen verstärkten Luftschlägen für „ein Ausmaß an Leid, das wir in mehr drei Jahren noch nicht gesehen haben“, beklagen die UN.",https://images.welt.de/686f977bac61ad562eaf5bc0/401f150434ce2015572ad24713e4d587-master/ci16x9-w1200/russia-hits-ukraine-with-wave-of-drone-and-missile-attack,2025-07-10T12:51:05Z,,"In Rom findet die vierte Konferenz für den Wiederaufbau der angegriffenen Ukraine statt. Russland sorgt derweil mit seinen verstärkten Luftschlägen für ein Ausmaß an Leid, das wir in mehr drei Jahren… [+4742 chars]",,de,'Russland'
https://www.n-tv.de/politik/KfW-richtet-Ukraine-Fonds-ein-Selenskyj-appelliert-an-Partner-article25892702.html,https://www.n-tv.de/politik/KfW-richtet-Ukraine-Fonds-ein-Selenskyj-appelliert-an-Partner-article25892702.html,0,www.n-tv.de,Wiederaufbaukonferenz in Rom: KfW richtet Ukraine-Fonds ein - Selenskyj appelliert an Partner,In Rom findet eine Konferenz zur Unterstützung der Ukraine statt. Zahlreiche Staatschefs sind geladen - darunter der ukrainische Präsident Selenskyj. Er fordert auch angesichts der schweren russischen Luftangriffe mehr Unterstützung für sein Land. Die Förderb…,https://www.n-tv.de/img/incoming/crop25892795/7741325573-cImg_16_9-w1200/535417658.jpg,2025-07-10T12:52:09Z,,In Rom findet eine Konferenz zur Unterstützung der Ukraine statt. Zahlreiche Staatschefs sind geladen - darunter der ukrainische Präsident Selenskyj. Er fordert auch angesichts der schweren russische… [+3831 chars],,de,'Ukraine'
https://www.tagesspiegel.de/internationales/frustriert-von-putin-trump-erwagt-zustimmung-zu-mega-sanktionspaket-gegen-moskau-14003423.html,https://www.tagesspiegel.de/internationales/frustriert-von-putin-trump-erwagt-zustimmung-zu-mega-sanktionspaket-gegen-moskau-14003423.html,0,www.tagesspiegel.de,Frustriert von Putin: Trump erwägt Zustimmung zu Mega-Sanktionspaket gegen Moskau,"Trump ist offenbar zunehmend verärgert darüber, dass Putin die Friedensbemühungen des US-Präsidenten torpediert. Stimmt er nun einem großen Sanktionspaket gegen Russland zu?",https://www.tagesspiegel.de/images/14003483/alternates/BASE_16_9_W1400/1752152225000/us-africa-politics-diplomacy-trump.jpeg,2025-07-10T13:03:07Z,,"Lange hat der US-Präsident offen gelassen, ob er weiteren Sanktionen gegen Russland zustimmen wird. Nun gibt es laut einem Bericht der US-Nachrichtenseite Politico Bewegung in der Sache. Der Grund: T… [+1506 chars]",,de,'Putin'
https://www.tagesspiegel.de/internationales/datenanalyse-zeigt-im-jetzigen-tempo-braucht-russland-noch-90-jahre-fur-die-eroberung-der-ukraine-14003324.html,https://www.tagesspiegel.de/internationales/datenanalyse-zeigt-im-jetzigen-tempo-braucht-russland-noch-90-jahre-fur-die-eroberung-der-ukraine-14003324.html,0,www.tagesspiegel.de,Datenanalyse zeigt: Im jetzigen Tempo braucht Russland noch 90 Jahre für die Eroberung der Ukraine,„The Economist“ veröffentlicht neue Daten zum Ukrainekrieg. Russland hat demnach seine blutigste Offensive gestartet – und kommt trotzdem nur langsam voran.,https://www.tagesspiegel.de/images/14003384/alternates/BASE_16_9_W1400/1752151795000/ukraine-krieg.jpeg,2025-07-10T13:09:51Z,,Anhand von NASA-Satellitenbildern und unterschiedlichen Schätzungen erhebt das britische Magazin The Economist Daten zum Ukrainekrieg. Es geht um Verluste und Eroberungen. Demnach kamen seit Beginn d… [+1416 chars],,de,'Russland'
https://www.morgenpost.de/politik/article409478720/spielt-trump-mit-merz-schmiedet-luftverteidigungsplan-fuer-kiew.html,https://www.morgenpost.de/politik/article409478720/spielt-trump-mit-merz-schmiedet-luftverteidigungsplan-fuer-kiew.html,0,www.morgenpost.de,Spielt Trump mit? Merz schmiedet Luftverteidigungsplan für Kiew,Putins Luftangriffe auf die Ukraine sind heftig wie nie. Der Kanzler will etwas dagegen tun – hilft ihm ein Stimmungswechsel von Trump?,https://img.sparknews.funkemedien.de/409480548/409480548_1752153570_v16_9_1600.jpeg,2025-07-10T13:15:00Z,,"Rom. Putins Luftangriffe auf die Ukraine sind heftig wie nie. Der Kanzler will etwas dagegen tun hilft ihm ein Stimmungswechsel von Trump?
Auf 506 Milliarden Euro werden derzeit die Schäden in der U… [+5987 chars]",,de,'Putin'
https://www.bild.de/politik/ausland-und-internationales/kiew-unbekannter-erschiesst-geheimdienst-offizier-auf-offener-strasse-686f9bd9d1592e395c9d6b8c,https://www.bild.de/politik/ausland-und-internationales/kiew-unbekannter-erschiesst-geheimdienst-offizier-auf-offener-strasse-686f9bd9d1592e395c9d6b8c,0,www.bild.de,Steckt Putin dahinter? - Hoher Geheimdienst-Offizier in Kiew erschossen,In Kiew wurde ein hoher Offizier des ukrainischen Geheimdienstes SBU auf offener Straße erschossen. Die Ermittlungen laufen.,"https://images.bild.de/686f9bd9d1592e395c9d6b8c/139bfd3c7309fc044cd281496df9045c,a45cb6d8?w=1280",2025-07-10T13:15:40Z,,"Kiew Erschossen auf offener Straße! Unbekannte haben in Kiew einen hohen Offizier des ukrainischen Geheimdienstes getötet. Noch ist unklar, wer dahintersteckt.
Nach einem Bericht von BBC Ukraine hat… [+1392 chars]",,de,'Putin'
https://www.tagesspiegel.de/internationales/schlingerkurs-des-us-prasidenten-was-europaische-offizielle-hinter-den-kulissen-uber-trumps-ukraine-politik-sagen-14003654.html,https://www.tagesspiegel.de/internationales/schlingerkurs-des-us-prasidenten-was-europaische-offizielle-hinter-den-kulissen-uber-trumps-ukraine-politik-sagen-14003654.html,0,www.tagesspiegel.de,Schlingerkurs des US-Präsidenten: Was europäische Offizielle hinter den Kulissen über Trumps Ukraine-Politik sagen,Aus den USA kommen zunehmend russland-kritische Signale. Doch in Europa mag man dem möglichen Sinneswandel in Washington nicht glauben. Zu erratisch war der Kurs im Ukraine-Krieg bisher.,https://www.tagesspiegel.de/images/14003648/alternates/BASE_16_9_W1400/1752153281000/u-s-president-trump-expected-to-sign-the-one-big-beautiful-bill-act-at-the-white-house.jpeg,2025-07-10T13:15:51Z,,"Donald Trump hat in den vergangenen Tagen die Rhetorik gegenüber dem russischen Präsidenten Wladimir Putin deutlich verschärft. Bullshit, würde der Kremlherrscher reden, schimpfte Trump. Die Telefona… [+4326 chars]",,de,'Ukraine'
https://www.tagesspiegel.de/internationales/macht-der-us-prasident-gegen-putin-jetzt-ernst-europas-ukraine-unterstutzer-zweifeln-an-den-harten-worten-trumps-14003654.html,https://www.tagesspiegel.de/internationales/macht-der-us-prasident-gegen-putin-jetzt-ernst-europas-ukraine-unterstutzer-zweifeln-an-den-harten-worten-trumps-14003654.html,0,www.tagesspiegel.de,Macht der US-Präsident gegen Putin jetzt ernst? : Europas Ukraine-Unterstützer zweifeln an den harten Worten Trumps,Aus den USA kommen zunehmend russland-kritische Signale. Doch in Europa mag man dem möglichen Sinneswandel in Washington nicht glauben. Zu erratisch war der Kurs im Ukraine-Krieg bisher.,https://www.tagesspiegel.de/images/14003648/alternates/BASE_16_9_W1400/1752153281000/u-s-president-trump-expected-to-sign-the-one-big-beautiful-bill-act-at-the-white-house.jpeg,2025-07-10T13:15:51Z,,"Donald Trump hat in den vergangenen Tagen die Rhetorik gegenüber dem russischen Präsidenten Wladimir Putin deutlich verschärft. Bullshit, würde der Kremlherrscher reden, schimpfte Trump. Die Telefona… [+4326 chars]",,de,'Ukraine'
https://www.tagesspiegel.de/internationales/macht-trump-gegen-putin-jetzt-wirklich-ernst-total-chaotisch--europas-ukraine-unterstutzer-verzweifeln-am-schlingerkurs-der-usa-14003654.html,https://www.tagesspiegel.de/internationales/macht-trump-gegen-putin-jetzt-wirklich-ernst-total-chaotisch--europas-ukraine-unterstutzer-verzweifeln-am-schlingerkurs-der-usa-14003654.html,0,www.tagesspiegel.de,Macht Trump gegen Putin jetzt wirklich ernst? : „Total chaotisch“ – Europas Ukraine-Unterstützer verzweifeln am Schlingerkurs der USA,Aus den USA kommen zunehmend russland-kritische Signale. Doch in Europa mag man dem möglichen Sinneswandel in Washington nicht glauben. Zu erratisch war der Kurs im Ukraine-Krieg bisher.,https://www.tagesspiegel.de/images/14003648/alternates/BASE_16_9_W1400/1752153281000/u-s-president-trump-expected-to-sign-the-one-big-beautiful-bill-act-at-the-white-house.jpeg,2025-07-10T13:15:51Z,,"Donald Trump hat in den vergangenen Tagen die Rhetorik gegenüber dem russischen Präsidenten Wladimir Putin deutlich verschärft. Bullshit, würde der Kremlherrscher reden, schimpfte Trump. Die Telefona… [+4326 chars]",,de,'Krieg'
https://www.spektrum.de/news/verteidigung-renaturierung-gegen-russland/2273551,https://www.spektrum.de/news/verteidigung-renaturierung-gegen-russland/2273551,0,www.spektrum.de,Verteidigung: Renaturierung gegen Russland,"Eine Kette aus renaturierten Flussauen, Mooren und Wäldern soll die EU-Ostgrenze vor einer russischen Invasion schützen. Vorbild ist die Verteidigung der Ukraine im Februar 2022.",https://static.spektrum.de/fm/912/f1920x1080/115655571_pa.jpg,2025-07-10T13:26:16Z,,"Im Februar 2022, als russische Truppen ihre Invasion in die Ukraine begannen, schützte eine unerwartete Macht die Hauptstadt Kiew vor einem raschen Fall: ein renaturiertes Feuchtgebiet. Die Angreifer… [+17346 chars]",,de,'Ukraine'
https://www.sueddeutsche.de/politik/ukraine-krieg-newsblog-wiederaufbau-konferenz-rom-russland-li.3281863,https://www.sueddeutsche.de/politik/ukraine-krieg-newsblog-wiederaufbau-konferenz-rom-russland-li.3281863,0,www.sueddeutsche.de,Krieg in der Ukraine: Ukraine will mindestens 850 Milliarden Euro für den Wiederaufbau,"Ministerpräsident Schmyhal will dafür auch russisches Vermögen verwenden, juristisch ist das aber heikel. Bundeskanzler Merz deutet an, Deutschland könne bei der Lieferung von „Patriot“-Systemen aus den USA helfen.",https://www.sueddeutsche.de/2025/07/10/c8bdd91c-72cf-4ff7-85c0-b0447abef095.jpg?q=60&fm=webp&width=1200&rect=0%2C209%2C4000%2C2250,2025-07-10T13:29:00Z,,US-Außenminister Marco Rubio fordert nach einem Treffen mit seinem russischen Amtskollegen Sergej Lawrow einen Fahrplan zur Beendigung des Krieges in der Ukraine. Er sprach von einem offenen und wich… [+1459 chars],,de,'Ukraine'
https://www.stern.de/politik/deutschland/merz-in-rom--haben-die-finanzmaerkte-die-ukraine-aufgegeben--35881166.html,https://www.stern.de/politik/deutschland/merz-in-rom--haben-die-finanzmaerkte-die-ukraine-aufgegeben--35881166.html,0,www.stern.de,Merz in Rom: Haben die Finanzmärkte die Ukraine aufgegeben?,Auf der Ukraine-Konferenz muss Merz gegen wachsende Skepsis ankämpfen – und erhält dabei Unterstützung von ungewohnter Seite. Ein anderes EU-Mitglied rügt er scharf.,https://image.stern.de/35881168/t/Dn/v3/w1440/r1.7778/-/friedrich-merz-in-rom.jpg,2025-07-10T13:30:00Z,,"Kopiere den aktuellen Link
Zur Merkliste hinzufügen
Auf der Ukraine-Konferenz muss Merz gegen wachsende Skepsis ankämpfen und erhält dabei Unterstützung von ungewohnter Seite. Ein anderes EU-Mitgli… [+5967 chars]",,de,'Ukraine'
https://www.nzz.ch/feuilleton/bezos-putin-aufgepasst-regisseur-james-gunn-hat-superman-losgeschickt-ld.1892804,https://www.nzz.ch/feuilleton/bezos-putin-aufgepasst-regisseur-james-gunn-hat-superman-losgeschickt-ld.1892804,0,www.nzz.ch,"Bezos, Putin, aufgepasst: Regisseur James Gunn hat «Superman» losgeschickt","Clark Kent kämpft an den entscheidenden Fronten: zu Hause gegen Big Tech, auf internationaler Ebene gegen einen Schurkenstaat, der das Nachbarland überfällt. Der neue Film ist eine krachende Mischung aus Humor, Schauwerten und Gesinnungsarbeit.","https://img.nzz.ch/2025/07/10/870a7e85-63a1-4600-a3db-c7bdf7c6547c.jpeg?width=1200&height=674&fit=bounds&quality=75&auto=webp&crop=5151,2897,x0,y89&wmark=nzz",2025-07-10T13:37:23Z,,"Geboren auf Krypton, aber das Wertesystem ist astrein amerikanisch: David Corenswet als Superman.
Superman ist der stärkste Held von allen, und gerade deshalb fand man ihn immer auch ein bisschen sc… [+5467 chars]",,de,'Putin'
https://orf.at/stories/3399299/,https://orf.at/stories/3399299/,0,orf.at,Kreml: Russland und USA wollen Beziehungen normalisieren,,https://orf.at/mojo/1_4_1/storyserver//news/common/images/og-fallback-news.png,2025-07-10T13:37:58Z,,Russland und die USA wollen nach Angaben aus Moskau die Bemühungen zur Normalisierung ihrer Beziehungen fortsetzen. Der russische Außenminister Sergej Lawrow und sein US-Amtskollege Marco Rubio sprac… [+1474 chars],,de,'Russland'
https://www.focus.de/politik/ausland/deutschland-plant-den-kauf-von-patriots-zur-unterstuetzung-der-ukraine_162f063a-bbb6-4257-ae17-68a1f633be4d.html,https://www.focus.de/politik/ausland/deutschland-plant-den-kauf-von-patriots-zur-unterstuetzung-der-ukraine_162f063a-bbb6-4257-ae17-68a1f633be4d.html,0,www.focus.de,Deutschland plant den Kauf von Patriots zur Unterstützung der Ukraine,"Die Bundesregierung erwägt den Erwerb von Patriot-Luftverteidigungssystemen aus den USA, um die Ukraine im Kampf gegen russische Angriffe zu unterstützen.",https://quadro.burda-forward.de/ctf/64b93a7f-2250-4212-94d2-834d350c1b5c.0e636ba6-2ccc-41df-bb24-c98b1a9e54a1.jpg?im=RegionOfInterestCrop%3D%281200%2C630%29%2CregionOfInterest%3D%281528%2C843%29&hash=41ac705431eb508ffaf624106133f31347ccaaf34d457e5ef1e164e33d170fb8,2025-07-10T13:46:03Z,,In einem Gespräch mit Präsident Trump äußerte Bundeskanzler Friedrich Merz (CDU) den Wunsch nach Lieferung dieser Systeme. Derzeit laufen Verhandlungen zwischen den Verteidigungsministern beider Länd… [+1180 chars],,de,'Russland'
https://www.stern.de/news/rubio-spricht-nach-treffen-mit-lawrow-ueber--frustration--zu-lage-in-ukraine-35883430.html,https://www.stern.de/news/rubio-spricht-nach-treffen-mit-lawrow-ueber--frustration--zu-lage-in-ukraine-35883430.html,0,www.stern.de,"Rubio spricht nach Treffen mit Lawrow über ""Frustration"" zu Lage in Ukraine",US-Außenminister Marco Rubio hat nach eigenen Angaben seinem russischen Amtskollegen Sergej Lawrow die Unzufriedenheit der USA über die Lage in der Ukraine übermittelt. Er habe sich den in den vergangenen Tagen geäußerten Worten von US-Präsident Donald Trump …,https://image.stern.de/35884046/t/EJ/v1/w1440/r1.7778/-/10--rubio-vorne-l-und-lawrow-vorne-r-in-kuala-lumpur---3b76990db8f85dc8.jpg,2025-07-10T13:54:16Z,,"Kopiere den aktuellen Link
Zur Merkliste hinzufügen
US-Außenminister Marco Rubio hat nach eigenen Angaben seinem russischen Amtskollegen Sergej Lawrow die Unzufriedenheit der USA über die Lage in d… [+2039 chars]",,de,'Ukraine'
https://www.stern.de/politik/ausland/wiederaufbau-konferenz--berlin-will-von-usa-patriots-fuer-ukraine-kaufen-35881716.html,https://www.stern.de/politik/ausland/wiederaufbau-konferenz--berlin-will-von-usa-patriots-fuer-ukraine-kaufen-35881716.html,0,www.stern.de,Wiederaufbau-Konferenz: Berlin will von USA Patriots für Ukraine kaufen,"Offiziell geht es in Rom darum, wie dem kriegsgeplagten Land beim Wiederaufbau geholfen werden kann. Aber Kanzler Merz stellt auch neue Patriots in Aussicht.",https://image.stern.de/35884108/t/Uk/v1/w1440/r1.7778/-/10--mu2i6nsuedv6axs2048jpeg---b797015c6a4325bc.jpg,2025-07-10T14:04:30Z,,"Kopiere den aktuellen Link
Zur Merkliste hinzufügen
Offiziell geht es in Rom darum, wie dem kriegsgeplagten Land beim Wiederaufbau geholfen werden kann. Aber Kanzler Merz stellt auch neue Patriots … [+5198 chars]",,de,'Russland'
https://www.basicthinking.de/blog/2025/07/10/oasis-supercharger/,https://www.basicthinking.de/blog/2025/07/10/oasis-supercharger/,0,www.basicthinking.de,Oasis Supercharger: Tesla eröffnet Solar-Ladepark – unabhängig vom Stromnetz,"Der Beitrag Oasis Supercharger: Tesla eröffnet Solar-Ladepark – unabhängig vom Stromnetz erschien zuerst beim Online-Magazin BASIC thinking. Über unseren Newsletter UPDATE startest du jeden Morgen bestens informiert in den Tag.
Tesla hat in Lost Hills, Kalifo…",https://www.basicthinking.de/blog/wp-content/uploads/2025/07/oasis-supercharger.webp,2025-07-10T14:45:18Z,,"Tesla hat in LostHills, Kalifornien, die erste autarke Oasis Supercharger-Station eröffnet. Der Ladepark ist solarbetrieben, verfügt über eigene Energiespeicher und ist komplett unabhängig vom Stromn… [+2343 chars]",,de,'Solar'
https://www.zeit.de/politik/2025-07/wohnungsbau-turbo-bundestag-nachrichtenpodcast,https://www.zeit.de/politik/2025-07/wohnungsbau-turbo-bundestag-nachrichtenpodcast,0,www.zeit.de,Wohnungsbau: Zündet die Regierung jetzt den Bau-Turbo?,Die schwarz-rote Koalition will die Planungszeit beim Bau verkürzen. Bürger könnten dann jedoch seltener Einspruch erheben. Und: Konferenz plant Wiederaufbau der Ukraine,https://img.zeit.de/politik/2017-09/illu-podcast-news/wide__8ed8a6__1300x731,2025-07-10T15:04:25Z,,Der Bundestag hat das erste Mal über ein Gesetz zum sogenannten Bau-Turbo der Bundesregierung beraten. Laut den Koalitionsfraktionen soll das Gesetz den Wohnungsbau vorantreiben. Konkret soll die Zei… [+1755 chars],,de,'Ukraine'
https://www.stern.de/news/solarenergie-im-juni-erstmals-wichtigste-stromquelle-in-der-eu-35884830.html,https://www.stern.de/news/solarenergie-im-juni-erstmals-wichtigste-stromquelle-in-der-eu-35884830.html,0,www.stern.de,Solarenergie im Juni erstmals wichtigste Stromquelle in der EU,"Solarenergie ist im Juni 2025 erstmals die größte Stromquelle in der Europäischen Union gewesen. 22,1 Prozent des in der EU verbrauchten Stroms stammten im vergangenen Monat aus Solaranlagen, wie der britische Thinktank Ember am Donnerstag mitteilte. Damit la…",https://image.stern.de/35884832/t/9h/v1/w1440/r1.7778/-/11--solaranlage---0c33b8184427fe8b.jpg,2025-07-10T23:32:57Z,,"Kopiere den aktuellen Link
Zur Merkliste hinzufügen
Solarenergie ist im Juni 2025 erstmals die größte Stromquelle in der Europäischen Union gewesen. 22,1 Prozent des in der EU verbrauchten Stroms s… [+1497 chars]",,de,'Solar'
https://www.zeit.de/news/2025-07/11/netanjahu-zu-hamas-werden-diese-monster-besiegen,https://www.zeit.de/news/2025-07/11/netanjahu-zu-hamas-werden-diese-monster-besiegen,0,www.zeit.de,"Gaza-Krieg: Netanjahu zu Hamas: Werden diese ""Monster"" besiegen","Hier finden Sie Informationen zu dem Thema „Gaza-Krieg“. Lesen Sie jetzt „Netanjahu zu Hamas: Werden diese ""Monster"" besiegen“.",https://img.zeit.de/news/2025-07/11/netanjahu-zu-hamas-werden-diese-monster-besiegen-image-group/wide__1300x731,2025-07-10T23:53:32Z,,Israels Ministerpräsident Benjamin Netanjahu hat während der in Katar laufenden Bemühungen um eine Waffenruhe im Gazastreifen den Sieg über die islamistische Hamas beschworen. «Wir werden diese Monst… [+1382 chars],,de,'Krieg'
https://www.tagesschau.de/ausland/europa/waffengabe-pkk-100.html,https://www.tagesschau.de/ausland/europa/waffengabe-pkk-100.html,0,www.tagesschau.de,Erste PKK-Kämpfer legen Waffen nieder,"Im Mai hatte die PKK angekündigt, den bewaffneten Kampf gegen den türkischen Staat zu beenden. Nun wollen die ersten der 2.000 Kämpfer im Nordirak ihre Waffen abgeben. Die Türkei setzt den Kampf gegen sie bis heute fort. Von Moritz Behrendt.",https://images.tagesschau.de/image/7ae0c841-eaa6-4764-8517-f02d39e768f0/AAABlUzcFOU/AAABkZLlo-k/16x9-big/pkk-kurden-101.jpg?width=1280,2025-07-11T04:16:57Z,,"Stand: 11.07.2025 06:16 Uhr
Im Mai hatte die PKK angekündigt, den bewaffneten Kampf gegen den türkischen Staat zu beenden. Nun wollen die ersten der 2.000 Kämpfer im Nordirak ihre Waffen abgeben. Di… [+3808 chars]",,de,'Kämpfe'
