index,url,valid,domain,title,description,image,published,archive,content,quote,language,keyword
https://www.welt.de/politik/article256408722/us-praesident-trump-sie-kommen-aus-deutschland-patriot-abwehrsysteme-schon-auf-dem-weg-in-die-ukraine.html,https://www.welt.de/politik/article256408722/us-praesident-trump-sie-kommen-aus-deutschland-patriot-abwehrsysteme-schon-auf-dem-weg-in-die-ukraine.html,0,www.welt.de,„Sie kommen aus Deutschland“ – Patriot-Abwehrsysteme schon auf dem Weg in die Ukraine,"Laut Donald Trump seien die Patriot-Flugabwehrsysteme bereits auf dem Weg in die Ukraine. Sie sollen aus Deutschland kommen. Der US-Präsident droht zudem, dass es, falls es keine Einigung mit dem russischen Präsidenten zur Waffenruhe gebe, „übel enden“ werde.",https://images.welt.de/687767767310134cfb62b9cc/6e603e8e0d818f577f14a2d747b79249-master/ci16x9-w1200/us-praesident-trump,2025-07-16T10:28:57Z,,Bei den Waffenlieferungen an Kiew erhöhen die USA das Tempo. Die ersten von Präsident Donald Trump versprochenen Patriot-Flugabwehrsysteme sind nach den Worten des US-Präsidenten bereits auf dem Weg … [+1953 chars],,de,'Russland'
https://www.dw.com/de/trump-keine-langstreckenraketen-f%C3%BCr-die-ukraine/a-73294341,https://www.dw.com/de/trump-keine-langstreckenraketen-f%C3%BCr-die-ukraine/a-73294341,0,www.dw.com,Trump: Keine Langstreckenraketen für die Ukraine,"Werden die USA der Ukraine auch solche Waffen liefern, mit denen etwa Russlands Hauptstadt Moskau angegriffen werden könnte? Entsprechende Spekulationen weist Präsident Trump nun zurück.",https://static.dw.com/image/73290698_6.jpg,2025-07-16T10:32:00Z,,"Die USA haben nach den Worten von Präsident Donald Trump nicht vor, der Ukraine Langstreckenraketen zur Verfügung zu stellen. Auf eine entsprechende Frage von Journalisten in Washington antwortete Tr… [+4071 chars]",,de,'Ukraine'
https://www.focus.de/panorama/welt/indische-polizei-entdeckt-eine-russin-die-mit-zwei-toechtern-in-einer-hoehle-lebt_c46e7526-ebb5-427f-a367-ad77bb188e81.html,https://www.focus.de/panorama/welt/indische-polizei-entdeckt-eine-russin-die-mit-zwei-toechtern-in-einer-hoehle-lebt_c46e7526-ebb5-427f-a367-ad77bb188e81.html,0,www.focus.de,"Indische Polizei entdeckt eine Russin, die mit zwei Töchtern in einer Höhle lebt",Nina Kutina suchte in Indien nach Spiritualität und lebte mehrere Jahre in einer Höhle. Nun droht ihr und ihren Töchtern die Rückführung nach Russland.,https://quadro.burda-forward.de/ctf/4976920e-ce8c-4c1f-bf03-9cb030bc48a0.f3585a56-4b2b-455d-80a8-a400b8e80291.jpg?im=RegionOfInterestCrop%3D%281200%2C630%29%2CregionOfInterest%3D%28516%2C422%29&hash=34fcec7ad73b75c96ef172547c453d8e3446b4faf260a5095586bdd07066d398,2025-07-16T10:48:04Z,,"In der südindischen Stadt Gokarna entdeckte die Polizei kürzlich eine russische Frau, die mit ihren zwei jungen Töchtern in einer Höhle lebte. Die Familie suchte nach Spiritualität und einem Leben im… [+2587 chars]",,de,'Russland'
https://www.focus.de/politik/ausland/russland-china-und-nordkorea-japan-warnt-vor-dreifacher-bedrohung_51c501d5-8d5c-48d0-b817-b88e2a59de85.html,https://www.focus.de/politik/ausland/russland-china-und-nordkorea-japan-warnt-vor-dreifacher-bedrohung_51c501d5-8d5c-48d0-b817-b88e2a59de85.html,0,www.focus.de,"Russland, China und Nordkorea: Japan warnt vor dreifacher Bedrohung","Japan sieht sich durch die zunehmende militärische Zusammenarbeit von China, Russland und Nordkorea einer ernsten Sicherheitslage gegenüber - und spricht von der größten Bedrohung seit dem Zweiten Weltkrieg.",https://quadro.burda-forward.de/ctf/0e0d5407-0ba9-4ba9-a415-5ce72604d686.6752a1dd-7542-4890-b62c-9048ba3d9b98.jpg?im=RegionOfInterestCrop%3D%281200%2C630%29%2CregionOfInterest%3D%281168%2C964%29&hash=fc4f1950bc1eed69606790c59755f4018a3c444f4cc9dc9bb192e821aa2ad344,2025-07-16T10:56:36Z,,Japan sieht sich nach eigenen Angaben der schwersten sicherheitspolitischen Lage seit dem Ende des Zweiten Weltkriegs gegenüber. In seinem jährlichen Verteidigungsbericht bezeichnete Verteidigungsmin… [+2093 chars],,de,'Russland'
https://www.focus.de/politik/ausland/kreml-wirft-europa-irrsinn-vor-und-droht-erneut-mit-atomwaffen_6746edc6-5857-41cf-bf55-797a21f3e092.html,https://www.focus.de/politik/ausland/kreml-wirft-europa-irrsinn-vor-und-droht-erneut-mit-atomwaffen_6746edc6-5857-41cf-bf55-797a21f3e092.html,0,www.focus.de,Kreml wirft Europa Irrsinn vor und droht erneut mit Atomwaffen,"Die europäischen Nato-Staaten kaufen nun US-Waffen, um sie der Ukraine in ihrem Verteidigungskampf zu überlassen. Der Kreml spricht von Militarismus und macht selbst Andeutungen.",https://quadro.burda-forward.de/ctf/c71738bb-7a47-4b1a-803c-9f0b020edfb2.ad76f046-c3ff-4815-8d49-9ae23fd9d71f.jpg?im=RegionOfInterestCrop%3D%281200%2C630%29%2CregionOfInterest%3D%281096%2C616%29&hash=893ee6e2480ea64523a88cf8c98d867fe31833e4e08fa08a5e76653fb000a559,2025-07-16T11:23:36Z,,"Der Kreml hat den europäischen Ländern offenen Militarismus vorgeworfen und einmal mehr den möglichen Einsatz von Atomwaffen angedeutet. Die europäischen Länder gäben Unsummen für Waffen aus, um den … [+1474 chars]",,de,'Ukraine'
https://www.welt.de/videos/video256409860/karsten-junius-trump-liebt-deals-handelsabkommen-mit-eu-wahrscheinlich.html,https://www.welt.de/videos/video256409860/karsten-junius-trump-liebt-deals-handelsabkommen-mit-eu-wahrscheinlich.html,0,www.welt.de,„Trump liebt Deals“ – Handelsabkommen mit EU wahrscheinlich,"Der Chefökonom Karsten Junius sieht gute Chancen für einen Handelsdeal zwischen den USA und der EU. Die US-Zollpolitik beeinflusst Inflation und Märkte, doch der Experte bleibt optimistisch: „Trump liebt Deals“, so Junius.",https://images.welt.de/687785fbcd5987311f2d0258/e7782bafdce1a42bcd3addf353013553-master/ci16x9-w1200/file-photo-president-donald-trump-is-shown-at-west-point-military-academy-new-york,2025-07-16T11:34:59Z,,"Der Chefökonom Karsten Junius sieht gute Chancen für einen Handelsdeal zwischen den USA und der EU. Die US-Zollpolitik beeinflusst Inflation und Märkte, doch der Experte bleibt optimistisch: Trump li… [+80 chars]",,de,'Inflation'
https://www.focus.de/politik/ausland/konflikt-um-taiwan-philippinen-bereiten-sich-auf-moeglichen-krieg-mit-china-vor_9cf375c9-b5ab-4c42-8778-8f0d741272a0.html,https://www.focus.de/politik/ausland/konflikt-um-taiwan-philippinen-bereiten-sich-auf-moeglichen-krieg-mit-china-vor_9cf375c9-b5ab-4c42-8778-8f0d741272a0.html,0,www.focus.de,Konflikt um Taiwan: Philippinen bereiten sich auf möglichen Krieg mit China vor,Die Philippinen rüsten auf: China verstärkt den Druck auf Taiwan und südostasiatische Länder. Manila könnte in einen Konflikt um Taiwan involviert werden.,https://quadro.burda-forward.de/ctf/97d481f6-0af2-4b2c-8f70-43eb03e8deee.e3076522-a39d-4ba0-86d6-86c4b47de579.jpg?im=RegionOfInterestCrop%3D%281200%2C630%29%2CregionOfInterest%3D%28931%2C687%29&hash=127a9f5e27c91d5c70de02714647765ebe9da123b4529d071dcd356be2fd9e7b,2025-07-16T11:38:35Z,,"Die Philippinen verstärken ihre militärische Präsenz und bereiten sich angesichts zunehmender Spannungen mit China auf einen möglichen Krieg vor. Newsweek berichtet, dass das Land seine militärischen… [+1666 chars]",,de,'Krieg'
"https://www.gamestar.de/videos/empire-of-the-ants-dank-koop-update-koennt-ihr-jetzt-gemeinsam-eine-ameisen-kolonie-zum-sieg-fuehren,136855.html","https://www.gamestar.de/videos/empire-of-the-ants-dank-koop-update-koennt-ihr-jetzt-gemeinsam-eine-ameisen-kolonie-zum-sieg-fuehren,136855.html",0,www.gamestar.de,Empire of the Ants: Dank Koop-Update könnt ihr jetzt gemeinsam eine Ameisen-Kolonie zum Sieg führen,"In Empire of the Ants dreht sich alles um die flei&szlig;igen, kleinen Arbeiter, nur eben in Kampflaune. In dem Echtzeit-Strategiespiel spielt ihr selbst als eine der Krieger-Ameisen und f&uuml;hrt eure Truppen durch die F&ouml;deration.

Das kostenlose &raqu…",https://images.cgames.de/images/gamestar/293/videoimage_6364292.jpg,2025-07-16T12:01:00Z,,"Für die Weiterentwicklung und Finanzierung unseres Angebotes erheben und verarbeiten wir und bis zu 255 Partner personenbezogene Daten und Identifikationsmerkmale wie, Gerätekennungen oder IP-Adresse… [+830 chars]",,de,'Krieg'
https://www.welt.de/politik/ausland/article256409970/krieg-in-der-ukraine-kreml-erinnert-europa-an-umgeschriebene-atomwaffendoktrin.html,https://www.welt.de/politik/ausland/article256409970/krieg-in-der-ukraine-kreml-erinnert-europa-an-umgeschriebene-atomwaffendoktrin.html,0,www.welt.de,Kreml erinnert Europa an umgeschriebene Atomwaffendoktrin,"Europa rüstet für die Ukraine auf – und Moskau warnt vor den Folgen. Russland wirft westlichen Staaten Militarismus vor und droht erneut indirekt mit Atomwaffen, falls Russland sich feindlichen Handlungen ausgesetzt sieht.",https://images.welt.de/6877862a75e6eb6eedf7f221/3f656438b44f71b8ecbc6b77c765ac01-master/ci16x9-w1200/kreml-sprecher-dmitri-peskow,2025-07-16T12:15:41Z,,"Der Kreml hat den europäischen Ländern offenen Militarismus vorgeworfen und einmal mehr den möglichen Einsatz von Atomwaffen angedeutet. Die europäischen Länder gäben Unsummen für Waffen aus, um den … [+1386 chars]",,de,'Ukraine'
https://www.welt.de/politik/deutschland/video256410244/welt-spezial-krieg-der-drohnen-wie-abwehrbereit-ist-deutschland.html,https://www.welt.de/politik/deutschland/video256410244/welt-spezial-krieg-der-drohnen-wie-abwehrbereit-ist-deutschland.html,0,www.welt.de,Krieg der Drohnen – Wie abwehrbereit ist Deutschland?,Der Bundesverband der deutschen Luft- und Raumfahrtindustrie kritisiert in einem Brandbrief den Rückstand Deutschlands bei moderner Drohnentechnologie. Sehen Sie hier ein WELT-Spezial zum Stand der Abwehrbereitschaft in Deutschland.,https://images.welt.de/687793589ecd0f747df66186/1f50b5aa9aa76af8e21bc1dde90e48d4-master/ci16x9-w1200/ukraine-krieg-weibliche-drohnenschuetzen,2025-07-16T12:35:32Z,,Die WELT als ePaper: Die vollständige Ausgabe steht Ihnen bereits am Vorabend zur Verfügung so sind Sie immer hochaktuell informiert. Weitere Informationen https://epaper.welt.de,,de,'Krieg'
https://www.bild.de/politik/trump-warnt-selenskyj-vor-angriff-auf-moskau-68779440543f7a2c50a2a3f3,https://www.bild.de/politik/trump-warnt-selenskyj-vor-angriff-auf-moskau-68779440543f7a2c50a2a3f3,0,www.bild.de,Trump warnt Selenskyj - „Er sollte Moskau nicht angreifen!“,Donald Trump spricht über Ukraine-Krieg und warnt den ukrainischen Präsidenten Selenskyj eindringlich vor einem Angriff auf Moskau.,"https://images.bild.de/68779440543f7a2c50a2a3f3/9668aa28e58e46a60e53367ccb3f2e02,8e8ebabe?w=1280",2025-07-16T12:47:42Z,,"Mehr zum Video anzeigen 
US-Präsident Donald Trump spricht vor Journalisten über den Ukraine-Krieg und richtet eine eindringliche Warnung an den ukrainischen Präsidenten Wolodymyr Selenskyj: Nein, e… [+70 chars]",,de,'Ukraine'
https://www.zeit.de/news/2025-07/16/freie-universitaet-berlin-prueft-intifada-treff,https://www.zeit.de/news/2025-07/16/freie-universitaet-berlin-prueft-intifada-treff,0,www.zeit.de,"Gaza-Krieg: Freie Universität Berlin prüft ""Intifada""-Treff","Hier finden Sie Informationen zu dem Thema „Gaza-Krieg“. Lesen Sie jetzt „Freie Universität Berlin prüft ""Intifada""-Treff“.",https://img.zeit.de/news/2025-07/16/freie-universitaet-berlin-prueft-intifada-treff-image-group/wide__1300x731,2025-07-16T12:49:01Z,,"Nach einem Treffen propalästinensischer Aktivisten in der Freien Universität Berlin unter dem Motto «Wie wir die Intifada globalisieren» prüft die Hochschule, ob dort strafbare Aussagen gefallen sind… [+2399 chars]",,de,'Krieg'
https://www.stern.de/gesellschaft/regional/berlin-brandenburg/gaza-krieg--freie-universitaet-berlin-prueft--intifada--treff-35899164.html,https://www.stern.de/gesellschaft/regional/berlin-brandenburg/gaza-krieg--freie-universitaet-berlin-prueft--intifada--treff-35899164.html,0,www.stern.de,"Gaza-Krieg: Freie Universität Berlin prüft ""Intifada""-Treff",Ein Aufruf zum weltweiten Aufstand gegen Israel – von Berlin aus? Ebendies war Thema bei einem Treffen von Aktivisten in der FU Berlin. Nun könnte es ein Nachspiel geben.,https://image.stern.de/35899166/t/Zv/v1/w1440/r1.7778/-/16--okwaihed5wv9axs2048jpeg---1b6c6ecacc8847e8.jpg,2025-07-16T12:49:01Z,,"Kopiere den aktuellen Link
Zur Merkliste hinzufügen
Ein Aufruf zum weltweiten Aufstand gegen Israel von Berlin aus? Ebendies war Thema bei einem Treffen von Aktivisten in der FU Berlin. Nun könnte … [+2583 chars]",,de,'Krieg'
https://www.tagesspiegel.de/berlin/gaza-krieg-freie-universitat-berlin-pruft-intifada-treff-14034419.html,https://www.tagesspiegel.de/berlin/gaza-krieg-freie-universitat-berlin-pruft-intifada-treff-14034419.html,0,www.tagesspiegel.de,Gaza-Krieg: Freie Universität Berlin prüft „Intifada“-Treff,Ein Aufruf zum weltweiten Aufstand gegen Israel – von Berlin aus? Ebendies war Thema bei einem Treffen von Aktivisten in der FU Berlin. Nun könnte es ein Nachspiel geben.,https://www.tagesspiegel.de/images/14034416/alternates/BASE_16_9_W1400/1752670215000/freie-universitat-berlin.jpeg,2025-07-16T12:50:16Z,,"Nach einem Treffen propalästinensischer Aktivisten in der Freien Universität Berlin unter dem Motto Wie wir die Intifada globalisieren prüft die Hochschule, ob dort strafbare Aussagen gefallen sind. … [+2437 chars]",,de,'Krieg'
https://www.stern.de/politik/ausland/gaza-krieg--stiftung--20-tote-an-verteilstelle-in-gaza-35898068.html,https://www.stern.de/politik/ausland/gaza-krieg--stiftung--20-tote-an-verteilstelle-in-gaza-35898068.html,0,www.stern.de,Gaza-Krieg: Stiftung: 20 Tote an Verteilstelle in Gaza,Bei einer Ausgabestelle für humanitäre Hilfe in Chan Junis ist es zu Chaos gekommen. Der Gaza Humanitarian Foundation zufolge sollen Bewaffnete gezielt Unruhen in der Menge angefacht haben.,https://image.stern.de/35898070/t/Gi/v2/w1440/r1.7778/-/16--ol75fducgpv3axs2048jpeg---b3c67b63b640686d.jpg,2025-07-16T13:04:01Z,,"Kopiere den aktuellen Link
Zur Merkliste hinzufügen
Bei einer Ausgabestelle für humanitäre Hilfe in Chan Junis ist es zu Chaos gekommen. Der Gaza Humanitarian Foundation zufolge sollen Bewaffnete g… [+1819 chars]",,de,'Krieg'
https://www.tagesspiegel.de/wissen/ein-handschlag-im-all-wie-ein-handedruck-vor-50-jahren-die-usa-und-russland-verbinden-sollte-14032853.html,https://www.tagesspiegel.de/wissen/ein-handschlag-im-all-wie-ein-handedruck-vor-50-jahren-die-usa-und-russland-verbinden-sollte-14032853.html,0,www.tagesspiegel.de,Ein Handschlag im All: Wie ein Händedruck vor 50 Jahren die USA und Russland verbinden sollte,"Vor 50 Jahren schwebten ein US-Astronaut und ein sowjetischer Kosmonaut im Kalten Krieg schwerelos zusammen – und schüttelten sich die Hände. Dieses Symbol der Zusammenarbeit hält bis heute, doch auf der Erde sind die Fronten längst nicht so friedlich. Wie üb…",https://www.tagesspiegel.de/images/14034701/alternates/BASE_16_9_W1400/1752671454000/drei-raumfahrer-kehren-von-der-iss-zur-erde-zuruck.jpeg,2025-07-16T13:30:19Z,,"Ein Händedruck, der in die Geschichte einging: Am Donnerstag (17. Juli) vor genau 50 Jahren schwebten der sowjetische Kosmonaut Alexej Leonow und der US-Raumfahrer Thomas Stafford rund 225 Kilometer … [+5982 chars]",,de,'Krieg'
https://www.faz.net/aktuell/politik/ausland/jahrelange-reparatur-russlands-einziger-flugzeugtraeger-vor-dem-aus-110593426.html,https://www.faz.net/aktuell/politik/ausland/jahrelange-reparatur-russlands-einziger-flugzeugtraeger-vor-dem-aus-110593426.html,0,www.faz.net,Jahrelange Reparatur: Russlands einziger Flugzeugträger vor dem Aus,"Acht Jahre lang hat Russland erfolglos versucht, die Admiral Kusnezow zu reparieren. In den Einsatz wird das Schiff wohl nie wieder geschickt – der Krieg in der Ukraine hat Priorität.",https://media1.faz.net/ppmedia/aktuell/2807024592/1.10593451/facebook_teaser/schwarzer-rauch-nach.jpg,2025-07-16T13:31:13Z,,"Für Russlands einzigen Flugzeugträger, die vor mehr als acht Jahren zur Reparatur geschickte Admiral Kusnezow, zeichnet sich nach vielen Schrecken ein schnödes Ende ab: Das Verteidigungsministerium w… [+5803 chars]",,de,'Krieg'
https://www.zeit.de/geld/2025-07/abschaffung-steuererklaerung-steuerhinterziehung-verhinderung-massnahmen,https://www.zeit.de/geld/2025-07/abschaffung-steuererklaerung-steuerhinterziehung-verhinderung-massnahmen,0,www.zeit.de,Abschaffung der Steuererklärung: Nie wieder Steuererklärung!,"Die Steuererklärung abschaffen? Klingt verrückt, aber eine vorausgefüllte Erklärung könnte viel Zeit und Geld sparen – und das Steuersystem gerechter machen.",https://img.zeit.de/geld/2025-07/abschaffung-steuererklaerung-steuerhinterziehung-verhinderung-massnahmen-bild/wide__1300x731,2025-07-16T13:34:30Z,,"Wie einfach eine Steuererklärung sein könnte, führte Friedrich Merz schon im Jahr 2004 vor. Am Rande eines CDU-Wahlkampftermins berechnete er die Einkommenssteuer für eine Familie in wenigen Minuten … [+802 chars]",,de,'Geld sparen'
https://www.sueddeutsche.de/politik/ukraine-ukraine-krieg-waffenlieferungen-russische-angriffe-li.3284841,https://www.sueddeutsche.de/politik/ukraine-ukraine-krieg-waffenlieferungen-russische-angriffe-li.3284841,0,www.sueddeutsche.de,Ukraine: Terror in der Nacht,"Die andauernden russischen Angriffe zehren an den Nerven, und auch Donald Trumps angebliche Kehrtwende in seiner Russland-Politik enttäuscht viele Ukrainer.  Doch noch ist ihr Widerstandswille ungebrochen.",https://www.sueddeutsche.de/2025/07/16/b3a43225-ff0c-4228-8c47-71f0a45c7b14.jpg?q=60&fm=webp&width=1200&rect=0%2C210%2C3500%2C1969,2025-07-16T13:43:06Z,,Und nicht nur die Luftangriffe setzten die Ukraine unter Druck: Daten des eng mit dem ukrainischen Militär verbundenen Infodienstes Deep Statezufolge hat Russland in den vergangenen drei Monaten weit… [+6285 chars],,de,'Krieg'
https://futurezone.at/digital-life/russland-152mm-sturmpanzer-haubitze-patent-30mm-kanone-fernbedient-t-72-laser-drohnen-thermobar/403058655,https://futurezone.at/digital-life/russland-152mm-sturmpanzer-haubitze-patent-30mm-kanone-fernbedient-t-72-laser-drohnen-thermobar/403058655,0,futurezone.at,Russland entwickelt Monster-Panzer mit 152mm-Kanone einer Haubitze,"Das Patent sieht vor, dass bestehende Kampfpanzer mit der Kanone einer Haubitze zum Sturmpanzer werden.",https://image.futurezone.at/images/facebook/9029997/46-189870808.jpg,2025-07-16T14:29:25Z,,"Das Patent sieht vor, dass bestehende Kampfpanzer mit der Kanone einer Haubitze zum Sturmpanzer werden.
Eine der Lehren aus dem Russland-Ukraine-Krieg ist, dass der Kampfpanzer nicht mehr der König … [+1111 chars]",,de,'Krieg'
https://www.faz.net/aktuell/wissen/geist-soziales/das-schicksal-von-heinrich-boells-bibliothek-110590786.html,https://www.faz.net/aktuell/wissen/geist-soziales/das-schicksal-von-heinrich-boells-bibliothek-110590786.html,0,www.faz.net,Heinrich Bölls Bibliothek: Verrechnung eines Kriegsverlusts,"Eine Akte zeigt, dass sich Heinrich Böll zeitlebens um die Restitution seiner durch Ausbombung zerstörten Bibliothek bemühte. Wie steht es um seine Bibliothek heute, vierzig Jahre nach seinem Tod?",https://media0.faz.net/ppmedia/aktuell/1864068751/1.10590784/facebook_teaser/was-sollte-aus-dem-jungen.jpg,2025-07-16T14:38:22Z,,"Sie können alles, was ich besitze, was wirklich mir gehört, bequem auf einen Handkarren laden, schrieb Heinrich Böll im Dezember 1951 an Georg Zänker, den Leiter des Middelhauve Verlags: ich besitze … [+15111 chars]",,de,'Krieg'
https://www.stern.de/politik/ausland/russischer-angriffskrieg--kreml-klagt-ueber-europa-und-ukraine--kiew-wechselt-regierung-35897436.html,https://www.stern.de/politik/ausland/russischer-angriffskrieg--kreml-klagt-ueber-europa-und-ukraine--kiew-wechselt-regierung-35897436.html,0,www.stern.de,"Russischer Angriffskrieg: Kreml klagt über Europa und Ukraine, Kiew wechselt Regierung",Russland wirft den Nato-Staaten Militarismus und der Ukraine Verhandlungsunwillen vor - und beschießt das Nachbarland weiter mit Drohnen. In Kiew werden derweil die Weichen für einen Wechsel gestellt.,https://image.stern.de/35899672/t/Wk/v1/w1440/r1.7778/-/16--hpa7em6jb6v4axs2048jpeg---006c334624dd7eb4.jpg,2025-07-16T14:38:28Z,,"Kopiere den aktuellen Link
Zur Merkliste hinzufügen
Russland wirft den Nato-Staaten Militarismus und der Ukraine Verhandlungsunwillen vor - und beschießt das Nachbarland weiter mit Drohnen. In Kiew… [+4270 chars]",,de,'Krieg'
https://www.zeit.de/news/2025-07/16/toter-nach-ukrainischem-drohnenangriff-auf-belgorod,https://www.zeit.de/news/2025-07/16/toter-nach-ukrainischem-drohnenangriff-auf-belgorod,0,www.zeit.de,Russisch-ukrainischer Krieg: Toter nach ukrainischem Drohnenangriff auf Belgorod,Hier finden Sie Informationen zu dem Thema „Russisch-ukrainischer Krieg“. Lesen Sie jetzt „Toter nach ukrainischem Drohnenangriff auf Belgorod“.,https://img.zeit.de/news/2025-07/16/toter-nach-ukrainischem-drohnenangriff-auf-belgorod-image-group/wide__1300x731,2025-07-16T20:40:42Z,,"In der westrussischen Grenzregion Belgorod ist infolge eines ukrainischen Drohnenangriffs mindestens ein Zivilist getötet worden. Weitere fünf Menschen wurden verletzt, teilte Gouverneur Wjatscheslaw… [+576 chars]",,de,'Krieg'
https://www.zeit.de/news/2025-07/17/verletzte-bei-drohnenangriffen-auf-russland,https://www.zeit.de/news/2025-07/17/verletzte-bei-drohnenangriffen-auf-russland,0,www.zeit.de,Angriffskrieg gegen Ukraine: Verletzte bei Drohnenangriffen auf Russland,Hier finden Sie Informationen zu dem Thema „Angriffskrieg gegen Ukraine“. Lesen Sie jetzt „Verletzte bei Drohnenangriffen auf Russland“.,https://img.zeit.de/news/2025-07/17/verletzte-bei-drohnenangriffen-auf-russland-image-group/wide__1300x731,2025-07-17T02:34:21Z,,Das russische Militär hat in der Nacht Behördenangaben zufolge mehrere ukrainische Drohnen im Westen und über der Hauptstadt Moskau abgeschossen. In der westrussischen Stadt Woronesch seien drei Mind… [+885 chars],,de,'Russland'
https://www.zeit.de/politik/2025-07/ukraine-regierung-umbildung-julija-swyrydenko-nachrichtenpodcast,https://www.zeit.de/politik/2025-07/ukraine-regierung-umbildung-julija-swyrydenko-nachrichtenpodcast,0,www.zeit.de,Regierungsumbildung in der Ukraine: Regierungsrochade in der Ukraine,"Julija Swyrydenko soll neue Premierministerin der Ukraine werden. Welcher Plan steckt hinter der Regierungsumbildung? Und: ein ""Boomer-Soli"" zur Sicherung der Renten",https://img.zeit.de/politik/2017-09/illu-podcast-news/wide__8ed8a6__1300x731,2025-07-17T03:59:34Z,,Der ukrainische Präsident Wolodymyr Selenskyj hat die stellvertretende Ministerpräsidentin Julia Swyrydenko mit der Regierungsbildung beauftragt. Sie soll Premierministerin werden und Denys Schmyhal … [+1824 chars],,de,'Ukraine'
https://www.welt.de/politik/ausland/video256412900/explosionen-in-damaskus-eskalation-im-nahen-osten-hunderte-tote-bei-gewalt-in-syrien.html,https://www.welt.de/politik/ausland/video256412900/explosionen-in-damaskus-eskalation-im-nahen-osten-hunderte-tote-bei-gewalt-in-syrien.html,0,www.welt.de,Eskalation im Nahen Osten – Hunderte Tote bei Gewalt in Syrien,Israel hat die Hauptstadt Damaskus seines Nachbarlandes Syrien bombardiert. Vorangegangen waren Kämpfe zwischen Angehörigen der religiösen Minderheit der Drusen und sunnitischen Beduinen im Süden Syriens.,https://images.welt.de/687877270d28e0459fe538d3/c2a271a43cdab89bdf43453553b3651d-master/ci16x9-w1200/nahostkonflikt-israelische-drusen-ueberqueren-grenze-nach-syrien,2025-07-17T04:42:18Z,,Die WELT als ePaper: Die vollständige Ausgabe steht Ihnen bereits am Vorabend zur Verfügung so sind Sie immer hochaktuell informiert. Weitere Informationen https://epaper.welt.de,,de,'Kämpfe'
https://www.telepolis.de/features/USA-pruefen-Lieferung-von-Tomahawk-Marschflugkoerpern-an-Ukraine-10490302.html,https://www.telepolis.de/features/USA-pruefen-Lieferung-von-Tomahawk-Marschflugkoerpern-an-Ukraine-10490302.html,0,www.telepolis.de,USA prüfen Lieferung von Tomahawk-Marschflugkörpern an Ukraine,Trump will der Ukraine Waffen mit Reichweite bis Moskau geben. Doch fehlende Startsysteme und hohe Kosten bremsen die Pläne aus.,https://heise.cloudimg.io/bound/1200x1200/q85.png-lossy-85.webp-lossy-85.foil1/_www-heise-de_/imgs/18/4/8/9/9/0/4/1/shutterstock_2413429857-9beba56e980a3270.jpeg,2025-07-17T05:00:00Z,,"(Bild: e-crow / Shutterstock.com)
Trump will der Ukraine Waffen mit Reichweite bis Moskau geben. Doch fehlende Startsysteme und hohe Kosten bremsen die Pläne aus.
""Volodymyr, can you hit Moscow? Ca… [+6428 chars]",,de,'Hohe Kosten'
https://www.golem.de/sonstiges/zustimmung/auswahl.html?from=https://www.golem.de/news/steuererklaerung-diese-digitalen-helfer-sparen-zeit-und-geld-2507-198184.html&referer=https://t.co/1a69e4cdbb,https://www.golem.de/sonstiges/zustimmung/auswahl.html?from=https://www.golem.de/news/steuererklaerung-diese-digitalen-helfer-sparen-zeit-und-geld-2507-198184.html&referer=https://t.co/1a69e4cdbb,0,www.golem.de,(g+) Steuererklärung: Diese digitalen Helfer sparen Zeit und Geld,"Für viele ist die Steuererklärung eine lästige Pflicht. Apps und Steuerprogramme können helfen, sie schneller zu erledigen - schließlich eilt es jetzt ein bisschen. Ein Ratgebertext von Ulrike Barth (Finanzen, Stiftung Warentest)",,2025-07-17T11:30:01Z,,"Besuchen Sie Golem.de wie gewohnt mit Werbung und Tracking,
 indem Sie der Nutzung aller Cookies zustimmen.
 Details zum Tracking finden Sie im Privacy Center.
Skript wurde nicht geladen. Informat… [+607 chars]",,de,'Geld sparen'
