index,url,valid,domain,title,description,image,published,archive,content,quote,language,keyword
https://www.welt.de/politik/ausland/article245654440/Ukraine-News-Russlands-Armee-wollte-laut-Prigoschin-Wagner-Soeldner-in-die-Luft-sprengen.html,https://www.welt.de/politik/ausland/article245654440/Ukraine-News-Russlands-Armee-wollte-laut-Prigoschin-Wagner-Soeldner-in-die-Luft-sprengen.html,0,www.welt.de,Russlands Armee wollte laut Prigoschin Wagner-Söldner in die Luft sprengen,"Das russische Verteidigungsministerium soll offenbar Sprengsätze deponiert haben, um Kämpfer der Wagner-Truppe zu treffen. Das behauptet Söldnerchef Jewgeni Prigoschin und hat eine mögliche Erklärung. Mehr im Liveticker.",https://img.welt.de/img/politik/ausland/mobile245538596/6351351687-ci16x9-w1200/prigoschin-jpg.jpg,2023-06-02T19:30:00Z,http://archive.md/20230602194107/https://www.welt.de/politik/ausland/article245654440/Ukraine-News-Russlands-Armee-wollte-laut-Prigoschin-Wagner-Soeldner-in-die-Luft-sprengen.html,"Dem russischen Söldnerchef Jewgeni Prigoschin zufolge haben Vertreter des russischen Verteidigungsministeriums Sprengsätze deponiert, die seine Kämpfer treffen sollten. Seine Männer hätten ein Dutzen… [+15257 chars]",,de,'Krieg'
https://www.stern.de/politik/ausland/kritik--selenskyj--weiterhin-probleme-mit-schutzbunkern-in-kiew-33525420.html,https://www.stern.de/politik/ausland/kritik--selenskyj--weiterhin-probleme-mit-schutzbunkern-in-kiew-33525420.html,0,www.stern.de,Kritik: Selenskyj: Weiterhin Probleme mit Schutzbunkern in Kiew,In der Hauptstadt der Ukraine bereiten dem Präsidenten Schutzbunker Sorgen. In einigen Stadtteilen fehlen die Notunterkünfte ganz oder der Zugang ist verschlossen. Welche Folgen das jetzt hat.,https://image.stern.de/33525422/t/2u/v1/w1440/r1.7778/-/03--urnnewsmldpacom2009010123060299922914v2w800h600l1063t9r3310b1505jpeg---b706bc4395d3ee7a.jpg,2023-06-02T19:47:04Z,https://web.archive.org/web/20230603065231/https://www.stern.de/politik/ausland/kritik--selenskyj--weiterhin-probleme-mit-schutzbunkern-in-kiew-33525420.html,"In der Hauptstadt der Ukraine bereiten dem Präsidenten Schutzbunker Sorgen. In einigen Stadtteilen fehlen die Notunterkünfte ganz oder der Zugang ist verschlossen. Welche Folgen das jetzt hat.
Der u… [+2302 chars]",,de,'Ukraine'
https://www.morgenpost.de/politik/ausland/article238573725/Selenskyj-Weiterhin-Probleme-mit-Schutzbunkern-in-Kiew.html,https://www.morgenpost.de/politik/ausland/article238573725/Selenskyj-Weiterhin-Probleme-mit-Schutzbunkern-in-Kiew.html,0,www.morgenpost.de,Kritik: Selenskyj: Weiterhin Probleme mit Schutzbunkern in Kiew,In der Hauptstadt der Ukraine bereiten dem Präsidenten Schutzbunker Sorgen. In einigen Stadtteilen fehlen die Notunterkünfte ganz oder der Zugang ist verschlossen. Welche Folgen das jetzt hat.,https://img.morgenpost.de/img/ausland/crop238573723/8772608747-w820-cv16_9-q85/Selenskyj.jpg,2023-06-02T19:47:04Z,https://web.archive.org/web/20230602201002/https://www.morgenpost.de/politik/ausland/article238573725/Selenskyj-Weiterhin-Probleme-mit-Schutzbunkern-in-Kiew.html,Kiew. Der ukrainische Präsident Wolodymyr Selenskyj hat angesichts der andauernden nächtlichen russischen Raketen- und Drohnenangriffe erneut Probleme mit den Schutzbunkern in der Hauptstadt Kiew bek… [+2232 chars],,de,'Krieg'
https://www.stern.de/news/selenskyj--nato-mitgliedschaft-der-ukraine-vor-kriegsende--unmoeglich--33524344.html,https://www.stern.de/news/selenskyj--nato-mitgliedschaft-der-ukraine-vor-kriegsende--unmoeglich--33524344.html,0,www.stern.de,"Selenskyj: Nato-Mitgliedschaft der Ukraine vor Kriegsende ""unmöglich""","In einem seltenen Eingeständnis hat der ukrainische Präsident Wolodymyr Selenskyj einen Nato-Beitritt seines Landes vor dem Ende des Krieges als ""unmöglich"" bezeichnet. Sein Land verstehe, dass es kein Nato-Mitglied in einen Krieg hineinziehen werde, sagte Se…",https://image.stern.de/33524716/t/mq/v1/w1440/r1.7778/-/02--der-ukrainische-praesident-wolodymyr-selenskyj---f6bc9ffdcffa5f6b.jpg,2023-06-02T19:59:16Z,https://web.archive.org/web/20230602210618/https://www.stern.de/news/selenskyj--nato-mitgliedschaft-der-ukraine-vor-kriegsende--unmoeglich--33524344.html,"In einem seltenen Eingeständnis hat der ukrainische Präsident Wolodymyr Selenskyj einen Nato-Beitritt seines Landes vor dem Ende des Krieges als ""unmöglich"" bezeichnet. Sein Land verstehe, dass es ke… [+2752 chars]",,de,'Ukraine'
https://www.zeit.de/news/2023-06/02/iaea-besorgt-akw-saporischschja-ohne-notstromleitung,https://www.zeit.de/news/2023-06/02/iaea-besorgt-akw-saporischschja-ohne-notstromleitung,0,www.zeit.de,Ukraine-Krieg: IAEA besorgt: AKW Saporischschja ohne Notstromleitung,,,2023-06-02T20:00:37Z,https://web.archive.org/web/20230603030130/https://www.zeit.de/news/2023-06/02/iaea-besorgt-akw-saporischschja-ohne-notstromleitung,"When browsing with ads:
We collect personal data and also transmit it to third-party providers
 that help us improve and finance our digital content. Some of the information stored on your device, … [+821 chars]",,de,'Krieg'
https://www.morgenpost.de/politik/ausland/article238573909/IAEA-besorgt-AKW-Saporischschja-ohne-Notstromleitung.html,https://www.morgenpost.de/politik/ausland/article238573909/IAEA-besorgt-AKW-Saporischschja-ohne-Notstromleitung.html,0,www.morgenpost.de,Ukraine-Krieg: IAEA besorgt: AKW Saporischschja ohne Notstromleitung,Das Atomkraftwerk hat nur eine einzige funktionierende Hauptstromleitung. Wie wahrscheinlich ist ein nuklearer Unfall?,https://img.morgenpost.de/img/ausland/crop238573907/3202605895-w820-cv16_9-q85/Ukraine-Krieg-Saporischschja.jpg,2023-06-02T20:00:37Z,https://web.archive.org/web/20230602202526/https://www.morgenpost.de/politik/ausland/article238573909/IAEA-besorgt-AKW-Saporischschja-ohne-Notstromleitung.html,Enerhodar/Wien. Das von Russland besetzte ukrainische Atomkraftwerk Saporischschja ist nach Angaben der Internationalen Atomenergiebehörde (IAEA) inzwischen seit drei Monaten ohne externe Notstromver… [+2080 chars],,de,'Krieg'
https://consent.google.com/ml?continue=https://news.google.com/rss/articles/CBMikgFodHRwczovL3d3dy53ZWx0LmRlL3BvbGl0aWsvYXVzbGFuZC9hcnRpY2xlMjQ1NjU0NDQwL1VrcmFpbmUtTmV3cy1SdXNzbGFuZHMtQXJtZWUtd29sbHRlLWxhdXQtUHJpZ29zY2hpbi1XYWduZXItU29lbGRuZXItaW4tZGllLUx1ZnQtc3ByZW5nZW4uaHRtbNIBAA?oc%3D5&gl=FR&hl=en-US&cm=2&pc=n&src=1,https://consent.google.com/ml?continue=https://news.google.com/rss/articles/CBMikgFodHRwczovL3d3dy53ZWx0LmRlL3BvbGl0aWsvYXVzbGFuZC9hcnRpY2xlMjQ1NjU0NDQwL1VrcmFpbmUtTmV3cy1SdXNzbGFuZHMtQXJtZWUtd29sbHRlLWxhdXQtUHJpZ29zY2hpbi1XYWduZXItU29lbGRuZXItaW4tZGllLUx1ZnQtc3ByZW5nZW4uaHRtbNIBAA?oc%3D5&gl=FR&hl=en-US&cm=2&pc=n&src=1,0,consent.google.com,Ukraine-News ++ Russlands Armee wollte laut Prigoschin Wagner-Söldner in die Luft sprengen ++ - WELT,"<ol><li>Ukraine-News ++ Russlands Armee wollte laut Prigoschin Wagner-Söldner in die Luft sprengen ++  WELT
</li><li>Tag 463 der Ukraine-Invasion: Doppelte Blamage für den Kreml  Tagesspiegel
</li><li>Krieg in der Ukraine im Live-Ticker: Russische Behörden …",,2023-06-02T20:18:44Z,,"We use cookies and data to<ul><li>Deliver and maintain Google services</li><li>Track outages and protect against spam, fraud, and abuse</li><li>Measure audience engagement and site statistics to unde… [+1131 chars]",,de,'Krieg'
https://consent.google.com/ml?continue=https://news.google.com/rss/articles/CBMiV2h0dHBzOi8vd3d3Lm4tdHYuZGUvcG9saXRpay8wMC0zMC1TdG9sdGVuYmVyZy1zcHJpY2h0LW1pdC1FcmRvZ2FuLS1hcnRpY2xlMjMxNDM4MjQuaHRtbNIBV2h0dHBzOi8vYW1wLm4tdHYuZGUvcG9saXRpay8wMC0zMC1TdG9sdGVuYmVyZy1zcHJpY2h0LW1pdC1FcmRvZ2FuLS1hcnRpY2xlMjMxNDM4MjQuaHRtbA?oc%3D5&gl=FR&hl=en-US&cm=2&pc=n&src=1,https://consent.google.com/ml?continue=https://news.google.com/rss/articles/CBMiV2h0dHBzOi8vd3d3Lm4tdHYuZGUvcG9saXRpay8wMC0zMC1TdG9sdGVuYmVyZy1zcHJpY2h0LW1pdC1FcmRvZ2FuLS1hcnRpY2xlMjMxNDM4MjQuaHRtbNIBV2h0dHBzOi8vYW1wLm4tdHYuZGUvcG9saXRpay8wMC0zMC1TdG9sdGVuYmVyZy1zcHJpY2h0LW1pdC1FcmRvZ2FuLS1hcnRpY2xlMjMxNDM4MjQuaHRtbA?oc%3D5&gl=FR&hl=en-US&cm=2&pc=n&src=1,0,consent.google.com,Ukraine-Krieg im Liveticker: +++ 00:30 Stoltenberg spricht mit Erdogan +++ - n-tv NACHRICHTEN,"<ol><li>Ukraine-Krieg im Liveticker: +++ 00:30 Stoltenberg spricht mit Erdogan +++  n-tv NACHRICHTEN
</li><li>Ukraine-Krieg | Sprengfallen für Wagner-Kämpfer? Prigoschin attackiert Ministerium  t-online
</li><li>Insider warnen vor Nuklearkatastrophe in Sapo…",,2023-06-02T20:26:15Z,,"We use cookies and data to<ul><li>Deliver and maintain Google services</li><li>Track outages and protect against spam, fraud, and abuse</li><li>Measure audience engagement and site statistics to unde… [+1131 chars]",,de,'Krieg'
https://www.sueddeutsche.de/politik/ukraine-krieg-newsblog-prigoschin-rueckzug-bachmut-1.5873544,https://www.sueddeutsche.de/politik/ukraine-krieg-newsblog-prigoschin-rueckzug-bachmut-1.5873544,0,www.sueddeutsche.de,Liveblog zum Krieg in der Ukraine: Prigoschin erhebt schwere Vorwürfe gegen Moskau,"Das russische Verteidigungsministerium soll den Rückzugsweg der Söldner aus Bachmut vermint haben. Bei einem Europafest der SPD in Falkensee wird Olaf Scholz als ""Kriegstreiber"" beschimpft.",https://www.sueddeutsche.de/image/sz.1.5897523/1200x675?v=1685744300,2023-06-02T20:28:11Z,https://web.archive.org/web/20230603024449/https://www.sueddeutsche.de/politik/ukraine-krieg-newsblog-prigoschin-rueckzug-bachmut-1.5873544,Viele Angaben über den Kriegsverlauf wie Opferzahlen oder Details zu Kämpfen stammen von ukrainischen oder russischen Behörden und lassen sich oft nicht unabhängig überprüfen. Für unseren Liveblog ve… [+107 chars],,de,'Krieg'
https://www.faz.net/aktuell/politik/ukraine-liveticker-selenskyj-nato-mitgliedschaft-der-ukraine-vor-kriegsende-unmoeglich-faz-18495964.html,https://www.faz.net/aktuell/politik/ukraine-liveticker-selenskyj-nato-mitgliedschaft-der-ukraine-vor-kriegsende-unmoeglich-faz-18495964.html,0,www.faz.net,"Ukraine-Liveblog: Selenskyj: Nato-Mitgliedschaft der Ukraine vor Kriegsende „unmöglich""",Wagner-Chef: Truppen zu 99 Prozent aus Bachmut abgezogen +++ Berlin beschafft 66 Truppentransporter für Kiew +++ Amerika kauft Gepard-Luftabwehrsysteme für die Ukraine +++ alle Entwicklungen im Liveblog,https://media1.faz.net/ppmedia/aktuell/politik/3569071385/1.8938803/facebook_teaser/wolodymyr-selenskyj-praesident.jpg,2023-06-02T20:29:25Z,https://web.archive.org/web/20230602210808/https://www.faz.net/aktuell/politik/ukraine-liveticker-selenskyj-nato-mitgliedschaft-der-ukraine-vor-kriegsende-unmoeglich-faz-18495964.html,"Wolodymyr Selenskyj, Präsident der Ukraine, während des Gipfeltreffens der Europäischen Politischen Gemeinschaft (EPG) in Moldau Bild: dpa
Kein Nato-Mitglied in einen Krieg hineinziehen +++ Wagner-C… [+134 chars]",,de,'Ukraine'
https://www.faz.net/aktuell/politik/ukraine-liveticker-selenskyj-wir-sind-bereit-fuer-die-gegenoffensive-18495964.html,https://www.faz.net/aktuell/politik/ukraine-liveticker-selenskyj-wir-sind-bereit-fuer-die-gegenoffensive-18495964.html,0,www.faz.net,Ukraine-Liveblog: Selenskyj: Wir sind bereit für die Gegenoffensive,"Selenskyj: Nato-Mitgliedschaft vor Kriegsende „unmöglich“, wollen kein Nato-Mitglied in einen Krieg hineinziehen +++ Wagner-Chef: Truppen zu 99 Prozent aus Bachmut abgezogen +++ Berlin beschafft 66 Truppentransporter für Kiew +++ alle Entwicklungen im Liveblog",https://media1.faz.net/ppmedia/aktuell/politik/4186545794/1.8939077/facebook_teaser/die-ukraine-ist-praesident.jpg,2023-06-02T20:29:25Z,https://web.archive.org/web/20230603073649/https://www.faz.net/aktuell/politik/ukraine-liveticker-selenskyj-wir-sind-bereit-fuer-die-gegenoffensive-18495964.html,"Ukraine-Liveblog: Selenskyj: Wir sind bereit für die Gegenoffensive
Ukraine-Liveblog
Selenskyj: Wir sind bereit für die Gegenoffensive
Von Selenskyj: Nato-Mitgliedschaft vor Kriegsende unmöglich, … [+266 chars]",,de,'Ukraine'
