index,url,valid,domain,title,description,image,published,archive,content,quote,language,keyword
https://www.diepresse.com/18073343/die-stunde-der-diplomaten-in-uniform,https://www.diepresse.com/18073343/die-stunde-der-diplomaten-in-uniform,0,www.diepresse.com,Die Stunde der Diplomaten in Uniform [premium],Verteidigungsattachés operieren meistens jenseits der Öffentlichkeit. In Zeiten von Krieg und Krisen gewinnen sie an Bedeutung. Österreich rüstet deshalb jetzt auch militärdiplomatisch auf.,https://img.diepresse.com/public/incoming/o1ln4x-Nikolaus-Rottenberger/alternates/DPR_SOCIAL_NACHRICHTEN_PAID/Nikolaus%20Rottenberger,2024-02-06T15:14:09Z,,"Verteidigungsattachés operieren meistens jenseits der Öffentlichkeit. In Zeiten von Krieg und Krisen gewinnen sie an Bedeutung. Österreich rüstet deshalb jetzt auch militärdiplomatisch auf.
Wien. Di… [+524 chars]",,de,'Krieg'
https://www.zeit.de/wissen/umwelt/2024-02/energiewende-emissionen-europa-wind-sonne-gas-fossile,https://www.zeit.de/wissen/umwelt/2024-02/energiewende-emissionen-europa-wind-sonne-gas-fossile,0,www.zeit.de,Energiewende: Erstmals mehr Wind als Gas in Europas Energiemix,Weniger Nachfrage und mehr Wind- und Solarstrom haben 2023 die Emissionen im EU-Energiesektor gesenkt. Europas Windkraft konnte Frankreichs kompletten Strombedarf decken.,https://img.zeit.de/wissen/umwelt/2024-02/energiewende-emissionen-europa-wind-sonne-gas-bild/wide__1300x731,2024-02-06T23:50:52Z,,"Die Emissionen im Energiesektor in der EU sind einer Analyse 
zufolge in der Europäischen Union im vergangenen Jahr so stark 
zurückgegangen wie noch nie. Der Emissionsrückgang um 19 Prozent sei zu… [+2754 chars]",,de,'Windkraft'
https://www.nzz.ch/schweiz/sprengt-die-daemme-der-flusswasserkraftwerke-ld.1777184,https://www.nzz.ch/schweiz/sprengt-die-daemme-der-flusswasserkraftwerke-ld.1777184,0,www.nzz.ch,"INTERVIEW - Alpenforscher verteidigt Solarkraftwerke: «Wer sagt mir, dass nicht auch eine Kuh die Alpen verunstaltet?»","Boris Previsic kennt ein Rezept, um alpine Solaranlagen bei der Bergbevölkerung beliebt zu machen. Die Umweltverbände bezeichnet der Direktor des Instituts Kulturen der Alpen als Verhinderer.","https://img.nzz.ch/2024/02/06/e6843a1e-f674-4eea-a773-ef89ebbd6146.jpeg?width=1200&height=675&fit=bound&quality=75&auto=webp&crop=2933,1650,x468,y1480&wmark=nzz",2024-02-07T04:30:00Z,,"«Von einem Opfern der Natur kann bei den Solaranlagen in den Bergen keine Rede sein», sagt Boris Previsic, Direktor des Urner Forschungsinstituts Kulturen der Alpen.
Herr Previsic, wenn Sie Einwohne… [+12567 chars]",,de,'Solar'
https://taz.de/Stromproduktion-in-der-EU/!5991051/,https://taz.de/Stromproduktion-in-der-EU/!5991051/,0,taz.de,Stromproduktion in der EU: Wind und Sonne führen zum Rekord,Im Jahr 2023 sind in der EU fast 44 Prozent des Stroms aus erneuerbaren Energien erzeugt worden – ein Rekord. Kohle und Gas brachen deutlich ein.,https://taz.de/picture/6812826/948/34278439-1.jpeg,2024-02-07T09:46:00Z,,"Im Jahr 2023 sind in der EU fast 44 Prozent des Stroms aus erneuerbaren Energien erzeugt worden ein Rekord. Kohle und Gas brachen deutlich ein.
Erneuerbare auf dem Vormarsch, hier zu sehen auf einem… [+2449 chars]",,de,'Windkraft'
https://www.dw.com/de/engp%C3%A4sse-bei-bauteilen-gef%C3%A4hrden-windkraftausbau-in-deutschland/a-68152918,https://www.dw.com/de/engp%C3%A4sse-bei-bauteilen-gef%C3%A4hrden-windkraftausbau-in-deutschland/a-68152918,0,www.dw.com,Engpässe bei Bauteilen gefährden Windkraftausbau in Deutschland,Deutschland will die Strommenge aus Offshore-Windanlagen bis 2030 fast vervierfachen. Dieses Ziel sehen Experten in akuter Gefahr - unter anderem weil wichtige Teile für den Ausbau der Netzinfrastruktur fehlen.,https://static.dw.com/image/65123383_6.jpg,2024-02-07T10:52:00Z,,"Bundeskanzler Olaf Scholz scheint optimistisch: Die Koalition aus seiner SPD mit den Grünen und der FDP will die Energiewende weiter voranbringen. Trotz aller Haushalts-Probleme, trotz einer immer sp… [+6179 chars]",,de,'Windkraft'
https://www.dw.com/de/windkraftausbau-in-deutschland-in-gefahr/a-68152918,https://www.dw.com/de/windkraftausbau-in-deutschland-in-gefahr/a-68152918,0,www.dw.com,Windkraftausbau in Deutschland in Gefahr?,"Deutschland will den Strom aus Windanlagen auf dem Meer bis 2030 fast vervierfachen. Branchenvertreter sehen diese Ziele jetzt in Gefahr, auch wegen der Infrastruktur in den Seehäfen. Bundeskanzler Olaf Scholz scheint optimistisch: Die Koalition aus seiner SP…",https://static.dw.com/image/65123383_6.jpg,2024-02-07T10:52:00Z,,"Bundeskanzler Olaf Scholz scheint optimistisch: Die Koalition aus seiner SPD mit den Grünen und der FDP will die Energiewende weiter voranbringen. Trotz aller Haushalts-Probleme, trotz einer immer sp… [+6179 chars]",,de,'Windkraft'
