index,url,valid,domain,title,description,image,published,archive,content,quote,language,keyword
https://www.tagesspiegel.de/politik/schlimmer-als-corona-sportvereine-kampfen-mit-hohen-energiepreisen-8963320.html,https://www.tagesspiegel.de/politik/schlimmer-als-corona-sportvereine-kampfen-mit-hohen-energiepreisen-8963320.html,0,www.tagesspiegel.de,Schlimmer als Corona?: Sportvereine kämpfen mit hohen Energiepreisen,Für manche Klubs sind die Gas- und Stromkosten existenzbedrohend. Der „Bewegungsgipfel“ der Bundesregierung soll sich dem Thema annehmen.,https://www.tagesspiegel.de/images/hallenbader-offnen-nach-und-nach2/alternates/BASE_16_9_W1400/hallenbaeder-oeffnen-nach-und-nach.jpeg,2022-12-06T11:08:23Z,https://web.archive.org/web/20221206173927/https://www.tagesspiegel.de/politik/schlimmer-als-corona-sportvereine-kampfen-mit-hohen-energiepreisen-8963320.html,"Die Energiekrise könnte Deutschlands Breitensport härter treffen als die Corona-Pandemie. Was die hohen Gas- und Strompreise bedeuten, hat man im bayerischen Mittenwald bereits zu spüren bekommen - d… [+5570 chars]",,de,'Hohe Kosten'
https://www.stern.de/politik/ausland/bundesaussenministerin--baerbock--mit-indien-gemeinsam-gegen-klimakrise-kaempfen-32979614.html,https://www.stern.de/politik/ausland/bundesaussenministerin--baerbock--mit-indien-gemeinsam-gegen-klimakrise-kaempfen-32979614.html,0,www.stern.de,Bundesaußenministerin: Baerbock: Mit Indien gemeinsam gegen Klimakrise kämpfen,Am zweiten und letzten Tag ihrer Indien-Reise steht für Außenministerin Baerbock die Energiewende im Mittelpunkt. Aber auch ein anderer zentraler Ansatz ihrer Politik kommt nicht zu kurz.,https://image.stern.de/32979616/t/hC/v4/w1440/r1.7778/-/06--urnnewsmldpacom2009010122120699795238v2w800h600l751t509r3001b2004jpeg---ca5eda89270d2db2.jpg,2022-12-06T12:05:24Z,https://web.archive.org/web/20221206130750/https://www.stern.de/politik/ausland/bundesaussenministerin--baerbock--mit-indien-gemeinsam-gegen-klimakrise-kaempfen-32979614.html,"Am zweiten und letzten Tag ihrer Indien-Reise steht für Außenministerin Baerbock die Energiewende im Mittelpunkt. Aber auch ein anderer zentraler Ansatz ihrer Politik kommt nicht zu kurz.
Außenminis… [+3327 chars]",,de,'Gas'
https://www.diepresse.com/6224410/verstaatlichter-gashandel-brunner-will-sich-bei-omv-plaenen-nicht-einmischen,https://www.diepresse.com/6224410/verstaatlichter-gashandel-brunner-will-sich-bei-omv-plaenen-nicht-einmischen,0,www.diepresse.com,"Verstaatlichter Gashandel? Brunner will sich bei OMV-Plänen ""nicht einmischen""",Der Finanzminister werde sich in operative Angelegenheiten der OMV nicht einmischen. Auch die Öbag reagiert auf den Vorschlag von OMV-Chef Stern zurückhaltend.,https://media.diepresse.com/social_diepresse_nachrichten/images/uploads_1200/a/1/a/6224410/19757CE1-A308-455B-B510-788B1C3F182F_v0_h.jpg,2022-12-06T12:22:00Z,https://web.archive.org/web/20221206202849/https://www.diepresse.com/6224410/verstaatlichter-gashandel-brunner-will-sich-bei-omv-plaenen-nicht-einmischen,"Der Finanzminister werde sich in operative Angelegenheiten der OMV nicht einmischen. Auch die Öbag reagiert auf den Vorschlag von OMV-Chef Stern zurückhaltend.
Finanzminister Magnus Brunner (ÖVP) ha… [+5173 chars]",,de,'Gas'
https://www.n-tv.de/wirtschaft/Deutsche-Industrie-erhaelt-wieder-mehr-Auftraege-article23765512.html,https://www.n-tv.de/wirtschaft/Deutsche-Industrie-erhaelt-wieder-mehr-Auftraege-article23765512.html,0,www.n-tv.de,"""Ein Hauch von Nikolaus"": Deutsche Industrie erhält wieder mehr Aufträge",Deutschlands Wirtschaft steht angesichts von Energiekrise und Inflationsangst wohl vor einer Rezession. Die dürfte aber milder ausfallen als befürchtet. Darauf deuten die wieder anziehenden Bestellungen bei der deutschen Industrie hin.,https://bilder3.n-tv.de/img/incoming/crop23765598/5921325887-cImg_16_9-w1200/257903561.jpg,2022-12-06T12:25:49Z,https://web.archive.org/web/20221206123130/https://www.n-tv.de/wirtschaft/Deutsche-Industrie-erhaelt-wieder-mehr-Auftraege-article23765512.html,Deutschlands Wirtschaft steht angesichts von Energiekrise und Inflationsangst wohl vor einer Rezession. Die dürfte aber milder ausfallen als befürchtet. Darauf deuten die wieder anziehenden Bestellun… [+2967 chars],,de,'Inflation'
https://tirol.orf.at/stories/3185269/,https://tirol.orf.at/stories/3185269/,0,tirol.orf.at,Heizkostenzuschuss wurde verlängert,Das Land Tirol hat die Einreichfrist für den Heiz- und Energiekostenzuschuss um drei Monate bis zum 31. März verlängert. Auch Online-Anträge sind ab sofort möglich. Bisher seien rund 22.500 Anträge für den Heiz- und Energiekostenzuschuss beim Land Tirol einge…,https://ibs.orf.at/tir?image=https%3A%2F%2Foekastatic.orf.at%2Fmims%2F2021%2F43%2F38%2Fcrops%2Fw%3D1200%2Ch%3D627%2Cq%3D75%2F1120923_master_398538_heiz_kamine.jpg%3Fs%3D97c59c0ca062f1790652d41563f979fe27f9c6a1,2022-12-06T13:25:03Z,https://web.archive.org/web/20221206133326/https://tirol.orf.at/stories/3185269/,"Das Beratungs- und Informationsangebot soll ausgeweitet werden, zudem soll eine Hotline eingerichtet werden, wo sich Menschen erkundigen können, ob sie anspruchsberechtigt sind oder nicht. Uns geht e… [+2623 chars]",,de,'Energiekosten'
https://www.sueddeutsche.de/muenchen/muenchen-armut-muenchner-armutsbericht-stadtrat-1.5710545,https://www.sueddeutsche.de/muenchen/muenchen-armut-muenchner-armutsbericht-stadtrat-1.5710545,0,www.sueddeutsche.de,Armutsbericht: Hilfen für mehr Menschen,"Die Stadt will die Armutsgrenze künftig jährlich prüfen und das Angebot an Unterstützung ausbauen. Die Opposition fordert, kinderreiche Familien besser in den Blick zu nehmen.",https://www.sueddeutsche.de/image/sz.1.5701184/1200x675?v=1670340173,2022-12-06T15:14:30Z,https://web.archive.org/web/20221206171003/https://www.sueddeutsche.de/muenchen/muenchen-armut-muenchner-armutsbericht-stadtrat-1.5710545,Fast jeder sechste Mensch in München ist arm. Die Stadt will die Armutsgrenze künftig jährlich prüfen - und das Angebot an Unterstützung ausbauen. Fast jeder sechste Mensch in München ist arm. Der St… [+3178 chars],,de,'Armut'
https://www.sueddeutsche.de/politik/klimawandel-robert-habeck-namibia-suedafrika-wasserstoff-1.5710596,https://www.sueddeutsche.de/politik/klimawandel-robert-habeck-namibia-suedafrika-wasserstoff-1.5710596,0,www.sueddeutsche.de,Reise nach Namibia und Südafrika: Habecks Auszeit in der Zukunft,Im Süden Afrikas darf sich der grüne Wirtschaftsminister mit Windkraft und Wasserstoff befassen statt mit Gaskrise und Preisbremse. Doch sein zweites Jahr im Amt droht so ungemütlich zu werden wie das erste.,https://www.sueddeutsche.de/image/sz.1.5710597/1200x675?v=1670345620,2022-12-06T16:53:43Z,,Im Süden Afrikas darf sich der grüne Wirtschaftsminister mit Windkraft und Wasserstoff befassen statt mit Gaskrise und Preisbremse. Doch sein zweites Jahr im Amt droht so ungemütlich zu werden wie da… [+782 chars],,de,'Windkraft'
https://www.handelsblatt.com/finanzen/maerkte/devisen-rohstoffe/wirtschaftskriminalitaet-hacker-grossmacht-nordkorea-wird-zur-bedrohung-fuer-die-kryptowelt/28850308.html,https://www.handelsblatt.com/finanzen/maerkte/devisen-rohstoffe/wirtschaftskriminalitaet-hacker-grossmacht-nordkorea-wird-zur-bedrohung-fuer-die-kryptowelt/28850308.html,0,www.handelsblatt.com,Wirtschaftskriminalität: Hacker-Großmacht Nordkorea wird zur Bedrohung für die Kryptowelt,Strafverfolger und Finanzexperten werfen Nordkorea Kryptodiebstähle vor – offenbar ein zunehmend lukratives Geschäft für das Regime.,https://www.handelsblatt.com/images/flagge-von-nordkorea-bitcoin-symbol-montage/28851324/3-format2003.jpg,2022-12-06T16:55:47Z,https://web.archive.org/web/20221206173424/https://www.handelsblatt.com/finanzen/maerkte/devisen-rohstoffe/wirtschaftskriminalitaet-hacker-grossmacht-nordkorea-wird-zur-bedrohung-fuer-die-kryptowelt/28850308.html,"Tokio Für die Kryptowelt ist 2022 ein fürchterliches Jahr. Das liegt nicht nur an einer langen Serie von Skandalen wie dem Kollaps der Börse FTX, sondern auch am nordkoreanischen Diktator Kim Jong Un… [+1064 chars]",,de,'Bedrohung'
https://www.sueddeutsche.de/kolumne/hackerangriff-kritis-it-sicherheit-1.5703654,https://www.sueddeutsche.de/kolumne/hackerangriff-kritis-it-sicherheit-1.5703654,0,www.sueddeutsche.de,Kritische Infrastruktur: Bedrohung aus dem Cyberspace,"Das Jahr 2022 hat gezeigt, wie anfällig die Infrastruktur in Deutschland ist. Auch Hackerangriffe können für Unternehmen bedrohlich werden. Doch es gibt Wege, sich zu schützen.",https://www.sueddeutsche.de/image/sz.1.4278865/1200x675?v=1670244273,2022-12-06T17:55:55Z,https://web.archive.org/web/20221207103729/https://www.sueddeutsche.de/kolumne/hackerangriff-kritis-it-sicherheit-1.5703654,"Das Jahr 2022 hat gezeigt, wie anfällig die Infrastruktur in Deutschland ist. Auch Hackerangriffe können für Unternehmen bedrohlich werden. Doch es gibt Wege, sich zu schützen. Als Andreas Lederle an… [+422 chars]",,de,'Bedrohung'
https://www.faz.net/aktuell/politik/ukraine-liveticker-ukrainische-krankenhaeuser-sollen-planbare-operationen-aussetzen-18495964.html,https://www.faz.net/aktuell/politik/ukraine-liveticker-ukrainische-krankenhaeuser-sollen-planbare-operationen-aussetzen-18495964.html,0,www.faz.net,Ukraine-Liveticker: Ukrainische Krankenhäuser sollen planbare Operationen aussetzen,Ungarn blockiert EU-Finanzhilfen für Ukraine +++ Selenskyj besucht Stadt im Donbass nahe der Front +++ Video soll Raketenabschuss durch deutschen Gepard zeigen +++ alle Entwicklungen im Liveblog.,https://media0.faz.net/ppmedia/aktuell/politik/1289229851/1.8515534/facebook_teaser/stromausfall-waehrend-einer.jpg,2022-12-06T18:00:40Z,https://web.archive.org/web/20221206182211/https://www.faz.net/aktuell/politik/ukraine-liveticker-ukrainische-krankenhaeuser-sollen-planbare-operationen-aussetzen-18495964.html,Der russische Präsident Wladimir Putin hat wegen mutmaßlich ukrainischer Drohnenangriffe auf Militärstützpunkte in Russland am Dienstag den Sicherheitsrat seines Landes einberufen. Ranghohe Vertreter… [+496 chars],,de,'Bedrohung'
https://www.focus.de/panorama/welt/bedrohung-durch-nordkorea-und-china-japan-plant-milliardenausgaben-fuer-langstreckenraketen_id_180435128.html,https://www.focus.de/panorama/welt/bedrohung-durch-nordkorea-und-china-japan-plant-milliardenausgaben-fuer-langstreckenraketen_id_180435128.html,0,www.focus.de,Bedrohung durch Nordkorea und China - Japan plant Milliardenausgaben für Langstreckenraketen,Angesichts der Bedrohung durch Nordkoreas Raketen- und Atomwaffenprogramm sowie Chinas militärisches Aufrüsten will das Nachbarland Japan laut einem Medienbericht Milliardensummen in die Entwicklung von Langstreckenraketen investieren.,https://p6.focus.de/img/panorama/welt/id_159936848/eine-falcon-9-rakete-der-firma-spacex-und-die-dragon-kapsel-heben-mit-einer-multinationalen-besatzung-von-vier-astronauten-vom-launch-complex-39-a-in-cape-canaveral-ab..jpg?im=Crop%3D%280%2C170%2C2048%2C1024%29%3BResize%3D%281200%2C627%29&impolicy=perceptual&quality=medium&hash=5562c1ccb79dde34ef267d24f0bc7354297f61a2c274f283d889e2b7d0fad072,2022-12-07T04:31:01Z,https://web.archive.org/web/20221207080738/https://www.focus.de/panorama/welt/bedrohung-durch-nordkorea-und-china-japan-plant-milliardenausgaben-fuer-langstreckenraketen_id_180435128.html,Angesichts der Bedrohung durch Nordkoreas Raketen- und Atomwaffenprogramm sowie Chinas militärisches Aufrüsten will das Nachbarland Japan laut einem Medienbericht Milliardensummen in die Entwicklung … [+1598 chars],,de,'Bedrohung'
https://www.zeit.de/2022/49/deutschland-unmut-inflation-energiekrise-sozialpolitik,https://www.zeit.de/2022/49/deutschland-unmut-inflation-energiekrise-sozialpolitik,0,www.zeit.de,"Unmut in Deutschland: War das der ""heiße Herbst""?",Wochenlang wurde vor einem Herbst der Wutproteste gewarnt. Doch trotz Krieg und Inflation bleiben die Deutschen gelassen.,,2022-12-07T05:04:19Z,https://web.archive.org/web/20221207052159/https://www.zeit.de/2022/49/deutschland-unmut-inflation-energiekrise-sozialpolitik,"When browsing with ads:
We collect personal data and also transmit it to third-party providers
 that help us improve and finance our digital content. Some of the information stored on your device, … [+732 chars]",,de,'Inflation'
https://www.faz.net/aktuell/politik/ukraine-liveticker-briten-wollen-massiv-lng-aus-den-usa-importieren-18495964.html,https://www.faz.net/aktuell/politik/ukraine-liveticker-briten-wollen-massiv-lng-aus-den-usa-importieren-18495964.html,0,www.faz.net,Ukraine-Liveticker: Briten wollen massiv LNG aus den USA importieren,Ukrainische Krankenhäuser sollen planbare Operationen aussetzen +++ Ungarn blockiert EU-Finanzhilfen für Ukraine +++ Selenskyj besucht Stadt im Donbass nahe der Front +++ alle Entwicklungen im Liveblog.,https://media0.faz.net/ppmedia/aktuell/502730861/1.8516144/facebook_teaser/auf-einem-schiff-wird-lng.jpg,2022-12-07T06:03:23Z,https://web.archive.org/web/20221207062332/https://www.faz.net/aktuell/politik/ukraine-liveticker-briten-wollen-massiv-lng-aus-den-usa-importieren-18495964.html,Der russische Präsident Wladimir Putin hat wegen mutmaßlich ukrainischer Drohnenangriffe auf Militärstützpunkte in Russland am Dienstag den Sicherheitsrat seines Landes einberufen. Ranghohe Vertreter… [+496 chars],,de,'Bedrohung'
https://www.welt.de/wirtschaft/article242540567/Stromerzeugung-Ueber-ein-Drittel-des-erzeugten-Stroms-stammt-aus-Kohlekraftwerken.html,https://www.welt.de/wirtschaft/article242540567/Stromerzeugung-Ueber-ein-Drittel-des-erzeugten-Stroms-stammt-aus-Kohlekraftwerken.html,0,www.welt.de,Über ein Drittel des erzeugten Stroms stammt aus Kohlekraftwerken,"In Reaktion auf den Ukraine-Krieg wird Kohle für die Energieversorgung in Deutschland immer wichtiger. Im Sommer-Quartal kletterte die Einspeisung von Kohlestrom laut dem Statistischen Bundesamt auf Jahressicht um 13,3 Prozent und macht damit ein Drittel des …",https://img.welt.de/img/regionales/nrw/mobile242445785/9591352977-ci16x9-w1200/Kohlekraftwerk-Niederaussem-E-und-F.jpg,2022-12-07T09:10:54Z,https://web.archive.org/web/20221207095247/https://www.welt.de/wirtschaft/article242540567/Stromerzeugung-Ueber-ein-Drittel-des-erzeugten-Stroms-stammt-aus-Kohlekraftwerken.html,"Deutschland setzt bei der Stromproduktion weiterhin vor allem auf Kohle. Im dritten Quartal 2022 stammte mehr als ein Drittel (36,3 Prozent) der gesamten hierzulande erzeugten Strommenge von 118,1 Mi… [+1367 chars]",,de,'Windkraft'
https://www.handelsblatt.com/meinung/kommentare/ihr-kommentar-im-handelsblatt-oelembargo-und-oelpreisdeckel-koennen-die-massnahmen-russland-tatsaechlich-schaden/28851116.html,https://www.handelsblatt.com/meinung/kommentare/ihr-kommentar-im-handelsblatt-oelembargo-und-oelpreisdeckel-koennen-die-massnahmen-russland-tatsaechlich-schaden/28851116.html,0,www.handelsblatt.com,Ihr Kommentar im Handelsblatt: Ölembargo und Ölpreisdeckel: Können die Maßnahmen Russland tatsächlich schaden?,"Seit Montag sind das Ölembargo und der Ölpreisdeckel in Kraft. Uns interessiert, für wie sinnvoll Handelsblatt-Leser die Maßnahmen halten. Schreiben Sie uns einen Kommentar!",https://www.handelsblatt.com/images/oelfoerderung-in-russland/28851130/3-format2003.jpg,2022-12-07T09:34:33Z,,"Ölförderung in RusslandDas EU-Embargo auf russisches Erdöl ist seit Montag in Kraft.
(Foto: dpa)
Das Ölembargo der Europäischen Union (EU) gilt seit Montag. Über den Seeweg darf ab sofort kein russ… [+2407 chars]",,de,'Russland'
https://www.stern.de/digital/online/das-waren-die-groessten-google-suchtrends-des-jahres-2022-32982098.html,https://www.stern.de/digital/online/das-waren-die-groessten-google-suchtrends-des-jahres-2022-32982098.html,0,www.stern.de,"Rückblick auf 2022: Queen, Ukraine, Putin: Das waren die größten Google-Suchtrends des Jahres","Putin, Queen, WM – ein Rückblick auf die Google-Trends ist auch ein Rückblick auf die Ereignisse des Jahres. Diese Suchtrends waren 2022 am größten.",https://image.stern.de/32982072/t/by/v4/w1440/r1.7778/-/queen-imago0168163612h.jpg,2022-12-07T09:39:00Z,,Jeden Tag geben die Menschen Millionen von Suchanfragen bei Google ein. Die Suchmaschine dominiert noch immer das Feld der Internetsuchen sehr deutlich vor allen Konkurrenzangeboten. Manche Zeichenke… [+4000 chars],,de,'Putin'
https://www.diepresse.com/6199225/diplomaten-russland-bestellt-hunderte-drohnen-und-raketen-vom-iran,https://www.diepresse.com/6199225/diplomaten-russland-bestellt-hunderte-drohnen-und-raketen-vom-iran,0,www.diepresse.com,Diplomaten: Russland bestellt Hunderte Drohnen und Raketen vom Iran,"UN-Diplomaten berichten von neuen Bestellungen Russlands im Iran. Nach dem erneuten Beschuss eines russischen Flugplatzes betonen die USA, die Ukraine nicht zu derartigen Angriffen ermutigt zu haben.",https://media.diepresse.com/social_diepresse_nachrichten/images/uploads_1200/7/b/9/6199225/DA5B11B6-72A3-4CBC-90C1-C3A136E13374_v0_h.jpg,2022-12-07T09:53:00Z,,"UN-Diplomaten berichten von neuen Bestellungen Russlands im Iran. Nach dem erneuten Beschuss eines russischen Flugplatzes betonen die USA, die Ukraine nicht zu derartigen Angriffen ermutigt zu haben.",,de,'Ukraine'
https://www.tagesschau.de/ausland/europa/russland-prozess-safronow-101.html,https://www.tagesschau.de/ausland/europa/russland-prozess-safronow-101.html,0,www.tagesschau.de,Russland: Ein bisschen Hoffnung für Safronow?,"22 Jahre Straflager für einen Journalisten - das ist selbst für Russland ungewöhnlich. Iwan Safronow soll Staatsgeheimnisse verraten haben, doch der Prozess warf Fragen auf. Was erwartet er von der Berufung? <em>Von C. Nagel.</em>",https://www.tagesschau.de/multimedia/bilder/iwan-safronow-101~_v-original.jpg,2022-12-07T09:57:11Z,https://web.archive.org/web/20221207135453/https://www.tagesschau.de/ausland/europa/russland-prozess-safronow-101.html,"22 Jahre Straflager für einen Journalisten - das ist selbst für Russland ungewöhnlich. Iwan Safronow soll Staatsgeheimnisse verraten haben, doch der Prozess warf Fragen auf. Was erwartet er von der B… [+3192 chars]",,de,'Russland'
https://www.zeit.de/2022/51/angela-merkel-russland-fluechtlingskrise-bundeskanzler,https://www.zeit.de/2022/51/angela-merkel-russland-fluechtlingskrise-bundeskanzler,0,www.zeit.de,"Angela Merkel: ""Hatten Sie gedacht, ich komme mit Pferdeschwanz?""","Angela Merkel spricht im Interview mit der ZEIT über ihren neuen Lebensabschnitt. Die Ex-Kanzlerin erklärt, was sie an ihrer Russland-Politik noch heute für richtig hält.",,2022-12-07T10:03:00Z,http://archive.md/20221207101523/https://www.zeit.de/2022/51/angela-merkel-russland-fluechtlingskrise-bundeskanzler,"When browsing with ads:
We collect personal data and also transmit it to third-party providers
 that help us improve and finance our digital content. Some of the information stored on your device, … [+732 chars]",,de,'Russland'
https://www.n-tv.de/wirtschaft/Kohle-ist-in-Deutschland-wieder-auf-dem-Vormarsch-article23767884.html,https://www.n-tv.de/wirtschaft/Kohle-ist-in-Deutschland-wieder-auf-dem-Vormarsch-article23767884.html,0,www.n-tv.de,Stromerzeugung steigt 13 Prozent: Kohle ist in Deutschland wieder auf dem Vormarsch,Wegen des russischen Angriffs auf die Ukraine wird in Deutschland wieder mehr Kohle verstromt. Der Anteil an der gesamten Strommenge steigt um 13 Prozent. Der Anteil von Erdgas steigt ebenfalls. Doch auch die erneuerbaren Energien legen zu.,https://bilder4.n-tv.de/img/incoming/crop23767887/4091329300-cImg_16_9-w1200/ce7107f119a2e0da2225d1d750325a8b.jpg,2022-12-07T10:06:53Z,,Wegen des russischen Angriffs auf die Ukraine wird in Deutschland wieder mehr Kohle verstromt. Der Anteil an der gesamten Strommenge steigt um 13 Prozent. Der Anteil von Erdgas steigt ebenfalls. Doch… [+2934 chars],,de,'Gas'
https://www.tagesspiegel.de/wirtschaft/lng-lieferungen-warum-russland-flussiggas-auf-rekordhoch-ausfuhrt-8986852.html,https://www.tagesspiegel.de/wirtschaft/lng-lieferungen-warum-russland-flussiggas-auf-rekordhoch-ausfuhrt-8986852.html,0,www.tagesspiegel.de,LNG-Lieferungen: Warum Russland Flüssiggas auf Rekordhoch ausführt,Russlands LNG-Export auf dem Seeweg steigt stark – indirekt wahrscheinlich auch nach Deutschland. Mit den Einnahmen füllt der Kreml seine Kriegskasse.,https://www.tagesspiegel.de/images/lng-terminal-in-brunsbuttel/alternates/BASE_16_9_W1400/lng-terminal-in-brunsbuettel.jpeg,2022-12-07T10:12:52Z,http://archive.md/20221207130452/https://www.tagesspiegel.de/wirtschaft/lng-lieferungen-warum-russland-flussiggas-auf-rekordhoch-ausfuhrt-8986852.html,"Durch die Nord Stream-Pipelines und die Jamal-Leitung durch Polen fließt längst kein russisches Gas mehr nach Deutschland. Und was über die Ukraine oder die Türkei in die EU kommt, gelangt nicht bis … [+260 chars]",,de,'Krieg'
https://www.tagesspiegel.de/potsdam/landeshauptstadt/medikamente-fur-kinderkliniken-hilfslieferung-aus-potsdam-in-die-ukraine-gebracht-8986936.html,https://www.tagesspiegel.de/potsdam/landeshauptstadt/medikamente-fur-kinderkliniken-hilfslieferung-aus-potsdam-in-die-ukraine-gebracht-8986936.html,0,www.tagesspiegel.de,Medikamente für Kinderkliniken: Hilfslieferung aus Potsdam in die Ukraine gebracht,Der Förderkreis des Bergmann-Klinikums transportierte Verbandsstoffe sowie Überwachungs- und Diagnosegeräte in das kriegsgeplagte Land. Drei Krankenhäuser wurden beliefert.,https://www.tagesspiegel.de/images/ukraine-krieg-tschernihiw3/alternates/BASE_16_9_W1400/ukraine-krieg---tschernihiw.jpeg,2022-12-07T10:13:32Z,,"Der Förderkreis des Potsdamer Klinikums Ernst von Bergmann hat eine umfangreiche Hilfslieferung in die Ukraine gebracht: Medikamente für Frühgeborene, Kinder und Verwundete, Verbandsstoffe sowie Über… [+1255 chars]",,de,'Ukraine'
https://www.brigitte.de/aktuell/buzz/dieser-geniale-haushaltstipp-wird-dein-weihnachtsessen-retten--13440154.html,https://www.brigitte.de/aktuell/buzz/dieser-geniale-haushaltstipp-wird-dein-weihnachtsessen-retten--13440154.html,0,www.brigitte.de,Energie sparen: Dieser geniale Haushaltstipp wird dein Weihnachtsessen retten,"Weihnachten kann – vor allem, wenn man selbst Gastgeber:in ist – zeitweise ziemlich stressig werden. Aus diesem Grund verraten wir euch einen genialen Haushaltstipp, der hält, was er verspricht, und zwar: weniger Stress!",https://image.brigitte.de/13440264/t/UE/v2/w1440/r1.7778/-/dieser-geniale-haushaltstipp-rettet-weihnachten.jpg,2022-12-07T10:25:00Z,https://web.archive.org/web/20221207112013/https://www.brigitte.de/aktuell/buzz/dieser-geniale-haushaltstipp-wird-dein-weihnachtsessen-retten--13440154.html,"Weihnachten kann vor allem, wenn man selbst Gastgeber:in ist zeitweise ziemlich stressig werden. Aus diesem Grund verraten wir euch einen genialen Haushaltstipp, der hält, was er verspricht, und zwar… [+1815 chars]",,de,'Energie sparen'
https://www.welt.de/politik/ausland/plus242519123/Drohnen-Ukraine-zeigt-dass-sie-Russland-tief-im-Landesinneren-treffen-kann.html,https://www.welt.de/politik/ausland/plus242519123/Drohnen-Ukraine-zeigt-dass-sie-Russland-tief-im-Landesinneren-treffen-kann.html,0,www.welt.de,"Die Ukraine zeigt, dass sie Russland tief im Landesinneren treffen kann","Vermutlich mit umgebauten sowjetischen Drohnen hat die Ukraine russische Stützpunkte und ein Öllager angegriffen, Hunderte Kilometer im Inneren Russlands Alle drei Ziele haben eines gemeinsam. Und im Westen werden Forderungen lauter, Kiew endlich Langstrecken…",https://img.welt.de/img/politik/ausland/mobile242519571/1311355647-ci16x9-w1200-fnov-fpotl-fpi157750653/DWO-Teaser-explosion-aw3.jpg,2022-12-07T10:34:00Z,http://archive.md/20221207104404/https://www.welt.de/politik/ausland/plus242519123/Drohnen-Ukraine-zeigt-dass-sie-Russland-tief-im-Landesinneren-treffen-kann.html,"Pell Puteua Ghlupel kepeu ple Bnppeu lkleu Gllea aeaeu ple nhlelulpeke Nlultpeuothelnua luleuplulell Oll lkleu Oepplueu, uothelleeklpvlpllaeu Pualltteu ent hllllpeke lutlepllnhlnl. Bp lpl Pnpplneh pe… [+7596 chars]",,de,'Russland'
https://www.welt.de/politik/ausland/plus242518369/US-Experte-Der-Iran-hat-eine-folgenschwere-Entscheidung-getroffen.html,https://www.welt.de/politik/ausland/plus242518369/US-Experte-Der-Iran-hat-eine-folgenschwere-Entscheidung-getroffen.html,0,www.welt.de,„Der Iran hat eine folgenschwere Entscheidung getroffen“,"Der Iran liefert Drohnen an Russland und schickt sogar Revolutionsgardisten auf die Krim. Das steht für Robert Malley, Iran-Experte der US-Regierung, fest. Er spricht über die Versuche, das Atomabkommen wiederherzustellen. Und er nennt das Szenario, in dem di…",https://img.welt.de/img/politik/ausland/mobile242519423/1621356657-ci16x9-w1200-fnov-fpotl-fpi157750653/Iran-Started-Nationwide-Drone-Exercises.jpg,2022-12-07T10:39:00Z,,"VBUI: Bleneu nup lnuae Zeupekeu kepeu elue Bluleplpeveanua lu 6eua aepelel, vle ep ple lu pel leuaeleu 6epeklekle pep lleu uuek ule aeaepeu kel. Feupetl ep plek pepel nO elue Beuutle upel elvep, pep … [+5204 chars]",,de,'Russland'
