index,url,valid,domain,title,description,image,published,archive,content,quote,language,keyword
https://www.stern.de/gesellschaft/regional/sachsen/demonstrationen--buendnis--dresden-wi-e-dersetzen---kein-platz-fuer-neonazis-37120336.html,https://www.stern.de/gesellschaft/regional/sachsen/demonstrationen--buendnis--dresden-wi-e-dersetzen---kein-platz-fuer-neonazis-37120336.html,0,www.stern.de,"Demonstrationen: Bündnis ""Dresden Wi(e)dersetzen"": Kein Platz für Neonazis",Zum Gedenken an die Kriegszerstörung von Dresden im Februar 1945 marschieren jedes Jahr Rechtsextreme auf. Ein Bündnis stellt sich quer und setzt auf möglichst großen Beistand aus der Bevölkerung.,https://image.stern.de/37120338/t/DE/v1/w1440/r1.7778/-/09--bq7cpo2phqv5axs2048jpeg---d091651f7ab6203f.jpg,2026-02-09T13:24:52Z,,"Kopiere den aktuellen Link
Zur Merkliste hinzufügen
Zum Gedenken an die Kriegszerstörung von Dresden im Februar 1945 marschieren jedes Jahr Rechtsextreme auf. Ein Bündnis stellt sich quer und setzt… [+2132 chars]",,de,'Krieg'
https://www.zeit.de/news/2026-02/09/wie-starlink-den-krieg-in-der-ukraine-beeinflusst,https://www.zeit.de/news/2026-02/09/wie-starlink-den-krieg-in-der-ukraine-beeinflusst,0,www.zeit.de,Krieg in der Ukraine: Wie Starlink den Krieg in der Ukraine beeinflusst,Hier finden Sie Informationen zu dem Thema „Krieg in der Ukraine“. Lesen Sie jetzt „Wie Starlink den Krieg in der Ukraine beeinflusst“.,https://img.zeit.de/news/2026-02/09/wie-starlink-den-krieg-in-der-ukraine-beeinflusst-image-group/wide__1300x731,2026-02-09T14:07:26Z,,Nach einer Reihe von aufsehenerregenden Schlägen des russischen Militärs gegen den Nachschub der Ukrainer wurden Moskaus Streitkräfte nun vom Internetsystem Starlink abgeschaltet. Erste Reaktionen ru… [+5180 chars],,de,'Krieg'
https://www.faz.net/aktuell/feuilleton/kunstmarkt/irina-zatulovskaya-in-der-galerie-volker-diehl-110833557.html,https://www.faz.net/aktuell/feuilleton/kunstmarkt/irina-zatulovskaya-in-der-galerie-volker-diehl-110833557.html,0,www.faz.net,Russische Gegenwartskunst: Lob der heiligen Armut,Auf rostigem Eisen oder grobem Stein schafft die russischen Malerin Irina Zatulovskaya Bilder eines entbehrungsreichen Lebens. Nun widmet die Berliner Galerie Volker Diehl ihr erstmals eine Verkaufsschau in Deutschland.,https://media0.faz.net/image/w1200h627/4f951c08a71a/w3000h1567x0y302o/022026/1.10833556/prozession-der.webp,2026-02-09T16:38:59Z,,"In Russland ist sie zurzeit eine der gefragten Künstlerinnen: die Moskauer Malerin und Dichterin Irina Zatulovskaya. Einer Malerfamilie entstammend, skizziert Irina Zatulovskaya Symbolbilder in naive… [+4266 chars]",,de,'Armut'
https://orf.at/stories/3419702/,https://orf.at/stories/3419702/,0,orf.at,Ex-Landeshauptmann Hans Niessl zu Gast,,https://orf.at/mojo/1_4_1/storyserver//news/common/images/og-fallback-news.png,2026-02-09T19:30:23Z,,"Entscheidende Tage für die SPÖ: In wenigen Tagen entscheidet der Parteivorstand, ob Andreas Babler einen Gegenkandidaten beim Parteitag im März bekommt. Zugleich bringt sich der frühere burgenländisc… [+1072 chars]",,de,'Armut'
https://www.zeit.de/politik/ausland/2026-02/russische-wirtschaft-wladimir-putin-ukraine-krieg-finanzprobleme,https://www.zeit.de/politik/ausland/2026-02/russische-wirtschaft-wladimir-putin-ukraine-krieg-finanzprobleme,0,www.zeit.de,Russische Wirtschaft: Auch der Bäcker soll den Krieg bezahlen,"Sanktionen, sinkende Ölpreise, Inflation: Nach vier Jahren Krieg gegen die Ukraine steht Russland vor einer Wirtschaftskrise. Und Wladimir Putin braucht neue Geldquellen.",https://img.zeit.de/politik/ausland/2026-02/russische-wirtschaft-wladimir-putin-ukraine-krieg-finanzprobleme-bild/wide__1300x731,2026-02-10T04:26:58Z,,"Denis Maximow steht an einem Dezembertag etwas nervös vor seiner Bäckerei in einem Moskauer Vorort. Im Staats-TV läuft gerade Wladimir Putins alljährliche Sprechstunde, und die Redakteure der Propaga… [+662 chars]",,de,'Putin'
https://www.faz.net/aktuell/wirtschaft/immobilien-wohnen/energie-heizung/die-vernetzte-heizung-mit-digitalisierung-die-energiekosten-senken-accg-110823578.html,https://www.faz.net/aktuell/wirtschaft/immobilien-wohnen/energie-heizung/die-vernetzte-heizung-mit-digitalisierung-die-energiekosten-senken-accg-110823578.html,0,www.faz.net,vernetzte Heizung: Digitale Thermostate sollen  Energiekosten senken,"Die Heizkosten steigen in den kalten Monaten. Die Digitalisierung soll die Wärme besser verteilen und den Verbrauch senken. Auf solche Hilfsmittel setzen nun auch Vermieter, um die Gebäude zu ertüchtigen.",https://media0.faz.net/image/w1200h627/c4270b836ba8/w3000h1567x0y182o/012026/1.10823575/aussen-kalt-innen-warm-auch-im.webp,2026-02-10T10:15:00Z,,"Wer es morgens im Badezimmer warm haben will, muss im Winter nachts die Heizung länger aufgedreht lassen oder schon vorher selbst die Heiztemperatur rechtzeitig erhöhen. Einfacher geht es, wenn die H… [+5598 chars]",,de,'Energiekosten'
https://www.tagesspiegel.de/internationales/radikaler-anti-klimaschutz-kurs-trump-regierung-will-treibhausgase-offenbar-nicht-mehr-als-gesundheitsschadlich-einstufen-15235153.html,https://www.tagesspiegel.de/internationales/radikaler-anti-klimaschutz-kurs-trump-regierung-will-treibhausgase-offenbar-nicht-mehr-als-gesundheitsschadlich-einstufen-15235153.html,0,www.tagesspiegel.de,Radikaler Anti-Klimaschutz-Kurs: Trump-Regierung will Treibhausgase offenbar nicht mehr als gesundheitsschädlich einstufen,"Der US-Präsident treibt seinen radikalen Kurs gegen den Klimaschutz voran. Sollte die wissenschaftliche Gefährdungsfeststellung zu Treibhausgasen gekippt werden, würden auch die Emissionsstandards für die Autoindustrie wegfallen.",https://www.tagesspiegel.de/images/15235170/alternates/BASE_16_9_W1400/1770715750000/file-photo-trump-set-to-repeal-landmark-climate-finding-in-huge-regulatory-rollback-this-week.jpeg,2026-02-10T11:12:19Z,,Es wäre der bislang weitreichendste Bruch mit der bisherigen US-Klimapolitik: Die Trump-Regierung will offenbar die Rechtsgrundlage für die Regulierung von Treibhausgasen auf Bundesebene beseitigen. … [+3919 chars],,de,'Energiekosten'
https://www.zeit.de/politik/ausland/2026-02/russland-telegram-einschraenkungen-max,https://www.zeit.de/politik/ausland/2026-02/russland-telegram-einschraenkungen-max,0,www.zeit.de,Messaging-App: Russland kündigt Einschränkungen für Telegram-Messenger an,"Russlands Medienaufsicht wirft Telegram vor, verbotene Inhalte nicht gelöscht zu haben. Nutzer in Russland melden Verbindungsprobleme bei der dort sehr bedeutenden App.",https://img.zeit.de/politik/ausland/2026-02/russland-telegram-einschraenkungen-max-bild/wide__1300x731,2026-02-10T14:09:18Z,,"Die russische Medienaufsichtsbehörde Roskomnadsor (RKN) hat angekündigt, den Informationsaustausch über die in Russland intensiv genutzte Messaging-App Telegram einzuschränken. Es würden weitere rest… [+2147 chars]",,de,'Russland'
https://www.golem.de/sonstiges/zustimmung/auswahl.html?from=https://www.golem.de/news/russisches-teleskop-weltraumschrott-in-3-500-km-entfernung-aufspueren-2602-205169.html&referer=https://t.co/d6fbfac1fe,https://www.golem.de/sonstiges/zustimmung/auswahl.html?from=https://www.golem.de/news/russisches-teleskop-weltraumschrott-in-3-500-km-entfernung-aufspueren-2602-205169.html&referer=https://t.co/d6fbfac1fe,0,www.golem.de,Russisches Teleskop: Weltraumschrott in 3.500 km Entfernung aufspüren,"Anfang 2026 will Russland sein neues Teleskop in Betrieb nehmen. Mit ihm können Satelliten und Weltraumschrott in einem erdnahen Orbit erkannt werden. (Russland, Raumfahrt)",,2026-02-10T15:45:02Z,,"Besuchen Sie Golem.de wie gewohnt mit Werbung und Tracking,
 indem Sie der Nutzung aller Cookies zustimmen.
 Details zum Tracking finden Sie im Privacy Center.
Skript wurde nicht geladen. Informat… [+607 chars]",,de,'Russland'
https://www.zeit.de/news/2026-02/10/streicheln-statt-schweigen-wie-hunde-vor-gericht-helfen,https://www.zeit.de/news/2026-02/10/streicheln-statt-schweigen-wie-hunde-vor-gericht-helfen,0,www.zeit.de,Tiere als Unterstützung: Vier Pfoten gegen die Angst: Wie Hunde vor Gericht helfen,Hier finden Sie Informationen zu dem Thema „Tiere als Unterstützung“. Lesen Sie jetzt „Vier Pfoten gegen die Angst: Wie Hunde vor Gericht helfen“.,https://img.zeit.de/news/2026-02/10/streicheln-statt-schweigen-wie-hunde-vor-gericht-helfen-image-group/wide__1300x731,2026-02-10T16:23:38Z,,"Ein Kind soll vor dem Richter Platz nehmen. Die Hände zittern, die Stimme stockt. Neben ihm liegt ein Hund. Sein Fell ist warm unter der Hand, der Kopf ruht sanft auf dem Schoß. Für das Kind, das ger… [+3633 chars]",,de,'Angst'
https://www.zeit.de/news/2026-02/10/eu-chefdiplomatin-russland-gewinnt-nicht-eu-kann-fordern,https://www.zeit.de/news/2026-02/10/eu-chefdiplomatin-russland-gewinnt-nicht-eu-kann-fordern,0,www.zeit.de,Ukraine-Krieg: EU-Chefdiplomatin: Russland gewinnt nicht - EU kann fordern,Hier finden Sie Informationen zu dem Thema „Ukraine-Krieg“. Lesen Sie jetzt „EU-Chefdiplomatin: Russland gewinnt nicht - EU kann fordern“.,https://img.zeit.de/news/2026-02/10/eu-chefdiplomatin-russland-gewinnt-nicht-eu-kann-fordern-image-group/wide__1300x731,2026-02-10T16:23:55Z,,Geheimdiensterkenntnisse deuten nach Angaben von EU-Chefdiplomatin Kaja Kallas nicht auf einen bevorstehenden russischen Durchbruch im Angriffskrieg gegen die Ukraine hin. «Russland gewinnt nicht. Im… [+2345 chars],,de,'Russland'
https://www.faz.net/aktuell/politik/ausland/neue-kommandostruktur-opas-alte-nato-kommt-nicht-wieder-110835074.html,https://www.faz.net/aktuell/politik/ausland/neue-kommandostruktur-opas-alte-nato-kommt-nicht-wieder-110835074.html,0,www.faz.net,Neue Kommandostruktur: Opas alte NATO kommt nicht wieder,"Trump treibt die Europäisierung der Allianz voran. Für die Verbündeten bleibt das eine zwiespältige Entwicklung, denn es ändert die Botschaft an Putin.",https://media0.faz.net/image/w1200h627/6a107f303241/w2101h1097x0y152o/022026/1.10835069/die-nato-flagge-vor-dem.webp,2026-02-10T21:28:21Z,,Auch in der Kommandostruktur lässt Trump jetzt seine Vorstellung von einer neuen Arbeitsteilung in der NATO durchsetzen. Die Europäer sollen die Hauptverantwortung für ihre konventionelle Verteidigun… [+1794 chars],,de,'Putin'
https://www.zeit.de/politik/deutschland/2026-02/sabotage-bundeswehr-korvette-hamburg-blohm-voss-festnahme,https://www.zeit.de/politik/deutschland/2026-02/sabotage-bundeswehr-korvette-hamburg-blohm-voss-festnahme,0,www.zeit.de,Sabotage an Bundeswehr-Korvetten: Sie wirkten wie ehrliche Handwerker,"Sie sollen Bundeswehrschiffe beschädigt haben, nun sitzen sie in Haft: Zwei Werftarbeitern werden schwere Sabotageakte vorgeworfen. Steckt wirklich Russland dahinter?",https://img.zeit.de/politik/deutschland/2026-02/sabotage-bundeswehr-korvette-hamburg-blohm-voss-festnahme-bild/wide__1300x731,2026-02-11T04:25:17Z,,"Es war offenbar ganz leicht, die Korvette Köln auszuknipsen. Am 26. Juni 2025 liegt das 89 Meter lange Schiff der deutschen Marine auf der Werft Blohm + Voss im Hamburger Hafen, ein Donnerstagnachmit… [+525 chars]",,de,'Russland'
https://www.golem.de/sonstiges/zustimmung/auswahl.html?from=https://www.golem.de/news/russland-sanktionen-eu-geht-gegen-kryptoplattformen-vor-2602-205255.html&referer=https://t.co/ac89e5b17e,https://www.golem.de/sonstiges/zustimmung/auswahl.html?from=https://www.golem.de/news/russland-sanktionen-eu-geht-gegen-kryptoplattformen-vor-2602-205255.html&referer=https://t.co/ac89e5b17e,0,www.golem.de,Russland-Sanktionen: EU geht gegen Kryptoplattformen vor,"Die Europäische Kommission will mit ihrem 20. Sanktionspaket gegen Russland erstmals gezielt Kryptowährungen einschränken. (Kryptowährung, Politik)",,2026-02-11T06:34:02Z,,"Besuchen Sie Golem.de wie gewohnt mit Werbung und Tracking,
 indem Sie der Nutzung aller Cookies zustimmen.
 Details zum Tracking finden Sie im Privacy Center.
Skript wurde nicht geladen. Informat… [+607 chars]",,de,'Russland'
https://www.zeit.de/politik/ausland/2026-02/arktis-grossbritannien-soldaten-norwegen-russland-nato-arctic-sentry,https://www.zeit.de/politik/ausland/2026-02/arktis-grossbritannien-soldaten-norwegen-russland-nato-arctic-sentry,0,www.zeit.de,Arktis: Großbritannien will mehr Soldaten nach Norwegen verlegen,Wegen der russischen Bedrohung will Großbritannien seine Truppenzahl in Norwegen verdoppeln. Norwegens Armeechef schloss einen russischen Angriff am Polarkreis nicht aus.,https://img.zeit.de/administratives/sharing/fallback-image-die-zeit/wide__1300x731,2026-02-11T07:44:03Z,,"Zum besseren Schutz der Arktis und des hohen 
Nordens will Großbritannien die Zahl seiner in Norwegen stationierten 
Soldaten auf 2.000 
verdoppeln. Das werde Verteidigungsminister John Healey am … [+1048 chars]",,de,'Putin'
https://www.n-tv.de/politik/Bericht-Selenskyj-plant-Praesidentschaftswahlen-und-Referendum-id30349484.html,https://www.n-tv.de/politik/Bericht-Selenskyj-plant-Praesidentschaftswahlen-und-Referendum-id30349484.html,0,www.n-tv.de,Abstimmung bis Mai?: Bericht: Selenskyj plant Präsidentschaftswahlen und Referendum,Die USA haben sich ein neues Ziel gesetzt und wollen den russischen Krieg gegen die Ukraine nun bis zum Sommer beenden. Dafür fordert Washington von Kiew einem Bericht zufolge unter anderem Präsidentschaftswahlen. In wenigen Monaten könnten diese demnach stat…,https://www.n-tv.de/img/30349664/1770799660/Img_16_9/1200/Aftermath-of-Russian-missile-strike-in-Ukraine-s-Pokrovsk-city-POKROVSK-DONETSK-OBLAST-UKRAINE-AUGUST-9-An-aerial-view-of-damaged-buildings-after-Russian-missile-strike-in-Pokrovsk-Donetsk-Oblast-Ukraine-on-August-9-2023-Officials-stated-that-7-people-were-killed-as-some-of-the-buildings-became-unusable-Donets-ka-Oblast-Ukraine-Editorial-use-only-Please-get-in-touch-for-any-other-usage.jpg,2026-02-11T07:56:03Z,,"Zerstörung im Osten der Ukraine durch russische Angriffe. Das Abhalten von Wahlen würde das Land vor große Herausforderungen stellen. (Foto: IMAGO/Anadolu Agency)
Die USA haben sich ein neues Ziel g… [+2859 chars]",,de,'Ukraine'
https://www.focus.de/politik/ausland/putin-startet-wettruesten-gegen-europa-dieses-szenario-fuerchtet-der-kreml_1cfa689d-2de3-4047-ab7b-9ac00a93e6bb.html,https://www.focus.de/politik/ausland/putin-startet-wettruesten-gegen-europa-dieses-szenario-fuerchtet-der-kreml_1cfa689d-2de3-4047-ab7b-9ac00a93e6bb.html,0,www.focus.de,Putin startet Wettrüsten gegen Europa: Dieses Szenario fürchtet der Kreml,Der estnische Geheimdienst hat seine Einschätzung zur russischen Aufrüstung abgegeben. Trotz Warnungen geht er nicht von einem Angriff auf Nato-Länder in den nächsten beiden Jahren aus.,https://quadro.burda-forward.de/ctf/2031e60e-eb38-4332-829d-8ea2f5d8880f.443b0b81-bd89-4c58-b3e1-880575ee9595.jpg?im=RegionOfInterestCrop%3D%281200%2C630%29%2CregionOfInterest%3D%281520%2C983%29&hash=8cee3cb37b3e09c69e345154e529f5fe64dae8233ec0e903b39f869cd5a32fa6,2026-02-11T08:05:00Z,,"Russland treibt laut dem estnischen Auslandsgeheimdienst den Wiederaufbau seiner Streitkräfte in rasantem Tempo voran. Dies geschehe auch vor dem Hintergrund der zunehmenden Aufrüstung in Europa. 
E… [+1633 chars]",,de,'Putin'
https://www.welt.de/politik/ausland/plus6981ac5f06b45afdb339b82d/oppositionspolitiker-kara-murza-deshalb-verliert-die-putin-diktatur-diesen-krieg.html,https://www.welt.de/politik/ausland/plus6981ac5f06b45afdb339b82d/oppositionspolitiker-kara-murza-deshalb-verliert-die-putin-diktatur-diesen-krieg.html,0,www.welt.de,„Deshalb verliert die Putin-Diktatur diesen Krieg“,"Der Oppositionelle Wladimir Kara-Murza ist Teil der Delegation, die an einem Übergang zu einem demokratischen Russland arbeitet. Er überlebte zwei Giftanschläge und erklärt, woran man erkennen kann, wie die Stimmung im Land wirklich ist.",https://images.welt.de/6981ac5f06b45afdb339b82d/b9681db9899a6912eb11dd2d14e982a9-master/ci16x9-w1200/508239380-jpg,2026-02-11T09:07:24Z,,"Der Oppositionelle Wladimir Kara-Murza ist Teil der Delegation, die an einem Übergang zu einem demokratischen Russland arbeitet. Er überlebte zwei Giftanschläge und erklärt, woran man erkennen kann, … [+37 chars]",,de,'Russland'
https://www.welt.de/politik/ausland/plus6981ac5f06b45afdb339b82d/oppositionspolitiker-kara-murza-in-den-geschichtsbuechern-wird-putin-als-zentraler-faktor-fuer-den-zusammenbruch-des-regimes-stehen.html,https://www.welt.de/politik/ausland/plus6981ac5f06b45afdb339b82d/oppositionspolitiker-kara-murza-in-den-geschichtsbuechern-wird-putin-als-zentraler-faktor-fuer-den-zusammenbruch-des-regimes-stehen.html,0,www.welt.de,„In den Geschichtsbüchern wird Putin als zentraler Faktor für den Zusammenbruch des Regimes stehen“,"Der Oppositionelle Wladimir Kara-Murza ist Teil der Delegation, die an einem Übergang zu einem demokratischen Russland arbeitet. Er überlebte zwei Giftanschläge und erklärt, woran man erkennen kann, wie die Stimmung im Land wirklich ist.",https://images.welt.de/6981ac5f06b45afdb339b82d/b9681db9899a6912eb11dd2d14e982a9-master/ci16x9-w1200/508239380-jpg,2026-02-11T09:07:24Z,,"Der Oppositionelle Wladimir Kara-Murza ist Teil der Delegation, die an einem Übergang zu einem demokratischen Russland arbeitet. Er überlebte zwei Giftanschläge und erklärt, woran man erkennen kann, … [+37 chars]",,de,'Russland'
https://www.faz.net/aktuell/politik/ukraine/ukraine-liveticker-grossbritannien-verdoppelt-zahl-seiner-soldaten-in-norwegen-faz-110683325.html,https://www.faz.net/aktuell/politik/ukraine/ukraine-liveticker-grossbritannien-verdoppelt-zahl-seiner-soldaten-in-norwegen-faz-110683325.html,0,www.faz.net,Krieg in der Ukraine: Großbritannien verdoppelt Zahl seiner Soldaten in Norwegen,Britischer Verteidigungsminister: zunehmende Bedrohung durch Russland in der Arktis +++ Bericht: Selenskyj plant Referendum und Wahl +++ alle Neuigkeiten im Liveblog,https://media0.faz.net/image/w1200h627/8a4f542a7641/w3600h1881x0y225o/202602/43601.0.1731572402/britische-soldaten-bei-einem.webp,2026-02-11T09:35:34Z,,"Die Europäische Union will ihre Sanktionen gegen Russland erstmals auf Häfen in Drittländern ausweiten, die russisches Öl umschlagen. Dies geht aus einem am Montag vorgelegten Vorschlagsdokument herv… [+1450 chars]",,de,'Russland'
https://www.focus.de/politik/ausland/showdown-am-15-mai-selenskyj-plant-schicksalswahl-mitten-im-krieg_e09afcdb-531f-49fb-be64-4e7de0d6f868.html,https://www.focus.de/politik/ausland/showdown-am-15-mai-selenskyj-plant-schicksalswahl-mitten-im-krieg_e09afcdb-531f-49fb-be64-4e7de0d6f868.html,0,www.focus.de,Showdown am 15. Mai: Selenskyj plant Schicksalswahl mitten im Krieg,"Die USA wollen ein schnelles Ende des Ukraine-Kriegs, sie machen Druck auf Kiew, nicht auf Moskau. Einem Bericht der „Financial Times“ zufolge könnte Präsident Selenskyj die Flucht nach vorn antreten.",https://quadro.burda-forward.de/ctf/c69e3c4b-3bf4-4f0d-b520-d6948ecf1936.3a44abe4-40c9-4253-8b68-536af95816b7.jpeg?im=RegionOfInterestCrop%3D%281200%2C630%29%2CregionOfInterest%3D%281024%2C683%29&hash=5c0690cc96481b0585bd938c714639edd37cbbadb4b8ada91f107551fef789b1,2026-02-11T09:41:00Z,,"Einem Bericht der Financial Times zufolge plant der ukrainische Staatschef Wolodymyr Selenskyj unter Druck der USA, eine Präsidentenwahl und ein Friedensreferendum für den 15. Mai anzusetzen. Die bri… [+1928 chars]",,de,'Krieg'
https://www.zeit.de/news/2026-02/11/polizei-schiesst-auf-mann-in-seniorenzentrum-tot,https://www.zeit.de/news/2026-02/11/polizei-schiesst-auf-mann-in-seniorenzentrum-tot,0,www.zeit.de,Bedrohung mit Messer: Polizei schießt auf Mann in Seniorenzentrum - tot,Hier finden Sie Informationen zu dem Thema „Bedrohung mit Messer“. Lesen Sie jetzt „Polizei schießt auf Mann in Seniorenzentrum - tot“.,https://img.zeit.de/news/2026-02/11/polizei-schiesst-auf-mann-in-seniorenzentrum-tot-image-group/wide__1300x731,2026-02-11T10:19:59Z,,Nach dem tödlichen Schuss eines Polizisten auf einen 53 Jahre alten Mann in einem Seniorenzentrum im nordrhein-westfälischen Waltrop befragt die Polizei Zeugen und wertet Spuren aus. Zuvor hatte der … [+633 chars],,de,'Bedrohung'
https://www.faz.net/aktuell/politik/ukraine/unermuedlich-wie-arbeiter-in-der-ukraine-die-kraftwerke-reparieren-accg-110834930.html,https://www.faz.net/aktuell/politik/ukraine/unermuedlich-wie-arbeiter-in-der-ukraine-die-kraftwerke-reparieren-accg-110834930.html,0,www.faz.net,Ukrainische Kraftwerksarbeiter: Sie kämpfen um jede Kilowattstunde,"Bei klirrender Kälte greift Russland in der Ukraine Wärme- und Stromkraftwerke an. Die Arbeiter dort reparieren im Akkord, obwohl jederzeit der nächste Angriff folgen kann.",https://media0.faz.net/image/w1200h627/918c5f605b4a/w3000h1567x0y388o/022026/1.10834929/raeumt-auf-mitarbeiter-jewhen.webp,2026-02-11T10:27:26Z,,"Von dort, wo Jewhen normalerweise arbeitet, bietet sich ein Bild der Verwüstung. Das Dach des Kraftwerks ist teilweise eingestürzt. Stahlträger liegen verkeilt über Turbinen, abgebrochene Betonsäulen… [+9267 chars]",,de,'Ukraine'
https://www.diepresse.com/20570710/trump-draengt-selenskij-offenbar-zu-wahlen-im-fruehling,https://www.diepresse.com/20570710/trump-draengt-selenskij-offenbar-zu-wahlen-im-fruehling,0,www.diepresse.com,Trump drängt Selenskij offenbar zu Wahlen im Frühling [premium],Laut US-Medienbericht könnte die Ukraine bis Mitte Mai Wahlen und eine Abstimmung über einen Friedensplan abhalten. Doch der Zeitplan scheint zu ambitioniert. Ein Deal ist nicht in Sicht.,https://img.diepresse.com/public/incoming/6hje9t-ukraine-crisistrump-zelenskiy/alternates/DPR_SOCIAL_NACHRICHTEN/UKRAINE-CRISISTRUMP-ZELENSKIY,2026-02-11T10:58:32Z,,US-Präsident Donald Trump erhöht offenbar den Druck bei den Friedensverhandlungen zwischen der Ukraine und Russland. Einem Bericht der Financial Times zufolge soll die Ukraine Präsidentenwahlen und e… [+3933 chars],,de,'Ukraine'
https://www.welt.de/politik/ausland/article698977ac2dc88ba237f4611e/ukraine-krieg-1-3-millionen-tote-russen-hoechste-opferzahlen-seit-1945-liveticker.html,https://www.welt.de/politik/ausland/article698977ac2dc88ba237f4611e/ukraine-krieg-1-3-millionen-tote-russen-hoechste-opferzahlen-seit-1945-liveticker.html,0,www.welt.de,"1,3 Millionen tote Russen – Höchste Opferzahlen seit 1945","US-Verteidigungsminister Hegseth hat seine Teilnahme an einem Nato-Treffen abgesagt. Die russischen Verluste im Ukraine-Krieg werden auf inzwischen 1,3 Millionen Soldaten beziffert. Mehr im Liveticker.",https://images.welt.de/698977ac2dc88ba237f4611e/df91448207e86ea1a9c536a6f0333f08/ci16x9-w1200/dpa-com-20090101-251114-911-013485-jpg,2026-02-11T11:02:00Z,,"US-Verteidigungsminister Hegseth hat seine Teilnahme an einem Nato-Treffen abgesagt. Die russischen Verluste im Ukraine-Krieg werden auf inzwischen 1,3 Millionen Soldaten beziffert. Mehr im Liveticke… [+17371 chars]",,de,'Ukraine'
https://www.welt.de/politik/ausland/article698977ac2dc88ba237f4611e/ukraine-krieg-hoechstgrenzen-fuer-atomwaffen-lawrow-nennt-den-usa-eine-bedingung-liveticker.html,https://www.welt.de/politik/ausland/article698977ac2dc88ba237f4611e/ukraine-krieg-hoechstgrenzen-fuer-atomwaffen-lawrow-nennt-den-usa-eine-bedingung-liveticker.html,0,www.welt.de,Höchstgrenzen für Atomwaffen? Lawrow nennt den USA eine Bedingung,"Russland hat erklärt, sich auch weiterhin an das Begrenzungsabkommen für Atomwaffen zu halten. Allerdings nur, wenn auch die USA mitmachen. Die USA haben derweil die Militärhilfen für die Ukraine um 99 Prozent zurückgefahren. Neue Zahlen offenbaren, wie viel …",https://images.welt.de/698977ac2dc88ba237f4611e/54cd898c07463b0f8c554d73cb95ee1a/ci16x9-w1200/dpa-com-20090101-260210-935-1142737-jpg,2026-02-11T11:02:00Z,,"Russland hat erklärt, sich auch weiterhin an das Begrenzungsabkommen für Atomwaffen zu halten allerdings nur, wenn auch die US-Amerikaner mitziehen. Die USA haben derweil die Militärhilfen für die Uk… [+15119 chars]",,de,'Ukraine'
https://www.bild.de/politik/ausland-und-internationales/grossbritannien-verdoppeln-truppen-in-norwegen-wegen-bedrohung-aus-moskau-698c5d7362ee8b267c15b47b,https://www.bild.de/politik/ausland-und-internationales/grossbritannien-verdoppeln-truppen-in-norwegen-wegen-bedrohung-aus-moskau-698c5d7362ee8b267c15b47b,0,www.bild.de,Bedrohung aus Moskau - Briten verdoppeln Truppen in Norwegen,Großbritannien verdoppelt die Truppen in Norwegen wegen wachsender russischer Bedrohung. Das erklärte Verteidigungsminister John Healey.,"https://images.bild.de/698c5d7362ee8b267c15b47b/875f49b610aae9dbc0d9fdf6e6ca7524,df5ba30e?w=1280",2026-02-11T11:20:13Z,,TTS-Player überspringenArtikel weiterlesenLondon Großbritannien rüstet im hohen Norden massiv auf. Die Zahl der in Norwegen stationierten Soldaten wird innerhalb von drei Jahren von aktuell rund 1000… [+2081 chars],,de,'Bedrohung'
