index,url,valid,domain,title,description,image,published,archive,content,quote,language,keyword
https://www.zeit.de/news/2025-09/19/selenskyj-kuendigt-fuer-2026-waffenexporte-an,https://www.zeit.de/news/2025-09/19/selenskyj-kuendigt-fuer-2026-waffenexporte-an,0,www.zeit.de,Krieg in der Ukraine: Selenskyj kündigt für 2026 Waffenexporte an,Hier finden Sie Informationen zu dem Thema „Krieg in der Ukraine“. Lesen Sie jetzt „Selenskyj kündigt für 2026 Waffenexporte an“.,https://img.zeit.de/news/2025-09/19/selenskyj-kuendigt-fuer-2026-waffenexporte-an-image-group/wide__1300x731,2025-09-19T17:24:03Z,,Der ukrainische Präsident Wolodymyr Selenskyj kündigt für das kommende Jahr Waffenexporte zur Finanzierung des eigenen Rüstungsbedarfs im Abwehrkrieg gegen Russland an. «Dank diesem kontrollierten Ex… [+1463 chars],,de,'Krieg'
https://www.jungewelt.de/artikel/508779.spaghetti-alla-putinesca.html,https://www.jungewelt.de/artikel/508779.spaghetti-alla-putinesca.html,0,www.jungewelt.de,Coole Wampe: Spaghetti alla Putinesca,"Während der ganzen Fahrt hat Töffi gebellt wie verrückt. »Udo, du bist nicht bei Trost. Du kannst doch nicht einfach Leute von der Straße weg zum Nudeln essen einladen!« schimpft Doris.",https://www.jungewelt.de/images/junge-welt-logo-square.png,2025-09-19T17:40:05Z,,"»Achtung, Achtung! Hier spricht das Bundesamt für Bevölkerungsschutz! Bei niedrigem Blutdruck kann der Verzehr von Knoblauch einen Kreislaufzusammenbruch zur Folge haben! Meiden Sie frischen Knoblauc… [+2888 chars]",,de,'Gas'
https://www.zeit.de/news/2025-09/19/russische-kampfjets-ueber-polnischer-oelplattform,https://www.zeit.de/news/2025-09/19/russische-kampfjets-ueber-polnischer-oelplattform,0,www.zeit.de,Krieg in der Ukraine: Russische Kampfjets über polnischer Ölplattform,Hier finden Sie Informationen zu dem Thema „Krieg in der Ukraine“. Lesen Sie jetzt „Russische Kampfjets über polnischer Ölplattform“.,https://img.zeit.de/news/2025-09/19/russische-kampfjets-ueber-polnischer-oelplattform-image-group/wide__1300x731,2025-09-19T19:09:20Z,,Zwei russische Kampfjets haben sich nach Angaben des polnischen Grenzschutzes im Tiefflug einer polnischen Bohrinsel in der Ostsee genähert. Die Kampfflugzeuge hätten die Bohrplattform Petrobaltic in… [+943 chars],,de,'Krieg'
https://www.zeit.de/news/2025-09/19/freigelassene-hamas-geisel-will-wieder-in-die-armee,https://www.zeit.de/news/2025-09/19/freigelassene-hamas-geisel-will-wieder-in-die-armee,0,www.zeit.de,Gaza-Krieg: Freigelassene Hamas-Geisel will wieder in die Armee,Hier finden Sie Informationen zu dem Thema „Gaza-Krieg“. Lesen Sie jetzt „Freigelassene Hamas-Geisel will wieder in die Armee“.,https://img.zeit.de/news/2025-09/19/freigelassene-hamas-geisel-will-wieder-in-die-armee-image-group/wide__1300x731,2025-09-19T19:34:27Z,,"Der im Mai von der Terrororganisation Hamas nach 548 Tagen als Geisel im Gazastreifen freigelassene Israeli Edan Alexander kündigt seine Rückkehr in den Armeedienst an. «So Gott will, werde ich nächs… [+1544 chars]",,de,'Krieg'
https://www.n-tv.de/politik/22-04-EU-Laender-wollen-gemeinsam-auf-Luftraumverletzungen-antworten--article26044646.html,https://www.n-tv.de/politik/22-04-EU-Laender-wollen-gemeinsam-auf-Luftraumverletzungen-antworten--article26044646.html,0,www.n-tv.de,Ukraine-Krieg im Liveticker: +++ 22:04 EU-Länder wollen gemeinsam auf Luftraumverletzungen antworten +++,Lesen Sie alle aktuellen Entwicklungen und Nachrichten über den russischen Angriffskrieg auf die Ukraine im Liveticker von ntv.de.,https://www.n-tv.de/img/incoming/crop25117070/8311326854-cImg_16_9-w1200/Ukraine-Liveticker.jpg,2025-09-19T20:00:00Z,,"Die Staats- und Regierungschefs der EU wollen bei ihrem Treffen am 1. Oktober in Kopenhagen über eine ""kollektive Antwort"" auf die Verletzung des europäischen Luftraums durch Russland beraten. Das kü… [+28740 chars]",,de,'Krieg'
https://www.n-tv.de/politik/19-36-Ukraine-sanktioniert-moskautreue-Kraefte-in-Moldau--article23143824.html,https://www.n-tv.de/politik/19-36-Ukraine-sanktioniert-moskautreue-Kraefte-in-Moldau--article23143824.html,0,www.n-tv.de,Ukraine-Krieg im Liveticker: +++ 19:36 Ukraine sanktioniert moskautreue Kräfte in Moldau +++,Lesen Sie alle aktuellen Entwicklungen und Nachrichten über den russischen Angriffskrieg auf die Ukraine im Liveticker von ntv.de.,https://www.n-tv.de/img/incoming/crop25117070/8311326854-cImg_16_9-w1200/Ukraine-Liveticker.jpg,2025-09-19T22:12:00Z,,"Eine Woche vor der Parlamentswahl in Moldau verhängt der ukrainische Präsident Selenskyj Sanktionen gegen prorussische Politiker in dem Nachbarland. Die Strafmaßnahmen richten sich ""gegen Personen, d… [+27212 chars]",,de,'Krieg'
https://www.n-tv.de/politik/17-49-Gruene-fordern-Stopp-von-EU-Visa-fuer-Russen--article23143824.html,https://www.n-tv.de/politik/17-49-Gruene-fordern-Stopp-von-EU-Visa-fuer-Russen--article23143824.html,0,www.n-tv.de,Ukraine-Krieg im Liveticker: +++ 17:49 Grüne fordern Stopp von EU-Visa für Russen +++,Lesen Sie alle aktuellen Entwicklungen und Nachrichten über den russischen Angriffskrieg auf die Ukraine im Liveticker von ntv.de.,https://www.n-tv.de/img/incoming/crop25117070/8311326854-cImg_16_9-w1200/Ukraine-Liveticker.jpg,2025-09-19T22:12:00Z,,Die Grünen fordern auf das Eindringen russischer Kampfjets in den estnischen und polnischen Luftraum mit harten Maßnahmen zu reagieren - etwa mit dem Aussetzen von EU-Visa für russische Bürger und de… [+25171 chars],,de,'Ukraine'
https://www.n-tv.de/politik/22-06-Politischer-Druck-Auftritt-australischer-Saengerin-bei-Anti-ESC-kurzfristig-abgesagt--article23143824.html,https://www.n-tv.de/politik/22-06-Politischer-Druck-Auftritt-australischer-Saengerin-bei-Anti-ESC-kurzfristig-abgesagt--article23143824.html,0,www.n-tv.de,"Ukraine-Krieg im Liveticker: +++ 22:06 ""Politischer Druck"": Auftritt australischer Sängerin bei Anti-ESC kurzfristig abgesagt +++",Lesen Sie alle aktuellen Entwicklungen und Nachrichten über den russischen Angriffskrieg auf die Ukraine im Liveticker von ntv.de.,https://www.n-tv.de/img/incoming/crop25117070/8311326854-cImg_16_9-w1200/Ukraine-Liveticker.jpg,2025-09-19T22:12:00Z,,Bei dem Intervision Song Contest in Moskau sollte eigentlich auch die aus Australien stammenden Sängerin Vassy (Vasiliki Karagiorgos) auftreten. Sie war für die USA angekündigt. Doch unmittelbar vor … [+30618 chars],,de,'Krieg'
https://www.n-tv.de/politik/15-40-Mutmasslich-russischer-Spion-bei-oesterreichischem-Energiekonzern-OMV-enttarnt--article23143824.html,https://www.n-tv.de/politik/15-40-Mutmasslich-russischer-Spion-bei-oesterreichischem-Energiekonzern-OMV-enttarnt--article23143824.html,0,www.n-tv.de,Ukraine-Krieg im Liveticker: +++ 15:40 Mutmaßlich russischer Spion bei österreichischem Energiekonzern OMV enttarnt +++,Lesen Sie alle aktuellen Entwicklungen und Nachrichten über den russischen Angriffskrieg auf die Ukraine im Liveticker von ntv.de.,https://www.n-tv.de/img/incoming/crop25117070/8311326854-cImg_16_9-w1200/Ukraine-Liveticker.jpg,2025-09-19T22:12:00Z,,"Ein Mitarbeiter des österreichischen Öl-, Gas- und Chemiekonzerns OMV soll einem Medienbericht zufolge als mutmaßlicher Spion für Russland enttarnt worden sein. Das Magazin ""Profil"" berichtet, die Di… [+22130 chars]",,de,'Gas'
https://www.nzz.ch/wissenschaft/oel-und-gasfirmen-kaempfen-mit-dem-abstieg-ld.1903251,https://www.nzz.ch/wissenschaft/oel-und-gasfirmen-kaempfen-mit-dem-abstieg-ld.1903251,0,www.nzz.ch,Öl- und Gasfirmen kämpfen gegen den Abstieg,"Öl- und Gasfelder gäben Jahr für Jahr weniger her, sagt die Internationale Energieagentur. Unternehmen müssen Hunderte Millionen Dollar investieren, um deren Produktivität zu maximieren und Rückgänge wettzumachen. Russland und Saudiarabien könnten geopolitisc…","https://img.nzz.ch/2025/09/18/9f99670c-cf92-4058-918a-9636a4b3b1a3.jpg?width=1200&height=674&fit=bounds&quality=75&auto=webp&crop=6500,3656,x0,y338&wmark=nzz",2025-09-20T03:30:00Z,,"Die USA wollen aus den Erdöl- und Gasfeldern in Texas noch mehr Kapital schlagen.
Erdöl- und Gasunternehmen sind die idealen Feindbilder in der Klimapolitik. Das Verbrennen von fossilen Brennstoffen… [+8196 chars]",,de,'Russland'
https://www.nzz.ch/gesellschaft/ukraine-und-russland-warum-der-krieg-in-osteuropa-nicht-endet-ld.1882011,https://www.nzz.ch/gesellschaft/ukraine-und-russland-warum-der-krieg-in-osteuropa-nicht-endet-ld.1882011,0,www.nzz.ch,Der Krieg ist wie ein Sumpf:Weshalb Ukrainer und Russen keinen Frieden finden,"Die beiden Gesellschaften leben in zwei Welten. Die Ukraine kämpft für ihre Zukunft, Russland für sein Imperium. Gemeinsam ist ihnen das Trauma von Krieg und Gewalt. Und die Angst vor der Vernichtung.","https://img.nzz.ch/2023/11/17/ee5f9027-a747-495e-90d5-86825fc4b256.jpeg?width=1200&height=674&fit=bounds&quality=75&auto=webp&crop=5007,2816,x0,y261&wmark=nzz",2025-09-20T03:30:00Z,,"Seit über drei Jahren führt Russland Krieg gegen die Ukraine: Mehr als 1300 Tage Sturmangriffe, Bombenhagel, Drohnenschwärme. Eine Million Soldaten stehen sich an einer mehr als 1000 Kilometer langen… [+27847 chars]",,de,'Russland'
https://www.stern.de/news/russland-weist-vorwurf-der-luftraumverletzung-zurueck---estland-will-konsultationen-mit-nato-partnern-36068444.html,https://www.stern.de/news/russland-weist-vorwurf-der-luftraumverletzung-zurueck---estland-will-konsultationen-mit-nato-partnern-36068444.html,0,www.stern.de,Russland weist Vorwurf der Luftraumverletzung zurück - Estland will Konsultationen mit Nato-Partnern,"Russland hat bestritten, dass drei seiner MiG-31-Kampfflugzeuge illegal in den estnischen Luftraum eingedrungen sind. Die Kampfflugzeuge hätten nicht die Grenzen anderer Staaten verletzt, erklärte das russische Verteidigungsministerium am Freitag. Estland wil…",https://image.stern.de/36068658/t/dC/v1/w1440/r1.7778/-/20--deutscher-eurofighter-2019-auf-dem-stuetzpunkt-noervenich---333ce38f4f5152ba.jpg,2025-09-20T05:18:21Z,,"Kopiere den aktuellen Link
Zur Merkliste hinzufügen
Russland hat bestritten, dass drei seiner MiG-31-Kampfflugzeuge illegal in den estnischen Luftraum eingedrungen sind. Die Kampfflugzeuge hätten n… [+5013 chars]",,de,'Russland'
https://orf.at/stories/3406014/,https://orf.at/stories/3406014/,0,orf.at,Kiew: Schwere russische Verluste im Osten der Ukraine,,https://orf.at/mojo/1_4_1/storyserver//news/common/images/og-fallback-news.png,2025-09-20T05:47:16Z,,Die Ukraine fügt bei ihrer Gegenoffensive im Osten des Landes den russischen Truppen schwere Verluste zu. Dies sagte der ukrainische Präsident Wolodymyr Selenskyj gestern in seiner abendlichen Videoa… [+834 chars],,de,'Russland'
https://www.stern.de/politik/ausland/estland--wo-manche-putin-feiern---und-die-anderen-ihn-fuerchten-35442330.html,https://www.stern.de/politik/ausland/estland--wo-manche-putin-feiern---und-die-anderen-ihn-fuerchten-35442330.html,0,www.stern.de,Serie – Die Nato-Ostflanke: Wo die einen Putin feiern – die anderen ihn fürchten,"Im estnischen Narva, direkt neben Russland, gehen die Risse durch die Familien. Russland lieben oder hassen? Oder doch eher: fürchten? Über ein Leben an der Grenze.",https://image.stern.de/35467670/t/xK/v2/w1440/r1.7778/-/estland-neu.jpg,2025-09-20T05:57:00Z,,"Kopiere den aktuellen Link
Zur Merkliste hinzufügen
Hinweis: Dieser Artikel stammt von Februar 2025. Wir veröffentlichen ihn an dieser Stelle erneut, weil russische Kampfjets am Freitag den Luftrau… [+296 chars]",,de,'Russland'
https://www.diepresse.com/20101542/oesterreich-bei-ukraine-hilfe-und-mercosur-tief-gespalten,https://www.diepresse.com/20101542/oesterreich-bei-ukraine-hilfe-und-mercosur-tief-gespalten,0,www.diepresse.com,Österreich bei Ukraine-Hilfe und Mercosur tief gespalten [premium],"Nur 46 Prozent halten die EU-Hilfe für die Ukraine für wichtig, fast ebenso viele lehnen sie ab. Auch beim Handelsabkommen gibt es keine klare Mehrheit in der Bevölkerung.",https://img.diepresse.com/public/incoming/wci6ts-1247326808/alternates/DPR_SOCIAL_NACHRICHTEN/1247326808,2025-09-20T06:23:15Z,,"Österreichs Bevölkerung bleibt bei politischen Entscheidungen, die in Brüssel getroffen werden, generell skeptisch. Das belegt eine neue Umfrage der Gesellschaft für Europapolitik (ÖGfE). Aktuell bet… [+3689 chars]",,de,'Russland'
https://www.zeit.de/news/2025-09/20/ukraine-tote-und-verletzte-nach-russischen-angriffen,https://www.zeit.de/news/2025-09/20/ukraine-tote-und-verletzte-nach-russischen-angriffen,0,www.zeit.de,Ukraine-Krieg: Ukraine: Tote und Verletzte nach russischen Angriffen,Hier finden Sie Informationen zu dem Thema „Ukraine-Krieg“. Lesen Sie jetzt „Ukraine: Tote und Verletzte nach russischen Angriffen“.,https://img.zeit.de/news/2025-09/20/ukraine-tote-und-verletzte-nach-russischen-angriffen-image-group/wide__1300x731,2025-09-20T06:42:33Z,,"Russland hat die Ukraine in der Nacht erneut massiv aus der Luft angegriffen. Dem ukrainischen Präsidenten Wolodymyr Selenskyj zufolge wurden drei Menschen dabei getötet und Dutzende verletzt. 
Mosk… [+1062 chars]",,de,'Krieg'
https://www.tagesspiegel.de/internationales/ukraine-krieg-ukraine-tote-und-verletzte-nach-russischen-angriffen-14358992.html,https://www.tagesspiegel.de/internationales/ukraine-krieg-ukraine-tote-und-verletzte-nach-russischen-angriffen-14358992.html,0,www.tagesspiegel.de,Ukraine-Krieg: Ukraine: Tote und Verletzte nach russischen Angriffen,Nacht für Nacht überzieht Russland die Ukraine mit Angriffen aus der Luft. Dabei gibt es erneut zivile Opfer.,https://www.tagesspiegel.de/images/14358989/alternates/BASE_16_9_W1400/1758350660000/russische-kampfdrohne.jpeg,2025-09-20T06:44:20Z,,"Russland hat die Ukraine in der Nacht erneut massiv aus der Luft angegriffen. Dem ukrainischen Präsidenten Wolodymyr Selenskyj zufolge wurden drei Menschen dabei getötet und Dutzende verletzt. 
Mosk… [+1118 chars]",,de,'Krieg'
https://www.welt.de/politik/ausland/video68ce53d95d604c6d7adac766/importverbot-fuer-fluessigerdgas-selenskyj-begruesst-eu-sanktionen-gegen-russland.html,https://www.welt.de/politik/ausland/video68ce53d95d604c6d7adac766/importverbot-fuer-fluessigerdgas-selenskyj-begruesst-eu-sanktionen-gegen-russland.html,0,www.welt.de,Selenskyj begrüßt EU-Sanktionen gegen Russland,Ukraine-Präsident Selenskyj hat das 19. Sanktionspaket der EU gegen Russland begrüßt. Es sieht unter anderem ein Importverbot für russisches Flüssigerdgas ab 2027 und weitere Strafmaßnahmen gegen Drittstaaten vor.,https://images.welt.de/68ce53d95d604c6d7adac766/4004e351558c3057cbb5b3f498d6e7fd-master/ci16x9-w1200/wolodymyr-selenskyj,2025-09-20T07:18:24Z,,Die WELT als ePaper: Die vollständige Ausgabe steht Ihnen bereits am Vorabend zur Verfügung so sind Sie immer hochaktuell informiert. Weitere Informationen https://epaper.welt.de,,de,'Russland'
https://www.bild.de/regional/rostock/rostock-falschfahrer-auf-der-a19-gestoppt-68ce5b226199625f8c0f7405,https://www.bild.de/regional/rostock/rostock-falschfahrer-auf-der-a19-gestoppt-68ce5b226199625f8c0f7405,0,www.bild.de,Rostock - Schwede (73) fährt 10 km als Geisterfahrer,Ein Schwede fuhr auf der A19 in falscher Richtung. Die Polizei stoppte ihn ohne Gefährdung anderer Verkehrsteilnehmer.,"https://images.bild.de/68ce5b226199625f8c0f7405/5701ac7286e26a01628e6d594789e65c-landscape,d896deb3?w=1280",2025-09-20T07:56:54Z,,"Rostock Ein 73-jähriger Schwede sorgte am Samstagmorgen auf der A19 für Aufsehen: Er fuhr rund 10 Kilometer in die falsche Richtung.
Ab 6 Uhr gingen zahlreiche Notrufe bei der Polizei ein. Der Fahre… [+979 chars]",,de,'Gefährdung'
https://www.zeit.de/news/2025-09/20/berichte-ueber-heftige-israelische-angriffe-in-der-stadt-gaza,https://www.zeit.de/news/2025-09/20/berichte-ueber-heftige-israelische-angriffe-in-der-stadt-gaza,0,www.zeit.de,Gaza-Krieg: Berichte über heftige israelische Angriffe in der Stadt Gaza,Hier finden Sie Informationen zu dem Thema „Gaza-Krieg“. Lesen Sie jetzt „Berichte über heftige israelische Angriffe in der Stadt Gaza“.,https://img.zeit.de/news/2025-09/20/berichte-ueber-heftige-israelische-angriffe-in-der-stadt-gaza-image-group/wide__1300x731,2025-09-20T10:22:51Z,,Trotz weltweiter Kritik setzt Israel seine militärische Offensive in der Stadt Gaza mit großer Härte fort. Es gebe schwere Bombardierungen und einen «Ring aus Feuer» in mehreren Teilen der größten St… [+1469 chars],,de,'Krieg'
https://www.zeit.de/news/2025-09/20/hamas-schuert-angst-vor-verschwinden-der-geiseln-fuer-immer,https://www.zeit.de/news/2025-09/20/hamas-schuert-angst-vor-verschwinden-der-geiseln-fuer-immer,0,www.zeit.de,Gaza-Krieg: Hamas schürt Angst vor Verschwinden der Geiseln für immer,Hier finden Sie Informationen zu dem Thema „Gaza-Krieg“. Lesen Sie jetzt „Hamas schürt Angst vor Verschwinden der Geiseln für immer“.,https://img.zeit.de/news/2025-09/20/hamas-schuert-angst-vor-verschwinden-der-geiseln-fuer-immer-image-group/wide__1300x731,2025-09-20T13:23:14Z,,"Mit einer Fotomontage hat die Hamas aufgrund der jüngsten israelischen Militäroffensive damit gedroht, dass die noch im Gazastreifen festgehaltenen Geiseln für immer verschollen bleiben könnten. Die … [+2398 chars]",,de,'Krieg'
https://www.n-tv.de/politik/Moskaus-Antwort-auf-den-ESC-Brave-Powerballaden-und-keine-Perversionen-article26045853.html,https://www.n-tv.de/politik/Moskaus-Antwort-auf-den-ESC-Brave-Powerballaden-und-keine-Perversionen-article26045853.html,0,www.n-tv.de,"Putin eröffnet Intervision: Moskaus Antwort auf den ESC: Brave Powerballaden und keine ""Perversionen""","Vom ESC ist Russland ausgeschlossen, dafür holt der Kreml jetzt den sowjetischen Intervision-Wettbewerb aus der Versenkung. Es geht um Musik - und um Moskaus geopolitische Interessen.",https://www.n-tv.de/img/incoming/crop26045850/637132291-cImg_16_9-w1200/df37f445a96979fa263c78ee09e3992a.jpg,2025-09-20T23:13:37Z,,"Vom ESC ist Russland ausgeschlossen, dafür holt der Kreml jetzt den sowjetischen Intervision-Wettbewerb aus der Versenkung. Es geht um Musik - und um Moskaus geopolitische Interessen. 
Bei der russi… [+4607 chars]",,de,'Russland'
https://www.stern.de/news/russland-organisiert-esc-gegenveranstaltung-intervision---vietnam-gewinnt-36069068.html,https://www.stern.de/news/russland-organisiert-esc-gegenveranstaltung-intervision---vietnam-gewinnt-36069068.html,0,www.stern.de,Russland organisiert ESC-Gegenveranstaltung Intervision - Vietnam gewinnt,"Mit Teilnehmern aus mehr als 20 Staaten und dem erklärten Ziel, mehr als eine Milliarde Fernsehzuschauer zu erreichen, hat Russland am Samstag eine Gegenveranstaltung zum Eurovision Song Contest (ESC) organisiert. In einer Video-Grußbotschaft unterstrich Krem…",https://image.stern.de/36069084/t/ID/v1/w1440/r1.7778/-/21--putin-auf-videoleinwand-beim-intervisionwettbewerb---6faf0a674314f1f8.jpg,2025-09-20T23:47:21Z,,"Kopiere den aktuellen Link
Zur Merkliste hinzufügen
Mit Teilnehmern aus mehr als 20 Staaten und dem erklärten Ziel, mehr als eine Milliarde Fernsehzuschauer zu erreichen, hat Russland am Samstag ei… [+2369 chars]",,de,'Russland'
https://www.n-tv.de/politik/CDU-Aussenexperte-Nato-muss-russische-Kampfjets-notfalls-abschiessen-article26045869.html,https://www.n-tv.de/politik/CDU-Aussenexperte-Nato-muss-russische-Kampfjets-notfalls-abschiessen-article26045869.html,0,www.n-tv.de,Antwort auf Luftraumverletzungen: CDU-Außenexperte: Nato muss russische Kampfjets notfalls abschießen,"Erst Drohnen über Polen, jetzt Kampfjets über Estland - Russland testet derzeit die Reaktionsfähigkeit der Nato aus. Für den CDU-Außenexperten Hardt ist klar: Ohne eine entschiedene Antwort wird Moskau immer weiter gehen.",https://www.n-tv.de/img/incoming/crop26045878/5591327397-cImg_16_9-w1200/631a5fbfd822491b489d6634fe3ba986.jpg,2025-09-21T01:13:36Z,,"Erst Drohnen über Polen, jetzt Kampfjets über Estland - Russland testet derzeit die Reaktionsfähigkeit der Nato aus. Für den CDU-Außenexperten Hardt ist klar: Ohne eine entschiedene Antwort wird Mosk… [+2161 chars]",,de,'Russland'
https://www.n-tv.de/politik/Union-Nato-muss-russische-Kampfjets-notfalls-abschiessen-article26045869.html,https://www.n-tv.de/politik/Union-Nato-muss-russische-Kampfjets-notfalls-abschiessen-article26045869.html,0,www.n-tv.de,Antwort auf Luftraumverletzungen: Union: Nato muss russische Kampfjets notfalls abschießen,"Erst Drohnen über Polen, jetzt Kampfjets über Estland - Russland testet derzeit die Reaktionsfähigkeit der Nato aus. Für den CDU-Außenexperten Hardt ist klar: Ohne eine entschiedene Antwort wird Moskau immer weiter gehen.",https://www.n-tv.de/img/incoming/crop26045878/5591327397-cImg_16_9-w1200/631a5fbfd822491b489d6634fe3ba986.jpg,2025-09-21T01:13:36Z,,"Erst Drohnen über Polen, jetzt Kampfjets über Estland - Russland testet derzeit die Reaktionsfähigkeit der Nato aus. Für den CDU-Außenexperten Hardt ist klar: Ohne eine entschiedene Antwort wird Mosk… [+2160 chars]",,de,'Russland'
https://www.zeit.de/news/2025-09/21/militaer-und-netzengpaesse-bremsen-bayerns-windkraft-aus,https://www.zeit.de/news/2025-09/21/militaer-und-netzengpaesse-bremsen-bayerns-windkraft-aus,0,www.zeit.de,Schwierige Energiewende: Militär und Netzengpässe bremsen Bayerns Windkraft aus,Hier finden Sie Informationen zu dem Thema „Schwierige Energiewende“. Lesen Sie jetzt „Militär und Netzengpässe bremsen Bayerns Windkraft aus“.,https://img.zeit.de/news/2025-09/21/militaer-und-netzengpaesse-bremsen-bayerns-windkraft-aus-image-group/wide__1300x731,2025-09-21T02:00:52Z,,Trotz einer Zunahme an Genehmigungsanträgen für Windkraftanlagen kommt der Ausbau in Bayern weiterhin nur schleppend voran. Zwar wurden im vergangenen Jahr 280 Anträge und in den ersten vier Monaten … [+4349 chars],,de,'Windkraft'
https://www.sueddeutsche.de/politik/ukraine-krieg-newsblog-drohnen-berlin-li.3315548,https://www.sueddeutsche.de/politik/ukraine-krieg-newsblog-drohnen-berlin-li.3315548,0,www.sueddeutsche.de,Krieg in der Ukraine: Generalinspekteur verspricht Tempo bei Drohnenabwehr,"Die Bundeswehr musste wegen politischer Bedenken lange ohne Drohnen für Angriff und Abwehr auskommen. Ihr oberster General, Carsten Breuer, will jetzt Tempo machen.",https://www.sueddeutsche.de/2025/09/21/7e43f0af-1767-4fe9-b4ba-487e6a88b315.jpg?q=60&fm=webp&width=1200&rect=0%2C209%2C4000%2C2250,2025-09-21T02:47:54Z,,Drei russische Kampfflugzeuge sind nach estnischen Angaben am Freitag in den Luftraum des baltischen Landes und Nato-Mitglieds eingedrungen. Die Maschinen seien dort zwölf Minuten lang unerlaubt gewe… [+1445 chars],,de,'Ukraine'
https://www.faz.net/aktuell/politik/ausland/bedrohung-aus-russland-kann-ein-drohnenwall-uns-schuetzen-accg-110694324.html,https://www.faz.net/aktuell/politik/ausland/bedrohung-aus-russland-kann-ein-drohnenwall-uns-schuetzen-accg-110694324.html,0,www.faz.net,Russische Bedrohung: Kann ein Drohnenwall uns schützen?,"Als Putin billige Drohnen nach Polen und Rumänien schickte, musste die NATO sie mit teuren Raketen abschießen. Was ist nötig, um besser und effizienter zu werden?",https://media0.faz.net/ppmedia/w1200/aktuell/politik/2486516557/1.10694316/facebook_teaser/ein-ukrainischer-offizier.jpg.webp,2025-09-21T06:01:19Z,,"Ursula von der Leyen hat ein gutes Gespür für Timing. Als die Präsidentin der EU-Kommission am 10. September ihre Rede zur Lage der Europäischen Union hielt, machten gerade die ersten Berichte über d… [+235 chars]",,de,'Putin'
https://www.zeit.de/news/2025-09/21/ukrainische-und-russische-drohnen-im-einsatz,https://www.zeit.de/news/2025-09/21/ukrainische-und-russische-drohnen-im-einsatz,0,www.zeit.de,Krieg in der Ukraine: Ukrainische und russische Drohnen im Einsatz,Hier finden Sie Informationen zu dem Thema „Krieg in der Ukraine“. Lesen Sie jetzt „Ukrainische und russische Drohnen im Einsatz“.,https://img.zeit.de/news/2025-09/21/ukrainische-und-russische-drohnen-im-einsatz-image-group/wide__1300x731,2025-09-21T19:27:27Z,,"Russland und die Ukraine haben sich am frühen Abend gegenseitig mit Drohnen angegriffen. Dabei gab es erneut Opfer und Schäden, wie die jeweiligen Medien berichteten.
Die ukrainischen Streitkräfte g… [+952 chars]",,de,'Ukraine'
https://www.zeit.de/news/2025-09/22/un-sicherheitsrat-tagt-russische-und-ukrainische-angriffe,https://www.zeit.de/news/2025-09/22/un-sicherheitsrat-tagt-russische-und-ukrainische-angriffe,0,www.zeit.de,Krieg in der Ukraine: UN-Sicherheitsrat tagt - Russische und ukrainische Angriffe,Hier finden Sie Informationen zu dem Thema „Krieg in der Ukraine“. Lesen Sie jetzt „UN-Sicherheitsrat tagt - Russische und ukrainische Angriffe“.,https://img.zeit.de/news/2025-09/22/un-sicherheitsrat-tagt-russische-und-ukrainische-angriffe-image-group/wide__1300x731,2025-09-22T03:13:44Z,,Wegen der Verletzung des estnischen Luftraums durch russische Kampfjets kommt der UN-Sicherheitsrat heute zu einer Dringlichkeitssitzung zusammen. Der EU- und Nato-Staat Estland hatte das Treffen bea… [+4409 chars],,de,'Krieg'
https://orf.at/stories/3406109/,https://orf.at/stories/3406109/,0,orf.at,Schwierige Vorzeichen bei Lohnverhandlungen,Am Montag beginnt in Wien die Herbstlohnrunde mit den Kollektivvertragsverhandlungen der Metallindustrie und des Bergbaus. Die Gespräche finden diesmal unter besonders schwierigen Vorzeichen statt: Während die Gewerkschaften angesichts der hohen Inflation die…,https://ibs.orf.at/news?image=https%3A%2F%2Fassets.orf.at%2Fmims%2F2025%2F39%2F73%2Fcrops%2Fw%3D1200%2Ch%3D630%2Cq%3D75%2F2773341_master_1069273_metaller_lohnrunde_start_a.jpg%3Fs%3D32cc12e3fbdf6081b2d907cf8750681d3495e0c1,2025-09-22T04:03:26Z,,"Traditionell starten die Gespräche mit der formellen Forderungsübergabe der Gewerkschaften in der Wirtschaftskammer (WKO), anschließend folgt die erste Gesprächsrunde mit dem Fachverband Metalltechni… [+4346 chars]",,de,'Inflation'
