index,url,valid,domain,title,description,image,published,archive,content,quote,language,keyword
https://www.zeit.de/news/2022-12/01/abschlag-fuer-gas-und-waerme-uebernimmt-der-staat,https://www.zeit.de/news/2022-12/01/abschlag-fuer-gas-und-waerme-uebernimmt-der-staat,0,www.zeit.de,Dezember-Soforthilfe: Abschlag für Gas und Wärme übernimmt der Staat,,,2022-12-01T06:24:59Z,,"When browsing with ads:
We collect personal data and also transmit it to third-party providers
 that help us improve and finance our digital content. Some of the information stored on your device, … [+732 chars]",,de,'Gas'
https://www.tagesschau.de/inland/strom-gaspreisbremse-101.html,https://www.tagesschau.de/inland/strom-gaspreisbremse-101.html,0,www.tagesschau.de,Mitnahmeeffekte bei Gas- und Strompreisbremse?,"Die für Januar geplante Strom- und Gaspreisbremse ist heute erstmals Thema im Bundestag. Viele Versorger haben drastische Preiserhöhungen angekündigt. Verbraucherschützer fürchten, dass diese höher ausfallen als nötig. <em>Von H.-J. Vieweger.</em>",https://www.tagesschau.de/multimedia/bilder/stromrechnung-101~_v-original.jpg,2022-12-01T06:48:54Z,https://web.archive.org/web/20221201071320/https://www.tagesschau.de/inland/strom-gaspreisbremse-101.html,"Die für Januar geplante Strom- und Gaspreisbremse ist heute erstmals Thema im Bundestag. Viele Versorger haben drastische Preiserhöhungen angekündigt. Verbraucherschützer fürchten, dass diese höher a… [+3676 chars]",,de,'Energie sparen'
https://www.tagesschau.de/wirtschaft/verbraucher/advent-beleuchtung-energiesparen-innenstaedte-101.html,https://www.tagesschau.de/wirtschaft/verbraucher/advent-beleuchtung-energiesparen-innenstaedte-101.html,0,www.tagesschau.de,"Energieverbrauch: Advent, Advent, kein Lichtlein brennt?","Die Bundesregierung ruft die Bürger zum Stromsparen auf, doch Deutschlands Innenstädte erstrahlen im Lichtermeer. Wie passen Energiekrise und Weihnachtsgeschäft zusammen? V<em>on Tim Diekmann.</em>",https://www.tagesschau.de/multimedia/bilder/stuttgart-weihnachtsmarkt-101~_v-original.jpg,2022-12-01T07:16:40Z,https://web.archive.org/web/20221201074024/https://www.tagesschau.de/wirtschaft/verbraucher/advent-beleuchtung-energiesparen-innenstaedte-101.html,"Die Bundesregierung ruft die Bürger zum Stromsparen auf, doch Deutschlands Innenstädte erstrahlen im Lichtermeer. Wie passen Energiekrise und Weihnachtsgeschäft zusammen?
116 Meter ragt das Wahrzeic… [+5886 chars]",,de,'Energie sparen'
https://www.focus.de/finanzen/news/konjunktur/solar-wind-elektroautos-5g-grosse-uebersicht-warum-deutschland-fast-allen-ausbauzielen-hinterherhinkt_id_180235960.html,https://www.focus.de/finanzen/news/konjunktur/solar-wind-elektroautos-5g-grosse-uebersicht-warum-deutschland-fast-allen-ausbauzielen-hinterherhinkt_id_180235960.html,0,www.focus.de,"Große Übersicht zu Solar, Wind, Elektroautos, 5G - Deutschland hinkt fast überall den Ampel-Zielen hinterher","Deutschland hat sich ehrgeizige Ziele gesetzt, um beim Klimaschutz und Zukunftstechnologien vorneweg zu marschieren. Doch wie gut sind wir wirklich? FOCUS Online analysiert die wichtigsten Bereiche.Von FOCUS-online-Autor Christoph Sackmann",https://p6.focus.de/img/fotos/id_11013079/urn-newsml-dpa-com-20090101-190809-99-398488-large-4-3.jpg?im=Crop%3D%280%2C100%2C800%2C400%29%3BResize%3D%281200%2C627%29&impolicy=perceptual&quality=medium&hash=d1b50a4aa28f477ac259897a44aaadf4bfc3c4122f4f9177baf1efb394a33302,2022-12-01T09:02:12Z,,"Deutschland hat sich ehrgeizige Ziele gesetzt, um beim Klimaschutz und Zukunftstechnologien vorneweg zu marschieren. Doch wie gut sind wir wirklich? FOCUS Online analysiert die wichtigsten Bereiche.S… [+11301 chars]",,de,'Solar'
https://www.spiegel.de/wirtschaft/unternehmen/schwache-geschaefte-durch-inflation-einzelhandel-setzt-deutlich-weniger-um-a-dcaeaf81-72bd-41f0-9465-f15d0798e7fb,https://www.spiegel.de/wirtschaft/unternehmen/schwache-geschaefte-durch-inflation-einzelhandel-setzt-deutlich-weniger-um-a-dcaeaf81-72bd-41f0-9465-f15d0798e7fb,0,www.spiegel.de,Schwache Geschäfte durch Inflation: Einzelhandel setzt deutlich weniger um,"Im deutschen Einzelhandel sind die Umsätze zuletzt unerwartet stark eingebrochen. Besonders stark leiden Lebensmittelhändler, aber auch Versandhändler, Baumärkte sowie Einrichtungs- und Haushaltsgeschäfte.",https://cdn.prod.www.spiegel.de/images/3d41cf15-04ab-4282-9b40-03f8b56f0fa8_w1280_r1.77_fpx68.42_fpy50.jpg,2022-12-01T09:31:20Z,https://web.archive.org/web/20221201095826/https://www.spiegel.de/wirtschaft/unternehmen/schwache-geschaefte-durch-inflation-einzelhandel-setzt-deutlich-weniger-um-a-dcaeaf81-72bd-41f0-9465-f15d0798e7fb,"»Wegen der Inflationssense werden die Verbraucher die Köpfe weiter einziehen«, sagte der Chefvolkswirt der Hauck Aufhäuser Lampe Privatbank, Alexander Krüger. Die schlechte Konsumstimmung die den GfK… [+541 chars]",,de,'Inflation'
https://www.faz.net/aktuell/politik/ausland/stoltenberg-warnt-davor-russland-zu-unterschaetzen-18501599.html,https://www.faz.net/aktuell/politik/ausland/stoltenberg-warnt-davor-russland-zu-unterschaetzen-18501599.html,0,www.faz.net,"Stoltenberg warnt davor, Russland zu unterschätzen","Der NATO-Generalsekretär erinnert bei seinem Besuch in Berlin daran, dass die Ukraine im Winter alle Unterstützung brauchen werde. Der Munitionsnachschub und die Wartung der Waffensysteme bereiten große Probleme.",https://media0.faz.net/ppmedia/aktuell/politik/4236006146/1.8501658/facebook_teaser/stoltenberg-am-donnerstag-in.jpg,2022-12-01T10:11:16Z,https://web.archive.org/web/20221201113814/https://www.faz.net/aktuell/politik/ausland/stoltenberg-warnt-davor-russland-zu-unterschaetzen-18501599.html,"NATO-Generalsekretär Jens Stoltenberg hat davor gewarnt, das russische Militär zu unterschätzen. Während der Winter komme, regne es weiterhin Raketen auf ukrainische Städte und Infrastruktur. Wir in … [+2256 chars]",,de,'Ukraine'
https://www.spiegel.de/ausland/syrien-russland-verstaerkt-offenbar-praesenz-nahe-tuerkischer-grenze-a-521d418c-13d1-419f-8061-27a55e78d3d7,https://www.spiegel.de/ausland/syrien-russland-verstaerkt-offenbar-praesenz-nahe-tuerkischer-grenze-a-521d418c-13d1-419f-8061-27a55e78d3d7,0,www.spiegel.de,Syrien: Russland verstärkt offenbar Präsenz nahe türkischer Grenze,"Die Lage in Nordsyrien ist extrem angespannt. Nach Wochen der Luftangriffe droht nun auch eine Bodenoffensive des türkischen Militärs. Anwohner berichten, dass auch Russland sich offenbar vorbereitet.",https://cdn.prod.www.spiegel.de/images/d732dda0-0001-0004-0000-000000757472_w1280_r1.77_fpx38.69_fpy54.99.jpg,2022-12-01T11:09:41Z,https://web.archive.org/web/20221201111225/https://www.spiegel.de/ausland/syrien-russland-verstaerkt-offenbar-praesenz-nahe-tuerkischer-grenze-a-521d418c-13d1-419f-8061-27a55e78d3d7,Russland kämpft im Syrienkrieg seit 2015 an der Seite des syrischen Machthabers Baschar al-Assad. Seit 2019 ist die russische Armee nach einem Abkommen mit der Türkei auch im Nordosten Syriens präsen… [+641 chars],,de,'Russland'
https://www.zeit.de/wirtschaft/2022-12/energiekrise-forderungen-empel-koalition-nachbesserungen,https://www.zeit.de/wirtschaft/2022-12/energiekrise-forderungen-empel-koalition-nachbesserungen,0,www.zeit.de,Energiekrise: Ampel-Politiker planen Nachbesserungen an Gas- und Strompreisbremse,"Zu spät, zu kompliziert, nicht zielgenau: Die Opposition im Bundestag kritisiert die Pläne der Regierung zu den Preisbremsen. Auch die Ampel-Koalition will nachbessern.",,2022-12-01T11:46:25Z,https://web.archive.org/web/20221201120945/https://www.zeit.de/wirtschaft/2022-12/energiekrise-forderungen-empel-koalition-nachbesserungen,"When browsing with ads:
We collect personal data and also transmit it to third-party providers
 that help us improve and finance our digital content. Some of the information stored on your device, … [+732 chars]",,de,'Gas'
https://www.tagesschau.de/ausland/europa/waermeorte-ukraine-101.html,https://www.tagesschau.de/ausland/europa/waermeorte-ukraine-101.html,0,www.tagesschau.de,"Wärmeorte in der Ukraine: Heizkanone, Internet, Strom und Tee","Um vor dem kalten Winter in der Ukraine zu schützen, werden derzeit Tausende Wärmeorte aufgebaut. Dort bekommen die Menschen nicht nur Energie für ihre Handys, sondern geben sich gegenseitig Unterstützung. <em>Von Andrea Beer.</em>",https://www.tagesschau.de/multimedia/bilder/waermeorte-ukraine-107~_v-original.jpg,2022-12-01T11:55:27Z,https://web.archive.org/web/20221201123549/https://www.tagesschau.de/ausland/europa/waermeorte-ukraine-101.html,"Um vor dem kalten Winter in der Ukraine zu schützen, werden derzeit Tausende Wärmeorte aufgebaut. Dort bekommen die Menschen nicht nur Energie für ihre Handys, sondern geben sich gegenseitig Unterstü… [+4273 chars]",,de,'Ukraine'
https://www.zeit.de/mobilitaet/2022-11/fahrradkauf-preis-energiekrise-inflation,https://www.zeit.de/mobilitaet/2022-11/fahrradkauf-preis-energiekrise-inflation,0,www.zeit.de,"Fahrradkauf: Ist jetzt ein guter Zeitpunkt, ein Fahrrad zu kaufen?","Trotz Energiekrise und Inflation senken einige Fahrradhersteller die Preise. Wir erklären, was dahintersteckt. Und ob es sich lohnt, weiter abzuwarten.",,2022-12-01T12:20:27Z,https://web.archive.org/web/20221201123540/https://www.zeit.de/mobilitaet/2022-11/fahrradkauf-preis-energiekrise-inflation,"When browsing with ads:
We collect personal data and also transmit it to third-party providers
 that help us improve and finance our digital content. Some of the information stored on your device, … [+732 chars]",,de,'Inflation'
https://www.zeit.de/news/2022-12/01/inflation-sozialhilfeempfaenger-scheitert-vor-gericht,https://www.zeit.de/news/2022-12/01/inflation-sozialhilfeempfaenger-scheitert-vor-gericht,0,www.zeit.de,Ausgleichszahlungen: Inflation: Sozialhilfeempfänger scheitert vor Gericht,,,2022-12-01T12:41:30Z,https://web.archive.org/web/20221201133927/https://www.zeit.de/news/2022-12/01/inflation-sozialhilfeempfaenger-scheitert-vor-gericht,"When browsing with ads:
We collect personal data and also transmit it to third-party providers
 that help us improve and finance our digital content. Some of the information stored on your device, … [+732 chars]",,de,'Inflation'
https://www.faz.net/aktuell/politik/inland/windkraftausbau-bundeswehr-und-investoren-im-konflikt-18500337.html,https://www.faz.net/aktuell/politik/inland/windkraftausbau-bundeswehr-und-investoren-im-konflikt-18500337.html,0,www.faz.net,Wie der Windkraftausbau zu Konflikten zwischen Bundeswehr und Investoren führt,Die Ampel will die Windkraft ausbauen – und sie will die Verteidigungsfähigkeit stärken. Das führt zu Konflikten zwischen Bundeswehr und Investoren.,https://media0.faz.net/ppmedia/aktuell/1046961969/1.8500332/facebook_teaser/zu-besuch-beim-jaegerbataillon.jpg,2022-12-01T12:55:41Z,https://web.archive.org/web/20221201132811/https://www.faz.net/aktuell/politik/inland/windkraftausbau-bundeswehr-und-investoren-im-konflikt-18500337.html,"Die Energiewende vorantreiben, ist das zentrale Projekt der Berliner Ampelregierung. Als SPD, Grüne und FDP vor einem Jahr in Berlin ihren Koalitionsvertrag vorlegten, versprachen sie: Der Anteil ern… [+2773 chars]",,de,'Windkraft'
https://www.sueddeutsche.de/kultur/a-l-kennedy-mutter-england-1.5700941,https://www.sueddeutsche.de/kultur/a-l-kennedy-mutter-england-1.5700941,0,www.sueddeutsche.de,"Schriftstellerin A. L. Kennedy über ihre Mutter und England: Gute Nacht, Mama","Sie hat nicht für den Brexit gestimmt, sie hat keine Angst vor schwarzer Hautfarbe, vor LGBTQ+-Menschen: A. L. Kennedy über ihre Mutter",https://www.sueddeutsche.de/image/sz.1.5707325/1200x675?v=1669897393,2022-12-01T13:22:07Z,https://web.archive.org/web/20221201134830/https://www.sueddeutsche.de/kultur/a-l-kennedy-mutter-england-1.5700941,"Ein paar Sätze zu meiner Mutter und dem Land, in dem sie lebt: England. Damit Sie auch in Deutschland Bescheid wissen.Von A.L. KennedyNicht jeder Mensch liebt seine Mutter. Familien können schwierig,… [+253 chars]",,de,'Angst'
https://www.tagesschau.de/inland/gesellschaft/energiekosten-dezemberhilfe-101.html,https://www.tagesschau.de/inland/gesellschaft/energiekosten-dezemberhilfe-101.html,0,www.tagesschau.de,Dezemberhilfen werden ab sofort an Energieversorger gezahlt,Im Dezember übernimmt der Bund die Abschlagszahlungen für  Gas- und Fernwärmekunden. Sie müssen dafür nichts tun. Unternehmen müssen Anträge stellen - 75 Prozent der Energieversorger haben das bisher getan.,https://www.tagesschau.de/multimedia/bilder/bilderstrecke-winter-113~_v-original.jpg,2022-12-01T14:02:44Z,https://web.archive.org/web/20221201143722/https://www.tagesschau.de/inland/gesellschaft/energiekosten-dezemberhilfe-101.html,Im Dezember übernimmt der Bund die Abschlagszahlungen für Gas- und Fernwärmekunden. Sie müssen dafür nichts tun. Unternehmen müssen Anträge stellen - 75 Prozent der Energieversorger haben das bisher … [+1167 chars],,de,'Energiekosten'
https://www.zeit.de/news/2022-12/01/inflation-leicht-abgeschwaecht-noch-ueber-10-prozent-marke,https://www.zeit.de/news/2022-12/01/inflation-leicht-abgeschwaecht-noch-ueber-10-prozent-marke,0,www.zeit.de,Verbraucherpreise: Inflation leicht abgeschwächt: Noch über 10-Prozent-Marke,,,2022-12-01T14:45:45Z,https://web.archive.org/web/20221201150832/https://www.zeit.de/news/2022-12/01/inflation-leicht-abgeschwaecht-noch-ueber-10-prozent-marke,"When browsing with ads:
We collect personal data and also transmit it to third-party providers
 that help us improve and finance our digital content. Some of the information stored on your device, … [+732 chars]",,de,'Inflation'
https://www.spiegel.de/ausland/ukraine-krieg-kaempfe-um-bachmut-wie-im-ersten-weltkrieg-a-7cf1895c-e7a7-4b20-95b3-9cec3aedd686,https://www.spiegel.de/ausland/ukraine-krieg-kaempfe-um-bachmut-wie-im-ersten-weltkrieg-a-7cf1895c-e7a7-4b20-95b3-9cec3aedd686,0,www.spiegel.de,Ukraine-Krieg: Kämpfe um Bachmut wie im Ersten Weltkrieg,"Im Bachmut ringen Soldaten und Söldner erbittert um wenige Kilometer. Sind die zähen Gefechte ein Versuch, die Kräfte Kiews zu binden, damit sie an anderen Orten fehlen?",https://cdn.prod.www.spiegel.de/images/dd19b163-72a7-4718-a8a9-5ed17b3aae58_w1280_r1.77_fpx62.1_fpy50.jpg,2022-12-01T15:58:00Z,,"Mehr Perspektiven, mehr verstehen.
Freier Zugang zu allen Artikeln, Videos, Audioinhalten und Podcasts
<ul><li>
Alle Artikel auf SPIEGEL.de frei zugänglich
</li><li>
DER SPIEGEL als E-Paper und … [+743 chars]",,de,'Ukraine'
https://www.faz.net/aktuell/politik/ukraine-liveticker-biden-keine-plaene-fuer-gespraech-mit-putin-18495964.html,https://www.faz.net/aktuell/politik/ukraine-liveticker-biden-keine-plaene-fuer-gespraech-mit-putin-18495964.html,0,www.faz.net,Ukraine-Liveticker: Biden: Keine Pläne für Gespräch mit Putin,Kiew bereitet sich auf massive Stromausfälle vor +++ Gouverneur: Cherson nach Bombardierung ohne Strom +++ London: Angriffe auf ukrainisches Stromnetz gehören zur Militärdoktrin +++ alle Entwicklungen im Liveblog.,https://media0.faz.net/ppmedia/aktuell/politik/415089497/1.8503940/facebook_teaser/amerikas-praesident-joe-biden.jpg,2022-12-01T19:26:42Z,https://web.archive.org/web/20221201193940/https://www.faz.net/aktuell/politik/ukraine-liveticker-biden-keine-plaene-fuer-gespraech-mit-putin-18495964.html,"Ukraine-Liveticker: Biden: Keine Pläne für Gespräch mit Putin
Ukraine-Liveblog
Biden: Keine Pläne für Gespräch mit Putin
Von Kiew bereitet sich auf massive Stromausfälle vor +++ Gouverneur: Cherso… [+207 chars]",,de,'Ukraine'
https://www.faz.net/aktuell/newsletter-fruehdenker/f-a-z-fruehdenker-hilft-ein-neues-gesetz-den-kinderkliniken-aus-der-krise-18504048.html,https://www.faz.net/aktuell/newsletter-fruehdenker/f-a-z-fruehdenker-hilft-ein-neues-gesetz-den-kinderkliniken-aus-der-krise-18504048.html,0,www.faz.net,F.A.Z. Frühdenker: Hilft ein neues Gesetz den Kinderkliniken aus der Krise?,"Der Bundestag verabschiedet ein Gesetz, das Kinderkliniken am Limit Entlastung bringen soll. Deutschland ist raus aus der Fußball-WM. Und: Skigebiete wollen Energie sparen.",https://media1.faz.net/ppmedia/aktuell/gesellschaft/2611084345/1.8504067/facebook_teaser_fplus/ein-arzt-untersucht-im.jpg,2022-12-02T05:10:02Z,https://web.archive.org/web/20221202052429/https://www.faz.net/aktuell/newsletter-fruehdenker/f-a-z-fruehdenker-hilft-ein-neues-gesetz-den-kinderkliniken-aus-der-krise-18504048.html,"Das Wichtigste für Sie an diesem Freitag:
1. Kinderkliniken im Krisenmodus2. Biden und Macron betonen Einigkeit3. OSZE macht weiter in der Ukraine 4. WM-Aus für Deutschland5. Großbritannien debattie… [+1061 chars]",,de,'Energie sparen'
https://www.faz.net/aktuell/politik/ukraine-liveticker-ukrainische-angriffe-auf-versorgungsknotenpunkte-draengen-russen-zurueck-18495964.html,https://www.faz.net/aktuell/politik/ukraine-liveticker-ukrainische-angriffe-auf-versorgungsknotenpunkte-draengen-russen-zurueck-18495964.html,0,www.faz.net,Ukraine-Liveticker: Ukrainische Angriffe auf Versorgungsknotenpunkte drängen Russen zurück,Deniz Yücel für deutsche Kampfpanzer an die Ukraine +++ Biden: Keine Pläne für Gespräch mit Putin +++ Kiew bereitet sich auf massive Stromausfälle vor +++ alle Entwicklungen im Liveblog.,https://media1.faz.net/ppmedia/aktuell/1529769762/1.8504545/facebook_teaser/ukrainische-soldaten-an-der.jpg,2022-12-02T05:29:51Z,https://web.archive.org/web/20221202082248/https://www.faz.net/aktuell/politik/ukraine-liveticker-ukrainische-angriffe-auf-versorgungsknotenpunkte-draengen-russen-zurueck-18495964.html,"Der Sprecher der Schriftstellervereinigung PEN Berlin, Deniz Yücel, hat sich für die Lieferung deutscher Kampfpanzer an die Ukraine ausgesprochen. Selbstverständlich bin ich dafür, weil der Faschismu… [+381 chars]",,de,'Putin'
https://www.faz.net/aktuell/politik/ukraine-liveticker-deniz-yuecel-fuer-deutsche-kampfpanzer-an-die-ukraine-18495964.html,https://www.faz.net/aktuell/politik/ukraine-liveticker-deniz-yuecel-fuer-deutsche-kampfpanzer-an-die-ukraine-18495964.html,0,www.faz.net,Ukraine-Liveticker: Deniz Yücel für deutsche Kampfpanzer an die Ukraine,Biden: Keine Pläne für Gespräch mit Putin +++ Kiew bereitet sich auf massive Stromausfälle vor +++ Gouverneur: Cherson nach Bombardierung ohne Strom +++ alle Entwicklungen im Liveblog.,https://media1.faz.net/ppmedia/aktuell/feuilleton/4192911099/1.8504327/facebook_teaser/deniz-yuecel-ist-sprecher-des.jpg,2022-12-02T05:29:51Z,https://web.archive.org/web/20221202060841/https://www.faz.net/aktuell/politik/ukraine-liveticker-deniz-yuecel-fuer-deutsche-kampfpanzer-an-die-ukraine-18495964.html,"Der Sprecher der Schriftstellervereinigung PEN Berlin, Deniz Yücel, hat sich für die Lieferung deutscher Kampfpanzer an die Ukraine ausgesprochen. Selbstverständlich bin ich dafür, weil der Faschismu… [+381 chars]",,de,'Ukraine'
https://www.faz.net/aktuell/politik/wie-norwegen-kuenftig-seine-pipelines-schuetzen-will-18503306.html,https://www.faz.net/aktuell/politik/wie-norwegen-kuenftig-seine-pipelines-schuetzen-will-18503306.html,0,www.faz.net,Gaspipelines in Norwegen: Wie schützt man die Lebensadern am Meeresboden?,Norwegisches Gas ist für ganz Europa wichtig – die Pipelines sollen nun auch militärisch besser geschützt werden.,https://media0.faz.net/ppmedia/aktuell/politik/3832294584/1.8503302/facebook_teaser_fplus/die-hms-queen-elizabeth-ein.jpg,2022-12-02T07:03:34Z,https://web.archive.org/web/20221202080352/http://www.faz.net/aktuell/politik/wie-norwegen-kuenftig-seine-pipelines-schuetzen-will-18503306.html,"Im Hafen von Oslo konnte man gerade sehen, dass es sehr spezielle Zeiten sind. Da lief vor wenigen Tagen die HMS Queen Elizabeth zu ihrem ersten Besuch in der norwegischen Hauptstadt ein, ein britisc… [+678 chars]",,de,'Gas'
https://www.tagesschau.de/wirtschaft/technologie/solardachziegel-solarstrom-sonnenenergie-101.html,https://www.tagesschau.de/wirtschaft/technologie/solardachziegel-solarstrom-sonnenenergie-101.html,0,www.tagesschau.de,Haben deutsche Solarfirmen auf dem Weltmarkt noch eine Chance?,Im Vergleich zu Firmen aus China ist die deutsche Solarbranche heute unbedeutend. Doch mehr Energie-Unabhängigkeit ist das politische Ziel. Haben deutsche Hersteller eine Chance mit Nischenprodukten?​ <em>Von David Zajonz.</em>,https://www.tagesschau.de/multimedia/bilder/solardachziegel-101~_v-original.jpg,2022-12-02T07:57:36Z,https://web.archive.org/web/20221202091909/https://www.tagesschau.de/wirtschaft/technologie/solardachziegel-solarstrom-sonnenenergie-101.html,Im Vergleich zu Firmen aus China ist die deutsche Solarbranche heute unbedeutend. Doch mehr Energie-Unabhängigkeit ist das politische Ziel. Haben deutsche Hersteller eine Chance mit Nischenprodukten?… [+4842 chars],,de,'Energie sparen'
https://www.faz.net/aktuell/politik/ukraine-liveticker-sanna-marin-zweifelt-verteidigungsfaehigkeit-europas-an-18495964.html,https://www.faz.net/aktuell/politik/ukraine-liveticker-sanna-marin-zweifelt-verteidigungsfaehigkeit-europas-an-18495964.html,0,www.faz.net,Ukraine-Liveticker: Sanna Marin zweifelt Verteidigungsfähigkeit Europas an,London: Ukrainische Angriffe auf Versorgungsknotenpunkte drängen Russen zurück +++ Biden: Keine Pläne für Gespräch mit Putin +++ Kiew bereitet sich auf massive Stromausfälle vor +++ alle Entwicklungen im Liveblog.,https://media1.faz.net/ppmedia/aktuell/politik/183628237/1.8504869/facebook_teaser/finnlands-ministerpraesidentin.jpg,2022-12-02T10:13:30Z,https://web.archive.org/web/20221202103820/https://www.faz.net/aktuell/politik/ukraine-liveticker-sanna-marin-zweifelt-verteidigungsfaehigkeit-europas-an-18495964.html,"Ukraine-Liveticker: Sanna Marin zweifelt Verteidigungsfähigkeit Europas an
Ukraine-Liveblog
Sanna Marin zweifelt Verteidigungsfähigkeit Europas an
Von London: Ukrainische Angriffe auf Versorgungsk… [+233 chars]",,de,'Putin'
https://www.spiegel.de/wirtschaft/haushaltspolitik-ezb-chefin-christine-lagarde-warnt-vor-zu-starker-konjunkturfoerderung-a-078396df-dfe4-4be3-ad44-e2c385c3a143,https://www.spiegel.de/wirtschaft/haushaltspolitik-ezb-chefin-christine-lagarde-warnt-vor-zu-starker-konjunkturfoerderung-a-078396df-dfe4-4be3-ad44-e2c385c3a143,0,www.spiegel.de,Haushaltspolitik: EZB-Chefin Christine Lagarde warnt vor zu starker Konjunkturförderung,EZB-Chefin Christine Lagarde macht sich Sorgen um die Konjunkturpolitik einzelner Länder im Euroraum. Die Maßnahmen zur Eindämmung der Rezession haben nämlich eine Kehrseite: Sie heizen die Inflation an.,https://cdn.prod.www.spiegel.de/images/f9a423d9-6957-4cd9-9ec9-a5cd17d2d1e7_w1280_r1.77_fpx57.8_fpy54.86.jpg,2022-12-02T10:56:31Z,https://web.archive.org/web/20221202115035/https://www.spiegel.de/wirtschaft/haushaltspolitik-ezb-chefin-christine-lagarde-warnt-vor-zu-starker-konjunkturfoerderung-a-078396df-dfe4-4be3-ad44-e2c385c3a143,"Die EU-Kommission geht inzwischen davon aus, dass die Wirtschaft im Euroraum im vierten Quartal und im ersten Quartal 2023 schrumpfen wird. Zu den Gründen zählt sie hohe Energiepreise, Kaufkraftverlu… [+417 chars]",,de,'Inflation'
https://www.faz.net/aktuell/politik/ukraine-liveticker-scholz-telefoniert-mit-putin-18495964.html,https://www.faz.net/aktuell/politik/ukraine-liveticker-scholz-telefoniert-mit-putin-18495964.html,0,www.faz.net,Ukraine-Liveticker: Scholz telefoniert mit Putin,Putin wirft Westen „zerstörerische Linie“ vor +++ Finnische Ministerpräsidentin Marin zweifelt an Europas Verteidigungsfähigkeit +++ London: Ukrainische Angriffe auf Versorgungsknotenpunkte drängen Russen zurück +++ alle Entwicklungen im Liveblog.,https://media1.faz.net/ppmedia/aktuell/politik/2011554050/1.8505367/facebook_teaser/bundeskanzler-olaf-scholz-und.jpg,2022-12-02T11:49:07Z,https://web.archive.org/web/20221202122144/https://www.faz.net/aktuell/politik/ukraine-liveticker-scholz-telefoniert-mit-putin-18495964.html,Der russische Präsident Wladimir Putin ist nach Angaben seines Sprechers offen für Gespräche mit dem amerikanischen Präsidenten Joe Biden über eine Regelung für die Ukraine. Allerdings behindere die … [+688 chars],,de,'Ukraine'
https://www.zeit.de/news/2022-12/02/zugspitze-startet-in-die-wintersaison,https://www.zeit.de/news/2022-12/02/zugspitze-startet-in-die-wintersaison,0,www.zeit.de,Energiekrise und Inflation: Zugspitze startet in die Wintersaison,,,2022-12-02T11:58:55Z,https://web.archive.org/web/20221202122356/https://www.zeit.de/news/2022-12/02/zugspitze-startet-in-die-wintersaison,"When browsing with ads:
We collect personal data and also transmit it to third-party providers
 that help us improve and finance our digital content. Some of the information stored on your device, … [+732 chars]",,de,'Inflation'
https://www.spiegel.de/politik/deutschland/ukraine-krieg-olaf-scholz-telefoniert-mit-wladimir-putin-und-will-austausch-fortsetzen-a-617b926f-f451-4283-8cca-a3b9ace138e5,https://www.spiegel.de/politik/deutschland/ukraine-krieg-olaf-scholz-telefoniert-mit-wladimir-putin-und-will-austausch-fortsetzen-a-617b926f-f451-4283-8cca-a3b9ace138e5,0,www.spiegel.de,Ukraine-Krieg: Olaf Scholz telefoniert mit Wladimir Putin und will Austausch fortsetzen,Bundeskanzler Scholz hat sich nach mehreren Monaten erneut mit Kremlchef Putin besprochen. Die Darstellungen des Anrufs gehen jedoch weit auseinander.,https://cdn.prod.www.spiegel.de/images/1798810d-5116-4e33-bdb7-53e3850581ed_w1280_r1.77_fpx40.66_fpy48.96.jpg,2022-12-02T12:45:06Z,https://web.archive.org/web/20221202130931/https://www.spiegel.de/politik/deutschland/ukraine-krieg-olaf-scholz-telefoniert-mit-wladimir-putin-und-will-austausch-fortsetzen-a-617b926f-f451-4283-8cca-a3b9ace138e5,Bundeskanzler Olaf Scholz (SPD) hat erstmals seit Mitte September mit Kremlchef Wladimir Putin am Telefon über den seit gut neun Monaten andauernden russischen Angriffskrieg gegen die Ukraine gesproc… [+2142 chars],,de,'Ukraine'
