index,url,valid,domain,title,description,image,published,archive,content,quote,language,keyword
https://www.tagesschau.de/ausland/europa/russland-extremismusgesetz-100.html,https://www.tagesschau.de/ausland/europa/russland-extremismusgesetz-100.html,0,www.tagesschau.de,Umstrittenes Extremismusgesetz tritt in Russland in Kraft,"In Russland ist die Internetsuche nach ""extremistischen Inhalten"" ab heute strafbar. Dazu gehören Recherchen zu LGBTQI, Beiträge zur Opposition oder das Abspielen bestimmter Musik. Die Meinungsfreiheit wird damit weiter eingeschränkt. Von Stefanie Markert.",https://images.tagesschau.de/image/c797ced1-03d7-4ed1-a8aa-2723cedc47bb/AAABmQAEKxc/AAABmKJZ-0g/16x9-big/duma-parlament-russland-100.jpg?width=1280,2025-09-01T03:15:13Z,,"Stand: 01.09.2025 05:15 Uhr
In Russland ist die Internetsuche nach ""extremistischen Inhalten"" ab heute strafbar. Dazu gehören Recherchen zu LGBTQI, Beiträge zur Opposition oder das Abspielen bestimm… [+3662 chars]",,de,'Russland'
https://www.zeit.de/politik/2025-08/hamas-gaza-israel-krieg-nachrichtenpodcast,https://www.zeit.de/politik/2025-08/hamas-gaza-israel-krieg-nachrichtenpodcast,0,www.zeit.de,Hamas: Was von der Hamas noch übrig ist,"In Gaza kämpft die Bevölkerung ums Überleben, während Israel den Krieg fortsetzt. Aber die Terrororganisation Hamas verschwindet nicht. Und: NRW vor den Kommunalwahlen",https://img.zeit.de/politik/2017-09/illu-podcast-news/wide__8ed8a6__1300x731,2025-09-01T03:58:13Z,,"Seit knapp zwei Jahren herrscht Krieg im Gazastreifen. Zehntausende Menschen sind gestorben. Fast zwei Millionen Menschen leiden weiterhin unter der extremen Hungersnot und versuchen, in dem kleinen … [+1653 chars]",,de,'Krieg'
https://www.autobild.de/artikel/dienstwagen-check-wer-zahlt-was---und-warum-28240627.html,https://www.autobild.de/artikel/dienstwagen-check-wer-zahlt-was---und-warum-28240627.html,0,www.autobild.de,Achtung! Kostenfalle Firmenwagen,Ein Firmenwagen bedeutet auch steuerliche Pflichten und laufende Kosten. Wie sich Geld sparen lässt.,https://i.auto-bild.de/ir_img/3/9/7/8/5/1/5/Achtung--Kostenfalle-Firmenwagen-2869-1800x1012-5b78d55aa5c44529.jpg?impolicy=og_images,2025-09-01T04:00:00Z,,Ein Firmenwagen ist für viele Angestellte ein echter Bonus aber zugleich auch ein steuerlich reguliertes Gesamtpaket. Was viele nicht wissen: Hinter dem schicken Dienstwagen stecken jede Menge Kosten… [+4797 chars],,de,'Geld sparen'
https://www.zeit.de/news/2025-09/01/spahn-und-miersch-ueberraschend-gemeinsam-in-der-ukraine,https://www.zeit.de/news/2025-09/01/spahn-und-miersch-ueberraschend-gemeinsam-in-der-ukraine,0,www.zeit.de,Krieg in der Ukraine: Spahn und Miersch überraschend gemeinsam in der Ukraine,Hier finden Sie Informationen zu dem Thema „Krieg in der Ukraine“. Lesen Sie jetzt „Spahn und Miersch überraschend gemeinsam in der Ukraine“.,https://img.zeit.de/news/2025-09/01/spahn-und-miersch-ueberraschend-gemeinsam-in-der-ukraine-image-group/wide__1300x731,2025-09-01T05:01:04Z,,"Die Vorsitzenden der beiden Koalitionsfraktionen, Jens Spahn (CDU/CSU) und Matthias Miersch (SPD), sind zu einem gemeinsamen Solidaritätsbesuch in der von Russland angegriffenen Ukraine eingetroffen.… [+220 chars]",,de,'Krieg'
https://www.faz.net/aktuell/politik/ukraine/ukraine-liveticker-ukraine-spahn-und-miersch-reisen-gemeinsam-in-die-ukraine-110172806.html,https://www.faz.net/aktuell/politik/ukraine/ukraine-liveticker-ukraine-spahn-und-miersch-reisen-gemeinsam-in-die-ukraine-110172806.html,0,www.faz.net,Krieg in der Ukraine: Spahn und Miersch reisen gemeinsam in die Ukraine,Fraktionsvorsitzende der Koalitionsparteien auf Solidaritätsbesuch +++ Ukraine: Haben Reihe von Angriffen auf der Krim durchgeführt +++ Merz glaubt nicht an baldigen Waffenstillstand +++ alle Neuigkeiten im Liveblog,https://media1.faz.net/ppmedia/w1200/aktuell/politik/1337085874/1.10664333/facebook_teaser/unionsfraktionschef-jens-spahn.jpg.webp,2025-09-01T05:19:44Z,,Der russische Präsident Wladimir Putin ist in China eingetroffen. Das berichtet die Staatsagentur TASS. Putin wird am Gipfel der Shanghaier Organisation für Zusammenarbeit in Tianjin teilnehmen. Ansc… [+525 chars],,de,'Ukraine'
https://www.tagesschau.de/newsticker/liveblog-ukraine-montag-526.html,https://www.tagesschau.de/newsticker/liveblog-ukraine-montag-526.html,0,www.tagesschau.de,Ukraine-Liveblog: ++ Spahn und Miersch zu Gesprächen in Ukraine ++,"Die Vorsitzenden der beiden Koalitionsfraktionen, Spahn und Miersch, besuchen überraschend die Ukraine. Laut EU-Kommissionspräsidentin von der Leyen arbeitet die EU an konkreten Plänen für die Entsendung multinationaler Truppen.",https://images.tagesschau.de/image/a92f01cf-8f9d-4d79-b8b7-f127e0132c0d/AAABmQO7UPM/AAABmKJZ-0g/16x9-big/miersch-spahn-ukraine-100.jpg?width=1280,2025-09-01T05:21:37Z,,"Stand: 01.09.2025 07:21 Uhr
Die Vorsitzenden der beiden Koalitionsfraktionen, Spahn und Miersch, besuchen überraschend die Ukraine. Laut EU-Kommissionspräsidentin von der Leyen arbeitet die EU an ko… [+1782 chars]",,de,'Ukraine'
https://www.n-tv.de/politik/Soeder-ruft-nach-harten-Reformen-im-Sozialbereich-article26000791.html,https://www.n-tv.de/politik/Soeder-ruft-nach-harten-Reformen-im-Sozialbereich-article26000791.html,0,www.n-tv.de,"Mehr Arbeit, weniger Ansprüche: Söder ruft nach ""harten Reformen"" im Sozialbereich","Seit Monaten tobt eine Debatte über die Kosten für die sozialen Sicherungssysteme. Die schwarz-rote Bundesregierung möchte mit einer Reform Geld sparen. Wie soll diese aussehen? Offen. Für CSU-Chef Söder ist dennoch klar: ""Das Bürgergeld muss komplett geänder…",https://www.n-tv.de/img/incoming/crop26000813/9881323383-cImg_16_9-w1200/542996603.jpg,2025-09-01T05:42:36Z,,Seit Monaten tobt eine Debatte über die Kosten für die sozialen Sicherungssysteme. Die schwarz-rote Bundesregierung möchte mit einer Reform Geld sparen. Wie soll diese aussehen? Offen. Für CSU-Chef S… [+3032 chars],,de,'Geld sparen'
https://www.zeit.de/politik/ausland/2025-08/ukrainische-gefangene-russland-haft-gewalt-folter,https://www.zeit.de/politik/ausland/2025-08/ukrainische-gefangene-russland-haft-gewalt-folter,0,www.zeit.de,"Ukrainische Gefangene: Nach Russland verschleppt, ohne Aussicht auf Freiheit",Russland hält Tausende ukrainische Zivilisten gefangen – und bricht damit das Völkerrecht. Einer von ihnen ist Damian Omeljanenko. Seine Mutter kämpft für ihn.,https://img.zeit.de/politik/ausland/2025-08/ukrainische-gefangene-russland-haft-gewalt-folter-bild/wide__1300x731,2025-09-01T06:10:42Z,,"Schließen
Artikelzusammenfassung
Ukrainische Zivilisten in russischer Gefangenschaft: Tetjana Omeljanenkos Kampf um ihren Sohn Damian, der unter fragwürdigen Anschuldigungen vor Gericht steht, ist … [+728 chars]",,de,'Russland'
https://www.zeit.de/politik/ausland/2025-09/miersch-spahn-ukraine-kyjiw-union-spd-koalition,https://www.zeit.de/politik/ausland/2025-09/miersch-spahn-ukraine-kyjiw-union-spd-koalition,0,www.zeit.de,Krieg in der Ukraine: Spahn und Miersch besuchen gemeinsam die Ukraine,Als Zeichen der weiteren Unterstützung für die Ukraine sind die Fraktionsspitzen von Union und SPD nach Kyjiw gereist. Sie wollen Einigkeit bei Schwarz-Rot demonstrieren.,https://img.zeit.de/politik/2025-09/miersch-spahn-ukraine-kyjiw-union-spd-koalition-bild/wide__1300x731,2025-09-01T07:40:23Z,,"Die Vorsitzenden der beiden Koalitionsfraktionen, Jens Spahn (CDU/CSU) und Matthias Miersch
 (SPD), sind zu einem gemeinsamen Solidaritätsbesuch in der Ukraine eingetroffen. In der ukrainischen Haup… [+2950 chars]",,de,'Krieg'
https://www.welt.de/politik/ausland/video68b55f45cf33b514cb80dda3/afghanen-flugzeug-sie-fluechten-nicht-vor-dem-regime-sie-fluechten-vor-der-armut.html,https://www.welt.de/politik/ausland/video68b55f45cf33b514cb80dda3/afghanen-flugzeug-sie-fluechten-nicht-vor-dem-regime-sie-fluechten-vor-der-armut.html,0,www.welt.de,"„Sie flüchten nicht vor dem Regime, sie flüchten vor der Armut“","Ein weiterer Flug mit Afghanen aus Pakistan landet in Hannover. Die meisten Passagiere sind keine Ortskräfte, sondern Angehörige. Zudem „gibt es keinen belegten Fall, dass ehemalige Ortskräfte umgebracht oder ins Gefängnis gesteckt wurden“, sagt Afghanistan-E…",https://images.welt.de/68b55f45cf33b514cb80dda3/f38d80ad5d0e6678d7540bc5964a6b8e-master/ci16x9-w1200/symbolbild-abschiebung,2025-09-01T09:15:59Z,,"Ein weiterer Flug mit Afghanen aus Pakistan landet in Hannover. Die meisten Passagiere sind keine Ortskräfte, sondern Angehörige. Zudem gibt es keinen belegten Fall, dass ehemalige Ortskräfte umgebra… [+142 chars]",,de,'Armut'
https://www.faz.net/aktuell/wirtschaft/unternehmen/mittelstaendler-sterben-still-steigende-kosten-und-strenge-auflagen-accg-110661461.html,https://www.faz.net/aktuell/wirtschaft/unternehmen/mittelstaendler-sterben-still-steigende-kosten-und-strenge-auflagen-accg-110661461.html,0,www.faz.net,Unternehmen in der Krise: Mittelständler sterben still,Inflation und Bürokratie setzen den Mittelstand unter Druck. ZGV-Präsident Althaus fordert Entlastungen und warnt vor einem Innovationsrückstand.,https://media0.faz.net/ppmedia/w1200/aktuell/2246384366/1.10661460/facebook_teaser/guenter-althaus-ist-praesident.jpg.webp,2025-09-01T09:25:27Z,,"Günter Althaus will den Bürokratieabbau zur Chefsache machen. Seit Mai ist er Präsident des Mittelstandsverbunds ZGV. Bürokratie killt die Leistung, sagt Althaus, der auch Vorstandsvorsitzender der R… [+340 chars]",,de,'Inflation'
https://www.zeit.de/news/2025-09/01/flugzeug-mit-von-der-leyen-wird-ziel-von-gps-stoerung,https://www.zeit.de/news/2025-09/01/flugzeug-mit-von-der-leyen-wird-ziel-von-gps-stoerung,0,www.zeit.de,EU: Flugzeug mit von der Leyen wird Ziel von GPS-Störung,Hier finden Sie Informationen zu dem Thema „Russland unter Verdacht“. Lesen Sie jetzt „Flugzeug mit von der Leyen wird Ziel von GPS-Störung“.,https://img.zeit.de/news/2025-09/01/flugzeug-mit-von-der-leyen-wird-ziel-von-gps-stoerung-image-group/wide__1300x731,2025-09-01T10:23:55Z,https://web.archive.org/web/20250901110830/https://www.zeit.de/news/2025-09/01/flugzeug-mit-von-der-leyen-wird-ziel-von-gps-stoerung,"Ein Flugzeug mit EU-Kommissionspräsidentin Ursula von der Leyen an Bord ist mutmaßlich Ziel einer absichtlichen Störung des satellitenbasierten Navigationssystems GPS durch Russland geworden.
«Wir k… [+1602 chars]",,de,'Russland'
https://www.tagesspiegel.de/internationales/wurde-vom-westen-provoziert-putin-gibt-nato-staaten-auf-soz-gipfel-in-tianjin-schuld-am-ukrainekrieg-14256476.html,https://www.tagesspiegel.de/internationales/wurde-vom-westen-provoziert-putin-gibt-nato-staaten-auf-soz-gipfel-in-tianjin-schuld-am-ukrainekrieg-14256476.html,0,www.tagesspiegel.de,„Wurde vom Westen provoziert“ : Putin gibt Nato-Staaten auf SOZ-Gipfel in Tianjin Schuld am Ukrainekrieg,"Das Gipfeltreffen der Shanghaier Organisation für Zusammenarbeit wird mit harscher Kritik eröffnet. Putin schießt verbal gegen den Westen, Xi Jinping sieht derweil die Weltordnung gefährdet.",https://www.tagesspiegel.de/images/14256839/alternates/BASE_16_9_W1400/1756723009000/russian-president-putin-and-indian-prime-minister-modi-meet-at-sco-summit-in-tianjin.jpeg,2025-09-01T10:38:56Z,,Kremlchef Wladimir Putin hat sich auf bei der Eröffnung des Gipfeltreffens der Shanghaier Organisation für Zusammenarbeit (SOZ) harsche Kritik an Nato-Staaten geübt. Konkret beschuldigte er den Weste… [+6183 chars],,de,'Putin'
https://www.tagesspiegel.de/internationales/putin-will-uns-alle-vernichten-wie-lebt-es-sich-in-einer-stadt-die-russland-an-sich-reissen-will-14234840.html,https://www.tagesspiegel.de/internationales/putin-will-uns-alle-vernichten-wie-lebt-es-sich-in-einer-stadt-die-russland-an-sich-reissen-will-14234840.html,0,www.tagesspiegel.de,"„Putin will uns alle vernichten“: Wie lebt es sich in einer Stadt, die Russland an sich reißen will?","Kramatorsk zählt zu den letzten Großstädten, die die Ukraine im Donbass noch kontrolliert. Nun will Moskau die Kapitulation erzwingen. Ein Besuch bei Menschen, für die es um alles geht.",https://www.tagesspiegel.de/images/14239121/alternates/BASE_16_9_W1400/1756372315000/russia-strikes-the-kramatorsk-community-ukraine.jpeg,2025-09-01T11:04:30Z,http://archive.md/20250901111246/https://www.tagesspiegel.de/internationales/putin-will-uns-alle-vernichten-wie-lebt-es-sich-in-einer-stadt-die-russland-an-sich-reissen-will-14234840.html,"Kramatorsk zählt zu den letzten Großstädten, die die Ukraine im Donbass noch kontrolliert. Nun will Moskau die Kapitulation erzwingen. Ein Besuch bei Menschen, für die es um alles geht.",,de,'Putin'
https://www.zeit.de/news/2025-09/01/pistorius-kritisiert-aeusserungen-von-der-leyens,https://www.zeit.de/news/2025-09/01/pistorius-kritisiert-aeusserungen-von-der-leyens,0,www.zeit.de,Krieg in der Ukraine: Pistorius kritisiert Äußerungen von der Leyens,Hier finden Sie Informationen zu dem Thema „Krieg in der Ukraine“. Lesen Sie jetzt „Pistorius kritisiert Äußerungen von der Leyens“.,https://img.zeit.de/news/2025-09/01/pistorius-kritisiert-aeusserungen-von-der-leyens-image-group/wide__1300x731,2025-09-01T11:25:02Z,,Verteidigungsminister Boris Pistorius hat Äußerungen von EU-Kommissionspräsidentin Ursula von der Leyen zu militärischen Sicherheitsgarantien für die Ukraine deutlich kritisiert. Er halte es grundsät… [+1092 chars],,de,'Ukraine'
https://www.stern.de/news/serbiens-praesident-vucic-reist-fuer-treffen-mit-xi-und-putin-nach-china-36018662.html,https://www.stern.de/news/serbiens-praesident-vucic-reist-fuer-treffen-mit-xi-und-putin-nach-china-36018662.html,0,www.stern.de,Serbiens Präsident Vucic reist für Treffen mit Xi und Putin nach China,"Serbiens Präsident Alexander Vucic wird am Dienstag nach China reisen, um dort in Peking mit den Präsidenten Chinas und Russlands, Xi Jinping und Wladimir Putin, zusammenzukommen. Wie Vucics Büro am Montag mitteilte, wird das serbische Staatsoberhaupt zudem a…",https://image.stern.de/36018664/t/6p/v1/w1440/r1.7778/-/01--vucic---382bd55ddb9e1ac6.jpg,2025-09-01T11:35:37Z,,"Kopiere den aktuellen Link
Zur Merkliste hinzufügen
Serbiens Präsident Alexander Vucic wird am Dienstag nach China reisen, um dort in Peking mit den Präsidenten Chinas und Russlands, Xi Jinping und… [+2189 chars]",,de,'Putin'
https://www.focus.de/politik/ausland/selenskyj-kuendigt-neue-angriffe-in-russland-an-und-enthuellt-putins-schmerzhafte-verluste_e51731bf-3e29-441c-b71f-78a80f26ab14.html,https://www.focus.de/politik/ausland/selenskyj-kuendigt-neue-angriffe-in-russland-an-und-enthuellt-putins-schmerzhafte-verluste_e51731bf-3e29-441c-b71f-78a80f26ab14.html,0,www.focus.de,Selenskyj kündigt neue Angriffe in Russland an - und enthüllt Putins schmerzhafte Verluste,Die Ukraine könnte weitere Angriffe tief in russischem Gebiet planen. Präsident Selenskyj betont die Bereitschaft der Streitkräfte und berichtet von der Lage an der Front.,https://quadro.burda-forward.de/ctf/81084fb9-cadd-40b5-8bd6-52c56181dc28.732f0f16-e9bc-486e-9303-aac7e5e11864.jpg?im=RegionOfInterestCrop%3D%281200%2C630%29%2CregionOfInterest%3D%281437%2C1037%29&hash=519fd8a833a327e1d653393830f388c97de9b16b1241a22765783c98b199af0c,2025-09-01T11:50:50Z,,"Der ukrainische Präsident Wolodymyr Selenskyj hat sich kürzlich mit dem Oberbefehlshaber der Streitkräfte, Oleksandr Syrskyj, getroffen. Dabei ging es laut RBC Ukraine vor allem um die Planung neuer … [+2320 chars]",,de,'Russland'
https://www.telepolis.de/features/3-Millionen-Arbeitslose-Kommt-jetzt-der-soziale-Absturz-10627678.html,https://www.telepolis.de/features/3-Millionen-Arbeitslose-Kommt-jetzt-der-soziale-Absturz-10627678.html,0,www.telepolis.de,3 Millionen Arbeitslose – Kommt jetzt der soziale Absturz?,Schönreden statt Kurswechsel: Hinter der Arbeitsmarkt-Misere steckt eine jahrelange Produktivitätskrise. Droht Deutschland der Absturz? Gastbeitrag.,https://heise.cloudimg.io/bound/1200x1200/q85.png-lossy-85.webp-lossy-85.foil1/_www-heise-de_/imgs/18/4/9/2/8/2/8/4/Master_Horn-7c93299e89ebb7b4.jpeg,2025-09-01T12:00:00Z,,"KI-generierte Illustration.
Schönreden statt Kurswechsel: Hinter der Arbeitsmarkt-Misere steckt eine jahrelange Produktivitätskrise. Droht Deutschland der Absturz? Gastbeitrag.
Allen wirtschaftlich… [+14264 chars]",,de,'Gas'
https://www.telepolis.de/features/Jobwunder-ade-Deutschlands-Arbeitsmarkt-am-Wendepunkt-10627678.html,https://www.telepolis.de/features/Jobwunder-ade-Deutschlands-Arbeitsmarkt-am-Wendepunkt-10627678.html,0,www.telepolis.de,Jobwunder ade: Deutschlands Arbeitsmarkt am Wendepunkt,"Drei Millionen Arbeitslose, Berlin redet schön. Hinter der Fassade steckt jahrelange Investitionsmüdigkeit – und ein gefährlicher Kurs. Kippt jetzt der Arbeitsmarkt? Gastbeitrag.",https://heise.cloudimg.io/bound/1200x1200/q85.png-lossy-85.webp-lossy-85.foil1/_www-heise-de_/imgs/18/4/9/2/8/2/8/4/Master_Horn-7c93299e89ebb7b4.jpeg,2025-09-01T12:00:00Z,,"KI-generierte Illustration.
Drei Millionen Arbeitslose, Berlin redet schön. Hinter der Fassade steckt jahrelange Investitionsmüdigkeit und ein gefährlicher Kurs. Kippt jetzt der Arbeitsmarkt? Gastbe… [+14292 chars]",,de,'Gas'
https://orf.at/stories/3404177/,https://orf.at/stories/3404177/,0,orf.at,Gipfeltreffen: Xi und Putin werben für neue Weltordnung,,https://orf.at/mojo/1_4_1/storyserver//news/common/images/og-fallback-news.png,2025-09-01T12:08:41Z,https://web.archive.org/web/20250901122904/https://orf.at/stories/3404177/,"Chinas Präsident Xi Jinping und der russische Staatschef Wladimir Putin haben auf einem Gipfel heute ihre Vision einer neuen globalen Sicherheits- und Wirtschaftsordnung vorangetrieben, die den Globa… [+1162 chars]",,de,'Putin'
https://www.zeit.de/wirtschaft/2025-08/wirtschaftspodcast-inflation-usa-donald-trump-zoelle,https://www.zeit.de/wirtschaft/2025-08/wirtschaftspodcast-inflation-usa-donald-trump-zoelle,0,www.zeit.de,"Wirtschaftspodcast ""Ist das eine Blase?"": Scheitert Trump an der Inflation?","Das Leben in den USA wird wieder teurer, der tägliche Einkauf schmerzt viele Menschen. Wie sehr ist US-Präsident Donald Trump mit seiner Politik dafür verantwortlich?",https://img.zeit.de/wirtschaft/2025-08/wirtschaftspodcast-inflation-usa-donald-trump-zoelle-1/wide__1300x731,2025-09-01T12:12:33Z,,"US-Präsident Donald Trump während einer Kabinettssitzung im Weißen Haus© Mark Schiefelbein/dpa
Die US-Amerikaner hatten sich eigentlich darauf eingestellt, dass ihr Leben einigermaßen bezahlbar blei… [+1775 chars]",,de,'Inflation'
https://www.welt.de/videos/video68b58c09cf33b514cb80e198/welt-spezial-sie-fluechten-nicht-vor-dem-regime-sie-fluechten-vor-armut-streit-um-neuen-afghanen-flieger.html,https://www.welt.de/videos/video68b58c09cf33b514cb80e198/welt-spezial-sie-fluechten-nicht-vor-dem-regime-sie-fluechten-vor-armut-streit-um-neuen-afghanen-flieger.html,0,www.welt.de,"„Sie flüchten nicht vor dem Regime, sie flüchten vor Armut“ – Streit um neuen Afghanen-Flieger","Ein weiterer Flug mit Afghanen aus Pakistan landet in Hannover. Aber erneut sind die meisten Passagiere keine Ortskräfte, die etwa für die Bundeswehr am Hindukusch tätig waren, sondern Angehörige. Sehen Sie ein WELT Spezial.",https://images.welt.de/68b58c09cf33b514cb80e198/f38d80ad5d0e6678d7540bc5964a6b8e-master/ci16x9-w1200/symbolbild-abschiebung,2025-09-01T12:22:35Z,,"Ein weiterer Flug mit Afghanen aus Pakistan landet in Hannover. Aber erneut sind die meisten Passagiere keine Ortskräfte, die etwa für die Bundeswehr am Hindukusch tätig waren, sondern Angehörige. Se… [+84 chars]",,de,'Armut'
https://www.stern.de/news/putin-nutzt-soz-gipfel-in-china-fuer-zahlreiche-bilaterale-gespraeche-36017278.html,https://www.stern.de/news/putin-nutzt-soz-gipfel-in-china-fuer-zahlreiche-bilaterale-gespraeche-36017278.html,0,www.stern.de,Putin nutzt SOZ-Gipfel in China für zahlreiche bilaterale Gespräche,Roter Teppich für Wladimir Putin: Russlands vom Westen weitgehend isolierter Präsident hat eine von Chinas Staatschef Xi Jinping bereitete Bühne für zahlreiche Gespräche genutzt. Am Rande des Gipfeltreffens der Shanghaier Organisation für Zusammenarbeit (SOZ)…,https://image.stern.de/36019076/t/ie/v1/w1440/r1.7778/-/01--wladimir-putin-und-xi-jinping-in-tianjin---92d9ae3469b3e97b.jpg,2025-09-01T12:49:41Z,https://web.archive.org/web/20250901183759/https://www.stern.de/news/putin-nutzt-soz-gipfel-in-china-fuer-zahlreiche-bilaterale-gespraeche-36017278.html,"Kopiere den aktuellen Link
Zur Merkliste hinzufügen
Roter Teppich für Wladimir Putin: Russlands vom Westen weitgehend isolierter Präsident hat eine von Chinas Staatschef Xi Jinping bereitete Bühne … [+4268 chars]",,de,'Russland'
https://www.focus.de/politik/ausland/russland-insider-packt-aus-darum-ist-putin-trump-und-europa-aktuell-ueberlegen_241a047b-e41d-44bb-a87b-1ff18aa16d6b.html,https://www.focus.de/politik/ausland/russland-insider-packt-aus-darum-ist-putin-trump-und-europa-aktuell-ueberlegen_241a047b-e41d-44bb-a87b-1ff18aa16d6b.html,0,www.focus.de,Russland-Insider packt aus - darum ist Putin Trump und Europa aktuell überlegen,"Der russische Ex-Diplomat Bondarew glaubt, dass Verhandlungen, Sanktionen und Angriffe Russland wenig beeindrucken. Putin ist in ""vielem klüger"".",https://quadro.burda-forward.de/ctf/576658b0-5fc8-4c6c-bdb1-79aeb031b219.ca45d20c-a6bb-4d56-a19a-e331a4e5d0b2.png?im=RegionOfInterestCrop%3D%281200%2C630%29%2CregionOfInterest%3D%281325%2C608%29&hash=861285c4f918727c09044dd6fb151b357cc3ff9f4de181f9883e39ba3d31b278,2025-09-01T12:50:12Z,,"Der ins Exil geflüchtete russische Ex-Diplomat Boris Bondarew warnt davor, Wladimir Putin weiterhin zu unterschätzen - gerade intellektuell. US-Präsident Donald Trump und den europäischen Ländern war… [+2953 chars]",,de,'Putin'
https://www.diepresse.com/20049750/neue-plaene-mit-eingefrorenem-russischem-vermoegen,https://www.diepresse.com/20049750/neue-plaene-mit-eingefrorenem-russischem-vermoegen,0,www.diepresse.com,Neue Pläne mit eingefrorenem russischem Vermögen [premium],Die meisten EU-Staaten – allen voran Frankreich und Deutschland – wollen die wirtschaftlichen Sanktionen gegen Moskau ausweiten. Doch Putin versucht dies erneut zu unterwandern.,https://img.diepresse.com/public/incoming/o45t7i-EU-FOREIGN/alternates/DPR_SOCIAL_NACHRICHTEN/EU-FOREIGN,2025-09-01T12:54:36Z,,"Angesichts der anhaltenden Angriffe gegen ukrainische Zivilisten und den bisher gescheiterten Friedensbemühungen drängen einige EU-Staaten, allen voran Frankreich, Deutschland und die baltischen Staa… [+3522 chars]",,de,'Putin'
https://www.stern.de/politik/ausland/ueberraschende-reise--koalitionsspitzen-gemeinsam-zu-solidaritaetsbesuch-in-kiew-36017374.html,https://www.stern.de/politik/ausland/ueberraschende-reise--koalitionsspitzen-gemeinsam-zu-solidaritaetsbesuch-in-kiew-36017374.html,0,www.stern.de,Überraschende Reise: Koalitionsspitzen gemeinsam zu Solidaritätsbesuch in Kiew,So eine Reise deutscher Spitzenpolitiker nach Kiew gab es noch nie: Die Chefs der Regierungsfraktionen demonstrieren gemeinsam Solidarität mit der Ukraine. Der Besuch hat aber noch einen Nebeneffekt.,https://image.stern.de/36019080/t/cC/v1/w1440/r1.7778/-/01--g2ehdeaq67v7axs2048jpeg---a4906cf20f5f2a58.jpg,2025-09-01T12:58:39Z,,"Kopiere den aktuellen Link
Zur Merkliste hinzufügen
So eine Reise deutscher Spitzenpolitiker nach Kiew gab es noch nie: Die Chefs der Regierungsfraktionen demonstrieren gemeinsam Solidarität mit de… [+6188 chars]",,de,'Ukraine'
https://www.stern.de/news/bundeswehr-sieht--aggressives-verhalten--russlands-in-ostsee---marineuebung-gestartet-36019168.html,https://www.stern.de/news/bundeswehr-sieht--aggressives-verhalten--russlands-in-ostsee---marineuebung-gestartet-36019168.html,0,www.stern.de,"Bundeswehr sieht ""aggressives Verhalten"" Russlands in Ostsee - Marineübung gestartet","Die Bundeswehr warnt vor zunehmend bedrohlicheren militärischen Aktionen Russlands in der Ostsee. Bundeswehr-Generalinspekteur Carsten Breuer sprach am Montag in Berlin von einem ""aggressiven Verhalten Russlands"", mit dem Gebietsansprüche untermauert werden s…",https://image.stern.de/36019170/t/I2/v1/w1440/r1.7778/-/01--carsten-breuer---0f950b5281467d79.jpg,2025-09-01T13:12:01Z,,"Kopiere den aktuellen Link
Zur Merkliste hinzufügen
Die Bundeswehr warnt vor zunehmend bedrohlicheren militärischen Aktionen Russlands in der Ostsee. Bundeswehr-Generalinspekteur Carsten Breuer spr… [+1947 chars]",,de,'Putin'
https://www.welt.de/politik/ausland/article68b55c1acf33b514cb80dd59/wadephul-in-indien-tow-online-haken-warum-sich-europa-nicht-an-trumps-strafzoellen-beteiligt.html,https://www.welt.de/politik/ausland/article68b55c1acf33b514cb80dd59/wadephul-in-indien-tow-online-haken-warum-sich-europa-nicht-an-trumps-strafzoellen-beteiligt.html,0,www.welt.de,Warum sich Europa nicht an Trumps Strafzöllen beteiligt,Billiges russisches Öl lässt die indische Wirtschaft florieren – und die Einnahmen füllen Putins Kriegskasse. US-Präsident Trump ordnete Strafzölle an. Außenminister Johann Wadephul verfolgt bei seinem Besuch in Indien aber eigene Pläne.,https://images.welt.de/68b55c1acf33b514cb80dd59/fcab0df7c22c922957bdea57dd6b7e55/ci16x9-w1200/shanghai-cooperation-organization-sco-summit-2025-in-tianjin,2025-09-01T13:26:15Z,,Billiges russisches Öl lässt die indische Wirtschaft florieren und die Einnahmen füllen Putins Kriegskasse. US-Präsident Trump ordnete Strafzölle an. Außenminister Johann Wadephul verfolgt bei seinem… [+5952 chars],,de,'Krieg'
