index,url,valid,domain,title,description,image,published,archive,content,quote,language,keyword
https://www.tagesspiegel.de/internationales/die-lage-im-uberblick-berichte-laut-cia-kein-angriff-kiews-auf-putins-residenz-15092604.html,https://www.tagesspiegel.de/internationales/die-lage-im-uberblick-berichte-laut-cia-kein-angriff-kiews-auf-putins-residenz-15092604.html,0,www.tagesspiegel.de,Die Lage im Überblick: Berichte: Laut CIA kein Angriff Kiews auf Putins Residenz,Nach Anschuldigungen Moskaus werden Erkenntnisse der US-Geheimdienste zum angeblichen Angriff der Ukraine auf Putins Residenz öffentlich. An den Fronten wird auch zum Jahreswechsel weiter gekämpft.,https://www.tagesspiegel.de/images/15092631/alternates/BASE_16_9_W1400/1767242558000/ukraine-krieg-drohne.jpeg,2026-01-01T02:13:54Z,,"Der US-Geheimdienst CIA hat Medienberichten zufolge die Erkenntnis erlangt, dass die Ukraine weder den russischen Präsidenten Wladimir Putin ins Visier genommen noch eine seiner Residenzen angegriffe… [+6019 chars]",,de,'Kämpfe'
https://www.zeit.de/news/2026-01/01/deutsche-firmen-wollen-trotz-sanktionen-in-russland-bleiben,https://www.zeit.de/news/2026-01/01/deutsche-firmen-wollen-trotz-sanktionen-in-russland-bleiben,0,www.zeit.de,Geschäftsklima in Russland: Deutsche Firmen wollen trotz Sanktionen in Russland bleiben,Hier finden Sie Informationen zu dem Thema „Geschäftsklima in Russland“. Lesen Sie jetzt „Deutsche Firmen wollen trotz Sanktionen in Russland bleiben“.,https://img.zeit.de/news/2026-01/01/deutsche-firmen-wollen-trotz-sanktionen-in-russland-bleiben-image-group/wide__1300x731,2026-01-01T03:30:04Z,,Hunderte deutsche Firmen wollen laut einer Umfrage ungeachtet der immer schärferen Sanktionen des Westens im Zuge des Moskauer Angriffskrieges weiter in Russland Geschäfte machen. «Nur vier Prozent d… [+2780 chars],,de,'Russland'
https://www.stern.de/gesellschaft/regional/niedersachsen-bremen/harz--brockenumbau-startet-2026---millionen-fuer-neuen-tourismus-37002678.html,https://www.stern.de/gesellschaft/regional/niedersachsen-bremen/harz--brockenumbau-startet-2026---millionen-fuer-neuen-tourismus-37002678.html,0,www.stern.de,Harz: Brockenumbau startet 2026 – Millionen für neuen Tourismus,"Ab 2026 beginnt auf dem Brocken eine umfassende Erneuerung. Neue Gastronomie, Veranstaltungsräume und Investitionen sollen den Tourismus im Harz stärken.",https://image.stern.de/37002680/t/AV/v1/w1440/r1.7778/-/01--zipmr4tbwgv3axs2048jpeg---6110e5dd3d6836b5.jpg,2026-01-01T03:30:05Z,,"Kopiere den aktuellen Link
Zur Merkliste hinzufügen
Ab 2026 beginnt auf dem Brocken eine umfassende Erneuerung. Neue Gastronomie, Veranstaltungsräume und Investitionen sollen den Tourismus im Harz … [+4466 chars]",,de,'Gas'
https://www.nzz.ch/wirtschaft/the-duc-ngo-ist-berlins-bekanntester-gastronom-und-sagt-man-verdient-heute-nicht-automatisch-mehr-geld-wenn-man-mehr-restaurants-eroeffnet-ld.1914788,https://www.nzz.ch/wirtschaft/the-duc-ngo-ist-berlins-bekanntester-gastronom-und-sagt-man-verdient-heute-nicht-automatisch-mehr-geld-wenn-man-mehr-restaurants-eroeffnet-ld.1914788,0,www.nzz.ch,"The Duc Ngo ist Berlins bekanntester Gastronom und sagt: «Man verdient heute nicht automatisch mehr Geld, wenn man mehr Restaurants eröffnet»","Seine Restaurants sind brechend voll, seine Mischung aus asiatischen und europäischen Techniken hat die Esskultur der Hauptstadt geprägt. Doch nun merkt auch The Duc Ngo: Die Zeiten werden härter.","https://img.nzz.ch/2025/12/04/c5a58916-4348-4688-81fd-2852ed1702eb.jpg?width=1200&height=675&fit=bounds&quality=75&auto=webp&crop=2000,1125,x0,y99&wmark=nzz",2026-01-01T04:30:00Z,,"Seine Restaurants sind brechend voll, seine Mischung aus asiatischen und europäischen Techniken hat die Esskultur der Hauptstadt geprägt. Doch nun merkt auch The Duc Ngo: Die Zeiten werden härter.
«… [+8375 chars]",,de,'Hohe Kosten'
https://science.orf.at/stories/3233595/,https://science.orf.at/stories/3233595/,0,science.orf.at,Hohe Therapiekosten als Zugangsproblem,"Die sogenannten Abnehmspritzen helfen vielen Patientinnen und Patienten dabei, Gewicht zu reduzieren. Doch die hohen Kosten und die Aussicht auf langfristige Therapie verunmöglichen zahlreichen Betroffenen den Zugang dazu. Doch Studien zeigen: Die Therapien k…",https://ibs.orf.at/science?image=https%3A%2F%2Ftubestatic.orf.at%2Fmims%2F2025%2F04%2F70%2Fcrops%2Fw%3D1200%2Ch%3D627%2Cq%3D75%2F2491846_master_953970_france_-_health_-_tiktok_-_ozempic_.jpg%3Fs%3Db92cff95b1cc480a01fce68230dc2520f902a1f9,2026-01-02T07:27:48Z,,"Für die Pharmaunternehmen, die die sogenannten Abnehmspritzen herstellen, war 2025 ein einträgliches Geschäftsjahr. Dennoch ist es in Ländern wie Österreich nach wie vor so, dass viele von Adipositas… [+5070 chars]",,de,'Hohe Kosten'
https://www.faz.net/aktuell/wirtschaft/unternehmen/ukraine-krieg-lufthansa-hofft-auf-rueckkehr-von-russland-ueberfluegen-accg-200403024.html,https://www.faz.net/aktuell/wirtschaft/unternehmen/ukraine-krieg-lufthansa-hofft-auf-rueckkehr-von-russland-ueberfluegen-accg-200403024.html,0,www.faz.net,Konzernchef Spohr: Lufthansa hofft auf Rückkehr der Russland-Überflüge 2026,Lufthansa hofft auf Rückkehr der Russland-Überflüge 2026,https://media0.faz.net/image/w1200h627/0b485bea139a/w2254h1177x344y45o/202510/43601.0.1414489463/bald-wieder-direkter-nach.webp,2026-01-02T12:09:13Z,,"Schneller und direkter ostwärts fliegen, diese Hoffnung hat Carsten Spohr, der Vorstandsvorsitzende der Deutschen Lufthansa für 2026. Seit Russlands Angriff auf die Ukraine im Jahr 2022 verhindern Sa… [+2970 chars]",,de,'Russland'
https://www.tagesspiegel.de/potsdam/brandenburg/kriminalitat-im-netz-cyberattacken-gegen-vier-brandenburger-kommunen-15096841.html,https://www.tagesspiegel.de/potsdam/brandenburg/kriminalitat-im-netz-cyberattacken-gegen-vier-brandenburger-kommunen-15096841.html,0,www.tagesspiegel.de,Aktuell vier Brandenburger Kommunen betroffen: Gefahr von Cyberangriffen auf Städte und Gemeinden nimmt laut Digitalminister zu,Angriffe auf das Computernetz von Städten oder Gemeinden können Angebote für Bürger für längere Zeit lahmlegen. Brandenburgs Digitalminister Grimm schätzt die Bedrohungslage ein.,https://www.tagesspiegel.de/images/15096840/alternates/BASE_16_9_W1400/1767363117000/cyberattacken-konnen-erheblichen-schaden-anrichten.jpeg,2026-01-02T14:11:57Z,,Die Gefahr von Cyberangriffen auf Kommunen nimmt in Brandenburg nach Ansicht von Digitalminister Benjamin Grimm (SPD) zu. Vier Kommunen seien derzeit von Cyberangriffen betroffen: Hoppegarten (Landkr… [+1717 chars],,de,'Bedrohung'
https://www.morgenpost.de/politik/article410695966/arbeiter-laufen-nach-rechts-so-gross-ist-die-gefahr-fuer-gewerkschaften.html,https://www.morgenpost.de/politik/article410695966/arbeiter-laufen-nach-rechts-so-gross-ist-die-gefahr-fuer-gewerkschaften.html,0,www.morgenpost.de,Arbeiter laufen nach rechts: So groß ist die Gefahr für Gewerkschaften,Angst vor Arbeitsplatzverlust treibt Beschäftigte in die Hände von Radikalen. Vor den Betriebsratswahlen wächst Sorge vor Unterwanderung.,https://img.sparknews.funkemedien.de/410826952/410826952_1767369852_v16_9_1600.jpeg,2026-01-02T16:04:14Z,,"Es gibt eine Statistik, die derzeit in den großen deutschen Gewerkschaften für Unruhe sorgt. 38 Prozent der Menschen, die bei der Bundestagswahl im Februar AfD gewählt haben, bezeichnen sich selbst a… [+9748 chars]",,de,'Bedrohung'
https://www.jungewelt.de/artikel/514956.maduro-über-usa-sie-wollen-sich-das-gesamte-öl-aneignen.html,https://www.jungewelt.de/artikel/514956.maduro-über-usa-sie-wollen-sich-das-gesamte-öl-aneignen.html,0,www.jungewelt.de,Maduro über USA: Sie wollen sich das gesamte Öl aneignen,"Am 31.12. führte der Journalist Ignacio Ramonet ein Interview mit dem Präsidenten Venezuelas, Nicolás Maduro, das der Sender Telesur ausstrahlte. Ein Auszug zur militärischen Bedrohung Venezuelas durch die USA.",https://www.jungewelt.de/img/1100/217411.jpg,2026-01-02T18:38:01Z,,"Am 31.12. führte der Journalist Ignacio Ramonet ein Interview mit dem Präsidenten Venezuelas, Nicolás Maduro, das der Sender Telesur ausstrahlte. An dieser Stelle ein kleiner Auszug zur militärischen… [+2987 chars]",,de,'Bedrohung'
https://www.faz.net/aktuell/wirtschaft/unternehmen/co-preis-schweigt-bald-der-schmiedehammer-110810403.html,https://www.faz.net/aktuell/wirtschaft/unternehmen/co-preis-schweigt-bald-der-schmiedehammer-110810403.html,0,www.faz.net,Hohe CO2-Kosten: Bald könnte der Schmiedehammer schweigen,Der CO₂-Preis bringt Traditionsunternehmen ins Straucheln. Die Chefs zweier Schmieden im industriellen Herz Nordrhein-Westfalens berichten.,https://media0.faz.net/image/w1200h627/11d8ea4e72fd/w4724h2468x0y447o/202510/43601.0.1361444076/bei-1200-grad-celsius.webp,2026-01-02T20:19:32Z,,"Im Konferenzraum des Unternehmens Dirostahl in Remscheid vibriert der lange Besprechungstisch. Trotz der geschlossenen Fenster dringt ein rhythmisches Hämmern in das Zimmer, es klingt ein wenig, als … [+6842 chars]",,de,'Hohe Kosten'
https://www.sueddeutsche.de/politik/ukraine-krieg-newsblog-selenskij-verteidigungsminister-neu-li.3353907,https://www.sueddeutsche.de/politik/ukraine-krieg-newsblog-selenskij-verteidigungsminister-neu-li.3353907,0,www.sueddeutsche.de,Krieg in der Ukraine: Selenskij will erneut Verteidigungsminister auswechseln,"Der Präsident, der jüngst wegen mehrerer Korruptionsskandale in seiner Regierung unter Druck stand, kündigt eine Welle von Veränderungen an. Der bisherige Verteidigungsminister Denys Schmyhal hatte das Amt erst im Sommer übernommen.",https://www.sueddeutsche.de/2026/01/02/724356bf-88c2-47bf-a556-0839f88233b7.jpg?q=60&fm=webp&width=1200&rect=0%2C209%2C4000%2C2250,2026-01-02T20:59:00Z,,Im Streit um den angeblichen Angriff Kiews auf eine Residenz von Wladimir Putin präsentiert die russische Regierung erstmals mögliche Beweise. In einem vom Verteidigungsministerium veröffentlichten V… [+2431 chars],,de,'Krieg'
https://www.faz.net/aktuell/politik/ukraine/ukraine-liveticker-selenskyj-kuendigt-austausch-des-verteidigungsministers-an-faz-110683325.html,https://www.faz.net/aktuell/politik/ukraine/ukraine-liveticker-selenskyj-kuendigt-austausch-des-verteidigungsministers-an-faz-110683325.html,0,www.faz.net,Krieg in der Ukraine: Selenskyj kündigt Austausch des Verteidigungsministers an,Bisheriger Verteidigungsministers hatte erst im Sommer übernommen +++ Budanow neuer ukrainischer Präsidialamtschef +++ Schwierige Sicherheitslage: Tausende Kinder sollen ukrainische Orte an der Front verlassen +++ alle Neuigkeiten im Liveblog,https://media0.faz.net/image/w1200h627/0c8539789d87/w3000h1567x0y216o/202601/43601.0.1629796171/mychajlo-fedorow-minister-fuer.webp,2026-01-02T21:00:53Z,,"Mit einer ungewöhnlichen Übergabezeremonie sind am Donnerstagabend Russlands Bemühungen, den amerikanischen Präsidenten Donald Trump für eine härtere Gangart gegenüber der Ukraine zu gewinnen, in ein… [+3246 chars]",,de,'Putin'
https://www.welt.de/politik/deutschland/article69562dde24b6e14cd2235527/aufruestung-in-deutschland-wie-die-csu-russland-mit-technischer-dominanz-abschrecken-will.html,https://www.welt.de/politik/deutschland/article69562dde24b6e14cd2235527/aufruestung-in-deutschland-wie-die-csu-russland-mit-technischer-dominanz-abschrecken-will.html,0,www.welt.de,Wie die CSU Russland mit „technischer Dominanz“ abschrecken will,"Deutschlands Schutz gegen Russland im Fokus: Die CSU-Landesgruppe im Bundestag plant eine weitreichende sicherheitspolitische Agenda. Als ein zentrales Ziel wird ein Arsenal an „Präzisionswaffen“ ausgegeben, „die den Gegner bis tief ins Hinterland treffen kön…",https://images.welt.de/69562dde24b6e14cd2235527/52056d4a4b22621a9a88018e7fecf658-master/ci16x9-w1200/552734330-jpg,2026-01-02T23:38:19Z,,Deutschlands Schutz gegen Russland im Fokus: Die CSU-Landesgruppe im Bundestag plant eine weitreichende sicherheitspolitische Agenda. Als ein zentrales Ziel wird ein Arsenal an Präzisionswaffen ausge… [+4765 chars],,de,'Russland'
https://www.welt.de/politik/deutschland/article69562dde24b6e14cd2235527/aufruestung-in-deutschland-csu-bundestagsgruppe-will-bundeswehr-zur-staerksten-konventionellen-armee-europas-machen.html,https://www.welt.de/politik/deutschland/article69562dde24b6e14cd2235527/aufruestung-in-deutschland-csu-bundestagsgruppe-will-bundeswehr-zur-staerksten-konventionellen-armee-europas-machen.html,0,www.welt.de,CSU-Bundestagsgruppe will Bundeswehr zur „stärksten konventionellen Armee Europas“ machen,"Deutschlands Schutz gegen Russland im Fokus: Die CSU-Landesgruppe im Bundestag plant eine weitreichende sicherheitspolitische Agenda. Als ein zentrales Ziel wird ein Arsenal an „Präzisionswaffen“ ausgegeben, „die den Gegner bis tief ins Hinterland treffen kön…",https://images.welt.de/69562dde24b6e14cd2235527/52056d4a4b22621a9a88018e7fecf658-master/ci16x9-w1200/552734330-jpg,2026-01-02T23:38:19Z,,Deutschlands Schutz gegen Russland im Fokus: Die CSU-Landesgruppe im Bundestag plant eine weitreichende sicherheitspolitische Agenda. Als ein zentrales Ziel wird ein Arsenal an Präzisionswaffen ausge… [+4765 chars],,de,'Russland'
https://www.freitag.de/autoren/the-guardian/polen-schild-und-schwert-des-westlichen-vorpostens-im-osten,https://www.freitag.de/autoren/the-guardian/polen-schild-und-schwert-des-westlichen-vorpostens-im-osten,0,www.freitag.de,Westlicher Vorposten im Osten: Polen bereitet sich auf den Ernstfall vor,"Schützengräben ausheben, Grenzmauern bauen, Überlebenstraining absolvieren, Migration verhindern. Das Land schottet sich gegen Russland ab wie noch nie seit Ende das Kalten Krieges, auch wenn viele das für übertrieben halten Cezary Pruszko erinnert sich noch …",https://www.freitag.de/autoren/the-guardian/polen-schild-und-schwert-des-westlichen-vorpostens-im-osten/@@images/image/great,2026-01-03T06:00:00Z,,"Cezary Pruszko erinnert sich noch an die Zivilschutz-Ausbildung während seiner Schulzeit in der kommunistischen Ära – Karten lesen, Überlebenstraining und das Gefühl, dass ein Krieg real und immer pr… [+6842 chars]",,de,'Russland'
https://www.faz.net/aktuell/feuilleton/debatten/spionage-app-so-unterdrueckt-russland-seine-studenten-accg-110812519.html,https://www.faz.net/aktuell/feuilleton/debatten/spionage-app-so-unterdrueckt-russland-seine-studenten-accg-110812519.html,0,www.faz.net,Russische Hochschulen: Schwach und gehorsam sollen die Studenten sein,"Russlands Universitäten werden zusehends zu Helfershelfern Putins. Studenten müssen Spionage-Apps installieren, Tarnnetze nähen und unter Aufsicht wählen. Ein Blick in ein System, das den freien Geist austreiben will.",https://media0.faz.net/image/w1200h627/084b39e0ff75/w6922h3616x0y139o/202511/43601.0.1516236767/die-strassenmusikerin-naoko.webp,2026-01-03T08:21:18Z,,"Universitäten gelten seit je als wichtige Orte der Freiheit und Studenten als Motoren des Wandels. Das ist auch in Russland so, allerdings mit gewissen Nuancen. Schon Ende des 19. Jahrhunderts merkte… [+532 chars]",,de,'Russland'
https://www.welt.de/politik/ausland/article6958e5e8666ac1993e7cc0db/maduro-festgesetzt-dieser-krieg-ist-illegal-das-sind-die-ersten-reaktionen.html,https://www.welt.de/politik/ausland/article6958e5e8666ac1993e7cc0db/maduro-festgesetzt-dieser-krieg-ist-illegal-das-sind-die-ersten-reaktionen.html,0,www.welt.de,„Dieser Krieg ist illegal“ – Das sind die ersten Reaktionen,In der Nacht zum Samstag haben die USA Ziele in Venezuela angegriffen. Präsident Maduro und seine Ehefrau wurden außer Landes gebracht. Das sind die Reaktionen im Überblick.,https://images.welt.de/6958e5e8666ac1993e7cc0db/99da0641c837e83d6fec5f5080177c3b/ci16x9-w1200/apdpa-32b846000236bd99-jpg,2026-01-03T09:55:23Z,,"Nach dem Angriff der USA auf Venezuela haben mehrere US-Parlamentarier Zweifel an der Rechtmäßigkeit des Vorgehens geäußert. Der demokratische Senator von Arizona, Ruben Gallego, schrieb im Kurznachr… [+6107 chars]",,de,'Putin'
https://www.welt.de/politik/ausland/article6958e5e8666ac1993e7cc0db/venezuela-dieser-krieg-ist-illegal-reaktionen-auf-den-angriff-der-usa.html,https://www.welt.de/politik/ausland/article6958e5e8666ac1993e7cc0db/venezuela-dieser-krieg-ist-illegal-reaktionen-auf-den-angriff-der-usa.html,0,www.welt.de,„Dieser Krieg ist illegal“ – Reaktionen auf den Angriff der USA,In der Nacht zum Samstag haben die USA Ziele in Venezuela angegriffen. Präsident Maduro und seine Ehefrau wurden außer Landes gebracht. Das sind die Reaktionen im Überblick.,https://images.welt.de/6958e5e8666ac1993e7cc0db/9a0793629c17e59e09e67d4da1d21b74/ci16x9-w1200/dpa-com-20090101-260103-935-1054123-jpg,2026-01-03T09:55:23Z,,"Nach dem Angriff der USA auf Venezuela haben mehrere US-Parlamentarier Zweifel an der Rechtmäßigkeit des Vorgehens geäußert. Der demokratische Senator von Arizona, Ruben Gallego, schrieb im Kurznachr… [+12704 chars]",,de,'Krieg'
https://www.zeit.de/politik/ausland/2026-01/venezuela-usa-angriff-reaktionen-russland-iran-eu,https://www.zeit.de/politik/ausland/2026-01/venezuela-usa-angriff-reaktionen-russland-iran-eu,0,www.zeit.de,US-Angriff auf Venezuela: Russland verurteilt US-Militäreinsatz in Venezuela,"Russland wertet den US-Angriff als ""Akt bewaffneter Aggression"", der Iran sieht darin eine ""eklatante Verletzung"" nationaler Souveränität. In Berlin tagt der Krisenstab.",https://img.zeit.de/administratives/sharing/fallback-image-die-zeit/wide__1300x731,2026-01-03T11:42:44Z,,"Russland hat den US-Militärangriff in Venezuela und die Festnahme von Präsident Nicolás Maduro als ""Akt bewaffneter Aggression"" verurteilt. Das Vorgehen sei ""zutiefst beunruhigend und verwerflich"", t… [+2188 chars]",,de,'Russland'
https://taz.de/Russische-Propaganda-in-der-Geschichte/!6142151/,https://taz.de/Russische-Propaganda-in-der-Geschichte/!6142151/,0,taz.de,Russische Propaganda in der Geschichte: Die Politik des Nazi-Vorwurfs ist keine Erfindung Putins,"Immer wieder behauptet Wladimir Putin, in der Ukraine seien Nazis an der Macht. Eine Historikerkonferenz in Lwiw zeigt, dass es solche Narrative schon seit Jahrzehnten gibt.",https://taz.de/picture/8160050/1200/40027203.jpeg,2026-01-03T15:40:00Z,,"Immer wieder behauptet Wladimir Putin, in der Ukraine seien Nazis an der Macht. Eine Historikerkonferenz in Lwiw zeigt, dass es solche Narrative schon seit Jahrzehnten gibt. mehr...",,de,'Ukraine'
https://www.n-tv.de/politik/Der-Angriff-der-USA-auf-Venezuela-stuerzt-Europa-in-Probleme-id30200041.html,https://www.n-tv.de/politik/Der-Angriff-der-USA-auf-Venezuela-stuerzt-Europa-in-Probleme-id30200041.html,0,www.n-tv.de,Ermutigt Trump Putin?: Der Angriff der USA auf Venezuela stürzt Europa in Probleme,Die Militärintervention der USA in Venezuela befeuert das Misstrauen der europäischen Regierungen über die wahren Motive der USA in ihren Verhandlungen mit Russland. Wie Putin setzt Trump auf eine Politik des Rechts des Stärkeren.,https://www.n-tv.de/img/30200054/1767460856/Img_16_9/1200/Venezuelans-celebrate-after-President-Donald-Trump-announced-that-Venezuelan-President-Nicolas-Maduro-had-been-captured-and-flown-out-of-the-country-in-Lima-Peru-Saturday-Jan-3-2026.jpg,2026-01-03T18:03:46Z,,"Ermutigt Trump Putin?Der Angriff der USA auf Venezuela stürzt Europa in Probleme
Die Militärintervention der USA in Venezuela befeuert das Misstrauen der europäischen Regierungen über die wahren Mot… [+5184 chars]",,de,'Putin'
https://www.freitag.de/autoren/the-guardian/trumps-angriff-auf-venezuela-so-illegal-wie-putins-angriff-auf-ukraine,https://www.freitag.de/autoren/the-guardian/trumps-angriff-auf-venezuela-so-illegal-wie-putins-angriff-auf-ukraine,0,www.freitag.de,Völkerrecht: Trumps Angriff auf Venezuela so illegal wie Putins Angriff auf die Ukraine?,Donald Trump rechtfertigt den US-Angriff auf Venezuela und den Putsch gegen Nicolas Maduro mit einer Bedrohung durch den Drogenhandel. Was Völkerrechts-Experten dazu sagen Die USA haben am Samstagmorgen einen „groß angelegten Angriff“ auf Venezuela durchgefüh…,https://www.freitag.de/autoren/the-guardian/trumps-angriff-auf-venezuela-so-illegal-wie-putins-angriff-auf-ukraine/@@images/image/great,2026-01-03T18:15:00Z,,Die USA haben am Samstagmorgen einen „groß angelegten Angriff“ auf Venezuela durchgeführt und dessen Präsidenten Nicolás Maduro sowie dessen Ehefrau Cilia Flores festgenommen. Das Ehepaar wurde nun i… [+5676 chars],,de,'Bedrohung'
https://www.bild.de/politik/ausland-und-internationales/bild-analyse-zum-sturz-von-diktator-maduro-trumps-venezuela-krieg-veraendert-die-ganze-welt-69596b6efb77630dac276919,https://www.bild.de/politik/ausland-und-internationales/bild-analyse-zum-sturz-von-diktator-maduro-trumps-venezuela-krieg-veraendert-die-ganze-welt-69596b6efb77630dac276919,0,www.bild.de,BILD-Analyse zum Sturz von Maduro - Trumps Venezuela-Krieg verändert die ganze Welt,"Berlin – Sofort nach Bekanntwerden der US-Operation gegen Venezuelas Staatschef Maduro entbrannte die Debatte: War es richtig, einen brutalen Diktator ge...","https://images.bild.de/69596b6efb77630dac276919/7af4fbe3712f8415e7ab4a91eacebfe1,cf9633c2?w=1280",2026-01-03T20:37:59Z,,"Berlin Sofort nach Bekanntwerden der US-Operation gegen Venezuelas Staatschef Maduro entbrannte die Debatte: War es richtig, einen brutalen Diktator gefangen zu nehmen? Oder haben die Amerikaner das … [+3603 chars]",,de,'Krieg'
https://www.faz.net/aktuell/politik/venezuela-was-der-sturz-von-maduro-fuer-putin-und-russland-bedeutet-accg-110813288.html,https://www.faz.net/aktuell/politik/venezuela-was-der-sturz-von-maduro-fuer-putin-und-russland-bedeutet-accg-110813288.html,0,www.faz.net,„Caracas in drei Stunden“: Putin musste machtlos zusehen,Russland verliert mit Nicolás Maduro einen weiteren Verbündeten und wirkt ohnmächtig. Putin schweigt – aus mehreren Gründen.,https://media0.faz.net/image/w1200h627/a081441d1200/w7813h4082x0y222o/202601/43601.0.1630892565/putin-empfaengt-maduro-im-mai.webp,2026-01-04T08:39:12Z,,"Das amerikanische Vorgehen gegen Venezuela bringt Russland in eine unbequeme Lage: Schon wieder ist ein Verbündeter gestürzt worden, den man nicht schützen konnte. Der venezolanische Präsident Nicolá… [+5106 chars]",,de,'Putin'
https://www.zeit.de/politik/ausland/2026-01/medwedew-droht-merz-mit-entfuehrung,https://www.zeit.de/politik/ausland/2026-01/medwedew-droht-merz-mit-entfuehrung,0,www.zeit.de,Russland: Medwedew könnte sich Entführung von Bundeskanzler Merz vorstellen,Russlands Ex-Präsident Dimitri Medwedew hält eine Entführung von Friedrich Merz nach US-amerikanischem Vorbild für denkbar. Er droht so auch dem Präsidenten der Ukraine.,https://img.zeit.de/administratives/sharing/fallback-image-die-zeit/wide__1300x731,2026-01-04T16:46:02Z,,"Analog zu dem Vorgehen der USA in Venezuela kann sich Russlands Ex-Präsident Dmitri Medwedew ähnliche Entführungsaktionen gegen andere Staats- oder Regierungschefs vorstellen, unter ihnen Bundeskanzl… [+1235 chars]",,de,'Ukraine'
https://www.dw.com/de/wie-koennen-aermere-entwicklungslaender-ohne-fossile-energie-kohle-oel-und-gas-wachsen-alternativen/a-75267197,https://www.dw.com/de/wie-koennen-aermere-entwicklungslaender-ohne-fossile-energie-kohle-oel-und-gas-wachsen-alternativen/a-75267197,0,www.dw.com,"Können Entwicklungsländer ohne Kohle, Öl und Gas wachsen?","Industrienationen wurden mit Kohle, Öl und Gas reich. Nun sollen ärmere Staaten anders wachsen. Doch ist ein fossilfreier Entwicklungspfad realistisch, bezahlbar und wirtschaftlich sinnvoll?",https://static.dw.com/image/70870074_6.jpg,2026-01-05T11:57:00Z,,"Mosambik steht an einem Wendepunkt. Vor der Nordküste locken Offshore-Gasprojekte im Wert von mehreren Milliarden US-Dollar, die dem Staat neue Einnahmen in erheblichem Umfang einbringen könnten. Gle… [+7831 chars]",,de,'Hohe Kosten'
https://www.focus.de/finanzen/news/oel-duell-in-venezuela-plaene-trumps-koennen-putin-jetzt-milliarden-kosten_33ad80bf-37e7-49e8-bf33-f7d4ab3eebfe.html,https://www.focus.de/finanzen/news/oel-duell-in-venezuela-plaene-trumps-koennen-putin-jetzt-milliarden-kosten_33ad80bf-37e7-49e8-bf33-f7d4ab3eebfe.html,0,www.focus.de,Öl-Duell in Venezuela: Pläne Trumps können Putin jetzt Milliarden kosten,"Russlands Milliarden-Poker in Venezuela wackelt: Sollte Washington den Öl-Riesen öffnen, droht Putin ein Fiasko. Verliert Moskau jetzt ein wertvolles geopolitisches Pfandstück?",https://quadro.burda-forward.de/ctf/2c594ae2-0f71-4e27-936b-48d8c341e2fd.3eef2857-e421-4779-a3d6-c7002ad060b6.jpg?im=RegionOfInterestCrop%3D%281200%2C630%29%2CregionOfInterest%3D%281189%2C655%29&hash=d3ba2a589c75355d342a0f6b5c83cc1117a8787163299ef6ee354b7717733000,2026-01-05T16:45:24Z,,"Russland steckt in einem Energie-Dilemma, das größer ist als jede einzelne Pipeline, die ins Leere geht. Moskau braucht hohe Ölpreise, politische Verbündete und verlässliche Absatzmärkte und sieht si… [+6986 chars]",,de,'Russland'
https://www.zeit.de/news/2026-01/06/anschlag-auf-stromnetz-spekulationen-ueber-russland,https://www.zeit.de/news/2026-01/06/anschlag-auf-stromnetz-spekulationen-ueber-russland,0,www.zeit.de,Stromausfall nach Sabotage: Anschlag auf Stromnetz: Spekulationen über Russland,Hier finden Sie Informationen zu dem Thema „Stromausfall nach Sabotage“. Lesen Sie jetzt „Anschlag auf Stromnetz: Spekulationen über Russland“.,https://img.zeit.de/news/2026-01/06/anschlag-auf-stromnetz-spekulationen-ueber-russland-image-group/wide__1300x731,2026-01-06T13:58:17Z,,"Der Anschlag auf Stromkabel und der Beginn des tagelangen Stromausfalls in einem Teil Berlins war noch frisch, da begannen die Spekulationen über die Urheberschaft. Könnten doch Russland und einer se… [+4392 chars]",,de,'Russland'
