index,url,valid,domain,title,description,image,published,archive,content,quote,language,keyword
https://www.zeit.de/politik/ausland/2025-09/sco-gipfel-china-wladimir-putin-russland-ukraine,https://www.zeit.de/politik/ausland/2025-09/sco-gipfel-china-wladimir-putin-russland-ukraine,0,www.zeit.de,SCO-Gipfel in China: Donald Trumps Sanktionsdiplomatie ist gescheitert,"Der US-Präsident wollte China und Indien zwingen, Russland nicht mehr zu unterstützen. Er hat das Gegenteil erreicht. Woran Donald Trumps Strategie krankt.",https://img.zeit.de/politik/ausland/2025-09/gipfeltreffen-tianjin-china-usa-ukraine-krieg-5vor8-bild-1/wide__1300x731,2025-09-02T03:34:12Z,http://archive.md/20250902033712/https://www.zeit.de/politik/ausland/2025-09/sco-gipfel-china-wladimir-putin-russland-ukraine,"Schließen
Artikelzusammenfassung
SCO-Gipfel in China: Putin, Trump und die Sanktionen - eine Bilanz. Trotz Trumps Drohungen bleiben Russlands Partner standhaft. China nutzt die Situation geschickt … [+454 chars]",,de,'Russland'
https://www.zeit.de/politik/2025-09/wladimir-putin-donald-trump-wolodymyr-selenskyj-treffen-russland,https://www.zeit.de/politik/2025-09/wladimir-putin-donald-trump-wolodymyr-selenskyj-treffen-russland,0,www.zeit.de,Donald Trump: Russland widerspricht Plänen zu trilateralem Treffen,"Für ein Treffen zwischen Putin, Selenskyj und Trump gibt es laut der russischen Regierung keine konkreten Pläne. Der US-Präsident hatte ein solches in Aussicht gestellt.",https://img.zeit.de/politik/2025-09/moskau-widerspricht-trump-kein-dreiergipfel-mit-selenskyj-geplant-bild/wide__1300x731,2025-09-02T05:30:43Z,https://web.archive.org/web/20250902055304/https://www.zeit.de/politik/2025-09/wladimir-putin-donald-trump-wolodymyr-selenskyj-treffen-russland,"Russland hat Aussagen von US-Präsident Donald Trump zu einem Dreiertreffen mit dem ukrainischen Präsidenten Wolodymyr Selenskyj und dem russischen Staatschef Wladimir Putin widersprochen. ""Jetzt rede… [+1100 chars]",,de,'Putin'
https://www.faz.net/aktuell/wirtschaft/unternehmen/balanced-tickets-sozialtickets-und-co-fuer-20-euro-aufs-stadionkonzert-accg-110666056.html,https://www.faz.net/aktuell/wirtschaft/unternehmen/balanced-tickets-sozialtickets-und-co-fuer-20-euro-aufs-stadionkonzert-accg-110666056.html,0,www.faz.net,Hohe Ticketpreise: Für 20 Euro aufs Stadionkonzert,"Die Kosten für Konzerte sind enorm gestiegen und so auch die Ticketpreise. Das birgt die Gefahr, Fangruppen auszuschließen. Die Toten Hosen, AnnenMayKantereit und andere wollen mit neuen Modellen gegensteuern. Doch das ist gar nicht so einfach.",https://media1.faz.net/ppmedia/w1200/aktuell/feuilleton/1088088187/1.10666061/facebook_teaser/die-toten-hosen-im-juni-2022.jpg.webp,2025-09-02T07:14:47Z,http://archive.md/20250902075135/https://www.faz.net/aktuell/wirtschaft/unternehmen/balanced-tickets-sozialtickets-und-co-fuer-20-euro-aufs-stadionkonzert-accg-110666056.html,Die Ticketpreise müssen steigen. So viel war Catharina Schorling von vornerein klar als es mit den Planungen für ihre Tour losging. Touren war schon immer ein teures und aufwendiges Unterfangen. Doch… [+10766 chars],,de,'Hohe Kosten'
https://www.bild.de/leben-wissen/mein-recht-verbraucherportal/eltern-in-finanz-sorge-jede-vierte-familie-bangt-ums-noetigste-68b6815c8c33b226bcaefb0a,https://www.bild.de/leben-wissen/mein-recht-verbraucherportal/eltern-in-finanz-sorge-jede-vierte-familie-bangt-ums-noetigste-68b6815c8c33b226bcaefb0a,0,www.bild.de,Immer mehr Eltern in Finanz-Sorge - Jede vierte Familie bangt ums Nötigste,"Immer mehr Familien in Deutschland haben Angst, ihre Kinder nicht mehr ausreichend versorgen zu können.","https://images.bild.de/68b6815c8c33b226bcaefb0a/1b6359fd09d6230f5c3159d17a751e03,658e4f27?w=1280",2025-09-02T07:51:08Z,,"Um den TTS Player darzustellen, brauchen wir deine Zustimmung. 
 externen Inhalt aktivieren Um eingebettete Inhalte anzuzeigen, ist Ihre jederzeit widerrufliche Einwilligung (über den Schalter oder … [+2716 chars]",,de,'Armut'
https://www.zeit.de/politik/ausland/2025-09/russland-china-kooperation-xi-jinping-wladimir-putin,https://www.zeit.de/politik/ausland/2025-09/russland-china-kooperation-xi-jinping-wladimir-putin,0,www.zeit.de,Peking: Russland und China unterzeichnen mehr als 20 neue Abkommen,"Energie, Luftfahrt, KI: Russland und China haben weitere Kooperationen vereinbart. Die Beziehungen beider Länder sind laut Wladimir Putin auf ""beispiellos hohem Niveau"".",https://img.zeit.de/politik/2025-09/russland-china-kooperation-xi-jinping-wladimir-putin-bild/wide__1300x731,2025-09-02T07:53:25Z,https://web.archive.org/web/20250902080448/https://www.zeit.de/politik/ausland/2025-09/russland-china-kooperation-xi-jinping-wladimir-putin,Russlands Präsident Wladimir Putin und Chinas Präsident Xi Jinping haben bei einem Treffen in Peking einen Ausbau der bilateralen Beziehungen ihrer Länder angekündigt. Der staatlichen chinesischen Na… [+1523 chars],,de,'Putin'
https://www.rtl.de/news/armut-in-deutschland-jede-vierte-familie-weiss-nicht-ob-sie-genug-geld-fuer-das-noetigste-aufbringen-kann-id6652415.html,https://www.rtl.de/news/armut-in-deutschland-jede-vierte-familie-weiss-nicht-ob-sie-genug-geld-fuer-das-noetigste-aufbringen-kann-id6652415.html,0,www.rtl.de,"Armut in Deutschland: Jede vierte Familie weiß nicht, ob sie genug Geld für das Nötigste aufbringen kann","Sie wissen nicht, ob sie die nächsten Monate über die Runden kommen! 
Viele Eltern in Deutschland sorgen sich um ihre finanzielle Situation. Laut einer aktuellen Umfrage der Organisation Save the Children Deutschland befürchtet ein Viertel, im kommenden Jahr …",https://www.rtl.de/img/6556588/1754478793/c16_9/1200/image.webp,2025-09-02T09:08:24Z,https://web.archive.org/web/20250903105320/https://www.rtl.de/news/armut-in-deutschland-jede-vierte-familie-weiss-nicht-ob-sie-genug-geld-fuer-das-noetigste-aufbringen-kann-id6652415.html,"Eltern in Deutschland in finanziellen Sorgen
Jede vierte Familie weiß nicht, ob sie genug Geld für Essen, Heizen und Kleidung aufbringen kann
Viele Familien in Deutschland machen sich große finanzi… [+1988 chars]",,de,'Armut'
https://www.welt.de/wirtschaft/article68b68cf98c33b226bcaefb91/Die-Gastronomie-Krise-eskaliert-und-zerstoert-die-Hoffnung-auf-sinkende-Preise.html,https://www.welt.de/wirtschaft/article68b68cf98c33b226bcaefb91/Die-Gastronomie-Krise-eskaliert-und-zerstoert-die-Hoffnung-auf-sinkende-Preise.html,0,www.welt.de,Die Gastronomie-Krise eskaliert – und zerstört die Hoffnung auf sinkende Preise,"Hotels und insbesondere die Gastronomie klagen über Gästemangel. Der Branche droht daher das sechste Verlustjahr hintereinander. Die Politik will mit einer Reduzierung der Mehrwertsteuer helfen. Doch Äußerungen aus dem Gastgewerbe zeigen deutlich, dass dieser…",https://images.welt.de/68b68cf98c33b226bcaefb91/40314271ed25d66b1b1e148a1729c555-master/ci16x9-w1200/leerer-biergarten-am-koenigssee-schoenau-am-koenigssee-berchtesgadener-land,2025-09-02T09:30:16Z,http://archive.md/20250902094234/https://www.welt.de/wirtschaft/article68b68cf98c33b226bcaefb91/Die-Gastronomie-Krise-eskaliert-und-zerstoert-die-Hoffnung-auf-sinkende-Preise.html,Hotels und insbesondere die Gastronomie klagen über Gästemangel. Der Branche droht daher das sechste Verlustjahr hintereinander. Die Politik will mit einer Reduzierung der Mehrwertsteuer helfen. Doch… [+7740 chars],,de,'Energiekosten'
https://www.zeit.de/politik/2025-09/sco-gipfel-china-wladimir-putin-xi-jinping-nachrichtenpodcast,https://www.zeit.de/politik/2025-09/sco-gipfel-china-wladimir-putin-xi-jinping-nachrichtenpodcast,0,www.zeit.de,SCO-Gipfel: Putin und Xi gemeinsam gegen den Westen,Die Staatschefs von Russland und China Putin und Xi betonen auf dem SCO-Gipfel ihre Einigkeit. Wie stabil ist das Bündnis? Und: Wadephul auf Fachkräfte-Suche in Indien.,https://img.zeit.de/politik/2017-09/illu-podcast-news/wide__8ed8a6__1300x731,2025-09-02T15:07:33Z,https://web.archive.org/web/20250903154807/https://www.zeit.de/politik/2025-09/sco-gipfel-china-wladimir-putin-xi-jinping-nachrichtenpodcast,Auf dem Gipfel der Shanghaier Organisation für Zusammenarbeit (SCO) im chinesischen Tianjin haben der russische Präsident Wladimir Putin und Chinas Staatschef Xi Jinping ihre Einigkeit und Zusammenar… [+1679 chars],,de,'Putin'
https://www.zeit.de/news/2025-09/02/merz-eu-nicht-fuer-militaereinsatz-in-ukraine-zustaendig,https://www.zeit.de/news/2025-09/02/merz-eu-nicht-fuer-militaereinsatz-in-ukraine-zustaendig,0,www.zeit.de,Krieg in der Ukraine: Merz: EU nicht für Militäreinsatz in Ukraine zuständig,Hier finden Sie Informationen zu dem Thema „Krieg in der Ukraine“. Lesen Sie jetzt „Merz: EU nicht für Militäreinsatz in Ukraine zuständig“.,https://img.zeit.de/news/2025-09/02/merz-eu-nicht-fuer-militaereinsatz-in-ukraine-zustaendig-image-group/wide__1300x731,2025-09-02T15:36:46Z,,"Bundeskanzler Friedrich Merz hat betont, dass die militärische Unterstützung der Ukraine Sache der Mitgliedstaaten in der sogenannten Koalition der Willigen und nicht der EU-Kommission sei. «Die Euro… [+1434 chars]",,de,'Ukraine'
https://www.faz.net/aktuell/wirtschaft/mehr-wirtschaft/gaspipeline-von-russland-nach-china-110666632.html,https://www.faz.net/aktuell/wirtschaft/mehr-wirtschaft/gaspipeline-von-russland-nach-china-110666632.html,0,www.faz.net,Sila Sibiri 2: Angeblich Einigung über russische Gaspipeline nach China,Russland will seit Jahren eine zusätzliche Gaspipeline nach China bauen. Bislang hatte China aber gezögert. Nun spricht Russland von einem Durchbruch bei den Verhandlungen.,https://media1.faz.net/ppmedia/w1200/aktuell/1283786603/1.10667103/facebook_teaser/ein-bild-aus-dem-jahr-2019.jpg.webp,2025-09-02T17:18:01Z,,"Russischen Angaben zufolge soll ein Durchbruch bei den jahrelangen Verhandlungen mit China über eine zweite Gaspipeline, genannt Sila Sibiri 2 (Kraft Sibiriens 2), gelungen sein. Wie Alexej Miller, d… [+3252 chars]",,de,'Russland'
https://www.zeit.de/news/2025-09/02/nach-wasserrohrbruch-in-koblenz-500-haushalte-ohne-gas,https://www.zeit.de/news/2025-09/02/nach-wasserrohrbruch-in-koblenz-500-haushalte-ohne-gas,0,www.zeit.de,Havarie: Nach Wasserrohrbruch in Koblenz: 500 Haushalte ohne Gas,Hier finden Sie Informationen zu dem Thema „Havarie“. Lesen Sie jetzt „Nach Wasserrohrbruch in Koblenz: 500 Haushalte ohne Gas“.,https://img.zeit.de/news/2025-09/02/nach-wasserrohrbruch-in-koblenz-500-haushalte-ohne-gas-image-group/wide__1300x731,2025-09-02T19:32:05Z,,"Nach einem Wasserrohrbruch in Koblenz wird für rund 500 Haushalte mehrere Tage lang die Gasversorgung gekappt - mindestens bis zum Wochenende. Betroffen sei der Stadtteil Lützel, teilten die Stadt un… [+917 chars]",,de,'Gas'
https://www.stern.de/gesellschaft/regional/sachsen/windkraft--kommunen-in-sachsen-sollen-mehr-geld-fuer-windraeder-bekommen-36023942.html,https://www.stern.de/gesellschaft/regional/sachsen/windkraft--kommunen-in-sachsen-sollen-mehr-geld-fuer-windraeder-bekommen-36023942.html,0,www.stern.de,Windkraft: Kommunen in Sachsen sollen mehr Geld für Windräder bekommen,"Dresden (sn) - Sachsens Kommunen sollen künftig mehr an der Windkraft verdienen. Demnach sollen die Gemeinden im Umkreis von 2,5 Kilometern eines Windrads",https://image.stern.de/36023944/t/sc/v1/w1440/r1.7778/-/03--msp6uzr6dwv9axs2048jpeg---7f9d387e5167f6b9.jpg,2025-09-03T05:17:02Z,,"Kopiere den aktuellen Link
Zur Merkliste hinzufügen
Der Ausbau der Windkraft in Sachsen kommt nur schleppend voran. Nun soll der finanzielle Anreiz für die Kommunen verbessert werden.
Sachsens Kom… [+2140 chars]",,de,'Windkraft'
https://www.faz.net/aktuell/wirtschaft/klima-nachhaltigkeit/windkraftausbau-in-europa-hinter-erwartungen-accg-110667755.html,https://www.faz.net/aktuell/wirtschaft/klima-nachhaltigkeit/windkraftausbau-in-europa-hinter-erwartungen-accg-110667755.html,0,www.faz.net,Erneuerbare Energien: Windkraftausbau in Europa hinter Erwartungen,Im ersten Halbjahr hat Deutschland mehr neue Windkraftanlagen gebaut als jedes andere Land in Europa. Dennoch bleibt der europaweite Ausbau hinter den Erwartungen zurück.,https://media0.faz.net/ppmedia/w1200/aktuell/wirtschaft/4087938866/1.10667772/facebook_teaser/trotz-starkem-ausbau-in.jpg.webp,2025-09-03T06:32:40Z,,In Deutschland sind Verbandsangaben zufolge in den ersten sechs Monaten des Jahres so viele neue Windkraftanlagen gebaut worden wie sonst nirgendwo in Europa. Insgesamt blieben die Neuinstallationen … [+1789 chars],,de,'Windkraft'
https://www.zeit.de/news/2025-09/03/fridays-for-future-plant-protestcamp-auf-borkum,https://www.zeit.de/news/2025-09/03/fridays-for-future-plant-protestcamp-auf-borkum,0,www.zeit.de,Gasprojekt in der Nordsee: Fridays For Future plant Protestcamp auf Borkum,Hier finden Sie Informationen zu dem Thema „Gasprojekt in der Nordsee“. Lesen Sie jetzt „Fridays For Future plant Protestcamp auf Borkum“.,https://img.zeit.de/news/2025-09/03/fridays-for-future-plant-protestcamp-auf-borkum-image-group/wide__1300x731,2025-09-03T10:53:10Z,,Klimaaktivisten wollen auf der ostfriesischen Insel Borkum gegen Gasbohrungen in der Nordsee protestieren. Mehr als 200 Teilnehmende seien für das Protestcamp von Donnerstag an angemeldet und würden … [+2569 chars],,de,'Gas'
https://www.focus.de/politik/bei-trump-treffen-merz-pocht-auf-waffenruhe-und-druck-auf-putin_2264e9f7-f66f-4494-8863-c111fa646c53.html,https://www.focus.de/politik/bei-trump-treffen-merz-pocht-auf-waffenruhe-und-druck-auf-putin_2264e9f7-f66f-4494-8863-c111fa646c53.html,0,www.focus.de,"Russland sauer nach Merz' Putin-Aussagen: ""Sehr viele ungute Äußerungen erlaubt""","Ukraine-News im Live-Ticker: Alle aktuellen Entwicklungen, Hintergründe und Berichte zum Krieg – laufend aktualisiert und kompakt zusammengefasst.",https://quadro.burda-forward.de/ctf/978f7db3-3582-45f8-b1cb-a24cc4fc5a2c.f490851c-8c8f-4a60-aa0c-22d3f10fa12e.png?im=RegionOfInterestCrop%3D%281200%2C630%29%2CregionOfInterest%3D%282081%2C608%29&hash=83d988d66efb180911a48e6eca3a546e3d337966a24dd32aebc867699b923ed6,2025-09-03T13:09:07Z,,"Mittwoch, 3. September, 14.54 Uhr: Russland hat mit Kritik auf die jüngsten Äußerungen von Bundeskanzler Friedrich Merz (CDU) reagiert, der Kremlchef Wladimir Putin wegen seines Überfalls auf die Ukr… [+1419 chars]",,de,'Ukraine'
https://www.dw.com/de/china-russland-und-nordkorea-wollen-zusammenarbeit-ausbauen/a-73867318,https://www.dw.com/de/china-russland-und-nordkorea-wollen-zusammenarbeit-ausbauen/a-73867318,0,www.dw.com,"China, Russland und Nordkorea wollen Zusammenarbeit ausbauen","Nordkoreas Machthaber Kim Jong Un wirbt auf seiner Chinareise für mehr Unterstützung - sowohl beim Gastgeber China als auch beim derzeit immer wichtigeren Partner Russland. Ein Pokerspiel mit Kim als Joker. Bei der Militärparade, die in Peking zum 80. Jahrest…",https://static.dw.com/image/73859403_6.jpg,2025-09-03T13:13:00Z,,"Bei der Militärparade, die in Peking zum 80. Jahrestag des Weltkriegsendes in Asien stattfand, saßen am Mittwoch (03.09.) Nordkoreas Machthaber Kim Jong Un und Russlands Präsident Wladimir Putin auf … [+6611 chars]",,de,'Russland'
https://www.faz.net/aktuell/politik/ukraine/ukraine-liveticker-kreml-kritisiert-merz-kriegesverbrecher-aussage-faz-110172806.html,https://www.faz.net/aktuell/politik/ukraine/ukraine-liveticker-kreml-kritisiert-merz-kriegesverbrecher-aussage-faz-110172806.html,0,www.faz.net,Krieg in der Ukraine: Kreml kritisiert Merz’ „Kriegesverbrecher“-Aussage,Moskau: Kanzler erlaubt sich „sehr viele ungute Äußerungen“ +++ Kim sagt Putin volle Unterstützung zu +++ Polen sichert Luftraum nach russischen Angriffen auf Westukraine +++ alle Neuigkeiten im Liveblog,https://media1.faz.net/ppmedia/w1200/aktuell/politik/2000957702/1.10668371/facebook_teaser/kremlsprecher-dmitri-peskow-im.jpg.webp,2025-09-03T13:14:11Z,https://web.archive.org/web/20250903153749/https://www.faz.net/aktuell/politik/ukraine/ukraine-liveticker-kreml-kritisiert-merz-kriegesverbrecher-aussage-faz-110172806.html,"Russland hat die Ukraine in der Nacht erneut aus der Luft angegriffen. Dabei wurden in der zentralukrainischen Region Kirowohrad mehrere Menschen verletzt, darunter vier Bahnarbeiter, wie die Behörde… [+520 chars]",,de,'Krieg'
https://www.focus.de/wissen/technik/china-enthuellt-militaer-laser-ly-1-deutsche-leser-diskutieren-entwicklungshilfe-technik-und-taiwan_b9f728a2-2b18-410e-92e0-f5be8d9802c4.html,https://www.focus.de/wissen/technik/china-enthuellt-militaer-laser-ly-1-deutsche-leser-diskutieren-entwicklungshilfe-technik-und-taiwan_b9f728a2-2b18-410e-92e0-f5be8d9802c4.html,0,www.focus.de,"China enthüllt Militär-Laser LY-1 – Deutsche Leser diskutieren Entwicklungshilfe, Technik und Taiwan","China präsentiert erstmals das Luftabwehrsystem LY-1 vor Xi, Putin und Kim. Die deutschen Leser debattieren über Entwicklungshilfe, Militärtechnik und geopolitische Folgen.",https://quadro.burda-forward.de/ctf/c449041f-2d1f-491b-9113-ac0fb1ff09c0.c6bafa4e-706c-499e-b95b-7d84674b5658.png?im=RegionOfInterestCrop%3D%281200%2C630%29%2CregionOfInterest%3D%28284%2C579%29&hash=e5c6d47fcf2cba79ed7f27d7f28d6a6ecd51baf93f486856651ee33f7fea0f52,2025-09-03T13:29:42Z,,"Chinas neue Militärtechnik sorgt für Schlagzeilen und für eine kontroverse Leserdebatte. Im Artikel ""China zeigt bei Parade neuen Super-Laser LY-1 Putin und Kim stehen Spalier"" geht es um die Premier… [+6419 chars]",,de,'Krieg'
https://www.welt.de/wirtschaft/weltplus/plus68b7f3e201ad191d1ad5d934/DIHK-Studie-Deutsche-Energiekosten-steigen-auf-bis-zu-5-5-Billionen-Euro.html,https://www.welt.de/wirtschaft/weltplus/plus68b7f3e201ad191d1ad5d934/DIHK-Studie-Deutsche-Energiekosten-steigen-auf-bis-zu-5-5-Billionen-Euro.html,0,www.welt.de,"„Eingeschlagene Wege sind falsch“ – Energiekosten steigen auf bis zu 5,5 Billionen Euro","Eine Fortsetzung der aktuellen Energiepolitik würde die Versorgungskosten bis 2050 auf 5,5 Billionen Euro erhöhen. Zu diesem Ergebnis kommt eine neue Studie im Auftrag der Industrie- und Handelskammer. Allein für Energieimporte würde mehr als eine Billion Eur…",https://images.welt.de/68b7f3e201ad191d1ad5d934/07a3807796be9627c21790a532b6a8ee/ci16x9-w1200/morgens-in-sachsen-anhalt-windpark,2025-09-03T13:41:30Z,,"Eine Fortsetzung der aktuellen Energiepolitik würde die Versorgungskosten bis 2050 auf 5,5 Billionen Euro erhöhen. Zu diesem Ergebnis kommt eine neue Studie im Auftrag der Industrie- und Handelskamme… [+68 chars]",,de,'Energiekosten'
https://www.nzz.ch/international/militaerparade-in-china-2025-diese-neuen-waffen-wurden-praesentiert-nzz-ld.1900720,https://www.nzz.ch/international/militaerparade-in-china-2025-diese-neuen-waffen-wurden-praesentiert-nzz-ld.1900720,0,www.nzz.ch,"Roboter-Wölfe, Laserwaffen und unbemannte Kampfjets: Diese neuen Waffensysteme hat China an der Militärparade präsentiert","Mit der Parade will Xi Jinping zeigen, dass Chinas Armee für den Hightech-Krieg gerüstet ist. Der Fokus liegt auf Drohnen, Drohnenabwehr und nuklearer Abschreckung.","https://img.nzz.ch/2025/09/03/b7e975a7-da83-4b14-8065-73893bd111eb.jpg?width=1200&height=675&fit=bounds&quality=75&auto=webp&crop=7500,4219,x0,y181&wmark=nzz",2025-09-03T14:22:20Z,http://archive.md/20250903143037/https://www.nzz.ch/international/militaerparade-in-china-2025-diese-neuen-waffen-wurden-praesentiert-nzz-ld.1900720,"China präsentiert die neuen Waffen während der grössten Militärparade des Landes in Peking.
Optimieren Sie Ihre Browsereinstellungen
NZZ.ch benötigt JavaScript für wichtige Funktionen. Ihr Browser … [+6878 chars]",,de,'Krieg'
https://www.stern.de/news/vor-treffen-der--koalition-der-willigen---russland-ueberzieht-ukraine-mit-angriffen-36024322.html,https://www.stern.de/news/vor-treffen-der--koalition-der-willigen---russland-ueberzieht-ukraine-mit-angriffen-36024322.html,0,www.stern.de,"Vor Treffen der ""Koalition der Willigen"": Russland überzieht Ukraine mit Angriffen",Vor dem Treffen der sogenannten Koalition der Willigen aus rund 30 überwiegend europäischen Verbündeten der Ukraine hat Russland das Nachbarland erneut mit einer massiven Angriffswelle überzogen. Nach Angaben der ukrainischen Luftwaffe setzte die russische Ar…,https://image.stern.de/36025988/t/aT/v1/w1440/r1.7778/-/03--rettungskraefte-in-kiew-nach-russischen-luftangriffen---8be578727c2f18db.jpg,2025-09-03T14:26:44Z,,"Kopiere den aktuellen Link
Zur Merkliste hinzufügen
Vor dem Treffen der sogenannten Koalition der Willigen aus rund 30 überwiegend europäischen Verbündeten der Ukraine hat Russland das Nachbarland … [+3812 chars]",,de,'Ukraine'
https://www.diepresse.com/20059068/xi-zelebriert-seine-macht-china-steht-auf-der-richtigen-seite-der-geschichte,https://www.diepresse.com/20059068/xi-zelebriert-seine-macht-china-steht-auf-der-richtigen-seite-der-geschichte,0,www.diepresse.com,Xi zelebriert seine Macht: „China steht auf der richtigen Seite der Geschichte“ [premium],"Bei einer pompösen Militärparade demonstriert Chinas Staatschef, Xi Jinping, den Schulterschluss mit Kreml-Chef Wladimir Putin und Nordkoreas Diktator, Kim Jong-un. Donald Trump reagierte erzürnt und sprach von „Konspiration gegen die USA“.",https://img.diepresse.com/public/incoming/l66jwk-WW2-ANNIVERSARYCHINA/alternates/DPR_SOCIAL_NACHRICHTEN/WW2-ANNIVERSARYCHINA,2025-09-03T14:43:05Z,http://archive.md/20250903145707/https://www.diepresse.com/20059068/xi-zelebriert-seine-macht-china-steht-auf-der-richtigen-seite-der-geschichte,"Peking. Dieses Bild dürfte in die Geschichtsbücher eingehen: Chinas Staatschef, Xi Jinping, gekleidet in Mao-Jacke, betritt die Balustrade am Tor des Himmlischen Friedens. Rechts an seiner Seite: der… [+4557 chars]",,de,'Krieg'
https://www.focus.de/politik/bei-trump-treffen-merz-pocht-auf-waffenruhe-und-druck-auf-putin_9848a4d3-936b-4f2a-bf9b-09634fcd7274.html,https://www.focus.de/politik/bei-trump-treffen-merz-pocht-auf-waffenruhe-und-druck-auf-putin_9848a4d3-936b-4f2a-bf9b-09634fcd7274.html,0,www.focus.de,Putin reagiert auf Merz-Aussage und will Selenskyj nur in Moskau treffen,"Ukraine-News im Live-Ticker: Alle aktuellen Entwicklungen, Hintergründe und Berichte zum Krieg – laufend aktualisiert und kompakt zusammengefasst.",https://quadro.burda-forward.de/ctf/a4ff830c-1f05-4c69-bfdd-363900947fb2.2e6d7903-0251-403c-add2-53726d112260.jpg?im=RegionOfInterestCrop%3D%281200%2C630%29%2CregionOfInterest%3D%282613%2C1493%29&hash=da629b1b351e9007d0e0b97448b3e9d199a5965cdcde3e1cab80dc98e68e68cb,2025-09-03T14:53:59Z,,"Putin will Selenskyj nur in Moskau treffen
16.15 Uhr: Der russische Präsident Wladimir Putin hat sich unter der Voraussetzung einer guten Vorbereitung erneut zu einem Treffen mit seinem ukrainischen… [+3072 chars]",,de,'Putin'
https://taz.de/Meduza-Auswahl-28-August---3-September/!6111147/,https://taz.de/Meduza-Auswahl-28-August---3-September/!6111147/,0,taz.de,Meduza-Auswahl 28. August – 3. September: Bis zu 3.000 russische Soldaten sterben wöchentlich,Meduza wertet neue Quellen zu den Todesjahren unter russischen Kämpfern im Ukraine-Krieg aus. Die Verluste haben ein völlig neues Ausmaß erreicht.,https://taz.de/picture/7907920/1200/39144393-1.jpeg,2025-09-03T15:01:00Z,,Meduza wertet neue Quellen zu den Todesjahren unter russischen Kämpfern im Ukraine-Krieg aus. Die Verluste haben ein völlig neues Ausmaß erreicht. mehr...,,de,'Ukraine'
https://www.faz.net/aktuell/politik/ukraine/robert-fico-nach-peking-um-mit-putin-ueber-die-ukraine-zu-reden-110668666.html,https://www.faz.net/aktuell/politik/ukraine/robert-fico-nach-peking-um-mit-putin-ueber-die-ukraine-zu-reden-110668666.html,0,www.faz.net,"Robert Fico: Nach Peking, um mit Putin über die Ukraine zu reden","Der slowakische Regierungschef bekräftigt gegenüber dem Kremlchef seine „andere Position“ zum russischen Krieg gegen die Ukraine. Putin fordert Fico auf, kein Gas mehr an die Ukraine zu liefern.",https://media1.faz.net/ppmedia/w1200/aktuell/3733874368/1.10668665/facebook_teaser/robert-fico-und-wladimir-putin.jpg.webp,2025-09-03T15:08:33Z,http://archive.md/20250903151332/https://www.faz.net/aktuell/politik/ukraine/robert-fico-nach-peking-um-mit-putin-ueber-die-ukraine-zu-reden-110668666.html,"Robert Fico ist der einzige Regierungschef aus der Europäischen Union, der zur Militärparade von Xi Jinping nach Peking gereist ist. Zumindest auf den von chinesischen Staatsmedien verbreiteten Aufna… [+203 chars]",,de,'Ukraine'
https://www.tagesspiegel.de/internationales/ein-solches-treffen-wird-stattfinden-putin-ware-bereit-selenskyj-in-moskau-zu-empfangen-14271833.html,https://www.tagesspiegel.de/internationales/ein-solches-treffen-wird-stattfinden-putin-ware-bereit-selenskyj-in-moskau-zu-empfangen-14271833.html,0,www.tagesspiegel.de,"„Ein solches Treffen wird stattfinden“: Putin wäre bereit, Selenskyj in Moskau zu empfangen",Putin bietet Selenskyj Moskau als Verhandlungsort an.  Die Möglichkeit zu einem Treffen habe der Kremlchef „nie ausgeschlossen“. Putin fragt: „Aber hätte es irgendeinen Sinn?“,https://www.tagesspiegel.de/images/14271929/alternates/BASE_16_9_W1400/1756912490000/militarparade-in-peking.jpeg,2025-09-03T15:21:07Z,,Der russische Präsident Wladimir Putin hat sich unter der Voraussetzung einer guten Vorbereitung erneut zu einem Treffen mit seinem ukrainischen Kollegen Wolodymyr Selenskyj bereiterklärt. Selenskyj … [+2740 chars],,de,'Putin'
