index,url,valid,domain,title,description,image,published,archive,content,quote,language,keyword
https://www.zeit.de/news/2024-12/02/koffer-statt-ledertasche-spekulationen-ueber-kanzler-gepaeck,https://www.zeit.de/news/2024-12/02/koffer-statt-ledertasche-spekulationen-ueber-kanzler-gepaeck,0,www.zeit.de,Olaf Scholz in der Ukraine: Koffer statt Ledertasche? Spekulationen über Kanzler-Gepäck,Hier finden Sie Informationen zu dem Thema „Olaf Scholz in der Ukraine“. Lesen Sie jetzt „Koffer statt Ledertasche? Spekulationen über Kanzler-Gepäck“.,https://img.zeit.de/news/2024-12/02/koffer-statt-ledertasche-spekulationen-ueber-kanzler-gepaeck-image-group/wide__1300x731,2024-12-02T14:41:09Z,https://web.archive.org/web/20241204033819/https://www.zeit.de/news/2024-12/02/koffer-statt-ledertasche-spekulationen-ueber-kanzler-gepaeck,Bei seinem ersten Besuch in Kiew seit zweieinhalb Jahren hat Bundeskanzler Olaf Scholz mit seinem Gepäck Spekulationen in den sozialen Medien ausgelöst. Statt seiner Ledertasche trug der Kanzler dies… [+1377 chars],,de,'Ukraine'
https://www.zeit.de/video/2024-12/6365419075112/krieg-in-der-ukraine-scholz-sagt-ukraine-ueber-650-millionen-euro-militaerhilfe-zu,https://www.zeit.de/video/2024-12/6365419075112/krieg-in-der-ukraine-scholz-sagt-ukraine-ueber-650-millionen-euro-militaerhilfe-zu,0,www.zeit.de,Krieg in der Ukraine: Scholz sagt Ukraine über 650 Millionen Euro Militärhilfe zu,Bundeskanzler Olaf Scholz ist am Montag überraschend in die Ukraine gereist. Dort kündigte er weitere Rüstungslieferungen im Wert von 650 Millionen Euro an.,https://img.zeit.de/video/2024-12/6365419075112-still/wide__1300x731,2024-12-02T15:38:18Z,https://web.archive.org/web/20241203041103/https://www.zeit.de/video/2024-12/6365419075112/krieg-in-der-ukraine-scholz-sagt-ukraine-ueber-650-millionen-euro-militaerhilfe-zu,"Schließen
Hier können Sie interessante Artikel speichern, um sie später zu lesen und wiederzufinden.
Sie haben bereits ein Konto?
 Hier anmelden.",,de,'Ukraine'
https://www.zeit.de/video/2024-12/6365410991112/krieg-in-der-ukraine-baerbock-warnt-china-vor-militaerischer-unterstuetzung-fuer-russland,https://www.zeit.de/video/2024-12/6365410991112/krieg-in-der-ukraine-baerbock-warnt-china-vor-militaerischer-unterstuetzung-fuer-russland,0,www.zeit.de,Krieg in der Ukraine: Baerbock warnt China vor militärischer Unterstützung für Russland,"Bundesaußenministerin Annalena Baerbock ist nach Peking gereist. Dort hat sie China erneut davor gewarnt, Russland im Krieg gegen die Ukraine zu unterstützen.",https://img.zeit.de/video/2024-12/6365410991112-still/wide__1300x731,2024-12-02T15:38:29Z,https://web.archive.org/web/20241203064157/https://www.zeit.de/video/2024-12/6365410991112/krieg-in-der-ukraine-baerbock-warnt-china-vor-militaerischer-unterstuetzung-fuer-russland,"Schließen
Hier können Sie interessante Artikel speichern, um sie später zu lesen und wiederzufinden.
Sie haben bereits ein Konto?
 Hier anmelden.",,de,'Ukraine'
https://www.n-tv.de/politik/SPD-Abgeordneter-Manuel-Gava-gesteht-Kokainkonsum-article25404261.html,https://www.n-tv.de/politik/SPD-Abgeordneter-Manuel-Gava-gesteht-Kokainkonsum-article25404261.html,0,www.n-tv.de,"""Habe abends viel Gas gegeben"": SPD-Abgeordneter Manuel Gava gesteht Kokainkonsum","Der Druck im Berliner Politikbetrieb und private Probleme waren zu viel für ihn: Der Osnabrücker Bundestagsabgeordnete Manuel Gava von der SPD hat im Jahr 2023 nach eigenen Aussagen ""mit einer gewissen Regelmäßigkeit"" Kokain konsumiert. Sein Geständnis zieht …",https://bilder3.n-tv.de/img/incoming/crop25404274/6791327720-cImg_16_9-w1200/275251963.jpg,2024-12-02T17:29:26Z,https://web.archive.org/web/20241202190622/https://www.n-tv.de/politik/SPD-Abgeordneter-Manuel-Gava-gesteht-Kokainkonsum-article25404261.html,"Der Druck im Berliner Politikbetrieb und private Probleme waren zu viel für ihn: Der Osnabrücker Bundestagsabgeordnete Manuel Gava von der SPD hat im Jahr 2023 nach eigenen Aussagen ""mit einer gewiss… [+2011 chars]",,de,'Gas'
https://www.zeit.de/news/2024-12/02/ukrainische-staedte-unter-beschuss,https://www.zeit.de/news/2024-12/02/ukrainische-staedte-unter-beschuss,0,www.zeit.de,Krieg in der Ukraine: Ukrainische Städte unter Beschuss,Hier finden Sie Informationen zu dem Thema „Krieg in der Ukraine“. Lesen Sie jetzt „Ukrainische Städte unter Beschuss“.,https://img.zeit.de/news/2024-12/02/ukrainische-staedte-unter-beschuss-image-group/wide__1300x731,2024-12-02T17:59:38Z,,"Das russische Militär hat die Regionen um die Städte Nikopol und Krywyj Rih im Südosten der Ukraine im Tagesverlauf mehrfach angegriffen. Der Leiter der regionalen Militärverwaltung, Serhij Lyssak, b… [+763 chars]",,de,'Ukraine'
https://www.zeit.de/politik/ausland/2024-12/olaf-scholz-ukraine-wolodymyr-selenskyj-krieg-verhandlungen,https://www.zeit.de/politik/ausland/2024-12/olaf-scholz-ukraine-wolodymyr-selenskyj-krieg-verhandlungen,0,www.zeit.de,Olaf Scholz in der Ukraine: Hier endet die ukrainische Gesprächsbereitschaft,Kanzler Scholz signalisiert entschlossene Unterstützung für die Ukraine. Dabei hat die Suche nach Kompromissen mit Russland längst begonnen. Nur Putin macht nicht mit.,https://img.zeit.de/politik/ausland/2024-12/olaf-scholz-ukraine-wolodymyr-selenskyj-krieg-verhandlungen-bild/wide__1300x731,2024-12-02T18:22:03Z,http://archive.md/20241202183051/https://www.zeit.de/politik/ausland/2024-12/olaf-scholz-ukraine-wolodymyr-selenskyj-krieg-verhandlungen,"Schließen
Artikelzusammenfassung
Bundeskanzler Olaf Scholz besucht die Ukraine nach langer Pause und kündigt neue Militärhilfen im Wert von 650 Millionen Euro an. Trotz Kritik von Präsident Selensk… [+810 chars]",,de,'Putin'
https://www.zeit.de/news/2024-12/03/selenskyj-nach-scholz-besuch-danke-deutschland,https://www.zeit.de/news/2024-12/03/selenskyj-nach-scholz-besuch-danke-deutschland,0,www.zeit.de,"Ukraine-Krieg: Selenskyj nach Scholz-Besuch: Danke, Deutschland","Hier finden Sie Informationen zu dem Thema „Ukraine-Krieg“. Lesen Sie jetzt „Selenskyj nach Scholz-Besuch: Danke, Deutschland“.",https://img.zeit.de/news/2024-12/03/selenskyj-nach-scholz-besuch-danke-deutschland-image-group/wide__1300x731,2024-12-02T23:34:07Z,https://web.archive.org/web/20241203054900/https://www.zeit.de/news/2024-12/03/selenskyj-nach-scholz-besuch-danke-deutschland,Nach dem ersten Besuch des Bundeskanzlers in Kiew seit zweieinhalb Jahren hat sich der ukrainische Präsident Wolodymyr Selenskyj nochmals für die anhaltende Unterstützung aus Deutschland im Abwehrkam… [+2115 chars],,de,'Ukraine'
https://www.zeit.de/politik/deutschland/2024-12/bundestagswahlkampf-ukraine-krieg-olaf-scholz-friedrich-merz-5vor8,https://www.zeit.de/politik/deutschland/2024-12/bundestagswahlkampf-ukraine-krieg-olaf-scholz-friedrich-merz-5vor8,0,www.zeit.de,Bundestagswahlkampf: Wie hältst Du es mit der Ukraine?,"Olaf Scholz reist nach Kyjiw, Friedrich Merz wirft ihm vor, Kriegsangst zu schüren. Beide wissen: Die Ukrainepolitik könnte zum Hauptthema im Wahlkampf werden.",https://img.zeit.de/politik/ausland/2024-12/olaf-scholz-selenskyj-ukraine/wide__1300x731,2024-12-03T07:30:50Z,http://archive.md/20241203073641/https://www.zeit.de/politik/deutschland/2024-12/bundestagswahlkampf-ukraine-krieg-olaf-scholz-friedrich-merz-5vor8,"Nein, Olaf Scholz, ist nicht ausschließlich zu Wahlkampfzwecken in die Ukraine gereist. Zwar unterstellt ihm das die CDU; doch man darf schon annehmen, dass es dem Kanzler auch um ein Zeichen der Sol… [+508 chars]",,de,'Ukraine'
https://www.faz.net/aktuell/feuilleton/kolumnen/brief-aus-istanbul/erdogan-geht-nicht-gegen-die-armut-vor-er-bedraengt-die-verarmten-110148794.html,https://www.faz.net/aktuell/feuilleton/kolumnen/brief-aus-istanbul/erdogan-geht-nicht-gegen-die-armut-vor-er-bedraengt-die-verarmten-110148794.html,0,www.faz.net,Brief aus Istanbul: Die größte Sünde in der Türkei ist das Schreiben,"Erdoğans Regime geht nicht gegen die Armut vor, es bedrängt die Verarmten und verfolgt die, die ihnen helfen wollen. Journalisten, die über Bestechung berichten, wird vorgeworfen, sie betrieben Desinformation.",https://media0.faz.net/ppmedia/aktuell/gesellschaft/3935085675/1.10148790/facebook_teaser/ankara-25-november-polizisten.jpg,2024-12-03T08:31:51Z,,"So finden sich in einem Drama, das sich vor zwei Wochen in einer Kleinstadt an der Ägäis abspielte, all die Probleme gebündelt, mit denen wir uns in den letzten Jahren herumschlagen. Vor allem die Ar… [+8104 chars]",,de,'Armut'
https://www.faz.net/aktuell/politik/ukraine/ukraine-liveticker-ukraine-will-nur-nato-mitgliedschaft-akzeptieren-faz-19030454.html,https://www.faz.net/aktuell/politik/ukraine/ukraine-liveticker-ukraine-will-nur-nato-mitgliedschaft-akzeptieren-faz-19030454.html,0,www.faz.net,Ukraine-Liveblog: Ukraine will nur NATO-Mitgliedschaft akzeptieren,Norwegen schickt Kampfflugzeuge und Soldaten nach Polen +++ Dutzende Attacken auf Städte im Westen und Südosten der Ukraine +++ Putin und Lukaschenko unterzeichnen „Sicherheitspakt“ +++ alle Entwicklungen im Liveblog,https://media0.faz.net/ppmedia/aktuell/politik/ukraine/1316685527/1.10150158/facebook_teaser/flaggen-der-nato-mitglieder.jpg,2024-12-03T10:01:01Z,https://web.archive.org/web/20241203113016/https://www.faz.net/aktuell/politik/ukraine/ukraine-liveticker-ukraine-will-nur-nato-mitgliedschaft-akzeptieren-faz-19030454.html,Vor einem Treffen der NATO-Außenminister in Brüssel hat die Ukraine eine Aufnahme in das Militärbündnis als einzige wirksame Sicherheitsgarantie angesichts des russischen Angriffskriegs bezeichnet. W… [+1035 chars],,de,'Putin'
https://www.golem.de/sonstiges/zustimmung/auswahl.html?from=https://www.golem.de/news/darknet-marktplatz-betreiber-von-hydra-market-erhaelt-in-russland-lebenslaenglich-2412-191367.html&referer=https://t.co/1e46b34e73,https://www.golem.de/sonstiges/zustimmung/auswahl.html?from=https://www.golem.de/news/darknet-marktplatz-betreiber-von-hydra-market-erhaelt-in-russland-lebenslaenglich-2412-191367.html&referer=https://t.co/1e46b34e73,0,www.golem.de,Darknet-Marktplatz: Betreiber von Hydra Market erhält in Russland lebenslänglich,"Neben dem Betreiber wurden noch 15 seiner Komplizen zu mehrjährigen Haftstrafen verurteilt. Sie alle erwartet ein ""besonders strenger Strafvollzug"". (Cybercrime, Politik)",,2024-12-03T12:14:02Z,,"Besuchen Sie Golem.de wie gewohnt mit Werbung und Tracking,
 indem Sie der Nutzung aller Cookies zustimmen.
 Details zum Tracking finden Sie im Privacy Center.
Skript wurde nicht geladen. Informat… [+607 chars]",,de,'Russland'
https://help.orf.at/stories/3227851/,https://help.orf.at/stories/3227851/,0,help.orf.at,Schlechte Noten für Stromanbieter im Nachhaltigkeitstest,"Das achte Jahr in Folge führten die Umweltorganisationen Global 2000 und der WWF Stromanbieterchecks nach ökologischen Gesichtspunkten durch. Dabei zeigt sich zwar ein positiver Trend zu Solar- und Windkraft, gute Noten erhielten dennoch nur neun von insgesam…",https://ibs.orf.at/help?image=https%3A%2F%2Ftubestatic.orf.at%2Fmims%2F2024%2F49%2F35%2Fcrops%2Fw%3D1200%2Ch%3D627%2Cq%3D75%2F2443041_master_934335_themenbild_verbund_agenergie_steiermark_ag_inbetriebnahme_des_murkraftwerks_gratkorn_.jpg%3Fs%3Df42ea346e3e6dcfa91c2572f9cff8a0ba2c46b03,2024-12-03T14:19:45Z,https://web.archive.org/web/20241204014805/https://help.orf.at/stories/3227851/,"Mit dem Stromanbietercheck wollen wir zeigen, welche Stromanbieter wirklich konsequent die Energiewende unterstützen, und welche zwar Grünstrom erzeugen, aber gleichzeitig noch in fossilen Geschäftsm… [+4013 chars]",,de,'Solar'
https://www.zeit.de/politik/deutschland/2024-12/krieg-ukraine-hilfe-waffenlieferung-olaf-scholz-kyjiw,https://www.zeit.de/politik/deutschland/2024-12/krieg-ukraine-hilfe-waffenlieferung-olaf-scholz-kyjiw,0,www.zeit.de,Folge 8: Was Sie über die Ukrainehilfen denken,Mehr Waffen liefern oder mit aller Macht zum Waffenstillstand? Wie Sie nach dem Besuch von Olaf Scholz in Kyjiw auf Deutschlands Unterstützung der Ukraine blicken.,https://img.zeit.de/podcasts/logos/anruf-an-alle-logo/wide__DEE4EC__1300x731,2024-12-03T14:30:47Z,https://web.archive.org/web/20241204051613/https://www.zeit.de/politik/deutschland/2024-12/krieg-ukraine-hilfe-waffenlieferung-olaf-scholz-kyjiw,Welche Auswirkungen hat das Ende der Ampelkoalition für das Land? Wie denken die Menschen jetzt über die Zukunft Deutschlands und ihre eigene Zukunft? Das wollen wir von Ihnen wissen. Für Anruf an al… [+352 chars],,de,'Ukraine'
https://taz.de/TikTok-Trend-Lavender-Marriage/!6050075/,https://taz.de/TikTok-Trend-Lavender-Marriage/!6050075/,0,taz.de,TikTok-Trend „Lavender Marriage“: Die pragmatische Ehe ist zurück,"Junge Erwachsene wollen heiraten, aber um Liebe geht es dabei oft nicht. Sie suchen eher Schutz vor Einsamkeit und Armut.",https://taz.de/picture/7394229/1200/37153280-1.jpeg,2024-12-03T19:03:00Z,https://web.archive.org/web/20241204030235/https://taz.de/TikTok-Trend-Lavender-Marriage/!6050075/,"Junge Erwachsene wollen heiraten, aber um Liebe geht es dabei oft nicht. Sie suchen eher Schutz vor Einsamkeit und Armut. mehr...",,de,'Armut'
https://www.zeit.de/news/2024-12/02/eu-chefdiplomatin-bringt-ukraine-friedenstruppe-ins-spiel,https://www.zeit.de/news/2024-12/02/eu-chefdiplomatin-bringt-ukraine-friedenstruppe-ins-spiel,0,www.zeit.de,Lage im Überblick: EU-Chefdiplomatin: Ukraine-Friedenstruppe nicht ausschließen,Hier finden Sie Informationen zu dem Thema „Lage im Überblick“. Lesen Sie jetzt „EU-Chefdiplomatin: Ukraine-Friedenstruppe nicht ausschließen“.,https://img.zeit.de/news/2024-12/02/eu-chefdiplomatin-bringt-ukraine-friedenstruppe-ins-spiel-image-group/wide__1300x731,2024-12-03T21:01:08Z,,"Die neue EU-Außenbeauftragte Kaja Kallas hält es für denkbar, dass irgendwann einmal Soldaten aus Mitgliedstaaten einen möglichen Waffenstillstand in der Ukraine absichern. «Ich denke, wir sollten wi… [+4821 chars]",,de,'Ukraine'
https://www.faz.net/aktuell/sport/sportpolitik/russlands-sport-putin-vertagt-seine-weltfreundschaftsspiele-110151046.html,https://www.faz.net/aktuell/sport/sportpolitik/russlands-sport-putin-vertagt-seine-weltfreundschaftsspiele-110151046.html,0,www.faz.net,Russische Sportpolitik: Putin vertagt seine Weltfreundschaftsspiele,Wegen der Sanktionen gegen russische Athleten hatte Wladimir Putin einst eine Gegenveranstaltung zu Olympia angekündigt. Doch das geplante Megaevent lässt noch immer auf sich warten.,https://media0.faz.net/ppmedia/aktuell/politik/614351672/1.10151340/facebook_teaser/beschluss-von-ganz-oben-putin.jpg,2024-12-03T21:10:24Z,http://archive.md/20241204002122/https://www.faz.net/aktuell/sport/sportpolitik/russlands-sport-putin-vertagt-seine-weltfreundschaftsspiele-110151046.html,"Die Verschiebung der Weltfreundschaftspiele, so heißt es vonseiten der russischen Regierung, stehe im Zusammenhang mit dem Schutz der Rechte von Athleten und Sportorganisationen auf freien Zugang zu … [+1194 chars]",,de,'Putin'
https://www.faz.net/aktuell/politik/ausland/suedkorea-praesident-yoon-suk-yeol-yoon-hebt-kriegsrecht-wieder-auf-110150802.html,https://www.faz.net/aktuell/politik/ausland/suedkorea-praesident-yoon-suk-yeol-yoon-hebt-kriegsrecht-wieder-auf-110150802.html,0,www.faz.net,Nach Parlaments-Abstimmung: Yoon hebt Kriegsrecht wieder auf,"Südkoreas Präsident Yoon Suk-yeol hat das von ihm ausgerufene Kriegsrecht nach nur wenigen Stunden wieder aufgehoben. Damit reagierte er auf einen Beschluss des Parlaments, seine Entscheidung zu blockieren.",https://media1.faz.net/ppmedia/aktuell/politik/5317991/1.10151693/facebook_teaser/buerger-vor-dem.jpg,2024-12-03T22:21:22Z,http://archive.md/20241203225038/https://www.faz.net/aktuell/politik/ausland/suedkorea-praesident-yoon-suk-yeol-yoon-hebt-kriegsrecht-wieder-auf-110150802.html,"Zuvor waren 190 Abgeordnete in der Nacht zu Mittwoch (Ortszeit) in das Parlamentsgebäude gelangt und hatten einstimmig für die Aufhebung des Kriegsrechts gestimmt, wie Parlamentspräsident Woo Won-shi… [+5813 chars]",,de,'Krieg'
https://www.n-tv.de/politik/11-45-Rutte-verspricht-NATO-Hilfe-fuer-die-Ukraine--article23143824.html,https://www.n-tv.de/politik/11-45-Rutte-verspricht-NATO-Hilfe-fuer-die-Ukraine--article23143824.html,0,www.n-tv.de,Ukraine-Krieg im Liveticker: +++ 11:45 Rutte verspricht NATO-Hilfe für die Ukraine +++,Lesen Sie alle aktuellen Entwicklungen und Nachrichten über den russischen Angriffskrieg auf die Ukraine im Liveticker von ntv.de.,https://bilder3.n-tv.de/img/incoming/crop25117070/4231326595-cImg_16_9-w1200/Ukraine-Liveticker.jpg,2024-12-03T23:29:00Z,https://web.archive.org/web/20241204110558/https://www.n-tv.de/politik/11-45-Rutte-verspricht-NATO-Hilfe-fuer-die-Ukraine--article23143824.html,"Die NATO-Außenminister bekennen sich nach Angaben von Generalsekretär Mark Rutte auf ihrem Treffen in Brüssel eindeutig zu einer weiteren Unterstützung der Ukraine. ""Gestern Abend war man sich rund u… [+20073 chars]",,de,'Putin'
https://www.n-tv.de/politik/13-24-Tschechien-meldet-Ausfall-der-Druschba-Pipeline--article23143824.html,https://www.n-tv.de/politik/13-24-Tschechien-meldet-Ausfall-der-Druschba-Pipeline--article23143824.html,0,www.n-tv.de,Ukraine-Krieg im Liveticker: +++ 13:24 Tschechien meldet Ausfall der Druschba-Pipeline +++,Lesen Sie alle aktuellen Entwicklungen und Nachrichten über den russischen Angriffskrieg auf die Ukraine im Liveticker von ntv.de.,https://bilder3.n-tv.de/img/incoming/crop25117070/4231326595-cImg_16_9-w1200/Ukraine-Liveticker.jpg,2024-12-03T23:29:00Z,,In Tschechien kommt über den südlichen Strang der Druschba-Pipeline derzeit kein russisches Erdöl mehr an. Das teilte der tschechische Industrieminister Lukas Vlcek bei der Online-Plattform X mit. Zu… [+23527 chars],,de,'Ukraine'
https://www.n-tv.de/politik/14-41-Scholz-Entsendung-deutscher-Truppen-kommt-nicht-in-Betracht--article23143824.html,https://www.n-tv.de/politik/14-41-Scholz-Entsendung-deutscher-Truppen-kommt-nicht-in-Betracht--article23143824.html,0,www.n-tv.de,"Ukraine-Krieg im Liveticker: +++ 14:41 Scholz: Entsendung deutscher Friedenstruppen kommt ""nicht in Betracht"" +++",Lesen Sie alle aktuellen Entwicklungen und Nachrichten über den russischen Angriffskrieg auf die Ukraine im Liveticker von ntv.de.,https://bilder3.n-tv.de/img/incoming/crop25117070/4231326595-cImg_16_9-w1200/Ukraine-Liveticker.jpg,2024-12-03T23:29:00Z,,"Bundeskanzler Olaf Scholz schließt die Entsendung deutscher Bodentruppen in die Ukraine zum gegenwärtigen Zeitpunkt aus. Dies komme ""nicht in Betracht"", sagt Scholz bei der Regierungsbefragung im Deu… [+26043 chars]",,de,'Ukraine'
https://www.n-tv.de/politik/12-26-NATO-Russland-unterstuetzt-Nordkoreas-Atomprogramm-im-Gegenzug-fuer-Truppen--article23143824.html,https://www.n-tv.de/politik/12-26-NATO-Russland-unterstuetzt-Nordkoreas-Atomprogramm-im-Gegenzug-fuer-Truppen--article23143824.html,0,www.n-tv.de,Ukraine-Krieg im Liveticker: +++ 12:26 NATO: Russland unterstützt Nordkoreas Atomprogramm im Gegenzug für Truppen +++,Lesen Sie alle aktuellen Entwicklungen und Nachrichten über den russischen Angriffskrieg auf die Ukraine im Liveticker von ntv.de.,https://bilder3.n-tv.de/img/incoming/crop25117070/4231326595-cImg_16_9-w1200/Ukraine-Liveticker.jpg,2024-12-03T23:29:00Z,,"Die NATO wirft Russland Unterstützung für das nordkoreanische Atomprogramm vor. ""Im Gegenzug für Truppen und Waffen unterstützt Russland Nordkorea bei seinen Raketen- und Nuklearprogrammen"", sagt NAT… [+21406 chars]",,de,'Krieg'
https://www.n-tv.de/politik/10-56-Hybridangriffe-Spionage-Tschechien-wirft-Russland-bis-zu-100-verdaechtige-Vorfaelle-vor--article23143824.html,https://www.n-tv.de/politik/10-56-Hybridangriffe-Spionage-Tschechien-wirft-Russland-bis-zu-100-verdaechtige-Vorfaelle-vor--article23143824.html,0,www.n-tv.de,"Ukraine-Krieg im Liveticker: +++ 10:56 Hybridangriffe, Spionage - Tschechien wirft Russland bis zu 100 ""verdächtige Vorfälle"" vor +++",Lesen Sie alle aktuellen Entwicklungen und Nachrichten über den russischen Angriffskrieg auf die Ukraine im Liveticker von ntv.de.,https://bilder3.n-tv.de/img/incoming/crop25117070/4231326595-cImg_16_9-w1200/Ukraine-Liveticker.jpg,2024-12-03T23:29:00Z,,"Tschechien wirft Russland vor, für eine Vielzahl verdeckter Maßnahmen in Europa dieses Jahr verantwortlich zu sein. Russland könnten bis zu 100 ""verdächtige Vorfälle"" zugeschrieben werden, sagt der t… [+18205 chars]",,de,'Russland'
https://www.n-tv.de/politik/08-05-NATO-entwickelt-Flotte-von-See-Uberwachungsdrohnen--article23143824.html,https://www.n-tv.de/politik/08-05-NATO-entwickelt-Flotte-von-See-Uberwachungsdrohnen--article23143824.html,0,www.n-tv.de,Ukraine-Krieg im Liveticker: +++ 08:05 NATO entwickelt Flotte von See-Überwachungsdrohnen +++,Lesen Sie alle aktuellen Entwicklungen und Nachrichten über den russischen Angriffskrieg auf die Ukraine im Liveticker von ntv.de.,https://bilder3.n-tv.de/img/incoming/crop25117070/4231326595-cImg_16_9-w1200/Ukraine-Liveticker.jpg,2024-12-03T23:29:00Z,,"Die NATO beginnt mit der Planung einer eigenen Flotte unbemannter Boote zum Schutz kritischer Unterwasserinfrastruktur in der Ostsee und im Mittelmeer. Dies berichtet das Magazin ""Defense News"". Dies… [+13844 chars]",,de,'Putin'
https://www.n-tv.de/politik/15-36-Scholz-Muessen-Ukrainer-zur-Rueckkehr-oder-Arbeitsaufnahme-bewegen--article23143824.html,https://www.n-tv.de/politik/15-36-Scholz-Muessen-Ukrainer-zur-Rueckkehr-oder-Arbeitsaufnahme-bewegen--article23143824.html,0,www.n-tv.de,Ukraine-Krieg im Liveticker: +++ 15:36 Scholz: Müssen Ukrainer zur Rückkehr oder Arbeitsaufnahme bewegen +++,Lesen Sie alle aktuellen Entwicklungen und Nachrichten über den russischen Angriffskrieg auf die Ukraine im Liveticker von ntv.de.,https://bilder3.n-tv.de/img/incoming/crop25117070/4231326595-cImg_16_9-w1200/Ukraine-Liveticker.jpg,2024-12-03T23:29:00Z,,"Arbeitslose Ukrainerinnen und Ukrainer in Deutschland sollen nach dem Willen von Bundeskanzler Olaf Scholz verstärkt zur Arbeitsaufnahme oder auch zu einer Rückkehr in ihre Heimat bewegt werden. ""Zu … [+28202 chars]",,de,'Ukraine'
https://www.n-tv.de/politik/07-34-Bericht-Vor-allem-Washington-und-Berlin-sperren-sich-gegen-NATO-Mitgliedschaft-der-Ukraine--article23143824.html,https://www.n-tv.de/politik/07-34-Bericht-Vor-allem-Washington-und-Berlin-sperren-sich-gegen-NATO-Mitgliedschaft-der-Ukraine--article23143824.html,0,www.n-tv.de,Ukraine-Krieg im Liveticker: +++ 07:34 Bericht: Vor allem Washington und Berlin sperren sich gegen NATO-Mitgliedschaft der Ukraine +++,Lesen Sie alle aktuellen Entwicklungen und Nachrichten über den russischen Angriffskrieg auf die Ukraine im Liveticker von ntv.de.,https://bilder3.n-tv.de/img/incoming/crop25117070/4231326595-cImg_16_9-w1200/Ukraine-Liveticker.jpg,2024-12-03T23:29:00Z,,"Die USA und Deutschland sperren sich offenbar gegen eine NATO-Mitgliedschaft der Ukraine. Dies berichtet der ukrainische Sender Suspilne unter Berufung auf eine Quelle in dem Bündnis. ""Das Problem li… [+12759 chars]",,de,'Putin'
https://www.n-tv.de/politik/12-15-Zur-Verteidigung-gegen-Russland-Baerbock-offen-fuer-Eurobonds--article23143824.html,https://www.n-tv.de/politik/12-15-Zur-Verteidigung-gegen-Russland-Baerbock-offen-fuer-Eurobonds--article23143824.html,0,www.n-tv.de,Ukraine-Krieg im Liveticker: +++ 12:09 Zur Verteidigung gegen Russland: Baerbock offen für Eurobonds +++,Lesen Sie alle aktuellen Entwicklungen und Nachrichten über den russischen Angriffskrieg auf die Ukraine im Liveticker von ntv.de.,https://bilder3.n-tv.de/img/incoming/crop25117070/4231326595-cImg_16_9-w1200/Ukraine-Liveticker.jpg,2024-12-03T23:29:00Z,,"Zur Verteidigung gegen Russland spricht sich Bundesaußenministerin Annalena Baerbock offen für die Aufnahme neuer EU-Gemeinschaftsschulden aus. Diese sogenannten Euro-Bonds müsse man ""intensiv diskut… [+20920 chars]",,de,'Russland'
https://www.n-tv.de/politik/16-23-Russlandexperte-Karasek-Dass-sich-Putin-an-Waffenstillstand-haelt-ist-eine-Maer--article23143824.html,https://www.n-tv.de/politik/16-23-Russlandexperte-Karasek-Dass-sich-Putin-an-Waffenstillstand-haelt-ist-eine-Maer--article23143824.html,0,www.n-tv.de,Ukraine-Krieg im Liveticker: +++ 16:01 Papst spricht mit Orban über Ukraine +++,Lesen Sie alle aktuellen Entwicklungen und Nachrichten über den russischen Angriffskrieg auf die Ukraine im Liveticker von ntv.de.,https://bilder3.n-tv.de/img/incoming/crop25117070/4231326595-cImg_16_9-w1200/Ukraine-Liveticker.jpg,2024-12-03T23:29:00Z,https://web.archive.org/web/20241204163715/https://www.n-tv.de/politik/16-23-Russlandexperte-Karasek-Dass-sich-Putin-an-Waffenstillstand-haelt-ist-eine-Maer--article23143824.html,"Für Russlandexperten Niko Karasek ist es momentan für ausgeschlossen, sich auf Zusagen irgendeiner Art aus dem Kreml zu verlassen. Die Errichtung einer Friedenszone hält er mit Blick auf die Länge de… [+29002 chars]",,de,'Krieg'
