index,url,valid,domain,title,description,image,published,archive,content,quote,language,keyword
https://www.tagesschau.de/wirtschaft/weltwirtschaft/grossbritannien-inflation-zinswende-100.html,https://www.tagesschau.de/wirtschaft/weltwirtschaft/grossbritannien-inflation-zinswende-100.html,0,www.tagesschau.de,"Britische Inflation geht im April deutlich zurück auf 2,3 Prozent",Die Inflation in Großbritannien ist weiter abgesunken und hat den tiefsten Stand seit fast drei Jahren erreicht. Gedrückt wurde sie durch fallende Gas- und Strompreise. Eine Zinssenkung der Bank of England rückt in greifbare Nähe.,https://images.tagesschau.de/image/f6864a27-5ee5-44cf-96cc-339e9d944c87/AAABibtj-fA/AAABjwnlFvA/16x9-1280/bank-of-england-126.jpg,2024-05-22T10:02:00Z,,"Stand: 22.05.2024 12:02 Uhr
Die Inflation in Großbritannien ist weiter abgesunken und hat den tiefsten Stand seit fast drei Jahren erreicht. Gedrückt wurde sie durch fallende Gas- und Strompreise. E… [+1981 chars]",,de,'Inflation'
https://www.focus.de/experts/psychologin-erklaert-wie-sie-aengste-in-den-griff-bekommen-und-lebensfreude-zurueckgewinnen_id_259953675.html,https://www.focus.de/experts/psychologin-erklaert-wie-sie-aengste-in-den-griff-bekommen-und-lebensfreude-zurueckgewinnen_id_259953675.html,0,www.focus.de,Lebensfreude zurückgewinnen - Psychologin: So lassen Sie sich nicht zum Sklaven Ihrer Angst machen,"Erinnern Sie sich noch an die ersten Tage nach der Nachricht, dass Putin die Ukraine angegriffen hat? Der Krieg in Europa konfrontierte viele von uns mit tiefen Urängsten. Psychologin Martina Lackners sagt, wie wir mit Ängsten wie diesen umgehen sollten.Von F…",https://p6.focus.de/img/fotos/id_259965935/gettyimages-1542325475.jpg?im=Crop%3D%280%2C288%2C3464%2C1732%29%3BResize%3D%281200%2C627%29&impolicy=perceptual&quality=mediumHigh&hash=d7270b0723cb43c9c1421e7fd6551ab6519493c7ee8b87b8f4e5297b5bb6308b,2024-05-22T10:43:42Z,,"<ul><li>
Kommentare</li><li>
E-Mail</li><li>
Teilen</li><li>
Mehr</li><li>
Twitter</li><li>
Drucken</li><li>
Feedback</li><li>
Fehler meldenSie haben einen Fehler gefunden?
Bitte markieren S… [+7422 chars]",,de,'Ukraine'
https://www.diepresse.com/18488841/iv-praesident-knill-made-in-austria-koennen-sich-viele-kunden-nicht-mehr-leisten,https://www.diepresse.com/18488841/iv-praesident-knill-made-in-austria-koennen-sich-viele-kunden-nicht-mehr-leisten,0,www.diepresse.com,IV-Präsident Knill: „Made in Austria können sich viele Kunden nicht mehr leisten“,Heimische Industrieprodukte werden im internationalen Vergleich wegen hoher KV-Abschlüsse und hoher Energiekosten teurer. IV-Präsident Georg Knill warnt vor dem „Schreckgespenst“ Deindustrialisierung.,https://img.diepresse.com/public/incoming/9omqpn-30621a011.jpg/alternates/DPR_SOCIAL_NACHRICHTEN/30621a011.jpg,2024-05-22T11:29:34Z,,Heimische Industrieprodukte werden im internationalen Vergleich wegen hoher KV-Abschlüsse und hoher Energiekosten teurer. IV-Präsident Georg Knill warnt vor dem Schreckgespenst Deindustrialisierung.,,,
https://www.zeit.de/news/2024-05/22/wirtschaft-in-mv-will-mit-oekostrom-energiekosten-senken,https://www.zeit.de/news/2024-05/22/wirtschaft-in-mv-will-mit-oekostrom-energiekosten-senken,0,www.zeit.de,Industrie: Wirtschaft in MV will mit Ökostrom Energiekosten senken,Hier finden Sie Informationen zu dem Thema „Industrie“. Lesen Sie jetzt „Wirtschaft in MV will mit Ökostrom Energiekosten senken“.,https://img.zeit.de/news/2024-05/22/wirtschaft-in-mv-will-mit-oekostrom-energiekosten-senken-image-group/wide__1300x731,2024-05-22T13:09:13Z,,Die Wirtschaft in Mecklenburg-Vorpommern will den im Land gewonnenen Ökostrom verstärkt selbst nutzen und so ihre Stromkosten verringern. «Die Möglichkeiten zur Eigennutzung der regional erzeugten er… [+2993 chars],,de,'Energiekosten'
https://www.zeit.de/news/2024-05/22/weiterer-baer-aus-der-ukraine-im-baerenpark-worbis,https://www.zeit.de/news/2024-05/22/weiterer-baer-aus-der-ukraine-im-baerenpark-worbis,0,www.zeit.de,Tiere: Weiterer Bär aus der Ukraine im Bärenpark Worbis,Hier finden Sie Informationen zu dem Thema „Tiere“. Lesen Sie jetzt „Weiterer Bär aus der Ukraine im Bärenpark Worbis“.,https://img.zeit.de/news/2024-05/22/weiterer-baer-aus-der-ukraine-im-baerenpark-worbis-image-group/wide__1300x731,2024-05-22T14:28:17Z,,"Zugang aus der Ukraine für den Alternativen Bärenpark in Worbis: Bär Mykhailo ist am Mittwoch im Eichsfeld eingetroffen, sagte Christopher Schmidt vom Träger des Parks, der Stiftung für Bären. Es sei… [+1562 chars]",,de,'Ukraine'
https://www.zeit.de/2024/23/armut-deutschland-sozialstaat-caritas-georg-cremer-verena-bentele,https://www.zeit.de/2024/23/armut-deutschland-sozialstaat-caritas-georg-cremer-verena-bentele,0,www.zeit.de,Armut in Deutschland: Rechnen wir uns arm?,"Der Sozialstaat ist besser als sein Ruf – wir messen nur die Armut falsch, sagt der ehemalige Caritas-Generalsekretär Georg Cremer.",https://img.zeit.de/2024/23/rechnen-wir-uns-arm-bild-3/wide__1300x731,2024-05-22T14:49:25Z,,"DIE ZEIT: Nach Daten des Statistischen Bundesamtes ist jeder fünfte Deutsche von Armut oder sozialer Ausgrenzung bedroht. Von ""schockierenden Zahlen"" ist in Kommentaren die Rede. Herr Cremer, sehen S… [+676 chars]",,de,'Armut'
https://www.faz.net/aktuell/wirtschaft/hohe-kosten-belasten-die-investitionen-in-deutschland-19736340.html,https://www.faz.net/aktuell/wirtschaft/hohe-kosten-belasten-die-investitionen-in-deutschland-19736340.html,0,www.faz.net,Hohe Kosten belasten die Investitionen in Deutschland,"Das schlechte gesamtwirtschaftliche Umfeld, die hohen Energiekosten und die hohen Lohnkosten – das sind die wichtigsten Gründe dafür, dass Unternehmen im vergangenen Jahr in Deutschland weniger investiert haben.",https://media1.faz.net/ppmedia/aktuell/wirtschaft/796533497/1.9736757/facebook_teaser/im-mercedes-benz-werk-im-baden.jpg,2024-05-22T14:58:51Z,,"Weitere Gründe mit Bedeutung waren der Arbeits- und Fachkräftemangel, die Unsicherheit über den regulatorischen Rahmen und die hohe Steuer- und Abgabenlast. Je rund ein Drittel der Unternehmen bezeic… [+3027 chars]",,de,'Energiekosten'
https://www.faz.net/aktuell/politik/ausland/russland-uebt-mit-nuklearwaffen-was-erhofft-sich-wladimir-putin-19736384.html,https://www.faz.net/aktuell/politik/ausland/russland-uebt-mit-nuklearwaffen-was-erhofft-sich-wladimir-putin-19736384.html,0,www.faz.net,Putins Nuklearmanöver: Einschüchtern mit Iskander und Kinschal,Russland lässt nahe der ukrainischen Grenze den Einsatz taktischer Nuklearwaffen üben. Moskau spricht von einer „erzwungenen“ Maßnahme.,https://media1.faz.net/ppmedia/aktuell/politik/50810936/1.9736383/facebook_teaser/attrappen-oder-echte-nukleare.jpg,2024-05-22T19:20:10Z,,"Laut dem Ministerium begann am Dienstag die erste von drei Phasen eines am 6. Mai angekündigten Manövers, mit dem die Gefechtsbereitschaft und die Anwendung taktischer Nuklearwaffen getestet werden s… [+7157 chars]",,de,'Russland'
https://www.zeit.de/politik/2024-05/russland-ukraine-deutschland-g7-eingefrorene-vermoegen,https://www.zeit.de/politik/2024-05/russland-ukraine-deutschland-g7-eingefrorene-vermoegen,0,www.zeit.de,G7-Treffen: Bundesregierung lehnt Verwendung eingefrorener russischer Vermögen ab,"Die Finanzierung der Ukraine wird Thema des G7-Gipfels Ende der Woche. Die USA wollen eingefrorenes russisches Vermögen ganz einziehen, Deutschland nur die Erträge.",https://img.zeit.de/politik/deutschland/2024-05/eingefrorenes-russisches-vermoegen-ukraine-bild/wide__1300x731,2024-05-22T19:27:29Z,,"Die Bundesregierung hat sich gegen US-Pläne ausgesprochen, eingefrorene russische Guthaben für die Ukraine zu nutzen. ""Es bleibt unsere Position: Es geht um die Erträge aus den eingefrorenen Vermögen… [+3070 chars]",,de,'Ukraine'
https://www.iphoneblog.de/2024/05/22/bebop-keine-angst-mehr-einen-gedanken-zu-verlieren/,https://www.iphoneblog.de/2024/05/22/bebop-keine-angst-mehr-einen-gedanken-zu-verlieren/,0,www.iphoneblog.de,„Bebop“ – keine Angst mehr einen Gedanken zu verlieren,"Alles, was ich hier ins Blog schreibe, startete in Ulysses. Schnell lässt sich dort jedoch nichts festhalten. Die App benötigt einige Sekunden, um zu starten; bis ein neues Blatt angelegt ist, klammere ich mich ängstlich an meinen einen Gedanken, den ich fest…",https://www.iphoneblog.de/wp-content/uploads/2024/05/image-22.5.2024-22.15.jpeg,2024-05-22T19:42:29Z,,"Alles, was ich hier ins Blog schreibe, startete in Ulysses. Schnell lässt sich dort jedoch nichts festhalten. Die App benötigt einige Sekunden, um zu starten; bis ein neues Blatt angelegt ist, klamme… [+1042 chars]",,de,'Angst'
https://www.faz.net/aktuell/feuilleton/buecher/ingolfuhr-bluehdorns-unhaltbarkeit-19715951.html,https://www.faz.net/aktuell/feuilleton/buecher/ingolfuhr-bluehdorns-unhaltbarkeit-19715951.html,0,www.faz.net,Ingolfuhr Blühdorns „Unhaltbarkeit“,"Für den Nachhaltigkeitsforscher Ingolfuhr Blühdorn sind es nicht so sehr Gefährdungen von außen, die das liberaldemokratische Projekt angreifen. Es sind Gefährdungen von innen, die dazu führen, dass sich ursprünglich gut gemeinte Prozesse der Ausweitung liber…",https://media0.faz.net/ppmedia/aktuell/3628113850/1.9715950/facebook_teaser/auch-eine-oekoemanzipatorische.jpg,2024-05-22T20:44:45Z,,Der Wiener Nachhaltigkeitsforscher Ingolfur Blühdorn aber setzt in seinem neuen Buch Unhaltbarkeiten: Auf dem Weg in eine andere Moderne den Pinsel an einer anderen Stelle an. Es sind nicht so sehr G… [+6842 chars],,de,'Gefährdung'
https://www.welt.de/podcasts/alles-auf-aktien/article251641326/Boersen-Podcast-Nvidia-ueber-1000-Dollar-was-Anleger-jetzt-wissen-muessen.html,https://www.welt.de/podcasts/alles-auf-aktien/article251641326/Boersen-Podcast-Nvidia-ueber-1000-Dollar-was-Anleger-jetzt-wissen-muessen.html,0,www.welt.de,Nvidia über 1000 und die plötzliche Solar-Wasserstoff-Rallye,"In der heutigen Folge von „Alles auf Aktien“ sprechen die Finanzjournalisten Nando Sommerfeldt und Holger Zschäpitz über auffällige Gewinne bei den Impfstoffaktien, Zoll-Frust bei den Autobauern und Silber-Gewinne im Schatten des Goldes.",https://img.welt.de/img/podcasts/alles-auf-aktien/mobile246304624/0521353177-ci16x9-w1200/Zschae-Nando-DWO-Podcast-Teaser-AllesAufAktien-mit-2zu3-zschaepitz-sommerfeld.jpg,2024-05-23T02:57:07Z,,"Außerdem geht es um BMW, Mercedes, BASF, Covestro, Aurubis, Target, Invesco Solar ETF (WKN: A2QQ9R), Maxeon Solar, First Solar, Jinko Solar, Global X Hydrogen ETF (WKN: A3E40P), Bloom Energy, Plug Po… [+740 chars]",,de,'Solar'
https://www.faz.net/aktuell/politik/ukraine-liveticker-tschetschenischer-machthaber-kadyrow-bietet-putin-weitere-truppen-an-19030454.html,https://www.faz.net/aktuell/politik/ukraine-liveticker-tschetschenischer-machthaber-kadyrow-bietet-putin-weitere-truppen-an-19030454.html,0,www.faz.net,Ukraine-Liveticker: Tschetschenischer Machthaber Kadyrow bietet Putin weitere Truppen an,"Ukraine lässt erstmals Häftlinge für Kriegseinsatz frei +++ Deutschland, Frankreich und Polen wollen Sicherheitspolitik bündeln +++ Micael Byden warnt: „Putin hat beide Augen auf Gotland geworfen“ +++ alle Entwicklungen im Liveblog",https://media1.faz.net/ppmedia/aktuell/politik/2552459390/1.9737423/facebook_teaser/russlands-praesident-wladimir.jpg,2024-05-23T03:18:09Z,,"Der Oberbefehlshaber der schwedischen Streitkräfte, Micael Byden, hat vor den russischen Machtambitionen in der Ostsee gewarnt. Ich bin sicher, dass (Präsident Wladimir) Putin sogar beide Augen auf G… [+1503 chars]",,de,'Putin'
https://vorarlberg.orf.at/stories/3258195/,https://vorarlberg.orf.at/stories/3258195/,0,vorarlberg.orf.at,Studie: Windkraft für neun Vogelarten sehr gefährlich,"Das Land Vorarlberg hat untersuchen lassen, welche Vogelarten von möglichen Windkraft-Anlagen bedroht wären. Die Studie der Naturschutzorganisation Birdlife Österreich sieht bei neun Vogelarten eine sehr große Gefahr. Davon sind aber nicht alle in Vorarlberg …",https://ibs.orf.at/vbg?image=https%3A%2F%2Foekastatic.orf.at%2Fmims%2F2020%2F20%2F83%2Fcrops%2Fw%3D1200%2Ch%3D627%2Cq%3D75%2F562037_master_191383_rotmilan_c_matthiasschmidt.jpg%3Fs%3Db624594d1350b45a1725a26328b3c2c402a1d8a4,2024-05-23T03:57:52Z,,"Noch gibt es keine großen Windkraft-Anlagen in Vorarlberg, aber mögliche Standorte dafür werden seit längerem geprüft. Das Land hat bei Birdlife Österreich eine Studie in Auftrag gegeben, welche Voge… [+828 chars]",,de,'Windkraft'
https://www.golem.de/sonstiges/zustimmung/auswahl.html?from=https://www.golem.de/news/sea-baby-ukraine-baut-drohnenboote-mit-mehrfachraketenwerfer-2405-185354.html&referer=https://t.co/8c62da315d,https://www.golem.de/sonstiges/zustimmung/auswahl.html?from=https://www.golem.de/news/sea-baby-ukraine-baut-drohnenboote-mit-mehrfachraketenwerfer-2405-185354.html&referer=https://t.co/8c62da315d,0,www.golem.de,Sea Baby: Ukraine baut Drohnenboote mit Mehrfachraketenwerfer,"Die Ukraine hat mit Raketen bestückte Drohnenboote vorgestellt - deren militärischer Nutzen eher gering sein dürfte. (Ukrainekrieg, Politik)",,2024-05-23T05:42:05Z,,"Besuchen Sie Golem.de wie gewohnt mit Werbung und Tracking,
 indem Sie der Nutzung aller Cookies zustimmen.
 Details zum Tracking finden Sie im Privacy Center.
Skript wurde nicht geladen. Informat… [+607 chars]",,de,'Ukraine'
https://www.faz.net/aktuell/politik/ukraine-liveticker-blinken-will-ukraine-offenbar-erlauben-us-waffen-auf-russland-abzufeuern-19030454.html,https://www.faz.net/aktuell/politik/ukraine-liveticker-blinken-will-ukraine-offenbar-erlauben-us-waffen-auf-russland-abzufeuern-19030454.html,0,www.faz.net,"Ukraine-Liveticker: Blinken will Ukraine offenbar erlauben, US-Waffen auf Russland abzufeuern","Kadyrow bietet Putin weitere Truppen an +++ Ukraine lässt Häftlinge für Kriegseinsatz frei +++ Deutschland, Frankreich und Polen wollen Sicherheitspolitik bündeln +++ alle Entwicklungen im Liveblog",https://media0.faz.net/ppmedia/aktuell/politik/2845177788/1.9737666/facebook_teaser/aussenminister-antony-blinken.jpg,2024-05-23T06:37:47Z,,"Der Oberbefehlshaber der schwedischen Streitkräfte, Micael Byden, hat vor den russischen Machtambitionen in der Ostsee gewarnt. Ich bin sicher, dass (Präsident Wladimir) Putin sogar beide Augen auf G… [+1503 chars]",,de,'Krieg'
https://taz.de/Neuwahlen-in-Grossbritannien/!6012369/,https://taz.de/Neuwahlen-in-Grossbritannien/!6012369/,0,taz.de,Neuwahlen in Großbritannien: Sunak geht voll auf Risiko,Der britische Premierminister Rishi Sunak kündigt trotz großen Rückstands in den Umfragen überraschend Unterhauswahlen für den 4. Juli an.,https://taz.de/picture/7016112/948/35395213-1.jpeg,2024-05-23T06:55:00Z,,"Der britische Premierminister Rishi Sunak kündigt trotz großen Rückstands in den Umfragen überraschend Unterhauswahlen für den 4. Juli an.
Spricht in strömendem Regen von seinen Errungenschaften: Ri… [+2968 chars]",,de,'Risiko'
https://www.faz.net/aktuell/feuilleton/steckt-russland-hinter-der-antisemitischen-farbattacke-in-paris-19738266.html,https://www.faz.net/aktuell/feuilleton/steckt-russland-hinter-der-antisemitischen-farbattacke-in-paris-19738266.html,0,www.faz.net,Antisemitismus in Frankreich: Steckt Russland hinter den Bluthänden?,"Die Schändung des Pariser Holocaust-Mahnmals sorgte für Entsetzen – nun gibt es neue Erkenntnisse der Polizei, die auf russische Hintermänner der Farbattacke hindeuten.",https://media0.faz.net/ppmedia/aktuell/politik/3638989024/1.9721852/facebook_teaser/eine-schmierkampagne-und-ihre.jpg,2024-05-23T11:25:30Z,,"Ein antisemitischer Tabubruch
Die Polizei fand demnach die Kopie eines Reisepasses von einem der Männer in ihrem Unterschlupf, einem Hotel im 20. Arrondissement von Paris. Kurz nach der Tat sollen d… [+2095 chars]",,de,'Russland'
https://www.faz.net/aktuell/politik/ukraine-liveticker-mehrere-tote-und-verletzte-nach-angriff-auf-charkiw-19030454.html,https://www.faz.net/aktuell/politik/ukraine-liveticker-mehrere-tote-und-verletzte-nach-angriff-auf-charkiw-19030454.html,0,www.faz.net,Ukraine-Liveticker: Mehrere Tote und Verletzte nach Angriff auf Charkiw,"Blinken will Ukraine offenbar erlauben, US-Waffen auf Russland abzufeuern +++ Hauptstromleitung in Kernkraftwerk Saporischschja ausgefallen +++ Russland meldet Drohnenangriff in Tartastan +++ alle Entwicklungen im Liveblog",https://media0.faz.net/ppmedia/aktuell/politik/2386544287/1.9739650/facebook_teaser/nach-dem-russischen-angriff.jpg,2024-05-23T16:25:38Z,,Schon zuvor war Tatarstan Ziel von Drohnenangriffen aus der Ukraine gewesen. Auch dabei hatte der Flughafen in Kasan zeitweilig seinen Betrieb unterbrochen. Mehrere Unternehmen in Tatarstan verfügten… [+475 chars],,de,'Ukraine'
https://www.n-tv.de/mediathek/videos/politik/USA-erwaegen-eigenes-Militaer-in-die-Ukraine-zu-entsenden-article24962327.html,https://www.n-tv.de/mediathek/videos/politik/USA-erwaegen-eigenes-Militaer-in-die-Ukraine-zu-entsenden-article24962327.html,0,www.n-tv.de,"Einmischung zu Ausbildungszwecken: USA erwägen, eigenes Militär in die Ukraine zu entsenden","Eigentlich dürfen aus den USA an die Ukraine gelieferte Waffen nur innerhalb der Ukraine eingesetzt werden. Nun wollen die USA offenbar von der Regel abrücken. Laut Medienberichten arbeitet das US-Außenministerium an einem Vorschlag, der vorsieht, dass die Uk…",https://bilder2.n-tv.de/img/incoming/crop24962505/771132810-cImg_16_9-w1200/usaukraine.jpg,2024-05-23T16:33:39Z,,,,de,'Ukraine'
https://www.focus.de/panorama/flugverbot-tausende-beamte-reiseverkehr-neue-bedrohungslagen-worauf-sich-besucher-bei-der-heim-em-einstellen-muessen_id_259969721.html,https://www.focus.de/panorama/flugverbot-tausende-beamte-reiseverkehr-neue-bedrohungslagen-worauf-sich-besucher-bei-der-heim-em-einstellen-muessen_id_259969721.html,0,www.focus.de,"Flugverbot, Tausende Beamte, Reiseverkehr - „Neue Bedrohungslagen“: Worauf sich Besucher bei der Heim-EM einstellen müssen","In rund drei Wochen beginnt die Heim-Europameisterschaft in Deutschland mit dem Auftaktspiel der deutschen Mannschaft gegen Schottland. Damit das Turnier ein Fest wird, setzt die Polizei höchste Sicherheitsmaßstäbe. Besucher und Einwohner müssen sich auf zahl…",https://p6.focus.de/img/regional/stuttgart/id_259969720/drohnenverbot-tausende-beamte-und-zwei-hochrisikospiele.jpg?im=Crop%3D%280%2C60%2C1920%2C960%29%3BResize%3D%281200%2C627%29&impolicy=perceptual&quality=mediumHigh&hash=5dd551306a06b7f8c24ed0e17c6787c40cb8398d3c9c9826a404f6b35b70359e,2024-05-23T17:05:34Z,,"In rund drei Wochen beginnt die Heim-Europameisterschaft in Deutschland mit dem Auftaktspiel der deutschen Mannschaft gegen Schottland. Damit das Turnier ein Fest wird, setzt die Polizei höchste Sich… [+6370 chars]",,de,'Ukraine'
https://www.tagesspiegel.de/politik/keine-pramien-fur-fahnenfluchtige-bayerns-innenminister-fordert-ende-des-burgergelds-fur-gefluchtete-ukrainer-11707553.html,https://www.tagesspiegel.de/politik/keine-pramien-fur-fahnenfluchtige-bayerns-innenminister-fordert-ende-des-burgergelds-fur-gefluchtete-ukrainer-11707553.html,0,www.tagesspiegel.de,„Keine Prämien für Fahnenflüchtige“: Bayerns Innenminister fordert Ende des Bürgergelds für geflüchtete Ukrainer,"Dem CSU-Politiker Joachim Herrmann zufolge soll den ukrainischen Geflüchteten kein Bürgergeld mehr gezahlt werden. Die Anreize, wegen der Unterstützung nicht zu arbeiten, seien zu groß.",https://www.tagesspiegel.de/images/innenminister-herrmann/alternates/BASE_16_9_W1400/innenminister-herrmann.jpeg,2024-05-23T17:08:59Z,,Bayerns Innenminister Joachim Herrmann fordert bei einer Verlängerung des Schutzstatus für ukrainische Flüchtlinge ein Ende des Bürgergelds. Der CSU-Politiker sagte am Donnerstag dem Nachrichtensende… [+1792 chars],,de,'Ukraine'
https://www.zeit.de/news/2024-05/23/herrmann-kein-buergergeld-fuer-fahnenfluechtige-ukrainer,https://www.zeit.de/news/2024-05/23/herrmann-kein-buergergeld-fuer-fahnenfluechtige-ukrainer,0,www.zeit.de,Flüchtlinge: Herrmann: kein Bürgergeld für fahnenflüchtige Ukrainer,Hier finden Sie Informationen zu dem Thema „Flüchtlinge“. Lesen Sie jetzt „Herrmann: kein Bürgergeld für fahnenflüchtige Ukrainer“.,https://img.zeit.de/news/2024-05/23/herrmann-kein-buergergeld-fuer-fahnenfluechtige-ukrainer-image-group/wide__1300x731,2024-05-23T17:12:05Z,,Bayerns Innenminister Joachim Herrmann fordert bei einer Verlängerung des Schutzstatus für ukrainische Flüchtlinge ein Ende des Bürgergelds. Der CSU-Politiker sagte am Donnerstag dem Nachrichtensende… [+1980 chars],,de,'Ukraine'
https://www.n-tv.de/mediathek/videos/politik/Thiele-Wir-setzen-den-Risikolevel-hoch-article24962745.html,https://www.n-tv.de/mediathek/videos/politik/Thiele-Wir-setzen-den-Risikolevel-hoch-article24962745.html,0,www.n-tv.de,"US-Soldaten in der Ukraine?: Thiele: ""Wir setzen den Risikolevel hoch""","Dass die USA einen Einsatz eigener Soldaten im Ukraine-Krieg erwägen, steigert laut Ralph Thiele die Gefahr einer Kriegsausweitung. Und dass das Weiße Haus nun solche Schritte bedenkt, hat laut dem Militärexperten mit einem ""Verschlafen"" bei den Waffenlieferu…",https://bilder2.n-tv.de/img/incoming/crop24963061/7811328099-cImg_16_9-w1200/thiele.jpg,2024-05-23T17:19:26Z,,,,de,'Ukraine'
https://www.zeit.de/politik/2024-05/estland-russland-bojen-grenzfluss,https://www.zeit.de/politik/2024-05/estland-russland-bojen-grenzfluss,0,www.zeit.de,Fluss Narva: Russland soll Bojen aus Grenzfluss zu Estland entfernt haben,"Estland beschuldigt den russischen Grenzschutz, Bojen aus dem Fluss Narva beseitigt zu haben. Nach estnischen Informationen markierten diese Schifffahrtsrouten.",https://img.zeit.de/politik/ausland/2024-05/estland-russland-bojen-grenzfluss-bild/wide__1300x731,2024-05-23T17:23:26Z,,Russland soll nach Darstellung des Nato-Mitglieds Estland mehrere im gemeinsamen Grenzfluss Narva schwimmende Bojen entfernt haben. Nach Angaben der estnischen Polizei- und Grenzschutzbehörde nahmen … [+2146 chars],,de,'Russland'
https://www.n-tv.de/politik/Russland-entfernt-estnische-Navigationsbojen-aus-Grenzfluss-article24962918.html,https://www.n-tv.de/politik/Russland-entfernt-estnische-Navigationsbojen-aus-Grenzfluss-article24962918.html,0,www.n-tv.de,"""Weiterer Akt der Provokation"": Russland entfernt estnische Navigationsbojen aus Grenzfluss","Um den Grenzverlauf zu markieren, positioniert Estland Bojen in der Narva. Doch in den frühen Morgenstunden entfernen russische Grenzer viele der Schwimmkörper aus dem Fluss. Die Regierung in Tallin spricht von einer Provokation.",https://bilder1.n-tv.de/img/incoming/crop24963008/9841329580-cImg_16_9-w1200/GORoeMDXkAAkpuS.jpg,2024-05-23T17:34:05Z,,"Um den Grenzverlauf zu markieren, positioniert Estland Bojen in der Narva. Doch in den frühen Morgenstunden entfernen russische Grenzer viele der Schwimmkörper aus dem Fluss. Die Regierung in Tallin … [+2990 chars]",,de,'Russland'
https://www.bild.de/politik/granaten-kommen-voellig-ueberraschend-toedliche-nacht-drohnen-im-einsatz-664f3a45bade7176939c2cf3,https://www.bild.de/politik/granaten-kommen-voellig-ueberraschend-toedliche-nacht-drohnen-im-einsatz-664f3a45bade7176939c2cf3,0,www.bild.de,Granaten kommen völlig überraschend - Tödliche Nacht-Drohnen im Einsatz,Lagezentrum: Russland und die Ukraine haben neue Truppen in die Schlacht um die nordostukrainische Stadt Wowtschansk verlegt. Der ehemalige 19.000-Einwoh...,"https://images.bild.de/664f3a45bade7176939c2cf3/e73f6923d91b90e84099f64a6dcfea64,fba7e492?w=1280",2024-05-23T17:35:38Z,,"Mehr zum Video anzeigen 
Lagezentrum: Russland und die Ukraine haben neue Truppen in die Schlacht um die nordostukrainische Stadt Wowtschansk verlegt. Der ehemalige 19.000-Einwohner-Ort wird seit de… [+224 chars]",,de,'Ukraine'
https://www.jungewelt.de/artikel/475960.klimakrise-profitable-energiewende.html,https://www.jungewelt.de/artikel/475960.klimakrise-profitable-energiewende.html,0,www.jungewelt.de,Klimakrise: Profitable Energiewende,Brasilien: Fast alle Wind- und Solarparks in der Hand globaler Investoren. Großprojekte treiben auch Landgrabbing voran • Foto: Pond5 Images/IMAGO,https://www.jungewelt.de/img/1100/195254.jpg,2024-05-23T17:37:04Z,,In Brasilien ist der Ausbau der Wind- und Solarenergie in jüngster Zeit gut vorangekommen. Im Jahr 2023 gingen fast fünf Gigawatt (GW) neue Windkraft- und gut vier GW neue Solarstromleistung ans Netz… [+3861 chars],,de,'Solar'
https://www.jungewelt.de/artikel/475933.nato-in-den-alpen-panzerhaubitzen-auf-durchfahrt.html,https://www.jungewelt.de/artikel/475933.nato-in-den-alpen-panzerhaubitzen-auf-durchfahrt.html,0,www.jungewelt.de,NATO in den Alpen: Panzerhaubitzen auf Durchfahrt,Ob Truppen oder Kriegsgerät: Alpenrepubliken dienen der NATO-Logistik • Foto: IMAGO/ZUMA Wire,https://www.jungewelt.de/img/1100/195258.jpg,2024-05-23T17:37:04Z,,"Manchmal reicht es schon, nichts zu tun und ein wenig wegzuschauen, um eine militärisch wichtige Aufgabe zu erfüllen. Österreichs Regierung ist darin gewöhnlich recht gut. So zum Beispiel im April ve… [+2322 chars]",,de,'Ukraine'
