index,url,valid,domain,title,description,image,published,archive,content,quote,language,keyword
https://www.n-tv.de/politik/17-54-London-50-000-ukrainische-Kinder-bei-Universitaets-Sessions-indoktriniert--article23143824.html,https://www.n-tv.de/politik/17-54-London-50-000-ukrainische-Kinder-bei-Universitaets-Sessions-indoktriniert--article23143824.html,0,www.n-tv.de,"Ukraine-Krieg im Liveticker: +++ 17:54 London: 50.000 ukrainische Kinder bei ""Universitäts-Sessions"" indoktriniert +++",Lesen Sie alle aktuellen Entwicklungen und Nachrichten über den russischen Angriffskrieg auf die Ukraine im Liveticker von ntv.de.,https://www.n-tv.de/img/incoming/crop25117070/8311326854-cImg_16_9-w1200/Ukraine-Liveticker.jpg,2025-09-05T22:12:00Z,,"Laut britischen Geheimdiensten werden ukrainische Jugendliche in den russisch besetzten Gebieten weiterhin politisch indoktriniert. Als ein Beispiel nennt das ""Geheimdienst-Update"" aus London die sog… [+19498 chars]",,de,'Putin'
https://www.n-tv.de/politik/07-56-Kiews-Geheimdienst-Russen-koennen-2700-Kampfdrohnen-pro-Monat-bauen--article23143824.html,https://www.n-tv.de/politik/07-56-Kiews-Geheimdienst-Russen-koennen-2700-Kampfdrohnen-pro-Monat-bauen--article23143824.html,0,www.n-tv.de,Ukraine-Krieg im Liveticker: +++ 07:56 Kiews Geheimdienst: Russen können 2700 Kampfdrohnen pro Monat bauen +++,Lesen Sie alle aktuellen Entwicklungen und Nachrichten über den russischen Angriffskrieg auf die Ukraine im Liveticker von ntv.de.,https://www.n-tv.de/img/incoming/crop25117070/8311326854-cImg_16_9-w1200/Ukraine-Liveticker.jpg,2025-09-05T22:12:00Z,,"Russlands Rüstungsindustrie ist nach ukrainischer Analyse inzwischen in der Lage, pro Monat 2700 Geran 2-Kamikazedrohnen zu bauen. So lautet die gegenwärtige Einschätzung von Kiews Militärgeheimdiens… [+7232 chars]",,de,'Putin'
https://www.n-tv.de/politik/22-04-Kiew-will-Flugabwehr-auch-mit-heimischer-Produktion-staerken-Das-ist-eine-Herausforderung--article23143824.html,https://www.n-tv.de/politik/22-04-Kiew-will-Flugabwehr-auch-mit-heimischer-Produktion-staerken-Das-ist-eine-Herausforderung--article23143824.html,0,www.n-tv.de,"Ukraine-Krieg im Liveticker: +++ 22:04 Kiew will Flugabwehr auch mit heimischer Produktion stärken: ""Das ist eine Herausforderung"" +++",Lesen Sie alle aktuellen Entwicklungen und Nachrichten über den russischen Angriffskrieg auf die Ukraine im Liveticker von ntv.de.,https://www.n-tv.de/img/incoming/crop25117070/8311326854-cImg_16_9-w1200/Ukraine-Liveticker.jpg,2025-09-05T22:12:00Z,,"Nach einem erneuten Anflug russischer Drohnen auf verschiedene Ziele in der Ukraine betont Präsident Selenskyj einmal mehr die Notwendigkeit des weiteren Ausbaus der Flugabwehr. ""Zu den wichtigsten P… [+24441 chars]",,de,'Ukraine'
https://www.n-tv.de/politik/05-36-Ukrainer-verkuenden-Rettung-von-Soldaten-die-sich-drei-Jahre-versteckten--article23143824.html,https://www.n-tv.de/politik/05-36-Ukrainer-verkuenden-Rettung-von-Soldaten-die-sich-drei-Jahre-versteckten--article23143824.html,0,www.n-tv.de,"Ukraine-Krieg im Liveticker: +++ 05:36 Ukrainer verkünden Rettung von Soldaten, die sich drei Jahre versteckten +++",Lesen Sie alle aktuellen Entwicklungen und Nachrichten über den russischen Angriffskrieg auf die Ukraine im Liveticker von ntv.de.,https://www.n-tv.de/img/incoming/crop25117070/8311326854-cImg_16_9-w1200/Ukraine-Liveticker.jpg,2025-09-05T22:12:00Z,,"Das ukrainische Militär verkündet, vier seiner Soldaten aus russisch besetztem Gebiet gerettet zu haben. Die Soldaten - ein Marinesoldat und drei Soldaten der Nationalgarde - hätten sich mehr als dre… [+4468 chars]",,de,'Ukraine'
https://www.zeit.de/politik/ausland/2025-09/g20-2026-donald-trump-golfclub-miami,https://www.zeit.de/politik/ausland/2025-09/g20-2026-donald-trump-golfclub-miami,0,www.zeit.de,US-Präsident: Trump will G20 im eigenen Golfclub in Miami veranstalten,Der G20-Gipfel im kommenden Jahr soll nach dem Willen von US-Präsident Donald Trump in dessen Golfresort in Miami stattfinden. Einladen möchte er auch Wladimir Putin.,https://img.zeit.de/politik/ausland/2025-09/g20-2026-donald-trump-golfclub-miami-bild/wide__1300x731,2025-09-06T02:35:15Z,,"US-Präsident Donald Trump will den G20-Gipfel im kommenden Jahr in einem seiner Golfresorts veranstalten. ""Ja, er wird in Doral stattfinden"", sagte Trump gegenüber Reportern mit Blick auf seinen Golf… [+1295 chars]",,de,'Putin'
https://www.faz.net/aktuell/politik/ukraine/ukraine-liveticker-csu-chef-soeder-gegen-bundeswehr-einsaetze-in-der-ukraine-faz-110172806.html,https://www.faz.net/aktuell/politik/ukraine/ukraine-liveticker-csu-chef-soeder-gegen-bundeswehr-einsaetze-in-der-ukraine-faz-110172806.html,0,www.faz.net,Krieg in der Ukraine: CSU-Chef Söder gegen Bundeswehr-Einsätze in der Ukraine,Russland lehnt Sicherheitsgarantien abermals ab +++ Selenskyj rechnet mit Stationierung Tausender Soldaten in seinem Land +++ Koalition der Willigen will Trump überzeugen +++ alle Neuigkeiten im Liveblog,https://media0.faz.net/ppmedia/w1200/aktuell/politik/3254981931/1.10673552/facebook_teaser/csu-chef-soeder-sieht.jpg.webp,2025-09-06T05:27:29Z,,"Der Kreml lehnt Sicherheitsgarantien europäischer Staaten und der USA für die Ukraine entschieden ab. Können ausländische, insbesondere europäische und amerikanische Militärkontingente, die Sicherhei… [+398 chars]",,de,'Ukraine'
https://www.zeit.de/news/2025-09/06/selenskyj-ueber-treffen-mit-putin-er-kann-nach-kiew-kommen,https://www.zeit.de/news/2025-09/06/selenskyj-ueber-treffen-mit-putin-er-kann-nach-kiew-kommen,0,www.zeit.de,Ukraine-Krieg: Selenskyj über Treffen mit Putin: Er kann nach Kiew kommen,Hier finden Sie Informationen zu dem Thema „Ukraine-Krieg“. Lesen Sie jetzt „Selenskyj über Treffen mit Putin: Er kann nach Kiew kommen“.,https://img.zeit.de/news/2025-09/06/selenskyj-ueber-treffen-mit-putin-er-kann-nach-kiew-kommen-image-group/wide__1300x731,2025-09-06T07:24:12Z,,"Der ukrainische Präsident Wolodymyr Selenskyj hat Moskau als Ort für ein mögliches Treffen mit Kremlchef Wladimir Putin erneut abgelehnt. «Er kann nach Kiew kommen», sagte Selenskyj in einem Intervie… [+1349 chars]",,de,'Putin'
https://www.faz.net/aktuell/politik/ukraine/ukraine-liveticker-selenskyj-putin-kann-nach-kiew-kommen-faz-110172806.html,https://www.faz.net/aktuell/politik/ukraine/ukraine-liveticker-selenskyj-putin-kann-nach-kiew-kommen-faz-110172806.html,0,www.faz.net,Krieg in der Ukraine: Selenskyj: Putin kann nach Kiew kommen,"Ukrainischer Präsident: „Willst du, dass kein Treffen stattfindet, lädst du mich nach Moskau ein“ +++ Söder gegen Bundeswehr-Einsätze in der Ukraine +++ Russland lehnt Sicherheitsgarantien abermals ab +++ alle Neuigkeiten im Liveblog",https://media1.faz.net/ppmedia/w1200/aktuell/politik/1738134109/1.10673619/facebook_teaser/wolodymyr-selenskyj-vergangene.jpg.webp,2025-09-06T07:39:44Z,,"06.09.2025, 09:39Lesezeit: 1 Min.
Ukrainischer Präsident: Willst du, dass kein Treffen stattfindet, lädst du mich nach Moskau ein +++ Söder gegen Bundeswehr-Einsätze in der Ukraine +++ Russland lehn… [+66 chars]",,de,'Russland'
https://www.zeit.de/news/2025-09/06/israels-armee-weist-gebiet-in-gaza-als-humanitaere-zone-aus,https://www.zeit.de/news/2025-09/06/israels-armee-weist-gebiet-in-gaza-als-humanitaere-zone-aus,0,www.zeit.de,"Krieg in Nahost: Israels Armee weist Gebiet in Gaza als ""humanitäre Zone"" aus","Hier finden Sie Informationen zu dem Thema „Krieg in Nahost“. Lesen Sie jetzt „Israels Armee weist Gebiet in Gaza als ""humanitäre Zone"" aus“.",https://img.zeit.de/news/2025-09/06/israels-armee-weist-gebiet-in-gaza-als-humanitaere-zone-aus-image-group/wide__1300x731,2025-09-06T09:19:10Z,,Vor einer erwarteten Großoffensive in der Stadt Gaza hat die israelische Armee ein Küstengebiet im südlichen Gazastreifen als sogenannte humanitäre Zone ausgewiesen. Das Areal von Al-Mawasi nahe Chan… [+1607 chars],,de,'Krieg'
https://www.faz.net/aktuell/wirtschaft/oel-und-gas-norwegen-ist-zu-reich-fuer-reformen-110666210.html,https://www.faz.net/aktuell/wirtschaft/oel-und-gas-norwegen-ist-zu-reich-fuer-reformen-110666210.html,0,www.faz.net,Öl und Gas: Norwegen krankt an seinem Reichtum,Der Ölfonds bewahrte das Land 30 Jahre vor den Schattenseiten des Rohstoffreichtums. Kurz vor der Parlamentswahl steht fest: Jetzt reicht das nicht mehr.,https://media0.faz.net/ppmedia/w1200/aktuell/gesellschaft/4143456449/1.10666292/facebook_teaser/ein-lng-terminal-des.jpg.webp,2025-09-06T14:03:38Z,,"Es gibt ein Land in Europa, dessen mit Abstand wichtigste Industriebranche vor einem gewaltigen Umbruch steht, dessen alteingesessene Konzerne seit einigen Jahren kaum mehr wachsen und dessen Unterne… [+230 chars]",,de,'Gas'
https://www.zeit.de/news/2025-09/06/london-tumulte-und-festnahmen-bei-propalaestinensischer-demo,https://www.zeit.de/news/2025-09/06/london-tumulte-und-festnahmen-bei-propalaestinensischer-demo,0,www.zeit.de,Gaza-Krieg: London: Tumulte und Festnahmen bei propalästinensischer Demo,Hier finden Sie Informationen zu dem Thema „Gaza-Krieg“. Lesen Sie jetzt „London: Tumulte und Festnahmen bei propalästinensischer Demo“.,https://img.zeit.de/news/2025-09/06/london-tumulte-und-festnahmen-bei-propalaestinensischer-demo-image-group/wide__1300x731,2025-09-06T17:10:30Z,,"Bei einer propalästinensischen Demonstration in London ist es zu tumultartigen Szenen gekommen. Bis zum frühen Abend wurden etwa 150 Menschen festgenommen, wie die Metropolitan Police mitteilte. 
Hu… [+1913 chars]",,de,'Krieg'
https://www.n-tv.de/politik/Kiew-sieht-neue-Taktik-russischer-Infanterie-bei-Pokrowsk-article26015489.html,https://www.n-tv.de/politik/Kiew-sieht-neue-Taktik-russischer-Infanterie-bei-Pokrowsk-article26015489.html,0,www.n-tv.de,Einkesselung durch Panzer?: Kiew sieht neue Taktik russischer Infanterie bei Pokrowsk,"Die Kämpfe um die ostukrainische Stadt Pokrowsk sind auch eine Propaganda-Schlacht: Welche Kriegspartei kann Erfolge verzeichnen? Die ukrainische Armee meldet nun ein neues taktisches Vorgehen von Moskaus Truppen - Ziel sei ein ""Entscheidungsdurchbruch"".",https://www.n-tv.de/img/incoming/crop26015488/6041326027-cImg_16_9-w1200/AP25227486323742.jpg,2025-09-06T19:29:22Z,,Die Kämpfe um die ostukrainische Stadt Pokrowsk sind auch eine Propaganda-Schlacht: Welche Kriegspartei kann Erfolge verzeichnen? Die ukrainische Armee meldet nun ein neues taktisches Vorgehen von Mo… [+1916 chars],,de,'Kämpfe'
https://www.zeit.de/news/2025-09/07/grossdemonstration-in-israel-fuer-gaza-abkommen,https://www.zeit.de/news/2025-09/07/grossdemonstration-in-israel-fuer-gaza-abkommen,0,www.zeit.de,Gaza-Krieg: Großdemonstration in Israel für Gaza-Abkommen,Hier finden Sie Informationen zu dem Thema „Gaza-Krieg“. Lesen Sie jetzt „Großdemonstration in Israel für Gaza-Abkommen“.,https://img.zeit.de/news/2025-09/07/grossdemonstration-in-israel-fuer-gaza-abkommen-image-group/wide__1300x731,2025-09-06T22:11:26Z,,Bei einer Großdemonstration in Jerusalem vor der Residenz von Ministerpräsident Benjamin Netanjahu haben zigtausende Menschen ihrer Forderung nach einem Ende des Gaza-Krieges Nachdruck verliehen. Das… [+1547 chars],,de,'Krieg'
https://www.zeit.de/news/2025-09/07/militaereinsatz-wie-im-krieg-trump-provoziert-chicago,https://www.zeit.de/news/2025-09/07/militaereinsatz-wie-im-krieg-trump-provoziert-chicago,0,www.zeit.de,Demokraten wehren sich: Militäreinsatz wie im Krieg? Trump provoziert Chicago,Hier finden Sie Informationen zu dem Thema „Demokraten wehren sich“. Lesen Sie jetzt „Militäreinsatz wie im Krieg? Trump provoziert Chicago“.,https://img.zeit.de/news/2025-09/07/militaereinsatz-wie-im-krieg-trump-provoziert-chicago-image-group/wide__1300x731,2025-09-06T23:02:30Z,,US-Präsident Donald Trump hat mit einer Anspielung auf einen möglichen Militäreinsatz in Chicago den Bürgermeister und den Gouverneur des umliegenden Bundesstaats Illinois gegen sich aufgebracht. Er … [+3394 chars],,de,'Krieg'
https://www.zeit.de/news/2025-09/07/russische-luftangriffe-auf-ukraine-opfer-in-kiew-gemeldet,https://www.zeit.de/news/2025-09/07/russische-luftangriffe-auf-ukraine-opfer-in-kiew-gemeldet,0,www.zeit.de,Krieg: Russische Luftangriffe auf Ukraine - Opfer in Kiew gemeldet,Hier finden Sie Informationen zu dem Thema „Krieg“. Lesen Sie jetzt „Russische Luftangriffe auf Ukraine - Opfer in Kiew gemeldet“.,https://img.zeit.de/news/2025-09/07/russische-luftangriffe-auf-ukraine-opfer-in-kiew-gemeldet-image-group/wide__1300x731,2025-09-07T02:30:28Z,,Russlands Militär hat die Ukraine in der Nacht nach Angaben aus Kiew erneut mit schweren Luftangriffen überzogen. Ukrainische Städte in nahezu allen Landesteilen seien mit Hunderten Kampfdrohnen und … [+466 chars],,de,'Ukraine'
https://www.faz.net/aktuell/politik/ukraine/ukraine-liveticker-ukraine-meldet-schwere-russische-angriffe-tote-in-kiew-faz-110172806.html,https://www.faz.net/aktuell/politik/ukraine/ukraine-liveticker-ukraine-meldet-schwere-russische-angriffe-tote-in-kiew-faz-110172806.html,0,www.faz.net,Krieg in der Ukraine: Ukraine meldet schwere russische Angriffe – Tote in Kiew,Kiew: Mindestens zwei Tote und elf Verletzte bei Luftangriffen +++ Bundeswehr verlegt Gerät für Übung nach Litauen +++ Selenskyj: Putin kann nach Kiew kommen +++ alle Neuigkeiten im Liveblog,https://media0.faz.net/ppmedia/w1200/aktuell/politik/3375874536/1.10674134/facebook_teaser/die-ukrainische-luftabwehr.jpg.webp,2025-09-07T03:50:55Z,,Russlands Militär hat die Ukraine in der Nacht nach Angaben aus Kiew abermals mit schweren Luftangriffen überzogen. Ukrainische Städte in nahezu allen Landesteilen seien mit Hunderten Kampfdrohnen un… [+826 chars],,de,'Ukraine'
https://www.waz.de/ratgeber-wissen/energie/article409889377/einspeiseverguetung-solaranlage-strom-foerderung.html,https://www.waz.de/ratgeber-wissen/energie/article409889377/einspeiseverguetung-solaranlage-strom-foerderung.html,0,www.waz.de,Ministerin gegen Solar-Förderung: Diese Botschaft wäre fatal,Energieforscher Volker Quaschning sieht in den Plänen von Katherina Reiche (CDU) eine Gefahr für die Energiewende. Was Millionen Verbrauchern jetzt droht.,https://img.sparknews.funkemedien.de/409714524/409714524_1754821975_v16_9_1600.jpeg,2025-09-07T04:56:00Z,,"Bundeswirtschaftsministerin Katherina Reiche (CDU) will die Einspeisevergütung für kleine Solaranlagen streichen. Das klingt technokratisch, beträfe aber Millionen Menschen direkt: Hausbesitzerinnen … [+2413 chars]",,de,'Solar'
https://orf.at/stories/3404299/,https://orf.at/stories/3404299/,0,orf.at,Gastgeber Äthiopien will Zeichen setzen,"Erste Vorveranstaltungen sind am Freitag angelaufen, ab Montag beginnt in der äthiopischen Hauptstadt Addis Abeba der offizielle Teil des zweiten Afrikanischen Klimagipfels (ACS2). Bei der gemeinsam mit der Afrikanischen Union veranstalteten und hochkarätig b…",https://ibs.orf.at/news?image=https%3A%2F%2Fassets.orf.at%2Fmims%2F2025%2F36%2F30%2Fcrops%2Fw%3D1200%2Ch%3D630%2Cq%3D75%2F2752981_master_1060830_afrika_klimagipfel_aethiopien_gy.jpg%3Fs%3Dd8d3420c439dd8997cba4a9e11692014c0aaa3de,2025-09-07T05:45:02Z,,Unter dem Motto Beschleunigung globaler Klimaschutzlösungen: Finanzierung für eine widerstandsfähige und grüne Entwicklung Afrikas werden bis Mittwoch im Addis International Convention Center etliche… [+5660 chars],,de,'Gas'
https://www.zeit.de/2025/38/sanitaetszuege-ukraine-front-krieg-aerzte-verwundete,https://www.zeit.de/2025/38/sanitaetszuege-ukraine-front-krieg-aerzte-verwundete,0,www.zeit.de,Sanitätszüge in der Ukraine: Das rollende Lazarett,"Ein Zug holt täglich verwundete ukrainische Soldaten von der Front ab. Wo er hält, ist geheim. Wo er hinfährt, ist der Krieg besonders brutal.",https://img.zeit.de/2025/38/das-rollende-lazarett-bild-6/wide__1300x731,2025-09-07T07:18:08Z,,"Der Zug schaukelt hin und her, als wollte er seine Passagiere beruhigen, während er sich ohne Halt der Front nähert. Es ist früh am Tag und schon drückend heiß, Sommerluft weht durch die offenen Fens… [+525 chars]",,de,'Ukraine'
https://www.der-postillon.com/2025/09/sonntagsfrage-smartphone-haemorrhoiden.html,https://www.der-postillon.com/2025/09/sonntagsfrage-smartphone-haemorrhoiden.html,0,www.der-postillon.com,"Sonntagsfrage: Was sagen Sie dazu, dass Smartphone-Nutzung auf dem Klo zu Hämorrhoiden führen soll?","Uns wäre fast das Handy ins Klo gefallen, als wir das lasen: Laut einer neuen Studie erhöht die Smartphone-Nutzung auf der Toilette das Hämorrhoiden-Risiko um ganze 46 Prozent. Na, juckt es Sie auch schon? In dieser Woche möchte der Proktillon (unterstützt du…",https://blogger.googleusercontent.com/img/b/R29vZ2xl/AVvXsEgNv85jaIcZkBiX12KZ5HV-2xR3SjWaoVcNe92KroNvZ3FBqEhXDqyMeMO34BPFwcBGVTINc0rsNw_L4CikJpTBxT_Wm9aaLZBdUvnVnnISwyH-BxYbvygaMlIGex24tNsJfv4Mu5P6kZ7to04jn6oI7UFNnlQwlELnjth0lKTC-PKhRCKWyhfgkTgZ37w/w1600/shutterstock_1647912745.jpg,2025-09-07T07:52:36Z,,"Uns wäre fast das Handy ins Klo gefallen, als wir das lasen: Laut einer neuen Studie erhöht die Smartphone-Nutzung auf der Toilette das Hämorrhoiden-Risiko um ganze 46 Prozent. Na, juckt es Sie auch … [+542 chars]",,de,'Risiko'
https://www.telepolis.de/features/Aus-fuer-Gaskraftwerke-Stromspeicher-uebernehmen-10630041.html,https://www.telepolis.de/features/Aus-fuer-Gaskraftwerke-Stromspeicher-uebernehmen-10630041.html,0,www.telepolis.de,Aus für Gaskraftwerke: Stromspeicher übernehmen!,Stromspeicher und Gaskraftwerke konkurrieren um knappe Netzanschlüsse. Doch wer setzt sich durch - und was bedeutet das für die Energiewende?,https://heise.cloudimg.io/bound/1200x1200/q85.png-lossy-85.webp-lossy-85.foil1/_www-heise-de_/imgs/18/4/9/2/9/5/1/0/stromschalterlongend-2kipp-7c5ae5b71814e57d.jpeg,2025-09-07T10:00:00Z,,"Stromspeicher und Gaskraftwerke konkurrieren um knappe Netzanschlüsse. Doch wer setzt sich durch - und was bedeutet das für die Energiewende?
In den vergangenen Jahren wurden die Investoren in Windk… [+5453 chars]",,de,'Gas'
https://www.telepolis.de/features/Wer-braucht-noch-Gaskraftwerke-wenn-Speicher-alles-besser-koennen-10630041.html,https://www.telepolis.de/features/Wer-braucht-noch-Gaskraftwerke-wenn-Speicher-alles-besser-koennen-10630041.html,0,www.telepolis.de,"Wer braucht noch Gaskraftwerke, wenn Speicher alles besser können?",Die Energiewende steht vor einem Dilemma: Batteriespeicher und Gaskraftwerke konkurrieren um knappe Netzanschlüsse. Wer setzt sich durch?,https://heise.cloudimg.io/bound/1200x1200/q85.png-lossy-85.webp-lossy-85.foil1/_www-heise-de_/imgs/18/4/9/2/9/5/1/0/stromschalterlongend-2kipp-7c5ae5b71814e57d.jpeg,2025-09-07T10:00:00Z,,"Die Energiewende steht vor einem Dilemma: Batteriespeicher und Gaskraftwerke konkurrieren um knappe Netzanschlüsse. Wer setzt sich durch?
In den vergangenen Jahren wurden die Investoren in Windkraft… [+5430 chars]",,de,'Gas'
https://www.telepolis.de/features/Energiewende-ohne-Gas-dank-billigerer-Batteriespeicher-10630041.html,https://www.telepolis.de/features/Energiewende-ohne-Gas-dank-billigerer-Batteriespeicher-10630041.html,0,www.telepolis.de,Energiewende ohne Gas – dank billigerer Batteriespeicher,Batteriespeicher und Gaskraftwerke konkurrieren um knappe Netzanschlüsse. Wer setzt sich durch – und was bedeutet das für die Energiewende?,https://heise.cloudimg.io/bound/1200x1200/q85.png-lossy-85.webp-lossy-85.foil1/_www-heise-de_/imgs/18/4/9/2/9/5/1/0/stromschalterlongend-2kipp-7c5ae5b71814e57d.jpeg,2025-09-07T10:00:00Z,,"Batteriespeicher und Gaskraftwerke konkurrieren um knappe Netzanschlüsse. Wer setzt sich durch  und was bedeutet das für die Energiewende?
In den vergangenen Jahren wurden die Investoren in Windkraf… [+5450 chars]",,de,'Windkraft'
https://www.zeit.de/news/2025-09/07/trump-sieht-sich-bereit-fuer-weitere-russland-sanktionen,https://www.zeit.de/news/2025-09/07/trump-sieht-sich-bereit-fuer-weitere-russland-sanktionen,0,www.zeit.de,Ukraine-Krieg: Trump sieht sich bereit für weitere Russland-Sanktionen,Hier finden Sie Informationen zu dem Thema „Ukraine-Krieg“. Lesen Sie jetzt „Trump sieht sich bereit für weitere Russland-Sanktionen“.,https://img.zeit.de/news/2025-09/07/trump-sieht-sich-bereit-fuer-weitere-russland-sanktionen-image-group/wide__1300x731,2025-09-07T17:32:06Z,,"US-Präsident Donald Trump sieht sich nach eigenen Angaben in der Lage, weitere Russland-Sanktionen verhängen zu können. Auf eine Frage eines Journalisten am Weißen Haus, ob er bereit sei, in die zwei… [+1323 chars]",,de,'Ukraine'
https://t3n.de/news/weltgroesstes-windkraftwerk-china-40000-haushalte-1702063/,https://t3n.de/news/weltgroesstes-windkraftwerk-china-40000-haushalte-1702063/,0,t3n.de,Fast so hoch wie der Berliner Fernsehturm: Weltgrößtes Windkraftwerk soll 40.000 Haushalte versorgen,Das größte Windkraftwerk der Welt wird derzeit vor der Küste Chinas installiert. Die 26-Megawatt-Anlage von Dongfang Electric wird damit die bisher führende Offshore-Windturbine von Siemens-Gamesa an der Spitze des Windrad-Rankings ablösen. Im April 2025 hatt…,https://cdn.t3n.de/news/wp-content/uploads/2025/08/Dongfang-Electric-Windrad-Rotor.jpg?class=content,2025-09-07T18:10:00Z,,"Im April 2025 hatte der spanische Energiekonzern Siemens-Gamesa im dänischen Offshore-Windpark Østerild das leistungsstärkste Windrad der Welt an den Start gebracht. Die 21,5-Megawatt-Anlage SG DD-27… [+3160 chars]",,de,'Windkraft'
https://www.zeit.de/news/2025-09/07/trump-letzte-warnung-an-hamas-zu-geiseln,https://www.zeit.de/news/2025-09/07/trump-letzte-warnung-an-hamas-zu-geiseln,0,www.zeit.de,Gaza-Krieg: Trump: Letzte Warnung an Hamas zu Geiseln,Hier finden Sie Informationen zu dem Thema „Gaza-Krieg“. Lesen Sie jetzt „Trump: Letzte Warnung an Hamas zu Geiseln“.,https://img.zeit.de/news/2025-09/07/trump-letzte-warnung-an-hamas-zu-geiseln-image-group/wide__1300x731,2025-09-07T19:24:37Z,,"Im Ringen um die Freilassung der Geiseln aus dem Gazastreifen hat US-Präsident Donald Trump eine «letzte Warnung» an die islamistische Hamas gerichtet. Alle wollten, dass die Geiseln freikommen, schr… [+1176 chars]",,de,'Krieg'
https://www.zeit.de/news/2025-09/07/hamas-nach-trump-warnung-sind-zu-verhandlungen-bereit,https://www.zeit.de/news/2025-09/07/hamas-nach-trump-warnung-sind-zu-verhandlungen-bereit,0,www.zeit.de,Gaza-Krieg: Hamas nach Trump-Warnung: Sind zu Verhandlungen bereit,Hier finden Sie Informationen zu dem Thema „Gaza-Krieg“. Lesen Sie jetzt „Hamas nach Trump-Warnung: Sind zu Verhandlungen bereit“.,https://img.zeit.de/news/2025-09/07/hamas-nach-trump-warnung-sind-zu-verhandlungen-bereit-image-group/wide__1300x731,2025-09-07T21:56:31Z,,Die islamistische Terrororganisation Hamas hat sich nach einer «letzten Warnung» des US-Präsidenten Donald Trump im Ringen um die Freilassung der Geiseln im Gazastreifen zu sofortigen Verhandlungen b… [+1386 chars],,de,'Krieg'
https://www.n-tv.de/politik/08-59-Russland-will-raus-aus-Antifolterkonvention--article23143824.html,https://www.n-tv.de/politik/08-59-Russland-will-raus-aus-Antifolterkonvention--article23143824.html,0,www.n-tv.de,Ukraine-Krieg im Liveticker: +++ 08:59 Russland will raus aus Antifolterkonvention +++,Lesen Sie alle aktuellen Entwicklungen und Nachrichten über den russischen Angriffskrieg auf die Ukraine im Liveticker von ntv.de.,https://www.n-tv.de/img/incoming/crop25117070/8311326854-cImg_16_9-w1200/Ukraine-Liveticker.jpg,2025-09-07T22:12:00Z,,Russlands Präsident Wladimir Putin will aus der europäischen Antifolterkonvention austreten. Er habe dem Parlament einen Gesetzentwurf zum Austritt aus der Europäischen Konvention zur Verhütung von F… [+8894 chars],,de,'Russland'
https://www.n-tv.de/politik/09-26-Ukraine-hofft-dass-Trump-richtig-sauer-wird--article23143824.html,https://www.n-tv.de/politik/09-26-Ukraine-hofft-dass-Trump-richtig-sauer-wird--article23143824.html,0,www.n-tv.de,"Ukraine-Krieg im Liveticker: +++ 09:26 Ukraine hofft, ""dass Trump richtig sauer wird"" +++",Lesen Sie alle aktuellen Entwicklungen und Nachrichten über den russischen Angriffskrieg auf die Ukraine im Liveticker von ntv.de.,https://www.n-tv.de/img/incoming/crop25117070/8311326854-cImg_16_9-w1200/Ukraine-Liveticker.jpg,2025-09-07T22:12:00Z,,"Während Unterstützerstaaten die Zukunftsperspektive der Ukraine diskutieren, trifft der bisher schwerste Angriff Russlands die Hauptstadt Kiew. Darüber ist auch der US-Präsident ""unhappy"", in dem ang… [+9250 chars]",,de,'Ukraine'
https://www.n-tv.de/politik/07-56-Drittes-Todesopfer-in-Kiew-geborgen-5-Tote-44-Verletzte-nach-russischem-Grossangriff--article23143824.html,https://www.n-tv.de/politik/07-56-Drittes-Todesopfer-in-Kiew-geborgen-5-Tote-44-Verletzte-nach-russischem-Grossangriff--article23143824.html,0,www.n-tv.de,"Ukraine-Krieg im Liveticker: +++ 07:56 Drittes Todesopfer in Kiew geborgen - 5 Tote, 44 Verletzte nach russischem Großangriff +++",Lesen Sie alle aktuellen Entwicklungen und Nachrichten über den russischen Angriffskrieg auf die Ukraine im Liveticker von ntv.de.,https://www.n-tv.de/img/incoming/crop25117070/8311326854-cImg_16_9-w1200/Ukraine-Liveticker.jpg,2025-09-07T22:12:00Z,,Bei dem riesigen russischen Drohnen- und Raketenangriff auf die Ukraine in der Nacht zum Sonntag werden mindestens 5 Menschen getötet und 44 weitere verletzt. Allein in der Hauptstadt Kiew werden ein… [+7119 chars],,de,'Russland'
