index,url,valid,domain,title,description,image,published,archive,content,quote,language,keyword
https://www.welt.de/politik/ausland/video245636904/Krieg-in-der-Ukraine-Zwei-tote-Kinder-nach-naechtlichem-Angriff-auf-Kiew.html,https://www.welt.de/politik/ausland/video245636904/Krieg-in-der-Ukraine-Zwei-tote-Kinder-nach-naechtlichem-Angriff-auf-Kiew.html,0,www.welt.de,Zwei tote Kinder nach nächtlichem Angriff auf Kiew,"Bei einem erneuten nächtlichen russischen Angriff auf die ukrainische Hauptstadt Kiew sind offiziellen Angaben zufolge drei Menschen, darunter zwei Kinder, getötet worden. Unterdessen toben in Bachmut weiter erbitterte Kämpfe.",https://img.welt.de/img/incoming/mobile245636902/3911359587-ci16x9-w1200/406117252-jpg.jpg,2023-06-01T05:52:23Z,https://web.archive.org/web/20230601103856/https://www.welt.de/politik/ausland/video245636904/Krieg-in-der-Ukraine-Zwei-tote-Kinder-nach-naechtlichem-Angriff-auf-Kiew.html,"Die WELT als ePaper: Die vollständige Ausgabe steht Ihnen bereits am Vorabend zur Verfügung so sind Sie immer hochaktuell informiert. Weitere Informationen: http://epaper.welt.de 
 Der Kurz-Link die… [+49 chars]",,de,'Kämpfe'
https://www.nzz.ch/feuilleton/sergei-gerasimow-kriegstagebuch-aus-charkiw-teil-4185-ld.1736750,https://www.nzz.ch/feuilleton/sergei-gerasimow-kriegstagebuch-aus-charkiw-teil-4185-ld.1736750,0,www.nzz.ch,"SERIE - Niederlage heisst jetzt Sieg – was die Russen machen müssen, ist, der Falle zu entkommen, in welche die Ukrainer sie gelockt haben","Sergei Gerasimow befindet sich noch immer in Charkiw und führt sein Kriegstagebuch weiter. Auch wenn die Raketenangriffe nachgelassen haben, der Schrecken des Krieges mit seinen seelischen Abgründen und absurden Situationen bleibt in drängender Weise präsent.","https://img.nzz.ch/2023/05/16/9657f265-8907-4dd1-a9fd-1634ba28cadc.jpeg?width=1200&height=675&fit=bound&quality=75&auto=webp&crop=5184,2916,x0,y191&wmark=nzz",2023-06-01T08:44:26Z,https://web.archive.org/web/20230601094106/https://www.nzz.ch/feuilleton/sergei-gerasimow-kriegstagebuch-aus-charkiw-teil-4185-ld.1736750,"In die Falle getappt Wladimir Putin bei der Militärparade zum Sieg vom 9. Mai in Sewastopol auf der Krim.
22. März 2023
Diktatoren sind niemals klug. Klugen Menschen würde es nie Freude machen, and… [+5403 chars]",,de,'Putin'
https://www.diepresse.com/6294617/wagner-chef-prigoschin-feiert-geburtstag-und-schimpft-auf-clowns-in-russischer-armee,https://www.diepresse.com/6294617/wagner-chef-prigoschin-feiert-geburtstag-und-schimpft-auf-clowns-in-russischer-armee,0,www.diepresse.com,"Wagner-Chef Prigoschin feiert Geburtstag und schimpft auf ""Clowns"" in russischer Armee","Der Chef der Söldnergruppe Wagner will seine Truppen in der Ukraine nur dann einsetzen, wenn sie einen eigenen Frontabschnitt bekommen. Bachmut werde Wagner am 5. Juni endgültig verlassen.",https://media.diepresse.com/social_diepresse_nachrichten/images/uploads_1200/c/5/9/6294617/C95216B4-CA89-4C86-BE26-C85C1E9909E7_v0_h.jpg,2023-06-01T08:53:00Z,https://web.archive.org/web/20230601090752/https://www.diepresse.com/6294617/wagner-chef-prigoschin-feiert-geburtstag-und-schimpft-auf-clowns-in-russischer-armee,"Der Chef der Söldnergruppe Wagner will seine Truppen in der Ukraine nur dann einsetzen, wenn sie einen eigenen Frontabschnitt bekommen. Bachmut werde Wagner am 5. Juni endgültig verlassen.
Russlands… [+2185 chars]",,de,'Ukraine'
https://consent.google.com/ml?continue=https://news.google.com/rss/articles/CCAiC3FnMC0xdjVod1ZJmAEB?oc%3D5&gl=FR&hl=en-US&cm=2&pc=n&src=1,https://consent.google.com/ml?continue=https://news.google.com/rss/articles/CCAiC3FnMC0xdjVod1ZJmAEB?oc%3D5&gl=FR&hl=en-US&cm=2&pc=n&src=1,0,consent.google.com,"BAERBOCK: Klare Ansage an Putin! ""..., dass man mit diesen Horror-Szenarien nicht spielen darf!"" - WELT Nachrichtensender","<ol><li>BAERBOCK: Klare Ansage an Putin! ""..., dass man mit diesen Horror-Szenarien nicht spielen darf!""  WELT Nachrichtensender
</li><li>Schweden wirbt weiter um NATO-Beitritt  tagesschau
</li><li>Erklärung von Roth und Kollegen: Außenpolitiker von 20 Staa…",,2023-06-01T09:08:37Z,https://web.archive.org/web/20230603021913/https://consent.google.com/ml?continue=https:%2F%2Fnews.google.com%2Frss%2Farticles%2FCCAiC3FnMC0xdjVod1ZJmAEB%3Foc%3D5&amp;gl=FR&amp;hl=en-US&amp;cm=2&amp;pc=n&amp;src=1,"We use cookies and data to<ul><li>Deliver and maintain Google services</li><li>Track outages and protect against spam, fraud, and abuse</li><li>Measure audience engagement and site statistics to unde… [+1131 chars]",,de,'Putin'
https://www.welt.de/politik/ausland/video245638396/Kiews-Sommeroffensive-Es-kann-sich-nur-noch-um-Tage-handeln.html,https://www.welt.de/politik/ausland/video245638396/Kiews-Sommeroffensive-Es-kann-sich-nur-noch-um-Tage-handeln.html,0,www.welt.de,„Es kann sich nur noch um Tage handeln“,"Die von Putin angeheuerten Wagner-Söldner werden aufgestockt und auch Kadyrows tschetschenische Kämpfer intensivieren ihre Aktivitäten im Donbass, so WELT-Korrespondent Christoph Wanner. Die ukrainische Gegenoffensive stehe in diesen Tagen unmittelbar bevor, …",https://img.welt.de/img/videos/mobile245639946/7571354937-ci16x9-w1200/PCR1-PGM-06-00-123793-jpg.jpg,2023-06-01T09:27:35Z,,"Die WELT als ePaper: Die vollständige Ausgabe steht Ihnen bereits am Vorabend zur Verfügung so sind Sie immer hochaktuell informiert. Weitere Informationen: http://epaper.welt.de 
 Der Kurz-Link die… [+49 chars]",,de,'Putin'
https://www.telepolis.de/features/Prigoschin-Angriff-auf-Putin-Elite-Hat-der-russische-Nachfolgekampf-begonnen-9154568.html,https://www.telepolis.de/features/Prigoschin-Angriff-auf-Putin-Elite-Hat-der-russische-Nachfolgekampf-begonnen-9154568.html,0,www.telepolis.de,Prigoschin-Angriff auf Putin-Elite: Hat der russische Nachfolgekampf begonnen?,Wütender Wagner-Chef attackiert russische Oberschicht und die Kriegsführung. Das Machtgerangel scheint bereits gestartet zu sein. Warum die Unruhen weit über Moskau hinausreichen könnten.,https://heise.cloudimg.io/bound/1200x1200/q85.png-lossy-85.webp-lossy-85.foil1/_www-heise-de_/imgs/18/4/2/3/8/5/4/3/Prigoschin_Putin_Final_3-4848f4f40a6d7ef0.png,2023-06-01T10:00:00Z,,"Bild: Wagner-Anführer Jewgeni Prigoschin und der russische Präsident Wladimir Putin. Bilder: t.me/Prigozhin_hat / kremlin.ru
Wütender Wagner-Chef attackiert russische Oberschicht und die Kriegsführu… [+4615 chars]",,de,'Putin'
https://www.morgenpost.de/politik/article238555903/putin-russland-moldau-drohung-europa-gipfel-video.html,https://www.morgenpost.de/politik/article238555903/putin-russland-moldau-drohung-europa-gipfel-video.html,0,www.morgenpost.de,50 Staaten in Moldau: Klare Kante gegen Putin: Staatschefs nehmen Videos auf,Moldau wird von Russland bedroht. Das Land erfährt nun besondere Unterstützung - europäische Staatschefs überraschen mit einem Video.,https://img.morgenpost.de/img/frontpage/crop238555861/979260113-w820-cv16_9-q85/putin-AFP-33GM4M4.jpg,2023-06-01T10:19:29Z,,"Berlin/Bulboaca. Sie trifft sich erst zum zweiten Mal: die Europäische Politische Gemeinschaft, kurz EPG. Am Donnerstag kommen in Moldau rund 50 europäische Staaten zusammen, um ein Zeichen der Einig… [+2912 chars]",,de,'Putin'
https://www.bild.de/news/ausland/news-ausland/drei-jahre-und-acht-antraege-spaeter-eltern-wollen-ihr-kind-immer-noch-putin-nen-84141774.bild.html,https://www.bild.de/news/ausland/news-ausland/drei-jahre-und-acht-antraege-spaeter-eltern-wollen-ihr-kind-immer-noch-putin-nen-84141774.bild.html,0,www.bild.de,Drei Jahre und acht Anträge später - Eltern wollen ihr Kind immer noch Putin nennen,"Wie kommen Eltern auf so eine Idee?! Er war noch im Bauch seiner Mama, da stand die Entscheidung schon.","https://images.bild.de/64786420580f3f5c3c2c89c3/c1fa658e791655c51d45dc2e83793563,12f934e?w=1280",2023-06-01T10:26:33Z,,"Wie kommen Eltern auf so eine Idee?!
Er war noch im Bauch seiner Mama, da entschieden seine Eltern Ann und Ronny aus Hishult (Schweden) bereits, dass der Kleine mal Putin heißen soll. Aber das Einwo… [+1599 chars]",,de,'Putin'
https://consent.google.com/ml?continue=https://news.google.com/rss/articles/CBMiXWh0dHBzOi8vd3d3LnpkZi5kZS9uYWNocmljaHRlbi9wb2xpdGlrL2JhZXJib2NrLW5hdG8tYmVpdHJpdHQtdWtyYWluZS1rcmllZy1ydXNzbGFuZC0xMDAuaHRtbNIBXWh0dHBzOi8vYW1wLnpkZi5kZS9uYWNocmljaHRlbi9wb2xpdGlrL2JhZXJib2NrLW5hdG8tYmVpdHJpdHQtdWtyYWluZS1rcmllZy1ydXNzbGFuZC0xMDAuaHRtbA?oc%3D5&gl=FR&hl=en-US&cm=2&pc=n&src=1,https://consent.google.com/ml?continue=https://news.google.com/rss/articles/CBMiXWh0dHBzOi8vd3d3LnpkZi5kZS9uYWNocmljaHRlbi9wb2xpdGlrL2JhZXJib2NrLW5hdG8tYmVpdHJpdHQtdWtyYWluZS1rcmllZy1ydXNzbGFuZC0xMDAuaHRtbNIBXWh0dHBzOi8vYW1wLnpkZi5kZS9uYWNocmljaHRlbi9wb2xpdGlrL2JhZXJib2NrLW5hdG8tYmVpdHJpdHQtdWtyYWluZS1rcmllZy1ydXNzbGFuZC0xMDAuaHRtbA?oc%3D5&gl=FR&hl=en-US&cm=2&pc=n&src=1,0,consent.google.com,"Kein Beitritt der Ukraine ""mitten im Krieg"" - zdf.de","<ol><li>Kein Beitritt der Ukraine ""mitten im Krieg""  zdf.de
</li><li>Treffen in Oslo: Baerbock gegen schnellen NATO-Beitritt der Ukraine  tagesschau.de
</li><li>BAERBOCK: Klare Ansage an Putin! ""..., dass man mit diesen Horror-Szenarien nicht spielen darf!""…",,2023-06-01T10:32:36Z,,"We use cookies and data to<ul><li>Deliver and maintain Google services</li><li>Track outages and protect against spam, fraud, and abuse</li><li>Measure audience engagement and site statistics to unde… [+1131 chars]",,de,'Putin'
https://www.tagesspiegel.de/internationales/machtkampf-in-moskau-hat-putin-genug-von-ihm-ist-prigoschin-mit-einem-fingerschnippen-weg-9909164.html,https://www.tagesspiegel.de/internationales/machtkampf-in-moskau-hat-putin-genug-von-ihm-ist-prigoschin-mit-einem-fingerschnippen-weg-9909164.html,0,www.tagesspiegel.de,"Machtkampf in Moskau: „Hat Putin genug von ihm, ist Prigoschin mit einem Fingerschnippen weg“","Moskau unter Beschuss und ein wütender Söldner-Chef – in Russland sorgen die jüngsten Kriegsereignisse für Unruhe. Welche Folgen das hat, erklärt Russland-Experte Mark Galeotti im Interview.",https://www.tagesspiegel.de/internationales/images/wagner-chef-prigoschin1/alternates/BASE_16_9_W1400/wagner-chef-prigoschin.jpeg,2023-06-01T10:34:45Z,https://web.archive.org/web/20230601111021/https://www.tagesspiegel.de/internationales/machtkampf-in-moskau-hat-putin-genug-von-ihm-ist-prigoschin-mit-einem-fingerschnippen-weg-9909164.html,"Drohnen über Moskau. Und ein russischer Präsident, der eine Verbesserung der russischen Luftabwehr fordert. Waren Sie von den Ereignissen zu Beginn der Woche überrascht?Zum Teil, denn die Angriffe au… [+318 chars]",,de,'Russland'
https://www.bild.de/bild-plus/video/clip/politik/bild-lagezentrum-jetzt-schickt-putin-monster-raketen-nach-kiew-84142086.bild.html,https://www.bild.de/bild-plus/video/clip/politik/bild-lagezentrum-jetzt-schickt-putin-monster-raketen-nach-kiew-84142086.bild.html,0,www.bild.de,BILD-Lagezentrum - Jetzt schickt Putin Monster-Raketen nach Kiew,Sie sind sieben Meter lang und vier Tonnen schwer. Gleich zehn ballistische Raketen vom Typ Iskander hat Russlands Terror-Regime letzte Nacht auf die ukr...,"https://images.bild.de/647868a7580f3f5c3c2c89d9/81e36b8aecbd05c63b63758db5f8a9cd,bcf64222?w=1280",2023-06-01T10:55:17Z,https://web.archive.org/web/20230601140826/https://www.bild.de/bild-plus/video/clip/politik/bild-lagezentrum-jetzt-schickt-putin-monster-raketen-nach-kiew-84142086.bild.html,Sie sind sieben Meter lang und vier Tonnen schwer. Gleich zehn ballistische Raketen vom Typ Iskander hat Russlands Terror-Regime letzte Nacht auf die ukrainische Hauptstadt Kiew gefeuert. Drei Mensch… [+117 chars],,de,'Russland'
https://www.bild.de/video/clip/politik/bild-lagezentrum-jetzt-schickt-putin-monster-raketen-nach-kiew-84142086.bild.html,https://www.bild.de/video/clip/politik/bild-lagezentrum-jetzt-schickt-putin-monster-raketen-nach-kiew-84142086.bild.html,0,www.bild.de,Angriffe auf Kiew immer brutaler - Jetzt schickt Putin diese Monster-Raketen,"BILD-Lagezentrum: Gleich zehn ballistische Raketen vom Typ Iskander hat Russlands Terror-Regime auf die ukrainische Hauptstadt Kiew gefeuert. BILD erklärt, warum der Kreml nun auf die Monster-Raketen aus eigener Produktion setzt.","https://images.bild.de/647868a7580f3f5c3c2c89d9/bc5f3e136cc274f479e6a90bfa93a208,fbd1a3ca?w=1280",2023-06-01T10:55:17Z,https://web.archive.org/web/20230602152425/https://www.bild.de/video/clip/politik/bild-lagezentrum-jetzt-schickt-putin-monster-raketen-nach-kiew-84142086.bild.html,"Mehr zum Video anzeigen
BILD-Lagezentrum: Sie sind sieben Meter lang und vier Tonnen schwer. Gleich zehn ballistische Raketen vom Typ Iskander hat Russlands Terror-Regime auf die ukrainische Hauptst… [+184 chars]",,de,'Putin'
https://www.faz.net/aktuell/politik/ausland/gegenpol-zum-westen-brics-wollen-weitere-staaten-aufnehmen-18934649.html,https://www.faz.net/aktuell/politik/ausland/gegenpol-zum-westen-brics-wollen-weitere-staaten-aufnehmen-18934649.html,0,www.faz.net,Gegenpol zum Westen: BRICS wollen weitere Staaten aufnehmen,"Der Name BRICS steht für Brasilien, Russland, Indien, China und Südafrika. Jetzt aber wollen viele Staaten der Gruppe beitreten. In Kapstadt beraten darüber die fünf Außenminister.",https://media0.faz.net/ppmedia/aktuell/2146035324/1.8934648/facebook_teaser/der-russische-aussenminister.jpg,2023-06-01T15:38:26Z,https://web.archive.org/web/20230601164334/https://www.faz.net/aktuell/politik/ausland/gegenpol-zum-westen-brics-wollen-weitere-staaten-aufnehmen-18934649.html,"Inmitten geopolitischer Spannungen haben sich am Donnerstag die Außenminister der BRICS (Brasilien, Russland, Indien, China und Südafrika) in Kapstadt zu zwei Tage langen Gesprächen getroffen. Es sei… [+2081 chars]",,de,'Russland'
https://www.apfelpage.de/news/russland-apple-und-nsa-sollen-iphone-spionageverschwoerung-angezettelt-haben/,https://www.apfelpage.de/news/russland-apple-und-nsa-sollen-iphone-spionageverschwoerung-angezettelt-haben/,0,www.apfelpage.de,Russland: Apple und NSA sollen iPhone-Spionageverschwörung angezettelt haben,"Die NSA und Apple sollen sich zur Spionage gegen russische Bürger und Diplomaten verschworen haben, behauptet der russische Geheimdienst. Tausende iPhones seien mit einer Backrohr infiziert, die zum Absaugen von Daten genutzt worden sein […]",https://www.apfelpage.de/wp-content/uploads/2021/03/Moskau-Symbolbild-anastasiya-romanova-unsplash-scaled.jpeg,2023-06-01T15:41:59Z,https://web.archive.org/web/20230601154206/https://www.apfelpage.de/news/russland-apple-und-nsa-sollen-iphone-spionageverschwoerung-angezettelt-haben/,"Die NSA und Apple sollen sich zur Spionage gegen russische Bürger und Diplomaten verschworen haben, behauptet der russische Geheimdienst. Tausende iPhones seien mit einer Backrohr infiziert, die zum … [+2522 chars]",,de,'Russland'
https://www.faz.net/aktuell/sport/sportpolitik/putins-werk-und-der-beitrag-des-sports-fechten-als-politikum-18934918.html,https://www.faz.net/aktuell/sport/sportpolitik/putins-werk-und-der-beitrag-des-sports-fechten-als-politikum-18934918.html,0,www.faz.net,Fechten als Politikum: Wie das russische NOK Putins Landraub unterstützt,"In den besetzten ukrainischen Gebieten werden Sportverbände Russland angeschlossen. Will Thomas Bach weiter der Idee anhängen, russische Sportler könnten in aller Unschuld an Olympia teilnehmen?",https://media0.faz.net/ppmedia/aktuell/sport/2583549729/1.8935068/facebook_teaser/an-die-waffen-russischen.jpg,2023-06-01T15:49:05Z,https://web.archive.org/web/20230601204748/https://www.faz.net/aktuell/sport/sportpolitik/putins-werk-und-der-beitrag-des-sports-fechten-als-politikum-18934918.html,"Sechsundfünfzig Mitgliedsorganisationen führt der Fechtverband Russlands auf seiner Website auf. Unter ihnen: die Republik Krim, die Stadt Sewastopol, die Volksrepublik Luhansk und die Volksrepublik … [+3109 chars]",,de,'Russland'
https://www.wiwo.de/politik/europa/wir-stehen-zusammen-europa-gipfel-sendet-klares-signal-an-moskau/29180254.html,https://www.wiwo.de/politik/europa/wir-stehen-zusammen-europa-gipfel-sendet-klares-signal-an-moskau/29180254.html,0,www.wiwo.de,Wir stehen zusammen: Europa-Gipfel sendet klares Signal an Moskau,"Fast ganz Europa trifft sich nur 20 Kilometer von der ukrainischen Grenze entfernt zu einem großen Solidaritätsgipfel für die Nachbarstaaten Russlands. Das Signal an Moskau ist deutlich. Neue Versprechen für die Ukraine, Moldau oder Georgien gibt es aber nich…",https://www.wiwo.de/images/gipfeltreffen-der-europaeischen-politischen-gemeinschaft-in-moldau/29182910/2-format11240.jpg,2023-06-01T15:51:41Z,https://web.archive.org/web/20230601173844/http://www.wiwo.de/politik/europa/wir-stehen-zusammen-europa-gipfel-sendet-klares-signal-an-moskau/29180254.html,Der ukrainische Präsident Wolodymyr Selenskyj hat beim Europa-Gipfel in Moldau eine schnelle Ost-Erweiterung von EU und Nato zum Schutz vor russischer Aggression gefordert. Wir brauchen Frieden. Desh… [+6502 chars],,de,'Russland'
https://www.morgenpost.de/politik/inland/article238561873/Mehrheit-gegen-deutsche-Kampfjet-Lieferungen-an-Ukraine.html,https://www.morgenpost.de/politik/inland/article238561873/Mehrheit-gegen-deutsche-Kampfjet-Lieferungen-an-Ukraine.html,0,www.morgenpost.de,Umfrage: Mehrheit gegen deutsche Kampfjet-Lieferungen an Ukraine,Die Ukraine wünscht sich im Kampf gegen Russland Kampfflugzeuge - unter anderem auch Eurofighter aus Deutschland. Die Mehrheit der Bevölkerung sieht das anders.,https://img.morgenpost.de/img/inland/crop238561871/1772606905-w820-cv16_9-q85/F-16-Kampfjet.jpg,2023-06-01T16:07:16Z,https://web.archive.org/web/20230601163338/https://www.morgenpost.de/politik/inland/article238561873/Mehrheit-gegen-deutsche-Kampfjet-Lieferungen-an-Ukraine.html,"Berlin. Eine Mehrheit der deutschen Bevölkerung ist einer Umfrage zufolge gegen Kampfflugzeug-Lieferungen der Bundesrepublik an die Ukraine.
64 Prozent der Befragten lehnen deutsche Lieferungen ab, … [+946 chars]",,de,'Russland'
https://www.stern.de/politik/deutschland/umfrage--mehrheit-gegen-deutsche-kampfjet-lieferungen-an-ukraine-33521360.html,https://www.stern.de/politik/deutschland/umfrage--mehrheit-gegen-deutsche-kampfjet-lieferungen-an-ukraine-33521360.html,0,www.stern.de,Umfrage: Mehrheit gegen deutsche Kampfjet-Lieferungen an Ukraine,Die Ukraine wünscht sich im Kampf gegen Russland Kampfflugzeuge - unter anderem auch Eurofighter aus Deutschland. Die Mehrheit der Bevölkerung sieht das anders.,https://image.stern.de/33521362/t/qr/v1/w1440/r1.7778/-/01--urnnewsmldpacom2009010123060199907966v2w800h600l1536t603r3181b2322jpeg---795d57885908d93d.jpg,2023-06-01T16:07:16Z,https://web.archive.org/web/20230601202300/https://www.stern.de/politik/deutschland/umfrage--mehrheit-gegen-deutsche-kampfjet-lieferungen-an-ukraine-33521360.html,"Die Ukraine wünscht sich im Kampf gegen Russland Kampfflugzeuge - unter anderem auch Eurofighter aus Deutschland. Die Mehrheit der Bevölkerung sieht das anders.
Eine Mehrheit der deutschen Bevölkeru… [+965 chars]",,de,'Russland'
https://www.tagesspiegel.de/wissen/waldbrande-auf-der-nordhalbkugel-copernicus-dienst-in-diesem-jahr-aussergewohnlich-starke-feuer-9912578.html,https://www.tagesspiegel.de/wissen/waldbrande-auf-der-nordhalbkugel-copernicus-dienst-in-diesem-jahr-aussergewohnlich-starke-feuer-9912578.html,0,www.tagesspiegel.de,Waldbrände auf der Nordhalbkugel: Copernicus-Dienst: In diesem Jahr außergewöhnlich starke Feuer,"Besonders betroffen war die Region Valencia in Spanien. Aber auch in Kanada, Kasachstan, der Mongolei und Russland loderten Brände. Bei Emissionswerten wurden Rekorde gemessen.",https://www.tagesspiegel.de/images/waldbrand-in-spanien2/alternates/BASE_16_9_W1400/waldbrand-in-spanien.jpeg,2023-06-01T16:09:47Z,https://web.archive.org/web/20230601162544/https://www.tagesspiegel.de/wissen/waldbrande-auf-der-nordhalbkugel-copernicus-dienst-in-diesem-jahr-aussergewohnlich-starke-feuer-9912578.html,Die Nordhalbkugel war in diesem Frühjahr außergewöhnlich stark von Waldbränden betroffen. Das teilte der EU-Atmosphärendienst CAMS (Copernicus Atmosphere Monitoring Service) am Donnerstag mit. In meh… [+2019 chars],,de,'Russland'
https://www.morgenpost.de/politik/article238560551/nadelstiche-ukrainekrieg-gegenoffensive-russland.html,https://www.morgenpost.de/politik/article238560551/nadelstiche-ukrainekrieg-gegenoffensive-russland.html,0,www.morgenpost.de,Neue Taktik: Nadelstich-Taktik: Ukraine will russische Front durchlöchern,Kiew attackiert russische Einheiten fast täglich aus der Luft – auch hinter der Grenze. Was das Ziel der Taktik ist - und wie die Erfolgschancen stehen.,https://img.morgenpost.de/img/politik/crop238560545/9462604050-w820-cv16_9-q85/2deef26a-0087-11ee-8116-1a66eeb5d30f.jpg,2023-06-01T16:12:39Z,https://web.archive.org/web/20230601164032/https://www.morgenpost.de/politik/article238560551/nadelstiche-ukrainekrieg-gegenoffensive-russland.html,"Kiew/Berlin.  Kämpfe in der westrussischen Region Belgorod, Drohnenattacken auf Moskau, Luftschläge auf Ziele in der russisch besetzten Südukraine. Auch wenn Kiew in vielen Fällen eine direkte Beteil… [+3675 chars]",,de,'Ukraine'
https://www.nzz.ch/international/ukraine-hoffnung-auf-nato-beitritt-duerfte-enttaeuscht-werden-ld.1740521,https://www.nzz.ch/international/ukraine-hoffnung-auf-nato-beitritt-duerfte-enttaeuscht-werden-ld.1740521,0,www.nzz.ch,Die Hoffnungen der Ukraine auf einen schnellen Nato-Beitritt können nur enttäuscht werden,"Seit 2008 gilt ein vages Beitrittsversprechen der Nato für die Ukraine. Kiew drängt auf einen Fahrplan, doch dafür fehlt in der Allianz weiter ein Konsens. Doch es gibt andere Ideen.","https://img.nzz.ch/2023/06/01/90eba4f6-b958-4614-861b-c6a031023c98.jpeg?width=1200&height=675&fit=bound&quality=75&auto=webp&crop=5392,3033,x0,y130&wmark=nzz",2023-06-01T16:22:11Z,https://web.archive.org/web/20230601163906/https://www.nzz.ch/international/ukraine-hoffnung-auf-nato-beitritt-duerfte-enttaeuscht-werden-ld.1740521,"Der französische Präsident Emmanuel Macron während der Globsec-Sicherheitskonferenz in Bratislava
Emmanuel Macron ist längst wieder mit der Nato im Reinen. Am Mittwoch, an einer Sicherheitskonferenz… [+5179 chars]",,de,'Russland'
https://www.nzz.ch/schweiz/europaeische-politische-gemeinschaft-alain-berset-bekraeftigt-die-solidaritaet-nach-schweizer-art-mit-der-ukraine-und-der-moldau-ld.1740500,https://www.nzz.ch/schweiz/europaeische-politische-gemeinschaft-alain-berset-bekraeftigt-die-solidaritaet-nach-schweizer-art-mit-der-ukraine-und-der-moldau-ld.1740500,0,www.nzz.ch,Europäische Politische Gemeinschaft: Alain Berset bekräftigt die Solidarität nach Schweizer Art mit der Ukraine und der Moldau,Der Bundespräsident hat in der Nähe von Chisinau bei den europäischen Partnern um Verständnis für die Schweizer Aussenpolitik geworben. Neben den Leopard-2-Panzern für Deutschland will die Schweiz mit der humanitären Tradition und Minenräumung punkten.,"https://img.nzz.ch/2023/06/01/846e132f-efac-4f41-82eb-b065d8704fa9.jpeg?width=1200&height=674&fit=bound&quality=75&auto=webp&crop=2550,1433,x0,y135&wmark=nzz",2023-06-01T16:23:14Z,https://web.archive.org/web/20230601171723/https://www.nzz.ch/schweiz/europaeische-politische-gemeinschaft-alain-berset-bekraeftigt-die-solidaritaet-nach-schweizer-art-mit-der-ukraine-und-der-moldau-ld.1740500,"Bundespräsident Alain Berset und Wolodimir Selenski am Treffen der Europäischen Politischen Gemeinschaft im moldauischen Bulboaca.
Europa hat sich am Donnerstag vor den Toren der Ukraine versammelt,… [+5799 chars]",,de,'Russland'
https://www.zeit.de/politik/ausland/2023-06/ukraine-ueberblick-belgorod-scholz-sicherheitsgarantien,https://www.zeit.de/politik/ausland/2023-06/ukraine-ueberblick-belgorod-scholz-sicherheitsgarantien,0,www.zeit.de,"Ukraine-Überblick: Erneut Angriffe auf Belgorod, Scholz plädiert für Sicherheitsgarantien",Russland will einen größeren Angriff in seiner Grenzregion abgewehrt haben. Bundeskanzler Scholz stellt der Ukraine Sicherheitsgarantien in Aussicht. Das war der Tag,,2023-06-01T16:28:09Z,,"When browsing with ads:
We collect personal data and also transmit it to third-party providers
 that help us improve and finance our digital content. Some of the information stored on your device, … [+821 chars]",,de,'Russland'
https://consent.google.com/ml?continue=https://news.google.com/rss/articles/CBMirQFodHRwczovL3d3dy5iZXJsaW5lci16ZWl0dW5nLmRlL3BvbGl0aWstZ2VzZWxsc2NoYWZ0L3ZpZXItcnVzc2lzY2hlLWtvbnN1bGF0ZS1pbi1kZXV0c2NobGFuZC1tdWVzc2VuLXNjaGxpZXNzZW4tZXgtYm90c2NoYWZ0ZXItZnVlaGx0LXNpY2gtYW4ta2FsdGVuLWtyaWVnLWVyaW5uZXJ0LWxpLjM1NDUxM9IBAA?oc%3D5&gl=FR&hl=en-US&cm=2&pc=n&src=1,https://consent.google.com/ml?continue=https://news.google.com/rss/articles/CBMirQFodHRwczovL3d3dy5iZXJsaW5lci16ZWl0dW5nLmRlL3BvbGl0aWstZ2VzZWxsc2NoYWZ0L3ZpZXItcnVzc2lzY2hlLWtvbnN1bGF0ZS1pbi1kZXV0c2NobGFuZC1tdWVzc2VuLXNjaGxpZXNzZW4tZXgtYm90c2NoYWZ0ZXItZnVlaGx0LXNpY2gtYW4ta2FsdGVuLWtyaWVnLWVyaW5uZXJ0LWxpLjM1NDUxM9IBAA?oc%3D5&gl=FR&hl=en-US&cm=2&pc=n&src=1,0,consent.google.com,"Schließung von Konsulaten, Ex-Botschafter sagt: „Mehr Nordkorea geht nicht“ - Berliner Zeitung","<ol><li>Schließung von Konsulaten, Ex-Botschafter sagt: „Mehr Nordkorea geht nicht“  Berliner Zeitung
</li><li>Konflikt mit Moskau: Russland kündigt »angemessene Reaktion« auf Konsulatsschließungen an  DER SPIEGEL
</li><li>++ Ukraine-News: Tote nach Raketen…",,2023-06-01T16:33:14Z,,"We use cookies and data to<ul><li>Deliver and maintain Google services</li><li>Track outages and protect against spam, fraud, and abuse</li><li>Measure audience engagement and site statistics to unde… [+1131 chars]",,de,'Russland'
