index,url,valid,domain,title,description,image,published,archive,content,quote,language,keyword
https://www.bild.de/bild-plus/geld/wirtschaft/politik-inland/verband-legt-drei-szenarien-vor-bei-diesen-temperaturen-droht-der-gasmangel-82217374.bild.html,https://www.bild.de/bild-plus/geld/wirtschaft/politik-inland/verband-legt-drei-szenarien-vor-bei-diesen-temperaturen-droht-der-gasmangel-82217374.bild.html,0,www.bild.de,*** BILDplus Inhalt *** Verband legt drei KÃ¤lte-Szenarien vor - Bei DIESEN Temperaturen droht uns der Gasmangel,Es gibt drei Szenarien fÃ¼r den Winter. In einem kommen wir sehr schlecht weg.Foto: Axel Heimken/dpa,"https://images.bild.de/6395a53882c17278ce2f0d4b/710c56d849a301ee6ff3d17efda0c178,286ec036?w=1280",2022-12-11T16:09:22Z,http://archive.md/20221211162232/https://www.bild.de/bild-plus/geld/wirtschaft/politik-inland/verband-legt-drei-szenarien-vor-bei-diesen-temperaturen-droht-der-gasmangel-82217374.bild.html,"Seit dem Beginn von Russlands Angriffskrieg gegen die Ukraine zittert Europa und vor allem Deutschland vor dem Winter. Die Angst vor einer Gas-Mangellage ist groÃŸ.
Der Gasspeicher-Verband hat jetzt â€¦ [+234 chars]",,de,'Gas'
https://www.sueddeutsche.de/muenchen/wolfratshausen/diakonie-oberland-waermewinter-energiekrise-inflation-1.5713292,https://www.sueddeutsche.de/muenchen/wolfratshausen/diakonie-oberland-waermewinter-energiekrise-inflation-1.5713292,0,www.sueddeutsche.de,"Diakonie Oberland: Mit ""WÃ¤rmewinter"" gegen Armut und KÃ¤lte","Die Diakonie Oberland und die Kirchliche Allgemeine Sozialarbeit rufen mit einer SolidaritÃ¤tsaktion zu Spenden fÃ¼r Menschen auf, die unter der Energiekrise und der Inflation besonders stark leiden.",https://www.sueddeutsche.de/image/sz.1.5713293/1200x675?v=1670775091,2022-12-11T16:09:55Z,https://web.archive.org/web/20221212030532/https://www.sueddeutsche.de/muenchen/wolfratshausen/diakonie-oberland-waermewinter-energiekrise-inflation-1.5713292,"Die Diakonie Oberland und die Kirchliche Allgemeine Sozialarbeit rufen mit einer SolidaritÃ¤tsaktion zu Spenden fÃ¼r Menschen auf, die unter der Energiekrise und der Inflation besonders stark leiden.Weâ€¦ [+4832 chars]",,de,'Inflation'
https://www.bild.de/bild-plus/unterhaltung/leute/leute/pietro-und-seine-schwangere-laura-angst-vor-fruehgeburt-82219096.bild.html,https://www.bild.de/bild-plus/unterhaltung/leute/leute/pietro-und-seine-schwangere-laura-angst-vor-fruehgeburt-82219096.bild.html,0,www.bild.de,Pietro und seine schwangere Laura - Angst vor FrÃ¼hgeburt,"DSDS-Star Pietro Lombardi (30) weicht nicht vom Krankenbett seiner Verlobten.Â Foto: ğ�—Ÿğ�—”ğ�—¨ğ�—¥ğ�—” ğ�— ğ�—”ğ�—¥ğ�—œğ�—”/Instagram, lauramaria.rpa/Instagram","https://images.bild.de/6395ca7c82c17278ce2f0d8d/1848188031f9d95da4344ebb59861fc3,845020fc?w=1280",2022-12-11T16:37:36Z,https://web.archive.org/web/20221211180406/https://www.bild.de/bild-plus/unterhaltung/leute/leute/pietro-und-seine-schwangere-laura-angst-vor-fruehgeburt-82219096.bild.html,"DSDS-Star Pietro Lombardi (30) ist mÃ¤chtig stolz und mÃ¤chtig in Sorge zugleich. 
Seit Samstag liegt die Verlobte des SÃ¤ngers im Krankenhaus und Pietro weicht ihr nicht von der Seite. Laura Maria Rypâ€¦ [+268 chars]",,de,'Angst'
https://www.sueddeutsche.de/politik/zweiter-weltkrieg-1942-peter-englund-1.5710721,https://www.sueddeutsche.de/politik/zweiter-weltkrieg-1942-peter-englund-1.5710721,0,www.sueddeutsche.de,Das Politische Buch: Der Krieg in den KÃ¶pfen,"Peter Englund will zeigen, wie der Zweite Weltkrieg erlebt wurde. Er konzentriert dafÃ¼r seinen Blick auf einen einzigen Monat im Jahr 1942. So gelingt ihm ein eindrucksvolles Panorama.",https://www.sueddeutsche.de/image/sz.1.5710722/1200x675?v=1670772877,2022-12-11T17:34:08Z,,"Peter Englund will zeigen, wie der Zweite Weltkrieg erlebt wurde. Er konzentriert dafÃ¼r seinen Blick auf einen einzigen Monat im Jahr 1942. So gelingt ihm ein eindrucksvolles Panorama. Vierzig Menschâ€¦ [+3109 chars]",,de,'Krieg'
https://www.brigitte.de/liebe/persoenlichkeit/angst-vor-der-neuen-woche--3-anzeichen--dass-du-an--sunday-scaries--leidest-13405010.html,https://www.brigitte.de/liebe/persoenlichkeit/angst-vor-der-neuen-woche--3-anzeichen--dass-du-an--sunday-scaries--leidest-13405010.html,0,www.brigitte.de,"Psychologie: Angst vor der neuen Woche: 3 Anzeichen, dass du an ""Sunday Scaries"" leidest","Viele Menschen leiden an den sogenannten ""Sunday Scaries"". Was man darunter versteht und wie man das psychologische PhÃ¤nomen erkennen kann, verraten wir euch im Video.",https://image.brigitte.de/13404932/t/EJ/v3/w1440/r1.7778/-/sunday-scaries-teaser.jpg,2022-12-11T19:00:00Z,,"Hast du am Sonntagabend auch schon Angst vor den Herausforderungen, die dich in der nÃ¤chsten Woche erwarten? Dann leidest du vielleicht an ""Sunday Scaries"".
WÃ¤hrend Kolleg:innen und Freund:innen sicâ€¦ [+258 chars]",,de,'Angst'
https://www.zeit.de/news/2022-12/13/inflation-im-november-bei-10-prozent,https://www.zeit.de/news/2022-12/13/inflation-im-november-bei-10-prozent,0,www.zeit.de,Energiekrise: Inflation im November bei 10 Prozent,,,2022-12-13T07:25:52Z,https://web.archive.org/web/20221214075913/https://www.zeit.de/news/2022-12/13/inflation-im-november-bei-10-prozent,"When browsing with ads:
We collect personal data and also transmit it to third-party providers
 that help us improve and finance our digital content. Some of the information stored on your device, … [+732 chars]",,de,'Inflation'
https://www.zeit.de/wirtschaft/2022-12/inflation-verbraucherpreise-statistisches-bundesamt,https://www.zeit.de/wirtschaft/2022-12/inflation-verbraucherpreise-statistisches-bundesamt,0,www.zeit.de,Statistisches Bundesamt: Inflation schwächt sich auf hohem Niveau leicht ab,Mit einer Teuerungsrate von zehn Prozent ist die Inflation in Deutschland weiterhin hoch. Die Teuerung hat sich im November erwartungsgemäß aber etwas verlangsamt.,,2022-12-13T07:37:25Z,https://web.archive.org/web/20221214030424/https://www.zeit.de/wirtschaft/2022-12/inflation-verbraucherpreise-statistisches-bundesamt,"When browsing with ads:
We collect personal data and also transmit it to third-party providers
 that help us improve and finance our digital content. Some of the information stored on your device, … [+732 chars]",,de,'Inflation'
https://www.zeit.de/wirtschaft/unternehmen/2022-12/inflation-ifo-unternehmen-gewinne-maximierung,https://www.zeit.de/wirtschaft/unternehmen/2022-12/inflation-ifo-unternehmen-gewinne-maximierung,0,www.zeit.de,ifo Institut: Firmen nutzen laut Studie die Inflation zur Gewinnmaximierung,"Nur die hohen Preise für Energie und Vorprodukte erklärten die Inflation nicht, sagt das ifo Institut. Unternehmen würden die Situation nutzen, um Gewinne zu steigern.",,2022-12-13T08:54:28Z,http://archive.md/20221213095627/https://www.zeit.de/wirtschaft/unternehmen/2022-12/inflation-ifo-unternehmen-gewinne-maximierung,"When browsing with ads:
We collect personal data and also transmit it to third-party providers
 that help us improve and finance our digital content. Some of the information stored on your device, … [+732 chars]",,de,'Inflation'
https://www.welt.de/politik/ausland/article242649911/Ukraine-News-Botschafter-Makejew-lobt-Deutschlands-Fuehrungsrolle.html,https://www.welt.de/politik/ausland/article242649911/Ukraine-News-Botschafter-Makejew-lobt-Deutschlands-Fuehrungsrolle.html,0,www.welt.de,Botschafter Makejew lobt Deutschlands „Führungsrolle“,"Der neue Botschafter der Ukraine in Berlin schlägt andere Töne an als sein Vorgänger. Olexij Makajew lobte nun den deutschen Einsatz für sein kriegsgebeuteltes Land. In Russland schlägt die Stimmung hingegen um, warnt London. Mehr im Liveticker.",https://img.welt.de/img/politik/ausland/mobile242604881/0991359107-ci16x9-w1200/Der-Ukrainische-Botschafter-in-Deut-3.jpg,2022-12-13T09:06:00Z,https://web.archive.org/web/20221213104348/https://www.welt.de/politik/ausland/article242649911/Ukraine-News-Botschafter-Makejew-lobt-Deutschlands-Fuehrungsrolle.html,"Der neue Botschafter der Ukraine in Berlin, Olexij Makejew, hat Deutschland ausdrücklich für die besondere Unterstützung seines Landes gedankt. Er sei froh, dass Deutschland inzwischen eine Führungsr… [+7247 chars]",,de,'Ukraine'
https://www.stern.de/politik/ausland/ukraine-news--deutschland-sagt-ukraine-weitere-50-millionen-euro-als-winterhilfe-zu-33000920.html,https://www.stern.de/politik/ausland/ukraine-news--deutschland-sagt-ukraine-weitere-50-millionen-euro-als-winterhilfe-zu-33000920.html,0,www.stern.de,Russlands Krieg gegen die Ukraine: Deutschland sagt Ukraine weitere 50 Millionen Euro als Winterhilfe zu,Konferenz in Paris soll Winterhilfe für Ukraine mobilisieren +++ Kiew: Kämpfe um Bachmut und Awdijiwka dauern an +++ Die Meldungen zum Krieg in der Ukraine im stern-Liveblog.,https://image.stern.de/33002584/t/ny/v4/w1440/r1.7778/-/ukraine-konferenz-paris.jpg,2022-12-13T10:16:00Z,,"Deutschland sagt der Ukraine weitere 50 Millionen Euro als Winterhilfe zu. ""Geld allein schützt nicht vor dem Erfrieren und Verdursten, und deswegen ist die ganz konkrete technische Hilfe so wichtig""… [+623 chars]",,de,'Kämpfe'
https://www.freitag.de/autoren/der-freitag/jugoslawien-die-unheilvolle-dynamik-des-krieges-nahm-ihren-lauf,https://www.freitag.de/autoren/der-freitag/jugoslawien-die-unheilvolle-dynamik-des-krieges-nahm-ihren-lauf,0,www.freitag.de,Buch | Norbert Mappes-Niediek zu Jugoslawien: Die unheilvolle Dynamik des Krieges,„Krieg in Europa. Der Zerfall Jugoslawiens und der überforderte Kontinent“ lautet der Titel des herausragenden Buchs von Norbert Mappes-Niediek. Der Südosteuropa-Experte schreibt über den Zerfall Jugoslawiens. Ein Standardwerk Die vorliegende Analyse über den…,https://www.freitag.de/autoren/der-freitag/jugoslawien-die-unheilvolle-dynamik-des-krieges-nahm-ihren-lauf/@@images/social_image,2022-12-13T11:00:00Z,https://web.archive.org/web/20221208192805/https://www.freitag.de/autoren/der-freitag/jugoslawien-die-unheilvolle-dynamik-des-krieges-nahm-ihren-lauf,"Die vorliegende Analyse über den Zerfall Jugoslawiens ist eine der gründlichsten Darstellungen, national wie international, die je zu diesem Thema erschienen ist als Literaturübersetzerin und Kulturv… [+521 chars]",,de,'Krieg'
https://www.fr.de/politik/bevoelkerung-ukraine-krieg-russland-strategie-fehler-putin-angriff-beschuss-91971259.html,https://www.fr.de/politik/bevoelkerung-ukraine-krieg-russland-strategie-fehler-putin-angriff-beschuss-91971259.html,0,www.fr.de,Russland setzt „gescheiterte Strategie“ ein: „Katastrophale Fehler“ im Ukraine-Krieg - fr.de,"<ol><li>Russland setzt „gescheiterte Strategie“ ein: „Katastrophale Fehler“ im Ukraine-Krieg  fr.de
</li><li>Experte: „Der Krieg ist schwer zu beenden, weil Russland ihn verloren hat“  FOCUS Online
</li><li>Putin gerät in die Kritik - „Kopf des Fisches völl…",https://www.fr.de/bilder/2022/12/12/91971259/30486250-russland-beschiesst-im-ukraine-krieg-aktuell-vermehrt-die-bevoelkerung-archivbild-Mfe.jpg,2022-12-13T11:10:00Z,https://web.archive.org/web/20221213051922/https://www.fr.de/politik/bevoelkerung-ukraine-krieg-russland-strategie-fehler-putin-angriff-beschuss-91971259.html,"<ol><li>Startseite</li><li>Politik</li></ol>Erstellt: 13.12.2022, 12:10 Uhr
Von: Sebastian Richter
KommentareTeilen
Russland kann im Ukraine-Krieg keine nennenswerten Erfolge für sich verbuchen. E… [+3007 chars]",,de,'Russland'
https://www.stern.de/politik/ausland/ukraine-news--selenskyj-schaetzt-beduerfnisse-bei-energieversorgung-auf-800-millionen-euro-33000920.html,https://www.stern.de/politik/ausland/ukraine-news--selenskyj-schaetzt-beduerfnisse-bei-energieversorgung-auf-800-millionen-euro-33000920.html,0,www.stern.de,Russlands Krieg gegen die Ukraine: Selenskyj schätzt Bedürfnisse bei Energieversorgung im Winter auf 800 Millionen Euro,Konferenz in Paris soll Winterhilfe für Ukraine mobilisieren +++ Kiew: Kämpfe um Bachmut und Awdijiwka dauern an +++ Die Meldungen zum Krieg in der Ukraine im stern-Liveblog.,https://image.stern.de/33002584/t/ny/v4/w1440/r1.7778/-/ukraine-konferenz-paris.jpg,2022-12-13T12:06:00Z,,"Deutschland sagt der Ukraine weitere 50 Millionen Euro als Winterhilfe zu. ""Geld allein schützt nicht vor dem Erfrieren und Verdursten, und deswegen ist die ganz konkrete technische Hilfe so wichtig""… [+623 chars]",,de,'Russland'
https://www.welt.de/politik/ausland/plus242652961/Korruptionsskandal-Jetzt-herrscht-in-Bruessel-Angst-vor-weiteren-Enthuellungen.html,https://www.welt.de/politik/ausland/plus242652961/Korruptionsskandal-Jetzt-herrscht-in-Bruessel-Angst-vor-weiteren-Enthuellungen.html,0,www.welt.de,Jetzt herrscht in Brüssel Angst vor weiteren Enthüllungen,"Nach den ersten Razzien und Festnahmen hieß es in Brüssel, das seien Einzelfälle und schwarze Schafe. Aber am Montag gab es neue Durchsuchungen. Und immer mehr Stimmen warnen, dass die bekannten Bestechungsfälle nur die Spitze des Eisbergs sein könnten.",https://img.welt.de/img/politik/ausland/mobile242653473/0931354227-ci16x9-w1200-fnov-fpotl-fpi157750653/DWO-Teaser-EU-Korruption-jb-eps.jpg,2022-12-13T12:51:58Z,http://archive.md/20221213125734/https://www.welt.de/politik/ausland/plus242652961/Korruptionsskandal-Jetzt-herrscht-in-Bruessel-Angst-vor-weiteren-Enthuellungen.html,"Uul pel evelleu Bnlekpneknuapvette kelleu eektleleke BV-BelteOeulellel enl VBUI-Belluelonptlhelluu Butllleu aepeal, ple peleu epeleenal, ple Pupekntplanuaeu velpeu plek ent elulae veulae Belpuueu pep… [+4456 chars]",,de,'Angst'
https://www.zeit.de/news/2022-12/13/feinstaub-muell-tiere-in-angst-feuerwerkverbot-gefordert,https://www.zeit.de/news/2022-12/13/feinstaub-muell-tiere-in-angst-feuerwerkverbot-gefordert,0,www.zeit.de,"Silvester: Feinstaub, Müll, Tiere in Angst: Feuerwerkverbot gefordert",,,2022-12-13T12:55:08Z,,"When browsing with ads:
We collect personal data and also transmit it to third-party providers
 that help us improve and finance our digital content. Some of the information stored on your device, … [+732 chars]",,de,'Angst'
https://www.welt.de/politik/ausland/article242649911/Ukraine-News-Russland-nennt-Anerkennung-annektierter-Gebiete-als-Voraussetzung-fuer-Friedensgespraeche.html,https://www.welt.de/politik/ausland/article242649911/Ukraine-News-Russland-nennt-Anerkennung-annektierter-Gebiete-als-Voraussetzung-fuer-Friedensgespraeche.html,0,www.welt.de,Russland nennt Anerkennung annektierter Gebiete als Voraussetzung für Friedensgespräche,"Solange Kiew die Annexion der vier ukrainischen Regionen Donezk, Luhansk, Saporischschja und Cherson nicht anerkennt, werde es keine Friedensverhandlungen geben, erklärte Kreml-Sprecher Dmitri Peskow. Die Ukraine müsse diese „Realitäten“ berücksichtigen. Mehr…",https://img.welt.de/img/regionales/mecklenburg-vorpommern/mobile242205343/1341357487-ci16x9-w1200/Dmitri-Peskow.jpg,2022-12-13T13:06:00Z,https://web.archive.org/web/20221213192737/https://www.welt.de/politik/ausland/article242649911/Ukraine-News-Russland-nennt-Anerkennung-annektierter-Gebiete-als-Voraussetzung-fuer-Friedensgespraeche.html,"Russland macht nach eigenen Angaben die Abtretung seiner annektierten Gebiete durch die Ukraine zur Voraussetzung für Friedensverhandlungen. Kiew müsse die Realitäten berücksichtigen, die sich vor Or… [+15809 chars]",,de,'Ukraine'
https://www.stern.de/politik/ausland/ukraine-news--russland-fordert-vor-friedensgespraechen-anerkennung-annektierter-gebiete-33000920.html,https://www.stern.de/politik/ausland/ukraine-news--russland-fordert-vor-friedensgespraechen-anerkennung-annektierter-gebiete-33000920.html,0,www.stern.de,Russlands Krieg gegen die Ukraine: Russland fordert vor Friedensgesprächen Anerkennung annektierter Gebiete durch Kiew,Konferenz in Paris soll Winterhilfe für Ukraine mobilisieren +++ Kiew: Kämpfe um Bachmut und Awdijiwka dauern an +++ Die Meldungen zum Krieg in der Ukraine im stern-Liveblog.,https://image.stern.de/33003352/t/Dt/v2/w1440/r1.7778/-/frontlinie-donbass.jpg,2022-12-13T13:14:00Z,,"Deutschland sagt der Ukraine weitere 50 Millionen Euro als Winterhilfe zu. ""Geld allein schützt nicht vor dem Erfrieren und Verdursten, und deswegen ist die ganz konkrete technische Hilfe so wichtig""… [+623 chars]",,de,'Krieg'
https://www.handelsblatt.com/finanzen/geldpolitik/preisentwicklung-us-inflationsrate-schwaecht-sich-staerker-ab-als-prognostiziert-investoren-reagieren-erleichtert/28864582.html,https://www.handelsblatt.com/finanzen/geldpolitik/preisentwicklung-us-inflationsrate-schwaecht-sich-staerker-ab-als-prognostiziert-investoren-reagieren-erleichtert/28864582.html,0,www.handelsblatt.com,Preisentwicklung: US-Inflationsrate schwächt sich stärker ab als prognostiziert – Investoren reagieren erleichtert,"Im November stiegen die Verbraucherpreise gegenüber dem Vorjahresmonat um 7,1 Prozent. Das nährt Spekulationen auf kleinere Zinsschritte der US-Notenbank.",https://www.handelsblatt.com/images/shopping-in-manhattan-am-black-friday/28865042/2-format2003.jpg,2022-12-13T13:30:00Z,,"Shopping in Manhattan am Black FridayDie US-Verbraucher können etwas aufatmen, weil die Preise nicht mehr so rasant steigen.
(Foto: Bloomberg) 
New York In den USA scheint die Inflation ihren Höhep… [+1118 chars]",,de,'Inflation'
https://www.handelsblatt.com/finanzen/geldpolitik/verbraucherpreise-us-inflationsrate-sinkt-unerwartet-stark-auf-7-1-prozent/28864582.html,https://www.handelsblatt.com/finanzen/geldpolitik/verbraucherpreise-us-inflationsrate-sinkt-unerwartet-stark-auf-7-1-prozent/28864582.html,0,www.handelsblatt.com,"Verbraucherpreise: US-Inflationsrate sinkt unerwartet stark auf 7,1 Prozent",Die Preise sind in den USA sind etwas langsamer gestiegen. Der Rückgang fällt damit stärker aus als von Ökonomen erwartet.,https://www.handelsblatt.com/images/supermarkt/28864630/2-format2003.jpg,2022-12-13T13:30:00Z,https://web.archive.org/web/20221213140224/https://www.handelsblatt.com/finanzen/geldpolitik/verbraucherpreise-us-inflationsrate-sinkt-unerwartet-stark-auf-7-1-prozent/28864582.html,"SupermarktDie Preise sind in den USA langsamer gestiegen.
(Foto: AP) 
Düsseldorf Die Inflation in den USA ist im November leicht gesunken. Die jährliche Teuerungsrate lag bei 7,1 Prozent, wie das U… [+1578 chars]",,de,'Inflation'
https://www.stern.de/digital/technik/kiews-mechanisierte-brigaden---diese-einheiten-haben-die-russen-zurueckgeworfen-32999954.html,https://www.stern.de/digital/technik/kiews-mechanisierte-brigaden---diese-einheiten-haben-die-russen-zurueckgeworfen-32999954.html,0,www.stern.de,Krieg in der Ukraine: Kiews mechanisierte Brigaden: Diese Einheiten haben die Russen zurückgeworfen,Ohne gepanzerte Verbände gibt es keine Gegenoffensive. Kiew schaffte das Kunststück inmitten der Invasion neue Einheiten aufzustellen – mit Hilfe der Verbündeten.,https://image.stern.de/32999956/t/ol/v2/w1440/r1.7778/-/m113-transporter.jpg,2022-12-13T13:34:00Z,,Nach den Erfahrungen der ersten Kriegsmonate in der Ukraine wurde der Kampfpanzer bereits totgesagt. Vor allem die russischen Streitkräfte erlitten große Verluste durch die kleinen Panzerbekämpfungsm… [+5503 chars],,de,'Krieg'
https://www.nzz.ch/wirtschaft/inflation-usa-mit-71-prozent-geht-sie-weiter-zurueck-ld.1716752,https://www.nzz.ch/wirtschaft/inflation-usa-mit-71-prozent-geht-sie-weiter-zurueck-ld.1716752,0,www.nzz.ch,"7,1 Prozent - die US-Inflation geht weiter zurück, ist aber immer noch auf sehr hohem Niveau","Der allgemeine Preisauftrieb scheint zwar etwas nachzulassen, aber für Euphorie ist es zu früh. Selbst die Notenbanker fürchten angesichts des regen Lohnwachstums die Entstehung einer Lohn-Preisspirale. Eine solche könnte sogar zu unerwartet hohen Zinsen führ…","https://img.nzz.ch/2022/12/13/6f8e5339-db1e-49f4-be90-39bb4d8cc121.jpeg?width=1200&height=675&fit=bound&quality=75&auto=webp&crop=5328,2997,x0,y502&wmark=nzz",2022-12-13T13:36:04Z,https://web.archive.org/web/20221213154042/https://www.nzz.ch/wirtschaft/inflation-usa-mit-71-prozent-geht-sie-weiter-zurueck-ld.1716752,"Treibstoffe sind inzwischen etwas günstiger geworden.
Der amerikanische Preisauftrieb lässt zwar etwas nach, aber er ist immer noch enorm. Die Inflationsrate ist im November im Vergleich mit dem Vor… [+3233 chars]",,de,'Inflation'
https://www.zeit.de/gesellschaft/2022-12/weihnachten-inflation-preissteigerungen-aufruf,https://www.zeit.de/gesellschaft/2022-12/weihnachten-inflation-preissteigerungen-aufruf,0,www.zeit.de,Inflation: Können Sie sich Weihnachten noch leisten?,"Braten, Baum, Geschenke: Das Weihnachtsfest ist teuer. Müssen Sie angesichts steigender Preise in diesem Jahr auf manches verzichten?",,2022-12-13T13:41:32Z,,"When browsing with ads:
We collect personal data and also transmit it to third-party providers
 that help us improve and finance our digital content. Some of the information stored on your device, … [+732 chars]",,de,'Inflation'
https://www.wiwo.de/finanzen/boerse/bitcoin-kurs-aktuell-inflation-in-den-usa-faellt-auf-7-1-prozent/27382428.html,https://www.wiwo.de/finanzen/boerse/bitcoin-kurs-aktuell-inflation-in-den-usa-faellt-auf-7-1-prozent/27382428.html,0,www.wiwo.de,"Bitcoin-Kurs aktuell: Inflation in den USA fällt auf 7,1 Prozent","Die US-Verbraucherpreise sind langsamer gestiegen als erwartet. Der Bitcoin legt zu, die Entwicklungen rund um die gescheiterte FTX-Übernahme drücken aber auf den Kryptomarkt. Die Nachrichten im Bitcoin-Newsblog.",https://www.wiwo.de/images/file-photo-illustration-shows-representations-of-cryptocurrency-bitcoin/28435878/2-format11240.jpg,2022-12-13T13:43:00Z,,"Aktuelle News und Nachrichten von heute zum Bitcoin (BTC) und zum aktuellen Kurs
Hier sehen Sie den aktuellen Bitcoin-Kurs in US-Dollar und in Echtzeit. Der tatsächliche Wert kann daher von den im T… [+84833 chars]",,de,'Inflation'
https://www.faz.net/aktuell/wirtschaft/inflation-in-den-usa-teuerungsrate-faellt-auf-7-1-prozent-18531229.html,https://www.faz.net/aktuell/wirtschaft/inflation-in-den-usa-teuerungsrate-faellt-auf-7-1-prozent-18531229.html,0,www.faz.net,Hohe Inflation ebbt vor Fed-Sitzung ab,"In Amerika steigen die Preise nicht mehr so schnell. Die Teuerungsrate fiel im November stärker als erwartet auf 7,1. Es ist der fünfte Rückgang in Folge.",https://media0.faz.net/ppmedia/aktuell/wirtschaft/2562645021/1.8531240/facebook_teaser/das-gebaeude-der.jpg,2022-12-13T13:49:52Z,,"Die Inflation in den Vereinigten Staaten ist vor der letzten US-Zinssitzung in diesem Jahr weiter auf dem Rückmarsch. Die Teuerungsrate für Waren und Dienstleistungen fiel im November auf 7,1 von 7,7… [+833 chars]",,de,'Inflation'
https://www.handelsblatt.com/finanzen/maerkte/marktberichte/dax-aktuell-dax-springt-nach-us-inflationsdaten-ueber-200-punkte-nach-oben-gute-chancen-auf-rally-fortsetzung/28863702.html,https://www.handelsblatt.com/finanzen/maerkte/marktberichte/dax-aktuell-dax-springt-nach-us-inflationsdaten-ueber-200-punkte-nach-oben-gute-chancen-auf-rally-fortsetzung/28863702.html,0,www.handelsblatt.com,Dax aktuell: Dax springt nach US-Inflationsdaten über 200 Punkte nach oben – Gute Chancen auf Rally-Fortsetzung,Mit dem heutigen Kurssprung beendet der Dax seine vierwöchige Seitwärtsphase. Zu den Gewinnern zählen vor allem Technologiewerte.,https://www.handelsblatt.com/images/dax-tafel-in-frankfurt-kurz-nach-bekanntgabe-der-us-inflationsdaten/28864908/2-format2003.jpg,2022-12-13T13:50:09Z,,Düsseldorf Die US-Inflationsdaten haben wie bereits im Vormonat den deutschen Aktienmarkt beflügelt. Nach den Daten schnellte der Dax am Dienstagnachmittag um mehr als 200 Punkten nach oben. Derzeit … [+4704 chars],,de,'Inflation'
https://www.handelsblatt.com/finanzen/maerkte/marktberichte/dax-aktuell-dax-springt-nach-us-inflationsdaten-ueber-200-punkte-nach-oben-rally-duerfte-sich-fortsetzen/28863702.html,https://www.handelsblatt.com/finanzen/maerkte/marktberichte/dax-aktuell-dax-springt-nach-us-inflationsdaten-ueber-200-punkte-nach-oben-rally-duerfte-sich-fortsetzen/28863702.html,0,www.handelsblatt.com,Dax aktuell: Dax spring nach US-Inflationsdaten über 200 Punkte nach oben – Rally dürfte sich fortsetzen,Mit dem heutigen Kurssprung beendet der Dax seine vierwöchige Seitwärtsphase. Damit dürfte sich die 2700-Punkte-Rally fortsetzen.,https://www.handelsblatt.com/images/dax-tafel-in-frankfurt-kurz-nach-bekanntgabe-der-us-inflationsdaten/28864908/2-format2003.jpg,2022-12-13T13:50:09Z,,Düsseldorf Die US-Inflationsdaten haben wie bereits im Vormonat den deutschen Aktienmarkt beflügelt. Nach den Daten schnellte der Dax am Dienstagnachmittag um mehr als 200 Punkten nach oben. Derzeit … [+3651 chars],,de,'Inflation'
https://www.tagesspiegel.de/wirtschaft/risikokapitalgeber-uber-start-up-finanzierung-hatten-eine-situation-richtung-ubertreibung-9020131.html,https://www.tagesspiegel.de/wirtschaft/risikokapitalgeber-uber-start-up-finanzierung-hatten-eine-situation-richtung-ubertreibung-9020131.html,0,www.tagesspiegel.de,Risikokapitalgeber über Start-up-Finanzierung: “Hatten eine Situation Richtung Übertreibung”,"Über die aktuellen Finanzierungsbedingungen für Start-ups, die jüngste Entlassungswelle, Investitionskriterien für Investoren und die Zukunft der Branche.",https://www.tagesspiegel.de/images/100-pro-imago-life-2115615859-highresjpg/alternates/BASE_16_9_W1400/100-pro-imago-life-2115615859-highresjpg.jpeg,2022-12-13T13:51:36Z,,"Herr Nagel, viele Start-ups in Deutschland bauen zuletzt im großen Stil Personal ab und klagen über schwierige Finanzierungsbedingungen. Warum machen Sie und andere Risikokapitalgeber es den Startups… [+8613 chars]",,de,'Risiko'
