index,url,valid,domain,title,description,image,published,archive,content,quote,language,keyword
https://www.zeit.de/news/2025-07/01/ukraine-un-generalsekretaer-fuer-bedingungslose-waffenruhe,https://www.zeit.de/news/2025-07/01/ukraine-un-generalsekretaer-fuer-bedingungslose-waffenruhe,0,www.zeit.de,Die Lage im Überblick: Ukraine: UN-Generalsekretär für bedingungslose Waffenruhe,Hier finden Sie Informationen zu dem Thema „Die Lage im Überblick“. Lesen Sie jetzt „Ukraine: UN-Generalsekretär für bedingungslose Waffenruhe“.,https://img.zeit.de/news/2025-07/01/ukraine-un-generalsekretaer-fuer-bedingungslose-waffenruhe-image-group/wide__1300x731,2025-07-01T02:56:36Z,,Angesichts der unvermindert heftigen Angriffe Russlands auf die Ukraine mahnt UN-Generalsekretär António Guterres eine sofortige und bedingungslose Waffenruhe an. Dies sei ein erster Schritt hin zu e… [+4830 chars],,de,'Ukraine'
https://www.welt.de/wirtschaft/weltplus/plus256328340/Trotz-halb-leerer-Gasspeicher-Regierung-vermietet-schwimmendes-LNG-Terminal.html,https://www.welt.de/wirtschaft/weltplus/plus256328340/Trotz-halb-leerer-Gasspeicher-Regierung-vermietet-schwimmendes-LNG-Terminal.html,0,www.welt.de,Trotz halb leerer Gasspeicher – Deutschland vermietet schwimmendes LNG-Terminal weiter,"Noch ist unklar, ob die deutschen Gasspeicher bis zum Winter ausreichend gefüllt werden. Dennoch hat die Bundesregierung ein schwimmendes Flüssiggas-Terminal gen Süden ziehen lassen – zur Untermiete. Experten warnen: Wird der Winter kalt, könnte das Gas knapp…",https://images.welt.de/6862aad554352c1fc4b321ff/30c6dc825bcc54974ee7ff2508ec0704-master/ci16x9-w1200-fnov-fpotl-fpi157750653/lng-fluessiggas-terminal-mit-anlegenden-spezialschiff-energos-force-am-elbufer-in-stade-im-bundesland-niedersachsen-deutschland,2025-07-01T05:00:00Z,,"Noch ist unklar, ob die deutschen Gasspeicher bis zum Winter ausreichend gefüllt werden. Dennoch hat die Bundesregierung ein schwimmendes Flüssiggas-Terminal gen Süden ziehen lassen zur Untermiete. E… [+65 chars]",,de,'Gas'
https://www.zeit.de/politik/ausland/2025-06/krieg-ukraine-hilfen-johann-wadephul-russland-5vor8,https://www.zeit.de/politik/ausland/2025-06/krieg-ukraine-hilfen-johann-wadephul-russland-5vor8,0,www.zeit.de,"Krieg in der Ukraine: Was, wenn Putin die Nato testet?","Russland ist eine reale Gefahr für Deutschland, warnt Außenminister Johann Wadephul. Gemessen daran ist das Handeln der Bundesregierung kurzsichtig.",https://img.zeit.de/politik/ausland/2025-06/krieg-ukraine-hilfen-johann-wadephul-russland-5vor8-bild/wide__1300x731,2025-07-01T06:00:46Z,,"Kann es sein, dass Bundeskanzler Friedrich Merz und sein Außenminister Johann Wadephul ein wenig übertreiben mit ihren Warnungen vor Russland? Einen Tag vor seiner Reise in die ukrainische Hauptstadt… [+632 chars]",,de,'Putin'
https://www.diepresse.com/19849606/die-notenbank-bremst-russlands-wirtschaft-aus,https://www.diepresse.com/19849606/die-notenbank-bremst-russlands-wirtschaft-aus,0,www.diepresse.com,Die Notenbank bremst Russlands Wirtschaft aus [premium],"Um die Inflation in den Griff zu bekommen, legt Russlands Zentralbank eine Vollbremsung hin – und hemmt das zuletzt kräftige Wirtschaftswachstum in dem Land. Für die Ukraine trübt sich der Ausblick weiter ein.",https://img.diepresse.com/public/incoming/ni54x9-RUSSIA-AGRICULTURESEEDS/alternates/DPR_SOCIAL_MAGAZIN/RUSSIA-AGRICULTURESEEDS,2025-07-01T06:03:15Z,,"Um die Inflation in den Griff zu bekommen, legt Russlands Zentralbank eine Vollbremsung hin und hemmt das zuletzt kräftige Wirtschaftswachstum in dem Land. Für die Ukraine trübt sich der Ausblick wei… [+679 chars]",,de,'Inflation'
https://www.stern.de/wirtschaft/news/prognose--institut--konjunktur-in-russland-und-ukraine-truebt-sich-ein-35854638.html,https://www.stern.de/wirtschaft/news/prognose--institut--konjunktur-in-russland-und-ukraine-truebt-sich-ein-35854638.html,0,www.stern.de,Prognose: Institut: Konjunktur in Russland und Ukraine trübt sich ein,Der Rubel rollt - oder eben auch nicht. Die hohen Zinsen machen laut Experten der russischen Wirtschaft zunehmend zu schaffen. In Kiew sieht es nicht besser aus.,https://image.stern.de/35854640/t/j_/v1/w1440/r1.7778/-/01--e3iu5rhnedv3axs2048jpeg---a3b2eaa5e880885d.jpg,2025-07-01T06:15:37Z,,"Kopiere den aktuellen Link
Zur Merkliste hinzufügen
Der Rubel rollt - oder eben auch nicht. Die hohen Zinsen machen laut Experten der russischen Wirtschaft zunehmend zu schaffen. In Kiew sieht es n… [+2170 chars]",,de,'Russland'
https://www.zeit.de/news/2025-07/01/institut-konjunktur-in-russland-und-ukraine-truebt-sich-ein,https://www.zeit.de/news/2025-07/01/institut-konjunktur-in-russland-und-ukraine-truebt-sich-ein,0,www.zeit.de,Prognose: Institut: Konjunktur in Russland und Ukraine trübt sich ein,Hier finden Sie Informationen zu dem Thema „Prognose“. Lesen Sie jetzt „Institut: Konjunktur in Russland und Ukraine trübt sich ein“.,https://img.zeit.de/news/2025-07/01/institut-konjunktur-in-russland-und-ukraine-truebt-sich-ein-image-group/wide__1300x731,2025-07-01T06:15:37Z,,Für die Kriegsgegner Russland und Ukraine trüben sich laut einer neuen Prognose die Konjunkturaussichten weiter ein. In Russland dürfte sich das Wachstum für 2025 im Vergleich zum Vorjahr auf zwei Pr… [+1992 chars],,de,'Russland'
https://www.tagesspiegel.de/wirtschaft/prognose-institut-konjunktur-in-russland-und-ukraine-trubt-sich-ein-13944895.html,https://www.tagesspiegel.de/wirtschaft/prognose-institut-konjunktur-in-russland-und-ukraine-trubt-sich-ein-13944895.html,0,www.tagesspiegel.de,Prognose: Institut: Konjunktur in Russland und Ukraine trübt sich ein,Der Rubel rollt - oder eben auch nicht. Die hohen Zinsen machen laut Experten der russischen Wirtschaft zunehmend zu schaffen. In Kiew sieht es nicht besser aus.,https://www.tagesspiegel.de/images/13944892/alternates/BASE_16_9_W1400/1751350597000/ukraine-krieg-kiew.jpeg,2025-07-01T06:16:37Z,,Für die Kriegsgegner Russland und Ukraine trüben sich laut einer neuen Prognose die Konjunkturaussichten weiter ein. In Russland dürfte sich das Wachstum für 2025 im Vergleich zum Vorjahr auf zwei Pr… [+2713 chars],,de,'Ukraine'
https://www.stern.de/gesellschaft/regional/nordrhein-westfalen/verbraucherpreise--inflation-faellt-leicht---kaffee-und-obst-deutlich-teurer-35851924.html,https://www.stern.de/gesellschaft/regional/nordrhein-westfalen/verbraucherpreise--inflation-faellt-leicht---kaffee-und-obst-deutlich-teurer-35851924.html,0,www.stern.de,Verbraucherpreise: Inflation fällt leicht - Kaffee und Obst deutlich teurer,Der Preisdruck auf Verbraucherinnen und Verbraucher in NRW hat im Juni im Vergleich zum Mai etwas nachgelassen. Einige Produkte weisen trotzdem hohe Preissteigerungen auf.,https://image.stern.de/35854664/t/cD/v1/w1440/r1.7778/-/01--ytnk25lk4bv6axs2048jpeg---9e971fcef31fa382.jpg,2025-07-01T06:28:59Z,,"Kopiere den aktuellen Link
Zur Merkliste hinzufügen
Der Preisdruck auf Verbraucherinnen und Verbraucher in NRW hat im Juni im Vergleich zum Mai etwas nachgelassen. Einige Produkte weisen trotzdem h… [+1271 chars]",,de,'Inflation'
https://www.stern.de/wirtschaft/news/konjunktur--stimmung-in-der-chemie-zieht-kraeftig-an-35854722.html,https://www.stern.de/wirtschaft/news/konjunktur--stimmung-in-der-chemie-zieht-kraeftig-an-35854722.html,0,www.stern.de,Konjunktur: Stimmung in der Chemie zieht kräftig an,Vor allem die Geschäftserwartungen sind sprunghaft gestiegen - die Branche setzt auf niedrigere Energiekosten. Der Anstieg macht auch Hoffnung für andere Wirtschaftsbereiche.,https://image.stern.de/35854724/t/Sq/v1/w1440/r1.7778/-/01--mchdzjmpbtv5axs2048jpeg---7383ed7056bdba91.jpg,2025-07-01T06:53:14Z,,"Kopiere den aktuellen Link
Zur Merkliste hinzufügen
Vor allem die Geschäftserwartungen sind sprunghaft gestiegen - die Branche setzt auf niedrigere Energiekosten. Der Anstieg macht auch Hoffnung fü… [+1893 chars]",,de,'Energiekosten'
https://www.tagesspiegel.de/wirtschaft/konjunktur-stimmung-in-der-chemie-zieht-kraftig-an-13945048.html,https://www.tagesspiegel.de/wirtschaft/konjunktur-stimmung-in-der-chemie-zieht-kraftig-an-13945048.html,0,www.tagesspiegel.de,Konjunktur: Stimmung in der Chemie zieht kräftig an,Vor allem die Geschäftserwartungen sind sprunghaft gestiegen - die Branche setzt auf niedrigere Energiekosten. Der Anstieg macht auch Hoffnung für andere Wirtschaftsbereiche.,https://www.tagesspiegel.de/images/13945045/alternates/BASE_16_9_W1400/1751352847000/chemische-industrie.jpeg,2025-07-01T06:54:07Z,,Hoffnung auf niedrigere Energiepreise und Auswirkungen der staatlichen Investitionspakete haben die Stimmung in der chemischen Industrie kräftig steigen lassen. Der entsprechende Index des Münchner I… [+2424 chars],,de,'Energiekosten'
https://orf.at/stories/3398309/,https://orf.at/stories/3398309/,0,orf.at,"Schnellschätzung: Inflation stieg im Juni auf 3,3 Prozent",,https://orf.at/mojo/1_4_1/storyserver//news/common/images/og-fallback-news.png,2025-07-01T07:19:59Z,,"Die Inflation ist im Juni laut Schnellschätzung der Statistik Austria auf 3,3 Prozent gestiegen. Das ist der höchste Wert seit Mai 2024, schreibt die Statistik heute in einer Aussendung. Im Mai lag d… [+359 chars]",,de,'Inflation'
https://www.diepresse.com/19854020/inflation-im-juni-auf-33-prozent-gestiegen,https://www.diepresse.com/19854020/inflation-im-juni-auf-33-prozent-gestiegen,0,www.diepresse.com,"Inflation im Juni auf 3,3 Prozent gestiegen",Die Inflation stieg auf den höchsten Wert seit Mai 2024.,https://img.diepresse.com/public/incoming/z8sx9p-Supermarkt/alternates/DPR_SOCIAL_NACHRICHTEN/Supermarkt,2025-07-01T07:29:47Z,,"Die Inflation stieg auf den höchsten Wert seit Mai 2024.
Die Inflation ist im Juni laut Schnellschätzung der Statistik Austria auf 3,3 Prozent gestiegen. Das ist der höchste Wert seit Mai 2024, schr… [+463 chars]",,de,'Inflation'
https://www.faz.net/aktuell/wirtschaft/unternehmen/doener-inflation-warum-der-kebab-zum-luxus-snack-wird-110567814.html,https://www.faz.net/aktuell/wirtschaft/unternehmen/doener-inflation-warum-der-kebab-zum-luxus-snack-wird-110567814.html,0,www.faz.net,Döner-Inflation: Warum der Kebab zum Luxus-Snack wird,Fleischpreise und  Energiekosten treiben den Dönerpreis hoch. Auch prominente  Investoren wie Lukas  Podolski sind betroffen.,https://media0.faz.net/ppmedia/aktuell/gesellschaft/3217461890/1.10567812/facebook_teaser_fplus/spiel-spass-spiess-der.jpg,2025-07-01T08:20:15Z,,"Döner Kebab ist ein beliebtes Fast Food sowohl in der Türkei als auch in Deutschland. Rund um den Drehspieß ist ein Industriezweig entstanden, der die unzähligen Imbisse und Restaurants mit der Ware … [+539 chars]",,de,'Energiekosten'
https://www.bild.de/politik/ausland-und-internationales/putin-in-der-brot-bredouille-stehen-russen-bald-vor-leeren-regalen-6862b78569afbf7d84ed263f,https://www.bild.de/politik/ausland-und-internationales/putin-in-der-brot-bredouille-stehen-russen-bald-vor-leeren-regalen-6862b78569afbf7d84ed263f,0,www.bild.de,Putin in der Brot-Bredouille! - Stehen die Russen bald vor leeren Regalen?,In Russland treibt die Inflation die Preise. Auch Grundnahrungsmittel werden immer teurer – darunter das beliebte Weißbrot.,"https://images.bild.de/6862b78569afbf7d84ed263f/0eb42e7f037f52ab4ee1124f63ba4c61,db56760d?w=1280",2025-07-01T08:26:52Z,,Berlin/Moskau In Russland treibt die Inflation die Preise. Auch Grundnahrungsmittel werden immer teurer. Jetzt warnt der größte Brotproduzent des Landes vor leeren Brot-Regalen! Der Grund: Die Regier… [+2330 chars],,de,'Inflation'
https://www.focus.de/finanzen/news/vergesst-die-armutsschere-die-echte-gefahr-droht-der-deutschen-mittelschicht_aed3247d-5476-492f-aa0e-5efbf04c19cb.html,https://www.focus.de/finanzen/news/vergesst-die-armutsschere-die-echte-gefahr-droht-der-deutschen-mittelschicht_aed3247d-5476-492f-aa0e-5efbf04c19cb.html,0,www.focus.de,Vergesst die Armutsschere – die echte Gefahr droht der deutschen Mittelschicht,"Alle reden dauernd über die Schere zwischen arm und reich. Wenn man aber tiefer nachdenkt, stellt sich heraus, dieses beliebte und berüchtigte Bild kaum Sinn macht. Dieses Essay wagt einen neuen Blick.",https://quadro.burda-forward.de/ctf/c5b5c493-d677-4528-9273-6c493d6f528a.c15908f1-a43d-4ed0-8123-653b3b9530ce.png?im=RegionOfInterestCrop%3D%281200%2C630%29%2CregionOfInterest%3D%28960%2C540%29&hash=a1c1e6d55cdd5ebcfbe2782217ef62681871cf665bfdbcf83f91796871d32c48,2025-07-01T08:36:09Z,,"Die Rede von der Schere zwischen Arm und Reich ist ein medial und politisch wirkmächtiges Bild, das seit Jahrzehnten Schlagzeilen macht. Doch aus Sicht der Vermögensforschung macht diese Metapher wen… [+8865 chars]",,de,'Armut'
https://www.n-tv.de/wirtschaft/Hohe-Zinsen-wuergen-russische-Wirtschaft-ab-article25870362.html,https://www.n-tv.de/wirtschaft/Hohe-Zinsen-wuergen-russische-Wirtschaft-ab-article25870362.html,0,www.n-tv.de,Pleitewelle bei Firmen droht: Hohe Zinsen würgen russische Wirtschaft ab,Dreieinhalb Jahre Krieg haben auch katastrophale Folgen für die Wirtschaft Russlands und der Ukraine. Russland machen besonders die hohen Zinsen zu schaffen. Die Ukraine leidet unter den immensen Zerstörungen. Sie hat aber noch ein anderes Problem.,https://www.n-tv.de/img/incoming/crop25818337/1241321122-cImg_16_9-w1200/521134925.jpg,2025-07-01T08:40:45Z,,Dreieinhalb Jahre Krieg haben auch katastrophale Folgen für die Wirtschaft Russlands und der Ukraine. Russland machen besonders die hohen Zinsen zu schaffen. Die Ukraine leidet unter den immensen Zer… [+2180 chars],,de,'Ukraine'
https://www.sueddeutsche.de/wirtschaft/ezb-strategie-update-herausforderungen-inflation-europa-putin-sintra-li.3277423,https://www.sueddeutsche.de/wirtschaft/ezb-strategie-update-herausforderungen-inflation-europa-putin-sintra-li.3277423,0,www.sueddeutsche.de,EZB-Präsidentin Christine Lagarde: Inflation heute schwieriger zu bekämpfen als früher,Christine Lagarde erläutert die neuen Herausforderungen der EZB im Kampf gegen Inflation. Geopolitische Spannungen und Angebotsschocks beeinflussen die Preise stärker als früher.,https://www.sueddeutsche.de/2025/01/30/a9b5ffa9-4e4a-46e9-aba4-1710851ce085.jpeg?q=60&fm=webp&width=1200&rect=0%2C177%2C3000%2C1687,2025-07-01T08:42:25Z,,EZB-Präsidentin Christine Lagarde warnt aufgrund der weltpolitischen Lage vor künftig stark schwankenden Preisen.Nach dem beschlossenen Strategie-Update sieht EZB-Chefin Christine Lagarde die Zentral… [+250 chars],,de,'Inflation'
https://www.stern.de/news/inflation-im-euroraum-steigt-im-juni-leicht-auf-ezb-zielmarke-bei-2-0-prozent-35855572.html,https://www.stern.de/news/inflation-im-euroraum-steigt-im-juni-leicht-auf-ezb-zielmarke-bei-2-0-prozent-35855572.html,0,www.stern.de,"Inflation im Euroraum steigt im Juni leicht auf EZB-Zielmarke bei 2,0 Prozent","Die Inflation im Euroraum ist im Juni voraussichtlich leicht auf 2,0 Prozent gestiegen. Die Preissteigerung im Vergleich zum Vorjahresmonat fiel damit 0,1 Prozentpunkte stärker aus als noch im Mai, wie das EU-Statistikamt Eurostat mit Sitz in Luxemburg am Die…",https://image.stern.de/35855574/t/Cm/v1/w1440/r1.7778/-/01--supermarkt-in-zagreb---885b36d1e071583a.jpg,2025-07-01T09:04:56Z,,"Kopiere den aktuellen Link
Zur Merkliste hinzufügen
Die Inflation im Euroraum ist im Juni voraussichtlich leicht auf 2,0 Prozent gestiegen. Die Preissteigerung im Vergleich zum Vorjahresmonat fiel … [+1499 chars]",,de,'Inflation'
https://www.faz.net/aktuell/finanzen/genau-auf-zielmarke-inflation-im-euroraum-steigt-auf-2-0-prozent-110569071.html,https://www.faz.net/aktuell/finanzen/genau-auf-zielmarke-inflation-im-euroraum-steigt-auf-2-0-prozent-110569071.html,0,www.faz.net,"Inflation im Euroraum steigt auf 2,0 Prozent","Die Inflation im Euroraum bleibt genau dort, wo die Zentralbank sie gerne hätte. Die Bandbreite innerhalb des Euroraums ist jedoch groß.",https://media0.faz.net/ppmedia/aktuell/3694451142/1.10569086/facebook_teaser/so-guenstig-ist-es-noch-nicht.jpg,2025-07-01T09:20:50Z,,"Die Inflation in der Euro-Zone ist leicht gestiegen und liegt nun genau auf der Zielmarke der Europäischen Zentralbank (EZB). Im Juni betrug die Teuerungsrate in der 20-Länder-Gemeinschaft 2,0 Prozen… [+2092 chars]",,de,'Inflation'
https://www.zeit.de/news/2025-07/01/daimler-truck-keine-folgen-durch-russlands-sanktionen,https://www.zeit.de/news/2025-07/01/daimler-truck-keine-folgen-durch-russlands-sanktionen,0,www.zeit.de,Nutzfahrzeughersteller: Daimler Truck: Keine Folgen durch Russlands Sanktionen,Hier finden Sie Informationen zu dem Thema „Nutzfahrzeughersteller“. Lesen Sie jetzt „Daimler Truck: Keine Folgen durch Russlands Sanktionen“.,https://img.zeit.de/news/2025-07/01/daimler-truck-keine-folgen-durch-russlands-sanktionen-image-group/wide__1300x731,2025-07-01T09:46:47Z,,Russlands Sanktionen gegen den Nutzfahrzeughersteller Daimler Truck wirken sich nach Angaben eines Unternehmenssprechers nicht auf das laufende Geschäft aus. «Wir haben keinerlei Geschäftsaktivitäten… [+1421 chars],,de,'Russland'
https://orf.at/stories/3398322/,https://orf.at/stories/3398322/,0,orf.at,Inflation wieder im Steigen,"Die Teuerungsrate in Österreich ist tendenziell wieder im Steigen. Laut Schnellschätzung der Statistik Austria vom Dienstag lag sie im Juni bei 3,3 Prozent. Verantwortlich dafür sind – nicht zum ersten Mal – höhere Preise für Treibstoffe, aber auch Lebensmitt…",https://ibs.orf.at/news?image=https%3A%2F%2Fassets.orf.at%2Fmims%2F2025%2F27%2F42%2Fcrops%2Fw%3D1200%2Ch%3D630%2Cq%3D75%2F2681901_master_1031942_inflation_schnellschaetzung_juni_anstieg_vik.jpg%3Fs%3D9520e90c9af3add20f7dbb01bb1a439156c6db6a,2025-07-01T11:08:35Z,,"Der Anstieg der Verbraucherpreise um 3,3 Prozent im Jahresabstand ist laut Presseaussendung der Statistik Austria vom Dienstag der höchste seit Mai 2024. In den letzten Monaten hatte sich die Inflati… [+3523 chars]",,de,'Inflation'
https://www.tagesschau.de/wirtschaft/konjunktur/inflation-eurozone-anstieg-100.html,https://www.tagesschau.de/wirtschaft/konjunktur/inflation-eurozone-anstieg-100.html,0,www.tagesschau.de,"Inflation im Euroraum steigt auf 2,0 Prozent","Die Inflation im Euroraum ist im Juni voraussichtlich leicht auf 2,0 Prozent gestiegen - also genau auf das Ziel der Europäischen Zentralbank. Die höchsten Teuerungsraten verzeichneten Estland, die Slowakei und Kroatien.",https://images.tagesschau.de/image/188b8e9b-33b6-430a-989a-68079e1c9783/AAABl8Vn5dM/AAABkZLlo-k/16x9-big/inflation-eu-102.jpg?width=1280,2025-07-01T11:10:14Z,,"Stand: 01.07.2025 13:10 Uhr
Die Inflation im Euroraum ist im Juni voraussichtlich leicht auf 2,0 Prozent gestiegen - also genau auf das Ziel der Europäischen Zentralbank. Die höchsten Teuerungsraten… [+4658 chars]",,de,'Inflation'
https://www.zeit.de/geld/2025-07/eurostat-inflation-euroraum-zwei-prozent-ezb-ziel,https://www.zeit.de/geld/2025-07/eurostat-inflation-euroraum-zwei-prozent-ezb-ziel,0,www.zeit.de,Eurostat: Inflation im Euroraum steigt voraussichtlich leicht auf zwei Prozent,"Nach 1,9 Prozent im Mai erhöht sich die Inflation in der Eurozone laut dem Statistikamt Eurostat leicht auf zwei Prozent. Damit liegt sie genau auf der EZB-Zielmarke.",https://img.zeit.de/wirtschaft/2025-07/inflation-euroraum-zwei-prozent-ezb-zielmarke-bild/wide__1300x731,2025-07-01T11:30:42Z,,"Die Inflation im Euroraum ist im Juni im Jahresvergleich voraussichtlich leicht auf 2,0 Prozent gestiegen. Das teilte das Statistikamt Eurostat in Luxemburg laut einer ersten Schätzung mit. Damit err… [+2468 chars]",,de,'Inflation'
https://de.catholicnewsagency.com/news/20437/papst-leo-beklagt-einsatz-von-hunger-als-kriegswaffe,https://de.catholicnewsagency.com/news/20437/papst-leo-beklagt-einsatz-von-hunger-als-kriegswaffe,0,de.catholicnewsagency.com,Papst Leo beklagt Einsatz von Hunger als „Kriegswaffe“,"Papst Leo XIV. hat in einer Botschaft an die Ernährungs- und Landwirtschaftsorganisation der Vereinten Nationen (FAO) den Einsatz von Hunger als „Kriegswaffe“ beklagt.
Der Pontifex sagte, dass die UN weit davon entfernt sei, ihr Ziel „Kein Hunger“ bis zum Jah…",https://de.catholicnewsagency.com/image/whatsapp-image-2025-06-29-at-06_1751316626.jpg?w=1150&jpg,2025-07-01T12:15:00Z,,"Vatikanstadt -
 Dienstag, 1. Juli 2025, 14:15 Uhr.
Papst Leo XIV. hat in einer Botschaft an die Ernährungs- und Landwirtschaftsorganisation der Vereinten Nationen (FAO) den Einsatz von Hunger als K… [+2524 chars]",,de,'Krieg'
https://www.focus.de/politik/ausland/alligatoren-und-pythons-sollen-ausbruechen-verhindern-trump-eroeffnet-haftlager-im-sumpf_60b30b1d-784f-4d52-b5e1-3c8fec0072b1.html,https://www.focus.de/politik/ausland/alligatoren-und-pythons-sollen-ausbruechen-verhindern-trump-eroeffnet-haftlager-im-sumpf_60b30b1d-784f-4d52-b5e1-3c8fec0072b1.html,0,www.focus.de,Alligatoren und Pythons sollen Ausbrüchen verhindern - Trump eröffnet Haftlager im Sumpf,"In Floridas Everglades entsteht „Alligator Alcatraz“, ein umstrittenes Haftlager für Migranten. Umwelt- und Menschenrechtsgruppen protestieren gegen die unmenschlichen Bedingungen und die Bedrohung des Ökosystems.",https://quadro.burda-forward.de/ctf/dcd4d40c-a635-4223-bca8-5bde85ef2ef7.a4853919-ef3b-45ff-93bc-36f3fc6da3ea.jpg?im=RegionOfInterestCrop%3D%281200%2C630%29%2CregionOfInterest%3D%28658%2C361%29&hash=3e4263a600c3f96c2738b8b15717a51edbcf7784171d2467315b4239385ee754,2025-07-01T12:15:10Z,,"Die US-Regierung unter Präsident Donald Trump hat innerhalb kürzester Zeit ein Haftlager für Migranten in den Everglades hochgezogen, das von führenden Republikanern Alligator Alcatraz genannt wird. … [+2012 chars]",,de,'Bedrohung'
https://www.zeit.de/news/2025-07/01/groesster-gasspeicher-fast-leer-kein-anlass-zur-sorge,https://www.zeit.de/news/2025-07/01/groesster-gasspeicher-fast-leer-kein-anlass-zur-sorge,0,www.zeit.de,"Gasversorgung: Größter Gasspeicher fast leer: ""Kein Anlass zur Sorge""","Hier finden Sie Informationen zu dem Thema „Gasversorgung“. Lesen Sie jetzt „Größter Gasspeicher fast leer: ""Kein Anlass zur Sorge""“.",https://img.zeit.de/news/2025-07/01/groesster-gasspeicher-fast-leer-kein-anlass-zur-sorge-image-group/wide__1300x731,2025-07-01T12:32:20Z,,Der momentan mit zwei Prozent sehr niedrige Füllstand von Deutschlands größtem Gasspeicher im niedersächsischen Rehden ist für die Bundesregierung «kein Anlass zur Sorge». Andere Speicher habe man au… [+1803 chars],,de,'Gas'
https://www.sueddeutsche.de/wirtschaft/berlin-bundesregierung-alarmstufe-gas-li.3277939,https://www.sueddeutsche.de/wirtschaft/berlin-bundesregierung-alarmstufe-gas-li.3277939,0,www.sueddeutsche.de,Energieversorgung: Bundesregierung setzt Alarmstufe Gas aus,"Die Bundesregierung hat die Alarmstufe im Notfallplan Gas ausgesetzt und die Frühwarnstufe aktiviert. Die Gasversorgung ist stabil, neue Lieferwege und Gasspeicher tragen zur Sicherheit bei.",https://www.sueddeutsche.de/2025/07/01/5ee67ea4-bdf2-477b-80f6-c283d96ed740.jpeg?q=60&fm=webp&width=1200&rect=0%2C206%2C4000%2C2250,2025-07-01T12:38:05Z,,"Im Juni 2022, ein paar Monate nach Beginn des russischen Angriffskriegs auf die Ukraine, hatte der damalige Wirtschaftsminister Robert Habeck (Grüne) die Alarmstufe des Notfallplans ausgerufen. Grund… [+985 chars]",,de,'Gas'
https://www.stern.de/politik/deutschland/energiekosten--koalition-ringt-um-loesungen-bei-der-stromsteuer-35856754.html,https://www.stern.de/politik/deutschland/energiekosten--koalition-ringt-um-loesungen-bei-der-stromsteuer-35856754.html,0,www.stern.de,Energiekosten: Koalition ringt um Lösungen bei der Stromsteuer,Berlin - Unter anhaltendem Druck vor allem aus der Wirtschaft sucht die schwarz-rote Koalition beim Streitthema Stromsteuer nach Lösungen. Die Kernfrage,https://image.stern.de/35856756/t/jZ/v1/w1440/r1.7778/-/01--nkud3ufn4hv17axs2048jpeg---30042b42e0c73066.jpg,2025-07-01T12:43:37Z,,"Kopiere den aktuellen Link
Zur Merkliste hinzufügen
Der Streit um die Stromsteuer hält die Koalition in Atem. Die Erwartungen an den Koalitionsausschuss sind hoch.
Unter anhaltendem Druck vor alle… [+5018 chars]",,de,'Energiekosten'
https://www.zeit.de/news/2025-07/01/koalition-ringt-um-loesungen-bei-der-stromsteuer,https://www.zeit.de/news/2025-07/01/koalition-ringt-um-loesungen-bei-der-stromsteuer,0,www.zeit.de,Energiekosten: Koalition ringt um Lösungen bei der Stromsteuer,Hier finden Sie Informationen zu dem Thema „Energiekosten“. Lesen Sie jetzt „Koalition ringt um Lösungen bei der Stromsteuer“.,https://img.zeit.de/news/2025-07/01/koalition-ringt-um-loesungen-bei-der-stromsteuer-image-group/wide__1300x731,2025-07-01T12:43:37Z,,"Unter anhaltendem Druck vor allem aus der Wirtschaft sucht die schwarz-rote Koalition beim Streitthema Stromsteuer nach Lösungen. Die Kernfrage ist, wie eine milliardenschwere Senkung der Stromsteuer… [+4890 chars]",,de,'Energiekosten'
https://www.faz.net/aktuell/politik/ukraine/ukraine-liveticker-wadephul-will-fuer-die-ukraine-sammeln-faz-110172806.html,https://www.faz.net/aktuell/politik/ukraine/ukraine-liveticker-wadephul-will-fuer-die-ukraine-sammeln-faz-110172806.html,0,www.faz.net,Ukraine-LiveblogUkraine-Liveticker: Wadephul will für die Ukraine sammeln,"Außenminister in Odessa: Auf Partner zugehen, damit Kiew mehr Abwehrsysteme bekommt +++ EU und Ukraine einigen sich auf Handelsabkommen für Agrargüter+++ Ukraine verlässt Abkommen über Minen-Verbot +++ alle Neuigkeiten im Liveblog",https://media1.faz.net/ppmedia/aktuell/politik/2393870966/1.10569795/facebook_teaser/aussenminister-johann-wadephul.jpg,2025-07-01T13:58:07Z,,"Die Europäische Union und die Ukraine haben sich auf ein Handelsabkommen für Agrarprodukte geeinigt. Es legt neue Obergrenzen für die zollfreie Einfuhr von Produkten wie Weizen, Geflügel, Mais und Ho… [+2235 chars]",,de,'Ukraine'
