index,url,valid,domain,title,description,image,published,archive,content,quote,language,keyword
https://www.nzz.ch/schweiz/das-parlament-will-die-wiederausfuhr-von-schweizer-waffen-ermoeglichen-aber-nicht-mit-der-lex-ukraine-ld.1740635,https://www.nzz.ch/schweiz/das-parlament-will-die-wiederausfuhr-von-schweizer-waffen-ermoeglichen-aber-nicht-mit-der-lex-ukraine-ld.1740635,0,www.nzz.ch,Das Parlament will die Wiederausfuhr von Schweizer Waffen ermöglichen – aber nicht mit der «lex Ukraine»,Das Schweizer Kriegsmaterialgesetz soll angepasst werden. Doch der Kompromiss ist noch nicht beschlossen.,"https://img.nzz.ch/2023/05/19/17d2cb53-7b94-4059-ac5c-5382c1953946.jpeg?width=1200&height=675&fit=bound&quality=75&auto=webp&crop=7772,4372,x0,y406&wmark=nzz",2023-06-01T16:34:58Z,http://archive.md/20230601225908/https://www.nzz.ch/schweiz/das-parlament-will-die-wiederausfuhr-von-schweizer-waffen-ermoeglichen-aber-nicht-mit-der-lex-ukraine-ld.1740635,"Gegenwärtig sind 12 400 Schuss 35mm-Munition für den Fliegerabwehrpanzer «Gepard» aus Schweizer Produktion blockiert, die Deutschland gerne an die Ukraine liefern würde.
Die Schweiz wird doch nicht … [+4469 chars]",,de,'Russland'
https://www.handelsblatt.com/politik/international/us-kongress-nach-dem-us-schuldenkompromiss-droht-das-naechste-datum-x/29182480.html,https://www.handelsblatt.com/politik/international/us-kongress-nach-dem-us-schuldenkompromiss-droht-das-naechste-datum-x/29182480.html,0,www.handelsblatt.com,US-Kongress: Nach dem US-Schuldenkompromiss droht das nächste „Datum X“,"Womöglich muss der US-Kongress schon im Sommer ein neues Milliardenpaket für die Ukraine beschließen. Die Republikaner sind gespalten, im Wahlkampf droht Widerstand.",https://www.handelsblatt.com/images/ukraines-praesident-wolodimir-selenski-und-us-senator-lindsey-graham/29183026/2-format2003.jpg,2023-06-01T16:35:38Z,https://web.archive.org/web/20230601165540/https://www.handelsblatt.com/politik/international/us-kongress-nach-dem-us-schuldenkompromiss-droht-das-naechste-datum-x/29182480.html,"Washington Der Republikaner Lindsey Graham, führender Außenpolitiker im US-Senat, greift gern zu Sätzen, die im Gedächtnis bleiben. Wer auf den Putin-Zug aufspringt, ist dümmer als Dreck, sagte er ei… [+4873 chars]",,de,'Russland'
https://www.stern.de/news/europa-demonstriert-in-moldau-einigkeit-gegen-putin-33519080.html,https://www.stern.de/news/europa-demonstriert-in-moldau-einigkeit-gegen-putin-33519080.html,0,www.stern.de,Europa demonstriert in Moldau Einigkeit gegen Putin,"Bei einem Europa-Gipfel in Moldau haben 47 Länder Geschlossenheit gegenüber dem russischen Präsidenten Wladimir Putin demonstriert. Moldaus Präsidentin Maia Sandu sagte am Donnerstag nach den Beratungen in Bulboaca, die europäische Familie stehe zusammen, um …",https://image.stern.de/33521110/t/YL/v1/w1440/r1.7778/-/01--selenskyj-bei-dem-gipfel-in-moldau---cc3e6ab90540427e.jpg,2023-06-01T16:36:01Z,https://web.archive.org/web/20230601175131/https://www.stern.de/news/europa-demonstriert-in-moldau-einigkeit-gegen-putin-33519080.html,Bei einem Europa-Gipfel in Moldau haben 47 Länder Geschlossenheit gegenüber dem russischen Präsidenten Wladimir Putin demonstriert. Moldaus Präsidentin Maia Sandu sagte am Donnerstag nach den Beratun… [+3133 chars],,de,'Putin'
https://taz.de/Gipfeltreffen-in-Moldau/!5934597/,https://taz.de/Gipfeltreffen-in-Moldau/!5934597/,0,taz.de,Gipfeltreffen in Moldau: Alle gegen Putin – aber einer fehlt,"In Moldau treffen sich über 50 europäische Regierungschefs, um Stärke gegen Russland zu zeigen. Doch die Türkei sagt überraschend ab.",https://taz.de/picture/6297767/948/32949779-1.jpeg,2023-06-01T16:49:00Z,https://web.archive.org/web/20230601192811/https://taz.de/Gipfeltreffen-in-Moldau/!5934597/,"In Moldau treffen sich über 50 europäische Regierungschefs, um Stärke gegen Russland zu zeigen. Doch die Türkei sagt überraschend ab.
Alle an der Seite Selenskis, alle gegen Putin: Familienfoto in B… [+5859 chars]",,de,'Russland'
https://www.faz.net/aktuell/politik/ukraine-liveticker-usa-kauft-gepard-luftabwehrsysteme-fuer-die-ukraine-faz-18495964.html,https://www.faz.net/aktuell/politik/ukraine-liveticker-usa-kauft-gepard-luftabwehrsysteme-fuer-die-ukraine-faz-18495964.html,0,www.faz.net,Ukraine-Liveblog: USA kauft Gepard-Luftabwehrsysteme für die Ukraine,Russland spricht von versuchter ukrainischer „Invasion“ in Grenzregion +++ Baerbock: Kein NATO-Beitritt der Ukraine „mitten im Krieg“ +++ Russland verärgert über Gipfeltreffen in Moldau +++ Selenskyj in Bulboaca eingetroffen +++ alle Entwicklungen im Liveblog,https://media0.faz.net/ppmedia/aktuell/politik/647085548/1.8935332/facebook_teaser/ein-flakpanzer-vom-typ-gepard.jpg,2023-06-01T16:53:15Z,https://web.archive.org/web/20230601174128/https://www.faz.net/aktuell/politik/ukraine-liveticker-usa-kauft-gepard-luftabwehrsysteme-fuer-die-ukraine-faz-18495964.html,"Angesprochen auf den Drohnenangriff auf russischem Boden am Dienstag hat NATO-Generalsekretär Jens Stoltenberg das Selbstverteidigungsrecht der Ukraine hervorgehoben. Die Ukraine das Recht, sich selb… [+646 chars]",,de,'Krieg'
https://www.faz.net/aktuell/politik/ukraine-liveticker-nach-fliegeralarm-zwei-angriffswellen-auf-kiew-18495964.html,https://www.faz.net/aktuell/politik/ukraine-liveticker-nach-fliegeralarm-zwei-angriffswellen-auf-kiew-18495964.html,0,www.faz.net,Ukraine-Liveblog: Nach Fliegeralarm zwei Angriffswellen auf Kiew,Regionalregierung: Ukrainische Drohnen nahe russischer Stadt Kursk abgeschossen +++ USA kauft Gepard-Luftabwehrsysteme für die Ukraine +++ Baerbock: Kein NATO-Beitritt der Ukraine „mitten im Krieg“ +++ alle Entwicklungen im Liveblog,https://media1.faz.net/ppmedia/aktuell/politik/382885439/1.8935699/facebook_teaser/die-ukrainische-luftabwehr.jpg,2023-06-01T16:53:15Z,https://web.archive.org/web/20230602020517/https://www.faz.net/aktuell/politik/ukraine-liveticker-nach-fliegeralarm-zwei-angriffswellen-auf-kiew-18495964.html,"Das Schweizer Parlament hat gegen ein Gesetz gestimmt, das Drittstaaten die Weitergabe von in der Schweiz produzierten Rüstungsgütern an die Ukraine erlaubt hätte. Der Nationalrat in Bern votierte am… [+892 chars]",,de,'Russland'
https://www.faz.net/aktuell/politik/ausland/angriffe-auf-russland-putin-der-praesident-im-kokon-18935142.html,https://www.faz.net/aktuell/politik/ausland/angriffe-auf-russland-putin-der-praesident-im-kokon-18935142.html,0,www.faz.net,Angriffe auf Russland: Putin im Kokon,Für Russlands Präsidenten häufen sich die schlechten Nachrichten. Er gibt sich unbeeindruckt. Doch sein Bild der Stärke bekommt immer mehr Risse.,https://media0.faz.net/ppmedia/aktuell/947088066/1.8935278/facebook_teaser/wladimir-putin-nimmt-am-1-juni.jpg,2023-06-01T16:55:16Z,https://web.archive.org/web/20230601185630/https://www.faz.net/aktuell/politik/ausland/angriffe-auf-russland-putin-der-praesident-im-kokon-18935142.html,"Die Einschläge kommen immer näher, immer schneller. Doch Wladimir Putin reagiert auf die wiederholten Einfälle Bewaffneter ins Grenzgebiet zur Ukraine und auf Drohnenangriffe, mittlerweile sogar auf … [+3475 chars]",,de,'Russland'
https://www.focus.de/panorama/welt/neue-indizien-im-fall-karl-erivan-haub-verschollener-tengelmann-chef-jetzt-kommt-eine-der-reporterinnen-zu-wort_id_194574511.html,https://www.focus.de/panorama/welt/neue-indizien-im-fall-karl-erivan-haub-verschollener-tengelmann-chef-jetzt-kommt-eine-der-reporterinnen-zu-wort_id_194574511.html,0,www.focus.de,Karl-Erivan Haub wohl gesichtet - Verschollener Tengelmann-Chef - jetzt spricht eine der Reporterinnen,"Neue Hinweise im Fall des verschwundenen Tengelmann-Chefs Karl-Erivan Haub sorgen für Aufsehen. Denn Indizien deuten darauf hin, dass der Milliardär angeblich in Russland gesichtet wurde. Der Fall wird immer rätselhafter. Eine an der Recherche beteiligte Repo…",https://p6.focus.de/img/fotos/id_8748632/haub2.png?im=Crop%3D%28296%2C0%2C1384%2C692%29%3BResize%3D%281200%2C627%29&impolicy=perceptual&quality=mediumHigh&hash=48618a24b434f857b81d6742e38449f482c202de41256a6638bddadebbd0503e,2023-06-01T16:56:15Z,https://web.archive.org/web/20230601172418/https://www.focus.de/panorama/welt/neue-indizien-im-fall-karl-erivan-haub-verschollener-tengelmann-chef-jetzt-kommt-eine-der-reporterinnen-zu-wort_id_194574511.html,"Neue Hinweise im Fall des verschwundenen Tengelmann-Chefs Karl-Erivan Haub sorgen für Aufsehen. Denn Indizien deuten darauf hin, dass der Milliardär angeblich in Russland gesichtet wurde. Der Fall wi… [+5925 chars]",,de,'Russland'
https://www.sueddeutsche.de/politik/nato-staaten-einig-ukraine-soll-mitglied-werden-1.5895199,https://www.sueddeutsche.de/politik/nato-staaten-einig-ukraine-soll-mitglied-werden-1.5895199,0,www.sueddeutsche.de,: Nato-Staaten einig - Ukraine soll Mitglied werden,Konkrete Zeitpläne für einen Beitritt der Ukraine zum Militärbündnis gibt es bisher aber nicht.,https://www.sueddeutsche.de/image/sz.1.5895200/1200x675?v=1685639370000,2023-06-01T17:09:30Z,https://web.archive.org/web/20230601183422/https://www.sueddeutsche.de/politik/nato-staaten-einig-ukraine-soll-mitglied-werden-1.5895199,"1. Juni 2023, 17:09
 "",""authorTextHtml"":""Direkt aus dem Reuters-Videokanal"",""mainTheme"":""Video"",""durationInSeconds"":""01:11"",""tags"":[""Video""],""autoListing"":true,""seoData"":{""seoTitle"":"""",""seoDescripti… [+8389 chars]",,de,'Ukraine'
https://www.focus.de/finanzen/news/konjunktur/diesel-heizoel-milch-preise-sinken-zum-ersten-mal-in-diesem-jahr-was-jetzt-besonders-guenstig-ist_id_195224967.html,https://www.focus.de/finanzen/news/konjunktur/diesel-heizoel-milch-preise-sinken-zum-ersten-mal-in-diesem-jahr-was-jetzt-besonders-guenstig-ist_id_195224967.html,0,www.focus.de,"Diesel, Heizöl, Milch - Preise sinken erstmals in diesem Jahr: Was jetzt besonders günstig ist","Nach vorläufigen Zahlen sind die Preise in Deutschland im Mai gegenüber dem April um 0,2 Prozent gesunken. Das ist das erste Mal in diesem Jahr. Besonders sinkende Energiepreise tragen dazu bei. Insgesamt bleibt die Inflation jedoch hoch.Von FOCUS-online-Auto…",https://p6.focus.de/img/regional/mecklenburg-vorpommern/id_191081232/lebensmittel-liegen-in-einem-einkaufswagen-in-einem-supermarkt..jpg?im=Crop%3D%280%2C169%2C2048%2C1024%29%3BResize%3D%281200%2C627%29&impolicy=perceptual&quality=mediumHigh&hash=596078b81ada270e22460aa438c725a21138c540bcd4ca5ac2ec96f336cdbecd,2023-06-02T04:51:43Z,https://web.archive.org/web/20230602073832/https://www.focus.de/finanzen/news/konjunktur/diesel-heizoel-milch-preise-sinken-zum-ersten-mal-in-diesem-jahr-was-jetzt-besonders-guenstig-ist_id_195224967.html,"Nach vorläufigen Zahlen sind die Preise in Deutschland im Mai gegenüber dem April um 0,2 Prozent gesunken. Das ist das erste Mal in diesem Jahr. Besonders sinkende Energiepreise tragen dazu bei. Insg… [+4034 chars]",,de,'Inflation'
https://www.faz.net/aktuell/sport/mehr-sport/bbl-play-offs-im-basketball-sportdirektor-leibenath-ueber-ratiopharm-ulm-18934382.html,https://www.faz.net/aktuell/sport/mehr-sport/bbl-play-offs-im-basketball-sportdirektor-leibenath-ueber-ratiopharm-ulm-18934382.html,0,www.faz.net,Basketball: Ulms Sportdirektor Leibenath über den Erfolg seiner Mannschaft,"Ulm fehlt ein Sieg, um ins Finale der BBL-Play-offs einzuziehen. Sportdirektor Leibenath über die Entwicklung von jungen Basketballspielern, die perfekte Trainerwahl und den Mut, ins Risiko zu gehen.",https://media0.faz.net/ppmedia/aktuell/sport/2334303509/1.8934400/facebook_teaser/spektakulaeres-spiel-gehoert.jpg,2023-06-02T06:56:25Z,https://web.archive.org/web/20230603020107/https://www.faz.net/aktuell/sport/mehr-sport/bbl-play-offs-im-basketball-sportdirektor-leibenath-ueber-ratiopharm-ulm-18934382.html,"Herr Leibenath, Ihr Team hat den deutschen Meister Alba Berlin aus den Play-offs geworfen und Pokalsieger Bayern München im Halbfinale zweimal in München besiegt. An diesem Freitag (19.00 Uhr bei Mag… [+5707 chars]",,de,'Risiko'
https://taz.de/Europatreffen-in-Moldau/!5935605/,https://taz.de/Europatreffen-in-Moldau/!5935605/,0,taz.de,Europatreffen in Moldau: Gegen Putin sein reicht nicht,"Die Abgrenzung gegen Russlands Diktator ist der einzige gemeinsame Nenner Europas. Was fehlt, ist eine geopolitische Strategie.",https://taz.de/picture/6300767/948/32950317-1.jpeg,2023-06-02T16:53:00Z,https://web.archive.org/web/20230602203537/https://taz.de/Europatreffen-in-Moldau/!5935605/,"Die Abgrenzung gegen Russlands Diktator ist der einzige gemeinsame Nenner Europas. Was fehlt, ist eine geopolitische Strategie.
Vereint: Frankreichs Präsident Macron, Maia Sandu, Präsidentin der Rep… [+2697 chars]",,de,'Putin'
https://www.faz.net/aktuell/politik/inland/ohne-russland-zeitenwende-im-ostseerat-18937979.html,https://www.faz.net/aktuell/politik/inland/ohne-russland-zeitenwende-im-ostseerat-18937979.html,0,www.faz.net,Munition und Windkraft: Zeitenwende im Ostseerat,"Ohne Russland stellt sich für den Ostseerat die Frage, wozu es ihn noch braucht. Außenministerin Annalena Baerbock und ihre Amtskollegen wollen neue Themen in den Mittelpunkt stellen.",https://media0.faz.net/ppmedia/aktuell/politik/2859538621/1.8937976/facebook_teaser/aussenministerin-annalena.jpg,2023-06-02T17:10:12Z,https://web.archive.org/web/20230602172242/https://www.faz.net/aktuell/politik/inland/ohne-russland-zeitenwende-im-ostseerat-18937979.html,"Annalena Baerbock geht weit zurück in der Geschichte. Die Grünen-Politikerin steht nach dem Treffen der Außenminister des Ostseerats in Wismar im Zeughaus und sagt, in der Ostseeregion könne man an j… [+3605 chars]",,de,'Krieg'
https://www.jungewelt.de/artikel/451952.zweiter-weltkrieg-morden-für-eine-freie-ukraine.html,https://www.jungewelt.de/artikel/451952.zweiter-weltkrieg-morden-für-eine-freie-ukraine.html,0,www.jungewelt.de,Zweiter Weltkrieg: Morden für eine »Freie Ukraine«,"Vor 80 Jahren töteten ukrainische Faschisten massenhaft polnische Nachbarn. Heute daran zu erinnern, gilt als »Beihilfe für Putin« • Foto: IMAGO/NurPhoto",https://www.jungewelt.de/img/1100/181424.jpg,2023-06-02T17:39:54Z,https://web.archive.org/web/20230602183934/https://www.jungewelt.de/artikel/451952.zweiter-weltkrieg-morden-f%C3%BCr-eine-freie-ukraine.html,"Am 2. Februar 1943 kapitulierten in Stalingrad die letzten Soldaten der 6. Armee der Wehrmacht. Auch in der noch deutsch besetzten Ukraine verstanden die dortigen Kollaborateure rasch, was die Stunde… [+8144 chars]",,de,'Krieg'
https://www.jungewelt.de/artikel/452020.außenpolitik-die-regierung-will-in-den-krieg-gegen-russland-ziehen.html,https://www.jungewelt.de/artikel/452020.außenpolitik-die-regierung-will-in-den-krieg-gegen-russland-ziehen.html,0,www.jungewelt.de,Außenpolitik: »Die Regierung will in den Krieg gegen Russland ziehen«,Über Irlands Neutralität unter dem Einfluss der EU sowie die Solidarität mit Kuba und Palästina. Ein Gespräch mit dem Parlamentsabgeordneten Thomas Pringle.,https://www.jungewelt.de/img/1100/181433.jpg,2023-06-02T17:39:54Z,https://web.archive.org/web/20230602183933/https://www.jungewelt.de/artikel/452020.au%C3%9Fenpolitik-die-regierung-will-in-den-krieg-gegen-russland-ziehen.html,"Wie würden Sie IhrePolitik kurz umreißen?
Ich bezeichne mich selbst nicht als linken Politiker, aber das ist es eigentlich, was ich bin. Über diese Begrifflichkeiten mache ich mir wenig Gedanken, ab… [+14847 chars]",,de,'Krieg'
https://www.jungewelt.de/artikel/452022.gespür-fürs-wesentliche.html,https://www.jungewelt.de/artikel/452022.gespür-fürs-wesentliche.html,0,www.jungewelt.de,Der schwarze Kanal: Gespür fürs Wesentliche,"Immerhin: An jedem Tag der zurückliegenden Woche widmet die NZZ der Volksrepublik China einen längeren Text, dem Ukraine-Krieg insgesamt nur einen. • Foto: jW",https://www.jungewelt.de/img/1100/181434.jpg,2023-06-02T17:39:54Z,https://web.archive.org/web/20230602183836/https://www.jungewelt.de/artikel/452022.gesp%C3%BCr-f%C3%BCrs-wesentliche.html,"Helmut Schmidt soll als Bundeskanzler die Neue Zürcher Zeitung (NZZ) für wichtiger gehalten haben als die Lageberichte des BND. Die Kanzlerschaft ist mehr als 40 Jahre her, ob die NZZ international n… [+3503 chars]",,de,'Ukraine'
https://orf.at/stories/3318946/,https://orf.at/stories/3318946/,0,orf.at,Startenor Jonas Kaufmann zu Gast,,https://orf.at/mojo/1_4_1/storyserver//news/common/images/og-fallback-news.png,2023-06-02T17:46:38Z,https://web.archive.org/web/20230602182529/https://orf.at/stories/3318946/,"Der deutsch-österreichische Publikumsliebling Jonas Kaufmann wird der neue Intendant der Tiroler Festspiele Erl. Kaufmann ist heute im ZIB2-Studio.
Die Angst vor einem nächsten Krieg in Europa
Die … [+632 chars]",,de,'Gas'
https://www.zeit.de/news/2023-06/02/scholz-verteidigt-ukraine-politik-gegen-schreihaelse,https://www.zeit.de/news/2023-06/02/scholz-verteidigt-ukraine-politik-gegen-schreihaelse,0,www.zeit.de,Krieg: Scholz verteidigt Ukraine-Politik gegen «Schreihälse»,,,2023-06-02T18:39:30Z,https://web.archive.org/web/20230603025936/https://www.zeit.de/news/2023-06/02/scholz-verteidigt-ukraine-politik-gegen-schreihaelse,"When browsing with ads:
We collect personal data and also transmit it to third-party providers
 that help us improve and finance our digital content. Some of the information stored on your device, … [+821 chars]",,de,'Krieg'
https://www.stern.de/politik/deutschland/krieg--scholz-verteidigt-ukraine-politik-gegen--schreihaelse--33525324.html,https://www.stern.de/politik/deutschland/krieg--scholz-verteidigt-ukraine-politik-gegen--schreihaelse--33525324.html,0,www.stern.de,"Krieg: Scholz verteidigt Ukraine-Politik gegen ""Schreihälse""",Eine Gruppe Störer hat sich lautstark bei einem Fest der SPD gegen die Waffenlieferungen an die Ukraine ausgesprochen. Der Kanzler richtet scharfe Worte an sie und steht zu seinen Entscheidungen.,https://image.stern.de/33525326/t/Vr/v1/w1440/r1.7778/-/03--urnnewsmldpacom2009010123060299922480v3w800h600l569t43r1849b1017jpeg---d031c8c202f3a8af.jpg,2023-06-02T18:39:30Z,https://web.archive.org/web/20230603065022/https://www.stern.de/politik/deutschland/krieg--scholz-verteidigt-ukraine-politik-gegen--schreihaelse--33525324.html,"Eine Gruppe Störer hat sich lautstark bei einem Fest der SPD gegen die Waffenlieferungen an die Ukraine ausgesprochen. Der Kanzler richtet scharfe Worte an sie und steht zu seinen Entscheidungen.
Bu… [+1350 chars]",,de,'Krieg'
https://www.morgenpost.de/politik/inland/article238573471/Scholz-verteidigt-Ukraine-Politik-gegen-Schreihaelse.html,https://www.morgenpost.de/politik/inland/article238573471/Scholz-verteidigt-Ukraine-Politik-gegen-Schreihaelse.html,0,www.morgenpost.de,Krieg: Scholz verteidigt Ukraine-Politik gegen „Schreihälse“,Eine Gruppe Störer hat sich lautstark bei einem Fest der SPD gegen die Waffenlieferungen an die Ukraine ausgesprochen. Der Kanzler richtet scharfe Worte an sie und steht zu seinen Entscheidungen.,https://img.morgenpost.de/img/inland/crop238573469/9392608652-w820-cv16_9-q85/Bundeskanzler-Scholz.jpg,2023-06-02T18:39:30Z,https://web.archive.org/web/20230602200848/https://www.morgenpost.de/politik/inland/article238573471/Scholz-verteidigt-Ukraine-Politik-gegen-Schreihaelse.html,Falkensee. Bundeskanzler Olaf Scholz (SPD) hat sich bei einem Europafest der SPD lautstark gegen Störer gewehrt und die Hilfe für die Ukraine verteidigt. Eine Gruppe schrie unter anderem Kriegstreibe… [+1273 chars],,de,'Krieg'
https://www.n-tv.de/sport/Belarussin-Sabalenka-verweigert-Presserunde-bei-French-Open-article24165065.html,https://www.n-tv.de/sport/Belarussin-Sabalenka-verweigert-Presserunde-bei-French-Open-article24165065.html,0,www.n-tv.de,"""Nicht sicher gefühlt"": Belarussin Sabalenka verweigert Presserunde bei French Open",Mehrfach erhält Aryna Sabalenka Fragen rund um den Ukraine-Krieg und ihre politische Position bei diesen French Open. Nun entscheidet sich die Belarussin gegen eine übliche Pressekonferenz.,https://bilder1.n-tv.de/img/incoming/crop24165064/3551327260-cImg_16_9-w1200/d32753b7900dd45078dbd7d351c8ee48.jpg,2023-06-02T18:58:23Z,https://web.archive.org/web/20230603005247/https://www.n-tv.de/sport/Belarussin-Sabalenka-verweigert-Presserunde-bei-French-Open-article24165065.html,"Mehrfach erhält Aryna Sabalenka Fragen rund um den Ukraine-Krieg und ihre politische Position bei diesen French Open. Nun entscheidet sich die Belarussin gegen eine übliche Pressekonferenz.
Nach kri… [+1544 chars]",,de,'Ukraine'
https://www.faz.net/aktuell/politik/ausland/ukrainekrieg-hat-keine-folgen-fuer-chinas-taiwan-plaene-18937894.html,https://www.faz.net/aktuell/politik/ausland/ukrainekrieg-hat-keine-folgen-fuer-chinas-taiwan-plaene-18937894.html,0,www.faz.net,Sorgen um mögliche Invasion: Ukrainekrieg ändert nichts an Chinas Taiwan-Plänen,"Immer wieder droht China mit einer Eroberung Taiwans. Doch ein Angriff steht in naher Zukunft nicht bevor, glauben Fachleute. Daran soll auch Russlands Einmarsch in der Ukraine nichts geändert haben.",https://media1.faz.net/ppmedia/aktuell/1010590014/1.8937893/facebook_teaser_fplus/chinas-verteidigungsminister.jpg,2023-06-02T19:15:55Z,https://web.archive.org/web/20230602195436/https://www.faz.net/aktuell/politik/ausland/ukrainekrieg-hat-keine-folgen-fuer-chinas-taiwan-plaene-18937894.html,"Einflussreiche Fachleute in Asien glauben nicht, dass eine etwaige chinesische Invasion Taiwans durch den Ukraine-Krieg beeinflusst wird und in naher Zukunft bevorstehen könnte. Mehr als ein Jahr nac… [+579 chars]",,de,'Ukraine'
https://consent.google.com/ml?continue=https://news.google.com/rss/articles/CBMibWh0dHBzOi8vd3d3Lm4tdHYuZGUvcG9saXRpay9Qcmlnb3NjaGluLXppZWh0LVdhZ25lci1hYi11bmQtc2NoaW1wZnQtYXVmLXJ1c3Npc2NoZS1DbG93bnMtYXJ0aWNsZTI0MTY1MTc0Lmh0bWzSAW1odHRwczovL2FtcC5uLXR2LmRlL3BvbGl0aWsvUHJpZ29zY2hpbi16aWVodC1XYWduZXItYWItdW5kLXNjaGltcGZ0LWF1Zi1ydXNzaXNjaGUtQ2xvd25zLWFydGljbGUyNDE2NTE3NC5odG1s?oc%3D5&gl=FR&hl=en-US&cm=2&pc=n&src=1,https://consent.google.com/ml?continue=https://news.google.com/rss/articles/CBMibWh0dHBzOi8vd3d3Lm4tdHYuZGUvcG9saXRpay9Qcmlnb3NjaGluLXppZWh0LVdhZ25lci1hYi11bmQtc2NoaW1wZnQtYXVmLXJ1c3Npc2NoZS1DbG93bnMtYXJ0aWNsZTI0MTY1MTc0Lmh0bWzSAW1odHRwczovL2FtcC5uLXR2LmRlL3BvbGl0aWsvUHJpZ29zY2hpbi16aWVodC1XYWduZXItYWItdW5kLXNjaGltcGZ0LWF1Zi1ydXNzaXNjaGUtQ2xvd25zLWFydGljbGUyNDE2NTE3NC5odG1s?oc%3D5&gl=FR&hl=en-US&cm=2&pc=n&src=1,0,consent.google.com,Nur zwei Söldner noch in Bachmut: Prigoschin zieht Wagner ab und schimpft auf russische Clowns - n-tv NACHRICHTEN,"<ol><li>Nur zwei Söldner noch in Bachmut: Prigoschin zieht Wagner ab und schimpft auf russische Clowns  n-tv NACHRICHTEN
</li><li>Krieg in der Ukraine im Live-Ticker: Wagner-Chef: Truppen zu 99 Prozent aus Bachmut abgezogen  WEB.DE News
</li><li>„Ganze Befe…",,2023-06-02T19:20:00Z,,"We use cookies and data to<ul><li>Deliver and maintain Google services</li><li>Track outages and protect against spam, fraud, and abuse</li><li>Measure audience engagement and site statistics to unde… [+1131 chars]",,de,'Krieg'
https://www.n-tv.de/politik/21-22-Wagner-will-fast-alle-Kaempfer-aus-Bachmut-abgezogen-haben--article24165275.html,https://www.n-tv.de/politik/21-22-Wagner-will-fast-alle-Kaempfer-aus-Bachmut-abgezogen-haben--article24165275.html,0,www.n-tv.de,Ukraine-Krieg im Liveticker: +++ 21:22 Wagner will fast alle Kämpfer aus Bachmut abgezogen haben +++,"Berlin, Washington, Br\u00fcssel - \u00fcberall. n-tv berichtet von allen wichtigen Schaupl\u00e4tzen der Innen- und Au\u00dfenpolitik.",https://bilder2.n-tv.de/img/incoming/crop23332537/9041326157-cImg_16_9-w1200/Liveticker1-grau-1-Kopie.jpg,2023-06-02T19:22:00Z,https://web.archive.org/web/20230603004037/https://www.n-tv.de/politik/21-22-Wagner-will-fast-alle-Kaempfer-aus-Bachmut-abgezogen-haben--article24165275.html,Die russische Privatarmee Wagner hat nach Angaben ihres Chefs Jewgeni Prigoschin ihren angekündigten Abzug aus der eroberten ostukrainischen Stadt Bachmut fast abgeschlossen. 99 Prozent der Einheiten… [+27028 chars],,de,'Kämpfe'
https://consent.google.com/ml?continue=https://news.google.com/rss/articles/CBMieWh0dHBzOi8vd3d3Lm1lcmt1ci5kZS9wb2xpdGlrL3VrcmFpbmUta3JpZWctYmVsZ29yb2QtZ3JlbnpyZWdpb24tcGFydGlzYW5lbi1rYWVtcGZlLXJ1c3NsYW5kLW5ld3MtdGlja2VyLXpyLTkyMzE3NDQ2Lmh0bWzSAQA?oc%3D5&gl=FR&hl=en-US&cm=2&pc=n&src=1,https://consent.google.com/ml?continue=https://news.google.com/rss/articles/CBMieWh0dHBzOi8vd3d3Lm1lcmt1ci5kZS9wb2xpdGlrL3VrcmFpbmUta3JpZWctYmVsZ29yb2QtZ3JlbnpyZWdpb24tcGFydGlzYW5lbi1rYWVtcGZlLXJ1c3NsYW5kLW5ld3MtdGlja2VyLXpyLTkyMzE3NDQ2Lmh0bWzSAQA?oc%3D5&gl=FR&hl=en-US&cm=2&pc=n&src=1,0,consent.google.com,++ Ukraine-Krieg: Russland meldet mehrere Tote in Grenzregion Belgorod - Merkur.de,"<ol><li>++ Ukraine-Krieg: Russland meldet mehrere Tote in Grenzregion Belgorod  Merkur.de
</li><li>Tag 463 der Ukraine-Invasion: Doppelte Blamage für den Kreml  Tagesspiegel
</li><li>PUTINS KRIEG: ""Da gab es sehr viel Aufregung hier in Russland!"" Und dann l…",,2023-06-02T19:25:35Z,,"We use cookies and data to<ul><li>Deliver and maintain Google services</li><li>Track outages and protect against spam, fraud, and abuse</li><li>Measure audience engagement and site statistics to unde… [+1131 chars]",,de,'Krieg'
