index,url,valid,domain,title,description,image,published,archive,content,quote,language,keyword
https://www.bild.de/politik/inland/politik-inland/ricarda-lang-ueber-die-ampel-haben-die-gruenen-ihre-ideale-verraten-82142004.bild.html,https://www.bild.de/politik/inland/politik-inland/ricarda-lang-ueber-die-ampel-haben-die-gruenen-ihre-ideale-verraten-82142004.bild.html,0,www.bild.de,"Kaum neue Windräder, aber Gas-Deal mit Katar - Haben die Grünen ihre Ideale verraten, Frau Lang?",Im Interview zieht Ricarda Lang Bilanz nach einem Jahr Ampel.Foto: ©Niels Starnick/Bild/BamS,"https://images.bild.de/638b721f005013569c2f101d/d659ab36f30d069e6e16b2ded7489caf,76fd6fab?w=1280",2022-12-03T21:37:26Z,https://web.archive.org/web/20221204053919/https://www.bild.de/politik/inland/politik-inland/ricarda-lang-ueber-die-ampel-haben-die-gruenen-ihre-ideale-verraten-82142004.bild.html,"Sie ist die mit Abstand jüngste Teilnehmerin bei den Spitzentreffen der Ampel-Koalition: Ricarda Lang (28) führt seit Februar zusammen mit Omid Nouripour (47) die Grünen, verhandelt regelmäßig mit Ka… [+5450 chars]",,de,'Gas'
https://www.bild.de/politik/kolumnen/politik-inland/kommentar-kinderarmut-ist-ein-gefaehrliches-virus-82141962.bild.html,https://www.bild.de/politik/kolumnen/politik-inland/kommentar-kinderarmut-ist-ein-gefaehrliches-virus-82141962.bild.html,0,www.bild.de,Kommentar - Kinderarmut ist ein gefährliches Virus,"Ist es richtig, in Zeiten, wo so viele kaum genug für sich selbst haben, um Spenden zu bitten? Ich bin sicher, es ist richtig und so nötig wie nie.","https://images.bild.de/638b717af454091b70efe8aa/53043fd092441c4043285b2a2d699f50,a12d4a68?w=1280",2022-12-03T21:40:29Z,https://web.archive.org/web/20221204053803/https://www.bild.de/politik/kolumnen/politik-inland/kommentar-kinderarmut-ist-ein-gefaehrliches-virus-82141962.bild.html,"Der Dezember hat begonnen, die Winter-WM ist für Deutschland vorbei. Aber für viele Millionen Deutsche sind die Sorgen geblieben: Was kommt in den nächsten Wochen auf uns zu? Wie viel Monat ist noch … [+2236 chars]",,de,'Armut'
https://www.welt.de/politik/deutschland/article242474227/Sonntagstrend-Ampelkoalition-ohne-Mehrheit-ein-Jahr-nach-Amtsuebernahme.html,https://www.welt.de/politik/deutschland/article242474227/Sonntagstrend-Ampelkoalition-ohne-Mehrheit-ein-Jahr-nach-Amtsuebernahme.html,0,www.welt.de,Ampelkoalition ohne Mehrheit ein Jahr nach Amtsübernahme,"Chaos um Gasumlage und Impfpflicht, Streit um Atomkraft und Waffenlieferungen, Scheitern beim Wohnungsbau: Vom ersten Jahr der Ampelkoalition bleibt den Deutschen nicht nur Gutes in Erinnerung. In einer Umfrage hat das Bündnis die Mehrheit verloren.",https://img.welt.de/img/bildergalerien/mobile242474223/9361359297-ci16x9-w1200/Verleihung-des-Deutschen-Nachhaltigkeitspreises.jpg,2022-12-04T00:10:50Z,https://web.archive.org/web/20221204010500/https://www.welt.de/politik/deutschland/article242474227/Sonntagstrend-Ampelkoalition-ohne-Mehrheit-ein-Jahr-nach-Amtsuebernahme.html,"Ein Jahr nach ihrer Amtsübernahme hat die Ampel-Regierung in der Wählergunst deutlich an Zustimmung eingebüßt. Im Sonntagstrend des Meinungsforschungsinstituts INSA kommen SPD, Grüne und FDP gemeinsa… [+4802 chars]",,de,'Gas'
https://www.zeit.de/politik/deutschland/2022-12/dietmar-bartsch-linke-energiepreise-kontrollen,https://www.zeit.de/politik/deutschland/2022-12/dietmar-bartsch-linke-energiepreise-kontrollen,0,www.zeit.de,Dietmar Bartsch: Linke verlangt strengere Preiskontrollen bei Energie,"Der Bund müsse jeden neuen Tarif bei Strom und Gas kontrollieren, fordert Fraktionschef Bartsch. Auch die CDU warnt vor einem Missbrauch der Preisbremsen durch Versorger.",,2022-12-04T04:30:21Z,https://web.archive.org/web/20221204060445/https://www.zeit.de/politik/deutschland/2022-12/dietmar-bartsch-linke-energiepreise-kontrollen,"When browsing with ads:
We collect personal data and also transmit it to third-party providers
 that help us improve and finance our digital content. Some of the information stored on your device, … [+732 chars]",,de,'Gas'
https://www.autobild.de/artikel/h-kennzeichen-youngtimer-klassiker-2023-22315667.html,https://www.autobild.de/artikel/h-kennzeichen-youngtimer-klassiker-2023-22315667.html,0,www.autobild.de,"H-Kennzeichen, Oldtimer, Klassiker Diese Oldtimer bekommen 2023 das H-Kennzeichen","Millionenfach geliebt, ikonisiert, komplett vergessen: Den Auto-Jahrgang 1993 prägen Innovationen, aber auch Existenzängste und tragische Schicksale. Diese Modelle dürfen 2023 erstmals das H-Kennzeichen tragen.",https://i.auto-bild.de/ir_img/3/1/7/5/6/3/9/96d679eb9aac9843.jpg?impolicy=og_images,2022-12-04T05:00:00Z,,"Was, die bekommen schon das H? Diese Frage ertönt jedes Jahr, wenn eine neue Garde an Automobilen 30 wird. Auch in diesem Jahr. Renault Twingo 1? Das letzte Exemplar ist gefühlt gerade vom Band gelau… [+3513 chars]",,de,'Existenzängste'
https://www.stern.de/wirtschaft/news/sanktionen--oel-embargo-und-preisdeckel-gegen-russland--was-bedeutet-das--32972758.html,https://www.stern.de/wirtschaft/news/sanktionen--oel-embargo-und-preisdeckel-gegen-russland--was-bedeutet-das--32972758.html,0,www.stern.de,Sanktionen: Öl-Embargo und Preisdeckel gegen Russland: Was bedeutet das?,"Die EU macht Druck. Ab heute greift das nach dem Ukraine-Krieg verhängte Öl-Embargo gegen Russland. Zugleich tritt ein Ölpreisdeckel in Kraft. Die Folgen sind komplex, auch für Deutschland.",https://image.stern.de/32972760/t/mj/v7/w1440/r1.7778/-/04--urnnewsmldpacom2009010122120399761910v3w800h600l657t568r1937b1421jpeg---a1e4ee6514120410.jpg,2022-12-04T05:42:06Z,https://web.archive.org/web/20221204060445/https://www.stern.de/wirtschaft/news/sanktionen--oel-embargo-und-preisdeckel-gegen-russland--was-bedeutet-das--32972758.html,"Die EU macht Druck. Ab heute greift das nach dem Ukraine-Krieg verhängte Öl-Embargo gegen Russland. Zugleich tritt ein Ölpreisdeckel in Kraft. Die Folgen sind komplex, auch für Deutschland.
Gut neun… [+6961 chars]",,de,'Ukraine'
https://www.spiegel.de/ausland/ukraine-krieg-selenskyj-findet-oelpreisdeckel-uneffektiv-russland-erntet-millionen-tonnen-ukrainischen-weizen-a-4fcc15a9-e6d9-43c9-9aa4-a5dafe14f09b,https://www.spiegel.de/ausland/ukraine-krieg-selenskyj-findet-oelpreisdeckel-uneffektiv-russland-erntet-millionen-tonnen-ukrainischen-weizen-a-4fcc15a9-e6d9-43c9-9aa4-a5dafe14f09b,0,www.spiegel.de,Ukraine-Krieg: Russland erntete Millionen Tonnen ukrainischen Weizen - Wolodymyr Selenskyj nennt Ölpreisdeckel uneffektiv,"Die Sanktionen gegen Öl aus Russland wirken nicht, sagt der ukrainische Präsident in einer Videobotschaft. US-Forscher weisen mit Satellitenbildern nach, wie viel Getreide Russland in besetzten Gebieten plünderte. Der Überblick.",https://cdn.prod.www.spiegel.de/images/27b5e23f-6efc-49bd-948c-978b97d045a0_w1280_r1.77_fpx55.98_fpy49.99.jpg,2022-12-04T06:14:23Z,https://web.archive.org/web/20221204103519/https://www.spiegel.de/ausland/ukraine-krieg-selenskyj-findet-oelpreisdeckel-uneffektiv-russland-erntet-millionen-tonnen-ukrainischen-weizen-a-4fcc15a9-e6d9-43c9-9aa4-a5dafe14f09b,"Russlands Verteidigungsminister Schoigu besucht Verbündeten Belarus
Russlands Verteidigungsminister Schoigu besuchte derweil das verbündete Nachbarland Belarus. Bei einem Treffen mit dem autoritären… [+1408 chars]",,de,'Ukraine'
https://www.zeit.de/news/2022-12/04/toedliche-bedrohung-great-smog-in-london-vor-70-jahren,https://www.zeit.de/news/2022-12/04/toedliche-bedrohung-great-smog-in-london-vor-70-jahren,0,www.zeit.de,Rauch und Nebel: Tödliche Bedrohung: Great Smog in London vor 70 Jahren,,,2022-12-04T06:44:00Z,https://web.archive.org/web/20221206014216/https://www.zeit.de/news/2022-12/04/toedliche-bedrohung-great-smog-in-london-vor-70-jahren,"When browsing with ads:
We collect personal data and also transmit it to third-party providers
 that help us improve and finance our digital content. Some of the information stored on your device, … [+732 chars]",,de,'Bedrohung'
https://www.stern.de/panorama/rauch-und-nebel--toedliche-bedrohung--great-smog-in-london-vor-70-jahren-32974476.html,https://www.stern.de/panorama/rauch-und-nebel--toedliche-bedrohung--great-smog-in-london-vor-70-jahren-32974476.html,0,www.stern.de,Rauch und Nebel: Tödliche Bedrohung: Great Smog in London vor 70 Jahren,Im Dezember 1952 legt sich fünf Tage lang eine schwere Dunstglocke aus Rauch und Nebel über London. Der Great Smog fordert wohl 12.000 Menschenleben. Er bringt auch die Wende im Umgang mit Atemluft.,https://image.stern.de/32974478/t/pE/v1/w1440/r1.7778/-/04--urnnewsmldpacom2009010122120499772003v2w800h600l2437t31r5728b2617jpeg---739eaf2c0ea3923a.jpg,2022-12-04T06:44:00Z,https://web.archive.org/web/20221204095911/https://www.stern.de/panorama/rauch-und-nebel--toedliche-bedrohung--great-smog-in-london-vor-70-jahren-32974476.html,Im Dezember 1952 legt sich fünf Tage lang eine schwere Dunstglocke aus Rauch und Nebel über London. Der Great Smog fordert wohl 12.000 Menschenleben. Er bringt auch die Wende im Umgang mit Atemluft.,,,
https://www.morgenpost.de/vermischtes/article237063935/Toedliche-Bedrohung-Great-Smog-in-London-vor-70-Jahren.html,https://www.morgenpost.de/vermischtes/article237063935/Toedliche-Bedrohung-Great-Smog-in-London-vor-70-Jahren.html,0,www.morgenpost.de,Rauch und Nebel: Tödliche Bedrohung: Great Smog in London vor 70 Jahren,Im Dezember 1952 legt sich fünf Tage lang eine schwere Dunstglocke aus Rauch und Nebel über London. Der Great Smog fordert wohl 12.000 Menschenleben. Er bringt auch die Wende im Umgang mit Atemluft.,https://img.morgenpost.de/img/vermischtes/crop237063933/159260975-w820-cv16_9-q85/Schutzmasken.jpg,2022-12-04T06:44:00Z,https://web.archive.org/web/20221204072208/https://www.morgenpost.de/vermischtes/article237063935/Toedliche-Bedrohung-Great-Smog-in-London-vor-70-Jahren.html,London. Eines der hartnäckigsten Klischees über Großbritannien ist das Bild von den stets nebelverhangenen Londoner Straßen. Kein Wunder: Auch wenn heutzutage nur selten dicke Schwaden dort die Sicht… [+4361 chars],,de,'Bedrohung'
https://www.zeit.de/gesellschaft/2022-12/zwangsraeumungen-deutschland-trend-bayern,https://www.zeit.de/gesellschaft/2022-12/zwangsraeumungen-deutschland-trend-bayern,0,www.zeit.de,Armut: Zwangsräumungen nehmen bundesweit ab,In Deutschland sind im vergangenen Jahr 29.000 Menschen zwangsgeräumt worden – weniger als im Vorjahr. Entgegen des Gesamttrends verzeichnete Bayern eine Zunahme.,,2022-12-04T07:15:15Z,https://web.archive.org/web/20221204075153/https://www.zeit.de/gesellschaft/2022-12/zwangsraeumungen-deutschland-trend-bayern,"When browsing with ads:
We collect personal data and also transmit it to third-party providers
 that help us improve and finance our digital content. Some of the information stored on your device, … [+732 chars]",,de,'Armut'
https://www.zeit.de/2022/49/pawel-filatjew-russland-soldat-krieg-ukraine,https://www.zeit.de/2022/49/pawel-filatjew-russland-soldat-krieg-ukraine,0,www.zeit.de,Pawel Filatjew: Ein Krieger klagt an,Pawel Filatjew war als russischer Elitesoldat beim Überfall auf die Ukraine dabei. Nun hat er einen wütenden Abgesang auf die Ära Putin geschrieben. Eine Begegnung,,2022-12-04T07:18:34Z,https://web.archive.org/web/20221204075157/https://www.zeit.de/2022/49/pawel-filatjew-russland-soldat-krieg-ukraine,"When browsing with ads:
We collect personal data and also transmit it to third-party providers
 that help us improve and finance our digital content. Some of the information stored on your device, … [+732 chars]",,de,'Putin'
https://www.zeit.de/news/2022-12/04/nachfrage-bei-tiertafeln-steigt,https://www.zeit.de/news/2022-12/04/nachfrage-bei-tiertafeln-steigt,0,www.zeit.de,Inflation: Nachfrage bei Tiertafeln steigt,,,2022-12-04T07:35:39Z,https://web.archive.org/web/20221204075141/https://www.zeit.de/news/2022-12/04/nachfrage-bei-tiertafeln-steigt,"When browsing with ads:
We collect personal data and also transmit it to third-party providers
 that help us improve and finance our digital content. Some of the information stored on your device, … [+732 chars]",,de,'Inflation'
https://www.faz.net/aktuell/wirtschaft/bundeswirtschaftsminister-habeck-ueber-krieg-und-energiewende-18505516.html,https://www.faz.net/aktuell/wirtschaft/bundeswirtschaftsminister-habeck-ueber-krieg-und-energiewende-18505516.html,0,www.faz.net,"Robert Habeck im Gespräch: „Putin soll sehen, wie leistungsfähig diese Demokratie ist“","Laut dem Bundeswirtschaftsminister steht Deutschland trotz Kriegs und Energiekrise robust da. Im Gespräch erläutert Habeck, wie es mit der Energiewende weitergeht, und warum 2023 „anders schwierig“ wird.",https://media1.faz.net/ppmedia/aktuell/678023421/1.8505511/facebook_teaser/robert-habeck-53-ist.jpg,2022-12-04T07:47:47Z,https://web.archive.org/web/20221204082220/https://www.faz.net/aktuell/wirtschaft/bundeswirtschaftsminister-habeck-ueber-krieg-und-energiewende-18505516.html,"Herr Habeck, bei Ihnen im Wirtschaftsministerium ists aus Energiespargründen ziemlich kalt. Treffen wir uns deshalb nicht dort, sondern in Ih­rem mollig warmen Bundestagsbüro?
Wir treffen uns im Bun… [+3548 chars]",,de,'Putin'
https://www.spiegel.de/ausland/armut-in-nordengland-wie-die-wirtschaftskrise-in-burnley-einschlaegt-a-4c9ff565-8ec8-4500-b4cc-0a79cbb17637,https://www.spiegel.de/ausland/armut-in-nordengland-wie-die-wirtschaftskrise-in-burnley-einschlaegt-a-4c9ff565-8ec8-4500-b4cc-0a79cbb17637,0,www.spiegel.de,Armut in Nordengland: Wie die Wirtschaftskrise in Burnley einschlägt,"Burnley ist ohnehin schon eine der ärmsten Städte Englands, in der Wirtschaftskrise mangelt es vielen Einwohnern nun am Nötigsten. Die Politik versagt – ein Pfarrer hilft.",https://cdn.prod.www.spiegel.de/images/463a1167-6285-46ac-83a6-a8ccb0f4618c_w1280_r1.77_fpx69_fpy45.jpg,2022-12-04T08:16:34Z,https://web.archive.org/web/20221204093908/https://www.spiegel.de/ausland/armut-in-nordengland-wie-die-wirtschaftskrise-in-burnley-einschlaegt-a-4c9ff565-8ec8-4500-b4cc-0a79cbb17637,"Zwei Mahlzeiten am Tag mehr ist gerade nicht drin für Ann und Keith Hartley. Die beiden Rentner leben gemeinsam von nur etwa 1.000 Pfund Pension im Monat, circa 1.200 Euro. Das Mittagessen müssen sie… [+7531 chars]",,de,'Armut'
https://www.spiegel.de/ausland/wladimir-putins-angriff-auf-die-ukraine-neun-monate-krieg-kolumne-a-976bf687-e561-4eba-abb4-024d3e1aaad4,https://www.spiegel.de/ausland/wladimir-putins-angriff-auf-die-ukraine-neun-monate-krieg-kolumne-a-976bf687-e561-4eba-abb4-024d3e1aaad4,0,www.spiegel.de,Wladimir Putins Angriff auf die Ukraine: Neun Monate Krieg - Kolumne,Seit Kriegsbeginn haben sich die Ukrainer in Marvel-Superhelden verwandelt und wollen Russland in »Moskowija« umbenennen. Das russische Volk ist zersplitter – und wie geht Europa mit dem Grauen vor der Haustür um?,https://cdn.prod.www.spiegel.de/images/490410df-5207-4007-b2fb-ec8129e39113_w1280_r1.77_fpx44_fpy57.jpg,2022-12-04T08:34:33Z,https://web.archive.org/web/20221204083834/https://www.spiegel.de/ausland/wladimir-putins-angriff-auf-die-ukraine-neun-monate-krieg-kolumne-a-976bf687-e561-4eba-abb4-024d3e1aaad4,"Mehr Perspektiven, mehr verstehen.
Freier Zugang zu allen Artikeln, Videos, Audioinhalten und Podcasts
<ul><li>
Alle Artikel auf SPIEGEL.de frei zugänglich
</li><li>
DER SPIEGEL als E-Paper und … [+743 chars]",,de,'Russland'
https://www.wiwo.de/politik/europa/sanktionen-oel-embargo-und-preisdeckel-gegen-russland-welche-folgen-hat-das/28846742.html,https://www.wiwo.de/politik/europa/sanktionen-oel-embargo-und-preisdeckel-gegen-russland-welche-folgen-hat-das/28846742.html,0,www.wiwo.de,Außenhandel: Öl-Embargo und Preisdeckel gegen Russland: Was bedeutet das?,"Die EU macht Druck. Ab heute greift das nach dem Ukraine-Krieg verhängte Öl-Embargo gegen Russland. Zugleich tritt ein Ölpreisdeckel in Kraft. Die Folgen sind komplex, auch für Deutschland.",https://www.wiwo.de/images/tanks-von-transneft/28846740/1-format11240.jpg,2022-12-04T09:34:26Z,https://web.archive.org/web/20221204112133/https://www.wiwo.de/politik/europa/sanktionen-oel-embargo-und-preisdeckel-gegen-russland-welche-folgen-hat-das/28846742.html,"Gut neun Monate nach dem russischen Angriff auf die Ukraine macht die Europäische Union ernst. Ab heute soll schrittweise ein Öl-Embargo gegen Russland greifen.
Zugleich haben die EU und ihre G7-Par… [+7420 chars]",,de,'Ukraine'
https://www.sueddeutsche.de/bayern/windkraft-klagen-naturschutzverband-bayern-1.5709062,https://www.sueddeutsche.de/bayern/windkraft-klagen-naturschutzverband-bayern-1.5709062,0,www.sueddeutsche.de,Energiewende in Bayern: Stürmischer Kampf gegen die Windkraft,"Ein Naturschutzverband aus der Oberpfalz blockiert bayern- und bundesweit mit Einsprüchen und Klagen den Bau von Windrädern. Das gefährdet Ministerpräsident Söders Ziel, tausend neue Anlagen zu errichten. Und um die neuen Regeln für mehr Windkraft auszuhebeln…",https://www.sueddeutsche.de/image/sz.1.5439073/1200x675?v=1670161147,2022-12-04T13:39:20Z,https://web.archive.org/web/20221204135008/https://www.sueddeutsche.de/bayern/windkraft-klagen-naturschutzverband-bayern-1.5709062,"Ein Naturschutzverband aus der Oberpfalz blockiert bayern- und bundesweit mit Einsprüchen und Klagen den Bau von Windrädern. Das gefährdet Ministerpräsident Söders Ziel, tausend neue Anlagen zu erric… [+7536 chars]",,de,'Windkraft'
https://www.spiegel.de/wirtschaft/unternehmen/drohender-handelskonflikt-mit-den-usa-ursula-von-der-leyen-will-eu-investitionsregeln-lockern-a-323deb94-5991-433a-be69-1040dddfa614,https://www.spiegel.de/wirtschaft/unternehmen/drohender-handelskonflikt-mit-den-usa-ursula-von-der-leyen-will-eu-investitionsregeln-lockern-a-323deb94-5991-433a-be69-1040dddfa614,0,www.spiegel.de,Drohender Handelskonflikt mit den USA: Ursula von der Leyen will EU-Investitionsregeln lockern,"US-Präsident Joe Biden bekämpft die Inflation in seinem Land mit milliardenschweren Subventionen. Als Reaktion darauf hat die Präsidentin der EU-Kommission nun angekündigt, die europäische Investitionspolitik zu stärken.",https://cdn.prod.www.spiegel.de/images/e29b3f10-1b31-43b1-8624-869d6a4015f3_w1280_r1.77_fpx51.34_fpy55.01.jpg,2022-12-04T15:53:27Z,https://web.archive.org/web/20221204203430/https://www.spiegel.de/wirtschaft/unternehmen/drohender-handelskonflikt-mit-den-usa-ursula-von-der-leyen-will-eu-investitionsregeln-lockern-a-323deb94-5991-433a-be69-1040dddfa614,"Handels- und Technologierat berät am Montag
Mit Spannung wird nun erwartet, wie die EU-Staaten auf die Vorschläge von der Leyens reagieren. Die Bundesregierung hatte zuletzt immer wieder betont, das… [+650 chars]",,de,'Inflation'
https://www.faz.net/aktuell/politik/ukraine-liveticker-us-aussenminister-putin-muss-an-diplomatie-interessiert-sein-18495964.html,https://www.faz.net/aktuell/politik/ukraine-liveticker-us-aussenminister-putin-muss-an-diplomatie-interessiert-sein-18495964.html,0,www.faz.net,Ukraine-Liveticker: Putin muss an Diplomatie interessiert sein,"US-Geheimdienst: Russland verbraucht mehr Munition, als es ersetzen kann +++ London: Zustimmung zum Krieg nimmt in Russland rapide ab +++ 9400 Zivilisten seit Kriegsbeginn in der Ukraine getötet +++ alle Entwicklungen im Liveblog.",https://media1.faz.net/ppmedia/aktuell/feuilleton/2977325051/1.8510247/facebook_teaser/us-aussenminister-antony.jpg,2022-12-04T18:20:03Z,https://web.archive.org/web/20221204191623/https://www.faz.net/aktuell/politik/ukraine-liveticker-us-aussenminister-putin-muss-an-diplomatie-interessiert-sein-18495964.html,"Der australische Historiker Christopher Clark (Die Schlafwandler) hält nichts davon, Wladimir Putin mit Adolf Hitler zu vergleichen. Aus solchen Gleichsetzungen lernt man nichts, sie mobilisieren nur… [+1863 chars]",,de,'Ukraine'
https://www.spiegel.de/politik/deutschland/russland-ukraine-krieg-reicht-die-unterstuetzung-fuer-ukraine-a-affd3889-95cb-4986-8d63-568687f9d90e,https://www.spiegel.de/politik/deutschland/russland-ukraine-krieg-reicht-die-unterstuetzung-fuer-ukraine-a-affd3889-95cb-4986-8d63-568687f9d90e,0,www.spiegel.de,Russland-Ukraine-Krieg: Reicht die Unterstützung für die Ukraine?,"Russland greift die Energieinfrastruktur der Ukraine massiv an. Die Folge: Männer, Frauen und Kinder leiden wie nie zuvor. Politiker aus Bundesregierung und Opposition schlagen Alarm: Deutschland tue nicht genug.",https://cdn.prod.www.spiegel.de/images/da396f9f-14e7-48ac-b15e-5d43b0eb6f90_w1280_r1.77_fpx33.2_fpy45.jpg,2022-12-04T19:10:44Z,https://web.archive.org/web/20221204202428/https://www.spiegel.de/politik/deutschland/russland-ukraine-krieg-reicht-die-unterstuetzung-fuer-ukraine-a-affd3889-95cb-4986-8d63-568687f9d90e,"Aus Kiesewetters Sicht sei die Solidarität »größer als sie von der Bundesregierung übermittelt wird«. Das bedinge aber auch, die Ukraine »glaubhaft unterstützt« werde. »Wir gehen viel zu verhalten vo… [+1130 chars]",,de,'Ukraine'
https://www.faz.net/aktuell/wirtschaft/die-details-der-strom-und-gaspreisbremse-sorgen-den-mittelstand-18509519.html,https://www.faz.net/aktuell/wirtschaft/die-details-der-strom-und-gaspreisbremse-sorgen-den-mittelstand-18509519.html,0,www.faz.net,Strom- und Gaspreisbremsen: Details der Energiehilfen sorgen den Mittelstand,"Wenn Unternehmen Energiehilfen in Anspruch nehmen, dürfen sie keine Dividenden, Boni oder Sonderzahlungen ausschütten. Das stellt vor allem den Mittelstand vor Herausforderungen.",https://media0.faz.net/ppmedia/aktuell/3400013761/1.8509584/facebook_teaser/ein-mitarbeiter-des.jpg,2022-12-04T21:08:32Z,https://web.archive.org/web/20221204211305/https://www.faz.net/aktuell/wirtschaft/die-details-der-strom-und-gaspreisbremse-sorgen-den-mittelstand-18509519.html,"Der Bundestagshaushaltsausschuss hat gesprochen: Es dürfen keine Dividenden, Boni, Sonderzahlungen neben dem Festgehalt fließen, wenn Unternehmen Hilfen aus dem Wirtschaftsstabilisierungsfonds zur Dä… [+4203 chars]",,de,'Gas'
https://www.faz.net/aktuell/politik/ukraine-liveticker-russische-luftwaffe-reduziert-einsaetze-in-ukraine-stark-18495964.html,https://www.faz.net/aktuell/politik/ukraine-liveticker-russische-luftwaffe-reduziert-einsaetze-in-ukraine-stark-18495964.html,0,www.faz.net,Ukraine-Liveticker: London: Russische Luftwaffe reduziert Einsätze in Ukraine stark,Ukraine beklagt drastische Zunahme sexueller Gewalt +++ Selenskyj ruft zum Durchhalten im harten Winter auf +++ Blinken: Putin muss an Diplomatie interessiert sein +++ alle Entwicklungen im Liveblog.,https://media1.faz.net/ppmedia/aktuell/politik/3245841700/1.8510885/facebook_teaser/zwei-tu-95-bomber-der.jpg,2022-12-05T01:11:34Z,https://web.archive.org/web/20221205083938/https://www.faz.net/aktuell/politik/ukraine-liveticker-russische-luftwaffe-reduziert-einsaetze-in-ukraine-stark-18495964.html,"Deutschland wird trotz des 100-Milliarden-Euro-Sondervermögens für die Bundeswehr einem Bericht zufolge in den Jahren 2023 und ab 2026 das Zwei-Prozent-Ziel der NATO verfehlen. Das Ziel, zwei Prozent… [+657 chars]",,de,'Putin'
https://www.sueddeutsche.de/politik/annalena-baerbock-indien-reise-mahatma-gandhi-1.5709394,https://www.sueddeutsche.de/politik/annalena-baerbock-indien-reise-mahatma-gandhi-1.5709394,0,www.sueddeutsche.de,Besuch in Indien: Baerbock gedenkt Mahatma Gandhi,"Die Außenministerin hat angekündigt, sie wolle die Zusammenarbeit mit Indien vertiefen. Nach ihrer Ankunft in der Hauptstadt Neu Delhi legte sie in einer Zeremonie Rosenblätter nieder zu Ehren des indischen Freiheitskämpfers.",https://www.sueddeutsche.de/image/sz.1.5709395/1200x675?v=1670217825,2022-12-05T05:16:14Z,https://web.archive.org/web/20221205071102/https://www.sueddeutsche.de/politik/annalena-baerbock-indien-reise-mahatma-gandhi-1.5709394,"Die Außenministerin hat angekündigt, sie wolle die Zusammenarbeit mit Indien vertiefen. Nach ihrer Ankunft in der Hauptstadt Neu Delhi legte sie in einer Zeremonie Rosenblätter nieder zu Ehren des in… [+3033 chars]",,de,'Armut'
https://www.spiegel.de/wirtschaft/inflation-schlaegt-tierwohl-am-spareifer-der-deutschen-droht-der-umbau-der-landwirtschaft-zu-ersticken-a-5132f1bc-4f5d-40ad-b9ea-503706d0c438,https://www.spiegel.de/wirtschaft/inflation-schlaegt-tierwohl-am-spareifer-der-deutschen-droht-der-umbau-der-landwirtschaft-zu-ersticken-a-5132f1bc-4f5d-40ad-b9ea-503706d0c438,0,www.spiegel.de,Inflation schlägt Tierwohl: Am Spareifer der Deutschen droht der Umbau der Landwirtschaft zu ersticken,"Mehr Platz für die Tiere, mehr Geld für die Bauern: Der Umbau der deutschen Landwirtschaft schien auf einem guten Weg – bis die Teuerung die Deutschen wieder an die Billigfleisch-Theke trieb.",https://cdn.prod.www.spiegel.de/images/a46a9cb9-f5e8-4a57-880f-8afe54c2a847_w1280_r1.77_fpx49_fpy56.jpg,2022-12-05T06:47:00Z,https://web.archive.org/web/20221204224154/https://www.spiegel.de/wirtschaft/inflation-schlaegt-tierwohl-am-spareifer-der-deutschen-droht-der-umbau-der-landwirtschaft-zu-ersticken-a-5132f1bc-4f5d-40ad-b9ea-503706d0c438,"Mehr Perspektiven, mehr verstehen.
Freier Zugang zu allen Artikeln, Videos, Audioinhalten und Podcasts
<ul><li>
Alle Artikel auf SPIEGEL.de frei zugänglich
</li><li>
DER SPIEGEL als E-Paper und … [+743 chars]",,de,'Inflation'
