index,url,valid,domain,title,description,image,published,archive,content,quote,language,keyword
https://www.faz.net/aktuell/politik/ukraine-liveticker-biden-unterstuetzung-fuer-ukraine-darf-nicht-unterbrochen-werden-19030454.html,https://www.faz.net/aktuell/politik/ukraine-liveticker-biden-unterstuetzung-fuer-ukraine-darf-nicht-unterbrochen-werden-19030454.html,0,www.faz.net,Ukraine-Liveblog: Biden: Unterstützung für Ukraine darf nicht unterbrochen werden,Übergangshaushalt ohne Ukraine-Hilfen: Weißes Haus beruhigt Kiew +++ EU-Außenbeauftragter Borrell sichert Ukraine anhaltenden Beistand zu +++ London: Russland setzt weiter auf Freiwilligenverbände und Privatarmeen +++ alle Entwicklungen im Liveblog,https://media0.faz.net/ppmedia/aktuell/1038718989/1.9213182/facebook_teaser/us-praesident-joe-biden.jpg,2023-10-01T02:05:55Z,https://web.archive.org/web/20231001053506/https://www.faz.net/aktuell/politik/ukraine-liveticker-biden-unterstuetzung-fuer-ukraine-darf-nicht-unterbrochen-werden-19030454.html,Wenige Stunden vor einer drohenden Haushaltssperre hat der US-Kongress einen Übergangshaushalt verabschiedet und damit einen sogenannten Shutdown abgewendet. Im Senat stimmten 88 Senatoren für und ne… [+738 chars],,de,'Russland'
https://www.diepresse.com/17710908/gasspeicher-zum-beginn-der-heizsaison-gut-gefuellt,https://www.diepresse.com/17710908/gasspeicher-zum-beginn-der-heizsaison-gut-gefuellt,0,www.diepresse.com,Gasspeicher zum Beginn der Heizsaison gut gefüllt,Die Gasspeicher sind bis zu 94 Prozent gefüllt. Im Vorjahr habe man so viel gar nicht verbraucht.,https://img.diepresse.com/public/incoming/ujb9dx-imago-images-0303064515/alternates/DPR_SOCIAL_NACHRICHTEN/imago%20images%200303064515,2023-10-01T07:34:08Z,,"Die Gasspeicher sind bis zu 94 Prozent gefüllt. Im Vorjahr habe man so viel gar nicht verbraucht. 
Österreich kann der mit 1. Oktober beginnenden Heizsaison gelassen entgegensehen: Die Gasspeicher s… [+976 chars]",,de,'Gas'
https://www.faz.net/aktuell/politik/ukraine-liveticker-london-russland-bereitet-sich-auf-mehrere-jahre-krieg-vor-19030454.html,https://www.faz.net/aktuell/politik/ukraine-liveticker-london-russland-bereitet-sich-auf-mehrere-jahre-krieg-vor-19030454.html,0,www.faz.net,Ukraine-Liveblog: London: Russland bereitet sich auf mehrere Jahre Krieg vor,Verletzte und ein Vermisster nach nächtlichen russischen Angriffen +++ Biden: Unterstützung für Ukraine darf nicht unterbrochen werden +++ EU-Außenbeauftragter Borrell sichert Ukraine anhaltenden Beistand zu +++ alle Entwicklungen im Liveblog,https://media0.faz.net/ppmedia/aktuell/politik/1473136038/1.9165110/facebook_teaser/ukrainische-soldaten-feuern.jpg,2023-10-01T08:03:56Z,,Wenige Stunden vor einer drohenden Haushaltssperre hat der US-Kongress einen Übergangshaushalt verabschiedet und damit einen sogenannten Shutdown abgewendet. Im Senat stimmten 88 Senatoren für und ne… [+738 chars],,de,'Krieg'
https://www.zeit.de/news/2023-10/01/london-russland-stellt-sich-wohl-noch-auf-langen-krieg-ein,https://www.zeit.de/news/2023-10/01/london-russland-stellt-sich-wohl-noch-auf-langen-krieg-ein,0,www.zeit.de,Ukraine-Krieg: London: Russland stellt sich wohl noch auf langen Krieg ein,,,2023-10-01T08:34:59Z,,"When browsing with ads:
We collect personal data and also transmit it to third-party providers
 that help us improve and finance our digital content. Some of the information stored on your device, … [+821 chars]",,de,'Ukraine'
https://www.morgenpost.de/wirtschaft/article239705823/solaranlage-photovoltaik-deutschland-firma-china.html,https://www.morgenpost.de/wirtschaft/article239705823/solaranlage-photovoltaik-deutschland-firma-china.html,0,www.morgenpost.de,Zurück zum Boom : Solaranlagen aus Deutschland: Firma wagt den großen Neustart,Solaranlagen aus Deutschland haben vor Jahren mal einen Boom erlebt. Dann kam die große Flaute. Doch nun gibt es neue Hoffnung.,https://img.morgenpost.de/img/wirtschaft/crop230176432/7342606749-w820-cv16_9-q85/410a5f6a-de16-11ea-baa8-2d843e3e3966.jpg,2023-10-01T14:37:53Z,,Bitterfeld. Vor etwa einem Jahrzehnt herrschte im Werk von Meyer Burger in Sachsen-Anhalt Hochbetrieb. Hunderte Beschäftigte produzierten Solarzellen in riesigen Werkhallen. Vom damaligen Boom künden… [+7330 chars],,de,'Solar'
https://www.zeit.de/politik/ausland/2023-10/ukraine-ueberblick-us-haushalt-militaerhilfe-grossbritannien-ausbildung,https://www.zeit.de/politik/ausland/2023-10/ukraine-ueberblick-us-haushalt-militaerhilfe-grossbritannien-ausbildung,0,www.zeit.de,"Ukraine-Überblick: EU fordert weitere US-Hilfe, Briten wollen in der Ukraine ausbilden",Die USA haben einen Haushalt ohne Mittel für die Ukraine verabschiedet – die EU rechnet mit einer Überarbeitung. Großbritannien will Ukrainer vor Ort schulen. Der Tag,,2023-10-01T18:03:45Z,,"When browsing with ads:
We collect personal data and also transmit it to third-party providers
 that help us improve and finance our digital content. Some of the information stored on your device, … [+821 chars]",,de,'Ukraine'
https://www.faz.net/aktuell/politik/ausland/eu-und-weisses-haus-versichern-der-ukraine-weitere-hilfe-19215018.html,https://www.faz.net/aktuell/politik/ausland/eu-und-weisses-haus-versichern-der-ukraine-weitere-hilfe-19215018.html,0,www.faz.net,EU und Weißes Haus versichern der Ukraine weitere Hilfe,"Der US-Präsident und der EU-Außenbeauftragte Borrell betonen, der Ukraine auch künftig zur Seite zu stehen. Der Kompromiss im US-Haushaltsstreit hatte Zweifel befeuert. Die Ukraine greift die russische Schwarzmeer-Stadt Sotschi an.",https://media0.faz.net/ppmedia/aktuell/213920548/1.9215094/facebook_teaser/amerikas-praesident-joe-biden.jpg,2023-10-02T04:33:38Z,,Die EU-Staaten und die USA als wichtigste Unterstützer der Ukraine wollen dem von Russland angegriffenen Land weiter mit ihrer Hilfe zur Seite stehen. Von Washington aus versuchte Präsident Joe Biden… [+4407 chars],,de,'Ukraine'
https://www.tagesschau.de/ausland/amerika/usa-ukraine-unterstuetzung-104.html,https://www.tagesschau.de/ausland/amerika/usa-ukraine-unterstuetzung-104.html,0,www.tagesschau.de,Biden verspricht der Ukraine weitere Hilfen,"Nach Bewilligung eines Übergangshaushalts versucht US-Präsident Biden, Zweifel an der Ukraine-Hilfe seines Landes zu beseitigen. Tatsächlich jedoch wächst der Widerstand dagegen. Die Ukraine und die EU geben sich dennoch zuversichtlich.",https://images.tagesschau.de/image/b0bf01f6-3554-424b-9c9f-8f41aa578f91/AAABiu7dahc/AAABibBxqrQ/16x9-1280/joe-biden-296.jpg,2023-10-02T05:30:02Z,,"Stand: 02.10.2023 07:30 Uhr
Nach Bewilligung eines Übergangshaushalts versucht US-Präsident Biden, Zweifel an der Ukraine-Hilfe seines Landes zu beseitigen. Tatsächlich jedoch wächst der Widerstand … [+3827 chars]",,de,'Ukraine'
https://www.zeit.de/news/2023-10/02/ueber-130-asylbewerber-aus-russland-registriert,https://www.zeit.de/news/2023-10/02/ueber-130-asylbewerber-aus-russland-registriert,0,www.zeit.de,Krieg: Über 130 Asylbewerber aus Russland registriert,,,2023-10-02T06:23:50Z,,"When browsing with ads:
We collect personal data and also transmit it to third-party providers
 that help us improve and finance our digital content. Some of the information stored on your device, … [+821 chars]",,de,'Russland'
https://www.morgenpost.de/ratgeber/article239713287/heizkosten-senken-heizen-heizung-altbau.html,https://www.morgenpost.de/ratgeber/article239713287/heizkosten-senken-heizen-heizung-altbau.html,0,www.morgenpost.de,Energiesparen: Heizkosten im Altbau senken – diese zwei Maßnahmen helfen,Die Energiepreise steigen derzeit wieder. Doch mit diesen beiden Maßnahmen lassen sich die Kosten für das Heizen unkompliziert senken.,https://img.morgenpost.de/img/wohnen/crop239713189/8192607596-w820-cv16_9-q85/Heizungsrohre-daemmen-mt-Schaumstoff.jpg,2023-10-02T07:45:02Z,,Berlin. Draußen wird es langsam kälter und die Sorge vor explodierenden Heizkosten damit wieder größer. Insbesondere Eigentümer von Altbauten stehen in Zeiten der Nachhaltigkeit und Energieeffizienz … [+2254 chars],,de,'Energie sparen'
https://taz.de/Tuareg-Rebellen-gegen-Regierung/!5961029/,https://taz.de/Tuareg-Rebellen-gegen-Regierung/!5961029/,0,taz.de,Tuareg-Rebellen gegen Regierung: Malis Norden versinkt im Krieg,Kämpfe zwischen Malis Regierungstruppen und Tuareg-Rebellen um die Kontrolle von Militärbasen eskalieren. Zunehmend sind Islamisten involviert.,https://taz.de/picture/6561292/948/Goita-1.jpeg,2023-10-02T08:15:00Z,,"Kämpfe zwischen Malis Regierungstruppen und Tuareg-Rebellen um die Kontrolle von Militärbasen eskalieren. Zunehmend sind Islamisten involviert.
Malis Militärmachthaber Assimi Goita beim Russland-Afr… [+3702 chars]",,de,'Krieg'
https://www.faz.net/aktuell/politik/ukraine-liveticker-russland-setzt-verstaerkt-marineflieger-ein-faz-19030454.html,https://www.faz.net/aktuell/politik/ukraine-liveticker-russland-setzt-verstaerkt-marineflieger-ein-faz-19030454.html,0,www.faz.net,Ukraine-Liveblog: Russland setzt verstärkt Marineflieger ein,EU-Außenminister zu „historischem Treffen“ in Kiew eingetroffen +++ Britischer Minister: Militärausbildung soll in Ukraine stattfinden +++ Verletzte und ein Vermisster nach nächtlichen russischen Angriffen +++ alle Entwicklungen im Liveblog,https://media0.faz.net/ppmedia/aktuell/politik/1853580242/1.9215450/facebook_teaser/ein-russisches-jagdflugzeug.jpg,2023-10-02T08:57:40Z,,"Ukraine-Liveblog: Russland setzt verstärkt Marineflieger ein
Ukraine-Liveblog
London: Russland setzt verstärkt Marineflieger ein
Von EU-Außenminister zu historischem Treffen in Kiew eingetroffen +… [+240 chars]",,de,'Russland'
https://www.zeit.de/wirtschaft/2023-10/ruestungsexporte-deutschland-hoechstwert-waffen-ukraine-krieg,https://www.zeit.de/wirtschaft/2023-10/ruestungsexporte-deutschland-hoechstwert-waffen-ukraine-krieg,0,www.zeit.de,Ukraine-Krieg: Deutsche Rüstungsexporte deutlich gestiegen,"Die Regierung hat schon jetzt mehr Rüstungsexporte genehmigt als 2022, bis Jahresende dürfte ein neuer Rekord erreicht werden. Größter Faktor sind Waffen für die Ukraine.",,2023-10-02T14:52:26Z,,"When browsing with ads:
We collect personal data and also transmit it to third-party providers
 that help us improve and finance our digital content. Some of the information stored on your device, … [+821 chars]",,de,'Ukraine'
https://www.faz.net/aktuell/politik/ukraine-liveticker-kinder-in-charkiw-werden-unter-der-erde-unterrichtet-faz-19030454.html,https://www.faz.net/aktuell/politik/ukraine-liveticker-kinder-in-charkiw-werden-unter-der-erde-unterrichtet-faz-19030454.html,0,www.faz.net,Ukraine-Liveblog: Kinder in Charkiw werden unter der Erde unterrichtet,Slowakisches Ministerium wirft Russland Wahl-Einmischung vor +++ Schlagabtausch zwischen Musk und dem ukrainischen Parlament +++ London: Russland setzt verstärkt Marineflieger ein +++ alle Entwicklungen im Liveblog,https://media1.faz.net/ppmedia/aktuell/1385837006/1.9216631/facebook_teaser/grundschueler-verlassen-ihr.jpg,2023-10-03T05:50:03Z,,"Ukraine-Liveblog: Kinder in Charkiw werden unter der Erde unterrichtet
Ukraine-Liveblog
Kinder in Charkiw werden unter der Erde unterrichtet
Von Slowakisches Ministerium wirft Russland Wahl-Einmis… [+228 chars]",,de,'Russland'
https://www.faz.net/aktuell/politik/ausland/ukraine-selenskyj-hofft-auf-eu-mitgliedschaft-19216641.html,https://www.faz.net/aktuell/politik/ausland/ukraine-selenskyj-hofft-auf-eu-mitgliedschaft-19216641.html,0,www.faz.net,Ukraine: Selenskyj nennt EU-Mitgliedschaft „nur Frage der Zeit“,Nach dem Treffen der EU-Außenminister in Kiew macht Präsident Wolodymyr Selenskyj den Bürgern seines Landes Hoffnung auf eine Mitgliedschaft. Er fordert strengere Sanktionen gegen Russland. Ein weiterer EU-Staat schließt seine Grenze für russische Autos.,https://media0.faz.net/ppmedia/aktuell/politik/2546134281/1.9216650/facebook_teaser/wolodymyr-selenskyj-praesident.jpg,2023-10-03T06:48:23Z,,"Nach dem Besuch der EU-Außenminister in Kiew hat sich der ukrainische Präsident Wolodymyr Selenskyj zuversichtlich in Bezug auf eine baldige EU-Mitgliedschaft seines Landes gezeigt. Wir alle wissen, … [+2774 chars]",,de,'Bedrohung'
https://taz.de/Nach-dem-Anschlag-in-Ankara/!5964348/,https://taz.de/Nach-dem-Anschlag-in-Ankara/!5964348/,0,taz.de,Nach dem Anschlag in Ankara: In der Wiederholungsschleife,Nach Jahren kocht die gewaltsame Konfrontation zwischen PKK und AKP-Staat wieder hoch. Dabei sind Kurden wie Türken dieser Kämpfe müde.,https://taz.de/picture/6562408/948/33726373-1.jpeg,2023-10-03T07:57:00Z,,"Nach Jahren kocht die gewaltsame Konfrontation zwischen PKK und AKP-Staat wieder hoch. Dabei sind Kurden wie Türken dieser Kämpfe müde.
Polizisten sperren nach dem Anschlag in Ankara eine Straße ab … [+2189 chars]",,de,'Kämpfe'
https://www.golem.de/sonstiges/zustimmung/auswahl.html?from=https://www.golem.de/news/kernphysik-teilchenbeschleuniger-mit-energie-recycling-2310-178101.html&referer=https://t.co/7c79fe357d,https://www.golem.de/sonstiges/zustimmung/auswahl.html?from=https://www.golem.de/news/kernphysik-teilchenbeschleuniger-mit-energie-recycling-2310-178101.html&referer=https://t.co/7c79fe357d,0,www.golem.de,(g+) Kernphysik: Teilchenbeschleuniger mit Energie-Recycling,"Teilchenbeschleuniger verbrauchen sehr viel Energie. Künftig soll die Energierückgewinnung Strom sparen und Teilchenbeschleuniger nachhaltiger machen. Ein Bericht von Dirk Eidemüller (Wissenschaft, Golem Plus)",,2023-10-03T08:00:02Z,,"Besuchen Sie Golem.de wie gewohnt mit Werbung und Tracking,
 indem Sie der Nutzung aller Cookies zustimmen.
 Details zum Tracking finden Sie im Privacy Center.
Skript wurde nicht geladen. Informat… [+607 chars]",,de,'Energie sparen'
https://www.faz.net/aktuell/wirtschaft/gaspreis-ministerin-lemke-fordert-entlastung-der-verbraucher-19218465.html,https://www.faz.net/aktuell/wirtschaft/gaspreis-ministerin-lemke-fordert-entlastung-der-verbraucher-19218465.html,0,www.faz.net,Gaspreis: Ministerin Lemke fordert Entlastung der Verbraucher,"Weil für Gaslieferanten zwei Umlagen wegfallen, fordert Umwelt- und Verbraucherministerin Steffi Lemke, die Einsparungen an Kunden weiterzugeben. Die Versorger werden sich aber wohl Zeit lassen.",https://media1.faz.net/ppmedia/aktuell/wirtschaft/3964754220/1.9218471/facebook_teaser/gasthermen-finden-sich-in.jpg,2023-10-04T05:11:51Z,,"Bundesverbraucherministerin Steffi Lemke hat Gaslieferanten aufgefordert, die Entlastung durch den Wegfall von Gasumlagen direkt an die Kunden weiterzugeben. Auch wenn für Verbraucherinnen und Verbra… [+1646 chars]",,de,'Gas'
https://www.nzz.ch/zuerich/news-aus-zuerich-restaurant-belvoirpark-geht-im-november-wieder-auf-ld.1751637,https://www.nzz.ch/zuerich/news-aus-zuerich-restaurant-belvoirpark-geht-im-november-wieder-auf-ld.1751637,0,www.nzz.ch,KURZMELDUNGEN - News aus Zürich: Kramer Gastronomie übernimmt das Restaurant Belvoirpark,"NZZ Nachrichten, Hintergründe, Meinungen aus der Schweiz, International, Sport, Digital, Wirtschaft, Auto & mehr. Fundierte Berichterstattung rund um die Uhr.","https://img.nzz.ch/2022/12/30/02ea51cc-7255-4871-bd14-0f07d5d6d5fb.jpeg?width=1200&height=674&fit=bound&quality=75&auto=webp&crop=5480,3078,x0,y287&wmark=nzz",2023-10-04T11:50:04Z,,"Das Restaurant Belvoirpark wird im November wiedereröffnet
So präsentierte sich das Restaurant Belvoirpark vor seiner Schliessung.
heu. Im Dezember 2022 hat die Hotelfachschule Zürich das Tradition… [+50604 chars]",,de,'Energie sparen'
https://www.morgenpost.de/kultur/article239723281/Checker-Tobi-ist-ein-Lehrfilm-fuer-die-Letzte-Generation.html,https://www.morgenpost.de/kultur/article239723281/Checker-Tobi-ist-ein-Lehrfilm-fuer-die-Letzte-Generation.html,0,www.morgenpost.de,Neu im Kino: „Checker Tobi“ ist ein Lehrfilm für die Letzte Generation,Von der Halong-Bucht in Vietnam bis zum Amazonas in Brasilien: „Checker Tobi und die Reise zu den fliegenden Flüssen“ zeigt auf einer Weltreise Schönheit und Gefährdung der Natur. Mit eigenen Mitteln – und Stargast.,https://img.morgenpost.de/img/kultur/crop239723279/2357545793-w820-cv16_9-q85-fnov-fpi231768577-fpotl/1701a17c-5dd1-11ee-a26a-2609ae0d1fc5.jpg,2023-10-04T13:00:00Z,,Xfoo Upcjbt Lsfmm tfjofo [vtdibvfso ejf Xfmu fslmåsu- jtu jin lfjo Fyusfn gsfne/ Fs tufjhu jo Csbtjmjfo bvg efo i÷ditufo Uvsn Týebnfsjlbt )411 Nfufs* voe jo Wjfuobn jo ejf hs÷àuf I÷imf efs Xfmu )261 … [+1872 chars],,de,'Gefährdung'
https://www.zeit.de/2023/42/kaja-kallas-premierministerin-estland-kriegsmuedigkeit,https://www.zeit.de/2023/42/kaja-kallas-premierministerin-estland-kriegsmuedigkeit,0,www.zeit.de,"Kaja Kallas: ""Bitte gebt alles, was ihr geben könnt!""","Viele Europäer unterschätzen die Bedrohung durch Wladimir Putin, sagt Estlands Premierministerin Kaja Kallas. Und warnt den Westen vor Kriegsmüdigkeit.",,2023-10-05T02:50:32Z,,"When browsing with ads:
We collect personal data and also transmit it to third-party providers
 that help us improve and finance our digital content. Some of the information stored on your device, … [+821 chars]",,de,'Bedrohung'
"https://www.gamestar.de/artikel/black-friday-smart-home-thermostat-angebot-fussbodenheizung-bosch-eve-matter,3401655.html","https://www.gamestar.de/artikel/black-friday-smart-home-thermostat-angebot-fussbodenheizung-bosch-eve-matter,3401655.html",0,www.gamestar.de,Deals: Komfortabel sparen - Smart Home Heizkörperthermostate im Black Friday Angebot [Anzeige],"Energie und Geld sparen mit smarten Thermostaten für Fußboden- und Wandheizungen. Passend für Apple HomeKit, Amazon Alexa und Google und zur Black Week günstiger.",https://images.cgames.de/images/gamestar/4/deal-teaser-smarte-heizkörperthermostate-black-friday-hub_6255812.jpg,2023-10-05T10:40:00Z,,"Komfortabel sparen und das sogar zweifach: Mit smarten Heizkörperthermostaten spart ihr Energie und damit bares Geld und am Black Friday sahnt ihr auch noch lukrative Rabatte ab.
Ich liebe mein Smar… [+4464 chars]",,de,'Energie sparen'
