index,url,valid,domain,title,description,image,published,archive,content,quote,language,keyword
https://www.bild.de/sport/olympia/olympia-ist-die-ioc-praesidentin-ein-falscher-fuffziger-698f459ff4d0b8d94ca1ba8e,https://www.bild.de/sport/olympia/olympia-ist-die-ioc-praesidentin-ein-falscher-fuffziger-698f459ff4d0b8d94ca1ba8e,0,www.bild.de,Diskussion um Ukraine-Helm - Ist die IOC-Präsidentin ein falscher Fuffziger?,IOC-Präsidentin Kirsty Coventry hätte den ukrainischen Skeleton-Piloten mit seinem Gedenkhelm starten lassen können. Aber sie wollte nicht.,"https://images.bild.de/698f459ff4d0b8d94ca1ba8e/44d7ab11cd40c79050c62a390605520d,c29123aa?w=1280",2026-02-13T16:55:08Z,,TTS-Player überspringenArtikel weiterlesenSie ist Olympiasiegerin. Weltmeisterin. Ex-Schwimmerin. Und heute die mächtigste Frau im Weltsport. Doch seit ihrer Skandalentscheidung frage ich mich: Ist I… [+2363 chars],,de,'Ukraine'
https://www.stern.de/news/treffen-der-ukraine-unterstuetzerstaaten-in-muenchen---rubio-nicht-dabei-37135732.html,https://www.stern.de/news/treffen-der-ukraine-unterstuetzerstaaten-in-muenchen---rubio-nicht-dabei-37135732.html,0,www.stern.de,Treffen der Ukraine-Unterstützerstaaten in München - Rubio nicht dabei,Die Staats- und Regierungschefs mehrerer europäischer Länder haben sich am Freitag anlässlich der Münchner Sicherheitskonferenz zu Beratungen über den Ukraine-Krieg getroffen. An dem Treffen mit dem ukrainischen Präsidenten Wolodymyr Selenskyj nahmen unter an…,https://image.stern.de/37135734/t/JK/v1/w1440/r1.7778/-/13--merz-und-selenskyj-bei-ukrainetreffen-in-muenchen---98f446815c47e275.jpg,2026-02-13T16:55:30Z,,"Kopiere den aktuellen Link
Zur Merkliste hinzufügen
Die Staats- und Regierungschefs mehrerer europäischer Länder haben sich am Freitag anlässlich der Münchner Sicherheitskonferenz zu Beratungen übe… [+2389 chars]",,de,'Krieg'
https://www.sueddeutsche.de/muenchen/muenchen-heute-aktuell-news-li.3387228,https://www.sueddeutsche.de/muenchen/muenchen-heute-aktuell-news-li.3387228,0,www.sueddeutsche.de,News-Überblick: Das sind die Nachrichten des Tages,"Der große SZ-Wahlcheck: Welche Münchner Partei Ihre Positionen vertritt, wie der erste Tag der Sicherheitskonferenz lief, wo ein AfD-Politiker Friedensbewegte für Russland gewinnen will und mehr.",https://www.sueddeutsche.de/2022/06/07/60207e09-b480-4a33-b0f4-807091bdad15.jpeg?q=60&fm=webp&width=1200&rect=0%2C76%2C800%2C450,2026-02-13T16:56:19Z,,"DER TAG IN MÜNCHEN
Welche Partei passt zu Ihnen und welche überhaupt nicht? Die Mieten steigen, die U-Bahn ist voll, kein Parkplatz in Sicht: Was sollte sich in München dringend ändern? Und was soll… [+2763 chars]",,de,'Russland'
https://orf.at/stories/3420140/,https://orf.at/stories/3420140/,0,orf.at,Kasparow: Krieg mittlerweile Stütze für Putin-Regime,,https://orf.at/mojo/1_4_1/storyserver//news/common/images/og-fallback-news.png,2026-02-13T17:10:45Z,,Der russische Exil-Oppositionelle und Ex-Schachweltmeister Garri Kasparow erwartet kein Ende des russischen Krieges gegen die Ukraine und auch keinen Waffenstillstand in diesem Jahr. Für (den russisc… [+1557 chars],,de,'Putin'
https://www.focus.de/politik/putin-verbietet-deutsche-organisation-in-muenchen-reagiert-wadephul-empoert_4b42ad0f-4985-42a4-968a-ffc26156e01c.html,https://www.focus.de/politik/putin-verbietet-deutsche-organisation-in-muenchen-reagiert-wadephul-empoert_4b42ad0f-4985-42a4-968a-ffc26156e01c.html,0,www.focus.de,Putin verbietet deutsche Organisation - in München reagiert Wadephul empört,Russland hat den DAAD zur unerwünschten Organisation erklärt. Auf der Münchner Sicherheitskonferenz kritisierte Außenminister Wadephul dieses Vorgehen scharf.,https://quadro.burda-forward.de/ctf/039e4862-968f-4cf5-8fb7-1ec3159fa446.1f4dedd7-36d4-4b4e-8829-ba96c558721a.jpg?im=RegionOfInterestCrop%3D%281200%2C630%29%2CregionOfInterest%3D%28899%2C460%29&hash=bf5033ba2a837966d64812af0b782c8a4ff39972f26f41efba0f0fa27c6bd09a,2026-02-13T17:34:00Z,,"Der Deutsche Akademische Austauschdienst (DAAD) muss seine Arbeit in Russland einstellen. Russland hat den DAAD zu einer unerwünschten Organisation erklärt, wodurch er faktisch verboten ist. Auf der … [+987 chars]",,de,'Russland'
https://www.welt.de/sport/olympia/article698f5ea412e01366e5874354/olympia-kirsty-coventrys-erste-krise-nur-ein-vorgeschmack-donald-trump-wartet-schon.html,https://www.welt.de/sport/olympia/article698f5ea412e01366e5874354/olympia-kirsty-coventrys-erste-krise-nur-ein-vorgeschmack-donald-trump-wartet-schon.html,0,www.welt.de,Coventrys erste Krise war nur ein Vorgeschmack – schon bald wartet Donald Trump,Kirsty Coventry erlebt beim Ausschluss eines Ukrainers ihre olympische Feuertaufe als IOC-Präsidentin. Ihre Tränen riefen unterschiedliche Reaktionen hervor. Bald kommen noch mehr unbequeme Themen auf sie zu.,https://images.welt.de/698f5ea412e01366e5874354/65dcbd21196979db78a7462345b1717c/ci16x9-w1200/gyi-2261196699-jpg,2026-02-13T18:46:19Z,,Kirsty Coventry erlebt beim Ausschluss eines Ukrainers ihre olympische Feuertaufe als IOC-Präsidentin. Ihre Tränen riefen unterschiedliche Reaktionen hervor. Bald kommen noch mehr unbequeme Themen au… [+5900 chars],,de,'Putin'
https://www.welt.de/politik/ausland/video698f6a4256df0f71cc041ec8/muenchner-sicherheitskonferenz-trump-weiss-dass-putin-nicht-von-seinen-maximalforderungen-zurueckweichen-wird.html,https://www.welt.de/politik/ausland/video698f6a4256df0f71cc041ec8/muenchner-sicherheitskonferenz-trump-weiss-dass-putin-nicht-von-seinen-maximalforderungen-zurueckweichen-wird.html,0,www.welt.de,"„Trump weiß, dass Putin nicht von seinen Maximalforderungen zurückweichen wird“","Friedrich Merz setzt bei der Münchner Sicherheitskonferenz auf eine neue Rhetorik gegenüber den USA und fordert eine stärkere Führungsrolle Deutschlands in Europa. „Es sind sehr klare und deutliche Worte“, sagt Paul Ronzheimer, „Global Reporters Network“-Repo…",https://images.welt.de/698f6a4256df0f71cc041ec8/875038828f233416bb9d2f6e8b534e0e-master/ci16x9-w1200/ronzheimer-jpg,2026-02-13T18:53:58Z,,Friedrich Merz setzt bei der Münchner Sicherheitskonferenz auf eine neue Rhetorik gegenüber den USA und fordert eine stärkere Führungsrolle Deutschlands in Europa. Es sind sehr klare und deutliche Wo… [+120 chars],,de,'Putin'
https://www.bild.de/politik/ausland-und-internationales/garri-kasparow-bei-msc-2026-regime-von-putin-kann-nicht-ohne-krieg-existieren-698f63ef56df0f71cc041e8d,https://www.bild.de/politik/ausland-und-internationales/garri-kasparow-bei-msc-2026-regime-von-putin-kann-nicht-ohne-krieg-existieren-698f63ef56df0f71cc041e8d,0,www.bild.de,„Regime kann nicht ohne Krieg existieren“ - Putin-Gegner mit düsterer Ukraine-Prognose,Putin-Gegner Garri Kasparow rechnet nicht mit einem baldigen Waffenstillstand in der Ukraine.,"https://images.bild.de/698f63ef56df0f71cc041e8d/565c540f530298f2a3c661f1a4b10cd3,c5d14a62?w=1280",2026-02-13T19:22:52Z,,TTS-Player überspringenArtikel weiterlesenMünchen Einer der schärfsten Kritiker von Kreml-Machthaber Wladimir Putin (73) hat zum Start der Münchner Sicherheitskonferenz eine düstere Prognose für die … [+2230 chars],,de,'Ukraine'
https://www.tagesschau.de/ausland/afrika/suedsudan-hunger-humanitaere-krise-100.html,https://www.tagesschau.de/ausland/afrika/suedsudan-hunger-humanitaere-krise-100.html,0,www.tagesschau.de,Hungerkrise im Südsudan befürchtet,"Im Südsudan eskaliert erneut die Gewalt, Hunderttausende sind auf der Flucht. Die Gewalt verschärft die bestehende Hungerkrise weiter: Mehr als eine Million Menschen sind laut NGOs betroffen. Die UN fordern ein Ende der Kämpfe.",https://images.tagesschau.de/image/d6941cf6-6edb-4858-9217-bb8fa689e391/AAABnFh6qxc/AAABmyZE0EA/16x9-big/sudan-frauen-102.jpg?width=1280,2026-02-13T19:32:27Z,,"Stand: 13.02.2026 20:32 Uhr
Im Südsudan eskaliert erneut die Gewalt, Hunderttausende sind auf der Flucht. Die Gewalt verschärft die bestehende Hungerkrise weiter: Mehr als eine Million Menschen sind… [+3086 chars]",,de,'Kämpfe'
https://www.n-tv.de/politik/BND-Chef-will-gegen-Putins-Geheimdienste-zurueckschlagen-duerfen-id30361826.html,https://www.n-tv.de/politik/BND-Chef-will-gegen-Putins-Geheimdienste-zurueckschlagen-duerfen-id30361826.html,0,www.n-tv.de,"Russland soll ""Schmerz spüren"": BND-Chef will gegen Putins Geheimdienste zurückschlagen dürfen",Im vergangenen Jahr registrieren die deutschen Behörden mehr als 3000 mutmaßliche Sabotageakte. Zahlreiche Fälle sollen auf das Konto russischer Geheimdienste gehen. BND-Chef Jäger wünscht sich mehr Handlungsspielraum gegen Moskaus hybride Kriegsführung.,https://www.n-tv.de/img/30361954/1771012821/Img_16_9/1200/December-29-2025-Moscow-Moscow-Oblast-Russia-Russian-President-Vladimir-Putin-chairs-a-meeting-to-discuss-the-ongoing-war-against-Ukraine-at-the-Kremlin-December-29-2025-in-Moscow-Russia.jpg,2026-02-13T20:31:53Z,,"Russlands Präsident Putin bei einer Lagebesprechung. (Foto: picture alliance / ZUMAPRESS.com)
Im vergangenen Jahr registrieren die deutschen Behörden mehr als 3000 mutmaßliche Sabotageakte. Zahlreic… [+2077 chars]",,de,'Russland'
https://www.welt.de/politik/ausland/article698fd37af4d0b8d94ca1bf96/ukraine-praesident-in-muenchen-ich-bin-juenger-als-putin-sagt-selenskyj-der-kreml-chef-dagegen-habe-nicht-allzu-viel-zeit.html,https://www.welt.de/politik/ausland/article698fd37af4d0b8d94ca1bf96/ukraine-praesident-in-muenchen-ich-bin-juenger-als-putin-sagt-selenskyj-der-kreml-chef-dagegen-habe-nicht-allzu-viel-zeit.html,0,www.welt.de,"„Ich bin jünger als Putin“, sagt Selenskyj – der Kreml-Chef dagegen habe „nicht allzu viel Zeit“","Am Rande der Münchner Sicherheitskonferenz hat der ukrainische Präsident Wolodymyr Selenskyj Forderungen an den US-Kongress erhoben: Es brauche einen Beschluss von dort für ein glaubwürdiges Friedensabkommen. Gleichzeitig betonte Selenskyj, Putin gegenüber ei…",https://images.welt.de/698fd37af4d0b8d94ca1bf96/13174941f6e4746ed8b3fdd1b06ea085-master/ci16x9-w1200/1770988003998-afp-97dx7nq-jpg,2026-02-14T02:01:07Z,,"Der ukrainische Präsident Wolodymyr Selenskyj forderte am Rande der Münchner Sicherheitskonferenz die US-Regierung eindringlich auf, mehr Druck auf Russland auszuüben, um den Krieg gegen die Ukraine … [+1596 chars]",,de,'Putin'
https://www.diepresse.com/20571092/nuklearwaffen-experte-dann-waeren-wir-durch-russland-endlos-erpressbar,https://www.diepresse.com/20571092/nuklearwaffen-experte-dann-waeren-wir-durch-russland-endlos-erpressbar,0,www.diepresse.com,Nuklearwaffen-Experte: „Dann wären wir durch Russland endlos erpressbar“ [premium],"Politologe Frank Sauer erklärt, warum Frankreich die USA nicht ersetzen kann, die Debatte über eine deutsche Atombombe unklug ist und Russland in einem regionalen Konflikt nukleare Gefechtsfeldwaffen einsetzen könnte. Einen Angriff Putins auf die Nato hält Sa…",https://img.diepresse.com/public/incoming/2yiiuz-F-35_B61-12_trial.jpg/alternates/DPR_SOCIAL_NACHRICHTEN/F-35_B61-12_trial.jpg,2026-02-14T06:46:15Z,,"Weil die nukleare Teilhabe der USA im Rahmen der Nato etwas bietet, das in Europa zumindest auf absehbare Zeit niemand ersetzen kann: Sie ermöglicht es uns, eine Vergeltungsdrohung mit substrategisch… [+13822 chars]",,de,'Putin'
https://www.welt.de/regionales/nrw/article698c523862ee8b267c15b2cc/karneval-und-krise-warum-das-fest-in-schwierigen-zeiten-seine-groesste-kraft-entfaltet.html,https://www.welt.de/regionales/nrw/article698c523862ee8b267c15b2cc/karneval-und-krise-warum-das-fest-in-schwierigen-zeiten-seine-groesste-kraft-entfaltet.html,0,www.welt.de,„Karneval ist ein Symbol für den Fortbestand der Welt“,"Kriege, Krisen, unglückliche Kölner – doch der Karneval bleibt. Der Karnevalsforscher Wolfgang Oelsner erklärt, warum das Fest gerade in schwierigen Zeiten seine größte Kraft entfaltet.",https://images.welt.de/698c523862ee8b267c15b2cc/f66330216ed24d64468aac971bd9c2cf-master/ci16x9-w1200/dpa-com-20090101-260212-911-013094-jpg,2026-02-14T06:48:59Z,,"Kriege, Krisen, unglückliche Kölner doch der Karneval bleibt. Der Karnevalsforscher Wolfgang Oelsner erklärt, warum das Fest gerade in schwierigen Zeiten seine größte Kraft entfaltet.  Für Außenstehe… [+11578 chars]",,de,'Putin'
https://www.faz.net/aktuell/politik/ausland/ruestungsprojekte-die-neuen-waffen-der-europaeer-accg-110836801.html,https://www.faz.net/aktuell/politik/ausland/ruestungsprojekte-die-neuen-waffen-der-europaeer-accg-110836801.html,0,www.faz.net,Sieben Rüstungsprojekte: Die neuen Waffen der Europäer,"Trump sieht die EU als Gegner, Putin fuchtelt mit Atomwaffen, und den Europäern fällt siedend heiß ein: Sie sind bei ihrer Verteidigung auf Amerika angewiesen. Sieben Projekte sollen jetzt Abhilfe schaffen, berichten @KonradSchuller, @TGutschker und Gregor Gr…",https://media0.faz.net/image/w1200h627/3170b392832b/w2999h1566x0y60o/022026/1.10836794/das-britisch-italienisch.webp,2026-02-14T07:10:12Z,,"Bei der Abwehr von Marschflugkörpern, ballistischen Raketen und Hyperschallflugkörpern haben die Europäer große Lücken. Nach manchen Schätzungen können sie nur fünf Prozent ihres Territoriums im Oste… [+208 chars]",,de,'Putin'
https://www.faz.net/aktuell/gesellschaft/kriminalitaet/acht-abgetrennte-koepfe-in-ecuador-entdeckt-accg-200540438.html,https://www.faz.net/aktuell/gesellschaft/kriminalitaet/acht-abgetrennte-koepfe-in-ecuador-entdeckt-accg-200540438.html,0,www.faz.net,Bandenkriminalität: Acht abgetrennte Köpfe in Ecuador entdeckt,Erst im Januar waren an einem örtlichen Strand fünf Köpfe entdeckt worden. Erbitterte Kämpfe zwischen Drogenkartellen haben Ecuador in das gewalttätigste Land Südamerikas verwandelt.,https://media0.faz.net/image/w1200h627/05597694146f/w3045h1591x0y330o/202602/43601.0.1777936586/polizisten-beraten-an-dem-ort.webp,2026-02-15T01:07:16Z,,"Grausamer Fund in Ecuador: In der Küstenprovinz Guayas sind acht abgetrennte Köpfe entdeckt worden. Nahe der Köpfe seien Zettel mit der Aufschrift stehlen verboten gefunden worden, sagte Polizei-Komm… [+837 chars]",,de,'Kämpfe'
https://www.tagesschau.de/ausland/europa/msc-kallas-eu-usa-100.html,https://www.tagesschau.de/ausland/europa/msc-kallas-eu-usa-100.html,0,www.tagesschau.de,"Münchner Sicherheitskonferenz: Kallas kritisiert ""EU-Bashing"" der USA","Immer wieder äußern US-Politiker Kritik an der EU. Auf der Sicherheitskonferenz spielte die EU-Außenbeauftragte Kallas den Ball nun zurück - und beklagte: Dass die EU bei Ukraine-Verhandlungen nicht am Tisch sitzt, sei ein Fehler.",https://images.tagesschau.de/image/8d132439-2403-4cae-b971-9e1943080a1e/AAABnGDL4J4/AAABmyZE0EA/16x9-big/kallas-msc-100.jpg?width=1280,2026-02-15T10:36:06Z,,"Stand: 15.02.2026 11:36 Uhr
Immer wieder äußern US-Politiker Kritik an der EU. Auf der Sicherheitskonferenz spielte die EU-Außenbeauftragte Kallas den Ball nun zurück - und beklagte: Dass die EU bei… [+3988 chars]",,de,'Ukraine'
https://www.morgenpost.de/politik/article411212034/er-sieht-sich-als-zar-an-dieser-frage-laesst-putin-ukraine-deal-wohl-scheitern.html,https://www.morgenpost.de/politik/article411212034/er-sieht-sich-als-zar-an-dieser-frage-laesst-putin-ukraine-deal-wohl-scheitern.html,0,www.morgenpost.de,„Er sieht sich als Zar“: An dieser Frage lässt Putin Ukraine-Deal wohl scheitern,Schlechte Stimmung vor den Ukraine-Friedensgesprächen. Selenskyj nennt in München Probleme – und drängt auf einen EU-Beitritt nächstes Jahr.,https://img.sparknews.funkemedien.de/411212975/411212975_1771153811_v16_9_1600.jpeg,2026-02-15T11:09:19Z,,"Diese Frage zu den Ukraine-Friedensverhandlungen könnte Wolodymyr Selenskyj in Bedrängnis bringen, aber der ukrainische Präsident will sich nichts anmerken lassen. Spüren Sie den Druck von Donald Tru… [+8398 chars]",,de,'Putin'
https://www.berliner-zeitung.de/news/muenchner-sicherheitskonferenz-bnd-chef-fordert-aktive-gegenmassnahmen-gegen-russland-li.10019114,https://www.berliner-zeitung.de/news/muenchner-sicherheitskonferenz-bnd-chef-fordert-aktive-gegenmassnahmen-gegen-russland-li.10019114,0,www.berliner-zeitung.de,Münchner Sicherheitskonferenz: BND-Chef fordert aktive Gegenmaßnahmen gegen Russland,Der Bundesnachrichtendienst soll künftig operativer agieren. Das Kanzleramt plant einen Paradigmenwechsel bei Geheimdienst-Befugnissen. Doch nicht alle sind begeistert.,https://berliner-zeitung-msp-prod.imgix.net/2026/02/15/194bd246-483e-4d22-884b-d6ca27bc6f59.jpg?w=1024&auto=format,2026-02-15T11:18:04Z,,"Der Präsident des Bundesnachrichtendienstes (BND), Martin Jäger, hat auf der Münchner Sicherheitskonferenz eine deutliche Kursänderung im Umgang mit russischen Angriffen gefordert. Deutschland solle … [+4233 chars]",,de,'Russland'
https://www.stern.de/politik/ausland/nach-tod-des-kremlkritikers--europaeische-laender--nawalny-starb-laut-analyse-an-nervengift-37138622.html,https://www.stern.de/politik/ausland/nach-tod-des-kremlkritikers--europaeische-laender--nawalny-starb-laut-analyse-an-nervengift-37138622.html,0,www.stern.de,Nach Tod des Kremlkritikers: Europäische Länder: Nawalny starb laut Analyse an Nervengift,Zum zweiten Todestag des Kremlkritikers Nawalny präsentieren Außenminister Wadephul und Kollegen am Rande der Münchner Sicherheitskonferenz neue Erkenntnisse. Hat das Folgen für Putin?,https://image.stern.de/37138624/t/fU/v1/w1440/r1.7778/-/15--w6i227a52fv5axs2048jpeg---c9ce9e87e8f083ae.jpg,2026-02-15T11:18:32Z,,"Kopiere den aktuellen Link
Zur Merkliste hinzufügen
Zum zweiten Todestag des Kremlkritikers Nawalny präsentieren Außenminister Wadephul und Kollegen am Rande der Münchner Sicherheitskonferenz neue … [+5035 chars]",,de,'Putin'
https://www.tagesspiegel.de/internationales/nach-tod-des-kremlkritikers-europaische-lander-nawalny-starb-laut-analyse-an-nervengift-15252580.html,https://www.tagesspiegel.de/internationales/nach-tod-des-kremlkritikers-europaische-lander-nawalny-starb-laut-analyse-an-nervengift-15252580.html,0,www.tagesspiegel.de,Nach Tod des Kremlkritikers: Europäische Länder: Nawalny starb laut Analyse an Nervengift,Zum zweiten Todestag des Kremlkritikers Nawalny präsentieren Außenminister Wadephul und Kollegen am Rande der Münchner Sicherheitskonferenz neue Erkenntnisse. Hat das Folgen für Putin?,https://www.tagesspiegel.de/images/15252579/alternates/BASE_16_9_W1400/1771154373000/62-munchner-sicherheitskonferenz.jpeg,2026-02-15T11:19:34Z,,"Zwei Jahre nach dem Tod von Alexej Nawalny steht für Deutschland und vier weitere europäische Länder fest, dass Russland den prominenten Kremlkritiker mit einem starken Nervengift umgebracht hat. Auß… [+4881 chars]",,de,'Putin'
https://www.zeit.de/news/2026-02/16/internationales-nawalny-gedenken-russland-am-pranger,https://www.zeit.de/news/2026-02/16/internationales-nawalny-gedenken-russland-am-pranger,0,www.zeit.de,Toter Kremlgegner: Internationales Nawalny-Gedenken – Russland am Pranger,Hier finden Sie Informationen zu dem Thema „Toter Kremlgegner“. Lesen Sie jetzt „Internationales Nawalny-Gedenken – Russland am Pranger“.,https://img.zeit.de/news/2026-02/16/internationales-nawalny-gedenken-russland-am-pranger-image-group/wide__1300x731,2026-02-15T23:01:04Z,,Zwei Jahre nach dem Tod des Kremlgegners Alexej Nawalny erinnern heute in Russland und anderen Ländern Menschen an den Oppositionsführer. Nach Angaben des im ausländischen Exil arbeitenden Nawalny-Te… [+3186 chars],,de,'Russland'
https://www.zeit.de/news/2026-02/16/koelner-rosenmontagszug-solidarisiert-sich-mit-tilly,https://www.zeit.de/news/2026-02/16/koelner-rosenmontagszug-solidarisiert-sich-mit-tilly,0,www.zeit.de,Verfolgung in Russland: Kölner Rosenmontagszug solidarisiert sich mit Tilly,Hier finden Sie Informationen zu dem Thema „Verfolgung in Russland“. Lesen Sie jetzt „Kölner Rosenmontagszug solidarisiert sich mit Tilly“.,https://img.zeit.de/news/2026-02/16/koelner-rosenmontagszug-solidarisiert-sich-mit-tilly-image-group/wide__1300x731,2026-02-16T08:10:20Z,,Mit Statements im Rosenmontagszug solidarisieren sich Kölner Karnevalisten mit dem in Russland gerichtlich verfolgten Wagenbauer Jacques Tilly aus Düsseldorf. Der Wagen von Karnevalspräsident Christo… [+1145 chars],,de,'Russland'
https://www.faz.net/aktuell/politik/ukraine/ukraine-liveticker-wegen-russischer-angriffe-un-befuerchten-neue-fluchtwelle-in-der-ukraine-faz-110683325.html,https://www.faz.net/aktuell/politik/ukraine/ukraine-liveticker-wegen-russischer-angriffe-un-befuerchten-neue-fluchtwelle-in-der-ukraine-faz-110683325.html,0,www.faz.net,Krieg in der Ukraine: UN befürchten neue Fluchtwelle in der Ukraine,Vereinte Nationen: Russische Angriffe auf Wärme-Infrastruktur machen Rückkehrer abermals zu Flüchtlingen +++ Helmholtz-Zentrum simuliert Auswirkungen möglicher Ölunfälle in der Ostsee  +++ Nordkorea spendiert Wohnungen für Familien gefallener Soldaten +++ all…,https://media0.faz.net/image/w1200h627/9441f443b963/w5334h2787x0y415o/202602/43601.0.1784314527/neuer-schneefall-und.webp,2026-02-16T11:45:54Z,,"Die frühere US-Außenministerin Hillary Clinton hat Präsident Donald Trumps Haltung zur Ukraine als schändlich bezeichnet. Ich halte den Versuch, die Ukraine zu einem Kapitulationsabkommen mit Putin z… [+634 chars]",,de,'Krieg'
https://www.diepresse.com/20593059/rubio-staerkt-orban-vor-ungarn-wahl-ihr-erfolg-ist-auch-unser-erfolg,https://www.diepresse.com/20593059/rubio-staerkt-orban-vor-ungarn-wahl-ihr-erfolg-ist-auch-unser-erfolg,0,www.diepresse.com,Rubio stärkt Orbán vor Ungarn-Wahl: „Ihr Erfolg ist auch unser Erfolg“,Orbán bezeichnet sich selbst als „Freund“ von US-Präsident Donald Trump - und setzt sich dabei ebenso wie bei seiner Haltung zum Ukraine-Krieg von den meisten Europäern ab. Am 12. April wählen die Menschen in Ungarn ein neues Parlament.,https://img.diepresse.com/public/incoming/vs4aa2-hungary-us-politics-diplomacy/alternates/DPR_SOCIAL_NACHRICHTEN/HUNGARY-US-POLITICS-DIPLOMACY,2026-02-16T12:20:32Z,,Orbán bezeichnet sich selbst als Freund von US-Präsident Donald Trump - und setzt sich dabei ebenso wie bei seiner Haltung zum Ukraine-Krieg von den meisten Europäern ab. Am 12. April wählen die Mens… [+1729 chars],,de,'Krieg'
https://www.welt.de/politik/ausland/article6993039e920e7fffb6a74243/orban-wirft-selenskyj-einmischung-mit-brutaler-offenheit-vor-und-erhaelt-rueckendeckung-aus-den-usa.html,https://www.welt.de/politik/ausland/article6993039e920e7fffb6a74243/orban-wirft-selenskyj-einmischung-mit-brutaler-offenheit-vor-und-erhaelt-rueckendeckung-aus-den-usa.html,0,www.welt.de,Orbán wirft Selenskyj Einmischung mit „brutaler Offenheit“ vor – und erhält Rückendeckung der USA,Ungarns Regierungschef kritisiert Äußerungen des ukrainischen Präsidenten Wolodymyr Selenskyj scharf. Kurz vor der Parlamentswahl stellt Viktor Orbán die Ukraine als Akteur im Inneren dar. Das Verhältnis zu den USA befände sich in einem „goldenen Zeitalter“.,https://images.welt.de/6993039e920e7fffb6a74243/8aa787e0899e63849be16f4ac096fa73-master/ci16x9-w1200/2026-02-16t114928z-617179222-rc2zmja9km0z-rtrmadp-3-usa-rubio-europe-hungary-jpg,2026-02-16T12:46:50Z,,Ungarns Regierungschef kritisiert Äußerungen des ukrainischen Präsidenten Wolodymyr Selenskyj scharf. Kurz vor der Parlamentswahl stellt Viktor Orbán die Ukraine als Akteur im Inneren dar. Das Verhäl… [+2736 chars],,de,'Krieg'
https://www.focus.de/politik/ausland/ukraine-zerstoert-wichtige-russische-militaerziele_12615a3d-1f0e-46f4-91ef-bd32e9da5b47.html,https://www.focus.de/politik/ausland/ukraine-zerstoert-wichtige-russische-militaerziele_12615a3d-1f0e-46f4-91ef-bd32e9da5b47.html,0,www.focus.de,Ukraine zerstört „wichtige“ russische Militärziele,Die Ukraine hat mehrere russische Militärziele in besetzten Gebieten angegriffen. Dabei wurden offenbar Kommandozentren und Luftabwehrsysteme zerstört.,https://quadro.burda-forward.de/ctf/269eed46-b88d-4afb-ab11-a8ad7741be07.f141ed4e-e515-446e-941a-e0a44fc03867.jpg?im=RegionOfInterestCrop%3D%281200%2C630%29%2CregionOfInterest%3D%28488%2C277%29&hash=32f376556b2afbafd9bb6ab7d2a9481ef2765e1a36299b79202d1d0bc5c0a18e,2026-02-16T13:05:00Z,,"Die ukrainischen Streitkräfte sollen mehrere wichtige russische Militärziele in den besetzten Gebieten der Regionen Donezk, Saporischschja und Dnipropetrowsk angegriffen haben. Das berichtet der Kyiv… [+1744 chars]",,de,'Krieg'
https://www.n-tv.de/politik/Generalinspekteur-Breuer-und-britischer-Generalstabschef-Knighton-warnen-vor-Russland-und-fordern-Staerkung-der-Einsatzbereitschaft-id30367984.html,https://www.n-tv.de/politik/Generalinspekteur-Breuer-und-britischer-Generalstabschef-Knighton-warnen-vor-Russland-und-fordern-Staerkung-der-Einsatzbereitschaft-id30367984.html,0,www.n-tv.de,"""Risiko eines Konflikts"": Top-Militärs warnen vor Russland","Viele Experten halten einen Angriff Russlands auf Nato-Staaten nicht für unwahrscheinlich. Es gibt Anzeichen, sind sich internationale Spitzenmilitärs sicher. Aus dem Krieg in der Ukraine würde Russland bereits seine Schlüsse ziehen.",https://www.n-tv.de/img/30368071/1771248954/Img_16_9/1200/RUSSIA-TRANSBAIKAL-REGION-NOVEMBER-13-2025-T-72-tanks-take-part-in-live-fire-exercises-at-the-Krasny-Yar-range-of-the-Eastern-Military-District.jpg,2026-02-16T13:22:24Z,,"Russland rüstet weiter auf, die Nato will nachlegen. (Foto: IMAGO/ITAR-TASS)
Viele Experten halten einen Angriff Russlands auf Nato-Staaten nicht für unwahrscheinlich. Es gibt Anzeichen, sind sich i… [+2680 chars]",,de,'Risiko'
