index,url,valid,domain,title,description,image,published,archive,content,quote,language,keyword
https://www.welt.de/debatte/article254777420/In-Georgien-bekommt-Europa-die-Rechnung-fuer-seine-Selbstverzwergung.html,https://www.welt.de/debatte/article254777420/In-Georgien-bekommt-Europa-die-Rechnung-fuer-seine-Selbstverzwergung.html,0,www.welt.de,In Georgien bekommt Europa die Rechnung für seine Selbstverzwergung,"So leid es einem um die überwiegend pro-europäische Bevölkerung in Georgien tut – Brüssel hat das Rennen mit Putin um den Einfluss im Land verloren. Die EU sollte das anerkennen und sich überlegen, was das für ihren Umgang mit den Ländern des westlichen Balka…",https://img.welt.de/img/debatte/mobile254786432/4807938057-ci16x9-w1200/Proteste-in-Georgien.jpg,2024-12-06T10:17:35Z,,"So leid es einem um die überwiegend pro-europäische Bevölkerung in Georgien tut Brüssel hat das Rennen mit Putin um den Einfluss im Land verloren. Die EU sollte das anerkennen und sich überlegen, was… [+2755 chars]",,de,'Putin'
https://www.focus.de/politik/zukunftsforscher-thomas-druyen-kampf-gegen-putins-truppen-zeigt-warum-wir-kuenftig-keine-panzer-mehr-brauchen_id_260540383.html,https://www.focus.de/politik/zukunftsforscher-thomas-druyen-kampf-gegen-putins-truppen-zeigt-warum-wir-kuenftig-keine-panzer-mehr-brauchen_id_260540383.html,0,www.focus.de,"Zukunftsforscher Thomas Druyen - Kampf gegen Putins Truppen zeigt, warum wir künftig keine Panzer mehr brauchen","Der Ukrainekrieg zeigt: Panzer sind nicht mehr unbesiegbar. KI-gestützte Drohnen könnten die Kriegsführung revolutionieren. Zukunftsforscher Thomas Druyen erklärt, warum alte Strategien obsolet werden und welche Rolle Künstliche Intelligenz spielen könnte.Von…",https://p6.focus.de/img/fotos/id_260540384/gettyimages-632208767.jpg?im=Crop%3D%280%2C291%2C1935%2C967%29%3BResize%3D%281200%2C627%29&impolicy=perceptual&quality=mediumHigh&hash=34283c7d5b51fa33c723b72b2643369dda319ddf678112d28f4db561f2895580,2024-12-06T10:27:36Z,,"Der Ukrainekrieg zeigt: Panzer sind nicht mehr unbesiegbar. KI-gestützte Drohnen könnten die Kriegsführung revolutionieren. Zukunftsforscher Thomas Druyen erklärt, warum alte Strategien obsolet werde… [+6276 chars]",,de,'Putin'
https://www.focus.de/politik/ausland/gustav-gressel-experte-entlarvt-scholz-luege-zur-ukraine-und-sagt-putin-moechte-deutschland-bestrafen_id_260540714.html,https://www.focus.de/politik/ausland/gustav-gressel-experte-entlarvt-scholz-luege-zur-ukraine-und-sagt-putin-moechte-deutschland-bestrafen_id_260540714.html,0,www.focus.de,Gustav Gressel - Experte entlarvt Scholz-Lüge zur Ukraine und sagt: „Putin möchte Deutschland bestrafen“,Der Militärexperte Gustav Gressel hat in einem Interview über Scholz' Wahlkampf „auf dem Rücken der Ukraine“ gesprochen. Zu Russlands hybridem Krieg sagt er: „Putin möchte Deutschland bestrafen.“,https://p6.focus.de/img/panorama/welt/id_260484035/scholz-rechts-bei-einem-besuch-bei-putin.-archivbild-.jpg?im=Crop%3D%280%2C142%2C2048%2C1024%29%3BResize%3D%281200%2C627%29&impolicy=perceptual&quality=mediumHigh&hash=6165e79f02fe4d24fcdd7fc02146a5681be0c20566d2b86e67cd7488a1451de1,2024-12-06T10:43:24Z,,Militärexperte Gustav Gressel spricht über Scholz' Wahlkampf auf dem Rücken der Ukraine. Zu Russlands hybridem Krieg sagt er: Putin möchte Deutschland bestrafen.Im Gespräch mit t-online erklärt Gress… [+2265 chars],,de,'Russland'
https://www.telepolis.de/features/Ukraine-Krieg-Russland-droht-mit-staerkeren-militaerischen-Mitteln-10190650.html,https://www.telepolis.de/features/Ukraine-Krieg-Russland-droht-mit-staerkeren-militaerischen-Mitteln-10190650.html,0,www.telepolis.de,"Ukraine-Krieg: Russland droht mit ""stärkeren militärischen Mitteln""",Russland erhöht den Druck im Ukraine-Konflikt. Die USA stehen vor einem möglichen Kurswechsel. Treffen zwischen Trump-Vertrauten und Ukrainischer Delegation.,https://heise.cloudimg.io/bound/1200x1200/q85.png-lossy-85.webp-lossy-85.foil1/_www-heise-de_/imgs/18/4/7/5/8/5/5/4/shutterstock_2428750523-c63e896c92e7f7f6.jpeg,2024-12-06T11:00:00Z,https://web.archive.org/web/20241207052143/https://www.telepolis.de/features/Ukraine-Krieg-Russland-droht-mit-staerkeren-militaerischen-Mitteln-10190650.html,"Ein ukrainischer Soldat in einem Schützengraben
(Bild: Drop of Light/Shutterstock.com)
Russland erhöht den Druck im Ukraine-Konflikt. Die USA stehen vor einem möglichen Kurswechsel. Treffen zwische… [+6359 chars]",,de,'Russland'
https://www.faz.net/aktuell/finanzen/finanzmarkt/geschwaechter-rubel-wertet-nach-putin-eingriff-auf-110158299.html,https://www.faz.net/aktuell/finanzen/finanzmarkt/geschwaechter-rubel-wertet-nach-putin-eingriff-auf-110158299.html,0,www.faz.net,Geschwächter Rubel wertet nach Putin-Eingriff auf,Die abgestürzte russische Währung hat wieder etwas an Wert gewonnen. Am Freitagmittag überschritt sie die 100er-Marke zum Dollar.,https://media0.faz.net/ppmedia/aktuell/wirtschaft/639229839/1.10158306/facebook_teaser/fast-nichts-mehr-wert.jpg,2024-12-06T11:45:04Z,,"Putins Dekret bedeutet, dass europäische Käufer von russischem Gas wie Ungarn und die Slowakei ihre Währung nun bei Banken in Rubel umtauschen können, die nicht unter Sanktionen stehen. Bisher nutzte… [+973 chars]",,de,'Putin'
https://www.zeit.de/2024/52/russische-wirtschaft-rubel-inflation-krieg-wladimir-putin,https://www.zeit.de/2024/52/russische-wirtschaft-rubel-inflation-krieg-wladimir-putin,0,www.zeit.de,Russische Wirtschaft: Wie lange hält Russland das durch?,"Russland schlittert in eine tiefe Krise: Der Wert des Rubels stürzt ab, die Preise steigen. Ausgerechnet jetzt könnte Donald Trump für Putin eine echte Hilfe sein.",https://img.zeit.de/2024/52/wie-lange-haelt-russland-das-durch-bild-1/wide__1300x731,2024-12-06T11:51:43Z,https://web.archive.org/web/20241205020404/https://www.zeit.de/2024/52/russische-wirtschaft-rubel-inflation-krieg-wladimir-putin,"In der Moskauer Innenstadt eröffnen täglich neue Wechselstuben. Allein in der unmittelbaren Nachbarschaft des ZEIT-Büros sind es mittlerweile vier. Denn wer mit Devisen gegen Rubel handelt, macht in … [+819 chars]",,de,'Putin'
https://www.focus.de/tagesthema/tagesthema-am-abend/update-am-abend-13-00-uhr-russlands-rekordverlust-merz-kritisiert-heizungsgesetz-plaene_dc3f112b-c977-42bf-8150-42df17be98b5.html,https://www.focus.de/tagesthema/tagesthema-am-abend/update-am-abend-13-00-uhr-russlands-rekordverlust-merz-kritisiert-heizungsgesetz-plaene_dc3f112b-c977-42bf-8150-42df17be98b5.html,0,www.focus.de,Update am Abend - 13.00 Uhr: Russlands Rekordverlust + Merz kritisiert Heizungsgesetz-Pläne,Update am Abend: 13.00 Uhr: Russlands Rekordverlust + Merz kritisiert Heizungsgesetz-Pläne,https://quadro.burda-forward.de/ctf/6843d9a5-dcc0-4135-9b14-6df71d4a01d6.f0a375d2-4394-44d1-96b0-f1e318f9f6d7.png?im=RegionOfInterestCrop%3D%281200%2C630%29%2CregionOfInterest%3D%28285%2C150%29&hash=14e0ebb7110d2a8cdce6ef2e9b92f30bd90f41e8267f59303d76aa2ef3f1be3b,2024-12-06T12:30:00Z,,"Rückblick auf die Top-Themen des Tages
Krieg in der Ukraine: Bundesaußenministerin Annalena Baerbock schließt den Einsatz der Bundeswehr zur Friedenssicherung in der Ukraine nicht aus. CDU-Chef Frie… [+3389 chars]",,de,'Hohe Kosten'
https://www.faz.net/aktuell/politik/ukraine/ukraine-liveticker-praesidentschaftskandidat-in-rumaenien-will-hilfe-fuer-ukraine-einstellen-faz-19030454.html,https://www.faz.net/aktuell/politik/ukraine/ukraine-liveticker-praesidentschaftskandidat-in-rumaenien-will-hilfe-fuer-ukraine-einstellen-faz-19030454.html,0,www.faz.net,Ukraine-Liveblog: Präsidentschaftskandidat in Rumänien will Hilfe für Ukraine einstellen,Calin Georgescu: Putin ist ein Patriot und Führer +++ Lawrow beim OSZE-Gipfel in Malta +++ Spitzengeneräle der USA und Russlands führten seltenes Telefonat +++ alle Entwicklungen im Liveblog,https://media1.faz.net/ppmedia/aktuell/2937401161/1.10157871/facebook_teaser/der-ukraine-will-er-nicht.jpg,2024-12-06T12:42:49Z,,"Die EU-Staaten haben sich auf Inhalte eines 15. Sanktionspakets gegen Russland verständigt, berichtet unser EU-Korrespondent Thomas Gutschker. Dazu gehören weitere Listungen von Schiffen der russisch… [+1958 chars]",,de,'Russland'
https://www.golem.de/sonstiges/zustimmung/auswahl.html?from=https://www.golem.de/news/windkraft-und-solar-stromerzeugung-aus-erneuerbaren-energien-erreicht-rekord-2412-191491.html&referer=https://t.co/cfe02a008a,https://www.golem.de/sonstiges/zustimmung/auswahl.html?from=https://www.golem.de/news/windkraft-und-solar-stromerzeugung-aus-erneuerbaren-energien-erreicht-rekord-2412-191491.html&referer=https://t.co/cfe02a008a,0,www.golem.de,Windkraft und Solar: Stromerzeugung aus erneuerbaren Energien erreicht Rekord,"Windkraft und Photovoltaik sind im dritten Quartal wichtigste Quellen für die Stromerzeugung vor Kohle gewesen. Ein Grund: das Wetter. (Erneuerbare Energien, Solarenergie)",,2024-12-06T12:55:08Z,,"Besuchen Sie Golem.de wie gewohnt mit Werbung und Tracking,
 indem Sie der Nutzung aller Cookies zustimmen.
 Details zum Tracking finden Sie im Privacy Center.
Skript wurde nicht geladen. Informat… [+607 chars]",,de,'Windkraft'
https://www.focus.de/panorama/welt/die-behoerden-wurden-schon-vor-jahrzehnten-alarmiert_id_260536498.html,https://www.focus.de/panorama/welt/die-behoerden-wurden-schon-vor-jahrzehnten-alarmiert_id_260536498.html,0,www.focus.de,Feuer gelegt und Mann getötet - Esslinger Feuermörder verbreitete lange Angst und Schrecken - Behörden schliefen,"Der Vorwurf aus dem Umfeld des getöteten Luca S., die Behörden hätten nicht angemessen reagiert, wird durch neue Aussagen gestärkt. Auch ein Anwalt hatte die Polizei gewarnt – und vor 30 Jahren wurde eine Ex-Vermieterin wohl in ähnlicher Weise bedroht.",https://p6.focus.de/img/regional/baden-wuerttemberg/id_260494241/der-vater-des-getoeteten-wirft-den-behoerden-versaeumnisse-vor.-archivbild-.jpg?im=Crop%3D%280%2C256%2C2048%2C1024%29%3BResize%3D%281200%2C627%29&impolicy=perceptual&quality=mediumHigh&hash=e24b8beeb1e6509682961bbe2d2e55b91a65de991f522a157a94a18d361068f5,2024-12-06T14:20:17Z,,"Die Polizei hatte weit mehr Hinweise auf die Absichten des mutmaßlichen Täters, der Luca S. in Esslingen getötet und das Haus angezündet haben soll, als bisher angenommen.
Neben dem Vater des Opfers… [+6902 chars]",,de,'Angst'
https://www.diepresse.com/19152449/putin-koennten-oreschnik-raketen-in-belarus-stationieren,https://www.diepresse.com/19152449/putin-koennten-oreschnik-raketen-in-belarus-stationieren,0,www.diepresse.com,Putin: Könnten Oreschnik-Raketen in Belarus stationieren,"Der russische Präsident stellt dem Verbündeten eine Lieferung der neuen Mittelstreckenraketen in Aussicht. Der Westen solle den Einsatz dieser Waffen in der Ukraine ernst nehmen, sagt Russlands Außenminister im Interview mit dem Trump-Vertrauten Carlson.",https://img.diepresse.com/public/incoming/562uft-BELARUS-RUSSIA/alternates/DPR_SOCIAL_NACHRICHTEN/BELARUS-RUSSIA,2024-12-06T15:18:41Z,https://web.archive.org/web/20241207154343/https://www.diepresse.com/19152449/putin-koennten-oreschnik-raketen-in-belarus-stationieren,"Der russische Präsident stellt dem Verbündeten eine Lieferung der neuen Mittelstreckenraketen in Aussicht. Der Westen solle den Einsatz dieser Waffen in der Ukraine ernst nehmen, sagt Russlands Außen… [+4995 chars]",,de,'Russland'
https://www.tagesspiegel.de/wissen/osteuropaforschung-schlagt-alarm-eine-bedrohung-des-freien-wissenschaftlichen-diskurses-12834542.html,https://www.tagesspiegel.de/wissen/osteuropaforschung-schlagt-alarm-eine-bedrohung-des-freien-wissenschaftlichen-diskurses-12834542.html,0,www.tagesspiegel.de,Osteuropaforschung schlägt Alarm: „Eine Bedrohung des freien wissenschaftlichen Diskurses“,Die Europa-Universität Viadrina protestiert gemeinsam mit anderen Universitäten gegen die russische Einstufung der Osteuropastudien als „extremistisch“. Die Hochschulen fordern politischen Schutz vor solchen Angriffen.,https://www.tagesspiegel.de/images/10487671/alternates/BASE_16_9_W1400/1733501813000/the-golden-domes-of-the-st-sophia-cathedral-complex-unesco-world-heritage-site-kyiv-kiev-ukraine-europe-publicati.jpeg,2024-12-06T17:31:29Z,,"Die Europa-Universität Viadrina Frankfurt (Oder) hat sich gemeinsam mit acht weiteren deutschen Universitäten, die einen Osteuropa-Schwerpunkt haben, solidarisch mit der Deutschen Gesellschaft für Os… [+2951 chars]",,de,'Bedrohung'
https://www.dw.com/de/aufstand-in-syrien-existenzielle-bedrohung-f%C3%BCr-iran/a-70988481,https://www.dw.com/de/aufstand-in-syrien-existenzielle-bedrohung-f%C3%BCr-iran/a-70988481,0,www.dw.com,Aufstand in Syrien: Existenzielle Bedrohung für Iran,"Der Vormarsch der Rebellenallianz in Syrien setzt auch den Iran massiv unter Druck. Stürzt dort Präsident Assad, würde auch das Regime in Teheran ins Wanken geraten.",https://static.dw.com/image/70985323_6.jpg,2024-12-06T17:34:00Z,,"Nach Aleppo und Hama stehen syrischeRebellen nun vor den Toren von Homs, der drittgrößten Stadt in Syrien. Ihr erklärtes Ziel sei der Sturz vom Machthaber Baschar al-Assad, sagt Rebellenanführer Abu … [+5180 chars]",,de,'Bedrohung'
https://www.focus.de/politik/ausland/aufstand-in-syrien-existenzielle-bedrohung-fuer-iran_a18debfb-ee43-4c60-abb5-41251f3fa837.html,https://www.focus.de/politik/ausland/aufstand-in-syrien-existenzielle-bedrohung-fuer-iran_a18debfb-ee43-4c60-abb5-41251f3fa837.html,0,www.focus.de,Ausland - Aufstand in Syrien: Existenzielle Bedrohung für Iran,"Der Vormarsch der Rebellenallianz in Syrien setzt auch den Iran massiv unter Druck. Stürzt dort Präsident Assad, würde auch das Regime in Teheran ins Wanken geraten.",https://quadro.burda-forward.de/ctf/79270897-eb4c-4d23-9cf5-eddfb9a77e5f.489a7381-6dec-4b14-8fe6-02d705b62575.jpeg?im=Resize%3D%281200%2C630%29&hash=d89b2d87921e3d5a078226624f191b54be6ed6bf6cc86d468fb94d5d91e1dc89,2024-12-06T17:51:28Z,,"Nach Aleppo und Hama stehen syrische Rebellen nun vor den Toren von Homs, der drittgrößten Stadt in Syrien. Ihr erklärtes Ziel sei der Sturz vom Machthaber Baschar al-Assad, sagt Rebellenanführer Abu… [+4595 chars]",,de,'Bedrohung'
https://www.jungewelt.de/artikel/489432.alte-stärke.html,https://www.jungewelt.de/artikel/489432.alte-stärke.html,0,www.jungewelt.de,Der schwarze Kanal: Alte Stärke,"Arndt Freytag von Loringhoven ist pensionierter Diplomat und Geheimdienstler. In der Berliner Zeitung macht er Vorschläge, wie »wir« Putins »hybriden Krieg« überstehen können. Denn der Russe ist längst unter »uns«.",https://www.jungewelt.de/img/1100/202891.jpg,2024-12-06T18:38:44Z,,"Erstmals in seiner Geschichte hatte das Parlamentarische Kontroll­gremium des Bundestages, das die deutschen Geheimdienste kontrollieren soll, am 14. Oktober deren Chefs eingeladen. Die Kontrolle ist… [+3471 chars]",,de,'Putin'
https://www.n-tv.de/politik/11-42-London-Russische-Truppen-nur-noch-sechs-Kilometer-vor-Pokrowsk--article23143824.html,https://www.n-tv.de/politik/11-42-London-Russische-Truppen-nur-noch-sechs-Kilometer-vor-Pokrowsk--article23143824.html,0,www.n-tv.de,Ukraine-Krieg im Liveticker: +++ 11:42 London: Russische Truppen nur noch sechs Kilometer vor Pokrowsk +++,Lesen Sie alle aktuellen Entwicklungen und Nachrichten über den russischen Angriffskrieg auf die Ukraine im Liveticker von ntv.de.,https://bilder3.n-tv.de/img/incoming/crop25117070/4231326595-cImg_16_9-w1200/Ukraine-Liveticker.jpg,2024-12-06T23:29:00Z,https://web.archive.org/web/20241207111559/https://www.n-tv.de/politik/11-42-London-Russische-Truppen-nur-noch-sechs-Kilometer-vor-Pokrowsk--article23143824.html,Russische Truppen haben bei den Kämpfen im Osten der Ukraine nach britischen Angaben zuletzt Fortschritte an mehreren Abschnitten im Gebiet Donezk gemacht. So rücke Russland schrittweise in Richtung … [+14471 chars],,de,'Krieg'
https://www.n-tv.de/politik/08-32-Ukraine-1300-russische-Verluste-seit-gestern--article23143824.html,https://www.n-tv.de/politik/08-32-Ukraine-1300-russische-Verluste-seit-gestern--article23143824.html,0,www.n-tv.de,Ukraine-Krieg im Liveticker: +++ 07:49 Seedrohnen attackieren russische Überwachung im Meer +++,Lesen Sie alle aktuellen Entwicklungen und Nachrichten über den russischen Angriffskrieg auf die Ukraine im Liveticker von ntv.de.,https://bilder3.n-tv.de/img/incoming/crop25117070/4231326595-cImg_16_9-w1200/Ukraine-Liveticker.jpg,2024-12-06T23:29:00Z,,Der Generalstab der Streitkräfte der Ukraine meldet für die vergangenen 24 Stunden 1300 Verluste unter russischen Soldaten sowie zwei Luftverteidigungssysteme. Zudem hätten die russischen Truppen 17 … [+10667 chars],,de,'Krieg'
https://www.n-tv.de/politik/13-57-Ukraine-Auch-in-Saporischschja-ist-Lage-angespannt--article23143824.html,https://www.n-tv.de/politik/13-57-Ukraine-Auch-in-Saporischschja-ist-Lage-angespannt--article23143824.html,0,www.n-tv.de,Ukraine-Krieg im Liveticker: +++ 13:57 Ukraine: Auch in Saporischschja ist Lage angespannt +++,Lesen Sie alle aktuellen Entwicklungen und Nachrichten über den russischen Angriffskrieg auf die Ukraine im Liveticker von ntv.de.,https://bilder3.n-tv.de/img/incoming/crop25117070/4231326595-cImg_16_9-w1200/Ukraine-Liveticker.jpg,2024-12-06T23:29:00Z,,"Auch an der Front bei Saporischschja ist die Lage für die Ukraine sehr schwierig und angespannt. Das sagt der Sprecher der Freiheitslegion Russlands, Kostiantyn Denysov im Interview mit dem Sender KY… [+17796 chars]",,de,'Ukraine'
https://www.n-tv.de/politik/15-24-Wenn-alle-so-entschlossen-waeren-Selenskyj-bedankt-sich-fuer-F-16-Lieferung--article23143824.html,https://www.n-tv.de/politik/15-24-Wenn-alle-so-entschlossen-waeren-Selenskyj-bedankt-sich-fuer-F-16-Lieferung--article23143824.html,0,www.n-tv.de,"Ukraine-Krieg im Liveticker: +++ 15:24 ""Wenn alle so entschlossen wären..."": Selenskyj bedankt sich für F-16-Lieferung +++",Lesen Sie alle aktuellen Entwicklungen und Nachrichten über den russischen Angriffskrieg auf die Ukraine im Liveticker von ntv.de.,https://bilder3.n-tv.de/img/incoming/crop25117070/4231326595-cImg_16_9-w1200/Ukraine-Liveticker.jpg,2024-12-06T23:29:00Z,,Nach dem designierten US-Präsidenten Donald Trump ist auch der ukrainische Staatschef Wolodymyr Selenskyj zur feierlichen Wiedereröffnung der Pariser Kathedrale Notre-Dame in der französischen Haupts… [+18606 chars],,de,'Krieg'
https://www.n-tv.de/politik/11-57-Ukraine-mehr-als-1000-verschleppte-Kinder-aus-Russland-gerettet--article23143824.html,https://www.n-tv.de/politik/11-57-Ukraine-mehr-als-1000-verschleppte-Kinder-aus-Russland-gerettet--article23143824.html,0,www.n-tv.de,Ukraine-Krieg im Liveticker: +++ 11:57 Ukraine: mehr als 1000 verschleppte Kinder aus Russland gerettet +++,Lesen Sie alle aktuellen Entwicklungen und Nachrichten über den russischen Angriffskrieg auf die Ukraine im Liveticker von ntv.de.,https://bilder3.n-tv.de/img/incoming/crop25117070/4231326595-cImg_16_9-w1200/Ukraine-Liveticker.jpg,2024-12-06T23:29:00Z,,"Die Ukraine hat inzwischen mehr als 1000 ukrainische Kinder aus Russland zurückgeholt. Die Zahl gab Dmytro Lubinets, Menschenrechtsbeauftragter des Parlaments, während einer Fernsehsendung bekannt. ""… [+15431 chars]",,de,'Gas'
https://www.zeit.de/news/2024-12/07/selenskyj-trifft-macron-viele-tote-nach-angriff-in-ukraine,https://www.zeit.de/news/2024-12/07/selenskyj-trifft-macron-viele-tote-nach-angriff-in-ukraine,0,www.zeit.de,Die Lage im Überblick: Selenskyj trifft Macron - Viele Tote nach Angriff in Ukraine,Hier finden Sie Informationen zu dem Thema „Die Lage im Überblick“. Lesen Sie jetzt „Selenskyj trifft Macron - Viele Tote nach Angriff in Ukraine“.,https://img.zeit.de/news/2024-12/07/selenskyj-trifft-macron-viele-tote-nach-angriff-in-ukraine-image-group/wide__1300x731,2024-12-07T03:00:44Z,,"Der ukrainische Präsident Wolodymyr Selenskyj wird heute in Paris von Frankreichs Präsidenten Emmanuel Macron zu Gesprächen über die Verteidigung gegen Russlands Angriffskrieg empfangen. Denkbar ist,… [+3873 chars]",,de,'Ukraine'
https://www.focus.de/immobilien/wohnen/erste-stilllegungen-angekuendigt-was-sie-beachten-muessen-falls-der-versorger-ihnen-bald-das-gas-abdreht_03e7d199-16aa-4acf-9306-fd59fe506124.html,https://www.focus.de/immobilien/wohnen/erste-stilllegungen-angekuendigt-was-sie-beachten-muessen-falls-der-versorger-ihnen-bald-das-gas-abdreht_03e7d199-16aa-4acf-9306-fd59fe506124.html,0,www.focus.de,"Erste Stilllegungen angekündigt - Was Sie beachten müssen, falls der Versorger Ihnen bald das Gas abdreht","Die ersten Gasversorger in Deutschland haben angekündigt, ihr Geschäft in rund zehn Jahren einzustellen. Wirtschaftlich ist das unvermeidlich. Doch was, wenn Sie sich jetzt gerade noch eine neue Gasheizung gekauft haben? Das müssen Sie wissen.",https://quadro.burda-forward.de/ctf/ce0ca2ba-9375-4e9a-87f3-7ce90af66c47.6ebf7217-2a31-45a1-95ad-dbe1049f83be.jpeg?im=Resize%3D%281200%2C630%29&hash=0fec5afbd97e3ba23790b1cd91a778e6cd68294d282dca6a2a745f1a3f5e461a,2024-12-07T06:21:00Z,http://archive.md/20241207165537/https://www.focus.de/immobilien/wohnen/erste-stilllegungen-angekuendigt-was-sie-beachten-muessen-falls-der-versorger-ihnen-bald-das-gas-abdreht_03e7d199-16aa-4acf-9306-fd59fe506124.html,"Die MVV Energie aus Mannheim war Anfang November der erste große Gasversorger, der seinen Kunden mitteilte, dass es von ihm in absehbarer Zeit ab 2035 kein Gas mehr geben wird. Gasheizungen eignen si… [+8633 chars]",,de,'Gas'
https://t3n.de/news/apple-mac-nutzer-ziel-cyberkriminelle-wie-schuetzen-1661470/,https://t3n.de/news/apple-mac-nutzer-ziel-cyberkriminelle-wie-schuetzen-1661470/,0,t3n.de,Apple: Warum Mac-Nutzer verstärkt Ziel von Cyberkriminellen werden – und wie du dich schützt,"Malware, Viren, Adware – all das war in der Vergangenheit für Nutzer von Apple-Geräten kein großes Thema, denn Macs galten als weitgehend sicher vor Angriffen. Einem Sicherheitsreport zufolge ändert sich das jetzt. 2024 nahmen die Bedrohungen deutlich zu.
wei…",https://t3n.de/news/wp-content/uploads/2024/10/macbook.jpg,2024-12-07T06:30:00Z,,"Macs haben seit langer Zeit den Ruf, viel sicherer zu sein, als Windows-Systeme. Zwar war es nie ganz ausgeschlossen, dass sich auch Apple-Computer mit Viren und Malware infizieren können, aber im Ve… [+3340 chars]",,de,'Bedrohung'
https://www.faz.net/aktuell/rhein-main/frankfurt/sicherheit-in-flugzeugen-wenn-ein-passagier-im-flugzeug-randaliert-110156717.html,https://www.faz.net/aktuell/rhein-main/frankfurt/sicherheit-in-flugzeugen-wenn-ein-passagier-im-flugzeug-randaliert-110156717.html,0,www.faz.net,Sicherheit in Flugzeugen: Wenn ein Passagier in der Luft randaliert,"Alkohol, Angst, Aggression: Regelmäßig kommt es vor, dass Fluggäste an Bord ausrasten. Wie gehen die Airlines damit um?",https://media1.faz.net/ppmedia/aktuell/3236275493/1.10156963/facebook_teaser/nicht-selten-gibt-es-an-bord.jpg,2024-12-07T07:40:42Z,http://archive.md/20241207074618/https://www.faz.net/aktuell/rhein-main/frankfurt/sicherheit-in-flugzeugen-wenn-ein-passagier-im-flugzeug-randaliert-110156717.html,"Zwei Wochen später ereignet sich ein ähnlicher Fall. Ein 54 Jahre alter Mann aus Deutschland ist auf dem Weg von Holguín in Kuba nach Frankfurt am Main. Auch er ist betrunken, beleidigt das Flugperso… [+3823 chars]",,de,'Bedrohung'
https://www.zeit.de/news/2024-12/07/zahl-der-toten-nach-russischen-angriffen-gestiegen,https://www.zeit.de/news/2024-12/07/zahl-der-toten-nach-russischen-angriffen-gestiegen,0,www.zeit.de,Krieg in der Ukraine: Zahl der Toten nach russischen Angriffen gestiegen,Hier finden Sie Informationen zu dem Thema „Krieg in der Ukraine“. Lesen Sie jetzt „Zahl der Toten nach russischen Angriffen gestiegen“.,https://img.zeit.de/news/2024-12/07/zahl-der-toten-nach-russischen-angriffen-gestiegen-image-group/wide__1300x731,2024-12-07T08:08:48Z,,Nach den russischen Luftschlägen in der Ukraine ist die Zahl der Toten in den Städten Saporischschja und Krywyj Rih im Südosten des Landes weiter gestiegen. Bei dem Angriff mit einer russischen Gleit… [+1560 chars],,de,'Ukraine'
https://www.bild.de/politik/ausland-und-internationales/russische-einmischung-auf-bundestagswahl-geheimdienst-warnt-67530c16e1414a21652c99bd,https://www.bild.de/politik/ausland-und-internationales/russische-einmischung-auf-bundestagswahl-geheimdienst-warnt-67530c16e1414a21652c99bd,0,www.bild.de,Nach Putins Rumänien-Einmischung - Große Sorge um Bundestagswahl,"Deutschland droht möglicherweise ein russischer Angriff auf die Bundestagswahl, ähnlich dem in Rumänien, warnt der Verfassungsschutz.","https://images.bild.de/67530c16e1414a21652c99bd/5a6f89404dcaa6617bf5987b545c6820,9dbc54b8?w=1280",2024-12-07T10:38:45Z,,"Droht Deutschland ein russischer Angriff auf die Bundestagswahlen?
Die Sorgen davor wachsen. Aktuelles Alarmsignal: Die Präsidentschaftswahl im EU-Land Rumänien muss komplett wiederholt werden. Der … [+2142 chars]",,de,'Putin'
https://www.bild.de/regional/nordrhein-westfalen/gevelsberg-bmw-fahrer-trifft-auf-audi-unfall-auf-hagener-strasse-67542ba99a1bed2c723580c8,https://www.bild.de/regional/nordrhein-westfalen/gevelsberg-bmw-fahrer-trifft-auf-audi-unfall-auf-hagener-strasse-67542ba99a1bed2c723580c8,0,www.bild.de,Gevelsberg - Audi-Fahrer (43) rammt BMW-Fahrerin (22),"In Gevelsberg kam es zu einem Unfall auf der Hagener Straße, als ein Audi-Fahrer Gas und Bremse verwechselte und mit einem BMW kollidierte.","https://images.bild.de/67542ba99a1bed2c723580c8/957bf87f14f0209aebea737d365454d8-landscape,4d5be5fc?w=1280",2024-12-07T11:10:29Z,,"Gevelsberg Eine 22-jährige Frau aus Remscheid wurde bei einem Unfall auf der Hagener Straße in Gevelsberg leicht verletzt.
Am 06.12.2024 gegen 17:30 Uhr fuhr sie mit ihrem BMW in Richtung Hagen, als… [+446 chars]",,de,'Gas'
