index,url,valid,domain,title,description,image,published,archive,content,quote,language,keyword
https://www.zeit.de/politik/ausland/2025-09/kriegsgewalt-frauen-russland-ukraine-krieg,https://www.zeit.de/politik/ausland/2025-09/kriegsgewalt-frauen-russland-ukraine-krieg,0,www.zeit.de,"Kriegsgewalt gegen Frauen: ""Ich bin nicht nur ein Opfer, ich bin auch eine Waffe.""","In einer Notunterkunft im Westen der Ukraine lernen Frauen, über das hinwegzukommen, was russische Besatzer ihnen angetan haben: Unsagbare Gewalt.",https://img.zeit.de/politik/ausland/2025-09/kriegsgewalt-frauen-russland-ukraine-22/wide__1300x731,2025-09-12T11:31:09Z,,"Dieser Artikel stammt aus dem Ressort X. Teil von ZEIT am Wochenende, Ausgabe 37/2025.
Lyuba Velychko lehnt an einem Gartensessel, den Blick gerichtet auf ihre darin ruhende ältere Schwester Ira. Zw… [+340 chars]",,de,'Krieg'
https://www.zeit.de/gesellschaft/2025-09/nahostkonflikt-gaza-krieg-israel-palaestina,https://www.zeit.de/gesellschaft/2025-09/nahostkonflikt-gaza-krieg-israel-palaestina,0,www.zeit.de,Nahostkonflikt: So hat sich Ihr Blick auf den Gaza-Krieg verändert,"Immer mehr Deutsche sehen den Krieg in Gaza kritisch. Bei ""Anruf an alle"" sprechen Sie über das militärische Vorgehen Israels und Deutschlands Verantwortung.",https://img.zeit.de/gesellschaft/2025-09/nahostkonflikt-gaza-krieg-israel-palaestina-bild/wide__1300x731,2025-09-12T11:33:29Z,,"Die israelische Armee nimmt derzeit Gaza-Stadt ein. Viele Binnengeflüchtete hatten in der Stadt Zuflucht gesucht und müssen nun erneut fliehen.© Omar Al-Qattaa/AFP/Getty Images
Er verstehe nicht meh… [+2704 chars]",,de,'Krieg'
https://www.zeit.de/news/2025-09/12/haftstrafen-fuer-verstoesse-gegen-russland-sanktionen-gefordert,https://www.zeit.de/news/2025-09/12/haftstrafen-fuer-verstoesse-gegen-russland-sanktionen-gefordert,0,www.zeit.de,Elektronik-Lieferungen: Haftstrafen für Verstöße gegen Russland-Sanktionen gefordert,Hier finden Sie Informationen zu dem Thema „Elektronik-Lieferungen“. Lesen Sie jetzt „Haftstrafen für Verstöße gegen Russland-Sanktionen gefordert“.,https://img.zeit.de/news/2025-09/12/haftstrafen-fuer-verstoesse-gegen-russland-sanktionen-gefordert-image-group/wide__1300x731,2025-09-12T12:26:29Z,,In einem Prozess um Verstöße gegen die Russland-Sanktionen hat die Staatsanwaltschaft Hamburg Haftstrafen für die fünf Angeklagten beantragt. Für den 46 Jahre alten Hauptangeklagten forderte die Staa… [+2481 chars],,de,'Russland'
https://www.faz.net/aktuell/sport/mehr-sport/radsportmaezen-adams-israels-sonderbotschafter-im-krieg-und-bei-der-vuelta-110683046.html,https://www.faz.net/aktuell/sport/mehr-sport/radsportmaezen-adams-israels-sonderbotschafter-im-krieg-und-bei-der-vuelta-110683046.html,0,www.faz.net,Radsportmäzen Adams: Israels Sonderbotschafter im Krieg,"Das Team Israel-Premier Tech ist bei der Vuelta Fokus des Protests. Sylvan Adams, der Finanzier des Radrennstalls und Verbündeter Benjamin Netanjahus, sieht sich auf einer Mission.",https://media0.faz.net/ppmedia/w1200/aktuell/1928924631/1.10683048/facebook_teaser/heisses-pflaster-die-proteste.jpg.webp,2025-09-12T13:19:16Z,,"Das abrupte, durch für die palästinensische Sache protestierende Demonstranten ausgelöste Ende der Etappen der Spanien-Rundfahrt bremste nicht nur die Fahrer aus. Sie beschädigten auch das ideologisc… [+384 chars]",,de,'Krieg'
https://www.zeit.de/news/2025-09/12/palaestinenser-wieder-tote-bei-angriffen-israels-in-gaza,https://www.zeit.de/news/2025-09/12/palaestinenser-wieder-tote-bei-angriffen-israels-in-gaza,0,www.zeit.de,Gaza-Krieg: Palästinenser: Wieder Tote bei Angriffen Israels in Gaza,Hier finden Sie Informationen zu dem Thema „Gaza-Krieg“. Lesen Sie jetzt „Palästinenser: Wieder Tote bei Angriffen Israels in Gaza“.,https://img.zeit.de/news/2025-09/12/palaestinenser-wieder-tote-bei-angriffen-israels-in-gaza-image-group/wide__1300x731,2025-09-12T16:10:21Z,,"Bei israelischen Angriffen auf Ziele im Gazastreifen hat es palästinensischen Angaben zufolge wieder Dutzende Tote gegeben. Aus medizinischen Kreisen in dem Küstengebiet hieß es, seit dem Morgen seie… [+2574 chars]",,de,'Krieg'
https://www.tagesschau.de/ausland/nato-ostflanke-100.html,https://www.tagesschau.de/ausland/nato-ostflanke-100.html,0,www.tagesschau.de,NATO will Flanke zu Russland stärken,"Die NATO zieht Konsequenzen aus der Verletzung des polnischen Luftraums durch russische Drohnen. Man starte zum Schutz der Ostflanke eine neue Militäroperation, so Generalsekretär Rutte. Dafür soll unter anderem die Flugabwehr ausgebaut werden.",https://images.tagesschau.de/image/e3d2b456-b701-4be3-ab60-b12c921f17c8/AAABmT66ycE/AAABmKJZ-0g/16x9-big/rutte-264.jpg?width=1280,2025-09-12T16:34:03Z,,"Stand: 12.09.2025 18:34 Uhr
Die NATO zieht Konsequenzen aus der Verletzung des polnischen Luftraums durch russische Drohnen. Man starte zum Schutz der Ostflanke eine neue Militäroperation, so Genera… [+1802 chars]",,de,'Russland'
https://www.n-tv.de/politik/Selenskyj-Putin-kann-seine-Kriegsmaschinerie-nicht-mehr-stoppen-article26029773.html,https://www.n-tv.de/politik/Selenskyj-Putin-kann-seine-Kriegsmaschinerie-nicht-mehr-stoppen-article26029773.html,0,www.n-tv.de,"Sumy-Offensive abgewehrt?: Selenskyj: ""Putin kann seine Kriegsmaschinerie nicht mehr stoppen""",In der nordöstlichen ukrainischen Region Sumy toben seit Monaten heftige Kämpfe. Präsident Selenskyj erklärt nun den russischen Vorstoß dort für abgewehrt. Gleichzeitig warnt er aber: Putin gebe seine Pläne zur Eroberung der gesamten Ukraine nicht auf.,https://www.n-tv.de/img/incoming/crop26029776/5811328253-cImg_16_9-w1200/542001014.jpg,2025-09-12T20:14:06Z,,In der nordöstlichen ukrainischen Region Sumy toben seit Monaten heftige Kämpfe. Präsident Selenskyj erklärt nun den russischen Vorstoß dort für abgewehrt. Gleichzeitig warnt er aber: Putin gebe sein… [+2627 chars],,de,'Kämpfe'
https://www.nzz.ch/wirtschaft/solaranlagen-zurueckhaltung-bei-photovoltaik-sorgt-fuer-entlassungen-ld.1900418,https://www.nzz.ch/wirtschaft/solaranlagen-zurueckhaltung-bei-photovoltaik-sorgt-fuer-entlassungen-ld.1900418,0,www.nzz.ch,"Erst Boom, jetzt Entlassungen: Die erfolgsverwöhnte Solarbranche schrumpft",Wegen sinkender Vergütungen und politischer Unsicherheit werden weniger Photovoltaikanlagen verkauft. Das Kalkül für eine Investition ändert sich.,"https://img.nzz.ch/2025/09/03/d9280fb0-f061-4453-b4eb-86aa1ece365c.jpg?width=1200&height=674&fit=bounds&quality=75&auto=webp&crop=5307,2985,x0,y479&wmark=nzz",2025-09-13T03:30:00Z,,"Besitzer von Einfamilienhäusern werden beim Kauf von Photovoltaikanlagen vorsichtiger.
Einige Jahre lang kannte die Schweizer Solarbranche nur Sonnenschein. Doch nun sind dunkle Wolken aufgezogen: E… [+7893 chars]",,de,'Solar'
https://www.zeit.de/kultur/2025-09/drohnen-polen-russland-nato-wladimir-putin-europa,https://www.zeit.de/kultur/2025-09/drohnen-polen-russland-nato-wladimir-putin-europa,0,www.zeit.de,Drohnen in Polen: Putins zweite Front,Mit dem Eindringen russischer Drohnen nach Polen testet Wladimir Putin nicht nur die Fähigkeiten der Nato. Er lockt die Europäer auch in ein strategisches Dilemma.,https://img.zeit.de/kultur/2025-09/drohnen-polen-russland-nato-wladimir-putin-europa-bild/wide__1300x731,2025-09-13T04:09:17Z,,"Dass russische Drohnen Kampfdrohnen wohlgemerkt, auch wenn sie offenbar nicht mit Sprengsätzen bestückt waren jüngst bis tief nach Polen eingedrungen sind, ist ein sicherheitspolitisch alarmierender … [+472 chars]",,de,'Putin'
https://www.waz.de/ratgeber-wissen/energie/article409795739/balkonkraftwerk-kaufen-anfaenger-fehler-experte.html,https://www.waz.de/ratgeber-wissen/energie/article409795739/balkonkraftwerk-kaufen-anfaenger-fehler-experte.html,0,www.waz.de,Balkonkraftwerk: Profi warnt vor häufigen Fehlern beim Kauf,"Balkonkraftwerke sind schnell gekauft und installiert. Doch schon kleine Nachlässigkeiten können später teuer werden, sagt ein Solar-Experte.",https://img.sparknews.funkemedien.de/409829171/409829171_1756108588_v16_9_1600.jpeg,2025-09-13T04:16:00Z,,"Die Zahl der angemeldeten Balkonkraftwerke in Deutschland steigt weiterhin. Anfang 2024 waren bei der Bundesnetzagentur rund 350.000 Balkonsolaranlagen gemeldet, mittlerweile sind es über eine Millio… [+6414 chars]",,de,'Solar'
https://www.bild.de/leben-wissen/wissenschaft/singapur-studie-enthuellt-pflanzen-und-solarmodule-profitieren-voneinander-68bf152d33503d3b00581d9c,https://www.bild.de/leben-wissen/wissenschaft/singapur-studie-enthuellt-pflanzen-und-solarmodule-profitieren-voneinander-68bf152d33503d3b00581d9c,0,www.bild.de,"Studie zeigt Win-Win-Situation - Stimmt es, dass unter Solar Pflanzen wachsen?","Experiment in Singapur zeigt: Dächer mit Pflanzen und Solarmodulen kühlen Gebäude, steigern Stromausbeute und fördern Stadtgrün.","https://images.bild.de/68bf152d33503d3b00581d9c/a5cb43c080c4d6371bf8dbec66a71c54,51b9588?w=1280",2025-09-13T07:02:09Z,,"Um den TTS Player darzustellen, brauchen wir deine Zustimmung. 
 externen Inhalt aktivieren Um eingebettete Inhalte anzuzeigen, ist Ihre jederzeit widerrufliche Einwilligung (über den Schalter oder … [+2991 chars]",,de,'Solar'
https://www.zeit.de/news/2025-09/13/russische-truppen-schleichen-durch-tunnel-nach-kupjansk,https://www.zeit.de/news/2025-09/13/russische-truppen-schleichen-durch-tunnel-nach-kupjansk,0,www.zeit.de,Krieg in der Ukraine: Russische Truppen schleichen durch Tunnel nach Kupjansk,Hier finden Sie Informationen zu dem Thema „Krieg in der Ukraine“. Lesen Sie jetzt „Russische Truppen schleichen durch Tunnel nach Kupjansk“.,https://img.zeit.de/news/2025-09/13/russische-truppen-schleichen-durch-tunnel-nach-kupjansk-image-group/wide__1300x731,2025-09-13T07:09:07Z,,"Die Kämpfe um die Frontstadt Kupjansk im Osten der ukrainischen Region Charkiw nehmen nach Angaben von Militärbeobachtern an Schärfe zu. Russischen Soldaten sei es gelungen, in kleinen Gruppen durch … [+1302 chars]",,de,'Krieg'
https://www.faz.net/aktuell/politik/ukraine/ukraine-liveticker-un-botschafterin-usa-werden-jeden-zentimeter-nato-territorium-verteidigen-110683325.html,https://www.faz.net/aktuell/politik/ukraine/ukraine-liveticker-un-botschafterin-usa-werden-jeden-zentimeter-nato-territorium-verteidigen-110683325.html,0,www.faz.net,Krieg in der Ukraine: UN-Botschafterin: USA werden jeden Zentimeter NATO-Territorium verteidigen,Shea: „Immense Missachtung der Friedensbemühungen durch Russland“ +++ UN-Sicherheitsratsmitglieder: „Große Besorgnis“ nach Drohnenvorfall +++ alle Neuigkeiten im Liveblog,https://media0.faz.net/ppmedia/w1200/aktuell/3970441436/1.10684198/facebook_teaser/dorothy-shea-in-der.jpg.webp,2025-09-13T07:12:18Z,,Die NATO hat nach dem Eindringen russischer Drohnen in den polnischen Luftraum eine neue Initiative zum Schutz der Ostflanke angekündigt. Das teilte Generalsekretär Mark Rutte in einer Pressekonferen… [+1601 chars],,de,'Russland'
https://www.bild.de/sport/hier-alle-kaempfe-gucken-agon-profis-lassen-die-faeuste-fliegen-68c4b7f9f313976149c6def8,https://www.bild.de/sport/hier-alle-kaempfe-gucken-agon-profis-lassen-die-faeuste-fliegen-68c4b7f9f313976149c6def8,0,www.bild.de,HIER alle Kämpfe gucken! - Agon-Profis lassen die Fäuste fliegen,"Im Hauptkampf des Abends steht der Berliner Hamsat Shadalov, der gegen den ebenfalls ungeschlagenen Alex de la Rosa um den WBA-Mediterran-Titel kämpfen w...","https://images.bild.de/68c4b7f9f313976149c6def8/ff52f666508ce4409af26ca648b8dd11,3c025a99?w=1280",2025-09-13T07:23:02Z,,"Mehr zum Video anzeigen 
Die große Boxnacht in der Berliner Uber Eats Music Hall im Friedrichshain. 
Eine Agon-Veranstaltung, die viel Spannung und boxerische Klasse verspricht.
Im Hauptkampf des … [+489 chars]",,de,'Kämpfe'
https://www.faz.net/aktuell/politik/ukraine/hybrider-krieg-so-vielfaeltig-bedroht-putin-europa-accg-110683096.html,https://www.faz.net/aktuell/politik/ukraine/hybrider-krieg-so-vielfaeltig-bedroht-putin-europa-accg-110683096.html,0,www.faz.net,Hybrider Krieg: So bedroht Putin Europa,Putin verschärft seinen hybriden Krieg gegen den Westen. Nun lässt er Kampfdrohnen nach Polen fliegen. Das könnte erst der Anfang der Eskalation sein.,https://media1.faz.net/ppmedia/w1200/aktuell/politik/282451193/1.10683283/facebook_teaser/wladimir-putin-im-september.jpg.webp,2025-09-13T09:23:38Z,,"Wladimir Putin liest jeden Tag als Erstes die Lagemeldungen der Geheimdienste. Die Dienste sichern nicht nur seine Herrschaft in Russland, sondern sind auch die wichtigsten Instrumente in seinem Kamp… [+11070 chars]",,de,'Krieg'
https://www.zeit.de/politik/deutschland/2025-09/demonstration-gaza-ukraine-frieden-sarah-wagenknecht,https://www.zeit.de/politik/deutschland/2025-09/demonstration-gaza-ukraine-frieden-sarah-wagenknecht,0,www.zeit.de,Protestaufruf: Tausende Menschen bei Kundgebung von Sahra Wagenknecht in Berlin,"In Berlin hat eine Demonstration für Frieden in Gaza und der Ukraine begonnen. Die Polizei zählt 8.000 Teilnehmer, zu den Organisatoren gehört auch Dieter Hallervorden.",https://img.zeit.de/administratives/sharing/fallback-image-die-zeit/wide__1300x731,2025-09-13T13:32:48Z,,In Berlin hat eine unter anderem von der BSW-Parteichefin Sahra Wagenknecht angemeldete Demonstration gegen die Kriege im Gazastreifen und der Ukraine begonnen. Zu der Kundgebung am Brandenburger Tor… [+730 chars],,de,'Ukraine'
https://www.zeit.de/news/2025-09/13/bagger-trifft-gasleitung-anwohner-muessen-haeuser-verlassen,https://www.zeit.de/news/2025-09/13/bagger-trifft-gasleitung-anwohner-muessen-haeuser-verlassen,0,www.zeit.de,Evakuierung: Bagger trifft Gasleitung - Anwohner müssen Häuser verlassen,Hier finden Sie Informationen zu dem Thema „Evakuierung“. Lesen Sie jetzt „Bagger trifft Gasleitung - Anwohner müssen Häuser verlassen“.,https://img.zeit.de/news/2025-09/13/bagger-trifft-gasleitung-anwohner-muessen-haeuser-verlassen-image-group/wide__1300x731,2025-09-13T14:37:31Z,,Ein Bagger hat bei Bauarbeiten in Steinwenden bei Kaiserslautern eine Gasleitung beschädigt und damit für den Austritt von Gas gesorgt. In einem Umkreis von 50 Metern mussten die Anwohner am Freitag … [+419 chars],,de,'Gas'
https://www.tagesschau.de/ausland/europa/ukraine-vormarsch-russland-100.html,https://www.tagesschau.de/ausland/europa/ukraine-vormarsch-russland-100.html,0,www.tagesschau.de,Krieg gegen die Ukraine: Russen graben Tunnel nach Kupiansk,"Russland meldet ein weiteres Vordringen in der Ukraine. Nahe des strategisch wichtigen Kupiansk gruben Truppen offenbar Tunnel unter dem Fluss Oskil, um schnell in die Stadt einzudringen. Die Ukraine dementiert einen russischen Erfolg.",https://images.tagesschau.de/image/5b073b67-29bf-4703-b6b1-71469e4c25bb/AAABldopTPc/AAABmKJZ-0g/16x9-big/flagge-ukraine-truemmer-101.jpg?width=1280,2025-09-13T16:06:25Z,,"Stand: 13.09.2025 18:06 Uhr
Russland meldet ein weiteres Vordringen in der Ukraine. Nahe des strategisch wichtigen Kupiansk gruben Truppen offenbar Tunnel unter dem Fluss Oskil, um schnell in die St… [+2918 chars]",,de,'Russland'
https://orf.at/stories/3405361/,https://orf.at/stories/3405361/,0,orf.at,Trump stellt Bedingungen an NATO-Partner,"Nach dem Eindringen russischer Drohnen weit nach Polen will der Westen Moskau mit verschärften Sanktionen treffen. US-Präsident Donald Trump möchte neuen Russland-Sanktionen der USA aber nur zustimmen, wenn die anderen NATO-Staaten ihrerseits chinesische Impo…",https://ibs.orf.at/news?image=https%3A%2F%2Fassets.orf.at%2Fmims%2F2025%2F37%2F49%2Fcrops%2Fw%3D1200%2Ch%3D630%2Cq%3D75%2F2765042_master_1065849_drohnen_polen_nato_trump_sana_2_a.jpg%3Fs%3D5c18f1041722b5eb635cc9f6b64c95fd1f3b6c10,2025-09-13T16:42:55Z,,"Ich bin bereit, wesentliche Sanktionen gegen Russland zu verhängen, wenn alle NATO-Länder sich einigen und beginnen, das Gleiche zu tun, und wenn alle NATO-Länder aufhören, Öl von Russland zu kaufen,… [+2575 chars]",,de,'Russland'
https://www.tagesspiegel.de/politik/friedensdemo-in-berlin-ich-war-auch-bei-der-letzten-demo-hier-14324162.html,https://www.tagesspiegel.de/politik/friedensdemo-in-berlin-ich-war-auch-bei-der-letzten-demo-hier-14324162.html,0,www.tagesspiegel.de,„Friedensdemo“ in Berlin: „Ich war auch bei der letzten Demo hier“,"Rund 12.000 Menschen demonstrierten in Berlin für ein Ende des Kriegs in Gaza und anderswo. Was treibt diejenigen um, die dabei waren? Ein Protokoll von Gesprächen auf der Demo.",https://www.tagesspiegel.de/images/14324309/alternates/BASE_16_9_W1400/1757778365000/demonstration-stoppt-den-volkermord-in-gaza.jpeg,2025-09-13T17:10:39Z,,Mehrere tausend Menschen haben am Samstag in Berlin gegen das israelische Vorgehen im Gaza-Streifen und gegen Waffenlieferungen in Kriegsgebiete demonstriert. Zu der Kundgebung am Brandenburger Tor h… [+4019 chars],,de,'Krieg'
https://www.sueddeutsche.de/politik/ukraine-krieg-newsblog-nato-trump-oel-russland-li.3309758,https://www.sueddeutsche.de/politik/ukraine-krieg-newsblog-nato-trump-oel-russland-li.3309758,0,www.sueddeutsche.de,Krieg in der Ukraine: Trump fordert von Nato-Staaten: Stoppt den Kauf von Öl aus Russland,"Der US-Präsident ist nach eigenen Angaben zu neuen Sanktionen gegen Russland bereit, stellt aber Bedingungen. Ukrainische Drohnen setzen wieder eine russische Ölraffinerie in Brand.",https://www.sueddeutsche.de/2025/08/21/9ddeea0f-62af-409b-8769-55db473a61a6.jpg?q=60&fm=webp&width=1200&rect=0%2C124%2C3854%2C2168,2025-09-13T17:30:00Z,,"Polen hat der Einschätzung von US-Präsident Donald Trump widersprochen, wonach das massive Eindringen russischer Drohnen in den polnischen Luftraum möglicherweise auf einem Fehler beruhte. Regierungs… [+1122 chars]",,de,'Russland'
https://www.nzz.ch/international/zusammen-gegen-israel-wagenknechts-gaza-demo-mobilisiert-verschiedene-milieus-ld.1902390,https://www.nzz.ch/international/zusammen-gegen-israel-wagenknechts-gaza-demo-mobilisiert-verschiedene-milieus-ld.1902390,0,www.nzz.ch,"«Israel bombardiert wahllos Zivilisten», sagt Sahra Wagenknecht auf der Bühne. «Mörder!», tönt es aus dem Publikum","Die Redner der grossen Friedenskundgebung in der deutschen Hauptstadt werfen Israel einen Völkermord in Gaza vor, Russlands Angriff auf die Ukraine sehen sie deutlich weniger kritisch. Die Demonstranten scheint das nicht zu stören.","https://img.nzz.ch/2025/09/13/2472f92e-2255-4f8d-98e1-d55b537a3303.jpg?width=1200&height=675&fit=bounds&quality=75&auto=webp&crop=5900,3319,x0,y307&wmark=nzz",2025-09-13T17:59:11Z,,"Optimieren Sie Ihre Browsereinstellungen
NZZ.ch benötigt JavaScript für wichtige Funktionen. Ihr Browser oder Adblocker verhindert dies momentan.
Bitte passen Sie die Einstellungen an.
Als der Rap… [+6871 chars]",,de,'Russland'
https://www.focus.de/kultur/stars/tatort-star-hat-kriegsangst-frage-mich-was-putin-will_2202b46f-e597-4ab8-ae07-942f9925d0c4.html,https://www.focus.de/kultur/stars/tatort-star-hat-kriegsangst-frage-mich-was-putin-will_2202b46f-e597-4ab8-ae07-942f9925d0c4.html,0,www.focus.de,"""Tatort""-Star hat Kriegsangst: ""Frage mich, was Putin will""","Schauspielerin Anja Antonowicz wurde in Polen geboren und ist auch dort aufgewachsen. Nach dem jüngsten Drohnen-Vorfall ist die ""Tatort""-Darstellerin in Alarmbereitschaft.",https://quadro.burda-forward.de/ctf/714de796-b7ea-4fa4-ba28-f1b71916f08f.55bec31a-375f-4b76-b267-f53c6d6a8f71.png?im=RegionOfInterestCrop%3D%281200%2C630%29%2CregionOfInterest%3D%28931%2C616%29&hash=204c1f23d188cd8da01bd8aaa790a425a508f5a2e4a05bfd452ca0cf5c92b1d7,2025-09-13T18:01:40Z,,Anja Antonowicz lebt und arbeitet seit über 20 Jahren in Deutschland. Die angespannte Lage in ihrer Heimat Polen bewegt sie dennoch sehr. Als in der Nacht zum 10. September mehrere russische Drohnen … [+1877 chars],,de,'Krieg'
https://www.n-tv.de/politik/08-02-BSWler-Onken-fuer-Gas-aus-Russland--article23143824.html,https://www.n-tv.de/politik/08-02-BSWler-Onken-fuer-Gas-aus-Russland--article23143824.html,0,www.n-tv.de,Ukraine-Krieg im Liveticker: +++ 08:02 BSWler Onken für Gas aus Russland +++,Lesen Sie alle aktuellen Entwicklungen und Nachrichten über den russischen Angriffskrieg auf die Ukraine im Liveticker von ntv.de.,https://www.n-tv.de/img/incoming/crop25117070/8311326854-cImg_16_9-w1200/Ukraine-Liveticker.jpg,2025-09-13T22:12:00Z,,Das Bündnis Sahra Wagenknecht (BSW) will sich ein Jahr nach der Gründung der Landesverbände in Niedersachsen und Bremen auf mehreren Ebenen profilieren. So lehnt der niedersächsische BSW-Co-Chef Holg… [+7232 chars],,de,'Gas'
https://www.stern.de/gesellschaft/regional/hessen/hohe-kosten--kommunen--bundesaufgaben-schraenken-handlungsfaehigkeit-ein-36053454.html,https://www.stern.de/gesellschaft/regional/hessen/hohe-kosten--kommunen--bundesaufgaben-schraenken-handlungsfaehigkeit-ein-36053454.html,0,www.stern.de,Hohe Kosten: Kommunen: Bundesaufgaben schränken Handlungsfähigkeit ein,Bei Sozialleistungen soll es nach dem Willen des Bundeskanzlers Reformen geben. Diese sind nach Auffassung von Kommunen vor allem bei der Kostenübernahme dringend nötig.,https://image.stern.de/36053456/t/u6/v1/w1440/r1.7778/-/14--sikekptxxgv2axs2048jpeg---cab7c216affedd7b.jpg,2025-09-14T01:45:37Z,,"Kopiere den aktuellen Link
Zur Merkliste hinzufügen
Bei Sozialleistungen soll es nach dem Willen des Bundeskanzlers Reformen geben. Diese sind nach Auffassung von Kommunen vor allem bei der Kostenü… [+771 chars]",,de,'Hohe Kosten'
https://www.zeit.de/news/2025-09/14/kommunen-bundesaufgaben-schraenken-handlungsfaehigkeit-ein,https://www.zeit.de/news/2025-09/14/kommunen-bundesaufgaben-schraenken-handlungsfaehigkeit-ein,0,www.zeit.de,Hohe Kosten: Kommunen: Bundesaufgaben schränken Handlungsfähigkeit ein,Hier finden Sie Informationen zu dem Thema „Hohe Kosten“. Lesen Sie jetzt „Kommunen: Bundesaufgaben schränken Handlungsfähigkeit ein“.,https://img.zeit.de/news/2025-09/14/kommunen-bundesaufgaben-schraenken-handlungsfaehigkeit-ein-image-group/wide__1300x731,2025-09-14T01:45:37Z,,In der Diskussion um eine Reform der Sozialleistungen sehen auch Kommunen in Hessen dringend Handlungsbedarf. Die Kosten für Sozialleistungen sind in einigen Landkreisen in den vergangenen Jahren exp… [+585 chars],,de,'Hohe Kosten'
https://www.zeit.de/news/2025-09/14/sozialausgaben-in-kommunen-teils-explodiert,https://www.zeit.de/news/2025-09/14/sozialausgaben-in-kommunen-teils-explodiert,0,www.zeit.de,Hohe Kosten: Sozialausgaben in Kommunen teils explodiert,Hier finden Sie Informationen zu dem Thema „Hohe Kosten“. Lesen Sie jetzt „Sozialausgaben in Kommunen teils explodiert“.,https://img.zeit.de/news/2025-09/14/sozialausgaben-in-kommunen-teils-explodiert-image-group/wide__1300x731,2025-09-14T02:01:38Z,,"Wohn- und Bürgergeld, Kinder- und Jugendhilfe oder Leistungen für Asylbewerber: In der Diskussion um eine Reform der Sozialleistungen sehen auch Kommunen in Hessen dringend Handlungsbedarf. Die Koste… [+4696 chars]",,de,'Hohe Kosten'
https://www.faz.net/aktuell/wirtschaft/frankreichs-premier-lecornu-keine-feiertage-streichen-accg-110684492.html,https://www.faz.net/aktuell/wirtschaft/frankreichs-premier-lecornu-keine-feiertage-streichen-accg-110684492.html,0,www.faz.net,Kurswechsel in Frankreich: Neuer Premier will keine Feiertage mehr streichen,"Anders als sein Vorgänger verspricht Sébastien Lecornu, Beschäftigte zu verschonen. Geld sparen will er in der Verwaltung und bei Privilegien früherer Minister. Die Ratingagenturen muss er noch überzeugen.",https://media1.faz.net/ppmedia/w1200/aktuell/politik/63000039/1.10684515/facebook_teaser/sebastien-lecornu-trifft-vor.jpg.webp,2025-09-14T02:56:10Z,,"Frankreichs neuer Premierminister Sébastien Lecornu hat das umstrittene Vorhaben seines gestürzten Amtsvorgängers eingestampft, zwei Feiertage abzuschaffen. Ich wünsche mir, dass diejenigen verschont… [+2261 chars]",,de,'Geld sparen'
https://www.zeit.de/news/2025-09/14/bsw-fuer-gas-aus-russland-und-gegen-mehr-ruestungsindustrie,https://www.zeit.de/news/2025-09/14/bsw-fuer-gas-aus-russland-und-gegen-mehr-ruestungsindustrie,0,www.zeit.de,Ein Jahr nach Gründung: BSW für Gas aus Russland und gegen mehr Rüstungsindustrie,Hier finden Sie Informationen zu dem Thema „Ein Jahr nach Gründung“. Lesen Sie jetzt „BSW für Gas aus Russland und gegen mehr Rüstungsindustrie“.,https://img.zeit.de/news/2025-09/14/bsw-fuer-gas-aus-russland-und-gegen-mehr-ruestungsindustrie-image-group/wide__1300x731,2025-09-14T05:00:41Z,,Das Bündnis Sahra Wagenknecht (BSW) will sich ein Jahr nach der Gründung der Landesverbände in Niedersachsen und Bremen auf mehreren Ebenen profilieren. So lehnt der niedersächsische BSW-Co-Chef Holg… [+2321 chars],,de,'Gas'
https://www.tagesschau.de/newsticker/liveblog-ukraine-sonntag-590.html,https://www.tagesschau.de/newsticker/liveblog-ukraine-sonntag-590.html,0,www.tagesschau.de,Ukraine-Liveblog: ++ Russland meldet Brand in Raffinerie ++,"Nach einem ukrainischen Drohnenangriff ist nach russischen Angaben in einer großen Raffinerie ein Brand ausgebrochen. Der ukrainische Präsident Selenskyj fordert die Verbündeten auf, den Kauf von russischem Öl einzustellen.",https://images.tagesschau.de/image/5b073b67-29bf-4703-b6b1-71469e4c25bb/AAABldopTPc/AAABmKJZ-0g/16x9-big/flagge-ukraine-truemmer-101.jpg?width=1280,2025-09-14T07:12:24Z,,"Stand: 14.09.2025 09:12 Uhr
Nach einem ukrainischen Drohnenangriff ist nach russischen Angaben in einer großen Raffinerie ein Brand ausgebrochen. Der ukrainische Präsident Selenskyj fordert die Verb… [+4349 chars]",,de,'Russland'
