index,url,valid,domain,title,description,image,published,archive,content,quote,language,keyword
https://www.zeit.de/politik/ausland/2024-07/student-russland-kritik-gefaengnis-abschiebung,https://www.zeit.de/politik/ausland/2024-07/student-russland-kritik-gefaengnis-abschiebung,0,www.zeit.de,Student in Russland: Vom Hörsaal ins Exil,Sergey Gulko war einer der besten Studenten seines Jahrgangs. Dann melden ihn seine Moskauer Kommilitonen den russischen Behörden. Die Geschichte einer Denunziation.,https://img.zeit.de/politik/ausland/2024-07/student-russland-kritik-gefaengnis-abschiebung-2/wide__1300x731,2024-08-01T09:30:02Z,,"Es ist eine Chatnachricht, die alles verändert. Am 16. März dieses Jahres, um kurz nach ein Uhr nachts, meldet sich eine Frau über
Telegram bei Sergey Gulko. Ihr Name ist der Redaktion bekannt, er s… [+653 chars]",,de,'Russland'
https://www.zeit.de/politik/ausland/2024-08/russland-gefangenenaustausch-evan-gershkovich-tiergartenmoerder-politische-haeftlinge,https://www.zeit.de/politik/ausland/2024-08/russland-gefangenenaustausch-evan-gershkovich-tiergartenmoerder-politische-haeftlinge,0,www.zeit.de,Evan Gershkovich: Gefangenenaustausch mit Russland steht bevor,Im Rahmen eines größeren Deals soll unter anderem US-Reporter Evan Gershkovich freikommen. Nach ZEIT-Informationen soll der Austausch im Laufe des Tages stattfinden.,https://img.zeit.de/politik/ausland/2024-08/russland-gefangenenaustausch-evan-gershkovich-tiergartenmoerder/wide__1300x731,2024-08-01T13:16:17Z,,Ein Gefangenenaustausch mit Russland steht nach Informationen der ZEIT unmittelbar bevor. Am Nachmittag sollen mehrere in Russland inhaftierte Personen gegen im Ausland inhaftierte Russen ausgetausch… [+3482 chars],,de,'Russland'
https://www.zeit.de/politik/ausland/2024-08/russland-laesst-politische-haeftlinge-gegen-tiergartenmoerder-frei,https://www.zeit.de/politik/ausland/2024-08/russland-laesst-politische-haeftlinge-gegen-tiergartenmoerder-frei,0,www.zeit.de,Russland lässt politische Häftlinge gegen Tiergartenmörder frei,"Der Reporter Evan Gershkovich, der Politiker Wladimir Kara-Mursa und 14 weitere Gefangene sind freigelassen worden. Im Gegenzug erhält Russland acht inhaftierte Agenten.",https://img.zeit.de/politik/ausland/2024-08/gefangenenaustausch-russland-usa/wide__1300x731,2024-08-01T15:49:29Z,,"Der US-Reporter Evan Gershkovich, die Oppositionspolitiker Wladimir Kara-Mursa und Ilja Jaschin sowie 13 weitere bisher in Russland und Belarus inhaftierte Personen sind freigekommen. Im Gegenzug wur… [+2805 chars]",,de,'Russland'
https://www.stern.de/politik/ausland/lage-im-ueberblick--us-berater--gefangenen-deal-beeinflusst-ukraine-krieg-nicht-34940590.html,https://www.stern.de/politik/ausland/lage-im-ueberblick--us-berater--gefangenen-deal-beeinflusst-ukraine-krieg-nicht-34940590.html,0,www.stern.de,Lage im Überblick: US-Berater: Gefangenen-Deal beeinflusst Ukraine-Krieg nicht,Westliche Länder und Russland tauschen in einer großangelegten Aktion Gefangene aus. Hat der erfolgreiche Deal auch Folgen für mögliche diplomatische Bemühungen im Ukraine-Krieg?,https://image.stern.de/34940592/t/T3/v1/w1440/r1.7778/-/02--hpd5kps556v2axw800h600jpeg---9989f0512e555459.jpg,2024-08-02T03:00:41Z,,"Westliche Länder und Russland tauschen in einer großangelegten Aktion Gefangene aus. Hat der erfolgreiche Deal auch Folgen für mögliche diplomatische Bemühungen im Ukraine-Krieg?
Der großangelegte G… [+5207 chars]",,de,'Ukraine'
https://www.zeit.de/news/2024-08/02/us-berater-gefangenen-deal-beeinflusst-ukraine-krieg-nicht,https://www.zeit.de/news/2024-08/02/us-berater-gefangenen-deal-beeinflusst-ukraine-krieg-nicht,0,www.zeit.de,Lage im Überblick: US-Berater: Gefangenen-Deal beeinflusst Ukraine-Krieg nicht,Hier finden Sie Informationen zu dem Thema „Lage im Überblick“. Lesen Sie jetzt „US-Berater: Gefangenen-Deal beeinflusst Ukraine-Krieg nicht“.,https://img.zeit.de/news/2024-08/02/us-berater-gefangenen-deal-beeinflusst-ukraine-krieg-nicht-image-group/wide__1300x731,2024-08-02T03:00:41Z,,Kiew (dpa) - Der großangelegte Gefangenenaustausch zwischen Russland und mehreren westlichen Ländern hat nach Einschätzung des US-Sicherheitsberaters Jake Sullivan keinen direkten Einfluss auf die Si… [+5711 chars],,de,'Ukraine'
https://www.tagesspiegel.de/internationales/lage-im-uberblick-us-berater-gefangenen-deal-beeinflusst-ukraine-krieg-nicht-12131102.html,https://www.tagesspiegel.de/internationales/lage-im-uberblick-us-berater-gefangenen-deal-beeinflusst-ukraine-krieg-nicht-12131102.html,0,www.tagesspiegel.de,Lage im Überblick: US-Berater: Gefangenen-Deal beeinflusst Ukraine-Krieg nicht,Westliche Länder und Russland tauschen in einer großangelegten Aktion Gefangene aus. Hat der erfolgreiche Deal auch Folgen für mögliche diplomatische Bemühungen im Ukraine-Krieg?,https://www.tagesspiegel.de/images/12131099/alternates/BASE_16_9_W1400/1722567734000/gefangenenaustausch-jake-sullivan.jpeg,2024-08-02T03:02:14Z,,Kiew (dpa) - Der großangelegte Gefangenenaustausch zwischen Russland und mehreren westlichen Ländern hat nach Einschätzung des US-Sicherheitsberaters Jake Sullivan keinen direkten Einfluss auf die Si… [+5109 chars],,de,'Russland'
https://www.zeit.de/politik/2024-08/russland-gefangenenaustausch-evan-gershkovich-nachrichtenpodcast,https://www.zeit.de/politik/2024-08/russland-gefangenenaustausch-evan-gershkovich-nachrichtenpodcast,0,www.zeit.de,Russland: Ein historischer Deal,"Die USA und Deutschland haben mit Russland mehrere Gefangene getauscht. Hat Putin bekommen, was er wollte? Und: Die Lage für die Ukraine verschlechtert sich.",https://img.zeit.de/politik/2017-09/illu-podcast-news/wide__8ed8a6__1300x731,2024-08-02T03:57:11Z,,"In einem großangelegten Gefangenenaustausch haben Deutschland und die USA mit Russland mehrere gefangene Personen ausgetauscht. Deutschland und die USA erwirkten, dass insgesamt 16 Personen aus russi… [+3369 chars]",,de,'Russland'
https://www.tagesspiegel.de/internationales/grosste-konzentration-von-personal-und-waffen-selenskyj-sieht-eroberung-von-pokrowsk-als-neue-prioritat-russlands-12131309.html,https://www.tagesspiegel.de/internationales/grosste-konzentration-von-personal-und-waffen-selenskyj-sieht-eroberung-von-pokrowsk-als-neue-prioritat-russlands-12131309.html,0,www.tagesspiegel.de,„Größte Konzentration von Personal und Waffen“ : Selenskyj sieht Eroberung von Pokrowsk als neue Priorität Russlands,Im Frühsommer scheiterten die russischen Truppen mit einem Angriff auf Charkiw. Jetzt konzentriert sich  Putins Armee nach Einschätzung des ukrainischen Präsidenten auf einen anderen Bereich.,https://www.tagesspiegel.de/images/12131318/alternates/BASE_16_9_W1400/1722575507000/667be224.jpeg,2024-08-02T05:24:45Z,,Nach Ansicht des ukrainischen Präsidenten Wolodymyr Selenskyj hat Russland nach dem gescheiterten Angriff auf Charkiw im Frühsommer sein Hauptziel geändert. Das sagte er in einem Interview mit Journa… [+3734 chars],,de,'Putin'
https://de.catholicnewsagency.com/news/16294/hilfsorganisationen-haben-athiopien-verlassen-aber-die-seelsorger-blieben,https://de.catholicnewsagency.com/news/16294/hilfsorganisationen-haben-athiopien-verlassen-aber-die-seelsorger-blieben,0,de.catholicnewsagency.com,"Hilfsorganisationen haben Äthiopien verlassen, aber „die Seelsorger blieben“",Der Krieg in der äthiopischen Region Tigray hat zu Massenmorden und sexueller Gewalt an Frauen und Mädchen geführt. Nun engagiert sich die Kirche bei der Therapie und Seelsorge für die traumatisierte Bevölkerung. Das berichtete der äthiopisch-katholische Bisc…,https://de.catholicnewsagency.com/image/tesfaselassie_1722468244.jpg?w=1150&jpg,2024-08-02T07:00:00Z,,"München -
 Freitag, 2. August 2024, 9:00 Uhr.
Der Krieg in der äthiopischen Region Tigray hat zu Massenmorden und sexueller Gewalt an Frauen und Mädchen geführt. Nun engagiert sich die Kirche bei d… [+4188 chars]",,de,'Krieg'
https://www.zeit.de/politik/ausland/2024-08/gefangenenaustausch-russland-usa-deutschland-presseschau,https://www.zeit.de/politik/ausland/2024-08/gefangenenaustausch-russland-usa-deutschland-presseschau,0,www.zeit.de,"Gefangenenaustausch: ""Jetzt ist klar, warum Nawalny getötet wurde""",Russische Staatsmedien feiern den Austausch von Gefangenen als Putins Erfolg. In den USA herrscht Sorge vor weiteren Geiselnahmen durch Russlands Regime. Eine Presseschau,https://img.zeit.de/politik/ausland/2024-08/gefangenenaustausch-russland-usa-deutschland-presseschau-bild/wide__1300x731,2024-08-02T07:12:38Z,,Internationale Medien reagieren mit Erleichterung auf die Freilassung von mehreren politischen Häftlingen in Russland und mit Sorge über den Preis dafür: Straffreiheit für einen Mörder und Spione. St… [+5412 chars],,de,'Putin'
https://www.tagesschau.de/newsticker/liveblog-ukraine-freitag-416.html,https://www.tagesschau.de/newsticker/liveblog-ukraine-freitag-416.html,0,www.tagesschau.de,Ukraine-Liveblog: ++ Schwere Kämpfe im Osten der Ukraine ++,Im Osten der Ukraine kommt es weiter zu schweren Gefechten. Nach Einschätzung von US-Sicherheitsberater Sullivan hat der Gefangenenaustausch keinen Einfluss auf den Krieg. Die Entwicklungen im Liveblog.,https://images.tagesschau.de/image/5b073b67-29bf-4703-b6b1-71469e4c25bb/AAABjz78AfM/AAABjwnlFvA/16x9-1280/flagge-ukraine-truemmer-101.jpg,2024-08-02T08:48:04Z,,"Stand: 02.08.2024 10:48 Uhr
Im Osten der Ukraine kommt es weiter zu schweren Gefechten. Nach Einschätzung von US-Sicherheitsberater Sullivan hat der Gefangenenaustausch keinen Einfluss auf den Krieg… [+2876 chars]",,de,'Kämpfe'
https://www.zeit.de/politik/ausland/2024-08/wadim-krassikow-russland-fsb-geheimdienst-putin,https://www.zeit.de/politik/ausland/2024-08/wadim-krassikow-russland-fsb-geheimdienst-putin,0,www.zeit.de,"Gefangenenaustausch: Russland räumt Agententätigkeit des ""Tiergartenmörders"" ein","Lange hat die russische Regierung bestritten, etwas mit dem Tiergartenmord zu tun zu haben. Nun räumt sie ein: Der Mörder ist Agent des Geheimdienstes FSB.",https://img.zeit.de/politik/ausland/2024-08/wadim-krassikow-bild-2/wide__1300x731,2024-08-02T11:58:53Z,,"Der im Zuge des Gefangenenaustauschs zwischen Russland, Deutschland und den USA ausgelieferte Wadim Krassikow ist ein Agent des russischen Inlandsgeheimdienstes FSB. Die russische Regierung bestätigt… [+1803 chars]",,de,'Russland'
https://www.tagesschau.de/wirtschaft/unternehmen/apple-amazon-tech-konzerne-100.html,https://www.tagesschau.de/wirtschaft/unternehmen/apple-amazon-tech-konzerne-100.html,0,www.tagesschau.de,US-Techriesen kämpfen mit mauer Nachfrage und hohen Kosten,"Hohe Investitionen und maue Nachfrage bei Amazon, schwache iPhone-Einnahmen und regulatorischer Druck bei Apple: Die US-Techriesen haben die Investoren enttäuscht. Das hat Folgen für den Gesamtmarkt.",https://images.tagesschau.de/image/4d90c3cf-6deb-4ef5-a6d8-d7806f5f44f3/AAABkRKw4og/AAABjwnlFvA/16x9-1280/apple-394.jpg,2024-08-02T13:23:53Z,,"Stand: 02.08.2024 15:23 Uhr
Hohe Investitionen und maue Nachfrage bei Amazon, schwache iPhone-Einnahmen und regulatorischer Druck bei Apple: Die US-Techriesen haben die Investoren enttäuscht. Das ha… [+5265 chars]",,de,'Hohe Kosten'
https://www.faz.net/aktuell/politik/ausland/krieg-zwischen-armee-und-rsf-der-verlierer-heisst-sudan-19895632.html,https://www.faz.net/aktuell/politik/ausland/krieg-zwischen-armee-und-rsf-der-verlierer-heisst-sudan-19895632.html,0,www.faz.net,Kämpfe zwischen Armee und RSF: Der Verlierer des Kriegs heißt Sudan,Im Sudan-Krieg gibt es kein Nachlassen. Vermittler hoffen auf neue Gespräche in der Schweiz. Ernährungsexperten sprechen von einer Hungersnot.,https://media1.faz.net/ppmedia/aktuell/98104450/1.9895629/facebook_teaser_fplus/vertriebene-am-24-juli-im.jpg,2024-08-02T13:32:51Z,,"Auf der Videoaufnahme sind junge Soldaten zu sehen, die in schwarzen Paradeuniformen vor einer Gebirgskulisse marschieren. Auch der Armeeführer und De-facto-Staatschef Abd al-Fattah al-Burhan ist zu … [+270 chars]",,de,'Kämpfe'
https://www.zeit.de/news/2024-08/02/usa-und-russland-bleiben-nach-austausch-auf-konfrontation,https://www.zeit.de/news/2024-08/02/usa-und-russland-bleiben-nach-austausch-auf-konfrontation,0,www.zeit.de,Gefangenen-Deal: USA und Russland bleiben nach Austausch auf Konfrontation,Hier finden Sie Informationen zu dem Thema „Gefangenen-Deal“. Lesen Sie jetzt „USA und Russland bleiben nach Austausch auf Konfrontation“.,https://img.zeit.de/news/2024-08/02/usa-und-russland-bleiben-nach-austausch-auf-konfrontation-image-group/wide__1300x731,2024-08-02T14:41:13Z,,"Es sind ähnliche Bilder auf den Flughäfen in Köln, Washington und Moskau, aber die Vorzeichen sind andere: Mehr als 20 Inhaftierte, darunter fünf Deutsche, sind nach dem größten Gefangenenaustausch s… [+6733 chars]",,de,'Russland'
https://www.tagesspiegel.de/internationales/ukraine-invasion-tag-891-warum-der-gefangenendeal-nicht-als-vorbild-fur-frieden-taugt-12136616.html,https://www.tagesspiegel.de/internationales/ukraine-invasion-tag-891-warum-der-gefangenendeal-nicht-als-vorbild-fur-frieden-taugt-12136616.html,0,www.tagesspiegel.de,"Ukraine-Invasion, Tag 891: Warum der Gefangenendeal nicht als Vorbild für Frieden taugt","US-Berater dämpft Hoffnungen für Friedensverhandlungen, schwere Kämpfe in der Ostukraine dauern an, der „Tiergartenmörder“ ist ein FSB-Agent. Der Überblick am Abend.",https://www.tagesspiegel.de/images/12136583/alternates/BASE_16_9_W1400/1722612865000/ukrainian-servicemen-attend-a-military-exercise-in-kherson-region.jpeg,2024-08-02T15:48:06Z,,"Dass westliche Staaten mit Russland, in beiderseitigem Interesse und trotz völlig unterschiedlicher Voraussetzungen, eine Verhandlungslösung finden können, zeigt der Gefangenenaustausch eindrucksvoll… [+4717 chars]",,de,'Kämpfe'
https://www.n-tv.de/politik/19-34-Ukrainischer-Beauftragter-interveniert-wegen-Foto-das-angeblich-brutale-Verstuemmelung-zeigt--article23143824.html,https://www.n-tv.de/politik/19-34-Ukrainischer-Beauftragter-interveniert-wegen-Foto-das-angeblich-brutale-Verstuemmelung-zeigt--article23143824.html,0,www.n-tv.de,"Ukraine-Krieg im Liveticker: +++ 19:34 Ukrainischer Beauftragter interveniert wegen Foto, das angeblich brutale Verstümmelung zeigt +++",Lesen Sie alle aktuellen Entwicklungen und Nachrichten über den russischen Angriffskrieg auf die Ukraine im Liveticker von ntv.de.,https://bilder2.n-tv.de/img/incoming/crop23332537/9041326157-cImg_16_9-w1200/Liveticker1-grau-1-Kopie.jpg,2024-08-02T23:02:00Z,,"Der ukrainische Menschenrechtsbeauftragte Dmytro Lubinez hat angekündigt, dass er als Reaktion auf ein Foto, das angeblich die Leiche eines von Russland hingerichteten ukrainischen Kriegsgefangenen z… [+30463 chars]",,de,'Ukraine'
https://www.n-tv.de/politik/17-27-Sacharowa-Drohungen-gegen-Krim-Bruecke-koennen-Teil-von-US-Wahlkampf-sein--article23143824.html,https://www.n-tv.de/politik/17-27-Sacharowa-Drohungen-gegen-Krim-Bruecke-koennen-Teil-von-US-Wahlkampf-sein--article23143824.html,0,www.n-tv.de,Ukraine-Krieg im Liveticker: +++ 17:27 Sacharowa: Drohungen gegen Krim-Brücke können Teil von US-Wahlkampf sein +++,Lesen Sie alle aktuellen Entwicklungen und Nachrichten über den russischen Angriffskrieg auf die Ukraine im Liveticker von ntv.de.,https://bilder2.n-tv.de/img/incoming/crop23332537/9041326157-cImg_16_9-w1200/Liveticker1-grau-1-Kopie.jpg,2024-08-02T23:02:00Z,,"Jüngste Drohungen der Ukraine, die Krimbrücke zu sprengen, sieht Moskau als möglichen Teil des US-Präsidentschaftswahlkampfs. Das geht aus Äußerungen der Sprecherin des russischen Außenministeriums, … [+28475 chars]",,de,'Ukraine'
https://www.zeit.de/politik/deutschland/2024-08/reporter-ohne-grenzen-gefangenenaustausch-union-kritik-gefahr-journalisten,https://www.zeit.de/politik/deutschland/2024-08/reporter-ohne-grenzen-gefangenenaustausch-union-kritik-gefahr-journalisten,0,www.zeit.de,Reporter ohne Grenzen: Gefangenendeal sendet laut Kritikern gefährliches Signal an Autokraten,"Die Journalistenorganisation Reporter ohne Grenzen fürchtet, dass der Deal mit Russland einen gefährlichen Präzedenzfall geschaffen hat. Auch in der Union gibt es Kritik.",https://img.zeit.de/politik/deutschland/2024-08/russlands-praesident-wladimir-putin/wide__1300x731,2024-08-03T03:10:26Z,,"Die Journalistenorganisation Reporter ohne Grenzen befürchtet negative Konsequenzen des Gefangenendeals mit Russland. ""Das ist in jedem Fall ein Zeichen an Autokraten, dass solche Deals grundsätzlich… [+2437 chars]",,de,'Putin'
https://www.zeit.de/politik/2024-08/gefangenenaustausch-russland-verhandlungen-ukraine-nachrichtenpodcast,https://www.zeit.de/politik/2024-08/gefangenenaustausch-russland-verhandlungen-ukraine-nachrichtenpodcast,0,www.zeit.de,Gefangenenaustausch mit Russland: Bringt der Gefangenenaustausch das Ende der Eiszeit?,"Nach dem Gefangenendeal mit Russland hoffen manche auf Gespräche über Frieden in der Ukraine. Zurecht? Und: Die ""Omas gegen Rechts"" veranstalten ihren ersten Kongress.",https://img.zeit.de/politik/2017-09/illu-podcast-news/wide__8ed8a6__1300x731,2024-08-03T03:59:46Z,,"Der größte Gefangenenaustausch zwischen Russland und dem Westen seit dem Kalten Krieg ist vollendet: Am Donnerstagabend empfing Bundeskanzler Olaf Scholz am Flughafen Köln/Bonn, die 12 in Russland In… [+3184 chars]",,de,'Ukraine'
