index,url,valid,domain,title,description,image,published,archive,content,quote,language,keyword
https://www.sueddeutsche.de/politik/kiew-europaeische-union-kaja-kallas-antonio-costa-lux.8wo3xkLzq2doEaY4Le7bZe,https://www.sueddeutsche.de/politik/kiew-europaeische-union-kaja-kallas-antonio-costa-lux.8wo3xkLzq2doEaY4Le7bZe,0,www.sueddeutsche.de,"„Wir müssen den Ukrainern zeigen, dass Europa bei ihnen ist“",Das neue EU-Spitzenpersonal Kaja Kallas und António Costa verbringen ihren ersten Arbeitstag in Kiew. Der Besuch ist eine Geste der Solidarität mit der Ukraine – aber auch ein Zeichen der Nervosität wegen des Wahlsiegs von Donald Trump.,https://www.sueddeutsche.de/2024/12/01/df74364b-3efb-48e9-9524-97851fba8a59.jpeg?q=60&fm=webp&width=1200&rect=0%2C386%2C3000%2C1688,2024-12-01T09:30:19Z,,"Als der Portugiese und die Estin den Zug am Sonntagmorgen in der ukrainischen Hauptstadt wieder verließen, waren sie hingegen zwei der wichtigsten Vertreter der Union: der neue EU-Ratspräsident und d… [+7933 chars]",,de,'Ukraine'
https://taz.de/-Nachrichten-im-Ukraine-Krieg-/!6053822/,https://taz.de/-Nachrichten-im-Ukraine-Krieg-/!6053822/,0,taz.de,+++ Nachrichten im Ukraine-Krieg +++: „Wir stehen an der Seite der Ukraine“,Die EU-Spitzen Kallas und Costa sind am ersten Tag in ihrem Amt zu einem Solidaritätsbesuch in Kyjiw eingetroffen. Ein Treffen mit Selenskyj ist vorgesehen.,https://taz.de/picture/7388115/1200/37137479-1.jpeg,2024-12-01T09:38:00Z,,Die EU-Spitzen Kallas und Costa sind am ersten Tag in ihrem Amt zu einem Solidaritätsbesuch in Kyjiw eingetroffen. Ein Treffen mit Selenskyj ist vorgesehen. mehr...,,de,'Ukraine'
https://www.tagesspiegel.de/politik/wahlkampf-grune-gehen-im-ukraine-konflikt-auf-distanz-zu-scholz-12800786.html,https://www.tagesspiegel.de/politik/wahlkampf-grune-gehen-im-ukraine-konflikt-auf-distanz-zu-scholz-12800786.html,0,www.tagesspiegel.de,Wahlkampf: Grüne gehen im Ukraine-Konflikt auf Distanz zu Scholz,Die Grünen wollen sich der Union als möglicher Koalitionspartner präsentieren. Das zeigt sich auch im Ukraine-Kurs der Partei.,https://www.tagesspiegel.de/images/12800798/alternates/BASE_16_9_W1400/1733047673000/pressekonferenz-nach-sitzung-des-bundesvorstands-der-grunen.jpeg,2024-12-01T10:03:29Z,,Die Grünen-Spitze geht im Bundestagswahlkampf auf Distanz zum Ukraine-Kurs von Bundeskanzler Olaf Scholz (SPD). Die neue Parteivorsitzende Franziska Brantner signalisierte im Konflikt mit Russland ei… [+1777 chars],,de,'Ukraine'
https://www.tagesspiegel.de/politik/bei-schweren-cyberangriffen-aus-russland-innenministerin-faeser-halt-nato-bundnisfall-fur-moglich-12800594.html,https://www.tagesspiegel.de/politik/bei-schweren-cyberangriffen-aus-russland-innenministerin-faeser-halt-nato-bundnisfall-fur-moglich-12800594.html,0,www.tagesspiegel.de,Bei schweren Cyberangriffen aus Russland: Innenministerin Faeser hält Nato-Bündnisfall für möglich,"Die hybride Bedrohungslage nehme klar zu, sagt die SPD-Politikerin. Es würden immer mehr Sabotageakte Putins registriert. Faeser warnt auch vor weiteren Anschlägen auf deutsche Rüstungsmanager.",https://www.tagesspiegel.de/images/12800657/alternates/BASE_16_9_W1400/1733045214000/pk-zu-geschlechtsspezifisch-gegen-frauen-gerichtete-straftaten.jpeg,2024-12-01T10:06:03Z,,"Durch den russischen Angriffskrieg gegen die Ukraine ist die Sorge gewachsen, dass Kreml-Machthaber Wladimir Putin weitere Länder attackieren könnte. Neben der Furcht vor konventionellen militärische… [+5407 chars]",,de,'Bedrohung'
https://www.dw.com/de/neue-eu-spitzenvertreter-zu-gespr%C3%A4chen-in-kyjiw/a-70930607,https://www.dw.com/de/neue-eu-spitzenvertreter-zu-gespr%C3%A4chen-in-kyjiw/a-70930607,0,www.dw.com,Neue EU-Spitzenvertreter zu Gesprächen in Kyjiw,"Besuch mit hohem Symbolwert: Die neuen Spitzen der Europäischen Union, Kaja Kallas und António Costa, nutzen den ersten Tag ihrer Amtszeit zu einem Solidaritätsbesuch in der Ukraine.",https://static.dw.com/image/70930690_6.jpg,2024-12-01T10:44:00Z,,"""Wir sind gekommen, um eine klare Botschaft zu übermitteln: dass wir an der Seite der Ukraine stehen und sie auch weiterhin voll und ganz unterstützen werden"", sagte der neue EU-Ratspräsident António… [+2926 chars]",,de,'Ukraine'
https://www.tagesschau.de/ausland/europa/ukraine-kallas-costa-102.html,https://www.tagesschau.de/ausland/europa/ukraine-kallas-costa-102.html,0,www.tagesschau.de,Neue EU-Spitzenvertreter auf Solidaritätsbesuch in Kiew,Gleich am ersten Tag ihrer Amtszeit sind die neuen EU-Spitzenvertreter Kallas und Costa nach Kiew gereist. Ihre Mission ist klar: Der Ukraine die volle EU-Unterstützung zusichern. Dabei setzt Russland das Land weiter militärisch unter Druck.,https://images.tagesschau.de/image/fc8b1779-9082-48f7-9a5c-bbbf680a79fa/AAABk4HahPo/AAABkZLhkrw/16x9-1280/ukraine-kallas-costa-104.jpg,2024-12-01T10:53:24Z,,"Stand: 01.12.2024 11:53 Uhr
Gleich am ersten Tag ihrer Amtszeit sind die neuen EU-Spitzenvertreter Kallas und Costa nach Kiew gereist. Ihre Mission ist klar: Der Ukraine die volle EU-Unterstützung z… [+4208 chars]",,de,'Russland'
https://www.welt.de/politik/ausland/plus254725320/Mehr-Unterstuetzung-fuer-Taiwan-Die-Entwicklungen-die-China-derzeit-besonders-nervoes-machen.html,https://www.welt.de/politik/ausland/plus254725320/Mehr-Unterstuetzung-fuer-Taiwan-Die-Entwicklungen-die-China-derzeit-besonders-nervoes-machen.html,0,www.welt.de,"Die Entwicklungen, die China derzeit besonders nervös machen","Verliert die Ukraine, könnte China dies als Ermutigung zu einem Angriff auf Taiwan sehen. Davor warnen Experten. Entsprechend steigt das Bewusstsein in Washington für die Unterstützung Kiews – und Taipehs. Gleich zwei Entwicklungen der vergangenen Tage lösen …",https://img.welt.de/img/politik/ausland/mobile254725782/2807933507-ci16x9-w1200-fnov-fpotl-fpi157750653/Taiwan-Holds-Defence-Drills.jpg,2024-12-01T11:25:25Z,http://archive.md/20241201172433/https://www.welt.de/politik/ausland/plus254725320/Mehr-Unterstuetzung-fuer-Taiwan-Die-Entwicklungen-die-China-derzeit-besonders-nervoes-machen.html,"Verliert die Ukraine, könnte China dies als Ermutigung zu einem Angriff auf Taiwan sehen. Davor warnen Experten. Entsprechend steigt das Bewusstsein in Washington für die Unterstützung Kiews und Taip… [+85 chars]",,de,'Ukraine'
https://www.stern.de/politik/ausland/krieg-in-syrien--was-die-einnahme-von-aleppo-durch-rebellen-bedeutet-35273162.html,https://www.stern.de/politik/ausland/krieg-in-syrien--was-die-einnahme-von-aleppo-durch-rebellen-bedeutet-35273162.html,0,www.stern.de,Krieg in Syrien: Was die Einnahme von Aleppo durch Rebellen bedeutet,Innerhalb kurzer Zeit erobern Rebellen die syrische Großstadt Aleppo. Syriens Regierungstruppen ziehen sich zurück. Warum flammt der Konflikt jetzt mit den schwersten Kämpfen seit Jahren wieder auf?,https://image.stern.de/35273596/t/ia/v2/w1440/r1.7778/-/01--alter7m3btv21axs2048jpeg---203af8e54d423a53.jpg,2024-12-01T12:36:58Z,,"Kopiere den aktuellen Link
Innerhalb kurzer Zeit erobern Rebellen die syrische Großstadt Aleppo. Syriens Regierungstruppen ziehen sich zurück. Warum flammt der Konflikt jetzt mit den schwersten Kämp… [+4296 chars]",,de,'Ukraine'
https://www.welt.de/politik/deutschland/plus254694550/Carlo-Masala-Wort-Frieden-wird-vom-Kanzler-benutzt-um-einen-Angst-Wahlkampf-zu-fuehren.html,https://www.welt.de/politik/deutschland/plus254694550/Carlo-Masala-Wort-Frieden-wird-vom-Kanzler-benutzt-um-einen-Angst-Wahlkampf-zu-fuehren.html,0,www.welt.de,"„Wort ,Frieden‘ wird vom Kanzler benutzt, um einen Angst-Wahlkampf zu führen“","Während die Ukraine-Lage „extrem kritisch“ sei, schüre der Kanzler im Wahlkampf Kriegsangst, rügt Militärexperte Masala. Er zieht ein vernichtendes Fazit: Scholz habe die Bundeswehr vernachlässigt und Deutschland in Europa isoliert. Mit Blick auf Trump sieht …",https://img.welt.de/img/politik/deutschland/mobile254730602/5897931037-ci16x9-w1200-fnov-fpotl-fpi157750653/Image-6749bb466ee5aa76f748d667.jpg,2024-12-01T13:16:19Z,https://web.archive.org/web/20241201134057/https://www.welt.de/politik/deutschland/plus254694550/Carlo-Masala-Wort-Frieden-wird-vom-Kanzler-benutzt-um-einen-Angst-Wahlkampf-zu-fuehren.html,"Während die Ukraine-Lage extrem kritisch sei, schüre der Kanzler im Wahlkampf Kriegsangst, rügt Militärexperte Masala. Er zieht ein vernichtendes Fazit: Scholz habe die Bundeswehr vernachlässigt und … [+102 chars]",,de,'Krieg'
https://www.morgenpost.de/politik/article407801005/vormarsch-der-islamisten-der-syrische-albtraum-ist-zurueck.html,https://www.morgenpost.de/politik/article407801005/vormarsch-der-islamisten-der-syrische-albtraum-ist-zurueck.html,0,www.morgenpost.de,Vormarsch der Islamisten: Der syrische Albtraum ist zurück,"Der syrische Albrtraum ist zurück: Islamistische Rebellen rücken mühelos vor.  Es ist weit mehr als ein Bürgerkrieg. Putin, Erdogan und die Mullahs haben Interessen.",https://img.sparknews.funkemedien.de/407801233/407801233_1733059739_v16_9_1600.jpeg,2024-12-01T13:28:55Z,https://web.archive.org/web/20241201154849/https://www.morgenpost.de/politik/article407801005/vormarsch-der-islamisten-der-syrische-albtraum-ist-zurueck.html,"Berlin. Islamistische Rebellen rücken in Syrien mühelos vor. Reagiert Kremlchef Wladimir Putin wie bei der brutalen Schlacht um Aleppo 2016? 
Es war ein winziger Hoffnungsschimmer, der sich jüngst ü… [+4108 chars]",,de,'Ukraine'
https://www.focus.de/politik/ausland/ukraine-krise/nach-selenskyjs-nato-vorschlag-experte-zur-ukraine-vom-waffenstillstand-sind-wir-noch-weit-entfernt_id_260527023.html,https://www.focus.de/politik/ausland/ukraine-krise/nach-selenskyjs-nato-vorschlag-experte-zur-ukraine-vom-waffenstillstand-sind-wir-noch-weit-entfernt_id_260527023.html,0,www.focus.de,"Nach Selenskyjs Nato-Vorschlag - „Eskalieren, um zu deeskalieren“: Experte erklärt die Trump-Strategien für die Ukraine","Gebietsverluste gegen Nato-Beitritt – mit diesem Vorschlag sorgt der ukrainische Präsident Wolodymyr Selenskyj in den letzten Tagen für Aufsehen. Militärexperte Carlo Masala sieht darin eine Reaktion auf wachsenden internationalen Druck – aus USA, aber auch a…",https://p6.focus.de/img/fotos/id_260378400/ukraine-krieg.jpg?im=Crop%3D%280%2C521%2C3467%2C1736%29%3BResize%3D%281200%2C627%29&impolicy=perceptual&quality=mediumHigh&hash=9420951921306ac2de1d5067a0c33717d9b0db37fce9a9a3630e78f716260dd6,2024-12-01T13:43:43Z,https://web.archive.org/web/20241202155720/https://www.focus.de/politik/ausland/ukraine-krise/nach-selenskyjs-nato-vorschlag-experte-zur-ukraine-vom-waffenstillstand-sind-wir-noch-weit-entfernt_id_260527023.html,Gebietsverluste gegen Nato-Beitritt mit diesem Vorschlag sorgt der ukrainische Präsident Wolodymyr Selenskyj in den letzten Tagen für Aufsehen. Militärexperte Carlo Masala sieht darin eine Reaktion a… [+4411 chars],,de,'Ukraine'
https://www.welt.de/politik/deutschland/article254731136/Bundestagswahl-2025-Dass-sich-Frau-Brantner-da-bloss-nicht-taeuscht-Kritik-an-Gruenen-Chefin-nach-Lob-fuer-Merz.html,https://www.welt.de/politik/deutschland/article254731136/Bundestagswahl-2025-Dass-sich-Frau-Brantner-da-bloss-nicht-taeuscht-Kritik-an-Gruenen-Chefin-nach-Lob-fuer-Merz.html,0,www.welt.de,„Dass sich Frau Brantner da bloß nicht täuscht“ – Kritik an Grünen-Chefin nach Lob für Merz,"Mit einem Bundeskanzler Merz könne man „klar an der Seite der Ukrainer stehen“, sagt die neue Grünen-Chefin Brantner – und bevorzugt in der Ukraine-Politik den CDU-Chef gegenüber Bundeskanzler Scholz (SPD). Die Sozialdemokraten halten das für falsch. Und aus …",https://img.welt.de/img/politik/deutschland/mobile254732192/8727937417-ci16x9-w1200/Image-674c5a796ee5aa76f748ebf9.jpg,2024-12-01T13:56:26Z,,"Mit einem Bundeskanzler Merz könne man klar an der Seite der Ukrainer stehen, sagt die neue Grünen-Chefin Brantner und bevorzugt in der Ukraine-Politik den CDU-Chef gegenüber Bundeskanzler Scholz (SP… [+4690 chars]",,de,'Ukraine'
https://www.faz.net/aktuell/politik/bundestagswahl/liveticker-zur-bundestagswahl-2025-merz-wirft-spd-spiel-mit-aengsten-der-bevoelkerung-vor-110093143.html,https://www.faz.net/aktuell/politik/bundestagswahl/liveticker-zur-bundestagswahl-2025-merz-wirft-spd-spiel-mit-aengsten-der-bevoelkerung-vor-110093143.html,0,www.faz.net,Liveticker zum Ampel-Aus: Merz wirft SPD Spiel mit Ängsten der Bevölkerung vor,Brantner hält Merz in Ukraine-Politik für besseren Partner +++ Merz will „grundlegend“ andere Wirtschaftspolitik +++ alle Entwicklungen im Liveblog,https://media1.faz.net/ppmedia/aktuell/politik/7254237/1.10146677/facebook_teaser/unionskanzlerkandidat.jpg,2024-12-01T14:05:33Z,,Die Grünen-Vorsitzende Franziska Brantner hält den Unionskanzlerkandidaten Friedrich Merz (CDU) in der Ukraine- und Europa-Politik für den besseren Partner als Kanzler Olaf Scholz (SPD). Drei zentral… [+1482 chars],,de,'Ukraine'
https://www.tagesschau.de/ausland/asien/syrien-kaempfe-116.html,https://www.tagesschau.de/ausland/asien/syrien-kaempfe-116.html,0,www.tagesschau.de,Kämpfe in Syrien: Dschihadisten erhöhen Druck auf Assad,Die Dschihadisten in Syrien sind weiter auf dem Vormarsch: Laut Aktivisten hat die Regierung die Kontrolle über Aleppo verloren. Machthaber Assad rechnet fest mit der Hilfe seiner Verbündeten.,https://images.tagesschau.de/image/4d4d07b8-1a17-49ee-9ca6-911fb0d980c9/AAABk4ELeuU/AAABkZLhkrw/16x9-1280/dschihadisten-104.jpg,2024-12-01T15:02:45Z,http://archive.md/20241201091033/https://www.tagesschau.de/ausland/asien/syrien-kaempfe-116.html,"Stand: 01.12.2024 16:02 Uhr
Die Dschihadisten in Syrien sind weiter auf dem Vormarsch: Laut Aktivisten hat die Regierung die Kontrolle über Aleppo verloren. Machthaber Assad rechnet fest mit der Hil… [+6402 chars]",,de,'Ukraine'
https://www.tagesspiegel.de/politik/burgerkrieg-wieder-eskaliert-unionsinnenpolitiker-gegen-aufnahme-von-syrien-fluchtlingen-12802256.html,https://www.tagesspiegel.de/politik/burgerkrieg-wieder-eskaliert-unionsinnenpolitiker-gegen-aufnahme-von-syrien-fluchtlingen-12802256.html,0,www.tagesspiegel.de,Bürgerkrieg wieder eskaliert: Unionsinnenpolitiker gegen Aufnahme von Syrien-Flüchtlingen,So schwere Kämpfe wie derzeit hat es in Syrien seit Jahren nicht gegeben. Flüchten deshalb wieder mehr Menschen nach Europa? Ein Unionspolitiker sieht die Nachbarländer Syriens in der Pflicht.,https://www.tagesspiegel.de/images/12802277/alternates/BASE_16_9_W1400/1733065587000/alexander-throm-cdu.jpeg,2024-12-01T15:12:31Z,,Unionsinnenpolitiker Alexander Throm hat sich angesichts der eskalierenden Lage in Syrien gegen eine Aufnahme von möglichen Flüchtlingen aus dem Bürgerkriegsland in Deutschland ausgesprochen. Sollten… [+1987 chars],,de,'Kämpfe'
https://www.tagesschau.de/ausland/europa/ukraine-kinder-besetzte-gebiete-100.html,https://www.tagesschau.de/ausland/europa/ukraine-kinder-besetzte-gebiete-100.html,0,www.tagesschau.de,Von Russland besetzte Gebiete: Mit Drill Patrioten formen,Russische Jugendorganisationen sind in den besetzten Gebieten der Ukraine ein Instrument der Militarisierung. Auch die Schulen sollen dort die Russifizierung der jungen Generation vorantreiben. Von A. Chaika und E. Aretz.,https://images.tagesschau.de/image/14c0af16-9fc9-4c7f-b959-cee5a5bd5565/AAABk3kP8iU/AAABkZLhkrw/16x9-1280/junarmija-putin-100.jpg,2024-12-01T15:13:54Z,https://web.archive.org/web/20241201153348/https://www.tagesschau.de/ausland/europa/ukraine-kinder-besetzte-gebiete-100.html,"Stand: 01.12.2024 16:13 Uhr
Russische Jugendorganisationen sind in den besetzten Gebieten der Ukraine ein Instrument der Militarisierung. Auch die Schulen sollen dort die Russifizierung der jungen G… [+8403 chars]",,de,'Ukraine'
https://www.n-tv.de/politik/So-koennte-Trumps-Ukraine-Deal-Europa-herausfordern-article25400736.html,https://www.n-tv.de/politik/So-koennte-Trumps-Ukraine-Deal-Europa-herausfordern-article25400736.html,0,www.n-tv.de,"""300.000 Mann Untergrenze"": So könnte Trumps Ukraine-Deal Europa herausfordern","Mit Erpressung will Trumps künftiger Ukraine-Beauftragter Kellogg die Gegner an einen Tisch zwingen. Doch lässt sich ein Putin, der sich auf der Zielgeraden wähnt, wirklich einhegen? Diese Aufgabe könnte auf Europa zukommen und bisherige Dimensionen sprengen.",https://bilder4.n-tv.de/img/incoming/crop25401575/8741328076-cImg_16_9-w1200/494566454.jpg,2024-12-01T15:31:21Z,https://web.archive.org/web/20241201153319/https://www.n-tv.de/politik/So-koennte-Trumps-Ukraine-Deal-Europa-herausfordern-article25400736.html,"Mit Erpressung will Trumps künftiger Ukraine-Beauftragter Kellogg die Gegner an einen Tisch zwingen. Doch lässt sich ein Putin, der sich auf der Zielgeraden wähnt, wirklich einhegen? Diese Aufgabe kö… [+9589 chars]",,de,'Ukraine'
https://www.tagesspiegel.de/politik/grune-gehen-auf-distanz-zum-kanzler-scholz-spielt-mit-angsten-in-der-bevolkerung-um-zu-gewinnen-12802328.html,https://www.tagesspiegel.de/politik/grune-gehen-auf-distanz-zum-kanzler-scholz-spielt-mit-angsten-in-der-bevolkerung-um-zu-gewinnen-12802328.html,0,www.tagesspiegel.de,"Grüne gehen auf Distanz zum Kanzler: „Scholz spielt mit Ängsten in der Bevölkerung, um zu gewinnen“",Die jüngsten Wahlkampfäußerungen von Kanzler Scholz zur Nuklearmacht Russland stoßen auf scharfe Kritik – auch beim Koalitionspartner. Der sieht darin „unverantwortliches Gerede“.,https://www.tagesspiegel.de/images/12798749/alternates/BASE_16_9_W1400/1732970237000/germany-parties-spd-vote.jpeg,2024-12-01T15:38:40Z,http://archive.md/20241201183020/https://www.tagesspiegel.de/politik/grune-gehen-auf-distanz-zum-kanzler-scholz-spielt-mit-angsten-in-der-bevolkerung-um-zu-gewinnen-12802328.html,"Der Auftritt von Olaf Scholz auf der sogenannten Wahlsieg-Konferenz der SPD und seine anschließenden Beiträge in den sozialen Medien sind am Wochenende auf scharfe Kritik von CDU, FDP und seinem grün… [+3030 chars]",,de,'Russland'
https://www.tagesschau.de/inland/innenpolitik/gruene-scholz-merz-100.html,https://www.tagesschau.de/inland/innenpolitik/gruene-scholz-merz-100.html,0,www.tagesschau.de,Grüne gehen auf Distanz zu Scholz' Ukraine-Politik,"Die Grünen haben Bundeskanzler Scholz und die SPD mit Blick auf deren Ukraine-Politik kritisiert. Eine klare Unterstützung Kiews sei mit CDU-Chef Merz einfacher, betonte Co-Chefin Brantner. Die SPD weist die Kritik zurück.",https://images.tagesschau.de/image/75dec400-9e99-451c-8ebb-1c020bd82953/AAABk4LjAO8/AAABkZLhkrw/16x9-1280/franziska-brantner-106.jpg,2024-12-01T15:42:15Z,https://web.archive.org/web/20241201174154/https://www.tagesschau.de/inland/innenpolitik/gruene-scholz-merz-100.html,"Stand: 01.12.2024 16:42 Uhr
Die Grünen haben Bundeskanzler Scholz und die SPD mit Blick auf deren Ukraine-Politik kritisiert. Eine klare Unterstützung Kiews sei mit CDU-Chef Merz einfacher, betonte … [+3412 chars]",,de,'Ukraine'
https://www.businessinsider.de/gruenderszene/business/wie-gruender-kohle-enpal-aus-solar-nische-jongliert-bfr/,https://www.businessinsider.de/gruenderszene/business/wie-gruender-kohle-enpal-aus-solar-nische-jongliert-bfr/,0,www.businessinsider.de,„Es gibt Arbeits- und Zirkuspferde“: Wie Mario Kohle Enpal aus der Solar-Nische jongliert,"Unicorn-Gründer Mario Kohle, Enpal-CEO, im Interview über neue Geschäftsmodelle, Kundenservice und Wettbewerber Philipp Schröder (1Komma5°).",https://cdn.businessinsider.de/wp-content/uploads/2024/09/202409_GS_Enpal_1800x1200_02.jpg?ver=1726677719,2024-12-01T18:02:13Z,http://archive.md/20241201205918/https://www.businessinsider.de/gruenderszene/business/wie-gruender-kohle-enpal-aus-solar-nische-jongliert-bfr/,"Eigentlich wirkt Mario Kohle, als habe er gerade meditiert: ruhig, entspannt. Ein Mönch in Cargo-Hosen. Das Interview sei allerdings um Punkt 16 Uhr vorbei, sagt der Enpal-CEO, er müsse noch zum Fris… [+1243 chars]",,de,'Solar'
https://www.nzz.ch/wirtschaft/meyer-burger-nach-ueber-70-jahren-steuert-die-solarfirma-in-den-abgrund-ld.1859201,https://www.nzz.ch/wirtschaft/meyer-burger-nach-ueber-70-jahren-steuert-die-solarfirma-in-den-abgrund-ld.1859201,0,www.nzz.ch,Ein Phönix namens Meyer Burger: Die Solarfirma ist immer wieder auferstanden – und verbrennt jetzt wohl endgültig,Solarzellen in der Energiewende verkaufen – was kann da schwierig sein? Sehr viel. Nach über 70 Jahren fehlt Meyer Burger ein Geschäftsmodell.,"https://img.nzz.ch/2024/11/29/6f7de07e-4749-4ee1-87d4-3f7bb7b5055e.jpeg?width=1200&height=674&fit=bounds&quality=75&auto=webp&crop=5464,3073,x0,y347&wmark=nzz",2024-12-02T04:30:00Z,http://archive.md/20241202050532/https://www.nzz.ch/wirtschaft/meyer-burger-nach-ueber-70-jahren-steuert-die-solarfirma-in-den-abgrund-ld.1859201,"Als die Zukunft noch glänzend war: Präsentation von Solarzellen von Meyer Burger im sächsischen Freiberg bei Dresden.
Als Meyer Burger vor drei Jahren ein Werk für Solarzellen in Sachsen-Anhalt eröf… [+9756 chars]",,de,'Solar'
https://www.zeit.de/news/2024-12/02/besuch-in-kiew-scholz-sagt-weitere-waffenlieferungen-zu,https://www.zeit.de/news/2024-12/02/besuch-in-kiew-scholz-sagt-weitere-waffenlieferungen-zu,0,www.zeit.de,Ukraine-Krieg: Besuch in Kiew: Scholz sagt weitere Waffenlieferungen zu,Hier finden Sie Informationen zu dem Thema „Ukraine-Krieg“. Lesen Sie jetzt „Besuch in Kiew: Scholz sagt weitere Waffenlieferungen zu“.,https://img.zeit.de/news/2024-12/02/besuch-in-kiew-scholz-sagt-weitere-waffenlieferungen-zu-image-group/wide__1300x731,2024-12-02T06:55:13Z,https://web.archive.org/web/20241203051911/https://www.zeit.de/news/2024-12/02/besuch-in-kiew-scholz-sagt-weitere-waffenlieferungen-zu,Bundeskanzler Olaf Scholz ist zu seinem ersten Ukraine-Besuch seit zweieinhalb Jahren in der Hauptstadt Kiew eingetroffen. Bei seiner Ankunft mit dem Zug kündigte der SPD-Politiker weitere Rüstungsli… [+6142 chars],,de,'Krieg'
https://www.focus.de/panorama/so-geht-es-deutschland-wirklich-focus-online-startet-serie-zur-stimmung-im-land-was-die-menschen-wirklich-bewegt_id_260501641.html,https://www.focus.de/panorama/so-geht-es-deutschland-wirklich-focus-online-startet-serie-zur-stimmung-im-land-was-die-menschen-wirklich-bewegt_id_260501641.html,0,www.focus.de,"Serie: „So geht es Deutschland wirklich“ - Kriegsangst, Inflation, Politik-Frust: FOCUS online fühlt den Deutschland-Puls","Viele Menschen klagen, die aktuelle Politik gehe an ihrer Lebenswirklichkeit vorbei. Doch was wünschen sie sich? Wie geht es ihnen? FOCUS-online-Reporter reisen drei Monate durch Deutschland und fangen die Stimmung ein – für eine Serie mit 101 Folgen.Von FOCU…",https://p6.focus.de/img/fotos/id_260501640/combo.png?im=Crop%3D%28324%2C0%2C3688%2C1844%29%3BResize%3D%281200%2C627%29&impolicy=perceptual&quality=mediumHigh&hash=9a1faca4fb990a019cbe5d220258710c85f3ac402c76d44aafcbc26508dfc19b,2024-12-02T08:34:13Z,https://web.archive.org/web/20241202090951/https://www.focus.de/panorama/so-geht-es-deutschland-wirklich-focus-online-startet-serie-zur-stimmung-im-land-was-die-menschen-wirklich-bewegt_id_260501641.html,"Viele Menschen klagen, die aktuelle Politik gehe an ihrer Lebenswirklichkeit vorbei. Doch was wünschen sie sich? Wie geht es ihnen? FOCUS-online-Reporter reisen drei Monate durch Deutschland und fang… [+3717 chars]",,de,'Solar'
https://www.zeit.de/news/2024-12/02/baerbock-mahnt-ukraine-krieg-nicht-in-chinas-interesse,https://www.zeit.de/news/2024-12/02/baerbock-mahnt-ukraine-krieg-nicht-in-chinas-interesse,0,www.zeit.de,China-Reise: Baerbock mahnt: Ukraine-Krieg nicht in Chinas Interesse,Hier finden Sie Informationen zu dem Thema „China-Reise“. Lesen Sie jetzt „Baerbock mahnt: Ukraine-Krieg nicht in Chinas Interesse“.,https://img.zeit.de/news/2024-12/02/baerbock-mahnt-ukraine-krieg-nicht-in-chinas-interesse-image-group/wide__1300x731,2024-12-02T09:49:25Z,,"Bundesaußenministerin Annalena Baerbock hat China davor gewarnt, Russland bei seinem Angriffskrieg in der Ukraine gewähren zu lassen. «Der russische Präsident zerstört nicht nur unsere europäische Fr… [+1697 chars]",,de,'Ukraine'
https://www.zeit.de/news/2024-12/02/kiesewetter-kanzlerreise-nach-kiew-ist-verlogen,https://www.zeit.de/news/2024-12/02/kiesewetter-kanzlerreise-nach-kiew-ist-verlogen,0,www.zeit.de,"Krieg in der Ukraine: Kiesewetter: Kanzlerreise nach Kiew ist ""verlogen""","Hier finden Sie Informationen zu dem Thema „Krieg in der Ukraine“. Lesen Sie jetzt „Kiesewetter: Kanzlerreise nach Kiew ist ""verlogen""“.",https://img.zeit.de/news/2024-12/02/kiesewetter-kanzlerreise-nach-kiew-ist-verlogen-image-group/wide__1300x731,2024-12-02T11:12:00Z,https://web.archive.org/web/20241203153755/https://www.zeit.de/news/2024-12/02/kiesewetter-kanzlerreise-nach-kiew-ist-verlogen,Der CDU-Außenpolitiker Roderich Kiesewetter hat den Ukraine-Besuch von Bundeskanzler Olaf Scholz (SPD) als unglaubwürdiges Wahlkampfmanöver kritisiert. Der «Augsburger Allgemeinen» sagte er: «Scholz … [+1765 chars],,de,'Krieg'
