index,url,valid,domain,title,description,image,published,archive,content,quote,language,keyword
https://www.tagesspiegel.de/internationales/ukraine-invasion-tag-1412-eu-diplomaten-sind-positiv-uberrascht-uber-die-friedensverhandlungen--selenskyj-zeigt-sich-skeptisch-15109178.html,https://www.tagesspiegel.de/internationales/ukraine-invasion-tag-1412-eu-diplomaten-sind-positiv-uberrascht-uber-die-friedensverhandlungen--selenskyj-zeigt-sich-skeptisch-15109178.html,0,www.tagesspiegel.de,"Ukraine-Invasion, Tag 1412: EU-Diplomaten sind positiv überrascht über die Friedensverhandlungen – Selenskyj zeigt sich skeptisch","Ukraine meldet ersten Abfang russischer Raketen-Drohne, Selenskyj lässt erfolgreichen Geheimdienst-Chef fallen. Der Überblick am Abend.",https://www.tagesspiegel.de/images/15109202/alternates/BASE_16_9_W1400/1767714253000/ukraine-krieg-treffen-der-koalition-der-willigen.jpeg,2026-01-06T15:44:29Z,,"Bei dem heutigen Gipfel der Koalition der Ukraine-Unterstützer in Paris geht es vor allem um die knifflige Frage der Sicherheitsgarantien. Konkret: Wer schickt Truppen in die Ukraine, sollte Russland… [+4377 chars]",,de,'Ukraine'
https://taz.de/Entwurf-fuer-Ukraine-Gipfelerklaerung/!6143371/,https://taz.de/Entwurf-fuer-Ukraine-Gipfelerklaerung/!6143371/,0,taz.de,Entwurf für Ukraine-Gipfelerklärung: USA sollen Überwachung eines Waffenstillstands leiten,"Sollte zwischen der Ukraine und Russland ein Waffenstillstand vereinbart werden, sollen dies die US-Amerikaner überwachen mit Beteiligung der Europäer.",https://taz.de/picture/8168646/1200/Gipfel-der-Koalition-der-Willigen-in-Paris.jpeg,2026-01-06T15:56:00Z,,"Sollte zwischen der Ukraine und Russland ein Waffenstillstand vereinbart werden, sollen dies die US-Amerikaner überwachen mit Beteiligung der Europäer. mehr...",,de,'Ukraine'
https://www.welt.de/politik/ausland/video695d2f22128ceb4c12ff388f/krieg-in-der-ukraine-keine-boots-on-the-ground-usa-sollen-ueberwachung-eines-waffenstillstands-leiten.html,https://www.welt.de/politik/ausland/video695d2f22128ceb4c12ff388f/krieg-in-der-ukraine-keine-boots-on-the-ground-usa-sollen-ueberwachung-eines-waffenstillstands-leiten.html,0,www.welt.de,„Keine Boots on the Ground“ – USA sollen Überwachung eines Waffenstillstands leiten,Westliche Unterstützer der Ukraine sind in Paris mit Vertretern der USA zu Beratungen über die Absicherung eines möglichen Waffenstillstands für das von Russland angegriffene Land zusammengekommen. Korrespondent Michael Wüllenweber berichtet.,https://images.welt.de/695d2f22128ceb4c12ff388f/7a3e97acf24f3489b2d0dcc00204d994/ci16x9-w1200,2026-01-06T15:57:34Z,,Die WELT als ePaper: Die vollständige Ausgabe steht Ihnen bereits am Vorabend zur Verfügung so sind Sie immer hochaktuell informiert. Weitere Informationen https://epaper.welt.de,,de,'Ukraine'
https://www.zeit.de/politik/2026-01/koalition-brandenburg-regierungskrise-nachrichtenpodcast,https://www.zeit.de/politik/2026-01/koalition-brandenburg-regierungskrise-nachrichtenpodcast,0,www.zeit.de,Koalition in Brandenburg: Das Ende der ersten BSW-Regierung,Nach nicht einmal einem Jahr ist die Koalition aus SPD und BSW zerbrochen. Wie geht es jetzt in Brandenburg weiter? Und: Ukraine-Unterstützer beraten in Paris.,https://img.zeit.de/politik/2017-09/illu-podcast-news/wide__8ed8a6__1300x731,2026-01-06T16:08:56Z,,Es hat nicht einmal ein Jahr gehalten: Die erste Koalition aus SPD und BSW in Brandenburg ist zerbrochen. Es war von Anfang an ein Experiment. Nach dem Fraktionsaustritt von BSW-Finanzminister Robert… [+1913 chars],,de,'Ukraine'
https://www.faz.net/aktuell/politik/ausland/beistand-auf-nato-niveau-usa-zu-ukraine-sicherheitsgarantien-bereit-110814646.html,https://www.faz.net/aktuell/politik/ausland/beistand-auf-nato-niveau-usa-zu-ukraine-sicherheitsgarantien-bereit-110814646.html,0,www.faz.net,Ukraine-Gipfel in Paris: Beistand auf NATO-Niveau,Die Ukraine soll verbindliche Sicherheitszusagen bekommen. Auch von den Vereinigten Staaten. Die Bundesregierung schließt eine Beteiligung an einer multinationalen Truppe nicht mehr aus.,https://media0.faz.net/image/w1200h627/42114fadf5fe/w2004h1047x0y241o/012026/1.10814643/selenskyj-wird-von-macron.webp,2026-01-06T16:15:05Z,,Die Ukraine soll von den Vereinigten Staaten und den anderen Mitgliedern der sogenannten Koalition der Willigen verbindliche Sicherheitszusagen erhalten. Das geht aus dem Entwurf für die Abschlusserk… [+5644 chars],,de,'Ukraine'
https://www.tagesschau.de/ausland/europa/groenland-usa-ansprueche-china-russland-100.html,https://www.tagesschau.de/ausland/europa/groenland-usa-ansprueche-china-russland-100.html,0,www.tagesschau.de,"US-Ansprüche auf Grönland: ""Die Sicherheitsgründe sind vorgeschoben""","US-Präsident Trump begründet seinen Anspruch auf Grönland mit einem Vordringen Russlands und Chinas. Der Arktis-Experte Michael Paul hält das für einen Vorwand. Im Interview erklärt er, welche Probleme die USA in Grönland erwarten würden.",https://images.tagesschau.de/image/33298e4a-e440-4f4f-9b13-b34f81e2f745/AAABm5MBCzQ/AAABmyZE0EA/16x9-big/boot-eismeer-100.jpg?width=1280,2026-01-06T16:19:52Z,,"Stand: 06.01.2026 17:19 Uhr
US-Präsident Trump begründet seinen Anspruch auf Grönland mit einem Vordringen Russlands und Chinas. Der Arktis-Experte Michael Paul hält das für einen Vorwand. Im Interv… [+9331 chars]",,de,'Russland'
