index,url,valid,domain,title,description,image,published,archive,content,quote,language,keyword
https://www.n-tv.de/politik/09-16-Deutsche-Soldaten-in-Ukraine-Schutztruppe-Gruener-Wahlkampfleiter-Audretsch-zurueckhaltend--article23143824.html,https://www.n-tv.de/politik/09-16-Deutsche-Soldaten-in-Ukraine-Schutztruppe-Gruener-Wahlkampfleiter-Audretsch-zurueckhaltend--article23143824.html,0,www.n-tv.de,Ukraine-Krieg im Liveticker: +++ 09:16 Deutsche Soldaten in Ukraine-Schutztruppe? Grüner Wahlkampfleiter Audretsch zurückhaltend +++,Lesen Sie alle aktuellen Entwicklungen und Nachrichten über den russischen Angriffskrieg auf die Ukraine im Liveticker von ntv.de.,https://bilder3.n-tv.de/img/incoming/crop25117070/4231326595-cImg_16_9-w1200/Ukraine-Liveticker.jpg,2024-12-03T23:29:00Z,https://web.archive.org/web/20241204083117/https://www.n-tv.de/politik/09-16-Deutsche-Soldaten-in-Ukraine-Schutztruppe-Gruener-Wahlkampfleiter-Audretsch-zurueckhaltend--article23143824.html,"Der Wahlkampfleiter der Grünen, Andreas Audretsch, äußert sich zurückhaltend zum Vorstoß von Außenministerin Baerbock, deutsche Soldaten zum Schutz eines möglichen Waffenstillstands in der Ukraine au… [+15469 chars]",,de,'Putin'
https://www.n-tv.de/politik/12-53-Wagenknecht-und-Schwarzer-starten-neuen-Appell-und-beschuldigen-die-USA--article23143824.html,https://www.n-tv.de/politik/12-53-Wagenknecht-und-Schwarzer-starten-neuen-Appell-und-beschuldigen-die-USA--article23143824.html,0,www.n-tv.de,Ukraine-Krieg im Liveticker: +++ 12:53 Wagenknecht und Schwarzer starten neuen Appell - und beschuldigen die USA +++,Lesen Sie alle aktuellen Entwicklungen und Nachrichten über den russischen Angriffskrieg auf die Ukraine im Liveticker von ntv.de.,https://bilder3.n-tv.de/img/incoming/crop25117070/4231326595-cImg_16_9-w1200/Ukraine-Liveticker.jpg,2024-12-03T23:29:00Z,,"Knapp zwei Jahre nach ihrem ""Manifest für Frieden"" startet Parteigründerin Sahra Wagenknecht mit der Autorin Alice Schwarzer einen neuen Appell für einen Waffenstillstand in der Ukraine. Der Aufruf w… [+22613 chars]",,de,'Putin'
https://www.n-tv.de/politik/08-38-Tucker-Carlson-Wir-sind-zurueck-in-Moskau--article23143824.html,https://www.n-tv.de/politik/08-38-Tucker-Carlson-Wir-sind-zurueck-in-Moskau--article23143824.html,0,www.n-tv.de,"Ukraine-Krieg im Liveticker: +++ 08:38 Tucker Carlson: ""Wir sind zurück in Moskau"" +++",Lesen Sie alle aktuellen Entwicklungen und Nachrichten über den russischen Angriffskrieg auf die Ukraine im Liveticker von ntv.de.,https://bilder3.n-tv.de/img/incoming/crop25117070/4231326595-cImg_16_9-w1200/Ukraine-Liveticker.jpg,2024-12-03T23:29:00Z,,"Der rechtsextreme US-Publizist Tucker Carlson ist offenbar wieder in Moskau. ""Wir sind gestern nach Moskau zurückgekehrt, um den russischen Außenminister Sergej Lawrow zu interviewen, den dienstältes… [+14705 chars]",,de,'Krieg'
https://www.tagesschau.de/newsticker/liveblog-ukraine-mittwoch-434.html,https://www.tagesschau.de/newsticker/liveblog-ukraine-mittwoch-434.html,0,www.tagesschau.de,Ukraine-Liveblog: ++ Rutte glaubt nicht an zügigen NATO-Beitritt ++,NATO-Generalsekretär Rutte macht der Ukraine wenig Hoffnung auf eine Beitrittseinladung vor dem Amtsantritt des designierten US-Präsidenten. Die russische Flugabwehr wehrt einen Angriff auf Noworossijsk ab. Die Entwicklungen im Liveblog.,https://images.tagesschau.de/image/9a3e9829-a980-4f4c-addd-fd6f4076363d/AAABk49EUT8/AAABkZLhkrw/16x9-1280/rutte-sybiha-100.jpg,2024-12-04T01:22:18Z,,"Stand: 04.12.2024 02:22 Uhr
NATO-Generalsekretär Rutte macht der Ukraine wenig Hoffnung auf eine Beitrittseinladung vor dem Amtsantritt des designierten US-Präsidenten. Die russische Flugabwehr wehr… [+3339 chars]",,de,'Putin'
https://www.bild.de/politik/inland/bei-markus-lanz-steinbrueck-kritisiert-angst-wahlkampf-von-scholz-674faa6e6ee5aa76f7490b8f,https://www.bild.de/politik/inland/bei-markus-lanz-steinbrueck-kritisiert-angst-wahlkampf-von-scholz-674faa6e6ee5aa76f7490b8f,0,www.bild.de,Klartext bei Markus Lanz - Steinbrück kritisiert Angst-Wahlkampf von Scholz,Ex-SPD-Kanzlerkandidat Peer Steinbrück äußert bei Markus Lanz Kritik an Olaf Scholz' Wahlkampftaktik und dessen Umgang mit der Angst-Rhetorik.,"https://images.bild.de/674faa6e6ee5aa76f7490b8f/bc5490d9704552b876083037acc8a784,b4b91061?w=1280",2024-12-04T01:47:11Z,http://archive.md/20241204045505/https://www.bild.de/politik/inland/bei-markus-lanz-steinbrueck-kritisiert-angst-wahlkampf-von-scholz-674faa6e6ee5aa76f7490b8f,Er nimmt nach wie vor kein Blatt vor den Mund: Der ehemalige SPD-Kanzlerkandidat und Ex-Bundesfinanzminister Peer Steinbrück hat bei Markus Lanz den für ihn typischen Klartext geliefert und Kanzler O… [+2297 chars],,de,'Putin'
https://www.zeit.de/politik/ausland/2024-12/syrien-us-militaer-selbstverteidigungsangriff-dschihadisten-russland-tuerkei-iran,https://www.zeit.de/politik/ausland/2024-12/syrien-us-militaer-selbstverteidigungsangriff-dschihadisten-russland-tuerkei-iran,0,www.zeit.de,Bürgerkrieg in Syrien: US-Militär startet Selbstverteidigungsangriff in Syrien,"In Syrien schlagen Raketen nahe einem US-Stützpunkt ein, die Verantwortlichen sind noch unklar. Russland wirft der Ukraine Unterstützung dschihadistischer Rebellen vor.",https://img.zeit.de/politik/ausland/2024-12/syrien-us-militaer-selbstverteidigungsangriff-dschihadisten-russland-tuerkei-iran-bild-2/wide__1300x731,2024-12-04T03:49:21Z,http://archive.md/20241204081513/https://www.zeit.de/politik/ausland/2024-12/syrien-us-militaer-selbstverteidigungsangriff-dschihadisten-russland-tuerkei-iran,Die US-Streitkräfte haben am Dienstag in der Nähe des Militärstützpunktes Euphrat in Ostsyrien einen Selbstverteidigungsangriff gestartet. Der Angriff erfolgte nach dem Abschuss von Raketen und Mörse… [+5291 chars],,de,'Ukraine'
https://www.zeit.de/news/2024-12/04/mehr-flugabwehr-fuer-ukraine-und-gespraeche-mit-trumps-team,https://www.zeit.de/news/2024-12/04/mehr-flugabwehr-fuer-ukraine-und-gespraeche-mit-trumps-team,0,www.zeit.de,Die Lage im Überblick: Mehr Flugabwehr für Ukraine - und Gespräche mit Trumps Team?,Hier finden Sie Informationen zu dem Thema „Die Lage im Überblick“. Lesen Sie jetzt „Mehr Flugabwehr für Ukraine - und Gespräche mit Trumps Team?“.,https://img.zeit.de/news/2024-12/04/mehr-flugabwehr-fuer-ukraine-und-gespraeche-mit-trumps-team-image-group/wide__1300x731,2024-12-04T04:00:45Z,,Der ukrainische Präsident Wolodymyr Selenskyj will die Truppen an der Front im Osten des Landes mit weiteren Waffenlieferungen der Verbündeten stärken. «Das ist eine direkte Abhängigkeit: Je mehr Feu… [+4156 chars],,de,'Ukraine'
https://www.nzz.ch/international/ukraine-krieg-kiew-droht-den-donbass-an-russland-zu-verlieren-ld.1859909,https://www.nzz.ch/international/ukraine-krieg-kiew-droht-den-donbass-an-russland-zu-verlieren-ld.1859909,0,www.nzz.ch,Schmerzhafter Abschied der Ukraine vom Donbass,"Zum östlichsten Landesteil hatten viele Ukrainer stets ein zwiespältiges Verhältnis. Dass Russland dort immer weiter vorrückt, empfinden sie trotzdem als katastrophalen Verlust.","https://img.nzz.ch/2024/12/02/9174aaef-acbc-4312-9739-c20521f90b75.jpeg?width=1200&height=674&fit=bounds&quality=75&auto=webp&crop=3071,1727,x0,y160&wmark=nzz",2024-12-04T04:30:00Z,http://archive.md/20241204062634/https://www.nzz.ch/international/ukraine-krieg-kiew-droht-den-donbass-an-russland-zu-verlieren-ld.1859909,"Die Ukrainer verteidigen den Donbass seit zehn Jahren, doch nun häufen sich die militärischen Rückschläge.
So schnell wie in den letzten Monaten ist Russlands Armee seit Kriegsbeginn nie vorgerückt.… [+8225 chars]",,de,'Ukraine'
https://www.nzz.ch/international/syrien-fall-von-aleppo-ist-rueckschlag-fuer-russland-ld.1860466,https://www.nzz.ch/international/syrien-fall-von-aleppo-ist-rueckschlag-fuer-russland-ld.1860466,0,www.nzz.ch,Russlands Rückschlag im Wüstensand: In Syrien ist ein strategisches Standbein in Gefahr,Russland verbindet mit Syrien weltpolitische Ambitionen. Nun kann es dem Vorstoss der Islamisten aber nicht viel entgegensetzen. Auf dem Spiel steht mehr als nur Moskaus Reputation.,"https://img.nzz.ch/2024/12/03/abdf9512-74c5-4677-84fe-616f6a882653.jpeg?width=1200&height=674&fit=bounds&quality=75&auto=webp&crop=5000,2812,x0,y0&wmark=nzz",2024-12-04T04:30:00Z,https://web.archive.org/web/20241204055158/https://www.nzz.ch/international/syrien-fall-von-aleppo-ist-rueckschlag-fuer-russland-ld.1860466,"Russland musste zuschauen, wie die einst mit russischer Unterstützung zurückeroberte Stadt Aleppo wieder an die islamistischen Aufständischen fiel.
Bärtige Männer werfen johlend den Mast um, an dem … [+6105 chars]",,de,'Russland'
https://orf.at/stories/3377864/,https://orf.at/stories/3377864/,0,orf.at,Reporter ohne Grenzen ehrt Journalisten aus Gaza und Ukraine,,https://orf.at/mojo/1_4_1/storyserver//news/common/images/og-fallback-news.png,2024-12-04T05:57:56Z,https://web.archive.org/web/20241204085800/https://orf.at/stories/3377864/,"Die Organisation Reporter ohne Grenzen (RSF) ehrt in diesem Jahr Journalisten in Kriegsgebieten für ihre Arbeit.
Den Preis in der Kategorie Wirkung erhielt die ukrainische Journalistin Natalja Humen… [+1636 chars]",,de,'Ukraine'
https://www.spektrum.de/podcast/detektor-fm-dunkelflaute-keine-angst-vor-stromausfall/2245606,https://www.spektrum.de/podcast/detektor-fm-dunkelflaute-keine-angst-vor-stromausfall/2245606,0,www.spektrum.de,Dunkelflaute: Keine Angst vor Stromausfall,"Wenn in Deutschland Dunkelheit und Windflaute zusammenkommen, dann ist in der öffentlichen Debatte schnell von Stromausfällen und Blackouts die Rede. ️",https://static.spektrum.de/fm/912/f1920x1080/GettyImages-1256699784.jpg,2024-12-04T06:13:00Z,https://web.archive.org/web/20241204063250/https://www.spektrum.de/podcast/detektor-fm-dunkelflaute-keine-angst-vor-stromausfall/2245606,"Ein Podcast von 
Die Bundesregierung macht Tempo beim Ausbau der Erneuerbaren Energien: Im ersten Halbjahr 2024 kamen dem Statistischen Bundesamt zufolge 61,5 Prozent des hierzulande erzeugten Strom… [+1452 chars]",,de,'Solar'
https://www.focus.de/kultur/kino_tv/tv-kolumne-markus-lanz-im-zdf-talk-wird-ueberdeutlich-wie-spd-mann-steinbrueck-ueber-den-kanzler-denkt_id_260534631.html,https://www.focus.de/kultur/kino_tv/tv-kolumne-markus-lanz-im-zdf-talk-wird-ueberdeutlich-wie-spd-mann-steinbrueck-ueber-den-kanzler-denkt_id_260534631.html,0,www.focus.de,"TV-Kolumne „Markus Lanz“ - Im ZDF-Talk wird überdeutlich, wie SPD-Mann Steinbrück über den Kanzler denkt",Kanzler Olaf Scholz wird die Diskussion um seine Kanzlerkandidatur immer noch nicht los. Im ZDF-Talk lässt SPD-Mann Peer Steinbrück kein gutes Haar ihm. Scholz‘ Ukraine-Politik bewertet er mit einem verbalen Mittelfinger.Von FOCUS-online-Autor Axel Wolfsgruber,https://p6.focus.de/img/fotos/id_260534620/screenshot-2024-12-04-071652.png?im=Crop%3D%280%2C56%2C1911%2C955%29%3BResize%3D%281200%2C627%29&impolicy=perceptual&quality=mediumHigh&hash=a5baa8e78487421a51af4c7c0aae555d5fc570d3d4613879c98f57a5d630e035,2024-12-04T06:51:33Z,https://web.archive.org/web/20241204085133/https://www.focus.de/kultur/kino_tv/tv-kolumne-markus-lanz-im-zdf-talk-wird-ueberdeutlich-wie-spd-mann-steinbrueck-ueber-den-kanzler-denkt_id_260534631.html,Kanzler Olaf Scholz wird die Diskussion um seine Kanzlerkandidatur immer noch nicht los. Im ZDF-Talk lässt SPD-Mann Peer Steinbrück kein gutes Haar ihm. Scholz Ukraine-Politik bewertet er mit einem v… [+4098 chars],,de,'Ukraine'
https://www.focus.de/politik/deutsche-rueckendeckung-baerbock-haelt-einsatz-der-bundeswehr-in-der-ukraine-fuer-moeglich_id_260534717.html,https://www.focus.de/politik/deutsche-rueckendeckung-baerbock-haelt-einsatz-der-bundeswehr-in-der-ukraine-fuer-moeglich_id_260534717.html,0,www.focus.de,Deutsche Rückendeckung - Baerbock hält Einsatz der Bundeswehr in der Ukraine für möglich,"Bundesaußenministerin Annalena Baerbock bringt bei einem Nato-Treffen in Brüssel den Einsatz deutscher Soldaten zur Friedenssicherung in der Ukraine ins Spiel – vorausgesetzt, es kommt zu einem Waffenstillstand.",https://p6.focus.de/img/politik/ausland/ukraine-krise/id_260494494/baerbock.jpg?im=Crop%3D%280%2C39%2C1024%2C512%29%3BResize%3D%281200%2C627%29&impolicy=perceptual&quality=mediumHigh&hash=fb674af292642649bc16a0085148ef48d08785dc2c0ffaae4081c9feb3cd7ce5,2024-12-04T07:16:22Z,https://web.archive.org/web/20241204072821/https://www.focus.de/politik/deutsche-rueckendeckung-baerbock-haelt-einsatz-der-bundeswehr-in-der-ukraine-fuer-moeglich_id_260534717.html,"Bundesaußenministerin Annalena Baerbock bringt bei einem Nato-Treffen in Brüssel den Einsatz deutscher Soldaten zur Friedenssicherung in der Ukraine ins Spiel vorausgesetzt, es kommt zu einem Waffens… [+1676 chars]",,de,'Ukraine'
https://www.n-tv.de/politik/Merkel-nennt-Punkt-an-dem-ihre-Sicht-auf-Putin-kippte-article25408508.html,https://www.n-tv.de/politik/Merkel-nennt-Punkt-an-dem-ihre-Sicht-auf-Putin-kippte-article25408508.html,0,www.n-tv.de,"Verhandeln mit dem Kremlchef?: Merkel nennt Punkt, an dem ihre Sicht auf Putin kippte",Das Verhältnis von Wladimir Putin und Angela Merkel ist zur Amtszeit der Kanzlerin geprägt von Machtspielen und Lügen. Das sei bei russischen Präsidenten aber nicht von Anfang an so gewesen. Der große Bruch erfolgt mit der Annexion der Krim durch Russland.,https://bilder2.n-tv.de/img/incoming/crop25408541/9391327018-cImg_16_9-w1200/imago75926586.jpg,2024-12-04T07:16:44Z,,Das Verhältnis von Wladimir Putin und Angela Merkel ist zur Amtszeit der Kanzlerin geprägt von Machtspielen und Lügen. Das sei bei russischen Präsidenten aber nicht von Anfang an so gewesen. Der groß… [+1795 chars],,de,'Russland'
https://www.focus.de/politik/deutschland/von-da-an-habe-ich-gewusst-merkel-spricht-ueber-moment-als-sie-in-putin-einen-luegner-erkannte_id_260534733.html,https://www.focus.de/politik/deutschland/von-da-an-habe-ich-gewusst-merkel-spricht-ueber-moment-als-sie-in-putin-einen-luegner-erkannte_id_260534733.html,0,www.focus.de,"„Von da an habe ich gewusst“ - Merkel spricht über Moment, als sie in Putin einen Lügner erkannte","Der russische Präsident Wladimir Putin und seine Gefolgsleute lügen, wo es ihnen passt. Laut Alt-Bundeskanzlerin Angela Merkel war das aber nicht immer so. Sie macht einen konkreten Moment aus, in dem das begann.",https://p6.focus.de/img/politik/ausland/id_180401660/putin-und-merkel-2018-im-garten-von-schloss-meseberg-sie-konnten-sich-wahlweise-auf-deutsch-und-russisch-unterhalten.jpg?im=Crop%3D%280%2C0%2C940%2C470%29%3BResize%3D%281200%2C627%29&impolicy=perceptual&quality=mediumHigh&hash=fb9af0f482261eacf4a7dff2857ce76d14a349ae860991131dcc71418e2d6fc9,2024-12-04T07:26:09Z,https://web.archive.org/web/20241204074504/https://www.focus.de/politik/deutschland/von-da-an-habe-ich-gewusst-merkel-spricht-ueber-moment-als-sie-in-putin-einen-luegner-erkannte_id_260534733.html,"<ul><li>
Kommentare</li><li>
E-Mail</li><li>
Teilen</li><li>
Mehr</li><li>
Twitter</li><li>
Drucken</li><li>
Feedback</li><li>
Fehler meldenSie haben einen Fehler gefunden?
Bitte markieren S… [+2301 chars]",,de,'Putin'
https://www.tagesspiegel.de/internationales/altkanzlerin-spricht-bei-cnn-uber-putin-lugen-uber-krim-waren-fur-merkel-ein-wendepunkt-12815129.html,https://www.tagesspiegel.de/internationales/altkanzlerin-spricht-bei-cnn-uber-putin-lugen-uber-krim-waren-fur-merkel-ein-wendepunkt-12815129.html,0,www.tagesspiegel.de,Altkanzlerin spricht bei CNN über Putin : Lügen über Krim waren für Merkel ein Wendepunkt,Mit ihren Memoiren ist die ehemalige Bundeskanzlerin auch in den USA unterwegs – und erzählt in Interviews von ihrer Zeit als deutsche Regierungschefin. Auch über Putin hat sie was zu sagen.,https://www.tagesspiegel.de/images/12815555/alternates/BASE_16_9_W1400/1733297833000/merkel-uber-putin-lugen-uber-krim-waren-wendepunkt.jpeg,2024-12-04T07:38:21Z,https://web.archive.org/web/20241204092034/http://www.tagesspiegel.de/internationales/altkanzlerin-spricht-bei-cnn-uber-putin-lugen-uber-krim-waren-fur-merkel-ein-wendepunkt-12815129.html,Die frühere Bundeskanzlerin Angela Merkel hat Kremlchef Wladimir Putin eigenen Worten nach nicht von Anfang als dreisten Lügner wahrgenommen. Zu Beginn ihrer Zeit als Bundeskanzlerin habe Putin nicht… [+2066 chars],,de,'Putin'
https://www.zeit.de/news/2024-12/04/moskau-sieht-ukrainische-spur-in-syrienkonflikt,https://www.zeit.de/news/2024-12/04/moskau-sieht-ukrainische-spur-in-syrienkonflikt,0,www.zeit.de,Krieg in Syrien: Moskau sieht ukrainische Spur in Syrienkonflikt,Hier finden Sie Informationen zu dem Thema „Krieg in Syrien“. Lesen Sie jetzt „Moskau sieht ukrainische Spur in Syrienkonflikt“.,https://img.zeit.de/news/2024-12/04/moskau-sieht-ukrainische-spur-in-syrienkonflikt-image-group/wide__1300x731,2024-12-04T10:18:54Z,,"Russland hat der Ukraine die Schuld an der Eskalation des Bürgerkriegs in Syrien gegeben. «Wir machen darauf aufmerksam, dass es unter den ausländischen Kämpfern, worunter auch viele im postsowjetisc… [+1663 chars]",,de,'Krieg'
https://www.zeit.de/news/2024-12/04/schwarzer-und-wagenknecht-mit-neuem-friedensappell,https://www.zeit.de/news/2024-12/04/schwarzer-und-wagenknecht-mit-neuem-friedensappell,0,www.zeit.de,Krieg und Frieden: Schwarzer und Wagenknecht mit neuem Friedensappell,Hier finden Sie Informationen zu dem Thema „Krieg und Frieden“. Lesen Sie jetzt „Schwarzer und Wagenknecht mit neuem Friedensappell“.,https://img.zeit.de/news/2024-12/04/schwarzer-und-wagenknecht-mit-neuem-friedensappell-image-group/wide__1300x731,2024-12-04T10:29:20Z,,Knapp zwei Jahre nach ihrem «Manifest für Frieden» startet Parteigründerin Sahra Wagenknecht mit der Autorin Alice Schwarzer und 36 Unterstützern einen neuen Appell für einen Waffenstillstand in der … [+2122 chars],,de,'Krieg'
https://www.zeit.de/politik/deutschland/2024-12/ukraine-politik-deutschland-taurus-spd-cdu-wahlkampf,https://www.zeit.de/politik/deutschland/2024-12/ukraine-politik-deutschland-taurus-spd-cdu-wahlkampf,0,www.zeit.de,Ukraine Politik: Die Angst vor der Angst,"Die SPD attackiert Friedrich Merz in der Taurus-Frage. Und der CDU-Chef? Knickt ein. So wird das nichts mit ""Frieden durch Abschreckung"".",https://img.zeit.de/politik/deutschland/2024-12/ukraine-politik-deutschland-taurus-spd-cdu-wahlkampf-bild/wide__1300x731,2024-12-04T15:58:08Z,http://archive.md/20241204160055/https://www.zeit.de/politik/deutschland/2024-12/ukraine-politik-deutschland-taurus-spd-cdu-wahlkampf,"Wie ein Befreiungsschlag hatte es gewirkt, als Friedrich Merz kürzlich im Bundestag zum Marschflugkörper Taurus sprach. ""Ich möchte Ihnen hier einen Vorschlag machen"", hatte der CDU-Oppositionsführer… [+605 chars]",,de,'Ukraine'
https://www.zeit.de/news/2024-12/04/merz-wirbt-fuer-staerke-gegenueber-russland,https://www.zeit.de/news/2024-12/04/merz-wirbt-fuer-staerke-gegenueber-russland,0,www.zeit.de,Verteidigung: Merz wirbt für Stärke gegenüber Russland,Hier finden Sie Informationen zu dem Thema „Verteidigung“. Lesen Sie jetzt „Merz wirbt für Stärke gegenüber Russland“.,https://img.zeit.de/news/2024-12/04/merz-wirbt-fuer-staerke-gegenueber-russland-image-group/wide__1300x731,2024-12-04T18:20:18Z,,"Unions-Kanzlerkandidat Friedrich Merz hat angesichts des russischen Angriffskrieges gegen die Ukraine für größere europäische Stärke geworben. «Wir müssen uns verteidigen können, damit wir uns nicht … [+2214 chars]",,de,'Russland'
https://www.zeit.de/news/2024-12/04/muetzenich-gespraeche-mit-putin-keine-scheinverhandlungen,https://www.zeit.de/news/2024-12/04/muetzenich-gespraeche-mit-putin-keine-scheinverhandlungen,0,www.zeit.de,"Krieg in der Ukraine: Mützenich: Gespräche mit Putin keine ""Scheinverhandlungen""","Hier finden Sie Informationen zu dem Thema „Krieg in der Ukraine“. Lesen Sie jetzt „Mützenich: Gespräche mit Putin keine ""Scheinverhandlungen""“.",https://img.zeit.de/news/2024-12/04/muetzenich-gespraeche-mit-putin-keine-scheinverhandlungen-image-group/wide__1300x731,2024-12-04T19:02:58Z,,SPD-Fraktionschef Rolf Mützenich hat für noch stärkere diplomatische Bemühungen um ein Ende des russischen Angriffskriegs gegen die Ukraine geworben. «Nach drei Jahren des Krieges müssen wir anerkenn… [+2257 chars],,de,'Putin'
https://www.zeit.de/news/2024-12/04/merz-nennt-gedankenspiele-baerbocks-unverantwortlich,https://www.zeit.de/news/2024-12/04/merz-nennt-gedankenspiele-baerbocks-unverantwortlich,0,www.zeit.de,Krieg in der Ukraine: Merz nennt Gedankenspiele Baerbocks unverantwortlich,Hier finden Sie Informationen zu dem Thema „Krieg in der Ukraine“. Lesen Sie jetzt „Merz nennt Gedankenspiele Baerbocks unverantwortlich“.,https://img.zeit.de/news/2024-12/04/merz-nennt-gedankenspiele-baerbocks-unverantwortlich-image-group/wide__1300x731,2024-12-04T22:01:07Z,,"Unions-Kanzlerkandidat Friedrich Merz hat scharfe Kritik an Gedankenspielen von Außenministerin Annalena Baerbock geübt, die Bundeswehr im Falle eines Waffenstillstands zur Friedenssicherung in der U… [+882 chars]",,de,'Ukraine'
https://www.zeit.de/politik/ausland/2024-12/sergej-lawrow-malta-eu-osze,https://www.zeit.de/politik/ausland/2024-12/sergej-lawrow-malta-eu-osze,0,www.zeit.de,OSZE: Sergej Lawrow reist erstmals seit Kriegsbeginn in die EU,"Eigentlich darf Russlands Außenminister wegen des Angriffs auf die Ukraine nicht in die EU einreisen. Zum OSZE-Treffen in Malta darf er aber, anders als seine Sprecherin.",https://img.zeit.de/politik/ausland/2024-12/sergej-lawrow-osze-malta/wide__1300x731,2024-12-05T00:57:44Z,https://web.archive.org/web/20241205013741/https://www.zeit.de/politik/ausland/2024-12/sergej-lawrow-malta-eu-osze,"Erstmals seit Beginn von Russlands Angriffskrieg gegen die Ukraine ist der russische Außenminister Sergej Lawrow in einem EU-Land eingetroffen. Er landete in Valletta, der Hauptstadt von Malta, um an… [+1781 chars]",,de,'Russland'
https://www.zeit.de/politik/deutschland/2024-12/ukraine-bundeswehr-auslandseinsatz-waffenstillstand-friedrich-merz-annalena-baerbock,https://www.zeit.de/politik/deutschland/2024-12/ukraine-bundeswehr-auslandseinsatz-waffenstillstand-friedrich-merz-annalena-baerbock,0,www.zeit.de,Ukraine: Merz kritisiert Baerbocks Aussagen zu möglichem Friedenseinsatz,Soll die Bundeswehr bei einem Waffenstillstand in der Ukraine den Frieden sichern? Diesen Vorstoß von Außenministerin Baerbock findet Merz unverantwortlich.,https://img.zeit.de/politik/deutschland/2024-12/ukraine-bundeswehr-auslandseinsatz-waffenstillstand-friedrich-merz-annalena-baerbock-bild/wide__1300x731,2024-12-05T02:30:03Z,,"Unions-Kanzlerkandidat Friedrich Merz hat Gedankenspiele von Außenministerin Annalena Baerbock heftig kritisiert, die Bundeswehr im Falle eines Waffenstillstands zur Friedenssicherung in der Ukraine … [+4784 chars]",,de,'Ukraine'
https://www.tagesschau.de/inland/innenpolitik/gruene-oezdemir-tuerkische-nationalisten-100.html,https://www.tagesschau.de/inland/innenpolitik/gruene-oezdemir-tuerkische-nationalisten-100.html,0,www.tagesschau.de,Özdemir schildert Drohungen durch türkische Nationalisten,Bundesminister Özdemir berichtet von Anfeindungen türkischer Nationalisten gegen sich uns seine Familie. Die Sicherheitsbehörden hätten auf die Bedrohung - die seit der Armenien-Resolution 2016 bestehe - zu spät reagiert.,https://images.tagesschau.de/image/58b1a83c-1c33-4d55-a436-75c0b9056bf2/AAABk5WJvmE/AAABkZLhkrw/16x9-1280/cem-oezdemir-122.jpg,2024-12-05T06:36:01Z,https://web.archive.org/web/20241205063917/https://www.tagesschau.de/inland/innenpolitik/gruene-oezdemir-tuerkische-nationalisten-100.html,"Stand: 05.12.2024 07:36 Uhr
Bundesminister Özdemir berichtet von Anfeindungen türkischer Nationalisten gegen sich uns seine Familie. Die Sicherheitsbehörden hätten auf die Bedrohung - die seit der A… [+2488 chars]",,de,'Bedrohung'
https://t3n.de/news/9-ganz-legale-tipps-um-in-diesem-jahr-noch-steuern-zu-sparen-1661661/,https://t3n.de/news/9-ganz-legale-tipps-um-in-diesem-jahr-noch-steuern-zu-sparen-1661661/,0,t3n.de,"9 ganz legale Tipps, um in diesem Jahr noch Steuern zu sparen","Mit ein paar cleveren Schritten können Steuerzahler bis Jahresende noch ordentlich Geld sparen – oder staatliche Zuschüsse mitnehmen. So geht ihr es an. Steuern sparen – das klingt nach einer komplizierten, zeitaufwendigen Sache, die man besser Profis überläs…",https://t3n.de/news/wp-content/uploads/2023/11/Geld-Geldbeutel-500-Euro.jpg,2024-12-05T07:35:31Z,,"Steuern sparen das klingt nach einer komplizierten, zeitaufwendigen Sache, die man besser Profis überlässt. Doch wer sich ein wenig mit den Möglichkeiten auseinandersetzt, kann das auch ganz ohne fre… [+8077 chars]",,de,'Hohe Kosten'
https://www.n-tv.de/wirtschaft/Marokkos-Wirtschaft-wartet-auf-den-grossen-Kick-article25410723.html,https://www.n-tv.de/wirtschaft/Marokkos-Wirtschaft-wartet-auf-den-grossen-Kick-article25410723.html,0,www.n-tv.de,"Solar, Wind und die WM 2030: Marokkos Wirtschaft wartet auf den großen Kick",Marokko ist nah dran an Europa. Kurze Wege und viel Sonne machen das Land zu einem guten Energiepartner. Doch Marokko setzt nicht nur auf grünen Wasserstoff. Auch die Fußball-WM 2030 pusht die Wirtschaft - wie spielen wir mit?,https://bilder1.n-tv.de/img/incoming/crop25410736/5361322905-cImg_16_9-w1200/89572307.jpg,2024-12-05T08:00:00Z,,Marokko ist nah dran an Europa. Kurze Wege und viel Sonne machen das Land zu einem guten Energiepartner. Doch Marokko setzt nicht nur auf grünen Wasserstoff. Auch die Fußball-WM 2030 pusht die Wirtsc… [+3609 chars],,de,'Solar'
