index,url,valid,domain,title,description,image,published,archive,content,quote,language,keyword
https://www.tagesschau.de/ausland/europa/russland-extremismusgesetz-100.html,https://www.tagesschau.de/ausland/europa/russland-extremismusgesetz-100.html,0,www.tagesschau.de,Umstrittenes Extremismusgesetz tritt in Russland in Kraft,"In Russland ist die Internetsuche nach ""extremistischen Inhalten"" ab heute strafbar. Dazu gehören Recherchen zu LGBTQI, Beiträge zur Opposition oder das Abspielen bestimmter Musik. Die Meinungsfreiheit wird damit weiter eingeschränkt. Von Stefanie Markert.",https://images.tagesschau.de/image/c797ced1-03d7-4ed1-a8aa-2723cedc47bb/AAABmQAEKxc/AAABmKJZ-0g/16x9-big/duma-parlament-russland-100.jpg?width=1280,2025-09-01T03:15:13Z,,"Stand: 01.09.2025 05:15 Uhr
In Russland ist die Internetsuche nach ""extremistischen Inhalten"" ab heute strafbar. Dazu gehören Recherchen zu LGBTQI, Beiträge zur Opposition oder das Abspielen bestimm… [+3662 chars]",,de,'Russland'
https://www.zeit.de/politik/2025-08/hamas-gaza-israel-krieg-nachrichtenpodcast,https://www.zeit.de/politik/2025-08/hamas-gaza-israel-krieg-nachrichtenpodcast,0,www.zeit.de,Hamas: Was von der Hamas noch übrig ist,"In Gaza kämpft die Bevölkerung ums Überleben, während Israel den Krieg fortsetzt. Aber die Terrororganisation Hamas verschwindet nicht. Und: NRW vor den Kommunalwahlen",https://img.zeit.de/politik/2017-09/illu-podcast-news/wide__8ed8a6__1300x731,2025-09-01T03:58:13Z,,"Seit knapp zwei Jahren herrscht Krieg im Gazastreifen. Zehntausende Menschen sind gestorben. Fast zwei Millionen Menschen leiden weiterhin unter der extremen Hungersnot und versuchen, in dem kleinen … [+1653 chars]",,de,'Krieg'
https://www.zeit.de/news/2025-09/01/spahn-und-miersch-ueberraschend-gemeinsam-in-der-ukraine,https://www.zeit.de/news/2025-09/01/spahn-und-miersch-ueberraschend-gemeinsam-in-der-ukraine,0,www.zeit.de,Krieg in der Ukraine: Spahn und Miersch überraschend gemeinsam in der Ukraine,Hier finden Sie Informationen zu dem Thema „Krieg in der Ukraine“. Lesen Sie jetzt „Spahn und Miersch überraschend gemeinsam in der Ukraine“.,https://img.zeit.de/news/2025-09/01/spahn-und-miersch-ueberraschend-gemeinsam-in-der-ukraine-image-group/wide__1300x731,2025-09-01T05:01:04Z,,"Die Vorsitzenden der beiden Koalitionsfraktionen, Jens Spahn (CDU/CSU) und Matthias Miersch (SPD), sind zu einem gemeinsamen Solidaritätsbesuch in der von Russland angegriffenen Ukraine eingetroffen.… [+220 chars]",,de,'Krieg'
https://www.n-tv.de/politik/Soeder-ruft-nach-harten-Reformen-im-Sozialbereich-article26000791.html,https://www.n-tv.de/politik/Soeder-ruft-nach-harten-Reformen-im-Sozialbereich-article26000791.html,0,www.n-tv.de,"Mehr Arbeit, weniger Ansprüche: Söder ruft nach ""harten Reformen"" im Sozialbereich","Seit Monaten tobt eine Debatte über die Kosten für die sozialen Sicherungssysteme. Die schwarz-rote Bundesregierung möchte mit einer Reform Geld sparen. Wie soll diese aussehen? Offen. Für CSU-Chef Söder ist dennoch klar: ""Das Bürgergeld muss komplett geänder…",https://www.n-tv.de/img/incoming/crop26000813/9881323383-cImg_16_9-w1200/542996603.jpg,2025-09-01T05:42:36Z,,Seit Monaten tobt eine Debatte über die Kosten für die sozialen Sicherungssysteme. Die schwarz-rote Bundesregierung möchte mit einer Reform Geld sparen. Wie soll diese aussehen? Offen. Für CSU-Chef S… [+3032 chars],,de,'Geld sparen'
https://www.welt.de/politik/ausland/video68b55f45cf33b514cb80dda3/afghanen-flugzeug-sie-fluechten-nicht-vor-dem-regime-sie-fluechten-vor-der-armut.html,https://www.welt.de/politik/ausland/video68b55f45cf33b514cb80dda3/afghanen-flugzeug-sie-fluechten-nicht-vor-dem-regime-sie-fluechten-vor-der-armut.html,0,www.welt.de,"„Sie flüchten nicht vor dem Regime, sie flüchten vor der Armut“","Ein weiterer Flug mit Afghanen aus Pakistan landet in Hannover. Die meisten Passagiere sind keine Ortskräfte, sondern Angehörige. Zudem „gibt es keinen belegten Fall, dass ehemalige Ortskräfte umgebracht oder ins Gefängnis gesteckt wurden“, sagt Afghanistan-E…",https://images.welt.de/68b55f45cf33b514cb80dda3/f38d80ad5d0e6678d7540bc5964a6b8e-master/ci16x9-w1200/symbolbild-abschiebung,2025-09-01T09:15:59Z,,"Ein weiterer Flug mit Afghanen aus Pakistan landet in Hannover. Die meisten Passagiere sind keine Ortskräfte, sondern Angehörige. Zudem gibt es keinen belegten Fall, dass ehemalige Ortskräfte umgebra… [+142 chars]",,de,'Armut'
https://www.faz.net/aktuell/wirtschaft/unternehmen/mittelstaendler-sterben-still-steigende-kosten-und-strenge-auflagen-accg-110661461.html,https://www.faz.net/aktuell/wirtschaft/unternehmen/mittelstaendler-sterben-still-steigende-kosten-und-strenge-auflagen-accg-110661461.html,0,www.faz.net,Unternehmen in der Krise: Mittelständler sterben still,Inflation und Bürokratie setzen den Mittelstand unter Druck. ZGV-Präsident Althaus fordert Entlastungen und warnt vor einem Innovationsrückstand.,https://media0.faz.net/ppmedia/w1200/aktuell/2246384366/1.10661460/facebook_teaser/guenter-althaus-ist-praesident.jpg.webp,2025-09-01T09:25:27Z,,"Günter Althaus will den Bürokratieabbau zur Chefsache machen. Seit Mai ist er Präsident des Mittelstandsverbunds ZGV. Bürokratie killt die Leistung, sagt Althaus, der auch Vorstandsvorsitzender der R… [+340 chars]",,de,'Inflation'
https://www.zeit.de/news/2025-09/01/flugzeug-mit-von-der-leyen-wird-ziel-von-gps-stoerung,https://www.zeit.de/news/2025-09/01/flugzeug-mit-von-der-leyen-wird-ziel-von-gps-stoerung,0,www.zeit.de,EU: Flugzeug mit von der Leyen wird Ziel von GPS-Störung,Hier finden Sie Informationen zu dem Thema „Russland unter Verdacht“. Lesen Sie jetzt „Flugzeug mit von der Leyen wird Ziel von GPS-Störung“.,https://img.zeit.de/news/2025-09/01/flugzeug-mit-von-der-leyen-wird-ziel-von-gps-stoerung-image-group/wide__1300x731,2025-09-01T10:23:55Z,https://web.archive.org/web/20250901110830/https://www.zeit.de/news/2025-09/01/flugzeug-mit-von-der-leyen-wird-ziel-von-gps-stoerung,"Ein Flugzeug mit EU-Kommissionspräsidentin Ursula von der Leyen an Bord ist mutmaßlich Ziel einer absichtlichen Störung des satellitenbasierten Navigationssystems GPS durch Russland geworden.
«Wir k… [+1602 chars]",,de,'Russland'
https://www.tagesspiegel.de/internationales/wurde-vom-westen-provoziert-putin-gibt-nato-staaten-auf-soz-gipfel-in-tianjin-schuld-am-ukrainekrieg-14256476.html,https://www.tagesspiegel.de/internationales/wurde-vom-westen-provoziert-putin-gibt-nato-staaten-auf-soz-gipfel-in-tianjin-schuld-am-ukrainekrieg-14256476.html,0,www.tagesspiegel.de,„Wurde vom Westen provoziert“ : Putin gibt Nato-Staaten auf SOZ-Gipfel in Tianjin Schuld am Ukrainekrieg,"Das Gipfeltreffen der Shanghaier Organisation für Zusammenarbeit wird mit harscher Kritik eröffnet. Putin schießt verbal gegen den Westen, Xi Jinping sieht derweil die Weltordnung gefährdet.",https://www.tagesspiegel.de/images/14256839/alternates/BASE_16_9_W1400/1756723009000/russian-president-putin-and-indian-prime-minister-modi-meet-at-sco-summit-in-tianjin.jpeg,2025-09-01T10:38:56Z,,Kremlchef Wladimir Putin hat sich auf bei der Eröffnung des Gipfeltreffens der Shanghaier Organisation für Zusammenarbeit (SOZ) harsche Kritik an Nato-Staaten geübt. Konkret beschuldigte er den Weste… [+6183 chars],,de,'Putin'
https://www.tagesspiegel.de/internationales/putin-will-uns-alle-vernichten-wie-lebt-es-sich-in-einer-stadt-die-russland-an-sich-reissen-will-14234840.html,https://www.tagesspiegel.de/internationales/putin-will-uns-alle-vernichten-wie-lebt-es-sich-in-einer-stadt-die-russland-an-sich-reissen-will-14234840.html,0,www.tagesspiegel.de,"„Putin will uns alle vernichten“: Wie lebt es sich in einer Stadt, die Russland an sich reißen will?","Kramatorsk zählt zu den letzten Großstädten, die die Ukraine im Donbass noch kontrolliert. Nun will Moskau die Kapitulation erzwingen. Ein Besuch bei Menschen, für die es um alles geht.",https://www.tagesspiegel.de/images/14239121/alternates/BASE_16_9_W1400/1756372315000/russia-strikes-the-kramatorsk-community-ukraine.jpeg,2025-09-01T11:04:30Z,http://archive.md/20250901111246/https://www.tagesspiegel.de/internationales/putin-will-uns-alle-vernichten-wie-lebt-es-sich-in-einer-stadt-die-russland-an-sich-reissen-will-14234840.html,"Kramatorsk zählt zu den letzten Großstädten, die die Ukraine im Donbass noch kontrolliert. Nun will Moskau die Kapitulation erzwingen. Ein Besuch bei Menschen, für die es um alles geht.",,de,'Putin'
https://www.stern.de/news/serbiens-praesident-vucic-reist-fuer-treffen-mit-xi-und-putin-nach-china-36018662.html,https://www.stern.de/news/serbiens-praesident-vucic-reist-fuer-treffen-mit-xi-und-putin-nach-china-36018662.html,0,www.stern.de,Serbiens Präsident Vucic reist für Treffen mit Xi und Putin nach China,"Serbiens Präsident Alexander Vucic wird am Dienstag nach China reisen, um dort in Peking mit den Präsidenten Chinas und Russlands, Xi Jinping und Wladimir Putin, zusammenzukommen. Wie Vucics Büro am Montag mitteilte, wird das serbische Staatsoberhaupt zudem a…",https://image.stern.de/36018664/t/6p/v1/w1440/r1.7778/-/01--vucic---382bd55ddb9e1ac6.jpg,2025-09-01T11:35:37Z,,"Kopiere den aktuellen Link
Zur Merkliste hinzufügen
Serbiens Präsident Alexander Vucic wird am Dienstag nach China reisen, um dort in Peking mit den Präsidenten Chinas und Russlands, Xi Jinping und… [+2189 chars]",,de,'Putin'
https://www.focus.de/politik/ausland/selenskyj-kuendigt-neue-angriffe-in-russland-an-und-enthuellt-putins-schmerzhafte-verluste_e51731bf-3e29-441c-b71f-78a80f26ab14.html,https://www.focus.de/politik/ausland/selenskyj-kuendigt-neue-angriffe-in-russland-an-und-enthuellt-putins-schmerzhafte-verluste_e51731bf-3e29-441c-b71f-78a80f26ab14.html,0,www.focus.de,Selenskyj kündigt neue Angriffe in Russland an - und enthüllt Putins schmerzhafte Verluste,Die Ukraine könnte weitere Angriffe tief in russischem Gebiet planen. Präsident Selenskyj betont die Bereitschaft der Streitkräfte und berichtet von der Lage an der Front.,https://quadro.burda-forward.de/ctf/81084fb9-cadd-40b5-8bd6-52c56181dc28.732f0f16-e9bc-486e-9303-aac7e5e11864.jpg?im=RegionOfInterestCrop%3D%281200%2C630%29%2CregionOfInterest%3D%281437%2C1037%29&hash=519fd8a833a327e1d653393830f388c97de9b16b1241a22765783c98b199af0c,2025-09-01T11:50:50Z,,"Der ukrainische Präsident Wolodymyr Selenskyj hat sich kürzlich mit dem Oberbefehlshaber der Streitkräfte, Oleksandr Syrskyj, getroffen. Dabei ging es laut RBC Ukraine vor allem um die Planung neuer … [+2320 chars]",,de,'Russland'
https://orf.at/stories/3404177/,https://orf.at/stories/3404177/,0,orf.at,Gipfeltreffen: Xi und Putin werben für neue Weltordnung,,https://orf.at/mojo/1_4_1/storyserver//news/common/images/og-fallback-news.png,2025-09-01T12:08:41Z,https://web.archive.org/web/20250901122904/https://orf.at/stories/3404177/,"Chinas Präsident Xi Jinping und der russische Staatschef Wladimir Putin haben auf einem Gipfel heute ihre Vision einer neuen globalen Sicherheits- und Wirtschaftsordnung vorangetrieben, die den Globa… [+1162 chars]",,de,'Putin'
https://www.welt.de/videos/video68b58c09cf33b514cb80e198/welt-spezial-sie-fluechten-nicht-vor-dem-regime-sie-fluechten-vor-armut-streit-um-neuen-afghanen-flieger.html,https://www.welt.de/videos/video68b58c09cf33b514cb80e198/welt-spezial-sie-fluechten-nicht-vor-dem-regime-sie-fluechten-vor-armut-streit-um-neuen-afghanen-flieger.html,0,www.welt.de,"„Sie flüchten nicht vor dem Regime, sie flüchten vor Armut“ – Streit um neuen Afghanen-Flieger","Ein weiterer Flug mit Afghanen aus Pakistan landet in Hannover. Aber erneut sind die meisten Passagiere keine Ortskräfte, die etwa für die Bundeswehr am Hindukusch tätig waren, sondern Angehörige. Sehen Sie ein WELT Spezial.",https://images.welt.de/68b58c09cf33b514cb80e198/f38d80ad5d0e6678d7540bc5964a6b8e-master/ci16x9-w1200/symbolbild-abschiebung,2025-09-01T12:22:35Z,,"Ein weiterer Flug mit Afghanen aus Pakistan landet in Hannover. Aber erneut sind die meisten Passagiere keine Ortskräfte, die etwa für die Bundeswehr am Hindukusch tätig waren, sondern Angehörige. Se… [+84 chars]",,de,'Armut'
https://www.stern.de/news/putin-nutzt-soz-gipfel-in-china-fuer-zahlreiche-bilaterale-gespraeche-36017278.html,https://www.stern.de/news/putin-nutzt-soz-gipfel-in-china-fuer-zahlreiche-bilaterale-gespraeche-36017278.html,0,www.stern.de,Putin nutzt SOZ-Gipfel in China für zahlreiche bilaterale Gespräche,Roter Teppich für Wladimir Putin: Russlands vom Westen weitgehend isolierter Präsident hat eine von Chinas Staatschef Xi Jinping bereitete Bühne für zahlreiche Gespräche genutzt. Am Rande des Gipfeltreffens der Shanghaier Organisation für Zusammenarbeit (SOZ)…,https://image.stern.de/36019076/t/ie/v1/w1440/r1.7778/-/01--wladimir-putin-und-xi-jinping-in-tianjin---92d9ae3469b3e97b.jpg,2025-09-01T12:49:41Z,https://web.archive.org/web/20250901183759/https://www.stern.de/news/putin-nutzt-soz-gipfel-in-china-fuer-zahlreiche-bilaterale-gespraeche-36017278.html,"Kopiere den aktuellen Link
Zur Merkliste hinzufügen
Roter Teppich für Wladimir Putin: Russlands vom Westen weitgehend isolierter Präsident hat eine von Chinas Staatschef Xi Jinping bereitete Bühne … [+4268 chars]",,de,'Russland'
https://www.focus.de/politik/ausland/russland-insider-packt-aus-darum-ist-putin-trump-und-europa-aktuell-ueberlegen_241a047b-e41d-44bb-a87b-1ff18aa16d6b.html,https://www.focus.de/politik/ausland/russland-insider-packt-aus-darum-ist-putin-trump-und-europa-aktuell-ueberlegen_241a047b-e41d-44bb-a87b-1ff18aa16d6b.html,0,www.focus.de,Russland-Insider packt aus - darum ist Putin Trump und Europa aktuell überlegen,"Der russische Ex-Diplomat Bondarew glaubt, dass Verhandlungen, Sanktionen und Angriffe Russland wenig beeindrucken. Putin ist in ""vielem klüger"".",https://quadro.burda-forward.de/ctf/576658b0-5fc8-4c6c-bdb1-79aeb031b219.ca45d20c-a6bb-4d56-a19a-e331a4e5d0b2.png?im=RegionOfInterestCrop%3D%281200%2C630%29%2CregionOfInterest%3D%281325%2C608%29&hash=861285c4f918727c09044dd6fb151b357cc3ff9f4de181f9883e39ba3d31b278,2025-09-01T12:50:12Z,,"Der ins Exil geflüchtete russische Ex-Diplomat Boris Bondarew warnt davor, Wladimir Putin weiterhin zu unterschätzen - gerade intellektuell. US-Präsident Donald Trump und den europäischen Ländern war… [+2953 chars]",,de,'Putin'
https://www.diepresse.com/20049750/neue-plaene-mit-eingefrorenem-russischem-vermoegen,https://www.diepresse.com/20049750/neue-plaene-mit-eingefrorenem-russischem-vermoegen,0,www.diepresse.com,Neue Pläne mit eingefrorenem russischem Vermögen [premium],Die meisten EU-Staaten – allen voran Frankreich und Deutschland – wollen die wirtschaftlichen Sanktionen gegen Moskau ausweiten. Doch Putin versucht dies erneut zu unterwandern.,https://img.diepresse.com/public/incoming/o45t7i-EU-FOREIGN/alternates/DPR_SOCIAL_NACHRICHTEN/EU-FOREIGN,2025-09-01T12:54:36Z,,"Angesichts der anhaltenden Angriffe gegen ukrainische Zivilisten und den bisher gescheiterten Friedensbemühungen drängen einige EU-Staaten, allen voran Frankreich, Deutschland und die baltischen Staa… [+3522 chars]",,de,'Putin'
https://www.stern.de/politik/ausland/ueberraschende-reise--koalitionsspitzen-gemeinsam-zu-solidaritaetsbesuch-in-kiew-36017374.html,https://www.stern.de/politik/ausland/ueberraschende-reise--koalitionsspitzen-gemeinsam-zu-solidaritaetsbesuch-in-kiew-36017374.html,0,www.stern.de,Überraschende Reise: Koalitionsspitzen gemeinsam zu Solidaritätsbesuch in Kiew,So eine Reise deutscher Spitzenpolitiker nach Kiew gab es noch nie: Die Chefs der Regierungsfraktionen demonstrieren gemeinsam Solidarität mit der Ukraine. Der Besuch hat aber noch einen Nebeneffekt.,https://image.stern.de/36019080/t/cC/v1/w1440/r1.7778/-/01--g2ehdeaq67v7axs2048jpeg---a4906cf20f5f2a58.jpg,2025-09-01T12:58:39Z,,"Kopiere den aktuellen Link
Zur Merkliste hinzufügen
So eine Reise deutscher Spitzenpolitiker nach Kiew gab es noch nie: Die Chefs der Regierungsfraktionen demonstrieren gemeinsam Solidarität mit de… [+6188 chars]",,de,'Ukraine'
https://www.stern.de/news/bundeswehr-sieht--aggressives-verhalten--russlands-in-ostsee---marineuebung-gestartet-36019168.html,https://www.stern.de/news/bundeswehr-sieht--aggressives-verhalten--russlands-in-ostsee---marineuebung-gestartet-36019168.html,0,www.stern.de,"Bundeswehr sieht ""aggressives Verhalten"" Russlands in Ostsee - Marineübung gestartet","Die Bundeswehr warnt vor zunehmend bedrohlicheren militärischen Aktionen Russlands in der Ostsee. Bundeswehr-Generalinspekteur Carsten Breuer sprach am Montag in Berlin von einem ""aggressiven Verhalten Russlands"", mit dem Gebietsansprüche untermauert werden s…",https://image.stern.de/36019170/t/I2/v1/w1440/r1.7778/-/01--carsten-breuer---0f950b5281467d79.jpg,2025-09-01T13:12:01Z,,"Kopiere den aktuellen Link
Zur Merkliste hinzufügen
Die Bundeswehr warnt vor zunehmend bedrohlicheren militärischen Aktionen Russlands in der Ostsee. Bundeswehr-Generalinspekteur Carsten Breuer spr… [+1947 chars]",,de,'Putin'
https://www.welt.de/politik/ausland/article68b55c1acf33b514cb80dd59/wadephul-in-indien-tow-online-haken-warum-sich-europa-nicht-an-trumps-strafzoellen-beteiligt.html,https://www.welt.de/politik/ausland/article68b55c1acf33b514cb80dd59/wadephul-in-indien-tow-online-haken-warum-sich-europa-nicht-an-trumps-strafzoellen-beteiligt.html,0,www.welt.de,Warum sich Europa nicht an Trumps Strafzöllen beteiligt,Billiges russisches Öl lässt die indische Wirtschaft florieren – und die Einnahmen füllen Putins Kriegskasse. US-Präsident Trump ordnete Strafzölle an. Außenminister Johann Wadephul verfolgt bei seinem Besuch in Indien aber eigene Pläne.,https://images.welt.de/68b55c1acf33b514cb80dd59/fcab0df7c22c922957bdea57dd6b7e55/ci16x9-w1200/shanghai-cooperation-organization-sco-summit-2025-in-tianjin,2025-09-01T13:26:15Z,,Billiges russisches Öl lässt die indische Wirtschaft florieren und die Einnahmen füllen Putins Kriegskasse. US-Präsident Trump ordnete Strafzölle an. Außenminister Johann Wadephul verfolgt bei seinem… [+5952 chars],,de,'Krieg'
https://www.stern.de/news/teilnehmer-von-soz-gipfeltreffen-verurteilen-hohe-opferzahl-im-gazastreifen-36019272.html,https://www.stern.de/news/teilnehmer-von-soz-gipfeltreffen-verurteilen-hohe-opferzahl-im-gazastreifen-36019272.html,0,www.stern.de,Teilnehmer von SOZ-Gipfeltreffen verurteilen hohe Opferzahl im Gazastreifen,"Die Shanghaier Organisation für Zusammenarbeit (SOZ) hat die humanitäre Lage im Gazastreifen scharf verurteilt. Ihre Mitgliedstaaten, darunter China, Russland, Indien und der Iran, würden die ""Handlungen, die zivile Opfer und humanitäre Katastrophen im Gazast…",https://image.stern.de/36019274/t/NN/v1/w1440/r1.7778/-/01--gruppenfoto-beim-sozgipfel-in-tianjin---5a5815cd51676742.jpg,2025-09-01T13:30:52Z,https://web.archive.org/web/20250902205756/https://www.stern.de/news/teilnehmer-von-soz-gipfeltreffen-verurteilen-hohe-opferzahl-im-gazastreifen-36019272.html,"Kopiere den aktuellen Link
Zur Merkliste hinzufügen
Die Shanghaier Organisation für Zusammenarbeit (SOZ) hat die humanitäre Lage im Gazastreifen scharf verurteilt. Ihre Mitgliedstaaten, darunter Ch… [+1660 chars]",,de,'Russland'
https://www.welt.de/politik/ausland/article68b1410cadc6ba5d53cb04da/Ukraine-Krieg-Putin-schaut-auf-uns-Nato-probt-Verteidigung-mit-8000-Soldaten-Liveticker.html,https://www.welt.de/politik/ausland/article68b1410cadc6ba5d53cb04da/Ukraine-Krieg-Putin-schaut-auf-uns-Nato-probt-Verteidigung-mit-8000-Soldaten-Liveticker.html,0,www.welt.de,„Putin schaut auf uns“ – Nato probt Verteidigung mit 8000 Bundeswehr-Soldaten,"Eine gemeinsame Erklärung der 27 EU-Staaten zur Verurteilung der russischen Angriffe auf die Kiew scheitert an Ungarn. Die USA drohen im UN-Sicherheitsrat dem Kreml mit Sanktionen – und schicken Flugabwehr im Wert von 7,3 Milliarden über die dänischen Verbünd…",https://images.welt.de/68b1410cadc6ba5d53cb04da/1c5df2a4ee65b2c85d2c2b2cb960f227/ci16x9-w1200/bundeswehr-uebungsserie-quadriga-2025,2025-09-01T13:32:00Z,,"Putin richte seinen Blick auf den Westen, warnt Bundeswehr-Generalinspekteur Breuer. Bei der Nato-Übung Quadriga 2025 trainieren Tausende Soldaten für den Ernstfall. Ziel sei Abschreckung nicht Eskal… [+8731 chars]",,de,'Putin'
https://www.welt.de/politik/ausland/article68b1410cadc6ba5d53cb04da/Ukraine-Krieg-Ukraine-Unterstuetzer-beraten-in-Paris-ueber-Sicherheitsgarantien-Liveticker.html,https://www.welt.de/politik/ausland/article68b1410cadc6ba5d53cb04da/Ukraine-Krieg-Ukraine-Unterstuetzer-beraten-in-Paris-ueber-Sicherheitsgarantien-Liveticker.html,0,www.welt.de,Ukraine-Unterstützer beraten in Paris über Sicherheitsgarantien,"Putin richte seinen Blick auf den Westen, warnt Bundeswehr-Generalinspekteur Breuer. Bei der Nato-Übung „Quadriga 2025“ trainieren Tausende Soldaten für den Ernstfall. Ziel sei Abschreckung – nicht Eskalation. Die „Koalition der Willigen“ berät in Paris über …",https://images.welt.de/68b1410cadc6ba5d53cb04da/c011fa273ef7d691a6cebbd65cd652dc/ci16x9-w1200/unterstuetzer-wollen-garantien-fuer-ukraine-konkretisieren,2025-09-01T13:32:00Z,https://web.archive.org/web/20250902043046/https://www.welt.de/politik/ausland/article68b1410cadc6ba5d53cb04da/Ukraine-Krieg-Ukraine-Unterstuetzer-beraten-in-Paris-ueber-Sicherheitsgarantien-Liveticker.html,"Putin richte seinen Blick auf den Westen, warnt Bundeswehr-Generalinspekteur Breuer. Bei der Nato-Übung Quadriga 2025 trainieren Tausende Soldaten für den Ernstfall. Ziel sei Abschreckung nicht Eskal… [+11562 chars]",,de,'Putin'
https://www.stern.de/news/ukraine--koalition-der-willigen-beraet-am-donnerstag-mit-selenskyj-36019264.html,https://www.stern.de/news/ukraine--koalition-der-willigen-beraet-am-donnerstag-mit-selenskyj-36019264.html,0,www.stern.de,Ukraine: Koalition der Willigen berät am Donnerstag mit Selenskyj,"Die Koalition der Willigen will am Donnerstag mit dem ukrainischen Präsidenten Wolodymyr Selenskyj über Sicherheitsgarantien für die Ukraine im Fall eines Waffenstillstands beraten. Selenskyj werde dazu in Paris erwartet, weitere Teilnehmer würden per Video z…",https://image.stern.de/36019266/t/sC/v1/w1440/r1.7778/-/01--keir-starmer-und-emmanuel-macron---1433655b5fe4b95f.jpg,2025-09-01T13:35:46Z,https://web.archive.org/web/20250902205409/https://www.stern.de/news/ukraine--koalition-der-willigen-beraet-am-donnerstag-mit-selenskyj-36019264.html,"Kopiere den aktuellen Link
Zur Merkliste hinzufügen
Die Koalition der Willigen will am Donnerstag mit dem ukrainischen Präsidenten Wolodymyr Selenskyj über Sicherheitsgarantien für die Ukraine im F… [+1232 chars]",,de,'Ukraine'
https://www.tagesspiegel.de/politik/putin-schaut-auf-uns-generalinspekteur-breuer-betont-wichtigkeit-der-abschreckung-14258690.html,https://www.tagesspiegel.de/politik/putin-schaut-auf-uns-generalinspekteur-breuer-betont-wichtigkeit-der-abschreckung-14258690.html,0,www.tagesspiegel.de,„Putin schaut auf uns“: Generalinspekteur Breuer betont Wichtigkeit der Abschreckung,Im Rahmen einer großen Übung probt Deutschland mit Nato-Partnern die Verteidigung der Ostflanke. Bundeswehr-Generalinspekteur Carsten Breuer spricht von einer unveränderten russischen Bedrohung.,https://www.tagesspiegel.de/images/14258909/alternates/BASE_16_9_W1400/1756733919000/carsten-breuer-generalinspekteur-der-bundeswehr.jpeg,2025-09-01T13:39:30Z,,"Der Generalinspekteur der Bundeswehr, Carsten Breuer, hat anlässlich der Nato-Übungsserie Quadriga 2025 im Ostseeraum eine Notwendigkeit der Abschreckung betont. Nur über Abschreckung werde man Fried… [+1737 chars]",,de,'Bedrohung'
https://www.zeit.de/politik/ausland/2025-09/stoerangriff-flugzeug-ursula-von-der-leyen-russland-gps-jamming,https://www.zeit.de/politik/ausland/2025-09/stoerangriff-flugzeug-ursula-von-der-leyen-russland-gps-jamming,0,www.zeit.de,Störangriff auf Flugzeug: Darauf muss Europa reagieren,"Russland provoziert gezielt die EU, das zeigen die jüngsten Attacken wie die GPS-Störung. Diese Art der Kriegsführung darf Europa nicht auf sich sitzen lassen.",https://img.zeit.de/politik/2025-09/stoerangriff-flugzeug-ursula-von-der-leyen-russland-gps-jamming-bild/wide__1300x731,2025-09-01T18:33:52Z,http://archive.md/20250901183838/https://www.zeit.de/politik/ausland/2025-09/stoerangriff-flugzeug-ursula-von-der-leyen-russland-gps-jamming,"Wladimir Putin führt nicht nur einen Krieg gegen die Ukraine, sondern auch einen Krieg gegen die EU. Wer daran Zweifel gehegt hat, der ist nur binnen weniger Tage eines Besseren belehrt worden durch … [+510 chars]",,de,'Krieg'
https://www.zeit.de/news/2025-09/02/garantien-fuer-ukraine-trump-spricht-erneut-ueber-lufthilfe,https://www.zeit.de/news/2025-09/02/garantien-fuer-ukraine-trump-spricht-erneut-ueber-lufthilfe,0,www.zeit.de,Ukraine-Krieg: Garantien für Ukraine: Trump spricht erneut über Lufthilfe,Hier finden Sie Informationen zu dem Thema „Ukraine-Krieg“. Lesen Sie jetzt „Garantien für Ukraine: Trump spricht erneut über Lufthilfe“.,https://img.zeit.de/news/2025-09/02/garantien-fuer-ukraine-trump-spricht-erneut-ueber-lufthilfe-image-group/wide__1300x731,2025-09-02T01:02:39Z,,Im Ringen um ein Ende des Ukraine-Kriegs sind schon länger sogenannte Sicherheitsgarantien für das Land als Schutz vor künftigen Angriffen Russlands im Gespräch. US-Präsident Donald Trump schloss zwa… [+1108 chars],,de,'Ukraine'
